ticker,title,date,content,url,sentiment
CVX,Chevron Spots Market Gaps and Calls for Venezuela Reforms - TradingView,2026-03-24 15:13:00,"Chevron Corporation CVX is facing a complex global landscape as geopolitical tensions, supply disruptions and policy uncertainties reshape the oil market. Recent remarks from CEO Mike Wirth highlight three key developments influencing the company’s outlook: Middle East supply constraints, mispriced oil markets and evolving opportunities in Venezuela. Middle East Disruptions to Prolong Supply Tightness Chevron expects a slow recovery in oil production impacted by ongoing tensions in the Middle East. According to Wirth, restarting shut-in production and rebalancing global inventories will take time, especially as markets struggle with shortages of key refined products like diesel and jet fuel. The disruption has been particularly severe in Asia, where supply concerns are intensifying. Even after geopolitical tensions ease, rebuilding the right mix of crude grades and refined products will remain a logistical and operational challenge, prolonging tight market conditions. Wirth also emphasized that current oil futures may not fully reflect the real extent of supply disruptions. The closure risks around the Strait of Hormuz — a critical artery for global oil flows — are creating tangible supply constraints that are not yet fully priced into markets. He pointed out a growing disconnect between physical supply realities and financial market expectations. With reduced oil and gas flows compared to prior geopolitical events, the current situation presents a more acute supply imbalance, suggesting potential upside risk for oil prices if markets recalibrate. Venezuela: Progress Made, But Policy Clarity Needed Chevron is also closely monitoring developments in Venezuela, where production from its joint ventures has been steadily rising, reinforcing its position as a critical partner to PDVSA. The company currently contributes roughly a quarter of the country’s total crude output, underscoring both its operational importance and long-term strategic interest in the region. Recent reforms to Venezuela’s hydrocarbons law have introduced some positive changes, including greater autonomy for foreign operators, the ability to sell crude independently and flexibility to outsource projects. These measures signal a shift toward a more investor-friendly framework and have helped revive global interest in the country’s vast oil reserves. However, Wirth emphasized that these steps, while encouraging, remain insufficient to unlock large-scale capital inflows. Key concerns persist around legal ambiguity, particularly in fiscal terms, taxation structures and the absence of clear dispute resolution mechanisms. Industry players are pushing for access to international arbitration and more defined incentives for new projects, especially greenfield developments. The delay in introducing detailed tax legislation has further added to uncertainty, limiting investor confidence. Moreover, Venezuela’s administration has shown reluctance to pursue additional reforms in the near term, slowing momentum for broader sector revival. Until clearer, more stable policy frameworks are established, Chevron and its peers are likely to remain cautious, balancing near-term production gains with disciplined long-term investment decisions. Chevron’s latest commentary underscores a market at an inflection point. Persistent supply tightness, underappreciated geopolitical risks and evolving regulatory frameworks are all shaping the future of global energy. While near-term volatility may support prices, long-term growth will depend on policy clarity and the industry’s ability to adapt to an increasingly uncertain environment. Houston, TX-based Chevron is one of the largest publicly traded oil and gas companies, participating in every aspect of the energy sector, from oil production to refining and marketing. Currently, CVX carries a Zacks Rank #3 (Hold). Investors interested in the energy sector may consider some better-ranked stocks like Drilling Tools International Corporation DTI, TechnipFMC plc FTI and USA Compression Partners, LP USAC.While Drilling Tools International and TechnipFMC sport a Zacks Rank #1 (Strong Buy) each at present, USA Compression carries a Zacks Rank #2 (Buy). You can see the complete list of today’s Zacks #1 Rank stocks here. Drilling Tools International is a global oilfield services provider focused on supplying downhole tools used in horizontal and directional drilling. The Zacks Consensus Estimate for DTI’s 2026 earnings indicates 90% year-over-year growth. Newcastle & Houston-based TechnipFMC is a leading manufacturer and supplier of products, services and fully integrated technology solutions for the energy industry. The Zacks Consensus Estimate for FTI’s 2026 earnings indicates 18% year-over-year growth. USA Compression Partners is one of the largest independent natural gas compression service providers in the United States, measured by fleet horsepower. The Zacks Consensus Estimate for USAC’s 2026 earnings indicates 30.7% year-over-year growth. From thousands of stocks, 5 Zacks experts each have chosen their favorite to skyrocket +100% or more in months to come. From those 5, Director of Research Sheraz Mian hand-picks one to have the most explosive upside of all. This company targets millennial and Gen Z audiences, generating nearly $1 billion in revenue last quarter alone. A recent pullback makes now an ideal time to jump aboard. Of course, all our elite picks aren’t winners but this one could far surpass earlier Zacks’ Stocks Set to Double like Nano-X Imaging which shot up +129.6% in little more than 9 months.Free: See Our Top Stock And 4 Runners Up Want the latest recommendations from Zacks Investment Research? Today, you can download 7 Best Stocks for the Next 30 Days. Click to get this free report Chevron Corporation (CVX): Free Stock Analysis Report USA Compression Partners, LP (USAC): Free Stock Analysis Report Drilling Tools International Corp. (DTI): Free Stock Analysis Report This article originally published on Zacks Investment Research (zacks.com). Select market data provided by ICE Data Services. Select reference data provided by FactSet. Copyright © 2026 FactSet Research Systems Inc.Copyright © 2026, American Bankers Association. CUSIP Database provided by FactSet Research Systems Inc. All rights reserved. SEC fillings and other documents provided by Quartr.© 2026 TradingView, Inc.",https://www.tradingview.com/news/zacks:df844468c094b:0-chevron-spots-market-gaps-and-calls-for-venezuela-reforms/,Risk
CVX,"The Zacks Analyst Blog Highlights Shell, Chevron, Allstate, Telefonica Brasil and OMV - The Globe and Mail",2026-03-24 14:42:47,"Chicago, IL – March 24, 2026 – Zacks.com announces the list of stocks featured in the Analyst Blog. Every day the Zacks Equity Research analysts discuss the latest news and events impacting stocks and the financial markets. Stocks recently featured in the blog include: Shell SHEL, Chevron CVX, Allstate ALL, Telefonica Brasil VIV and OMV OMVKY. ·         Concerns over energy prices — and inflation — are set to shape the week ahead ·         The first business sentiment PMI readings since the start of the conflict print (1) Global Oil and Gas Industry Leaders Meet at CERAWeek in Houston, TX How the global energy sector deals with the impact of the Middle East conflict will become apparent when the industry's leaders kick off CERAWeek in Houston, Texas, on Monday. CEOs of Saudi Aramco, Shell and Chevron are among the many high-profile executives set to speak at the annual conference that runs until Friday. U.S. Energy Secretary Chris Wright and other energy officials from Europe and Latin America are also on the agenda. But the Middle East is not the only focus: Washington on Wednesday broadly authorized U.S. companies to do business with state-oil company PDVSA in Venezuela, home to the world's largest proven oil reserves. Opposition leader Maria Corina Machado will attend the conference. Energy (XLE) has been the best-performing S&P500 sector since the war started. The Iran war is entering its fourth week with no sign of imminent de-escalation. Markets ‌have been febrile over concerns the conflict could destroy more energy and business infrastructure in the region, while Iran has effectively closed the Strait of Hormuz, an artery for energy transport. Bets have risen in the markets that central banks, faced with flares in inflation and volatility, will have to hike interest rates, at least in Europe, or, in the case of the U.S. Federal Reserve, have no more scope to lower lending benchmarks. Even previously resilient stock markets have begun to wobble, as traders shift baseline assumptions of economic growth and inflation. Shuttle diplomacy will continue, with Gulf states expected to continue diplomatic coordination through ministerial level contacts while G7 foreign ministers meet in Paris on Thursday. Most of Iran's major energy facilities, as well as major assets in nearby countries, have been targeted. (3) Via Flash PMIs, the ""Stagflation"" Word Likely Returns to Widespread Use Flash business activity data for March released on Tuesday will give a first reading of how the war has hit corporate sentiment as markets fear the risk of stagflation has grown. Most of the impact of higher energy costs, both direct and indirect, has yet to be felt, but PMI survey numbers will provide an early impression and offer a comparison between the impact on different parts of the world. Investors consider Asia and Europe are much more exposed to higher energy costs than the U.S., though the effects will be global. Business activity picked up in most economies in February, and the danger is the ‌war has caused a significant reversal. Readings on input costs will be closely monitored. March data has already showed an increase in Europe and the U.S. The Organization for Economic Cooperation and Development (OECD) will publish its interim economic outlook on Thursday. (4) Japan's Inflation Data Comes Out. BoJ Monetary Policy Must Heed It Tuesday brings a new print of the Japanese inflation data that has determined the central bank's tightening cycle — and has been thrown off course by the Middle East crisis. The previous reading showed annual core consumer inflation fell to a two-year low of +2.0% in January, matching the Bank of Japan's target. It likely declined further to +1.7% in February, according to a Reuters poll of economists, but that data will not reflect the surge in energy costs from the war in Iran that has paralyzed the oil shipments on which Japan depends. As it kept policy unchanged on Thursday, the BoJ struck a hawkish tone, warning about the impact of imported energy inflation on consumers. Japan's currency is already suffering as the yen wallows near a 20-month low on mounting concerns over the nation's terms of trade. Denmark, in focus as U.S. President Donald Trump's foreign policy forays resonate globally, holds an election on Tuesday. Prime Minister Mette Frederiksen, seeking a third term, hopes to capitalize on strong support for her defiant stance against U.S. pressure over annexing Greenland. The vote could be a barometer of Greenlanders' appetite for independence. The cost of living, a dominant theme in elections this year, is also a major concern for Danes. Italy, meanwhile, holds a March 22-23 referendum on a highly contested government plan to reform the judiciary. Supporters hope it will modernize the legal system. Opponents reckon it will make it easier for the state to control prosecutors. Tensions in the ruling coalition could surface if Italians vote ""no."" Italy's leader Giorgia Meloni is taking no chances, joining an irreverent podcast hosted by a popular rapper to reach younger voters to try to secure a ""yes"" vote. Here are three Zacks #1 (STRONG BUY) picks, with solid long-term Zacks VGM scores of B. (1) Allstate: This is a $204 a share stock, with a market cap of $52.9B. It is found in Zacks Insurance – Property & Casualty industry. The stock holds a Zacks Value score of A, a Zacks Growth score of C, and a Zacks Momentum score of B. The Allstate Corporation is the third-largest property-casualty insurer and the largest publicly-held personal lines carrier in the U.S. The company also provides a range of life insurance and investment products to its diverse customer base. It provides insurance products to households through exclusive agencies and financial specialists in the U.S. and Canada. (2) Telefonica Brasil: This is a $16 a share stock, with a market cap of $25.3B. It is found in the Zacks Diversified Communications industry. The stock holds a Zacks Value score of B, a Zacks Growth score of C, and a Zacks Momentum score of A. Telefonica Brasil SA is engaged in providing communication, information and entertainment solutions in the telecommunication sector, in the State of Sao Paulo. The company also provides multimedia communication services, local voice services, long-distance services, data services, Pay TV services, land-based wireless technology multichannel multipoint distribution service and network services. (3) OMV: This is a $17 a share stock, with a market cap of $22.3B. It is found in the Zacks Oil and Gas - Integrated industry. The stock holds a Zacks Value score of A, a Zacks Growth score of D, and a Zacks Momentum score of B. OMV Aktiengesellschaft (OMV AG) is an Austria-based integrated oil and gas company. It operates through two segments: Upstream and Downstream. The Upstream segment focuses on the exploration, development and production of oil and gas in three core regions: Central and Eastern Europe (CEE), the North Sea, as well as the Middle East and Africa. The Downstream segment comprises two business units: Downstream Oil, that operates around 3,800 filling stations in approximately 10 countries, refineries in Austria and Germany, both of which feature integrated petrochemical production, as well as the Petrobrazi refinery in Romania, which processes predominantly Romanian crude oil, and Downstream Gas, that focuses on gas trade and sales. They also own a pipeline network and gas storage facilities in Austria. Free: Instant Access to Zacks' Market-Crushing Strategies Since 2000, our top stock-picking strategies have blown away the S&P's +7.7% average gain per year. Amazingly, they soared with average gains of +48.4%, +50.2% and +56.7% per year. Today you can tap into those powerful strategies – and the high-potential stocks they uncover – free. No strings attached. support@zacks.com https://www.zacks.com Past performance is no guarantee of future results. Inherent in any investment is the potential for loss. This material is being provided for informational purposes only and nothing herein constitutes investment, legal, accounting or tax advice, or a recommendation to buy, sell or hold a security. No recommendation or advice is being given as to whether any investment is suitable for a particular investor. It should not be assumed that any investments in securities, companies, sectors or markets identified and described were or will be profitable. All information is current as of the date of herein and is subject to change without notice. Any views or opinions expressed may not reflect those of the firm as a whole. Zacks Investment Research does not engage in investment banking, market making or asset management activities of any securities. These returns are from hypothetical portfolios consisting of stocks with Zacks Rank = 1 that were rebalanced monthly with zero transaction costs. These are not the returns of actual portfolios of stocks. The S&P 500 is an unmanaged index. Visit https://www.zacks.com/performance for information about the performance numbers displayed in this press release. The AI revolution has already minted millionaires. But the stocks everyone knows about aren't likely to keep delivering the biggest profits. Little-known AI firms tackling the world's biggest problems may be more lucrative in the coming months and years. Want the latest recommendations from Zacks Investment Research? Today, you can download 7 Best Stocks for the Next 30 Days. Click to get this free report This article originally published on Zacks Investment Research (zacks.com). All market data (will open in new tab) is provided by Barchart Solutions. Copyright © 2026. Information is provided 'as is' and solely for informational purposes, not for trading purposes or advice. For exchange delays and terms of use, please read disclaimer (will open in new tab).",https://www.theglobeandmail.com/investing/markets/stocks/CVX/pressreleases/922206/the-zacks-analyst-blog-highlights-shell-chevron-allstate-telefonica-brasil-and-omv/,Neutral
CVX,3 Large Energy Dividend Stocks to Ride Out Oil Price Swings - The Globe and Mail,2026-03-24 14:07:47,"The oil market is going through a turbulent phase, with prices swinging sharply on geopolitical headlines. Brent crude has moved back above $100 per barrel after recent declines, highlighting how uncertain and reactive the market remains. Supply disruptions, especially around key transit routes, continue to keep prices elevated despite short-term pullbacks.In this environment, large, established players like Chevron CorporationCVX, Kinder MorganKMI and TC Energy CorporationTRP stand out. These companies combine strong market positions with reliable dividend payouts, making them attractive options for investors looking for stability amid ongoing volatility. The current energy landscape is shaped by real supply disruptions rather than just perceived risks. The ongoing conflict in the Middle East has impacted production and shipping, particularly through critical chokepoints like the Strait of Hormuz. This has limited the flow of oil and gas, pushing prices higher and increasing volatility.Unlike past shocks, the current situation is harder to resolve quickly. Even with efforts like rerouting supplies or releasing reserves, physical constraints remain. As a result, oil and gas prices are likely to stay elevated for some time, keeping the sector in focus and creating both risks and opportunities for investors. In such uncertain conditions, dividend-paying stocks offer a key advantage: steady income. Even when prices fluctuate, these companies continue to return cash to their shareholders, providing a buffer against market swings. This becomes especially valuable when short-term price movements are unpredictable.What makes the three companies mentioned earlier stand out is their large-cap status. Large-cap energy firms typically have diversified operations, stronger balance sheets, and better access to capital. This allows them to maintain dividend payouts even during downturns, offering a level of stability that smaller or more volatile companies may struggle to provide. Another reason to hold dividend stocks now is their ability to balance growth and resilience. Companies like Chevron benefit from integrated operations, while pipeline-focused players like Kinder Morgan and TC Energy generate stable, fee-based income. This mix helps smooth earnings across different market conditions. With energy prices expected to remain volatile but generally elevated, these businesses are well-positioned to generate strong cash flows. For investors, this translates into consistent dividends and potential upside, making them reliable holdings in an otherwise unpredictable market. Chevron: Chevron’s global integrated model spans exploration, production, refining and chemicals, creating stability across market cycles. With operations in the United States, Asia-Pacific, Africa, the Middle East and South America, the company’s scale and diversity support consistent free cash flow generation.Chevron has maintained or raised its dividend for 90 years, underscoring a long track record of resilience. Its 3.5% yield stands above both the sector and the S&P 500’s 1.2% average, and its Zacks Rank #3 (Hold) reflects a steady earnings outlook. A disciplined approach to capital spending and efficiency continues to strengthen its ability to sustain attractive payouts.You can seethe complete list of today’s Zacks #1 Rank (Strong Buy) stocks here.Kinder Morgan: Kinder Morgan oversees one of North America’s largest energy infrastructure networks, including 78,000 miles of pipelines and extensive storage capacity. Its take-or-pay agreements across natural gas, refined products, crude oil, and bulk terminals provide stable, contracted cash flows, largely insulated from commodity price volatility.The company carries a Zacks Rank of 3. It expects a dividend increase in 2026, which would mark its ninth consecutive annual raise. Its current payout of 29.25 cents per quarter results in a 3.5% yield. With demand for natural gas and LNG infrastructure rising, Kinder Morgan’s asset base positions it well for continued cash flow durability.TC Energy: TC Energy is a leading North American energy infrastructure company focused on natural gas pipelines and power generation. It operates an extensive ~94,000 km pipeline network, delivering 57 billion cubic feet per day and connecting key supply basins to demand centers, including LNG export facilities and power markets. TC Energy’s business model is largely underpinned by regulated or take-or-pay contracts, providing stable, low-risk cash flows and high earnings visibility.Currently yielding nearly 4%, the #3 Ranked company has delivered 26 consecutive years of dividend increases and targets sustainable annual dividend growth of 3-5%, supported by rising cash flows and disciplined payout ratios. Growth is driven by a multibillion-dollar capital program, strong natural gas demand outlook, and focus on low-risk, contracted projects. The AI revolution has already minted millionaires. But the stocks everyone knows about aren't likely to keep delivering the biggest profits. Little-known AI firms tackling the world's biggest problems may be more lucrative in the coming months and years. Want the latest recommendations from Zacks Investment Research? Today, you can download 7 Best Stocks for the Next 30 Days. Click to get this free report This article originally published on Zacks Investment Research (zacks.com). All market data (will open in new tab) is provided by Barchart Solutions. Copyright © 2026. Information is provided 'as is' and solely for informational purposes, not for trading purposes or advice. For exchange delays and terms of use, please read disclaimer (will open in new tab).",https://www.theglobeandmail.com/investing/markets/stocks/CVX/pressreleases/920910/3-large-energy-dividend-stocks-to-ride-out-oil-price-swings/,Growth
