ticker,title,date,content,url,sentiment
CVX,"RF&L Wealth Management LLC Buys 6,320 Shares of Chevron Corporation $CVX - MarketBeat",2026-03-24 10:31:00,"RF&L Wealth Management LLC grew its stake in  Chevron Corporation (NYSE:CVX - Free Report) by 438.9% in the 4th quarter, according to the company in its most recent disclosure with the Securities and Exchange Commission. The firm owned 7,760 shares of the oil and gas company's stock after buying an additional 6,320 shares during the period. RF&L Wealth Management LLC's holdings in Chevron were worth $1,183,000 as of its most recent filing with the Securities and Exchange Commission. A number of other hedge funds also recently made changes to their positions in the stock. Perigon Wealth Management LLC raised its stake in  Chevron by 19.3% during the third quarter. Perigon Wealth Management LLC now owns 73,448 shares of the oil and gas company's stock worth $11,406,000 after buying an additional 11,875 shares during the last quarter.  Brooklyn FI LLC bought a new stake in  Chevron during the third quarter valued at $431,000.  New York State Teachers Retirement System boosted its position in  Chevron by 15.3% during the third quarter. New York State Teachers Retirement System now owns 1,620,231 shares of the oil and gas company's stock valued at $251,606,000 after acquiring an additional 215,345 shares during the last quarter.  Finemark National Bank & Trust grew its holdings in  Chevron by 40.3% during the 3rd quarter. Finemark National Bank & Trust now owns 56,535 shares of the oil and gas company's stock worth $8,779,000 after acquiring an additional 16,243 shares during the period.  Finally, Pictet North America Advisors SA acquired a new stake in  Chevron during the 3rd quarter worth about $5,662,000. 72.42% of the stock is currently owned by institutional investors. CVX has been the topic of a number of recent analyst reports. TD Cowen boosted their price objective on Chevron from $160.00 to $168.00 and gave the company a ""hold"" rating in a research note on Monday, February 2nd. Wall Street Zen raised Chevron from a ""sell"" rating to a ""hold"" rating in a research note on Saturday, January 31st. Mizuho lifted their target price on Chevron from $206.00 to $217.00 and gave the stock an ""outperform"" rating in a report on Tuesday, March 17th. Freedom Capital lowered Chevron from a ""hold"" rating to a ""strong sell"" rating in a research note on Tuesday, January 6th. Finally, Morgan Stanley cut their price target on Chevron from $180.00 to $174.00 and set an ""overweight"" rating on the stock in a report on Friday, January 23rd. Fourteen analysts have rated the stock with a Buy rating, six have given a Hold rating and four have given a Sell rating to the company's stock. According to data from MarketBeat.com, Chevron  has a consensus rating of ""Hold"" and a consensus price target of $184.77. Here are the key news stories impacting Chevron this week: In other news, Vice Chairman Mark A. Nelson sold 139,600 shares of the business's stock in a transaction that occurred on Monday, March 2nd. The stock was sold at an average price of $187.92, for a total transaction of $26,233,632.00. Following the completion of the sale, the insider owned 11,337 shares in the company, valued at $2,130,449.04. The trade was a 92.49% decrease in their ownership of the stock. The transaction was disclosed in a legal filing with the SEC, which is available through this hyperlink. Also, insider R. Hewitt Pate sold 47,200 shares of the company's stock in a transaction that occurred on Friday, March 6th. The stock was sold at an average price of $192.12, for a total value of $9,068,064.00. Following the transaction, the insider directly owned 8,558 shares in the company, valued at $1,644,162.96. The trade was a 84.65% decrease in their ownership of the stock. Additional details regarding this sale are available in the official SEC disclosure. In the last ninety days, insiders have sold 1,099,397 shares of company stock valued at $196,196,468. Company insiders own  0.20% of the company's stock. Shares of NYSE CVX opened at $205.12 on Tuesday. The firm has a market capitalization of $409.30 billion, a P/E ratio of 30.80, a P/E/G ratio of 1.87 and a beta of 0.67. The firm's 50-day moving average price is $182.17 and its 200-day moving average price is $163.78. The company has a current ratio of 1.15, a quick ratio of 0.86 and a debt-to-equity ratio of 0.21. Chevron Corporation has a 1-year low of $132.04 and a 1-year high of $205.36. Chevron (NYSE:CVX - Get Free Report) last issued its earnings results on Friday, January 30th. The oil and gas company reported $1.52 EPS for the quarter, beating the consensus estimate of $1.44 by $0.08. Chevron had a return on equity of 7.89% and a net margin of 6.51%.The company had revenue of $45.79 billion during the quarter, compared to the consensus estimate of $48.18 billion. During the same period last year, the business posted $2.06 EPS. The firm's revenue for the quarter was down 10.2% compared to the same quarter last year.  Equities research analysts anticipate that  Chevron Corporation will post 10.79 earnings per share for the current fiscal year. The company also recently disclosed a quarterly dividend, which was paid on Tuesday, March 10th. Shareholders of record on Tuesday, February 17th were paid a $1.78 dividend. This represents a $7.12 dividend on an annualized basis and a yield of 3.5%. This is a boost from Chevron's previous quarterly dividend of $1.71. The ex-dividend date of this dividend was Tuesday, February 17th. Chevron's payout ratio is 106.91%. Chevron Corporation NYSE: CVX is an American multinational energy company engaged in virtually all aspects of the oil and gas industry. As an integrated energy firm, Chevron's core activities include upstream oil and natural gas exploration and production, midstream transportation and storage, downstream refining and marketing of fuels and lubricants, and petrochemical manufacturing through joint ventures and subsidiaries. The company markets fuels under brands such as Chevron, Texaco and Caltex and supplies a range of products and services to retail customers, industrial users and commercial fleets worldwide. Chevron traces its corporate lineage to the early petroleum companies that eventually became Standard Oil of California and has evolved through significant mergers and restructurings, including the acquisitions of Gulf Oil and Texaco. This instant news alert was generated by narrative science technology and financial data from MarketBeat in order to provide readers with the fastest reporting and unbiased coverage. Please send any questions or comments about this story to contact@marketbeat.com. Before you consider Chevron, you'll want to hear this. MarketBeat keeps track of Wall Street's top-rated and best performing research analysts and the stocks they recommend to their clients on a daily basis. MarketBeat has identified the five stocks that top analysts are quietly whispering to their clients to buy now before the broader market catches on... and Chevron wasn't on the list. While Chevron currently has a Hold rating among analysts, top-rated analysts believe these five stocks are better buys. MarketBeat just released its list of the 7 hottest IPOs expected to hit Wall Street in 2026. See which companies are preparing to go public and why investors are watching closely. Sign up for MarketBeat All Access to gain access to MarketBeat's full suite of research tools. 345 N Reid Place, Suite 620, Sioux Falls, SD 57103
                                        
                                        contact@marketbeat.com
                                        
                                        (844) 978-6257 © MarketBeat Media, LLC 2010-2026. All rights reserved. © 2026   Fair market value prices are updated every minute and are provided by Massive. Other market data provided is at least 10-minutes delayed and hosted by Barchart Solutions.  Information is provided 'as-is' and solely for informational purposes, not for trading purposes or advice, and is delayed. To see all exchange delays and terms of use please see Barchart's disclaimer. We and our partners share information on your use of this website to help improve your experience. For more information, or to opt out click the Do Not Sell My Information button below.",https://www.marketbeat.com/instant-alerts/filing-rfl-wealth-management-llc-buys-6320-shares-of-chevron-corporation-cvx-2026-03-24/,Neutral
CVX,Marshall Financial Group LLC Decreases Stock Holdings in Chevron Corporation $CVX - MarketBeat,2026-03-24 10:20:56,"Marshall Financial Group LLC lowered its stake in shares of  Chevron Corporation (NYSE:CVX - Free Report) by 69.2% during the fourth quarter, according to the company in its most recent Form 13F filing with the Securities and Exchange Commission (SEC). The institutional investor  owned 2,514 shares of the oil and gas company's stock after selling 5,637 shares during the quarter. Marshall Financial Group LLC's holdings in Chevron were worth $383,000 as of its most recent filing with the Securities and Exchange Commission (SEC). Several other institutional investors and hedge funds also recently added to or reduced their stakes in CVX. Decker Retirement Planning Inc. purchased a new stake in shares of  Chevron during the third quarter valued at about $34,000.  Vermillion & White Wealth Management Group LLC grew its position in shares of  Chevron by 86.1% in the 2nd quarter. Vermillion & White Wealth Management Group LLC now owns 255 shares of the oil and gas company's stock worth $37,000 after buying an additional 118 shares during the last quarter.  Marquette Asset Management LLC purchased a new position in shares of  Chevron in the 3rd quarter worth approximately $41,000.  Barnes Dennig Private Wealth Management LLC raised its stake in shares of  Chevron by 306.1% during the 3rd quarter. Barnes Dennig Private Wealth Management LLC now owns 268 shares of the oil and gas company's stock worth $42,000 after acquiring an additional 202 shares in the last quarter.  Finally, Evolution Wealth Management Inc. bought a new position in shares of  Chevron during the 2nd quarter worth approximately $49,000. Hedge funds and other institutional investors own  72.42% of the company's stock. Here are the key news stories impacting Chevron this week: Several brokerages have weighed in on CVX. Melius Research upgraded shares of Chevron from a ""hold"" rating to a ""buy"" rating and set a $205.00 target price for the company in a research note on Tuesday, February 17th. Piper Sandler upped their price target on Chevron from $179.00 to $242.00 and gave the stock an ""overweight"" rating in a research report on Thursday, March 12th. Weiss Ratings  reiterated a ""hold (c)"" rating on shares of Chevron in a report on Wednesday, January 21st. Jefferies Financial Group raised their price objective on Chevron from $174.00 to $189.00 and gave the stock a ""buy"" rating in a research report on Wednesday, January 14th. Finally, Argus  set a $203.00 target price on Chevron in a research report on Tuesday, February 3rd. Fourteen investment analysts have rated the stock with a Buy rating, six have assigned  a Hold rating and four have assigned  a Sell rating to the company's stock. According to MarketBeat.com, the stock  has a consensus rating of ""Hold"" and an average price target of $184.77. Shares of Chevron stock opened at $205.12 on Tuesday. The firm's 50 day simple moving average is $182.17 and its two-hundred day simple moving average is $163.78. The firm has a market capitalization of $409.30 billion, a price-to-earnings ratio of 30.80, a PEG ratio of 1.87 and a beta of 0.67. Chevron Corporation has a 12-month low of $132.04 and a 12-month high of $205.36. The company has a current ratio of 1.15, a quick ratio of 0.86 and a debt-to-equity ratio of 0.21. Chevron (NYSE:CVX - Get Free Report) last posted its quarterly earnings data on Friday, January 30th. The oil and gas company reported $1.52 EPS for the quarter, topping the consensus estimate of $1.44 by $0.08. The business had revenue of $45.79 billion during the quarter, compared to the consensus estimate of $48.18 billion. Chevron had a net margin of 6.51% and a return on equity of 7.89%. The business's revenue for the quarter was down 10.2% compared to the same quarter last year. During the same period in the previous year, the firm posted $2.06 earnings per share.  Analysts predict that  Chevron Corporation will post 10.79 EPS for the current year. The company also recently declared a quarterly dividend, which was paid on Tuesday, March 10th. Shareholders of record on Tuesday, February 17th were given a dividend of $1.78 per share. The ex-dividend date of this dividend was Tuesday, February 17th. This represents a $7.12 dividend on an annualized basis and a yield of 3.5%. This is an increase from Chevron's previous quarterly dividend of $1.71. Chevron's payout ratio is presently 106.91%. In other Chevron news, Vice Chairman Mark A. Nelson sold 139,600 shares of the business's stock in a transaction dated Monday, March 2nd. The stock was sold at an average price of $187.92, for a total transaction of $26,233,632.00. Following the sale, the insider owned 11,337 shares in the company, valued at approximately $2,130,449.04. The trade was a 92.49% decrease in their position. The transaction was disclosed in a document filed with the Securities & Exchange Commission, which can be accessed through the SEC website. Also, CEO Michael K. Wirth sold 272,624 shares of the stock in a transaction dated Monday, March 2nd. The shares were sold at an average price of $189.35, for a total value of $51,621,354.40. Following the completion of the transaction, the chief executive officer directly owned 31,266 shares in the company, valued at $5,920,217.10. This represents a 89.71% decrease in their ownership of the stock. The disclosure for this sale is available in the SEC filing. In the last quarter, insiders have sold 1,099,397 shares of company stock worth $196,196,468. 0.20% of the stock is owned by corporate insiders. Chevron Corporation NYSE: CVX is an American multinational energy company engaged in virtually all aspects of the oil and gas industry. As an integrated energy firm, Chevron's core activities include upstream oil and natural gas exploration and production, midstream transportation and storage, downstream refining and marketing of fuels and lubricants, and petrochemical manufacturing through joint ventures and subsidiaries. The company markets fuels under brands such as Chevron, Texaco and Caltex and supplies a range of products and services to retail customers, industrial users and commercial fleets worldwide. Chevron traces its corporate lineage to the early petroleum companies that eventually became Standard Oil of California and has evolved through significant mergers and restructurings, including the acquisitions of Gulf Oil and Texaco. This instant news alert was generated by narrative science technology and financial data from MarketBeat in order to provide readers with the fastest reporting and unbiased coverage. Please send any questions or comments about this story to contact@marketbeat.com. Before you consider Chevron, you'll want to hear this. MarketBeat keeps track of Wall Street's top-rated and best performing research analysts and the stocks they recommend to their clients on a daily basis. MarketBeat has identified the five stocks that top analysts are quietly whispering to their clients to buy now before the broader market catches on... and Chevron wasn't on the list. While Chevron currently has a Hold rating among analysts, top-rated analysts believe these five stocks are better buys. Wondering where to start (or end) with AI stocks? These 10 simple stocks can help investors build long-term wealth as artificial intelligence continues to grow into the future. Sign up for MarketBeat All Access to gain access to MarketBeat's full suite of research tools. 345 N Reid Place, Suite 620, Sioux Falls, SD 57103
                                        
                                        contact@marketbeat.com
                                        
                                        (844) 978-6257 © MarketBeat Media, LLC 2010-2026. All rights reserved. © 2026   Fair market value prices are updated every minute and are provided by Massive. Other market data provided is at least 10-minutes delayed and hosted by Barchart Solutions.  Information is provided 'as-is' and solely for informational purposes, not for trading purposes or advice, and is delayed. To see all exchange delays and terms of use please see Barchart's disclaimer. Enter your email address below to receive a concise daily summary of the latest news and analysts’ ratings for Chevron and related companies with MarketBeat.com’s FREE daily ratings newsletter. We and our partners share information on your use of this website to help improve your experience. For more information, or to opt out click the Do Not Sell My Information button below.",https://www.marketbeat.com/instant-alerts/filing-marshall-financial-group-llc-decreases-stock-holdings-in-chevron-corporation-cvx-2026-03-24/,Neutral
CVX,Chevron (CVX) Stock Climbs as CEO Flags Market Disconnect on Hormuz Supply Crisis - MoneyCheck,2026-03-24 09:57:41,"At S&P Global’s CERAWeek conference in Houston on Monday, Chevron (CVX) CEO Mike Wirth delivered a stark message that resonated throughout the energy sector: the oil markets are dramatically underestimating the crisis at hand. Wirth emphasized to attendees that while the physical ramifications of the Strait of Hormuz shutdown are actively disrupting global energy flows, crude oil futures pricing fails to account for this emerging reality. “There are real physical manifestations from the closure of the Strait of Hormuz that are working their way around the world and through the system that I don’t think are fully priced into the futures curve on oil,” Wirth stated. He characterized the market as driven by “any kind of perception” and described current conditions as “uncertain,” “unpredictable,” and “volatile.” CVX stock posted a 1.73% gain despite falling crude prices. On March 23 afternoon trading, Brent crude declined 12% to $98.95 per barrel, while WTI slid 11% to $87.73. The selloff followed President Trump’s declaration of diplomatic engagement with Iran and a minimum five-day pause on threatened military action. The data supporting Wirth’s concerns paints a concerning picture. S&P Global Energy estimates that roughly 6.5 to 7 million barrels per day of oil supply are currently unavailable from Middle Eastern sources. Projections indicate this figure could escalate to 8 or 9 million barrels in the coming days. Approximately 80% of Strait of Hormuz oil flows typically head to Asian destinations, where Kurt Barrow of S&P Global Energy describes an emerging “availability crisis.” “Some countries will have to go without oil,” Barrow warned. “There’s no model for this.” Wirth noted that diesel and jet fuel markets are already demonstrating supply constraints. Even with a rapid diplomatic resolution, production restoration will be time-consuming. Industry experts project recovery timeframes ranging from weeks to potentially years depending on damage severity. “Some of these facilities suffered damage and in some cases reportedly significant damage. How quickly that production can come back on-line is an uncertainty that we are going to have to deal with,” Wirth explained. Current WTI futures contracts indicate prices near $82 per barrel for July delivery, declining to approximately $73 by year-end December. Forward curves project oil remaining in the $70 range throughout most of 2027. Pre-conflict, these same contracts traded between $50 and $60. Wirth’s argument centers on the likelihood that even these elevated price levels inadequately reflect the infrastructure damage and unprecedented supply removal from global markets. Late Sunday, WTI momentarily surged to $101 per barrel while Brent reached $113 amid fears of potential U.S. military strikes targeting Iranian energy infrastructure. Prices retreated sharply Monday morning following Trump’s strike postponement announcement. Goldman Sachs recently upgraded its 2026 WTI price forecast to $79 per barrel from $72, operating under the assumption that Strait of Hormuz shipments will continue at approximately 5% of normal capacity for a minimum of two additional weeks. Among 21 Wall Street analysts covering CVX, the consensus rating stands at Strong Buy, comprising 16 Buy ratings and five Hold recommendations. The average analyst price target is set at $197.25. Discover top-performing stocks in AI, Crypto, and Technology with expert analysis. Futures & Crypto Trader
 Sharing charts, strategies, & mindset tips to help you level up
 Not Financial Advice
Follow on X @Pro_Trader_Edge Microsoft (MSFT) stock has plummeted 32% from its October peak as Copilot adoption lags expectations, though fundamentals remain solid. Type above and press Enter to search. Press Esc to cancel. No KYC. 70% Rakeback & 10% Cashback, Exclusive Thrill Originals!",https://moneycheck.com/chevron-cvx-stock-climbs-as-ceo-flags-market-disconnect-on-hormuz-supply-crisis/,Risk
CVX,Chevron (CVX) Stock Rises as CEO Warns Oil Futures Are Underpricing Supply Shock - CoinCentral,2026-03-24 09:46:06,"Chevron (CVX) CEO Mike Wirth stepped up to the podium at S&P Global’s annual CERAWeek conference in Houston on Monday and said what many in the room were quietly thinking: oil markets are not taking this seriously enough. Wirth told the crowd that the physical consequences of the Strait of Hormuz closure are already moving through the global energy system — but crude futures are not reflecting that reality. “There are real physical manifestations from the closure of the Strait of Hormuz that are working their way around the world and through the system that I don’t think are fully priced into the futures curve on oil,” Wirth said. He warned that futures traders are making moves based on “any kind of perception” and described the market as “uncertain,” “unpredictable,” and “volatile.” CVX stock was up 1.73% on the day, even as crude prices tumbled. Brent crude fell 12% to $98.95 a barrel in afternoon trading on March 23, while WTI dropped 11% to $87.73. The drop came after President Trump announced talks with Iran and said he would pause threatened strikes for at least five days. The numbers behind Wirth’s warning are sobering. According to S&P Global Energy, approximately 6.5 to 7 million barrels of daily oil supply are currently offline in the Middle East. That figure is expected to climb to 8 or 9 million barrels within days. Around 80% of the oil that normally flows through the Strait of Hormuz is destined for Asia, and the region is already starting to face what Kurt Barrow of S&P Global Energy called an “availability crisis.” “Some countries will have to go without oil,” Barrow said. “There’s no model for this.” Diesel and jet fuel markets are showing tightness, Wirth said. Even if a ceasefire is reached quickly, restoring production won’t happen overnight. Experts say it could take weeks, months, or even years in some cases. “Some of these facilities suffered damage and in some cases reportedly significant damage. How quickly that production can come back on-line is an uncertainty that we are going to have to deal with,” Wirth said. The WTI futures curve currently shows prices around $82 a barrel in July, falling to the $73 range by December. The market has priced oil to stay in the $70s for most of 2027. Before the conflict, those futures were trading in the $50–60s range. Wirth’s point is that even this elevated pricing likely isn’t high enough given the physical damage to infrastructure and the scale of supply being taken offline. WTI briefly hit $101 a barrel and Brent shot to $113 late Sunday on concerns about potential U.S. strikes on Iranian power plants. Prices dropped sharply Monday morning after Trump postponed those strikes. Goldman Sachs revised its 2026 WTI oil price forecast to $79 a barrel from $72, based on the assumption that Strait of Hormuz oil shipments will remain at roughly 5% of normal levels for at least two more weeks. CVX has a consensus Strong Buy rating among 21 Wall Street analysts, with 16 Buy and five Hold recommendations. The average price target sits at $197.25. Discover top-performing stocks in AI, Crypto, and Technology with expert analysis. Futures & Crypto Trader 
 Sharing charts, strategies, & mindset tips to help you level up
 Not Financial Advice
Follow on X @Pro_Trader_Edge Coinbase just launched stock perpetual futures for non US traders, putting Apple and Nvidia exposure… Never Miss Another Opportunity. Get hand selected news & info from our Crypto Experts so you can make educated, informed decisions that directly affect your crypto profits! Type above and press Enter to search. Press Esc to cancel. ZunaBet New Crypto Casino: 250% Bonus & 75 Free Casino Spins, Claim!",https://coincentral.com/chevron-cvx-stock-rises-as-ceo-warns-oil-futures-are-underpricing-supply-shock/,Risk
