ticker,title,date,content,url,sentiment
CVX,Chevron reports outage at Australian gas facilities due to cyclone - TradingView,2026-03-26 23:37:50,"Select market data provided by ICE Data Services. Select reference data provided by FactSet. Copyright © 2026 FactSet Research Systems Inc.Copyright © 2026, American Bankers Association. CUSIP Database provided by FactSet Research Systems Inc. All rights reserved. SEC fillings and other documents provided by Quartr.© 2026 TradingView, Inc.","https://www.tradingview.com/news/reuters.com,2026:newsml_L1N40E1BK:0-chevron-reports-outage-at-australian-gas-facilities-due-to-cyclone/",Risk
CVX,Chevron (NYSE:CVX) Shares Up 1.3% - Here's What Happened - MarketBeat,2026-03-26 21:30:03,"Chevron Corporation (NYSE:CVX - Get Free Report) shares rose 1.3% during mid-day trading on Thursday . The company traded as high as $209.21 and last traded at $207.8130. Approximately 11,000,929 shares were traded  during mid-day trading, a decline of 16% from the average daily volume of 13,073,589 shares. The stock had previously closed at $205.15. Here are the key news stories impacting Chevron this week: Several brokerages have issued reports on CVX. Sanford C. Bernstein raised their price objective on shares of Chevron from $170.00 to $172.00 and gave the stock a ""market perform"" rating in a research report on Monday, January 5th. Freedom Capital lowered Chevron from a ""hold"" rating to a ""strong sell"" rating in a research note on Tuesday, January 6th. Melius Research upgraded shares of Chevron from a ""hold"" rating to a ""buy"" rating and set a $205.00 price objective for the company in a research note on Tuesday, February 17th. Wall Street Zen raised Chevron from a ""sell"" rating to a ""hold"" rating in a report on Saturday, January 31st. Finally, Bank of America upped their target price on Chevron from $188.00 to $206.00 and gave the company a ""buy"" rating in a research report on Monday, March 2nd. Fourteen research analysts have rated the stock with a Buy rating, six have assigned  a Hold rating and four have given a Sell rating to the company's stock. According to MarketBeat, the stock presently has an average rating of ""Hold"" and an average price target of $184.77. The stock has a market cap of $414.67 billion, a price-to-earnings ratio of 31.20, a P/E/G ratio of 1.91 and a beta of 0.67. The company has a quick ratio of 0.86, a current ratio of 1.15 and a debt-to-equity ratio of 0.21. The company has a 50 day simple moving average of $183.79 and a 200 day simple moving average of $164.44. Chevron (NYSE:CVX - Get Free Report) last issued its quarterly earnings data on Friday, January 30th. The oil and gas company reported $1.52 EPS for the quarter, beating the consensus estimate of $1.44 by $0.08. The business had revenue of $45.79 billion during the quarter, compared to the consensus estimate of $48.18 billion. Chevron had a net margin of 6.51% and a return on equity of 7.89%. The firm's revenue was down 10.2% compared to the same quarter last year. During the same quarter in the prior year, the firm earned $2.06 EPS.  As a group, equities research analysts forecast that  Chevron Corporation will post 10.79 EPS for the current year. The company also recently disclosed a quarterly dividend, which was paid on Tuesday, March 10th. Stockholders of record on Tuesday, February 17th were paid a $1.78 dividend. This is an increase from Chevron's previous quarterly dividend of $1.71. This represents a $7.12 annualized dividend and a dividend yield of 3.4%. The ex-dividend date of this dividend was Tuesday, February 17th. Chevron's payout ratio is currently 106.91%. In other news, insider R. Hewitt Pate sold 58,000 shares of Chevron stock in a transaction on Monday, March 2nd. The shares were sold at an average price of $188.65, for a total transaction of $10,941,700.00. Following the transaction, the insider owned 8,558 shares in the company, valued at approximately $1,614,466.70. The trade was a 87.14% decrease in their ownership of the stock. The sale was disclosed in a document filed with the Securities & Exchange Commission, which is accessible through the SEC website. Also, CFO Eimear P. Bonner sold 32,100 shares of the stock in a transaction dated Friday, January 30th. The shares were sold at an average price of $175.01, for a total value of $5,617,821.00. Following the completion of the sale, the chief financial officer directly owned 4,366 shares of the company's stock, valued at approximately $764,093.66. The trade was a 88.03% decrease in their position. The disclosure for this sale is available in the SEC filing. Insiders sold a total of 1,099,397 shares of company stock worth $196,196,468 over the last ninety days. Insiders own  0.21% of the company's stock. Hedge funds and other institutional investors have recently modified their holdings of the company. Phillip James Consulting Co. bought a new stake in  Chevron during the fourth quarter valued at $26,000.  Core Wealth Advisors LLC bought a new position in shares of  Chevron in the 4th quarter worth about $26,000.  Karpus Management Inc. acquired a new position in shares of  Chevron in the 4th quarter valued at about $27,000.  Basso Capital Management L.P. acquired a new position in shares of  Chevron in the 4th quarter valued at about $27,000.  Finally, Quattro Advisors LLC bought a new stake in shares of  Chevron during the 4th quarter valued at about $27,000. Institutional investors and hedge funds own  72.42% of the company's stock. Chevron Corporation NYSE: CVX is an American multinational energy company engaged in virtually all aspects of the oil and gas industry. As an integrated energy firm, Chevron's core activities include upstream oil and natural gas exploration and production, midstream transportation and storage, downstream refining and marketing of fuels and lubricants, and petrochemical manufacturing through joint ventures and subsidiaries. The company markets fuels under brands such as Chevron, Texaco and Caltex and supplies a range of products and services to retail customers, industrial users and commercial fleets worldwide. Chevron traces its corporate lineage to the early petroleum companies that eventually became Standard Oil of California and has evolved through significant mergers and restructurings, including the acquisitions of Gulf Oil and Texaco. This instant news alert was generated by narrative science technology and financial data from MarketBeat in order to provide readers with the fastest reporting and unbiased coverage. Please send any questions or comments about this story to contact@marketbeat.com. Before you consider Chevron, you'll want to hear this. MarketBeat keeps track of Wall Street's top-rated and best performing research analysts and the stocks they recommend to their clients on a daily basis. MarketBeat has identified the five stocks that top analysts are quietly whispering to their clients to buy now before the broader market catches on... and Chevron wasn't on the list. While Chevron currently has a Hold rating among analysts, top-rated analysts believe these five stocks are better buys. Learn the basics of options trading and how to use them to boost returns and manage risk with this free report from MarketBeat. Click the link below to get your free copy. Sign up for MarketBeat All Access to gain access to MarketBeat's full suite of research tools. 345 N Reid Place, Suite 620, Sioux Falls, SD 57103
                                        
                                        contact@marketbeat.com
                                        
                                        (844) 978-6257 © MarketBeat Media, LLC 2010-2026. All rights reserved. © 2026   Fair market value prices are updated every minute and are provided by Massive. Other market data provided is at least 10-minutes delayed and hosted by Barchart Solutions.  Information is provided 'as-is' and solely for informational purposes, not for trading purposes or advice, and is delayed. To see all exchange delays and terms of use please see Barchart's disclaimer. We and our partners share information on your use of this website to help improve your experience. For more information, or to opt out click the Do Not Sell My Information button below.",https://www.marketbeat.com/instant-alerts/chevron-nysecvx-shares-up-13-heres-what-happened-2026-03-26/,Neutral
CVX,Protect Your Portfolio From Inflation: Buy These 2 Energy Stocks - The Globe and Mail,2026-03-26 19:52:09,"Rising oil prices will help Occidental Petroleum and Chevron. Both companies have only a small exposure to the Middle East. The stocks look cheap if you believe oil will stay above $100 a barrel for 2026. Geopolitical tensions are rising, and with the Strait of Hormuz still closed to most ships, energy prices have remained elevated. Oil is now above $100 a barrel as of this writing and will likely go up even further if the strait is closed for longer. If the prices of oil and natural gas remain elevated, it will likely induce inflation in markets such as the U.S. and increase the risk of a recession. And if you are worried about how these developments may affect your portfolio, here are two energy stocks you can load up on as a hedge against inflation. Will AI create the world's first trillionaire? Our team just released a report on the one little-known company, called an ""Indispensable Monopoly"" providing the critical technology Nvidia and Intel both need. Continue » Even though 15% of Occidental Petroleum's (NYSE: OXY) energy assets are in the Middle East, the oil and gas producer's stock has soared to start the year, trading up 44.5% year to date as of this writing on March 24. Investors are betting that the region's conflict will lead to increased investment in North American oil and gas projects, to which Occidental has significant exposure. And if these remain among the world's most secure ways to source oil and natural gas, those commodities may command higher selling prices as places like Europe and Asia demand petroleum to sustain their economies. The last time that oil prices soared, Occidental Petroleum's free cash flow (FCF) soared to $12 billion. If prices stay above $100 a barrel throughout 2026, the company may generate even more in FCF despite the uncertainties around its Middle East assets. After the stock's recent bump, the company now has a market cap of $61 billion, which would only be around five times this level of FCF, making Occidental Petroleum a nice inflation hedge if you are worried about oil prices staying high for the long haul. A company that has skillfully transitioned from the Middle East to North and South America is Chevron(NYSE: CVX). It remains one of the largest oil and gas producers in the world and recently secured a strategic win by making large investments in Venezuela and Guyana, including the acquisition of Hess Energy. With the market potentially opening up in Venezuela, this could help the company at the perfect moment to increase production as oil and gas prices rise. Chevron has only an estimated 5% of its FCF exposed to the Middle East, putting it in a much better position than the competition. Right now, the stock is up 33% in 2026, but it could still offer value to investors worried about oil prices staying higher for longer. Shares trade at a dividend yield of 3.44%. Last time oil prices soared, Chevron's FCF zoomed up to $36 billion, which is just over 10 times its current market capitalization. This is a lower multiple than Occidental Petroleum's peak FCF, but it has now significantly expanded its production capabilities from around 3 million barrels per day in 2022 to over 4 million barrels per day this year. That could help its FCF soar, making Chevron stock still a cheap inflation hedge for any portfolio right now. Before you buy stock in Occidental Petroleum, consider this: The Motley Fool Stock Advisor analyst team just identified what they believe are the 10 best stocks for investors to buy now… and Occidental Petroleum wasn’t one of them. The 10 stocks that made the cut could produce monster returns in the coming years. Consider when Netflix made this list on December 17, 2004... if you invested $1,000 at the time of our recommendation, you’d have $497,659!* Or when Nvidia made this list on April 15, 2005... if you invested $1,000 at the time of our recommendation, you’d have $1,095,404!* Now, it’s worth noting Stock Advisor’s total average return is 912% — a market-crushing outperformance compared to 185% for the S&P 500. Don't miss the latest top 10 list, available with Stock Advisor, and join an investing community built by individual investors for individual investors. Brett Schafer has no position in any of the stocks mentioned. The Motley Fool has positions in and recommends Chevron. The Motley Fool recommends Occidental Petroleum. The Motley Fool has a disclosure policy. All market data (will open in new tab) is provided by Barchart Solutions. Copyright © 2026. Information is provided 'as is' and solely for informational purposes, not for trading purposes or advice. For exchange delays and terms of use, please read disclaimer (will open in new tab).",https://www.theglobeandmail.com/investing/markets/stocks/CVX-N/pressreleases/990373/protect-your-portfolio-from-inflation-buy-these-2-energy-stocks/,Growth
CVX,Mochi Finance founder offloads 550K CVX as fraud claims deepen across DeFi - Cryptonews.net,2026-03-26 19:14:01,"Mochi founder Azeem Ahmed sold 550K $CVX from a Curve-linked stash as on-chain probes allege over $8M in diverted rewards and $54M in DeFi losses. Azeem Ahmed, founder of Mochi Finance and GaiaDAO, has sold approximately 550,285 Convex Finance ($CVX) tokens from wallets linked to a 2021 Curve Finance drain, netting around $946,000 and triggering a double‑digit intraday slide in $CVX’s price. On March 19, the tokens were liquidated at an average price of about $1.72, sending $CVX from roughly $1.88 to $1.68, a drop of more than 10% according to on-chain data reviewed by Crypto Daily. The proceeds were routed to a multisig associated with the Mochi protocol, which held about $864,858 in assets after the sale, while another 500,000 $CVX remain locked on Convex Finance. The $CVX position itself originates from Mochi’s controversial November 2021 move to mint its USDM stablecoin against MOCHI and drain roughly $46 million in DAI-equivalent liquidity from the USDM/3CRV pool on Curve. At the time, Mochi used 10 billion MOCHI tokens—assigned a hard‑coded oracle price despite near‑zero market value—to mint 46 million USDM, convert the proceeds into 9,876 $ETH, and purchase about 1,050,285 $CVX, which were then locked on Convex Finance, according to certified crypto‑trace reports by forensics firm IFW Global. Curve’s Emergency DAO responded by killing Mochi’s gauge and blocking further emissions after characterizing the maneuver as a “clear governance attack,” a clash that became part of the broader “Curve Wars” over $CVX and CRV voting power and emissions. In the aftermath, Ahmed re-emerged through GaiaDAO with a Peg Rebalancing Module (PBM) pitched as a mechanism to distribute $CVX staking rewards from the locked position to USDM holders and gradually restore the stablecoin’s peg. The PBM charged a 2% management fee and 20% performance fee payable to Ahmed, but according to Curve governance forum records, he unilaterally hiked the performance fee to 50% before community backlash forced him to reverse the change. By November 2025, reward distributions from the 1,050,285 vlCVX position had stopped entirely, and on-chain data indicates those rewards were rerouted to a wallet that also acts as a signer on the $CVX multisig, with the value of diverted staking rewards alone estimated at more than $1.6 million. Beyond staking flows, investigators allege that about 2,198 $ETH—worth roughly $6.67 million at the time—and $471,429 in USDC were drained from Mochi/$ETH liquidity pools and never returned to depositors, while airdrops from protocols including Prisma, CNC, VELO, LFT, and YB reportedly remained unclaimed or undistributed. Aggregate investor losses tied to the Mochi ecosystem and its associated pools are now estimated at over $54 million, according to IFW Global’s certified reports. Ahmed’s track record stretches back to at least 2020 and spans Yieldfarming.insure (SAFE), Armor.fi, Mochi Finance, and GaiaDAO, with repeated accusations of misappropriating community funds. During the original Mochi‑Curve confrontation, Curve alleged that Mochi’s strategy amounted to a governance attack, while Ahmed insisted in an interview with Crypto Briefing that the team had simply taken a “bold approach to gaining voting power in the DAO” and argued that the “DeFi Cartel … feels threatened that a small player on the outskirts” could challenge incumbents. Robert Forster, Ahmed’s former co‑founder at Armor.fi, later accused him publicly of stealing “millions in LP tokens,” a charge Ahmed denied by claiming the funds were “returned in full” and counter‑alleging that Forster had taken money for personal use. Legal pressure has also followed the on‑chain drama into courts. A prior lawsuit by an Armor.fi user in San Francisco Superior Court (Chen v. Ahmed, Case No. CGC‑21‑589609) ended in an out‑of‑court settlement after a temporary restraining order application, according to filings referenced in IFW Global’s reports. Attorneys now point to potential U.S. claims spanning securities fraud under Section 10(b), racketeering (RICO), common‑law fraud, conversion, and unjust enrichment, and affected investors have been directed to file complaints with the Securities and Exchange Commission, Commodity Futures Trading Commission, and the FBI’s IC3 portal. Ahmed’s March 19 liquidation is the most aggressive on-chain move from Mochi‑linked wallets since the 2021 Curve incident and is being read by many affected investors as confirmation that the locked $CVX will be used for exit liquidity rather than restitution. With roughly 500,000 $CVX still locked on Convex Finance and controlled via the same governance structure, any further sales could become major liquidity events for $CVX and reignite questions over how DeFi protocols respond when governance power is acquired through exploits rather than open‑market buying. Ahmed, described in IFW documentation as a UK citizen, has not publicly responded to the latest allegations, and his social media profiles have been inactive for months.",https://cryptonews.net/news/defi/32610206/,Negative
CVX,Chevron (CVX) Price Target Raised by Bernstein on Stronger Crude Backdrop - Yahoo Finance,2026-03-26 17:43:28,"Tip: Try a valid symbol or a specific company name for relevant results How Trump went from saying the Strait of Hormuz 'will open itself' to acknowledging Iran's power to control the waterway SpaceX tells prospective investors to anticipate briefings in April in preparation for IPO (Bloomberg) Every Big Tech darling is down double-digit percentages from its 52-week high The Nasdaq led indexes lower as Big Tech and chip stocks sold off and oil spiked above $100 Mortgage rates surged to a 7-month high as buyer confidence is 'shaken' Stocks slid at the open as Trump warned Iran to make a deal before it is 'too late' Worker productivity is on the rise. How much is because of AI is hard to say. Workers everywhere are feeling horrible about their job security. Here's why. Wall Street analysts say recession odds are rising as oil prices remain volatile and the Middle East war drags on The TSA chief says travel problems will likely outlive any shutdown deal, warning of a 'perfect storm' this summer Stocks rose and oil stayed below the $100 level, as Wall Street weighed hopes for deescalation in Iran Meta, YouTube reportedly found liable in landmark social media addiction lawsuit 2 charts explain why OpenAI just pulled the plug on Sora US stocks jump amid hopes for US-Iran talks, as oil falls below $100 Three factors have driven double-digit stock market losses in the last 100 years. They're all in play. The economist known as 'Dr. Doom' says the Iran war could have serious implications for inflation and interest rates The CEO claims the era of the $1 billion AI-run companies is already here. Shares tanked the most on record, thanks to unfavorable developments in legislation moving through Congress. Stocks resumed a slide, with the Nasdaq leading the decline. Oil jumped as the Iran war dragged on. Stocks retreated at the open, pulling back after Monday's sharp rally as the Iran war dragged on How the Fed has — and hasn't — responded to previous oil price shocks Musk's 'Terafab' is finally here. It might be his grandest overarching vision yet for where he sees his companies headed. Larry Fink's annual letter featured a stark warning about AI and inequality Trump started talks with Iran after US allies warned him about the dangers of his planned strikes (Bloomberg) The Dow jumped over 600 points, while the S&P 500 and Nasdaq both rose over 1% as Wall Street cheered Trump's signal to resume talks with Iran. US stocks soar after Trump puts Iran strikes on hold to pursue 'very good' talks Dow futures soared nearly 1,000 points and oil sank after Trump postponed threatened strikes on Iran's power plants The Saudi oil pipeline the world didn't know it needed (Bloomberg) Here's how HELOCs have changed — and why some homeowners may not like the new rules Home health aides epitomize a key problem in the current job market: High demand but low pay Analysts are looking at how surging gas prices may affect consumers, inflation, and the broader economy Border czar Homan says ICE will do ‘non-significant’ tasks at airports (Bloomberg) Powell doesn't plan to step down from the Fed Board of Governors until the DOJ investigations of him and the Fed are resolved Iran war rages on, possible rate hikes, and AI's 'show me' phase Why Nascar star Joey Logano just invested in a Ford dealership A growing number of Americans are looking to retire overseas. Here's what you need to know. Your flight is about to get more expensive. These tips could save you. Trump threatens to deploy ICE agents to airports in shutdown (Bloomberg) Why used EVs may be the answer for Americans looking for affordable cars Property taxes are skyrocketing. But states are learning that cutting them has major consequences. OpenAI to double workforce as business push intensifies (Financial Times) Wall Street priced a swift bombing campaign. What it got was an energy war. Shutdown-induced travel problems may get even worse next week. And Congress has a recess looming. Jury finds Elon Musk misled investors during Twitter purchase, absolves him of some fraud claims (Associated Press) Gas prices are just the start: Consumers will feel more pain from Iran war The Dow, S&P 500, and Nasdaq sold off to end another brutal week as the Iran war rages Wall Street resumed its sell-off, with the Nasdaq down over 1% as stocks looked headed for another brutal week. US stocks retreat as oil swings around amid Iran war jitters The robotaxi companies have wildly different problems, but the same goal The financial sector is on pace for its worst first quarter since 2020 Chevron Corporation (NYSE:CVX) is included among the Dividend Kings and Aristocrats List: 32 Biggest Stocks. On March 22, Bernstein raised its price recommendation on Chevron Corporation (NYSE:CVX) to $216 from $194. It reiterated a Market Perform rating on the shares. The firm said it updated its models across the energy and transportation group to reflect current crude prices and crack spreads, while noting there is still a wide range of possible outcomes. The analyst also pointed out that conflicts that stretch beyond a few weeks often last for years. Given that level of uncertainty and what the firm described as “right tail risk,” it continues to favor adding exposure to energy. A day later, on March 23, Reuters reported that Chevron is seeing progress in Venezuela as oil production increases. At the same time, CEO Mike Wirth said more work is needed to improve the legal and investment environment. Interest in Venezuela’s energy sector has picked up again after political changes earlier this year and calls for significant new investment to rebuild the industry. Wirth said access to international arbitration will be important for companies looking to invest. He also noted that recent changes to the country’s oil laws are broad and still require more specific incentives to attract capital. Chevron Corporation (NYSE:CVX) operates as an integrated energy company. The company is involved in producing crude oil and natural gas, as well as manufacturing fuels, lubricants, petrochemicals, and additives. It also develops technologies that support its operations and the broader energy industry. While we acknowledge the potential of CVX as an investment, we believe certain AI stocks offer greater upside potential and carry less downside risk. If you're looking for an extremely undervalued AI stock that also stands to benefit significantly from Trump-era tariffs and the onshoring trend, see our free report on the best short-term AI stock. READ NEXT: 15 Dividend Stocks to Buy for Steady Income and 14 Under-the-Radar High Dividend Stocks to Buy Now Disclosure: None. Follow Insider Monkey on Google News. Tip: Try a valid symbol or a specific company name for relevant results",https://finance.yahoo.com/sectors/energy/articles/chevron-cvx-price-target-raised-174328392.html,Positive
