id,ticker,date,title,content,url,sentiment
1,MSFT,2026-03-28 17:31:00,멜린다 프렌치 게이츠는 25세에 마이크로소프트를 그만둘 뻔했다. 이제 그녀는 냉정함을 잃지 않고 피드백을 주는 간단한 원칙을 갖고 있다: '명확함은 친절이다' - Microsoft (NASDAQ:MSFT) - Benzinga,"멜린다 프렌치 게이츠는 어려운 대화를 피하지 않는다. 다만 그것을 성급하게 시작하지도 않는다. 전 남편인 마이크로소프트(NASDAQ:MSFT) 공동창업자 빌 게이츠와 함께 20년 넘게 빌 & 멜린다 게이츠 재단을 공동 의장으로 이끌다가 2024년 물러난 이 억만장자 자선가는 직장에서 피드백을 주는 데 분명한 원칙을 갖고 있다. 무언가에 불만이 있으면 그 책임자는 48시간 이내에 그녀의 말을 듣게 된다는 것이다. 즉각은 아니지만, 그렇다고 조용히 넘어가지는 않는다. 그녀는 이달 초 블룸버그의 Leaders with Francine Lacqua 팟캐스트에서 “나는 즉시 말하지 않을 겁니다. 생각을 정리할 시간이 필요하니까요”라고 말했다. “무언가에 화가 났다면, [나는 이렇게 합니다] 진정하기 위해서요. 그건 제 책임입니다.”

그녀는 이 원칙이 비판을 누그러뜨리기 위한 것이 아니라, 그것이 제대로 전달되게 하기 위한 것이라고 설명한다. 프렌치 게이츠는 “명확함은 친절입니다”라고 말하며, “제가 피드백을 주는 것은 그들이 실제로 성장하고 더 나아질 수 있도록 하기 위해서입니다”라고 밝혔다. 48시간의 유예 시간은 반대 방향의 신호로도 작동한다. 말 없이 시간이 지나면 직원들은 자신이 문제없다는 것을 알게 된다. “48시간이 지나면 자신이 한 일이 좋은 일이었다는 확신을 가질 수 있습니다. 성과평가 때 가서 깜짝 놀라게 되지는 않을 겁니다.”

이 철학은 그녀의 초기 경력에서 뿌리를 찾을 수 있다. 프렌치 게이츠는 마이크로소프트에서 9년을 보냈으며, 대학을 졸업하자마자 그녀가 “남자들의 토론 사회”라고 표현한 곳에 들어갔다. 이는 강하게 몰아붙이는 문화였고, 그녀는 자신에게 맞지 않는 공격적인 스타일을 따라 하게 되었다. “약 2년쯤 지났을 때—그러니까 그 당시 저는 25세 정도였겠죠—저는 제가 저 자신을 좋아하지 않는다는 걸 깨달았습니다”라고 그녀는 말했다. “직장 밖의 사람들을 대하는 방식이 마음에 들지 않았어요. 직장 안에서 사람들을 대하던 방식과 똑같이 대하고 있었기 때문입니다.” 그녀는 회사를 그만두는 것도 생각했다. 대신 그녀는 단호하지만 동시에 돌보는 리더십 스타일로 방향을 틀었고, 놀랍게도 그것은 효과가 있었다.

현재 프렌치 게이츠는 2015년 자신이 설립한 투자 및 인큐베이션 회사 피보탈 벤처스(Pivotal Ventures)를 이끌고 있으며, 이혼 합의의 일부로 받은 125억 달러를 전 세계 자선 목적에 배분하고 있다. 결국 48시간 원칙은 단지 직장 내 습관이 아니었다. 그것은 리더십 철학이 되었다. “저는 갈등을 꺼리지 않습니다. 저는 제 자신에게 정직함을 유지할 수 있는 방식으로 그것을 하는 법을 배웠습니다.”

면책 고지: 이 콘텐츠는 AI 도구의 도움으로 일부 작성되었으며 Benzinga 편집진의 검토 및 게시를 거쳤습니다. © 2026 Benzinga.com. Benzinga는 투자 조언을 제공하지 않습니다. 모든 권리 보유. Google에서 Benzinga News를 선호 소스로 추가하려면 여기를 클릭하세요. 시장 애호가들을 위해 시장 애호가들이 만든 뉴스레터. 장 마감 전후 매 영업일 아침과 저녁에 주요 뉴스, 주요 변동 종목, 거래 아이디어를 받은편지함으로 전달합니다.",https://www.benzinga.com/news/psychology/26/03/51528122/melinda-french-gates-almost-quit-microsoft-at-25-now-she-has-a-simple-rule-for-giving-feedback-without-losing-your-cool-being-clear-is-kind,Neutral
2,MSFT,2026-03-28 13:18:57,AI 지출과 채용 동결이 수년 만의 가장 가파른 조정을 촉발한 가운데 마이크로소프트(MSFT) 밸류에이션 살펴보기 - simplywall.st,"마이크로소프트(MSFT)는 AI 인프라 지출을 늘리고 핵심 클라우드 및 영업 부문에서 채용을 중단한 이후 수년 만에 가장 가파른 조정을 겪고 있다. 다만 클라우드와 AI 사업은 여전히 강한 성과를 내고 있다. 마이크로소프트 주가는 연초 대비 24.6% 하락했고, 3개월 기준으로는 약 26.9% 떨어졌으며, 최근 30일 동안도 10.9% 하락했다. 최근 AI CAPEX 관련 헤드라인과 채용 중단은 다년간 총주주수익률이 여전히 플러스임에도 불구하고 모멘텀이 약해지고 있다는 인식을 강화했다. 이번 조정 국면에서 다른 AI 종목들이 어떻게 거래되고 있는지 보고 싶다면, 35개 AI 인프라 주식 전반에서 집중된 기회를 살펴보는 것도 좋을 수 있다.

주가가 크게 하락한 반면 마이크로소프트는 두 자릿수 매출 및 순이익 성장률을 보고하고 있으며, 일부에서는 의미 있는 내재가치 할인 수준으로 거래되고 있다. 이에 투자자들은 이번 매도세가 과민반응인지, 아니면 시장이 이미 향후 수년간의 AI 주도 확장을 가격에 반영한 것인지 질문하고 있다. 마이크로소프트에 대해 가장 많이 참고되는 밸류에이션 서사는 주당 공정가치를 420달러로 제시하는데, 이는 직전 종가 356.77달러와 비교된다. 이는 최근 하락이 가격과 인식된 펀더멘털 사이의 괴리임을 보여준다.

마이크로소프트는 현재 자사를 특별하게 만드는 기반을 파고 허물고 있다. 구글과의 AI 기술 전쟁에서 밀리고 있고, 보장된 ROI도 없이 인프라에 현금을 쏟아붓고 있으며, 좌석 기반(Seat-based) 매출을 스스로 잠식하고 있고, 버그와 불필요한 소프트웨어가 가득한 운영체제로 사용자들을 자극하고 있다. 배는 매우 크고, 모멘텀이 앞으로 수년간 회사를 밀고 가겠지만, 마이크로소프트가 계속해서 열등하고 일자리를 파괴하는 AI를 판매하면서 사용자들에게 품질이 떨어지는 윈도우 경험을 강요한다면, 결국 자사의 기업용 해자는 모래 위에 지어진 것임을 깨닫게 될 것이다.

이처럼 강한 표현으로 묘사된 회사가 어떻게 여전히 더 높은 공정가치를 받는지 보고 싶으신가? 이 서사는 견조한 수익성, 탄력적인 마진, 그리고 오늘날의 AI 지출과 사업 믹스를 궁극적으로 현금 창출적이라고 보는 밸류에이션 기준에 크게 의존한다. 전체 서사를 읽고 전망의 배경을 파악해보시라. 다만 AI 인프라 지출이 명확한 현금 창출로 이어지지 않거나 내부 사기 저하 문제가 실행력에 영향을 미치기 시작하면 이 서사는 여전히 도전받을 수 있다. 이 마이크로소프트 서사의 핵심 리스크를 확인해보라.

리스크와 보상에 대한 시장 심리가 엇갈리고 있는 만큼, 직접 수치를 살펴보고 자신의 견해를 신속히 형성하는 것이 타당하다. 먼저 5가지 핵심 보상 요소와 1가지 중요한 경고 신호부터 시작해보라.

이번 마이크로소프트 조정 때문에 포트폴리오를 다시 생각하고 있다면 여기서 멈추지 말라. 나중에 뒤늦게 따라잡는 사람이 되지 않도록 지금 관심 종목 목록을 넓혀라.

이 Simply Wall St 기사는 일반적인 성격의 글이다. 우리는 과거 데이터와 애널리스트 전망에 기반한 논평만 제공하며, 편향되지 않은 방법론을 사용하고 있고, 우리의 기사는 금융 조언을 목적으로 하지 않는다. 이는 어떤 종목의 매수 또는 매도를 권고하는 것이 아니며, 귀하의 목표나 재무 상황을 고려하지 않는다. 우리는 펀더멘털 데이터에 기반한 장기 중심 분석을 제공하는 것을 목표로 한다. 또한 우리의 분석은 최신의 가격 민감 공시나 정성적 중요 요소를 반영하지 못할 수 있다. Simply Wall St는 언급된 어떤 종목에도 포지션을 보유하고 있지 않다. 우리는 주식 투자자를 위한 최고의 포트폴리오 동반 도구를 만들었으며, 이는 무료다.
• 무제한 수의 포트폴리오를 연결하고 모든 자산을 하나의 통화로 확인
• 이메일 또는 모바일로 새로운 경고 신호나 리스크 알림 수신
• 보유 종목의 공정가치 추적
이 글에 대한 피드백이 있나요? 내용이 우려되시나요? 직접 문의해 주세요. 또는 editorial-team@simplywallst.com 으로 이메일을 보내주세요
전 세계적으로 소프트웨어, 서비스, 디바이스 및 솔루션을 개발하고 지원한다. 탁월한 실적을 보유하고 있으며 배당을 지급하는 매우 저평가된 종목이다. 금융 데이터는 S&P Global Market Intelligence LLC가 제공하며, 분석은 Simply Wall Street Pty Ltd가 제공한다. Copyright © 2026, S&P Global Market Intelligence LLC. 모든 권리 보유. Simply Wall Street Pty Ltd (ACN 600 056 611)는 Sanlam Private Wealth Pty Ltd(AFSL No. 337927)의 기업 공인 대표자(Authorised Representative Number: 467183)이다. 본 웹사이트에 포함된 모든 조언은 일반적인 조언에 불과하며, 귀하의 목적, 재무 상황 또는 필요를 고려하지 않고 작성되었다. 본 웹사이트에 포함된 조언 및/또는 정보에 의존해서는 안 되며, 어떠한 투자 결정을 내리기 전에 귀하의 상황에 적절한지 검토하고 적절한 재무, 세무 및 법률 자문을 구할 것을 권고한다. 금융 서비스를 받기 전에 당사의 Financial Services Guide를 읽어보시기 바란다. © 2026 Simply Wall Street Pty Ltd, US Design Patent #29/544/281, Community and European Design Registration #2845206",https://simplywall.st/stocks/us/software/nasdaq-msft/microsoft/news/a-look-at-microsoft-msft-valuation-as-ai-spending-and-hiring,Mixed
3,MSFT,2026-03-28 12:57:29,마이크로소프트: 주가가 답을 제시한 듯한 질문들 (NASDAQ:MSFT) - Seeking Alpha,"시장에서 가장 높은 품질의 주식 중 하나가 2025년 10월 555달러에서 366달러로 하락한 것은, 모든 투자자는 아니더라도 대부분의 투자자에게 왜 그런지 묻게 만드는 일이다.

애널리스트 공시: 본인/당사는 언급된 어떤 회사의 주식, 옵션 또는 유사한 파생상품 포지션도 보유하고 있지 않으며, 향후 72시간 내에 그러한 포지션을 개시할 계획도 없다. 본 문서는 제가 직접 작성했으며, 제 개인적인 의견을 담고 있다. 저는 이에 대해 보상을 받지 않는다(Seeking Alpha로부터 받는 보상 외에는). 본 기사에 언급된 어떤 회사와도 사업적 관계가 없다. Seeking Alpha의 공시: 과거 성과가 미래 결과를 보장하지 않는다. 어떤 투자도 특정 투자자에게 적합한지에 대한 추천 또는 조언은 제공되지 않는다. 위에 표현된 견해나 의견은 Seeking Alpha 전체의 견해를 반영하지 않을 수 있다. Seeking Alpha는 허가받은 증권 딜러, 브로커, 미국 투자 자문업자 또는 투자은행이 아니다. 당사의 애널리스트는 전문 투자자와 개인 투자자를 모두 포함하는 제3자 작성자이며, 이들 중 일부는 어떤 기관이나 규제 기관으로부터도 면허나 인증을 받지 않았을 수 있다.",https://seekingalpha.com/article/4886825-microsoft-the-questions-that-price-seems-to-have-answered,Neutral
4,MSFT,2026-03-28 09:17:50,"Independence Wealth Advisors LLC, 마이크로소프트 코퍼레이션 $MSFT에 포지션 취득 - MarketBeat","Independence Wealth Advisors LLC는 최근 미국 증권거래위원회(SEC)에 제출한 공시에 따르면, 4분기에 마이크로소프트 코퍼레이션(NASDAQ:MSFT - Free Report) 주식의 신규 포지션을 취득했다. 이 펀드는 소프트웨어 대기업의 주식 3,838주를 매입했으며, 가치는 약 185만6,000달러였다. 마이크로소프트는 Independence Wealth Advisors LLC 포트폴리오의 약 1.0%를 차지하며, 24번째로 큰 보유 종목이다. 최근 다른 여러 헤지펀드와 기관투자자들도 이 주식의 지분을 늘리거나 줄였다. WFA Asset Management Corp는 1분기 동안 마이크로소프트 지분을 27.0% 늘렸다. WFA Asset Management Corp는 지난 분기 추가로 216주를 매입한 뒤 현재 소프트웨어 대기업의 주식 1,016주를 보유하고 있으며, 가치는 42만7,000달러다. Ironwood Wealth Management LLC.는 2분기 동안 마이크로소프트 보유 주식을 0.3% 늘렸다. Ironwood Wealth Management LLC.는 지난 분기 38주를 추가 매입한 뒤 현재 소프트웨어 대기업의 주식 12,658주를 보유하고 있으며, 가치는 565만8,000달러다. Discipline Wealth Solutions LLC는 3분기에 마이크로소프트 지분을 410.4% 늘렸다. Discipline Wealth Solutions LLC는 지난 분기 추가로 2,138주를 매입한 뒤 현재 소프트웨어 대기업의 주식 2,659주를 보유하고 있으며, 가치는 114만4,000달러다. Wealth Group Ltd.는 4분기에 마이크로소프트 지분을 1.2% 확대했다. Wealth Group Ltd.는 지난 분기 추가로 28주를 매입한 뒤 현재 소프트웨어 대기업의 주식 2,374주를 보유하고 있으며, 가치는 100만 달러다. 마지막으로 Eagle Capital Management LLC는 4분기에 마이크로소프트 지분을 0.4% 늘렸다. Eagle Capital Management LLC는 지난 분기 추가로 96주를 매입한 뒤 현재 소프트웨어 대기업의 주식 23,097주를 보유하고 있으며, 가치는 973만5,000달러다. 현재 주식의 71.13%는 헤지펀드와 기타 기관투자자가 보유하고 있다.

여러 리서치 애널리스트들도 이 종목에 대해 의견을 냈다. Goldman Sachs Group은 2월 12일 목요일 리서치 노트에서 마이크로소프트 주식에 대한 ‘매수’ 의견을 재차 제시했다. Oppenheimer는 1월 29일 목요일 보고서에서 마이크로소프트 주식에 대한 ‘시장수익률 상회’ 의견을 재확인했다. Daiwa Securities Group은 2월 4일 수요일 리서치 보고서에서 마이크로소프트 주식의 목표주가를 630.00달러에서 600.00달러로 낮추고, ‘매수’ 의견을 제시했다. Mizuho는 1월 21일 수요일 리서치 노트에서 마이크로소프트 주식의 목표주가를 640.00달러에서 620.00달러로 낮추고, 회사에 대해 ‘시장수익률 상회’ 의견을 제시했다. 마지막으로 Weiss Ratings는 화요일 리서치 보고서에서 마이크로소프트 주식의 투자의견을 ‘매수(b-)’에서 ‘보유(c+)’로 하향했다. 주식 리서치 애널리스트 2명은 강력 매수(Strong Buy) 의견을, 38명은 매수(Buy) 의견을, 5명은 보유(Hold) 의견을 제시했다. MarketBeat.com 데이터에 따르면, 현재 회사의 평균 투자의견은 ‘중립적 매수(Moderate Buy)’이며 합의 목표주가는 588.97달러다.

이번 주 마이크로소프트에 영향을 미치는 주요 뉴스는 다음과 같다. 다른 마이크로소프트 관련 소식으로, EVP Kathleen T. Hogan은 3월 6일 금요일에 발생한 거래에서 주식 12,321주를 매도했다. 주식은 주당 평균 409.52달러에 매도되었으며, 총 가치는 5,045,695.92달러였다. 매도 완료 후 해당 부사장은 회사 주식 137,933주를 보유했으며, 가치는 약 56,486,322.16달러였다. 이 거래는 지분 8.20% 감소를 의미한다. 해당 거래는 SEC 웹사이트에서 확인할 수 있는 공시를 통해 공개되었다. 또한 이사 John W. Stanton은 2월 18일 수요일 날짜의 거래에서 사업 주식 5,000주를 취득했다. 주식은 주당 평균 397.35달러에 매입되었으며, 총 거래 금액은 1,986,750.00달러였다. 거래 완료 후 이사는 회사 주식 83,905주를 보유했으며, 가치는 약 33,339,651.75달러였다. 이 거래는 지분 6.34% 증가를 의미한다. 이 매수에 대한 SEC 공시에는 추가 정보가 있다. 주식의 0.03%는 회사 내부자가 보유하고 있다.

NASDAQ MSFT 주식은 금요일 356.77달러에 개장했다. 회사의 50일 이동평균은 409.36달러이며 200일 이동평균은 467.65달러다. 마이크로소프트 코퍼레이션의 52주 최저가는 344.79달러, 52주 최고가는 555.45달러다. 회사의 당좌비율은 1.38, 유동비율은 1.39, 부채비율은 0.09다. 회사의 시가총액은 2조6,500억 달러이며, 주가수익비율(PER)은 22.31, PEG 비율은 1.39, 베타는 1.10이다.

마이크로소프트(NASDAQ:MSFT - 무료 보고서)가 마지막으로 실적을 발표한 것은 1월 28일 수요일이었다. 이 소프트웨어 대기업은 분기 주당순이익(EPS) 4.14달러를 보고해, 시장 예상치 3.86달러를 0.28달러 상회했다. 마이크로소프트의 순이익률은 39.04%, 자기자본이익률(ROE)은 32.34%였다. 분기 매출은 812억7,000만 달러로, 애널리스트 예상치 802억8,000만 달러를 웃돌았다. 전년 동기에는 EPS가 3.23달러였다. 해당 분기 매출은 전년 동기 대비 16.7% 증가했다. 평균적으로 주식 리서치 애널리스트들은 마이크로소프트 코퍼레이션이 올해 주당순이익 13.08달러를 기록할 것으로 예상한다. 회사는 또한 최근 분기 배당을 발표했으며, 배당금은 6월 11일 목요일에 지급될 예정이다. 5월 21일 목요일 기준 주주명부에 등재된 투자자들은 주당 0.91달러의 배당금을 받게 된다. 이 배당의 배당락일은 5월 21일 목요일이다. 이는 연간 환산 배당금 3.64달러, 배당수익률 1.0%를 의미한다. 마이크로소프트의 배당성향(DPR)은 현재 22.76%다.

마이크로소프트 코퍼레이션은 워싱턴주 레드먼드에 본사를 둔 글로벌 기술 기업이다. 1975년 빌 게이츠와 폴 앨런이 설립했으며, 전 세계 소비자, 기업 및 정부를 대상으로 다양한 소프트웨어 제품, 서비스 및 디바이스를 개발, 라이선스 제공 및 지원한다. 사업 영역은 개인용 컴퓨팅, 생산성 소프트웨어, 클라우드 인프라, 엔터프라이즈 애플리케이션, 개발자 도구 및 게임을 포괄한다. 마이크로소프트의 제품 포트폴리오에는 윈도우 운영체제와 생산성 및 협업 도구 모음인 Microsoft 365(Office 앱, Outlook, Teams)가 포함된다.

다른 헤지펀드들이 MSFT를 어떻게 보유하고 있는지 보고 싶으신가요? HoldingsChannel.com을 방문해 마이크로소프트 코퍼레이션(NASDAQ:MSFT - Free Report)에 대한 최신 13F 공시와 내부자 거래를 확인하세요. 이 즉시 뉴스 알림은 독자들에게 가장 빠른 보도와 편향되지 않은 커버리지를 제공하기 위해 narrative science technology와 MarketBeat의 금융 데이터로 생성되었습니다. 이 기사에 대한 질문이나 의견은 contact@marketbeat.com으로 보내 주세요. 마이크로소프트를 고려하기 전에, 이 내용을 먼저 들어보시기 바랍니다. MarketBeat는 월가 최고 평점 및 최고 성과를 내는 리서치 애널리스트와 그들이 고객에게 추천하는 종목을 매일 추적합니다. MarketBeat는 더 넓은 시장이 알아차리기 전에 지금 조용히 매수하라고 고객에게 속삭이는 애널리스트 추천 종목 5개를 확인했으며, 마이크로소프트는 그 목록에 없었습니다. 현재 마이크로소프트는 애널리스트들 사이에서 ‘중립적 매수(Moderate Buy)’ 의견을 받고 있지만, 최고 평점 애널리스트들은 이 5개 종목이 더 나은 매수 대상이라고 보고 있습니다. 모두가 알기 전에 다음 FAANG 종목을 찾고 계신가요? 링크를 클릭해 MarketBeat 애널리스트들이 차세대 1조 달러 기술기업이 될 수 있다고 생각하는 종목을 확인하세요. MarketBeat All Access에 가입하면 MarketBeat의 전체 리서치 도구 모음을 이용할 수 있습니다. 345 N Reid Place, Suite 620, Sioux Falls, SD 57103 contact@marketbeat.com (844) 978-6257 © MarketBeat Media, LLC 2010-2026. 모든 권리 보유. © 2026 공정가치 가격은 매분 업데이트되며 Massive가 제공합니다. 기타 시장 데이터는 최소 10분 지연되며 Barchart Solutions가 호스팅합니다. 정보는 '있는 그대로' 제공되며 오직 정보 제공 목적으로만 사용되고 거래 목적이나 조언을 위한 것이 아니며, 지연되어 있습니다. 모든 거래소 지연 및 이용 약관은 Barchart의 면책 조항을 참조하십시오. 당사와 파트너는 귀하의 경험 향상을 위해 이 웹사이트 사용 정보를 공유합니다. 자세한 내용이나 제외를 원하시면 아래의 '내 정보를 판매하지 마십시오(Do Not Sell My Information)' 버튼을 클릭하십시오.",https://www.marketbeat.com/instant-alerts/filing-independence-wealth-advisors-llc-takes-position-in-microsoft-corporation-msft-2026-03-28/,Neutral
