id,ticker,date,title,content,url,sentiment
12,MSFT,2026-03-28 05:55:03,"MSFT 주가 하락은 344달러 지지선에서 멈출까, 아니면 다음 주 300달러까지 밀릴까? - FXLeaders","회사의 오랜 성장 서사가 커지는 AI 비용, 격화되는 경쟁, 마진 우려로 인해 의문시되면서 마이크로소프트 주가가 압박을 받고 있다. 마이크로소프트 주가는 지속적인 매도 압력을 받아 추가로 2.5% 하락해 약 356달러 수준에 머물렀고, 현재는 2025년 10월 고점인 약 557달러에서 거의 35% 내려온 상태다. 이번 하락은 수년 만에 회사의 가장 약한 6개월 구간 중 하나를 의미한다. 기술적으로는 주가가 100주 이동평균선을 포함한 주요 지지선을 하향 돌파하며 모멘텀의 변화를 시사하고 있다. 3월 초 잠시 안정되는 듯했지만, 다시 하방 압력이 커지면서 투자자들은 위험-보상 프로필을 재평가하고 있는 것으로 보인다. 기술주 전반의 일부는 비교적 견조한 흐름을 유지하고 있음에도 불구하고 이런 약세가 두드러진다는 점은, 시장 환경이 보다 선별적으로 변하고 있음을 보여준다. 매출 성장세와 클라우드 및 엔터프라이즈 소프트웨어에서의 강한 입지에도 불구하고, 마이크로소프트는 새로운 과제에 직면해 있다. 바로 성장이 지속 가능한 수익성으로 이어질 수 있음을 입증해야 한다는 점이다. 회사는 AI 붐의 주요 수혜자 중 하나로, 인프라에 대규모 투자를 단행하고 Azure 클라우드 플랫폼을 확장하며 Copilot 같은 AI 도구를 생태계 전반에 통합해 왔다. 그러나 이제 투자자들은 단순한 확장이 아니라 이러한 투자에 대한 보다 분명한 수익을 요구하고 있다. 이러한 변화는 혁신만큼이나 자본 규율이 중요해지는 더 넓은 시장 추세를 반영한다. 마이크로소프트의 OpenAI와의 깊은 파트너십은 AI 전략의 핵심이었지만, 동시에 투자자 우려의 초점이 되고 있다. 투자 규모가 단기에 충분한 수익을 창출할 수 있을지에 대한 의문이 제기되고 있다. 최근 보도에 따르면 마이크로소프트는 클라우드와 영업 부문의 일부 채용을 중단한 것으로 알려져, 보다 신중한 운영 기조를 시사한다. 동시에 OpenAI가 마이크로소프트에 의존하고 있다는 우려도 제기되면서, 매우 전략적이었던 관계에 복잡성이 더해지고 있다. 이 같은 전개는 투자자들로 하여금 실행 리스크를 더 비판적으로 바라보게 만들고 있다. 마이크로소프트 주가는 지난주 중요한 400달러 선 아래로 떨어졌고, 이번 주에도 하락세가 이어지고 있다. 이 구간은 심리적·기술적 지지선 모두에 해당하므로 중요한 분기점이다. 지난달 저점은 381달러였지만, 3월 첫째 주에는 MSFT가 100일 SMA(빨간색)에서 지지를 받으며 400달러 위로 빠르게 반등했다. 그러나 상승분을 지키지 못했고, 오늘 360달러 아래로 떨어진 뒤 다시 그 수준으로 밀렸다. 지지 역할을 하던 100주 SMA(빨간색)가 붕괴됐고, 가격은 481 아래로 밀렸다. 따라서 380달러 아래로의 결정적 이탈이 추가 하락을 촉발했으며, 특히 모멘텀 지표가 여전히 취약한 상황에서 그 영향이 컸다. 최근 하락은 단기 변동성 이상의 의미를 갖는다. 이는 초대형 기술주 전반에 걸쳐 가치평가, 자본 집약도, 리스크를 시장이 더 광범위하게 재평가하고 있음을 보여준다. 특히 이번 조정은 실적 호조에도 불구하고 발생했다는 점이 주목된다. 이는 투자자 우선순위가 바뀌었음을 보여주며, 표면적인 성장만으로는 향후 수익성이 불확실하다면 충분하지 않다는 뜻이다. 따라서 MSFT는 이제 4월 저점인 344달러를 향하고 있다. 마이크로소프트 주가는 최근 몇 달간 눈에 띄는 재가격을 겪었으며, 이는 투자자들이 초대형 기술 리더를 평가하는 방식이 더 넓게 재설정되고 있음을 시사한다. 10월에 555달러를 웃돌며 고점을 기록한 뒤 주가는 급격히 후퇴해 약 175달러를 잃었다. 최신 분기 보고서를 앞두고 주가는 반등을 시도했다. 그러나 AI 비용 급증에 대한 우려가 다시 커지면서 그 움직임은 되돌려졌고, MSFT는 다시 하락해 380달러 선이 확실히 다시 주목받고 있다. MSFT가 372달러까지 내려가면서 이 구간을 하향 돌파했으나 200주 SMA(보라색)에서 반등했고, 그러나 그 반등 역시 이미 약해졌다. 50개월 SMA가 무너진다면 다음 목표는 2025년 4월 저점인 345달러가 될 것이다. 다만 현재로서는 더 큰 상승 추세가 여전히 유효하며, 200 SMA까지의 이번 조정은 상승 모멘텀이 다시 이어지기 전의 또 다른 되돌림처럼 보인다. 그러나 200 SMA 아래로의 이탈도 볼 수 있다. 경쟁 압박도 커지고 있다. 아마존은 클라우드 부문 AWS를 통해 여전히 강력한 경쟁자이며, 아마존과 OpenAI의 긴밀한 연계 가능성을 시사하는 보도는 AI 생태계의 잠재적 변화에 대한 우려를 키웠다. 마이크로소프트가 Office와 개발자 도구 같은 제품에 AI를 통합한 것은 핵심 차별화 요인이었다. 그러나 경쟁사가 AI 인프라나 파트너십에서 입지를 넓히면, 시간이 지나며 Azure의 우위는 좁아질 수 있다. 이러한 변화하는 환경은 장기 시장점유율에 대한 불확실성을 키우고 있다. 마이크로소프트는 Copilot 기능 확대부터 Starlink 네트워크를 통한 SpaceX와의 협업에 이르기까지 새로운 제품과 파트너십을 계속 출시하고 있다. 그러나 이러한 혁신이 주가의 지속적인 상승으로 이어지지는 못했다. 미온적인 반응은 현재 환경에서 시장이 기술 발전보다 재무적 결과를 우선시하고 있음을 시사한다. 가장 큰 우려는 여전히 마이크로소프트의 공격적인 지출이다. 회사는 AI 중심 데이터센터 인프라 확장에 약 500억 달러를 투입하기로 약속했다. 자본지출이 매출보다 더 빠르게 증가하면서, 마진 압축의 초기 징후가 나타나기 시작했다. 이러한 투자들은 장기 리더십 확보를 목표로 하지만, 단기 수익성에는 부담으로 작용하고 있다. 결론: 마이크로소프트의 최근 하락은 시장 기대의 더 넓은 변화를 반영한다. 강한 성장과 혁신만으로는 더 이상 충분하지 않으며, 투자자들은 이제 수익성과 효율적인 자본 배분에 대한 분명한 증거를 원하고 있다. 회사가 기술 분야의 지배적 강자로 남아 있는 것은 분명하지만, 상승하는 비용, 경쟁 압박, 실행 리스크가 보다 신중한 전망을 만들고 있다. 마이크로소프트가 AI 투자로부터 실질적인 수익을 입증할 때까지, 장기적 잠재력에도 불구하고 주가는 계속 압박을 받을 수 있다.",https://www.fxleaders.com/news/2026/03/27/can-msft-stock-decline-stop-at-344-support-or-will-it-slip-to-300-next-week/,Risk
13,MSFT,2026-03-28 03:35:21,"오늘의 MSFT 주가, 3월 27일: OpenAI 리스크가 AI 서사를 시험하면서 과매도 구간 진입 - Meyka","오늘 MSFT 주식은 투자자들이 AI 지출과 OpenAI와의 제휴를 의문시하면서 과매도 신호를 보이고 있다. 주가는 356.77달러에 거래되며 2.51% 하락했고, 52주 최저가 344.79달러에 근접해 있다. 이는 50일선 420.77달러와 200일선 481.56달러를 크게 밑도는 수준이다. 논쟁은 분명하다. 강한 AI 수요 대 현금흐름 부담과 파트너 리스크다. 미국 투자자들이 4월 실적을 앞두고 위험-보상을 가늠할 수 있도록 기술적 지표, 마이크로소프트의 AI 자본지출, OpenAI 파트너십 리스크를 분석한다. RSI는 22.05, Stochastic %K는 1.86, Williams %R은 -99.40으로 모두 매우 깊은 과매도 상태를 가리킨다. MACD 히스토그램은 -2.91이며, ADX는 32.58로 강한 하락 추세를 시사한다. 거래량 3,760만 주는 평균 3,420만 주를 웃돌아 강한 참여를 보여준다. MFI는 19.43으로 매수 압력이 약하며 MSFT 주식은 바닥을 찾고 있다. 마이크로소프트 주가는 361.88달러 부근의 볼린저 밴드 하단 근처에서 등락하고 있으며 ATR은 8.73으로, 일중 변동폭이 더 넓음을 시사한다. 50일선 420.77달러와 200일선 481.56달러는 현 주가보다 훨씬 위에 있어 추세가 무너졌음을 보여준다. 지지선은 350달러 부근과 52주 최저가 344.79달러 근처에 있다. 저항은 370달러 부근과 중간 밴드 392달러 부근에 보인다. 마이크로소프트의 AI 자본지출은 데이터에서 확인된다. 자본지출은 매출의 27.20%, 영업현금흐름의 51.77%에 해당한다. 주당 잉여현금흐름은 10.42달러로, P/FCF는 약 34.25배 수준이다. 배당수익률은 약 0.97%, 배당성향은 21%다. 부채비율은 0.32, 이자보상배율은 53.9로, 재무제표는 지출을 감당할 수 있지만 단기 FCF는 빡빡하다. 영업이익률은 46.7%, ROE는 33.6%로 모두 최상위 수준이다. 그러나 소득의 질(income quality) 1.35는 지출 속도에 따른 현금 전환 민감도를 보여준다. 시장은 AI 워크로드가 Azure 사용량과 Copilot 수익화에 충분히 빠르게 기여해 높은 감가상각비와 에너지 비용을 상쇄할 수 있음을 입증하길 원한다. 그때까지는 실적의 질과 타이밍이 MSFT 주가의 핵심 변동 요인이다. Copilot과 소비자용 AI에서 OpenAI 모델에 의존하는 구조는 모델 접근성, 비용, 거버넌스가 바뀔 경우 집중 리스크를 키운다. 투자자들은 이 노출을 단기 부담 요인으로 보고 있으며, 파트너십의 지속 가능성과 경제성에 대해 신중한 태도로 돌아서고 있다. 24/7 Wall St.의 OpenAI 노출에 대한 투자자 우려 보도를 참고하라. 일부는 마이크로소프트가 AI 서사를 잃고 있다고 주장하며 시장 폭 확산도 약화됐다. MarketWatch에 따르면, 10년 수준의 과매도 판독치는 심리 변화를 보여준다. 그럼에도 애널리스트들은 대체로 긍정적이다. 매수 57개, 보유 2개, 매도 1개이며, 전체적으로 매수 컨센서스다. 마이크로소프트는 2026년 4월 29일 실적을 발표한다. Azure AI 사용량 증가, Copilot 유료 좌석 침투율, 총이익률 구성 변화에 주목해야 한다. 자본지출 가이던스, 에너지 비용, 데이터센터 시점은 하반기 현금흐름을 좌우할 것이다. 잉여현금흐름, 이연매출, OpenAI 경제성 및 모델 선택권에 대한 코멘트를 추적하라. 이들이 실적 발표 이후 MSFT 주가 방향을 이끌 것이다. TTM P/E 22.26배, EV/EBITDA 14.37배 수준에서 밸류에이션은 고점에서 내려왔지만 여전히 프리미엄이다. 주가는 연초 대비 24.56% 하락했고 3개월간 26.85% 하락했으며, RSI 22는 평균회귀 가능성을 시사한다. 강세 시나리오는 AI 매출 가속과 더 분명한 자본지출 수익성을 필요로 한다. 약세 시나리오는 파트너 리스크와 지속적인 현금흐름 압박을 핵심으로 한다. MSFT 주가는 현재 하단 밴드 부근에서 과매도 지표와 높은 거래 참여를 보이며, 기술적 반등 가능성을 예고하고 있다. 근본적 질문은 타이밍이다. AI 매출이 높은 데이터센터 지출을 감당할 만큼 빠르게 확대되면서 잉여현금흐름을 훼손하지 않을 수 있을까. 투자자들은 Azure AI 사용량, Copilot 수익화, 자본지출 가이던스, OpenAI 파트너십 조건에 대한 추가 명확성을 주시해야 한다. 평가는 월가가 매수 쪽으로 기울지만, 우리의 프레임워크는 혼재돼 있다. Stock Grade A(BUY)이지만 Company Rating은 B+(Neutral)다. 전술적으로는 지지선 부근에서 분할 매수를 고려하고 4월 29일 실적을 전후한 변동성에 대비해야 한다. 항상 자신의 위험 감내 수준에 맞게 포지션 규모를 조절하라. 그렇다. 기술적 지표는 RSI 22.05, Stochastic 1.86, Williams %R -99.40으로 매우 깊은 과매도 신호를 보여준다. 주가가 볼린저 밴드 하단 근처에 있는 점도 이를 뒷받침한다. 과매도는 반등의 선행 신호가 될 수 있지만, 시점을 보장하지는 않는다. 리스크 통제를 사용하고 가격 움직임으로 확인하라. 마이크로소프트의 AI 자본지출은 얼마나 크며 왜 중요한가? AI 투자는 상당하다. 자본지출은 매출의 27.20%, 영업현금흐름의 51.77%다. 이런 규모는 단기 잉여현금흐름에 부담을 줄 수 있지만, Azure AI 역량과 Copilot 기능을 확장하는 것을 목표로 한다. 시장은 매출과 마진이 그 지출을 정당화할 만큼 빠르게 확대된다는 증거를 원한다. 단일 모델 제공업체에 대한 의존은 비용, 접근성, 로드맵의 확실성에 영향을 줄 수 있다. 거버넌스나 모델 경제성 관련 헤드라인은 심리에 영향을 미칠 수 있다. 투자자들은 더 많은 조건 명확성, 대안, 자체 모델 진척 상황을 원한다. 모델 공급이 다변화되고 있다는 신호가 나오면 인식되는 리스크가 줄고 밸류에이션 배수가 지지될 수 있다. MSFT는 TTM 이익 기준 22.26배, EV/EBITDA 14.37배 수준에서 거래되고 있다. 이는 고점 멀티플보다 낮지만, 성장성과 마진 덕분에 여전히 많은 대형주 대비 프리미엄이다. 0.97%에 가까운 배당수익률과 견조한 재무구조는 도움이 되지만, 방향성은 Azure AI 성장, 자본지출 수익성, 4월 가이던스에 달려 있다. 가장 관심 있는 항목을 선택하면 시작하도록 도와드리겠다. 가장 관심 있는 항목을 선택하면 시작하도록 도와드리겠다. Meyka는 투자자들이 과거 데이터를 바탕으로 의사결정을 내릴 수 있도록 돕는, AI 기반 실시간 주식 및 암호화폐 뉴스 플랫폼이다. Meyka AI PTY LTD가 제공하는 정보는 정보 및 연구 목적에 한하며 금융, 투자 또는 거래 조언을 구성하지 않는다. Meyka는 리서치 플랫폼이지 금융 자문 서비스가 아니다. 금융시장 투자에는 위험이 수반되며, 과거 성과가 미래 결과를 보장하지 않는다. 사용자는 투자 결정을 내리기 전에 자체적으로 실사를 수행하고, 전문 금융 자문가와 상담하며, 자신의 위험 감내 수준을 평가해야 한다. Meyka와 운영자는 이 플랫폼의 정보를 사용함으로써 발생한 모든 금융 손실에 대해 책임지지 않는다. 제공되는 데이터는 공개적으로 이용 가능한 출처에서 추출되었으며 신뢰할 수 있다고 여겨지지만 항상 정확하거나 최신이라고 보장되지는 않는다. 사용자는 정보를 독립적으로 검증해야 하며 금융 결정을 Meyka에만 의존해서는 안 된다. Meyka를 사용함으로써 귀하는 이 서비스가 금융 조언이나 추천을 제공하지 않음을 인정하고, 어떤 투자 결정을 내리기 전에 자격을 갖춘 금융 전문가의 지도를 구하는 데 동의하는 것이다. 우리는 귀하의 경험을 개선하기 위해 귀하의 웹사이트 사용 정보에 대해 파트너와 공유한다. 자세한 정보 또는 거부를 원하시면 아래의 내 정보 판매 금지 버튼을 클릭하십시오.",https://meyka.com/blog/msft-stock-today-march-27-oversold-as-openai-risk-tests-ai-narrative-2803/,Risk
14,MSFT,2026-03-27 23:01:54,마이크로소프트 코퍼레이션(MSFT)이 2026년 3월 30일 주간 목표를 달성할까? 거래 확률 및 예측(2026년 3월 27일) - Polymarket,"마이크로소프트(MSFT) 주가는 3월 27일 356.77달러에 마감했으며, 인플레이션 우려와 급증하는 자본지출에 따른 기술주 전반의 매도세 속에서 2.5% 하락했다. 주간 기준으로는 7.8%, 월간 기준으로는 8.6% 하락해 2008년 이후 최악의 분기 흐름을 기록하고 있다. 3월 31일로 끝나는 회계 3분기 실적은 3월 30일 주간의 핵심 촉매로 다가오고 있으며, 높은 거래량 속에서 분기말 리밸런싱과 윈도 드레싱을 촉발할 가능성이 있다. 최근 압박에도 불구하고 애널리스트 컨센서스 목표주가 평균은 589달러로, 52주 최고가인 약 555달러 대비 크게 낮아진 현재 수준에서 상당한 상승 여력을 시사한다. 실적 발표는 4월 말로 예정돼 있다. 예측시장 트레이더들의 심리는 거시경제 역풍이 단기 낙관론을 누르고 있는 가운데, 클라우드와 AI 매출 추세에 기반한 견조한 장기 펀더멘털을 가격에 반영하고 있다. SPDR S&P 500 ETF Trust(SPY)가 4월에 (LOW) 650달러를 기록할까? Invesco QQQ Trust(QQQ)가 4월에 (HIGH) 650달러를 기록할까? 미국 30년 고정금리 모기지 금리가 2026년 12월 31일까지 6.50%(HIGH)에 도달할까? Polymarket은 별도의 법인을 통해 전 세계에서 운영된다. Polymarket US는 CFTC가 규제하는 지정계약시장(Designated Contract Market)인 QCX LLC d/b/a Polymarket US가 운영한다. 이 국제 플랫폼은 CFTC의 규제를 받지 않으며 독립적으로 운영된다. 거래에는 상당한 손실 위험이 수반된다. 이용약관 및 개인정보처리방침을 참조하라.",https://polymarket.com/event/will-msft-hit-week-of-march-30-2026,Risk
15,MSFT,2026-03-27 22:31:22,Microsoft (MSFT)는 3월 30일 주간에 ___에 마감할까? 거래 확률 및 예측 - Polymarket,"3월 30일 주간 마이크로소프트(MSFT) 주가에 대한 트레이더 심리는 350~370달러 구간에 촘촘하게 모여 있으며, 이는 인플레이션 우려와 AI 인프라에 대한 높은 자본지출이 주도한 기술주 전반의 매도세 속에서 최근 한 달간 8% 하락해 52주 최저가 부근에 머문 흐름을 반영한다. 이에 따라 주식의 내재 확률은 치열하게 맞붙는 양상이며, 상승한 국채 수익률 같은 거시경제 역풍이 고평가 성장주를 압박하는 가운데 1월 FY26 2분기 실적에서 매출이 전년 대비 16.7% 증가한 견조한 펀더멘털이 이를 일부 상쇄하고 있다. 애널리스트 컨센서스 목표주가는 평균 약 590달러로 장기 낙관론을 시사하지만, 4월 29일 회계 3분기 실적을 앞둔 시장의 위험 선호도에 따라 단기 변동성이 좌우될 전망이다. Polymarket은 별도의 법인을 통해 전 세계에서 운영된다. Polymarket US는 CFTC가 규제하는 지정계약시장(Designated Contract Market)인 QCX LLC d/b/a Polymarket US가 운영한다. 이 국제 플랫폼은 CFTC의 규제를 받지 않으며 독립적으로 운영된다. 거래에는 상당한 손실 위험이 수반된다. 이용약관 및 개인정보처리방침을 참조하라.",https://polymarket.com/event/msft-week-april-3-2026,Risk
16,MSFT,2026-03-27 22:23:43,Microsoft (MSFT)는 4월 말까지 ___를 상회하며 마감할까? 거래 확률 및 전망 - Polymarket,"Microsoft(MSFT) 주가는 지난주 동안 급락했으며, 3월 27일 의료기기 제조업체 Stryker에 대한 사이버 공격에 Microsoft 애플리케이션이 연루됐다는 보도와, 1월의 Q2 FY26 실적에서 부각된 대규모 AI 관련 자본지출 부담 및 광범위한 기술주 압박 속에 356.77달러로 마감했다. 당시 실적에서는 Azure 및 기타 클라우드 서비스가 31% 성장하며 매출이 813억 달러로 17% 증가하는 견조한 흐름을 보여, 현재 수준을 훨씬 웃도는 약 589달러 수준의 애널리스트 컨센서스 목표주가와 함께 장기 낙관론을 뒷받침했다. 트레이더들은 4월 29일에 발표될 중요한 Q3 FY26 실적을 주목하고 있으며, 이는 거시경제 변동성 속에서 AI 수요, 클라우드 마진, 가이던스 업데이트를 통해 4월 30일 종가에 영향을 미칠 수 있다. Polymarket은 별도의 법인을 통해 전 세계적으로 운영된다. Polymarket US는 CFTC 규제를 받는 지정계약시장(Designated Contract Market)인 QCX LLC d/b/a Polymarket US가 운영한다. 이 국제 플랫폼은 CFTC의 규제를 받지 않으며 독립적으로 운영된다. 거래에는 상당한 손실 위험이 수반된다. 이용약관 및 개인정보처리방침을 확인하십시오.",https://polymarket.com/event/msft-above-in-april-2026,Risk
