id,ticker,date,title,content,url,sentiment
32,MSFT,2026-03-27 09:23:23,"Northside Capital Management LLC, Microsoft Corporation $MSFT 주식 매입 - MarketBeat","Northside Capital Management LLC는 최근 공시에 따르면 4분기 동안 Microsoft Corporation(NASDAQ:MSFT - Free Report) 지분을 16.9% 늘렸습니다. 이 펀드는 해당 분기 중 11,110주를 추가 매수한 뒤 소프트웨어 대기업 주식 76,897주를 보유하고 있었습니다. Microsoft는 Northside Capital Management LLC 보유 자산의 3.2%를 차지해 6번째로 큰 포지션이 되었습니다. Northside Capital Management LLC의 Microsoft 보유 지분 가치는 최근 증권거래위원회(SEC) 신고 기준 3,718만 9,000달러였습니다.

최근 다른 헤지펀드와 기관투자자들도 이 회사의 주식을 사고팔았습니다. Procyon Advisors LLC는 4분기에 Microsoft 보유 지분을 11.2% 늘렸습니다. Procyon Advisors LLC는 지난 분기 추가로 7,840주를 매수한 뒤 현재 소프트웨어 대기업 주식 77,603주를 보유하고 있으며, 가치는 3,753만 달러입니다. Cyndeo Wealth Partners LLC는 4분기 동안 Microsoft 지분을 3.2% 확대했습니다. Cyndeo Wealth Partners LLC는 지난 분기 추가로 5,355주를 취득한 뒤 현재 소프트웨어 대기업 주식 170,553주를 보유하고 있으며, 가치는 8,248만 3,000달러입니다. Panoramic Capital Partners LLC는 4분기 동안 Microsoft 주식 포지션을 0.4% 늘렸습니다. Panoramic Capital Partners LLC는 같은 기간 추가로 70주를 취득한 뒤 현재 17,425주를 보유하고 있으며, 가치는 842만 7,000달러입니다. New England Research & Management Inc.는 4분기 동안 Microsoft 포지션을 18.4% 확대했습니다. New England Research & Management Inc.는 같은 기간 추가로 2,325주를 취득한 뒤 현재 14,955주를 보유하고 있으며, 가치는 723만 3,000달러입니다. 마지막으로 Magnus Financial Group LLC는 4분기 동안 Microsoft 주식 지분을 4.9% 늘렸습니다. Magnus Financial Group LLC는 지난 분기 추가로 1,561주를 매수한 뒤 현재 33,223주를 보유하고 있으며, 가치는 1,606만 7,000달러입니다. 주식의 71.13%는 기관투자자와 헤지펀드가 보유하고 있습니다.

최근 여러 애널리스트가 이 회사에 대해 의견을 냈습니다. TD Cowen은 1월 29일 목요일 리서치 보고서에서 Microsoft 주식에 대한 “매수” 의견을 재확인했습니다. Melius Research는 2월 9일 월요일 리서치 보고서에서 Microsoft의 목표주가를 430.00달러로 제시했습니다. Rothschild & Co Redburn은 1월 21일 수요일 리서치 노트에서 Microsoft의 목표주가를 450.00달러로 설정했습니다. UBS Group은 수요일 리서치 보고서에서 Microsoft의 목표주가를 600.00달러에서 510.00달러로 낮추고 “매수” 의견을 유지했습니다. 마지막으로 Wolfe Research는 1월 29일 목요일 리서치 노트에서 Microsoft 주식의 목표주가를 625.00달러에서 530.00달러로 하향하고 “아웃퍼폼” 의견을 제시했습니다. 두 명의 투자 애널리스트가 Strong Buy, 38명이 Buy, 5명이 Hold 의견을 제시했습니다. MarketBeat 데이터에 따르면 현재 이 회사의 종합 의견은 “Moderate Buy”이며 평균 목표주가는 588.97달러입니다.

이번 주 Microsoft에 영향을 미친 주요 뉴스는 다음과 같습니다. 다른 소식으로, EVP Kathleen T. Hogan은 3월 6일 금요일 거래에서 회사 주식 12,321주를 매도했습니다. 주식은 평균 409.52달러에 매도되었으며 총 거래금액은 5,045,695.92달러였습니다. 매도 완료 후 이 수석부사장은 회사 주식 137,933주를 보유했으며, 가치는 56,486,322.16달러였습니다. 이는 보유 지분이 8.20% 감소한 것입니다. 해당 거래는 증권거래위원회에 제출된 공시를 통해 공개되었으며, 링크를 통해 확인할 수 있습니다. 또한 이사 John W. Stanton은 2월 18일 수요일 거래에서 Microsoft 주식 5,000주를 매수했습니다. 주식은 주당 평균 397.35달러에 취득되었으며 총 가치는 1,986,750.00달러였습니다. 거래 완료 후 이사는 회사 주식 83,905주를 직접 보유하게 되었고, 가치는 약 33,339,651.75달러였습니다. 이는 보유 지분이 6.34% 증가한 것입니다. 이 매수 공시는 SEC 공시에서 확인할 수 있습니다. 기업 내부자는 주식의 0.03%를 보유하고 있습니다.

금요일 Microsoft 주가는 365.97달러에 출발했습니다. 50일 단순이동평균은 411.42달러, 200일 단순이동평균은 468.63달러입니다. Microsoft Corporation의 12개월 최저가는 344.79달러, 12개월 최고가는 555.45달러입니다. 시가총액은 2조 7,200억 달러이며, P/E 비율은 22.89배, PEG 비율은 1.41배, 베타는 1.10입니다. 부채비율(debt-to-equity ratio)은 0.09, 유동비율(current ratio)은 1.39, 당좌비율(quick ratio)은 1.38입니다.

Microsoft(NASDAQ:MSFT - Get Free Report)는 마지막으로 1월 28일 수요일 실적을 발표했습니다. 이 소프트웨어 대기업은 분기 주당순이익(EPS) 4.14달러를 보고해 컨센서스 추정치 3.86달러를 0.28달러 상회했습니다. Microsoft의 자기자본이익률(ROE)은 32.34%, 순이익률은 39.04%였습니다. 분기 매출은 812억 7,000만 달러로, 컨센서스 추정치 802억 8,000만 달러를 웃돌았습니다. 전년 동기 같은 분기에는 주당순이익이 3.23달러였습니다. 분기 매출은 전년 동기 대비 16.7% 증가했습니다. 애널리스트들은 평균적으로 Microsoft Corporation이 현재 회계연도에 EPS 13.08달러를 기록할 것으로 예상합니다.

이 회사는 최근 분기 배당금도 발표했으며, 6월 11일 목요일에 지급됩니다. 5월 21일 목요일 기준 주주에게 주당 0.91달러의 배당금이 지급됩니다. 이는 연환산 배당금 3.64달러, 배당수익률 1.0%를 의미합니다. 이 배당의 배당락일은 5월 21일 목요일입니다. Microsoft의 배당성향은 22.76%입니다.

Microsoft Corporation은 워싱턴주 레드먼드에 본사를 둔 글로벌 기술 기업입니다. 1975년 Bill Gates와 Paul Allen이 설립했으며, Microsoft는 전 세계 소비자, 기업, 정부를 대상으로 광범위한 소프트웨어 제품, 서비스, 디바이스를 개발·라이선스·지원합니다. 사업 영역은 개인용 컴퓨팅, 생산성 소프트웨어, 클라우드 인프라, 엔터프라이즈 애플리케이션, 개발자 도구, 게임까지 포괄합니다. Microsoft의 제품 포트폴리오에는 Windows 운영체제와 생산성 및 협업 도구 모음인 Microsoft 365(Office 앱, Outlook, Teams)가 포함됩니다.

다른 헤지펀드가 MSFT를 얼마나 보유하고 있는지 보고 싶으신가요? HoldingsChannel.com을 방문해 Microsoft Corporation(NASDAQ:MSFT - Free Report)의 최신 13F 공시와 내부자 거래 내역을 확인하십시오.

이 즉시 뉴스 알림은 독자들에게 가장 빠른 보도와 편향 없는 커버리지를 제공하기 위해 MarketBeat의 서술형 과학 기술 및 금융 데이터로 생성되었습니다. 이 기사에 관한 질문이나 의견은 contact@marketbeat.com으로 보내주시기 바랍니다.

Microsoft를 고려하기 전에, 이 내용을 먼저 들어보십시오. MarketBeat는 월가의 최고 평가 및 최고 성과 리서치 애널리스트와 그들이 고객에게 추천하는 종목을 매일 추적합니다. MarketBeat는 상위 애널리스트들이 고객에게 몰래 매수하라고 권하는 5개 종목을 확인했으며, 이는 광범위한 시장이 알아채기 전에 지금 매수해야 할 종목들입니다... 그리고 Microsoft는 그 목록에 없었습니다. Microsoft는 현재 애널리스트들 사이에서 Moderate Buy 의견을 받고 있지만, 최고 평가 애널리스트들은 이 5개 종목이 더 나은 매수 대상이라고 보고 있습니다.

다음 FAANG 종목이 모두 알기 전에 궁금하신가요? 링크를 클릭해 MarketBeat 애널리스트들이 차세대 1조 달러 기술 기업이 될 수 있다고 생각하는 종목을 확인하십시오. MarketBeat All Access에 가입하면 MarketBeat의 전체 리서치 도구 모음을 이용할 수 있습니다.

345 N Reid Place, Suite 620, Sioux Falls, SD 57103 contact@marketbeat.com (844) 978-6257 © MarketBeat Media, LLC 2010-2026. 모든 권리 보유.

© 2026 공정가치 가격은 매분 업데이트되며 Massive가 제공합니다. 기타 시장 데이터는 최소 10분 지연되며 Barchart Solutions에서 호스팅합니다. 제공되는 정보는 '있는 그대로' 제공되며, 거래 목적이나 조언이 아닌 정보 제공 목적에 한하며 지연될 수 있습니다. 모든 거래소 지연 및 이용 약관은 Barchart의 면책 조항을 참조하십시오.

귀하의 경험 향상을 위해 이 웹사이트 사용 정보는 당사와 파트너가 공유합니다. 자세한 내용이나 제외를 원하시면 아래의 'Do Not Sell My Information' 버튼을 클릭하십시오.",https://www.marketbeat.com/instant-alerts/filing-microsoft-corporation-msft-shares-acquired-by-northside-capital-management-llc-2026-03-27/,Neutral
33,MSFT,2026-03-27 09:15:22,"Microsoft Corporation $MSFT 보유 지분, Nordea Investment Management AB가 확대 - MarketBeat","Nordea Investment Management AB는 최근 증권거래위원회(SEC) 제출 자료에 따르면 4분기 동안 Microsoft Corporation(NASDAQ:MSFT - Free Report) 보유 지분을 0.2% 늘렸습니다. 이 회사는 해당 분기 동안 추가로 32,505주를 매수한 뒤 소프트웨어 대기업 주식 14,194,502주를 보유하고 있었습니다. Microsoft는 Nordea Investment Management AB 보유 자산의 약 5.9%를 차지해 2번째로 큰 포지션이 되었습니다. Nordea Investment Management AB는 최근 SEC 신고 기준 Microsoft 지분 0.19%를 보유하고 있으며, 가치는 68억 7,993만 3,000달러입니다.

다른 여러 기관투자자들도 MSFT 지분을 추가하거나 축소했습니다. Occidental Asset Management LLC는 4분기 동안 Microsoft 주식 포지션을 0.7% 늘렸습니다. Occidental Asset Management LLC는 지난 분기 추가로 415주를 매수한 뒤 현재 소프트웨어 대기업 주식 56,889주를 보유하고 있으며, 가치는 2,751만 3,000달러입니다. Value Partners Investments Inc.는 4분기 동안 Microsoft 주식 포지션을 1.5% 확대했습니다. Value Partners Investments Inc.는 지난 분기 추가로 1,251주를 취득한 뒤 현재 소프트웨어 대기업 주식 84,412주를 보유하고 있으며, 가치는 4,084만 달러입니다. Cooper Financial Group는 4분기 동안 Microsoft 지분을 2.3% 늘렸습니다. Cooper Financial Group는 지난 분기 추가로 1,364주를 취득한 뒤 현재 소프트웨어 대기업 주식 61,778주를 보유하고 있으며, 가치는 2,987만 7,000달러입니다. Kure Advisory LLC는 4분기 동안 Microsoft 지분을 44.7% 늘렸습니다. Kure Advisory LLC는 지난 분기 추가로 754주를 취득한 뒤 현재 소프트웨어 대기업 주식 2,440주를 보유하고 있으며, 가치는 118만 달러입니다. 마지막으로 Tounjian Advisory Partners LLC는 4분기 동안 Microsoft 보유 지분을 11.4% 확대했습니다. Tounjian Advisory Partners LLC는 지난 분기 추가로 3,036주를 취득한 뒤 현재 29,700주를 보유하고 있으며, 가치는 1,436만 4,000달러입니다. 주식의 71.13%는 헤지펀드와 기타 기관투자자가 보유하고 있습니다.

이번 주 Microsoft에 영향을 미친 주요 뉴스는 다음과 같습니다. 여러 애널리스트가 최근 MSFT에 대해 의견을 냈습니다. Mizuho는 1월 21일 수요일 리서치 노트에서 Microsoft의 목표주가를 640.00달러에서 620.00달러로 낮추고 “아웃퍼폼” 의견을 유지했습니다. UBS Group은 수요일 보고서에서 Microsoft의 목표주가를 600.00달러에서 510.00달러로 낮추고 “매수” 의견을 제시했습니다. DA Davidson은 1월 29일 목요일 리서치 보고서에서 “매수” 의견을 재확인하고 Microsoft 주식의 목표주가 650.00달러를 제시했습니다. TD Cowen은 1월 29일 목요일 리서치 노트에서 Microsoft 주식에 대해 “매수” 의견을 재확인했습니다. 마지막으로 Wolfe Research는 1월 29일 목요일 보고서에서 Microsoft의 목표주가를 625.00달러에서 530.00달러로 낮추고 “아웃퍼폼” 의견을 제시했습니다. 두 명의 투자 애널리스트가 Strong Buy, 38명이 Buy, 5명이 Hold 의견을 제시했습니다. MarketBeat 데이터에 따르면 현재 이 회사의 종합 의견은 “Moderate Buy”이며 평균 목표주가는 588.97달러입니다.

NASDAQ MSFT는 금요일 365.97달러에 출발했습니다. 회사의 quick ratio는 1.38, current ratio는 1.39, debt-to-equity ratio는 0.09입니다. Microsoft Corporation의 52주 최저가는 344.79달러, 52주 최고가는 555.45달러입니다. 이 회사의 시가총액은 2조 7,200억 달러이며, 주가수익비율(P/E)은 22.89배, PEG 비율은 1.41배, 베타는 1.10입니다. 50일 이동평균은 411.42달러, 200일 이동평균은 468.63달러입니다.

Microsoft(NASDAQ:MSFT - Get Free Report)는 마지막으로 1월 28일 수요일 실적을 발표했습니다. 이 소프트웨어 대기업은 분기 EPS 4.14달러를 보고해 애널리스트 컨센서스 추정치 3.86달러를 0.28달러 상회했습니다. Microsoft의 순이익률은 39.04%, 자기자본이익률(ROE)은 32.34%였습니다. 분기 매출은 812억 7,000만 달러로, 애널리스트 예상치 802억 8,000만 달러를 웃돌았습니다. 전년 동기 같은 분기에는 주당순이익이 3.23달러였습니다. 회사의 분기 매출은 전년 동기 대비 16.7% 증가했습니다. 리서치 애널리스트들은 평균적으로 Microsoft Corporation이 올해 EPS 13.08달러를 기록할 것으로 예상합니다.

이 회사는 최근 분기 배당도 공시했으며, 6월 11일 목요일에 지급됩니다. 5월 21일 목요일 기준 투자자에게 주당 0.91달러의 배당이 지급됩니다. 이는 연환산 기준 배당금 3.64달러, 배당수익률 1.0%를 의미합니다. 이 배당의 배당락일은 5월 21일 목요일입니다. Microsoft의 배당성향(DPR)은 현재 22.76%입니다.

다른 Microsoft 소식으로, 이사 John W. Stanton은 2월 18일 수요일 거래에서 회사 주식 5,000주를 취득했습니다. 주식은 주당 평균 397.35달러에 매수되었으며 총 거래금액은 1,986,750.00달러였습니다. 취득 완료 후 이사는 회사 주식 83,905주를 보유하게 되었으며, 가치는 약 33,339,651.75달러였습니다. 이는 보유 지분이 6.34% 증가한 것입니다. 해당 취득은 SEC 웹사이트에서 확인 가능한 SEC 공시를 통해 공개되었습니다. 또한 EVP Kathleen T. Hogan은 3월 6일 금요일 거래에서 회사 주식 12,321주를 매도했습니다. 주식은 평균 409.52달러에 매도되었으며 총 거래금액은 5,045,695.92달러였습니다. 거래 완료 후 수석부사장은 회사 주식 137,933주를 직접 보유하고 있었으며, 가치는 56,486,322.16달러였습니다. 이는 보유 지분이 8.20% 감소한 것입니다. 해당 매도의 공시는 SEC 공시에서 확인할 수 있습니다. 내부자는 회사 주식의 0.03%를 보유하고 있습니다.

Microsoft Corporation은 워싱턴주 레드먼드에 본사를 둔 글로벌 기술 기업입니다. 1975년 Bill Gates와 Paul Allen이 설립했으며, Microsoft는 전 세계 소비자, 기업, 정부를 대상으로 광범위한 소프트웨어 제품, 서비스, 디바이스를 개발·라이선스·지원합니다. 사업 영역은 개인용 컴퓨팅, 생산성 소프트웨어, 클라우드 인프라, 엔터프라이즈 애플리케이션, 개발자 도구, 게임까지 포괄합니다. Microsoft의 제품 포트폴리오에는 Windows 운영체제와 생산성 및 협업 도구 모음인 Microsoft 365(Office 앱, Outlook, Teams)가 포함됩니다.

이 즉시 뉴스 알림은 독자들에게 가장 빠른 보도와 편향 없는 커버리지를 제공하기 위해 MarketBeat의 서술형 과학 기술 및 금융 데이터로 생성되었습니다. 이 기사에 관한 질문이나 의견은 contact@marketbeat.com으로 보내주시기 바랍니다.

Microsoft를 고려하기 전에, 이 내용을 먼저 들어보십시오. MarketBeat는 월가의 최고 평가 및 최고 성과 리서치 애널리스트와 그들이 고객에게 추천하는 종목을 매일 추적합니다. MarketBeat는 상위 애널리스트들이 고객에게 몰래 지금 매수하라고 속삭이는 5개 종목을 확인했으며, 이는 더 넓은 시장이 알아채기 전에 사야 할 종목들입니다... 그리고 Microsoft는 그 목록에 없었습니다. Microsoft는 현재 애널리스트들 사이에서 Moderate Buy 의견을 받고 있지만, 최고 평가 애널리스트들은 이 5개 종목이 더 나은 매수 대상이라고 믿고 있습니다.

MarketBeat 애널리스트들이 5G에 대해 생각하는 내용과 어떤 5G 종목이 가장 유망한지 알아보려면 링크를 클릭하십시오. MarketBeat All Access에 가입하면 MarketBeat의 전체 리서치 도구 모음을 이용할 수 있습니다.

345 N Reid Place, Suite 620, Sioux Falls, SD 57103 contact@marketbeat.com (844) 978-6257 © MarketBeat Media, LLC 2010-2026. 모든 권리 보유.

© 2026 공정가치 가격은 매분 업데이트되며 Massive가 제공합니다. 기타 시장 데이터는 최소 10분 지연되며 Barchart Solutions에서 호스팅합니다. 제공되는 정보는 '있는 그대로' 제공되며, 거래 목적이나 조언이 아닌 정보 제공 목적에 한하며 지연될 수 있습니다. 모든 거래소 지연 및 이용 약관은 Barchart의 면책 조항을 참조하십시오.

당사와 파트너는 귀하의 경험 향상을 위해 이 웹사이트 사용 정보를 공유합니다. 자세한 내용이나 제외를 원하시면 아래의 'Do Not Sell My Information' 버튼을 클릭하십시오.",https://www.marketbeat.com/instant-alerts/filing-microsoft-corporation-msft-holdings-lifted-by-nordea-investment-management-ab-2026-03-27/,Neutral
