id,ticker,date,title,content,url,sentiment
1,TSM,2026-03-28 15:18:40,"대만 반도체(TSM), 타이트한 생산능력 조건 속에서도 강세 지속 - Yahoo Finance","팁: 관련 결과를 보려면 유효한 심볼 또는 특정 회사명을 입력해 보세요
치솟는 휘발유 가격으로 인해 자동차 구매 비용이 그 어느 때보다 비싸졌다. 하지만 전기차에는 기회가 열릴 수도 있다.
그 어느 때보다 많은 미국인이 개인 대출로 몰리고 있다. 그 배경은 다음과 같다.
미국인들은 여행 악몽 같은 한 주를 막 견뎌냈다. 당분간 나아질 가능성은 없다.
집을 팔려는 사람들이 임대인이 되고 있다. 세입자에게는 좋은 소식이다.
지금 시장에서는 거의 모든 것이 잘못되고 있다.
S&P 500은 하락세를 연장했고, 다우지수는 기술주가 시가총액 수십억 달러를 증발시키면서 나스닥과 함께 조정 국면에 진입했다.
상원, 공항 운영을 마비시키고 TSA 직원들을 무급으로 만든 미국 셧다운 종료 표결
미국 증시 하락, 이란 전쟁이 계속되는 가운데 나스닥은 조정 국면이 더 깊어져
트럼프가 호르무즈 해협에 대해 '저절로 열릴 것'이라고 말했다가, 이후 이 수로를 통제할 수 있는 이란의 힘을 인정하게 된 과정
SpaceX, IPO 준비를 위해 4월 투자자 설명회를 예상하라고 잠재 투자자들에게 통보 (Bloomberg)
모든 빅테크 인기 종목이 52주 고점 대비 두 자릿수 하락률을 기록 중
빅테크와 반도체주가 매도되며 나스닥이 지수를 끌어내렸고, 유가는 100달러를 넘어섰다
주택담보대출 금리가 7개월 만의 최고치로 급등, 매수자 신뢰는 '흔들렸다'
트럼프가 이란에 대해 '너무 늦기 전에' 합의하라고 경고하자 개장과 함께 주가 하락
노동 생산성이 증가하고 있다. AI 때문인지는 말하기 어렵다.
곳곳의 노동자들은 자신의 고용 안정성에 대해 끔찍한 감정을 느끼고 있다. 이유는 다음과 같다.
월가 애널리스트들은 유가가 여전히 변동성을 보이고 중동 전쟁이 장기화되면서 경기침체 확률이 높아지고 있다고 말한다
TSA 국장은 셧다운 합의가 나오더라도 여행 문제는 아마 그보다 오래 지속될 것이라며, 올여름 '퍼펙트 스톰'을 경고했다
미국과 이란 간 긴장 완화 기대에 월가가 무게를 두며 주가 상승, 유가는 100달러 아래에 머물러
메타·유튜브, 획기적 소셜미디어 중독 소송에서 책임 인정 판결 받은 것으로 보도
OpenAI가 Sora의 전원을 갑자기 끈 이유를 설명하는 2개의 차트
미국-이란 대화 기대 속 미 증시 급등, 유가는 100달러 아래로 하락
지난 100년간 두 자릿수 주가 하락을 이끈 세 가지 요인이 있다. 지금 모두 작동 중이다.
'닥터 둠'으로 알려진 이코노미스트, 이란 전쟁이 인플레이션과 금리에 중대한 함의를 가질 수 있다고 경고
CEO, 10억 달러 규모의 AI 운영 기업 시대는 이미 도래했다고 주장
의회에서 진행 중인 법안의 불리한 전개로 인해 주가가 역대 최대 폭으로 급락했다.
주식이 다시 하락세로 돌아섰고, 나스닥이 낙폭을 주도했다. 이란 전쟁이 장기화되며 유가는 급등했다.
개장과 함께 주가가 후퇴했다. 이란 전쟁이 길어지는 가운데 월요일의 급등 이후 되돌림이 나타났다
연준은 과거 유가 충격에 어떻게 대응했고, 또 어떻게 대응하지 않았는가
머스크의 '테라팹(Terafab)'이 마침내 등장했다. 이는 그의 기업들이 향하는 방향에 대한 가장 거대한 총체적 비전일 수 있다.
래리 핑크의 연례 서한은 AI와 불평등에 대한 날카로운 경고를 담았다
트럼프, 미국 동맹국들이 계획한 공격의 위험성을 경고하자 이란과의 대화를 시작 (Bloomberg)
다우지수는 600포인트 이상 급등했고, S&P 500과 나스닥은 트럼프가 이란과의 대화를 재개하겠다는 신호를 보내자 모두 1% 이상 상승했다.
트럼프가 이란 공격을 보류하고 '매우 좋은' 대화를 추진하자 미국 증시 급등
트럼프가 이란의 발전소 공격 위협을 연기한 뒤 다우 선물이 거의 1,000포인트 급등하고 유가는 급락
세계가 몰랐던, 사우디의 석유 파이프라인이 필요한 이유 (Bloomberg)
HELOC가 어떻게 바뀌었는지, 그리고 왜 일부 주택 소유자들은 새 규칙을 좋아하지 않을 수 있는지
홈헬스 보조인력은 현재 노동시장의 핵심 문제를 상징한다: 수요는 높지만 임금은 낮다
치솟는 휘발유 가격이 소비자, 인플레이션, 그리고 더 넓은 경제에 어떤 영향을 미칠지 애널리스트들이 주목하고 있다
국경 차르 호먼, ICE가 셧다운 속 공항에서 ‘비중요 업무’를 맡을 것이라고 말해 (Bloomberg)
파월, 자신과 연준에 대한 법무부 조사들이 해결될 때까지 연준 이사회에서 물러날 계획이 없다고 밝혀
이란 전쟁 장기화, 가능성 있는 금리 인상, 그리고 AI의 '보여줘' 단계
나스카르 스타 조이 로가노가 포드 딜러십에 막 투자한 이유
해외 은퇴를 고려하는 미국인이 늘고 있다. 알아야 할 사항은 다음과 같다.
항공권이 곧 더 비싸진다. 이 팁들이 비용을 아껴줄 수 있다.
트럼프, 셧다운 속 공항에 ICE 요원 배치 위협 (Bloomberg)
중고 EV가 저렴한 자동차를 찾는 미국인들에게 해답이 될 수 있는 이유
재산세가 치솟고 있다. 하지만 이를 낮추는 데에는 큰 부작용이 있다는 점을 각 주가 배우고 있다.
OpenAI, 사업 확장을 강화하며 인력 두 배로 늘린다 (Financial Times)
월가는 신속한 폭격 작전을 예상했다. 실제로 받아든 것은 에너지 전쟁이었다.
Taiwan Semiconductor Manufacturing Co. Ltd. (NYSE:TSM)는 향후 10년간 매수 후 보유할 수 있는 고성장 메가캡 종목 10선 중 하나다. 로이터는 3월 24일, 브로드컴의 한 임원에 따르면 자사 제조 파트너인 Taiwan Semiconductor Manufacturing Co. Ltd. (NYSE:TSM)가 AI 칩 수요가 계속 급증함에 따라 사실상 풀가동에 가까운 수준으로 운영되고 있다고 보도했다. 이 임원은 더 넓은 산업 전반도 공급망 제약에 직면해 있다고 덧붙였다. 그는 인쇄회로기판(PCB)과 레이저 같은 분야의 부족을 지적했으며, 이는 예상치 못한 병목으로 부상해 지연을 초래하고 있다고 말했다. 이러한 제약을 해결하기 위해 많은 고객들이 3~4년 장기 계약을 체결하고 있다. Taiwan Semiconductor Manufacturing Co. Ltd. (NYSE:TSM)도 타이트한 생산능력 조건으로 인해 고객의 계획 수립 시점이 현재 2~3년 앞서 있다고 밝혔다. 브로드컴 물리계층 제품 부문의 제품 마케팅 디렉터 나타라잔 라마찬드란은 다음과 같이 말했다. ""우리는 TSMC가 (생산능력) 한계에 도달하고 있음을 보고 있습니다. 이들은 2027년까지 생산능력을 늘릴 것이지만, 그것이 병목이 되었고, 2026년에는 공급망을 어느 정도 질식시키고 있습니다."" CEO C.C. 웨이(C.C. Wei)에 따르면, 회사는 수요를 충족하기 위해 애리조나와 대만에서 생산능력을 확대하는 데 총력을 기울이고 있다. 전 세계 최첨단 칩의 약 90%를 생산하는 Taiwan Semiconductor Manufacturing Co. Ltd. (NYSE:TSM)는 엔비디아와 애플을 주요 고객으로 두고 있다. 한편 삼성도 업계 사이클을 보다 잘 관리하기 위해 3~5년 장기 계약으로 방향을 전환하고 있다. Taiwan Semiconductor Manufacturing Co. Ltd. (NYSE:TSM)는 세계 최대의 반도체 파운드리로, 반도체 칩의 제조와 설계에 종사하고 있다. 이 칩들은 개인용 컴퓨터와 주변기기, 소비자 전자제품, 유선 및 무선 통신 시스템, 자동차 및 산업 장비 등 여러 최종 시장의 기업들에 사용된다. 우리는 TSM의 투자 잠재력을 인정하지만, 일부 AI 종목이 더 큰 상승 여력과 더 낮은 하방 위험을 제공한다고 본다. 트럼프 시대 관세와 온쇼어링 추세의 수혜도 크게 받을 수 있는 극도로 저평가된 AI 종목을 찾고 있다면, 최고의 단기 AI 종목에 대한 무료 보고서를 확인해 보라. 다음 읽을거리: 2026년에 매수 후 보유하기 좋은 미국 주식 8선과 헤지펀드에 따르면 매수하기 좋은 중형주 AI 종목 12선. 공시: 없음. Insider Monkey를 구글 뉴스에서 팔로우하세요. 팁: 관련 결과를 보려면 유효한 심볼 또는 특정 회사명을 입력해 보세요",https://finance.yahoo.com/sectors/technology/articles/taiwan-semiconductor-tsm-going-strong-151840195.html,Risk
2,TSM,2026-03-28 08:41:19,"Taiwan Semiconductor Manufacturing Company Ltd. $TSM 주식, Generali Investments CEE investicni spolecnost a.s.가 매도 - MarketBeat","미국 증권거래위원회(SEC)에 제출한 최신 13F 보고서에 따르면, Generali Investments CEE investicni spolecnost a.s.는 4분기 동안 Taiwan Semiconductor Manufacturing Company Ltd. (NYSE:TSM - Free Report) 지분을 26.0% 축소했다. 이 펀드는 해당 기간 중 9,550주를 매도한 뒤 반도체 회사 주식 27,189주를 보유하고 있었다. Generali Investments CEE investicni spolecnost a.s.의 Taiwan Semiconductor Manufacturing 보유 가치는 최근 분기 말 기준 826만 2,000달러였다. 최근 여러 다른 헤지펀드와 기관투자자들도 이 주식을 사고팔았다. Childress Capital Advisors LLC는 3분기 동안 Taiwan Semiconductor Manufacturing 보유 주식을 145.3% 늘렸다. Childress Capital Advisors LLC는 지난 분기 추가로 1,891주를 매입한 뒤 현재 반도체 회사 주식 3,192주를 보유하고 있으며, 가치는 89만 1,000달러다. Shannon River Fund Management LLC는 3분기 동안 Taiwan Semiconductor Manufacturing에 약 243만 달러 상당의 신규 포지션을 매입했다. Vanguard Personalized Indexing Management LLC는 3분기 동안 Taiwan Semiconductor Manufacturing 포지션을 9.4% 늘렸다. Vanguard Personalized Indexing Management LLC는 해당 기간 추가로 8,738주를 매입한 뒤 현재 반도체 회사 주식 101,876주를 보유하고 있으며, 가치는 2,847만 달러다. Hantz Financial Services Inc.는 3분기 동안 Taiwan Semiconductor Manufacturing 포지션을 28.6% 늘렸다. Hantz Financial Services Inc.는 해당 기간 추가로 8,284주를 매입한 뒤 현재 반도체 회사 주식 37,216주를 보유하고 있으며, 가치는 1,039만 4,000달러다. 마지막으로 Hollencrest Capital Management는 3분기 동안 Taiwan Semiconductor Manufacturing 지분을 125.3% 늘렸다. Hollencrest Capital Management는 지난 분기 추가로 2,901주를 매입한 뒤 현재 145만 7,000달러 가치의 5,216주를 보유하고 있다. 현재 주식의 16.51%는 기관투자자와 헤지펀드가 보유하고 있다. 다른 소식으로, VP Bor-Zen Tien은 3월 22일 일요일 거래에서 회사 주식 1,000주를 매입했다. 주식은 주당 평균 55.93달러에 매입됐으며, 총 거래 규모는 5만 5,930달러였다. 거래 이후 부사장은 회사 주식 9,051주를 보유하게 되었으며, 가치는 50만 6,222.43달러였다. 이는 해당 보유 지분이 12.42% 증가한 것이다. 해당 매수는 SEC에 제출된 문서에 공시됐으며, SEC 웹사이트에서 확인할 수 있다. 내부자 보유 비중은 회사 주식의 1.11%다. Taiwan Semiconductor Manufacturing 주식은 금요일 327.44달러에 개장했다. 이 주식의 50일 이동평균은 348.84달러, 200일 이동평균은 312.56달러다. Taiwan Semiconductor Manufacturing Company Ltd.의 52주 최저가는 134.25달러, 52주 최고가는 390.20달러다. 시가총액은 1조 7,000억 달러, 주가수익비율(P/E)은 30.75, PEG 비율은 0.90, 베타는 1.29다. 회사의 유동비율은 2.62, 당좌비율은 2.42, 부채비율은 0.17이다. Taiwan Semiconductor Manufacturing(NYSE:TSM - Get Free Report)은 가장 최근 분기 실적을 2월 26일 목요일에 발표했다. 이 반도체 회사는 해당 분기 주당순이익(EPS) 3.11달러를 보고했다. Taiwan Semiconductor Manufacturing의 자기자본이익률(ROE)은 34.89%, 순이익률은 45.13%였다. 해당 분기 매출은 306억 5,000만 달러였다. 애널리스트들은 Taiwan Semiconductor Manufacturing Company Ltd.가 올해 주당순이익 9.2달러를 기록할 것으로 예상한다. 회사는 또한 최근 분기 배당을 공시했으며, 배당금은 7월 9일 목요일에 지급된다. 6월 11일 목요일 기준 주주에게는 주당 0.9503달러의 배당금이 지급된다. 이는 연환산 배당금 3.80달러, 배당수익률 1.2%에 해당한다. 이 배당의 배당락일은 6월 11일 목요일이다. Taiwan Semiconductor Manufacturing의 배당성향은 현재 28.36%다. 이번 주 Taiwan Semiconductor Manufacturing에 영향을 준 주요 뉴스는 다음과 같다. 여러 증권 리서치 애널리스트들이 최근 이 회사에 대해 의견을 내놓았다. Citigroup은 1월 9일 금요일 보고서에서 Taiwan Semiconductor Manufacturing 주식에 대해 '매수' 의견을 재확인했다. Sanford C. Bernstein은 1월 2일 금요일 리서치 보고서에서 Taiwan Semiconductor Manufacturing 주식에 대해 '시장수익률 상회' 의견을 재확인했다. Weiss Ratings는 3월 20일 금요일 리서치 नोट에서 Taiwan Semiconductor Manufacturing 주식의 등급을 '보유(c+)'에서 '매수(b-)'로 상향했다. UBS Group은 12월 7일 일요일 리서치 보고서에서 Taiwan Semiconductor Manufacturing 주식에 330.00달러의 목표주가를 제시했다. 마지막으로 Wedbush는 2월 11일 수요일 리서치 नोट에서 Taiwan Semiconductor Manufacturing 주식에 대해 '시장수익률 상회' 의견을 다시 제시했다. 3명의 애널리스트가 해당 종목에 강력 매수(Strong Buy) 등급을, 10명이 매수(Buy) 등급을, 2명이 보유(Hold) 등급을 부여했다. MarketBeat 데이터에 따르면, 회사의 컨센서스 등급은 '매수'이며 평균 목표주가는 391.43달러다. Taiwan Semiconductor Manufacturing에 대한 최신 주식 분석 읽기 Taiwan Semiconductor Manufacturing Company(TSMC)는 글로벌 반도체 산업에 웨이퍼 제조 및 관련 서비스를 제공하는 대표적인 순수 파운드리다. 1987년 Morris Chang이 설립하고 대만 신주에 본사를 둔 TSMC는 팹리스 및 종합반도체기업을 대신해 집적회로를 제조하며, 다양한 기술과 제품 전반에 걸쳐 위탁 칩 생산을 제공한다. TSMC의 서비스는 로직 및 혼합신호 공정 기술, 무선주파수·전력관리·임베디드 메모리를 위한 특수 공정, 그리고 모바일·고성능 컴퓨팅·AI 애플리케이션에 사용되는 첨단 노드를 포괄한다. 이 즉시 뉴스 알림은 독자에게 가장 빠른 보도와 편향되지 않은 커버리지를 제공하기 위해 MarketBeat의 내러티브 과학 기술과 금융 데이터를 바탕으로 생성됐다. 이 기사에 관한 질문이나 의견은 contact@marketbeat.com으로 보내기 바란다. Taiwan Semiconductor Manufacturing을 고려하기 전에, 이것을 들어보는 것이 좋다. MarketBeat는 월가의 최고 등급이자 가장 성과가 좋은 리서치 애널리스트들과 그들이 고객에게 추천하는 종목을 매일 추적한다. MarketBeat는 상위 애널리스트들이 고객에게 지금 조용히 매수를 권하고 있는 다섯 종목을 파악했으며, 더 넓은 시장이 이를 알아차리기 전에 사두라고 속삭이고 있다... 그리고 Taiwan Semiconductor Manufacturing은 그 목록에 없었다. Taiwan Semiconductor Manufacturing은 현재 애널리스트들 사이에서 매수 의견을 받고 있지만, 최고 등급 애널리스트들은 이 다섯 종목이 더 나은 매수라고 본다. MarketBeat의 7개 종목 목록과 왜 이들의 장기 전망이 매우 유망한지 보려면 링크를 클릭하라. MarketBeat All Access에 가입하면 MarketBeat의 전체 리서치 도구 모음을 이용할 수 있다. 345 N Reid Place, Suite 620, Sioux Falls, SD 57103 contact@marketbeat.com (844) 978-6257 © MarketBeat Media, LLC 2010-2026. All rights reserved. © 2026 공정가치 가격은 매분 업데이트되며 Massive가 제공합니다. 기타 시장 데이터는 최소 10분 지연되며 Barchart Solutions에서 호스팅됩니다. 정보는 '있는 그대로(as-is)' 제공되며, 거래 목적이나 조언이 아닌 정보 제공 목적으로만 사용되며 지연될 수 있습니다. 모든 거래소 지연 및 이용 약관은 Barchart의 고지사항을 참고하십시오. 당사와 파트너는 귀하의 경험 개선을 위해 이 웹사이트 사용 정보를 공유합니다. 자세한 내용 또는 옵트아웃은 아래의 '내 정보를 판매하지 않기(Do Not Sell My Information)' 버튼을 클릭하십시오.",https://www.marketbeat.com/instant-alerts/filing-taiwan-semiconductor-manufacturing-company-ltd-tsm-shares-sold-by-generali-investments-cee-investicni-spolecnost-as-2026-03-28/,Neutral
