id,ticker,date,title,content,url,sentiment
5,TSM,2026-03-28 03:42:06,"¡TSM에서의 비, 열정 그리고 축구! 🌧⚽ | Santos Laguna 대 Toluca. [8b0a94] - fathomjournal.org","Fathom의 영향력 있는 주간 뉴스레터를 구독하고 9,000명 이상의 글로벌 오피니언 리더들과 함께하세요
عيد الفطر 2026 متى — 이것은 지금 많은 사람들이 묻고 있는 질문이며, 특히 문화적 또는 가족 전통과 안정적인 대사 건강 목표를 함께 고려하는 사람들에게 그렇습니다. 2026년 3월 중순 현재, 사우디아라비아의 공식 월령 관측 발표와 천문 계산을 포함한 신뢰할 수 있는 출처들은 2026년 3월 20일 금요일을 확정된 이드 알피트르(Eid al-Fitr) 시작일로 제시하고 있으며, 이는 라마단 1447 AH의 종료를 의미합니다. 날짜는 지역별 월령 관측 위원회에 따라 약간 달라질 수 있지만, 3월 20일은 이슬람 세계와 디아스포라 공동체 전반에서 널리 받아들여지는 첫째 날입니다. 미국과 유럽의 영어권 독자들 중 근거 기반 웰니스를 우선시하는 이들에게는 이 시점이 중요합니다. 이드는 한 달간의 간헐적 단식 패턴 직후에 찾아오며, 이는 어떤 사람들에게는 활력을 주지만 다른 사람들에게는 정상적인 식사가 다시 시작될 때 보상성 허기나 에너지 저하를 겪게 할 수 있습니다. 축제 자체는 공동 식사, 달콤한 음식, 모임을 중심으로 진행되며, 이 모든 것이 연중 유지하려고 애쓰는 대사 균형에 도전이 될 수 있습니다. 이 글은 날짜에 대한 맥락, 성과를 흔들지 않으면서 축제를 즐기는 현실적인 방법, 그리고 전환을 부드럽게 만드는 데 일부 사람들이 사용하는 보충제 옵션을 정리합니다. 초점은 실용적입니다. 실제로 순응을 돕는 것은 무엇인지, 근거가 약한 부분은 어디인지, 마케팅 잡음 속에서 양질의 제품을 어떻게 식별할지에 대해 다룹니다. 이드 알피트르(Eid al-Fitr), 즉 금식을 끝내는 축제는 라마단 종료 다음 날 시작됩니다. 2026년에는 확정된 관측을 기준으로 라마단이 3월 19일에 끝나므로, عيد الفطر 2026 متى는 3월 20일이 첫째 날로 정리됩니다. 축제는 일반적으로 3일간 이어지지만 관습은 다를 수 있으며, 일부 가정은 주말까지 잔치를 연장합니다. 이 날짜는 많은 서구 달력에서 금요일에 해당해, 미국이나 유럽에서는 더 긴 사회적 식사 시간이 될 수 있습니다. 이미 시간제한식이나 저탄수화물 패턴을 따르는 사람들은 라마단 동안 허기에 대한 회복력을 연습해 왔기 때문에 이 전환을 비교적 쉽게 느끼는 경우가 많습니다. 반면 꾸준한 식사로 혈당을 안정적으로 유지해 온 사람들은 달콤한 음식과 탄수화물 위주의 요리가 갑자기 등장할 때 더 큰 변동을 느낄 수 있습니다. 이 시기는 이미 대사 유연성에 익숙한 사람들, 즉 때때로 탄수화물을 순환 섭취하거나 단식 시간을 전략적으로 활용하는 사람들에게 가장 잘 맞습니다. 엄격한 일일 칼로리 통제에 의존하거나 지방 적응이 깊이 진행된 상태라면, 대추야자, 바클라바, 쌀 요리의 갑작스러운 유입은 방해가 될 수 있습니다. 요약하면, 이전에 명절 식사를 큰 탈 없이 잘 넘긴 적이 있다면 Eid 2026은 충분히 관리할 수 있습니다. 과거에 단식 후 반동이 문제였던 사람이라면 미리 계획하는 것이 도움이 됩니다. 가장 큰 장점은 사회성입니다. 함께 먹는 식사는 관계를 강화하고, 죄책감 없이 참여하는 것은 완벽한 고립보다 장기적인 일관성에 더 도움이 됩니다. 많은 사람들은 문화적 행사 동안 적절히 즐길 수 있게 허용한 뒤, 나머지 한 해의 순응도가 더 좋아졌다고 말합니다. 에너지 측면에서는 장시간 주간 단식의 종료가 처음 며칠 동안 아침 각성도를 눈에 띄게 높일 수 있습니다. 새벽 식사가 없어지면 수면 패턴이 안정되고, 물 섭취가 다시 고르게 분산되면서 수분 상태도 개선됩니다. 아쉬운 점은 양 조절이 무너지는 것입니다. 이프타르 스타일의 한 접시만 해도 탄수화물과 지방이 함께 많아 800~1200칼로리에 쉽게 도달할 수 있으며, 이는 분산된 식사보다 인슐린을 더 크게 자극합니다. 달콤한 음식은 계속 돌고 돌아 한 조각이 또 한 조각으로 이어지기도 합니다. 소화 편안함도 타격을 받습니다. 한 달간 음식량이 줄어든 뒤에는 크림이 많은 디저트나 튀김이 복부 팽만감이나 무기력을 유발할 수 있습니다. 작년에 함께 일했던 한 고객은 의지력만으로 '밀어붙이기'를 시도했습니다. 그는 방문할 때마다 마무울(maamoul) 쿠키를 잔뜩 먹으면서, 추가 산책으로 다 태워버릴 수 있다고 생각했습니다. 4일째가 되자 그는 머리가 멍해졌고, 아침 케톤 수치는 급격히 떨어졌으며, 그 뒤 2주 동안 순응도도 무너졌습니다. 실수는 음식 자체가 아니라, 이 3일 전체를 아무 제약 없는 하나의 긴 치팅 데이처럼 대했다는 점이었습니다. 라마단 단식에 대한 연구는 단기적인 대사 효과가 혼재하지만 대체로 중립적이거나 긍정적임을 보여줍니다. Nutrients에 실린 2020년 리뷰는 많은 참가자에서 인슐린 민감도 개선을 언급했으나, 기저 건강 상태와 비단식 시간의 식사 구성에 따라 결과가 달랐습니다. New England Journal of Medicine은 라마단 패턴과 유사한 간헐적 단식 프로토콜을 다루며, 총 섭취량이 통제될 때 포도당 조절에 이점이 있을 수 있다고 제시했습니다. 라마단 이후 전환에 대한 데이터는 더 부족합니다. Journal of Translational Medicine(2019)의 한 연구를 포함한 소규모 시험들은 정제 탄수화물 과다 섭취로 인해 이드 이후 일주일 동안 일시적인 체중 증가와 인슐린 급등을 관찰했습니다. Mayo Clinic 같은 기관의 명절 식사 패턴에 대한 대규모 코호트 연구는 하루에 한 번 정도의 의식적인 즐김과 같은 느슨한 경계를 설정한 사람들이 무제한 섭취자보다 체중을 덜 되찾는다는 점을 보여줍니다. 고품질 근거에는 한계가 있습니다. 대부분의 라마단 연구는 4~8주 동안 진행되고, 표본이 작으며(종종 100명 미만), 보충제 사용이나 정확한 음식 선택을 항상 통제하지도 않습니다. 때로는 긍정적으로 해석하려는 문화적 이해관계가 있는 지역 보건 기관의 자금 지원을 받기도 합니다. Eid al-Fitr 2026 또는 이와 유사한 날짜를 따라 대사 지표를 추적하는 대규모 무작위 시험은 없습니다. 결론적으로, 라마단 동안의 단식은 많은 사람에게 대사 유연성을 돕지만, 재급식 단계에는 반동 문제를 피하기 위한 의도적인 구조가 필요합니다. 보충제는 간극을 메우는 데 도움이 될 수 있지만, 신중한 식사를 대체하지는 못합니다. 이드 전후에 사람들이 흔히 찾는 보충제에는 전해질 블렌드(잔여 탈수 완화용), 포만감을 위한 차전자피나 이눌린 같은 섬유질 공급원, 그리고 탄수화물 의존 없이 안정적인 에너지를 주는 외인성 케톤이나 MCT 오일이 있습니다. 마그네슘 글리시네이트는 바뀐 일과 이후 수면과 근육 이완을 위해 자주 등장합니다. 제형도 중요합니다. 분말은 물에 쉽게 섞이지만 무향이면 분필 같은 식감이 날 수 있습니다. 캡슐은 편리하지만 용량 조절 유연성은 떨어집니다. 구미는 복용 순응도를 높여준다고 약속하지만, 보통 1회 제공량당 2~4g의 첨가당을 포함해 탄수화물 제한을 목표로 할 때는 역효과입니다. 품질 신호: 라벨의 GMP 인증, 제3자 시험 결과(NSF, USP, ConsumerLab 마크), 투명한 원료 출처(예: 모호한 'MCT 오일' 대신 '지속가능한 팜에서 추출한 C8 MCT')를 확인하세요. 핵심 활성 성분에 대해 'proprietary blend'라고 표기한 제품은 피하세요. 이는 저용량 사용을 숨기기 때문입니다. 나는 지난 라마단-이드 주기에 인기 있는 MCT C8 파우더를 시험해 봤다. 질감은 부드러웠고 거칠지 않았으며, 무광택의 기름막 없이 블랙커피에 빠르게 녹았다. 맛은 중립적이었고, 이미 대추야자로 배가 부른 상태에서는 중요했다. 에너지는 약 4시간 동안 고르게 유지됐고, 급락은 없었다. 경쟁 브랜드의 향료가 들어간 제품은 인공적인 뒷맛을 남겼고 첫 복용 때 약간의 위장 불편을 유발했다. 이드 전환기에 사람들이 고려하는 다섯 가지 보충제 범주를 간단히 비교하면 다음과 같다. 용량은 사용자 보고와 라벨의 현실성을 바탕으로 한 전형적인 유효 범위를 반영한다. 섬유질과 전해질 옵션은 대부분의 사람에게 명절 기간을 헤쳐 나갈 때 일상적인 가치가 가장 좋다. 목표부터 정하라. 식사 중 포만감인지, 안정적인 에너지인지, 아니면 소화 편안함인지? 그 우선순위에 맞는 제품을 선택하라. 경고 신호: 주의 문구 없는 화려한 전후 사진, 명시된 자격이 없는 '의사가 만든' 문구, 또는 30회 제공분에 10달러 미만의 가격(대개 필러가 많은 제형을 의미함). 자주 하는 실수 중 하나는 이드 당일에 새 보충제를 시작하는 것이다. 한 친구는 가족 모임 중 처음으로 고용량 BHB 케톤을 시도했다가, 디저트 중간에 복통이 와버렸다. 진한 음식과 검증되지 않은 내성의 조합은 잘 맞지 않았다. 명절 5~7일 전에 미리 시험해 보는 것이 더 낫다. 또 하나는 섬유질 증량을 무시하는 것이다. 저섬유질 단식 후 곧바로 차전자피 10g으로 뛰어들면 가스가 생기기 쉽다. 일주일 전부터 3~5g으로 시작하라. 보충제에만 의존하고 접시 전략을 무시하는 것도 역효과를 낳는다. 아무 분말도 끝없는 바클라바 양을 해결해 주지 못한다. 정확히 언제 عيد الفطر 2026 متى가 확정되었는가? 2026년 3월 20일 금요일은 사우디아라비아의 월령 관측과 이를 뒷받침하는 천문 데이터에 근거한 널리 인정되는 첫날이다. 일부 지역은 지역 위원회의 판단에 따라 3월 21일 토요일을 관측할 수 있다. 보충제가 이드 식사 동안 정말 도움이 될까? 도움이 될 수는 있다. 전해질은 탈수 변화로 인한 두통을 막아주고, 섬유질은 포만감을 늘리며, MCT는 빠른 연료를 제공한다. 하지만 가장 효과적인 것은 적절한 양 조절과 식후 걷기와 함께할 때다. 구미는 대사 목표에 좋은 선택일까? 대체로 아니다. 대부분은 이미 달콤한 음식에 직면한 상황에서 혈당을 자극할 정도의 첨가당을 포함한다. 캡슐이나 분말이 더 깔끔한 전달 방식을 제공한다. 이 시기에 어떤 사람은 특정 보충제를 피해야 할까? 활동성 역류가 있는 사람(MCT는 하부식도괄약근을 이완시킬 수 있음), 당뇨약을 복용 중인 사람(외인성 케톤이 인슐린 필요량에 영향을 줄 수 있음), 위장관 불내성이 쉬운 사람(서서히 도입하지 않은 고섬유질 제품)이다. 제품이 값어치를 하는지 어떻게 알 수 있을까? 제3자 시험, 투명한 용량 표시, 그리고 과장 광고보다 포만감 지속 시간 같은 실제 효과에 초점을 맞춘 사용자 후기를 확인하라. 소용량으로 먼저 시험해 보라. 3월 20일 일주일 전부터 부담 없는 방식으로 시작해 보라: 평소 루틴은 유지한 채 보충제 하나(예: 아침과 저녁 전해질)를 추가한다. 아침 에너지, 복부 팽만감, 그리고 오후 중반 허기 정도를 1~10점 척도로 기록한다. 이드 당일에는 마음에 드는 요리 한두 가지를 신중하게 고르고, 계획한 대로 보충제를 사용한 뒤 다음 날 아침의 느낌을 기록한다. 에너지가 일정하고 소화가 편안하다면 계속하라. 급격한 피로, 위장 문제, 또는 차이가 없다면 중단하라. 억지로 할 필요는 없다. 목표는 완벽함이 아니라, 다음 해의 축제를 더 쉽게 만들 수 있도록 데이터를 모으는 것이다.
루카스 베넷 – 실용적 퍼포먼스 최적화 전문가
나는 케토 순응과 대사 퍼포먼스를 지원하도록 설계된 보충제를 테스트하는 일을 전문으로 한다. 지난 5년간 개인적으로 80개 이상의 소비자 제품을 검토하며, 이들이 식욕 조절, 일상적 일관성, 소화 편안함, 장기 사용성에 어떤 영향을 미치는지 분석해 왔다. 품질 보증과 원료 소싱에 대한 내 배경은 표면적인 주장 이상으로 제형 기준을 평가하는 데 도움이 된다. 나는 보충제가 진정으로 지속 가능한 습관을 지원하는지 같은 실용적 결과에 초점을 맞춘다. 이 정보는 교육 목적이며 의료 조언으로 해석되어서는 안 된다.
국가: 미국, 호주, 영국. 도시: 디모인, 프리몬트, 그린베이, 레이크우드, 유니언시티
TSM 코로나 경기장에서 잊지 못할 밤! 폭우에도 불구하고, 산토스 라구나와 톨루카의 경기를 전사의 팬들의 열기와 함께 click through the next site 느꼈다 have a peek at these guys. 💚⚔️ 쏟아지는 비를 맞으며 도착한 순간부터, 젖었지만 뜨거웠던 분위기, 그리고 경기의 최고의 장면들까지, 산토스 라구나의 홈에서의 이 특별한 경험을 step by step please click the next website page로 전해드립니다. 🌧🔥 ⚽ 더 많은 모험을 위해 구독하는 것을 잊지 마세요! 이번 격주 우리의 목소리는 데이비드 마코프스키와 함께하는 Decision Points 팟캐스트입니다 - 헤즈볼라의 참수? 이스라엘과의 전쟁과 레바논의 미래",https://fathomjournal.org/068cdce2smm/3d188a7f-djoLJZufFV4.html,Neutral
