id,ticker,date,title,content,url,sentiment
32,UNH,2026-03-26 17:01:48,"라 밸리, 농촌 보건 교육 담당 집행이사로 임명 - 뉴햄프셔 대학교","UNH 보건·인간서비스대학의 크리스틴 코라치니 학장은 켄 라 밸리가 즉시 발효되는 농촌 보건 교육 담당 집행이사로 임명됐다고 발표했다. 이 새로운 직책에서 라 밸리는 뉴햄프셔에 새로 설립된 주지사실 산하 새로운 기회 및 농촌 혁신 보건 사무국(GO-NORTH)에 대한 UNH의 기여를 이끌게 된다. 코라치니는 “신뢰받는 관계의 탄탄한 기반 없이는 이 일은 불가능하다”며 “켄은 UNH와 뉴햄프셔에 수년간 탁월한 공헌을 해왔고 … 지속적인 파트너십과 지역사회 기반 협력을 통해 쌓은 경험과 신뢰도는 그를 우리의 중요한 업무를 진전시키고, 주 전역의 계획이 진행됨에 따라 농촌 공동체를 지원하는 데 필요한 참여, 파트너십, 전달 인프라를 갖추는 일에 매우 적합하게 만든다”고 말했다. 농촌 보건 교육 담당 집행이사로서 라 밸리는 뉴햄프셔의 농촌 보건 인력 개발 노력을 지원하는 더 넓은 대학 전략의 일환으로, 대학의 농촌 공동체 및 이해관계자 참여를 이끌게 된다. 그는 대학 전반의 동료들과 주 전역의 파트너들과 긴밀히 협력해 지역사회에 내재된 참여 방식을 강화하고 지역 주도형 인력 개발을 지원할 예정이다. 라 밸리는 UNH에서 동물학 학사 학위를, 로드아일랜드대학교에서 수산·동물·수의과학 석사와 환경과학 박사 학위를 받았다. 그는 앞서 10년 넘게 UNH 협동확장센터의 학장 겸 센터장을 지냈으며, 이후 대외협력 및 참여 담당 부총장으로 임명됐고, 최근에는 대외협력 및 온라인학습 담당 부총장을 역임했다. 라 밸리는 “지역사회 파트너십과 전달에 초점을 맞춘 역할을 통해 계속해서 뉴햄프셔에 기여하게 되어 영광”이라며 “이 일은 경청과 신뢰에서 시작된다. 나는 상호적 대외협력을 강화하고, 주 전역의 농촌 보건 목표를 혁신적인 인력 솔루션과 지속적인 지역사회 영향으로 전환하는 데 도움이 되는 견고한 파트너십을 구축하기를 기대한다”고 말했다. UNH의 농촌 보건 이니셔티브에 대해 더 알아보려면 이니셔티브 웹페이지를 방문하면 된다. 저작권 © 2026, University of New Hampshire. 무단 전재 및 재배포 금지.",https://www.unh.edu/news/2026/03/la-valley-named-executive-director-rural-health-education,Neutral
33,UNH,2026-03-26 15:58:55,"네이선 퓨리, 제1대 로버트 섬머스 생물학 석좌교수로 임명 - 뉴햄프셔 대학교","UNH 생명과학·농업대학(COLSA) 생물과학과 부교수인 네이선 퓨리가 제1대 로버트 섬머스 생물학 석좌교수로 임명됐다. 자선가 로버트 섬머스의 100만 달러 기부로 설립된 이 새로운 석좌는 탁월한 연구와 대학원생 멘토링에 대한 강한 헌신을 인정하기 위한 것이다. 이 상은 교수 수혜자와 그들의 대학원생 모두에게 직접적인 지원을 제공해 멘토링과 연구 우수성을 촉진하도록 설계됐다. 뉴햄프셔 농업실험장의 연구 담당 부학장 겸 소장인 안톤 베커만은 “강력한 대학원생 멘토링은 과학적 발견을 촉발하는 새로운 아이디어와 혁신을 이끌어내는 데 도움이 된다. 로버트 섬머스 생물학 석좌교수는 UNH 연구자 같은 네이선 퓨리가 내일의 과학자들이 호기심을 따르고, 매우 까다로운 질문에 대한 답을 찾고, 아이디어와 혁신을 현실로 만들어 가도록 멘토링하고, 지도하고, 역량을 부여할 수 있음을 보여주는 훌륭한 기부 활용 사례”라고 말했다. 퓨리의 연구실은 수중 동물의 이동, 주로 어류를 다루지만 해조류와 갑각류도 연구한다. 쉽게 말해, 퓨리와 그의 학생들은 동물들이 어디로 가는지와 왜 그렇게 이동하는지를 연구한다. 한 가지 중점 분야는 바다에서 민물로 이동해 산란하는 어류의 산란 회유로, 이는 육지와 바다를 연결한다. 번식 외에도 그의 연구실은 또 다른 이동 동기를 조사한다. 퓨리는 “동물들은 종종 먹이를 찾고, 자신이 먹히는 것을 피하기 위해 움직인다”고 말한다. “우리는 뉴잉글랜드 해안에서 식량 가용성과 질의 변화가 생태계 내 동물들의 이동과 성공에 어떤 영향을 미치는지 살펴보는 다양한 프로젝트를 진행하고 있다. 나는 제1대 로버트 섬머스 생물학 석좌교수로 임명돼 영광이며, UNH의 연구 우수성에 매우 중요한 대학원생들을 지원해 준 로버트의 후원에 깊이 감사한다”고 퓨리는 덧붙였다. “대학원생들은 현장과 실험실에서 과학의 진전을 정말로 이끈다.” 석좌교수 재원은 퓨리 연구실의 연구를 중요한 방식으로 촉진할 것이다. 현장 조사를 직접 지원하고, 그의 학생들이 여름 연구에 참여하고, 학회에 참석하며, 혁신적이고 흥미로운 새 프로젝트를 개발할 기회를 확대해 줄 것이다. 이 석좌를 설립한 관대한 기부는 과학적 탐구와 교육을 진전시키려는 섬머스의 오랜 관심과, 생명과학 분야 교수진과 대학원생 모두를 위한 학문 환경을 강화하려는 그의 목적을 반영한다. 섬머스의 직업 경력은 미국지질조사국(USGS)에서 이루어졌으며, 그는 단층대에 저장된 고압 암석 변형과 지진 발생원 에너지를 연구하며 뛰어난 경력을 쌓았다. 그의 연구는 지진학자들이 수집한 방출 에너지 데이터와 결합되어 지진 과정을 더 잘 이해하는 데 핵심적 역할을 했다. 그러나 결국 그를 UNH와 연결한 것은 베이 에어리어의 전혀 다른 종류의 연구를 도왔던 경험이었다. 섬머스는 “나는 [현재 UNH 생물학 교수인] 제시카 볼커가 버클리에서 대학원생으로 철갑상어 배아와 발달을 연구할 때 그녀를 만났다”며 “가능할 때마다 실험실에서 여러 발달 단계를 추적하는 일을 도왔다. 이후로도 연락을 이어왔고, 제시카는 UNH 생물학과에서 지원할 만한 좋은 일들이 많이 일어나고 있다고 말했다”고 전했다. COLSA 생물과학과 학과장 겸 부교수인 엘리자베스 하비는 “로버트 섬머스가 우리 교수진과 대학원생들의 우수성을 인정해 준 것은 진정으로 감사할 일이며, 네이선 퓨리는 탁월한 연구와 대학원생 멘토링을 인정하려는 로버트 섬머스 생물학 석좌교수의 취지를 완벽하게 구현한다”고 말했다. “그는 어류 생태와 동물 이동 분야에서 국제적으로 인정받는 연구 프로그램을 구축했다. 마찬가지로 중요한 것은, 그는 협력적 지원을 통해 매우 숙련되고 독립적인 젊은 과학자들을 양성하는 뛰어난 대학원생 멘토라는 점이다.” 저작권 © 2026, University of New Hampshire. 무단 전재 및 재배포 금지.",https://www.unh.edu/news/2026/03/nathan-furey-appointed-first-robert-summers-professor-biology,Neutral
34,UNH,2026-03-26 13:19:38,"UNH, 지속가능 식품 시스템 분야 토머스 W. 하스 석좌교수직 발표 - 뉴햄프셔 대학교","뉴햄프셔 대학교는 농업·영양·식품시스템학과의 어시스턴트 교수인 아날레나 브루스가 지속가능 식품 시스템 분야 토머스 W. 하스 석좌교수로 임명됐다고 발표했다. 이 임명은 뉴햄프셔와 뉴잉글랜드에서 지속가능하고 공정하며 회복력 있는 식품 시스템을 발전시키는 UNH 교수진을 인정하는 것이다. 하스 석좌교수직은 장기적 파트너십을 육성하고, 연구를 현실 세계의 실천과 연결하며, 주와 지역 전반의 식품 시스템 개발 노력을 진전시키기 위한 전용 자원을 제공한다. 브루스는 공공 대외 홍보와 참여를 강화해 자신의 연구 범위와 영향을 넓히는 데 이 석좌교수직을 활용할 계획이다. 그녀의 연구는 지역 전반에서 건강한 식품에 대한 접근성을 강화하기 위해 노력하는 뉴햄프셔 농민들과 지역사회 단체들을 지원하는 데 초점을 맞출 것이다. 브루스는 “이 인정을 겸허하게 받아들이며, 더 직접적인 파트너십을 통해 지역사회 단체들과의 협력을 심화할 기회에 매우 기대가 크다”며 “내 경험으로 볼 때, 사회를 위한 연구의 혜택은 학문적 환경 밖에서의 공동 학습, 지식 교환, 협력을 위한 역량 부족으로 종종 제한된다. 이 직책은 지역사회 구성원들과 함께 일하고 연구 결과가 폭넓은 청중에게 접근 가능하고 유용하도록 보장하는 새로운 기회를 만든다”고 말했다. 어시스턴트 교수 역할 외에도 브루스는 UNH 푸드 시스템 랩의 소장으로, 소규모 및 중규모 농장을 지원하고 농장의 지속가능성을 높이며 영양가 있는 식품에 대한 공정한 접근을 보장하기 위해 설계된 시장에서의 공공 참여에 관한 연구를 이끈다. 그녀의 현재 연구는 농민들이 더 큰 시장에 도달하면서도 지속가능성과 투명성과 같은 공유 가치를 지키고 생존을 뒷받침하는 가격을 유지할 수 있도록 돕는 협력적 집적 및 마케팅 접근법에 초점을 맞추고 있다. 농업·영양·식품시스템학과 학과장 겸 교수인 베키 시드먼은 “이 기회는 아날레나가 자신의 식품 시스템 연구를 교실로 가져와 학생들이 식품 시스템과 직접 교류하고 그들에게 영감을 주는 지역사회 단체들과 연결될 수 있는 기회를 제공함으로써 혜택을 주는 역량을 강화할 것”이라고 말했다. UNH 생명과학·농업대학(COLSA)의 학부 및 전문 학사과정 담당 부학장인 제시 스태빌 모렐은 이 임명이 브루스가 최근 대학에 합류한 UNH 협동확장센터와 뉴햄프셔 푸드 얼라이언스와의 협력을 확대할 수 있게 해줄 것이라고 밝혔다. 그녀는 “이 임명은 주 전역의 식품 시스템 회복력을 지원하기 위한 연구, 교육, 대외협력 노력을 더욱 강하게 통합하는 데 도움이 될 것”이라고 말했다. 토머스 W. 하스 석좌교수직은 2013년 뉴햄프셔 자선재단을 통해, 현재 COLSA의 일부인 UNH 지속가능성 연구소에 대한 100만 달러 기부로 설립됐다. 이 기부금은 더럼의 자선가 톰 하스가 설립한 기부자 지정 기금에서 조성됐으며, 그의 지원은 지속가능성과 지역사회 복지에 대한 오랜 헌신을 반영한다. 저작권 © 2026, University of New Hampshire. 무단 전재 및 재배포 금지.",https://www.unh.edu/news/2026/03/unh-announces-thomas-w-haas-professorship-sustainable-food-systems,Neutral
35,UNH,2026-03-26 13:19:38,"윌프리드 볼하임, 기후 및 지속가능성 분야 조세핀 A. 램프리 석좌교수로 임명 - 뉴햄프셔 대학교","천연자원·환경학과 교수인 윌프리드 볼하임이 조세핀 A. 램프리 기후 및 지속가능성 석좌교수직을 수여받았다. 이 석좌교수직은 중대한 기후, 물, 에너지, 지속가능성 문제를 다루기 위해 만들어졌으며, 지역 기후과학 연구, 지속가능 기술, 과학을 정책 행동으로 전환하는 일을 지원한다. UNH 수자원 분석 그룹의 공동 책임자이기도 한 볼하임은 하천, 강, 습지, 호수, 저수지 같은 담수 생태계가 영양분을 어떻게 처리하고 수질에 어떤 영향을 미치는지를 연구하며, 특히 폭풍과 가뭄 사건에 대한 반응에 초점을 맞춘다. 연구는 질소와 탄소 같은 영양분이 하천망을 통해 어떻게 이동하는지, 그리고 담수 시스템이 이러한 물질을 하류의 호수와 연안 수역으로 보존, 변환 또는 운반하는 방식을 다룬다. 현장 관측, 센서 네트워크, 실험, 환경 모델링을 결합해 그의 연구는 작은 상류 하천에서 전체 유역에 이르기까지 다양한 규모의 과정을 살펴본다. 볼하임의 연구는 또한 토지 이용 변화, 기후 변화, 인간 인프라가 영양 순환과 생태계 건강에 미치는 영향도 탐구한다. 볼하임은 “기후 및 지속가능성 분야 램프리 석좌교수로 선정돼 영광”이라며 “이 자리를 통해 사람들이 환경과 함께 어떻게 번영할 수 있는지, 증가하는 가뭄 빈도와 극단적 강수 같은 환경 변화에 생태계가 어떻게 반응하는지, 그리고 인간 활동의 영향을 받은 생태계를 복원해 변화하는 기후 속에서 더 건강하고 지속가능하게 만들 수 있는지를 더 잘 이해하는 데 기여하고 싶다”고 말했다. 뉴햄프셔에서 볼하임의 연구는 주 기관과 지역사회가 영양염 오염을 더 잘 이해하고, 식수 공급을 보호하며, 복원 작업을 포함해 강, 호수, 연안 생태계를 관리하는 데 도움을 준다. 그의 연구는 주 전역의 수질과 건강한 수생 시스템을 유지하는 데 도움이 되는 과학 기반 의사결정을 지원한다. 천연자원·환경학과 학과장 겸 교수인 레베카 로는 “이 기금형 석좌교수직은 윌의 담수 생태계에 대한 영향력 있는 연구뿐 아니라, 과학을 현실 세계의 적용과 연결하려는 그의 헌신도 인정한다”며 “이는 천연자원을 보호하고 지속가능한 지역사회 주도형 해법을 육성하려는 우리의 약속을 보여준다”고 말했다. COLSA 학사 담당 부학장인 킴벌리 J. 배빗은 “이 상은 매우 적절하다”며 “윌프리드 볼하임은 자신의 분야에서 국제적으로 존경받는 리더이자 뛰어난 연구자일 뿐만 아니라, 학생들도 그를 다음 세대 문제 해결사를 양성하는 데 깊이 헌신하는 뛰어난 교육자로 알고 있다”고 말했다. 2012년 이 석좌교수직을 설립한 조세핀 A. 램프리 ’22H는 사업가이자 환경 선구자였고, UNH의 지속가능성 프로그램 후원자였다. 그는 석좌교수직과 함께 UNH 지속가능성 연구소의 기후 펠로우, 쇼얼스 해양연구소의 그린 그리드, 카시 공공정책대학원의 사회혁신 프로그램을 지원하는 기부도 했다. 2014년 그는 UNH 재단 이사회에 합류해 8년간 이사로 활동했다. 2022년에는 기후 연구와 교육, 자선활동, 자원봉사에 대한 공로로 명예학위를 받았으며, 이 공헌은 대학과 주에 오래 지속되는 영향을 미쳤다. 현재의 지속가능성 실천을 자신이 자란 농업적 삶의 방식과 자주 비교하곤 했던 램프리는 2023년 세상을 떠났다. 저작권 © 2026, University of New Hampshire. 무단 전재 및 재배포 금지.",https://www.unh.edu/news/2026/03/wilfred-wollheim-named-josephine-lamprey-professor-climate-sustainability,Neutral
36,UNH,2026-03-26 10:36:03,"Erste Group Bank, UNH 실적에 대해 긍정적 전망 제시 - MarketBeat","UnitedHealth Group Incorporated(NYSE:UNH - Free Report) - Erste Group Bank의 애널리스트들은 3월 24일 화요일에 발표한 리서치 보고서에서 UnitedHealth Group의 FY2027 주당순이익(EPS) 추정치를 상향했다. Erste Group Bank의 애널리스트 H. Engel은 이제 이 헬스케어 대기업이 해당 연도 주당 19.77달러의 이익을 낼 것으로 예상하고 있으며, 이는 이전 추정치 19.71달러에서 상향된 수치다. UnitedHealth Group의 현재 회계연도 연간 실적에 대한 컨센서스 추정치는 주당 29.54달러다. UNH는 다른 여러 보고서의 대상이 되기도 했다. Weiss Ratings는 3월 2일 월요일 보고서에서 UnitedHealth Group의 투자의견을 '보유(c-)'에서 '매도(d+)'로 하향했다. JPMorgan Chase & Co.는 2월 2일 월요일 리서치 보고서에서 UnitedHealth Group의 목표주가를 425.00달러에서 389.00달러로 낮추고, 회사에 대해 '비중확대(overweight)' 의견을 제시했다. UBS Group은 1월 28일 수요일 리서치 보고서에서 UnitedHealth Group 주식의 목표주가를 430.00달러에서 410.00달러로 낮추고 해당 종목에 '매수(buy)' 의견을 제시했다. Barclays는 1월 30일 금요일 리서치 보고서에서 UnitedHealth Group 주식의 목표주가를 391.00달러에서 327.00달러로 낮추고 회사에 대해 '비중확대(overweight)' 의견을 제시했다. 마지막으로 Royal Bank Of Canada는 1월 28일 수요일 리서치 보고서에서 UnitedHealth Group 주식의 목표주가를 408.00달러에서 361.00달러로 낮추고 해당 종목에 '시장수익률 상회(outperform)' 의견을 제시했다. 한 명의 주식 애널리스트는 이 종목에 '강력 매수(Strong Buy)' 의견을, 17명은 '매수(Buy)' 의견을, 8명은 '보유(Hold)' 의견을, 2명은 '매도(Sell)' 의견을 제시했다. MarketBeat 데이터에 따르면 UnitedHealth Group의 평균 투자의견은 '중립적 매수(Moderate Buy)'이며 평균 목표주가는 372.13달러다. UNH 주식은 목요일 270.48달러에 출발했다. 이 주식의 시가총액은 2,455억 1,000만 달러, 주가수익비율(P/E)은 20.51, 주가수익성장비율(PEG)은 1.25, 베타는 0.41이다. 50일 이동평균가는 293.25달러, 200일 이동평균가는 323.43달러다. UnitedHealth Group의 1년 최저가는 234.60달러, 1년 최고가는 606.36달러다. 회사의 유동비율은 0.79, 당좌비율은 0.79, 부채비율은 0.72다. UnitedHealth Group(NYSE:UNH - Get Free Report)은 지난 1월 27일 화요일 분기 실적을 발표했다. 이 헬스케어 대기업은 해당 분기 주당순이익(EPS) 2.11달러를 보고해 시장 예상치 2.09달러를 0.02달러 상회했다. 회사의 분기 매출은 1,137억 3,000만 달러로, 컨센서스 추정치 1,133억 8,000만 달러를 웃돌았다. UnitedHealth Group의 순이익률은 2.69%, 자기자본이익률(ROE)은 14.79%였다. 분기 매출은 전년 동기 대비 12.3% 증가했다. 전년 동기 같은 분기에는 주당 6.81달러의 이익을 기록했다. UnitedHealth Group은 FY2026 가이던스를 주당 17.750- EPS로 제시했다. 최근 여러 기관투자가와 헤지펀드가 UNH 보유 비중을 조정했다. North Capital Inc.는 3분기 동안 UnitedHealth Group 지분을 16.2% 늘렸다. North Capital Inc.는 지난 분기 추가로 27주를 매입한 뒤 현재 6만 7,000달러 상당의 헬스케어 대기업 주식 194주를 보유하고 있다. Sunflower Bank N.A.는 3분기 동안 UnitedHealth Group 지분을 1.5% 늘렸다. Sunflower Bank N.A.는 같은 기간 추가로 28주를 취득한 뒤 현재 66만 2,000달러 상당의 헬스케어 대기업 주식 1,916주를 보유하고 있다. Axis Wealth Partners LLC는 3분기 동안 UnitedHealth Group 지분 보유를 1.7% 늘렸다. Axis Wealth Partners LLC는 지난 분기 추가로 28주를 취득한 뒤 현재 56만 3,000달러 상당의 헬스케어 대기업 주식 1,631주를 보유하고 있다. Abound Wealth Management는 3분기 동안 UnitedHealth Group 보유 지분을 13.5% 확대했다. Abound Wealth Management는 지난 분기 추가로 29주를 매입한 뒤 현재 8만 4,000달러 상당의 헬스케어 대기업 주식 244주를 보유하고 있다. 마지막으로 Founders Capital Management LLC는 4분기 동안 UnitedHealth Group 주식 보유를 3.0% 늘렸다. Founders Capital Management LLC는 지난 분기 추가로 29주를 매입한 뒤 현재 32만 4,000달러 상당의 헬스케어 대기업 주식 982주를 보유하고 있다. 이 주식의 87.86%는 기관투자가가 보유하고 있다. 회사는 최근 분기 배당도 ঘোষণা했으며, 이는 3월 17일 화요일 지급됐다. 3월 9일 월요일 기준 주주들에게 주당 2.21달러의 배당금이 지급됐다. 배당락일은 3월 9일 월요일이었다. 이는 연환산 기준 8.84달러의 배당금과 3.3%의 배당수익률을 의미한다. UnitedHealth Group의 배당성향(DPR)은 현재 67.02%다. 이번 주 UnitedHealth Group에 영향을 미치는 주요 뉴스는 다음과 같다. UnitedHealth Group Inc는 미네소타주 미네통카에 본사를 둔 다각화된 헬스케어 회사로, UnitedHealthcare와 Optum 두 개의 주요 사업 플랫폼을 운영한다. 1977년에 설립된 이 회사는 개인, 고용주, 정부 기관 및 기타 조직을 대상으로 광범위한 건강보험 혜택과 의료 서비스를 제공한다. 사업 영역은 민간 고용주 후원 플랜, 개인 및 Medicare·Medicaid 프로그램, 그리고 미국과 일부 해외 시장의 고객 및 의료 시스템을 위한 서비스까지 포괄한다. UnitedHealthcare는 회사의 보험 혜택 사업으로, 건강보험 플랜과 네트워크를 운영하고, 의료 제공자와의 관계를 관리하며, 고용주·개인·정부 지원 프로그램을 위한 보장 상품을 제공한다. 이 속보 알림은 독자에게 가장 빠른 보도와 편향 없는 커버리지를 제공하기 위해 Narrative Science 기술과 MarketBeat의 금융 데이터를 바탕으로 생성됐다. 이 기사에 대한 질문이나 의견은 contact@marketbeat.com으로 보내달라. UnitedHealth Group을 고려하기 전에, 이 내용을 먼저 들어보길 바란다. MarketBeat는 월가 최고 평가 애널리스트들과 최고의 성과를 내는 애널리스트들을 추적하며, 그들이 고객에게 매일 추천하는 종목을 관리한다. MarketBeat는 광범위한 시장이 인지하기 전에 지금 고객에게 매수를 조용히 권하는, 최고 애널리스트들이 꼽은 5개 종목을 확인했다. 그리고 UnitedHealth Group은 그 목록에 없었다. UnitedHealth Group은 현재 애널리스트들 사이에서 중립적 매수(Moderate Buy) 의견을 받고 있지만, 최고 평가 애널리스트들은 이 5개 종목이 더 나은 매수 대상이라고 본다. 관세와 기타 경제적 불확실성에도 불구하고 2026년에 급등할 것으로 예상되는 10개 종목 목록을 보려면 링크를 클릭하라. 이 10개 종목은 매우 견고하며 어떤 경제 환경에서도 성장할 가능성이 높다. MarketBeat의 전체 리서치 도구를 이용하려면 MarketBeat All Access에 가입하라. 345 N Reid Place, Suite 620, Sioux Falls, SD 57103 contact@marketbeat.com (844) 978-6257 © MarketBeat Media, LLC 2010-2026. All rights reserved. © 2026 공정가치 가격은 매분 업데이트되며 Massive가 제공한다. 기타 시장 데이터는 최소 10분 지연되며 Barchart Solutions가 호스팅한다. 정보는 있는 그대로 제공되며, 정보 제공 목적으로만 사용되고 거래 목적이나 조언을 위한 것이 아니며, 지연될 수 있다. 모든 거래소 지연 및 이용 약관은 Barchart의 면책 조항을 참조하라. 당사와 파트너는 귀하의 경험을 개선하는 데 도움을 주기 위해 이 웹사이트 사용 정보와 공유한다. 자세한 내용 또는 제외를 원하면 아래의 '내 정보 판매 금지(Do Not Sell My Information)' 버튼을 클릭하라.",https://www.marketbeat.com/instant-alerts/erste-group-bank-issues-positive-forecast-for-unh-earnings-2026-03-26/,Positive
