ticker,title,date,content,url,sentiment
UNH,UnitedHealth Group (NYSE:UNH) Shares Up 1% - Still a Buy? - MarketBeat,2026-03-24 21:45:21,"UnitedHealth Group Incorporated (NYSE:UNH - Get Free Report)'s stock price shot up 1% during trading on Tuesday . The company traded as high as $273.38 and last traded at $272.2960. 5,809,206 shares were traded  during mid-day trading, a decline of 41% from the average session volume of 9,921,009 shares. The stock had previously closed at $269.54. Here are the key news stories impacting UnitedHealth Group this week: UNH has been the topic of several recent research reports. Jefferies Financial Group decreased their price objective on UnitedHealth Group from $418.00 to $340.00 and set a ""buy"" rating on the stock in a research note on Wednesday, January 28th. Truist Financial lowered their price target on shares of UnitedHealth Group from $410.00 to $370.00 and set a ""buy"" rating on the stock in a report on Monday, February 2nd. Barclays decreased their price objective on shares of UnitedHealth Group from $391.00 to $327.00 and set an ""overweight"" rating on the stock in a research report on Friday, January 30th. Evercore raised shares of UnitedHealth Group to a ""strong-buy"" rating in a report on Tuesday, January 6th. Finally, Piper Sandler  reissued an ""overweight"" rating on shares of UnitedHealth Group in a report on Tuesday, January 27th. One analyst  has rated the stock with a Strong Buy rating, seventeen have given a Buy rating, eight have issued  a Hold rating and two have assigned  a Sell rating to the company's stock. Based on data from MarketBeat, the company  has a consensus rating of ""Moderate Buy"" and a consensus target price of $372.13. The company has a current ratio of 0.79, a quick ratio of 0.79 and a debt-to-equity ratio of 0.72. The firm has a market cap of $247.16 billion, a P/E ratio of 20.64, a P/E/G ratio of 1.27 and a beta of 0.41. The stock has a 50 day simple moving average of $295.77 and a 200-day simple moving average of $324.10. UnitedHealth Group (NYSE:UNH - Get Free Report) last announced its quarterly earnings results on Tuesday, January 27th. The healthcare conglomerate reported $2.11 earnings per share for the quarter, topping the consensus estimate of $2.09 by $0.02. UnitedHealth Group had a net margin of 2.69% and a return on equity of 14.79%. The company had revenue of $113.73 billion for the quarter, compared to analysts' expectations of $113.38 billion. During the same quarter in the previous year, the business posted $6.81 earnings per share. UnitedHealth Group's quarterly revenue was up 12.3% on a year-over-year basis. UnitedHealth Group has set its FY 2026 guidance at 17.750- EPS.  On average, equities research analysts expect that  UnitedHealth Group Incorporated will post 29.54 EPS for the current fiscal year. The business also recently disclosed a quarterly dividend, which was paid on Tuesday, March 17th. Shareholders of record on Monday, March 9th were paid a dividend of $2.21 per share. This represents a $8.84 annualized dividend and a yield of 3.2%. The ex-dividend date of this dividend was Monday, March 9th. UnitedHealth Group's payout ratio is presently 67.02%. Hedge funds have recently bought and sold shares of the company. Sarver Vrooman Wealth Advisors purchased a new position in  UnitedHealth Group in the 4th quarter worth about $25,000.  Beacon Financial Strategies CORP bought a new stake in shares of  UnitedHealth Group during the fourth quarter valued at approximately $26,000.  Anfield Capital Management LLC increased its holdings in  UnitedHealth Group by 220.0% during the 4th quarter. Anfield Capital Management LLC now owns 80 shares of the healthcare conglomerate's stock worth $26,000 after purchasing an additional 55 shares during the period.  Joseph Group Capital Management purchased a new stake in shares of  UnitedHealth Group in the 4th quarter worth $27,000.  Finally, Nalls Sherbakoff Group LLC purchased a new position in shares of  UnitedHealth Group during the fourth quarter valued at $27,000. Institutional investors own  87.86% of the company's stock. UnitedHealth Group Inc is a diversified health care company headquartered in Minnetonka, Minnesota, that operates two primary business platforms: UnitedHealthcare and Optum. Founded in 1977, the company provides a broad range of health benefits and health care services to individuals, employers, governmental entities and other organizations. Its operations span commercial employer-sponsored plans, individual and Medicare and Medicaid programs, and services for customers and health systems in the United States and selected international markets. UnitedHealthcare is the company's benefits business, administering health plans and networks, managing provider relationships, and offering coverage products for employers, individuals, and government-sponsored programs. This instant news alert was generated by narrative science technology and financial data from MarketBeat in order to provide readers with the fastest reporting and unbiased coverage. Please send any questions or comments about this story to contact@marketbeat.com. Before you consider UnitedHealth Group, you'll want to hear this. MarketBeat keeps track of Wall Street's top-rated and best performing research analysts and the stocks they recommend to their clients on a daily basis. MarketBeat has identified the five stocks that top analysts are quietly whispering to their clients to buy now before the broader market catches on... and UnitedHealth Group wasn't on the list. While UnitedHealth Group currently has a Moderate Buy rating among analysts, top-rated analysts believe these five stocks are better buys. We are about to experience the greatest A.I. boom in stock market history...

Thanks to a pivotal economic catalyst, specific tech stocks will skyrocket just like they did during the ""dot com"" boom in the 1990s.

That’s why, we’ve hand-selected 7 tiny tech disruptor stocks positioned to surge. Sign up for MarketBeat All Access to gain access to MarketBeat's full suite of research tools. 345 N Reid Place, Suite 620, Sioux Falls, SD 57103
                                        
                                        contact@marketbeat.com
                                        
                                        (844) 978-6257 © MarketBeat Media, LLC 2010-2026. All rights reserved. © 2026   Fair market value prices are updated every minute and are provided by Massive. Other market data provided is at least 10-minutes delayed and hosted by Barchart Solutions.  Information is provided 'as-is' and solely for informational purposes, not for trading purposes or advice, and is delayed. To see all exchange delays and terms of use please see Barchart's disclaimer. Enter your email address below to receive a concise daily summary of dividend news for UnitedHealth Group, new dividend declarations and stocks going ex-dividend with DividendStocks.com’s free newsletter. We and our partners share information on your use of this website to help improve your experience. For more information, or to opt out click the Do Not Sell My Information button below.",https://www.marketbeat.com/instant-alerts/unitedhealth-group-nyseunh-shares-up-1-still-a-buy-2026-03-24/,Neutral
UNH,UNH Graduate Student Union Continues Efforts for Better Conditions - The New Hampshire,2026-03-24 20:36:35,"On Feb. 10, 2026, UNH graduate student workers attended the President and Provost’s State of the University Presentation. President Chilton discussed the university’s achievements with an emphasis on being an R1 institution and the notable research that is done by graduate workers. Members of the Union walked out and called on other students and staff to join them. “None of the excellence that you described or the goals would be possible without the labor of graduate workers. Yet, we are paid poverty wages,” said Jed Seibert, a PhD student in the Forestry program, and member of the union and Bargaining Committee since 2021. “I think it makes them a little uncomfortable, and if that's what it takes for them to come to the table in good faith and meaningfully engage with our proposals, then I'm all for it,” said Sam Crawford, a PhD student in the Sociology department, and member of the union’s Bargaining Committee. Representative Heath Howard (D-NH) agreed that there needs to be pressure put on the university system. “The University of Connecticut, their stipends that they provide to their grad students, I believe is upwards of $40,000 a year. Here at UNH, it's $22,000. It's a very significant jump if we're even comparing just in-state universities here in New England.” According to The Laconia Daily Sun, as of 2025, a single adult with no children needs an annual salary of $101,774 to live comfortably in New Hampshire. UNH graduate student workers are paid a tiny fraction of this for their rigorous work and research. Many graduate student workers, such as Crawford, are in their early thirties, and the fact that the university just recently struck parental leave from the union’s proposal entirely is incredibly concerning. As of August 2025, the union’s non-economic proposals, which include things like workplace protection and grievance process, were tentatively agreed upon with the university. Currently, graduate student workers are working towards progress for the economic articles, which include wages, housing, health benefits, and insurance. Seibert said, “I talked to somebody recently who told me how he is choosing between buying food for his family or medicine for his kid. And for them to come back and offer us nothing in return is frustrating.” Many undergraduate students are not aware that the teaching assistants in their lectures or labs are dealing with these conditions while simultaneously trying to serve their students as effectively as possible. “I really care about the undergrad experience here, and the better we are treated, the more energy we’ll have to devote to make everybody’s experience worthwhile here,” said Seibert. Kadienne LaPointe, an Organizer and Bargaining Committee member of the Graduate Student Union, as well as Communications Officer for the Graduate Student Senate, said, “It is something that impacts all of us, and we really do rely on the support of ally undergraduates and ally faculty who care that we have good working conditions so that we can make this place run smoothly.” Tim Hoheneder, Earth and Political Sciences Doctoral Student and External Relations Officer for the Graduate Student Senate, said the administration boasts about how much they love graduate student workers and they are such a critical part of the university, but, “when it comes to the bargaining table and showing love and affection to us and that we matter, the university has repeatedly come back and said, no, you’re not worth it.” The UNH Graduate Student Union has continued to evolve in its advocacy efforts this year, using social media, walk-outs, and other campaigns to continue to pressure the administration to improve working and living conditions. LaPointe said, “I have been really impressed with people's leadership this year. I think they're really stepping up our social media presence and community-building efforts. We've been doing art builds and inviting people to come out for all sorts of various events and meetings, just so that there's greater transparency in the work we're doing.” Crawford acknowledged that President Chilton and graduate student workers have shared goals: producing quality research, creating new scholars, and teaching undergraduates. They also said they would not want a PhD from an institution that is not an R1 university. Yet, there is still this disconnect between what the administration is saying and what they are doing. And graduate student workers are not going to back down, continuing to advocate publicly for what they deserve. Crawford said, “If you ask me, in my personal capacity, do I want to do stuff like this every day? The answer is no, because it's uncomfortable sometimes, and it's ultimately annoying, but I will be the first person in line to do that kind of thing every time, until we get what we need.”",https://www.tnhdigital.com/article/2026/03/unh-graduate-student-union-continues-efforts-for-better-conditions,Neutral
UNH,UnitedHealth Group Incorporated $UNH Stock Position Raised by Diversified Trust Co. - Defense World,2026-03-24 19:59:22,"Posted by Defense World Staff on Mar 24th, 2026 Diversified Trust Co. boosted its holdings in  UnitedHealth Group Incorporated (NYSE:UNH – Free Report) by 5.5% during the fourth quarter, according to its most recent Form 13F filing with the Securities & Exchange Commission. The fund owned 47,500 shares of the healthcare conglomerate’s stock after acquiring an additional 2,482 shares during the period. Diversified Trust Co.’s holdings in UnitedHealth Group were worth $15,680,000 at the end of the most recent quarter. Other hedge funds have also made changes to their positions in the company. Foster Dykema Cabot & Partners LLC grew its stake in  UnitedHealth Group by 69.4% during the 3rd quarter. Foster Dykema Cabot & Partners LLC now owns 83 shares of the healthcare conglomerate’s stock worth $29,000 after buying an additional 34 shares during the last quarter.  1248 Management LLC acquired a new position in shares of  UnitedHealth Group during the third quarter valued at $29,000.  Holos Integrated Wealth LLC acquired a new stake in shares of  UnitedHealth Group in the 4th quarter worth about $29,000.  Hurley Capital LLC boosted its stake in  UnitedHealth Group by 81.6% during the 3rd quarter. Hurley Capital LLC now owns 89 shares of the healthcare conglomerate’s stock valued at $31,000 after purchasing an additional 40 shares during the period.  Finally, Financial Life Planners acquired a new stake in shares of  UnitedHealth Group in the third quarter valued at approximately $32,000. Institutional investors own  87.86% of the company’s stock. NYSE:UNH opened at $269.62 on Tuesday. UnitedHealth Group Incorporated has a 52-week low of $234.60 and a 52-week high of $606.36. The company has a quick ratio of 0.79, a current ratio of 0.79 and a debt-to-equity ratio of 0.72. The firm has a market cap of $244.72 billion, a P/E ratio of 20.44, a PEG ratio of 1.27 and a beta of 0.41. The business’s 50-day moving average price is $295.77 and its 200 day moving average price is $324.10. The business also recently disclosed a quarterly dividend, which was paid on Tuesday, March 17th. Stockholders of record on Monday, March 9th were given a dividend of $2.21 per share. This represents a $8.84 dividend on an annualized basis and a dividend yield of 3.3%. The ex-dividend date was Monday, March 9th. UnitedHealth Group’s dividend payout ratio  is 67.02%. A number of equities analysts recently issued reports on UNH shares. KeyCorp  reissued an “overweight” rating on shares of UnitedHealth Group in a report on Wednesday, January 28th. Leerink Partners reduced their price target on UnitedHealth Group from $410.00 to $345.00 and set an “outperform” rating for the company in a research report on Wednesday, January 28th. Piper Sandler  restated an “overweight” rating on shares of UnitedHealth Group in a research note on Tuesday, January 27th. Oppenheimer decreased their target price on shares of UnitedHealth Group from $415.00 to $385.00 and set an “outperform” rating for the company in a research report on Wednesday, January 28th. Finally, Truist Financial dropped their price target on shares of UnitedHealth Group from $410.00 to $370.00 and set a “buy” rating on the stock in a research report on Monday, February 2nd. One research analyst  has rated the stock with a Strong Buy rating, seventeen have assigned  a Buy rating, eight have issued  a Hold rating and two have issued  a Sell rating to the stock. According to data from MarketBeat, UnitedHealth Group currently has a consensus rating of “Moderate Buy” and a consensus target price of $372.13.Financial Markets News Get Our Latest Stock Analysis on UnitedHealth Group Here are the key news stories impacting UnitedHealth Group this week: UnitedHealth Group Inc is a diversified health care company headquartered in Minnetonka, Minnesota, that operates two primary business platforms: UnitedHealthcare and Optum. Founded in 1977, the company provides a broad range of health benefits and health care services to individuals, employers, governmental entities and other organizations. Its operations span commercial employer-sponsored plans, individual and Medicare and Medicaid programs, and services for customers and health systems in the United States and selected international markets.Recent defense news UnitedHealthcare is the company’s benefits business, administering health plans and networks, managing provider relationships, and offering coverage products for employers, individuals, and government-sponsored programs. Want to see what other hedge funds are holding UNH? Visit HoldingsChannel.com to get the latest 13F filings and insider trades for UnitedHealth Group Incorporated (NYSE:UNH – Free Report). Receive News & Ratings for UnitedHealth Group Daily - Enter your email address below to receive a concise daily summary of the latest news and analysts' ratings for UnitedHealth Group and related companies with MarketBeat.com's FREE daily email newsletter. Amazon.com (NASDAQ:AMZN) Receives “Buy” Rating from Barclays Dynamic Advisor Solutions LLC Sells 28,555 Shares of Verizon Communications Inc. $VZ",https://www.defenseworld.net/2026/03/24/unitedhealth-group-incorporated-unh-stock-position-raised-by-diversified-trust-co.html,Neutral
UNH,Service Credit Union Student-Athletes of the Week: Mady Harvey and Rose Pavuk - University of New Hampshire Athletics,2026-03-24 19:52:20,"3/24/2026 3:06:00 PM  | General, Women's Gymnastics, Women's Lacrosse DURHAM, N.H. – Sophomore Mady Harvey (Freeland, Mich.) of the University of New Hampshire gymnastics team and senior Rose Pavuk (York, Maine) of the UNH women's lacrosse team were named the Service Credit Union Student-Athletes of the Week on March. 24. Mady won the EAGL balance beam individual title with a 9.875 finishing first in the event this past Saturday, March 21, at the EAGL Championships, hosted by LIU at the Pratt Recreation Center. The UNH gymnastics team finished third overall with a score of 194.775. Mady's impressive score in the balance beam led to her being selected to compete in the 2026 NCAA Collegiate Women's Gymnastics Baton Rouge Regional Championship, hosted by LSU, on Thursday, April 2 (2pm ET, ESPN+). Harvey, EAGL's regular-season and EAGL Championship balance beam champion, will compete as an event specialist. Rose had a great week posting eight goals and six assists for a total of 14 points in two games. In an 18-13 comeback win over Merrimack, on March,18, she tailed four goals and four assists. She set a personal best with eight points while her four assists tied for a career best. Rose also put up big numbers on the road vs Binghamton this past Saturday, March 21, she recorded four goals and two assists for a total of six points. Rose was able to find the back of the net once in each quarter. With her most important goal coming with 5:19 left in the fourth quarter, giving the 'Cats an 11-10 advantage. Unfortunately, the Wildcats fell in overtime 12-11. With her four-goal performances, Rose earned her sixth overall and fourth straight game with at least four goals this season. Additionally, her six-point day marks the fourth consecutive game with at least five points and the fifth such game overall this season. Her 14 points also led America East in total points this week

 The Wildcats return home on Saturday, March 28, as New Hampshire hosts the University of Vermont (5-5, 1-1 AE) at Wildcat Stadium in Durham, N.H., for a 1pm draw. Check back every week during the season to get to know two more Wildcats as part of the Service Credit Union Student-Athlete of the Week. Thank you to Service Credit Union for sponsoring the Student-Athlete of the Week.",https://unhwildcats.com/news/2026/3/24/womens-gymnastics-service-credit-union-student-athletes-of-the-week-mady-harvey-and-rose-pavuk,Neutral
UNH,"Assenagon Asset Management S.A. Sells 278,705 Shares of UnitedHealth Group Incorporated $UNH - Defense World",2026-03-24 18:49:20,"Posted by Defense World Staff on Mar 24th, 2026
Military technology reports Assenagon Asset Management S.A. cut its holdings in shares of  UnitedHealth Group Incorporated (NYSE:UNH – Free Report) by 22.6% during the 4th quarter, according to its most recent Form 13F filing with the SEC. The firm owned 953,546 shares of the healthcare conglomerate’s stock after selling 278,705 shares during the period. Assenagon Asset Management S.A. owned 0.11% of UnitedHealth Group worth $314,775,000 as of its most recent SEC filing. Financial Markets News Several other large investors have also added to or reduced their stakes in UNH. Sagard Holdings Management Inc. bought a new position in  UnitedHealth Group in the 2nd quarter worth $29,000.  Foster Dykema Cabot & Partners LLC increased its position in shares of  UnitedHealth Group by 69.4% during the third quarter. Foster Dykema Cabot & Partners LLC now owns 83 shares of the healthcare conglomerate’s stock valued at $29,000 after buying an additional 34 shares during the period.  1248 Management LLC purchased a new stake in  UnitedHealth Group in the third quarter worth about $29,000.  Holos Integrated Wealth LLC purchased a new position in shares of  UnitedHealth Group during the 4th quarter worth approximately $29,000.  Finally, Hurley Capital LLC lifted its stake in shares of  UnitedHealth Group by 81.6% in the 3rd quarter. Hurley Capital LLC now owns 89 shares of the healthcare conglomerate’s stock valued at $31,000 after purchasing an additional 40 shares during the period. Institutional investors own  87.86% of the company’s stock. Shares of UnitedHealth Group stock opened at $269.62 on Tuesday. The company has a quick ratio of 0.79, a current ratio of 0.79 and a debt-to-equity ratio of 0.72. UnitedHealth Group Incorporated has a twelve month low of $234.60 and a twelve month high of $606.36. The company has a market cap of $244.72 billion, a price-to-earnings ratio of 20.44, a price-to-earnings-growth ratio of 1.27 and a beta of 0.41. The company’s 50 day moving average is $295.77 and its 200 day moving average is $324.10. The company also recently declared a quarterly dividend, which was paid on Tuesday, March 17th. Shareholders of record on Monday, March 9th were paid a dividend of $2.21 per share. This represents a $8.84 dividend on an annualized basis and a dividend yield of 3.3%. The ex-dividend date was Monday, March 9th. UnitedHealth Group’s payout ratio is currently 67.02%. A number of equities analysts have issued reports on UNH shares. JPMorgan Chase & Co. decreased their price objective on UnitedHealth Group from $425.00 to $389.00 and set an “overweight” rating for the company in a report on Monday, February 2nd. Leerink Partners reduced their target price on shares of UnitedHealth Group from $410.00 to $345.00 and set an “outperform” rating on the stock in a research report on Wednesday, January 28th. Barclays dropped their price objective on shares of UnitedHealth Group from $391.00 to $327.00 and set an “overweight” rating on the stock in a research note on Friday, January 30th. Evercore raised shares of UnitedHealth Group to a “strong-buy” rating in a research note on Tuesday, January 6th. Finally, Weiss Ratings cut UnitedHealth Group from a “hold (c-)” rating to a “sell (d+)” rating in a research report on Monday, March 2nd. One research analyst  has rated the stock with a Strong Buy rating, seventeen have issued  a Buy rating, eight have assigned  a Hold rating and two have issued  a Sell rating to the company’s stock. According to data from MarketBeat, UnitedHealth Group presently has an average rating of “Moderate Buy” and an average price target of $372.13. Get Our Latest Research Report on UnitedHealth Group Here are the key news stories impacting UnitedHealth Group this week: UnitedHealth Group Inc is a diversified health care company headquartered in Minnetonka, Minnesota, that operates two primary business platforms: UnitedHealthcare and Optum. Founded in 1977, the company provides a broad range of health benefits and health care services to individuals, employers, governmental entities and other organizations. Its operations span commercial employer-sponsored plans, individual and Medicare and Medicaid programs, and services for customers and health systems in the United States and selected international markets. UnitedHealthcare is the company’s benefits business, administering health plans and networks, managing provider relationships, and offering coverage products for employers, individuals, and government-sponsored programs. Receive News & Ratings for UnitedHealth Group Daily - Enter your email address below to receive a concise daily summary of the latest news and analysts' ratings for UnitedHealth Group and related companies with MarketBeat.com's FREE daily email newsletter. UnitedHealth Group Incorporated $UNH Shares Sold by Appleton Partners Inc. MA Constitution Capital LLC Has $1.61 Million Position in American Electric Power Company, Inc. $AEP",https://www.defenseworld.net/2026/03/24/assenagon-asset-management-s-a-sells-278705-shares-of-unitedhealth-group-incorporated-unh.html,Neutral
