ticker,title,date,content,url,sentiment
UNH,Former Ocean Spray CEO to deliver UNH commencement address - New Hampshire Public Radio,2026-03-26 20:07:00,"The 2026 University of New Hampshire commencement address will be delivered by the former CEO of Ocean Spray, who graduated from UNH in 1987. Tom Hayes retired from Ocean Spray in March. He previously was president and CEO of Tyson Foods, and has served as a food industry executive for brands including Sara Lee, ConAgra, and Kraft Foods. Hayes also served two terms on the board of directors for the UNH Foundation, which is dedicated to building private support for the university. The UNH commencement for undergraduate ceremonies is scheduled for May 16 at the Whittemore Center Arena. Other commencement events include: Plymouth State University and Keene State College hold commencement ceremonies May 9. Get daily top stories from NHPR's newsroom with The Rundown. 
                        Check out all of NHPR's newsletters here. NHPR is nonprofit and independent. We rely on readers like you to support the local, national, and international coverage on this website. Your support makes this news available to everyone. Give today. A monthly donation of $5 makes a real difference.",https://www.nhpr.org/nh-news/2026-03-26/unh-newhampshire-2026-commencement-address,Neutral
UNH,UnitedHealth Group (UNH) Valuation Check After Recent Weak Share Performance - Yahoo Finance,2026-03-26 18:07:07,"Tip: Try a valid symbol or a specific company name for relevant results How Trump went from saying the Strait of Hormuz 'will open itself' to acknowledging Iran's power to control the waterway SpaceX tells prospective investors to anticipate briefings in April in preparation for IPO (Bloomberg) Every Big Tech darling is down double-digit percentages from its 52-week high The Nasdaq led indexes lower as Big Tech and chip stocks sold off and oil spiked above $100 Mortgage rates surged to a 7-month high as buyer confidence is 'shaken' Stocks slid at the open as Trump warned Iran to make a deal before it is 'too late' Worker productivity is on the rise. How much is because of AI is hard to say. Workers everywhere are feeling horrible about their job security. Here's why. Wall Street analysts say recession odds are rising as oil prices remain volatile and the Middle East war drags on The TSA chief says travel problems will likely outlive any shutdown deal, warning of a 'perfect storm' this summer Stocks rose and oil stayed below the $100 level, as Wall Street weighed hopes for deescalation in Iran Meta, YouTube reportedly found liable in landmark social media addiction lawsuit 2 charts explain why OpenAI just pulled the plug on Sora US stocks jump amid hopes for US-Iran talks, as oil falls below $100 Three factors have driven double-digit stock market losses in the last 100 years. They're all in play. The economist known as 'Dr. Doom' says the Iran war could have serious implications for inflation and interest rates The CEO claims the era of the $1 billion AI-run companies is already here. Shares tanked the most on record, thanks to unfavorable developments in legislation moving through Congress. Stocks resumed a slide, with the Nasdaq leading the decline. Oil jumped as the Iran war dragged on. Stocks retreated at the open, pulling back after Monday's sharp rally as the Iran war dragged on How the Fed has — and hasn't — responded to previous oil price shocks Musk's 'Terafab' is finally here. It might be his grandest overarching vision yet for where he sees his companies headed. Larry Fink's annual letter featured a stark warning about AI and inequality Trump started talks with Iran after US allies warned him about the dangers of his planned strikes (Bloomberg) The Dow jumped over 600 points, while the S&P 500 and Nasdaq both rose over 1% as Wall Street cheered Trump's signal to resume talks with Iran. US stocks soar after Trump puts Iran strikes on hold to pursue 'very good' talks Dow futures soared nearly 1,000 points and oil sank after Trump postponed threatened strikes on Iran's power plants The Saudi oil pipeline the world didn't know it needed (Bloomberg) Here's how HELOCs have changed — and why some homeowners may not like the new rules Home health aides epitomize a key problem in the current job market: High demand but low pay Analysts are looking at how surging gas prices may affect consumers, inflation, and the broader economy Border czar Homan says ICE will do ‘non-significant’ tasks at airports (Bloomberg) Powell doesn't plan to step down from the Fed Board of Governors until the DOJ investigations of him and the Fed are resolved Iran war rages on, possible rate hikes, and AI's 'show me' phase Why Nascar star Joey Logano just invested in a Ford dealership A growing number of Americans are looking to retire overseas. Here's what you need to know. Your flight is about to get more expensive. These tips could save you. Trump threatens to deploy ICE agents to airports in shutdown (Bloomberg) Why used EVs may be the answer for Americans looking for affordable cars Property taxes are skyrocketing. But states are learning that cutting them has major consequences. OpenAI to double workforce as business push intensifies (Financial Times) Wall Street priced a swift bombing campaign. What it got was an energy war. Shutdown-induced travel problems may get even worse next week. And Congress has a recess looming. Jury finds Elon Musk misled investors during Twitter purchase, absolves him of some fraud claims (Associated Press) Gas prices are just the start: Consumers will feel more pain from Iran war The Dow, S&P 500, and Nasdaq sold off to end another brutal week as the Iran war rages Wall Street resumed its sell-off, with the Nasdaq down over 1% as stocks looked headed for another brutal week. US stocks retreat as oil swings around amid Iran war jitters The robotaxi companies have wildly different problems, but the same goal The financial sector is on pace for its worst first quarter since 2020 Find your next quality investment with Simply Wall St's easy and powerful screener, trusted by over 7 million individual investors worldwide. UnitedHealth Group (UNH) has drawn fresh attention after a period of weak share performance, with the stock showing negative returns over the past month, the past 3 months, year to date, and over the past year. The recent loss of momentum, with a 7 day share price return of 4.85% and a 90 day share price return of 17.41%, sits alongside a 1 year total shareholder return of 46.32%. This combination points to pressure rather than support building around the stock. If this pullback has you reassessing your watchlist, it can be a useful time to look at other healthcare focused AI names using our dedicated screener for 36 healthcare AI stocks With UnitedHealth Group trading at a discount to both some intrinsic estimates and published price targets, yet carrying a weak recent return profile, you need to ask whether there is real value on offer here or whether the market is already pricing in any future growth. The most followed narrative on UnitedHealth Group pegs fair value at $486.86 per share versus the last close of $270.55, which points to a sizeable valuation gap that centers on how its core businesses scale over time. UNH’s revenue growth stems from serving more people and providing comprehensive healthcare solutions across its offerings. Double-digit growth at both Optum and UnitedHealthcare has contributed to the company’s financial success. Want to see what sits behind that fair value gap, and how much weight this narrative puts on revenue, margins, and future earnings power? The underlying assumptions are clear, but the conclusions might surprise you. Have a read of the narrative in full and understand what's behind the forecasts. However, you also need to weigh risks like tighter healthcare regulation or tougher competition in insurance and pharmacy services, which could challenge this view that the stock is undervalued. Find out about the key risks to this UnitedHealth Group narrative. With mixed signals on value and sentiment, do you see a bargain or a value trap here? Act while the data is fresh and review the 4 key rewards and 1 important warning sign If you are serious about building a stronger portfolio, now is the moment to broaden your search before others move first on high quality opportunities. Spot potential mispricings early and compare quality names using our screener for 55 high quality undervalued stocks Secure income focused ideas that aim for durability with the help of our screener for 12 dividend fortresses Find under the radar opportunities with solid fundamentals using our screener for screener containing 25 high quality undiscovered gems This article by Simply Wall St is general in nature. We provide commentary based on historical data and analyst forecasts only using an unbiased methodology and our articles are not intended to be financial advice. It does not constitute a recommendation to buy or sell any stock, and does not take account of your objectives, or your financial situation. We aim to bring you long-term focused analysis driven by fundamental data. Note that our analysis may not factor in the latest price-sensitive company announcements or qualitative material. Simply Wall St has no position in any stocks mentioned. Have feedback on this article? Concerned about the content? Get in touch with us directly. Alternatively, email editorial-team@simplywallst.com Tip: Try a valid symbol or a specific company name for relevant results",https://finance.yahoo.com/markets/stocks/articles/unitedhealth-group-unh-valuation-check-180707391.html,Negative
UNH,"Mark Cuban Calls $30,000 Corporate Healthcare Burden 'Insane,' Backs Bill To Break Up Big Medicine Giants UNH, CVS, CI - Yahoo Finance",2026-03-26 17:31:07,"Tip: Try a valid symbol or a specific company name for relevant results How Trump went from saying the Strait of Hormuz 'will open itself' to acknowledging Iran's power to control the waterway SpaceX tells prospective investors to anticipate briefings in April in preparation for IPO (Bloomberg) Every Big Tech darling is down double-digit percentages from its 52-week high The Nasdaq led indexes lower as Big Tech and chip stocks sold off and oil spiked above $100 Mortgage rates surged to a 7-month high as buyer confidence is 'shaken' Stocks slid at the open as Trump warned Iran to make a deal before it is 'too late' Worker productivity is on the rise. How much is because of AI is hard to say. Workers everywhere are feeling horrible about their job security. Here's why. Wall Street analysts say recession odds are rising as oil prices remain volatile and the Middle East war drags on The TSA chief says travel problems will likely outlive any shutdown deal, warning of a 'perfect storm' this summer Stocks rose and oil stayed below the $100 level, as Wall Street weighed hopes for deescalation in Iran Meta, YouTube reportedly found liable in landmark social media addiction lawsuit 2 charts explain why OpenAI just pulled the plug on Sora US stocks jump amid hopes for US-Iran talks, as oil falls below $100 Three factors have driven double-digit stock market losses in the last 100 years. They're all in play. The economist known as 'Dr. Doom' says the Iran war could have serious implications for inflation and interest rates The CEO claims the era of the $1 billion AI-run companies is already here. Shares tanked the most on record, thanks to unfavorable developments in legislation moving through Congress. Stocks resumed a slide, with the Nasdaq leading the decline. Oil jumped as the Iran war dragged on. Stocks retreated at the open, pulling back after Monday's sharp rally as the Iran war dragged on How the Fed has — and hasn't — responded to previous oil price shocks Musk's 'Terafab' is finally here. It might be his grandest overarching vision yet for where he sees his companies headed. Larry Fink's annual letter featured a stark warning about AI and inequality Trump started talks with Iran after US allies warned him about the dangers of his planned strikes (Bloomberg) The Dow jumped over 600 points, while the S&P 500 and Nasdaq both rose over 1% as Wall Street cheered Trump's signal to resume talks with Iran. US stocks soar after Trump puts Iran strikes on hold to pursue 'very good' talks Dow futures soared nearly 1,000 points and oil sank after Trump postponed threatened strikes on Iran's power plants The Saudi oil pipeline the world didn't know it needed (Bloomberg) Here's how HELOCs have changed — and why some homeowners may not like the new rules Home health aides epitomize a key problem in the current job market: High demand but low pay Analysts are looking at how surging gas prices may affect consumers, inflation, and the broader economy Border czar Homan says ICE will do ‘non-significant’ tasks at airports (Bloomberg) Powell doesn't plan to step down from the Fed Board of Governors until the DOJ investigations of him and the Fed are resolved Iran war rages on, possible rate hikes, and AI's 'show me' phase Why Nascar star Joey Logano just invested in a Ford dealership A growing number of Americans are looking to retire overseas. Here's what you need to know. Your flight is about to get more expensive. These tips could save you. Trump threatens to deploy ICE agents to airports in shutdown (Bloomberg) Why used EVs may be the answer for Americans looking for affordable cars Property taxes are skyrocketing. But states are learning that cutting them has major consequences. OpenAI to double workforce as business push intensifies (Financial Times) Wall Street priced a swift bombing campaign. What it got was an energy war. Shutdown-induced travel problems may get even worse next week. And Congress has a recess looming. Jury finds Elon Musk misled investors during Twitter purchase, absolves him of some fraud claims (Associated Press) Gas prices are just the start: Consumers will feel more pain from Iran war The Dow, S&P 500, and Nasdaq sold off to end another brutal week as the Iran war rages Wall Street resumed its sell-off, with the Nasdaq down over 1% as stocks looked headed for another brutal week. US stocks retreat as oil swings around amid Iran war jitters The robotaxi companies have wildly different problems, but the same goal The financial sector is on pace for its worst first quarter since 2020 Billionaire entrepreneur Mark Cuban is sounding the alarm on skyrocketing corporate healthcare costs, declaring them a primary driver of layoffs and throwing his full weight behind bipartisan legislation to dismantle healthcare conglomerates like UnitedHealth Group Inc., CVS Health Corp., and Cigna Group. In a recent social media post, the founder of Cost Plus Drugs, Cuban, argued that out-of-control medical expenses—not artificial intelligence (AI)—are forcing companies to slash jobs. Cuban noted that employers are burdened with “$30k per family, per year for premiums and care,” calling the financial strain “insane.” “Most of that goes to the massive, vertically integrated insurance companies that send weekly bills that no one reviews in details,” Cuban wrote. Investors With $1M+ Often Use Advisors for Tax Strategy — This Tool Matches You With One in Minutes Think your retirement plan is on track? Click here to see how it stacks up against the numbers most Americans are missing He emphasized that healthcare is typically a company’s second-largest expense behind payroll, making it “far easier to blame AI than it is to blame Healthcare costs” when layoffs occur. To combat these mounting costs, Cuban is urging the public to support the “Break Up Big Medicine Act,” introduced by Senators Josh Hawley (R-Mo.) and Elizabeth Warren (D-Mass.). The sweeping bill targets industry giants like UnitedHealth Group, CVS Health, and Cigna Group, aiming to prohibit common ownership between insurers, pharmacy benefit managers (PBMs), and medical providers. “Break up the biggest insurance companies,” Cuban demanded. “They don't need thousands of subsidiaries. That's how they game and abuse the system and increase costs for all of us.” I don't think people realize how much healthcare costs are driving big companies to fire and not hire. It costs them $30k per family, per year for premiums and care. Most of that goes to the massive, vertically integrated insurance companies that send weekly bills that no… See Also: You Saved for Retirement — But Do You Know What You'll Keep After Taxes? The proposed legislation mirrors the 1933 Glass-Steagall Act, seeking to eliminate the self-dealing that inflates consumer premiums. Under the act, these massive healthcare entities would be required to divest conflicting subsidiaries within one year, with enforcement led by the Federal Trade Commission and the Department of Justice. Cuban has previously praised the bill as an absolute “no brainer” and urged President Donald Trump to back the populist effort. For Cuban, dismantling these monopolies is the only viable path forward to increase jobs, boost wages, and fundamentally improve healthcare affordability for every working American. This Startup Thinks It Can Reinvent the Wheel — Literally Instead of buying someone else's ETF, build an index around your own thesis with Public's AI tools. Get started and see if you qualify for the 1% match. UNLOCKED: 5 NEW TRADES EVERY WEEK. Click now to get top trade ideas daily, plus unlimited access to cutting-edge tools and strategies to gain an edge in the markets. This article Mark Cuban Calls $30,000 Corporate Healthcare Burden &#39;Insane,&#39; Backs Bill To Break Up Big Medicine Giants UNH, CVS, CI originally appeared on Benzinga.com Tip: Try a valid symbol or a specific company name for relevant results",https://finance.yahoo.com/sectors/healthcare/articles/mark-cuban-calls-30-000-173107714.html,Negative
UNH,"Adobe, PayPal, UnitedHealth Just Got 2X ETFs — Direxion Builds Out The Leverage Trade - Benzinga",2026-03-26 16:11:00,"Direxion has rolled out four new single-stock leveraged ETFs, giving traders amplified exposure to Adobe Inc (NASDAQ:ADBE), PayPal Holdings Inc (NASDAQ:PYPL), Texas Instruments Inc (NASDAQ:TXN) and UnitedHealth Group Inc (NYSE:UNH). The launch reflects a broader shift in market behavior, where stock-specific catalysts, ranging from earnings surprises to sector tailwinds, are increasingly driving short-term price action over broader index moves. The firm said the new funds are designed for tactical traders looking to capitalize on near-term momentum in high-profile names across software, fintech, semiconductors and health care. According to Direxion's internal trading data, interest in single-stock ETFs is rising as investors move away from passive, index-based exposure toward more targeted, event-driven strategies. Bottom line: Direxion is doubling down — quite literally — on the rise of single-stock trading, but these high-octane ETFs come with equally high risks, making them tools for precision plays rather than set-it-and-forget-it portfolios. This content was partially produced with the help of AI tools and was reviewed and published by Benzinga editors. © 2026 Benzinga.com. Benzinga does not provide investment advice. All rights reserved. To add Benzinga News as your preferred source on Google, click here. A newsletter built for market enthusiasts by market enthusiasts. Top stories, top movers, and trade ideas delivered to your inbox every weekday before and after the market closes.",https://www.benzinga.com/etfs/new-etfs/26/03/51487844/adobe-paypal-unitedhealth-just-got-2x-etfs-direxion-builds-out-the-leverage-trade,Neutral
UNH,UnitedHealth Group Incorporated (UNH) Is a Trending Stock: Facts to Know Before Betting on It - Yahoo Finance Singapore,2026-03-26 13:00:02,"Tip: Try a valid symbol or a specific company name for relevant results UnitedHealth Group (UNH) has recently been on Zacks.com's list of the most searched stocks. Therefore, you might want to consider some of the key factors that could influence the stock's performance in the near future. Shares of this largest U.S. health insurer have returned -4.8% over the past month versus the Zacks S&P 500 composite's -5% change. The Zacks Medical - HMOs industry, to which UnitedHealth belongs, has lost 5.6% over this period. Now the key question is: Where could the stock be headed in the near term? Although media reports or rumors about a significant change in a company's business prospects usually cause its stock to trend and lead to an immediate price change, there are always certain fundamental factors that ultimately drive the buy-and-hold decision. Rather than focusing on anything else, we at Zacks prioritize evaluating the change in a company's earnings projection. This is because we believe the fair value for its stock is determined by the present value of its future stream of earnings. We essentially look at how sell-side analysts covering the stock are revising their earnings estimates to reflect the impact of the latest business trends. And if earnings estimates go up for a company, the fair value for its stock goes up. A higher fair value than the current market price drives investors' interest in buying the stock, leading to its price moving higher. This is why empirical research shows a strong correlation between trends in earnings estimate revisions and near-term stock price movements. UnitedHealth is expected to post earnings of $6.62 per share for the current quarter, representing a year-over-year change of -8.1%. Over the last 30 days, the Zacks Consensus Estimate has changed -2.1%. For the current fiscal year, the consensus earnings estimate of $17.7 points to a change of +8.3% from the prior year. Over the last 30 days, this estimate has remained unchanged. For the next fiscal year, the consensus earnings estimate of $19.83 indicates a change of +12.1% from what UnitedHealth is expected to report a year ago. Over the past month, the estimate has remained unchanged. With an impressive externally audited track record, our proprietary stock rating tool -- the Zacks Rank -- is a more conclusive indicator of a stock's near-term price performance, as it effectively harnesses the power of earnings estimate revisions. The size of the recent change in the consensus estimate, along with three other factors related to earnings estimates, has resulted in a Zacks Rank #3 (Hold) for UnitedHealth. The chart below shows the evolution of the company's forward 12-month consensus EPS estimate: Even though a company's earnings growth is arguably the best indicator of its financial health, nothing much happens if it cannot raise its revenues. It's almost impossible for a company to grow its earnings without growing its revenue for long periods. Therefore, knowing a company's potential revenue growth is crucial. For UnitedHealth, the consensus sales estimate for the current quarter of $110.08 billion indicates a year-over-year change of +0.5%. For the current and next fiscal years, $440.38 billion and $457.43 billion estimates indicate -1.6% and +3.9% changes, respectively. UnitedHealth reported revenues of $113.22 billion in the last reported quarter, representing a year-over-year change of +12.3%. EPS of $2.11 for the same period compares with $6.81 a year ago. Compared to the Zacks Consensus Estimate of $113.26 billion, the reported revenues represent a surprise of -0.04%. The EPS surprise was +0.96%. Over the last four quarters, UnitedHealth surpassed consensus EPS estimates two times. The company topped consensus revenue estimates just once over this period. Without considering a stock's valuation, no investment decision can be efficient. In predicting a stock's future price performance, it's crucial to determine whether its current price correctly reflects the intrinsic value of the underlying business and the company's growth prospects. Comparing the current value of a company's valuation multiples, such as its price-to-earnings (P/E), price-to-sales (P/S), and price-to-cash flow (P/CF), to its own historical values helps ascertain whether its stock is fairly valued, overvalued, or undervalued, whereas comparing the company relative to its peers on these parameters gives a good sense of how reasonable its stock price is. As part of the Zacks Style Scores system, the Zacks Value Style Score (which evaluates both traditional and unconventional valuation metrics) organizes stocks into five groups ranging from A to F (A is better than B; B is better than C; and so on), making it helpful in identifying whether a stock is overvalued, rightly valued, or temporarily undervalued. UnitedHealth is graded A on this front, indicating that it is trading at a discount to its peers. Click here to see the values of some of the valuation metrics that have driven this grade. The facts discussed here and much other information on Zacks.com might help determine whether or not it's worthwhile paying attention to the market buzz about UnitedHealth. However, its Zacks Rank #3 does suggest that it may perform in line with the broader market in the near term. Want the latest recommendations from Zacks Investment Research? Today, you can download 7 Best Stocks for the Next 30 Days. Click to get this free report UnitedHealth Group Incorporated (UNH) : Free Stock Analysis Report This article originally published on Zacks Investment Research (zacks.com). Tip: Try a valid symbol or a specific company name for relevant results",https://sg.finance.yahoo.com/news/unitedhealth-group-incorporated-unh-trending-130002118.html?guccounter=1&guce_referrer=aHR0cHM6Ly9uZXdzLmdvb2dsZS5jb20v&guce_referrer_sig=AQAAACnoId530s8CVSQvtsHgyf1lre7y6OGDM4B_Exewpsi0kygHHfUzpnb2JyPWxwzUsBgbtyqaG_CbtVAktX1ePrJw1LcOhnjkskjbG_sEv_UtY6mb74BE4kODgXyIfT_D7pMC8-R8xjUlhEh_8-bBMxOcvcYw_vZ2Wh5YPchFf_ux,Neutral
