id,ticker,date,title,content,url,sentiment
8,UNH,2026-03-27 23:39:30,"UNH 주가, 지지선 이탈 후 2025년 저점으로 향해…UnitedHealth가 리셋 국면에 들어서다 - FXLeaders","UnitedHealth Group 주가는 법적 조사, 규제 압박, 그리고 악화된 전망으로 인해 시장 신뢰가 흔들리면서 하락했다. UnitedHealth 주가는 3월 27일 3% 이상 하락하며, 여러 역풍을 둘러싼 투자자 불안이 커지고 있음을 반영했다. 이번 하락은 미국 의료 시스템에서의 지배적 지위에도 불구하고 시장이 회사의 성장 전망을 재평가하면서, 심리가 더 신중한 방향으로 바뀌고 있음을 보여준다. 이번 매도세는 정책 리스크와 운영상의 불확실성이 겹치기 시작할 때 신뢰가 얼마나 빠르게 변할 수 있는지를 드러낸다.

1월 실적 발표에서 UnitedHealth는 2025년 매출 4,476억달러를 보고했고, 2026년 매출이 4,390억달러를 넘을 것으로 전망했으며, 조정 EPS는 주당 17.75달러를 초과할 것으로 예상했다. 이 수치들은 여전히 상당하지만, 전망치는 시장 기대에 미치지 못했다. 이에 따라 밸류에이션 가정이 재조정됐고, 투자자들은 성장세가 상승하는 비용과 규제 제약을 따라갈 수 있을지 의문을 제기하기 시작했다. 경영진은 2025년을 '리셋의 해(reset year)'라고 설명하며, 이는 근본적 사업 붕괴가 아니라 전환기임을 시사했다. 그러나 시장은 아직 이를 납득하지 못하는 모습이다. 상환 추세와 법적 리스크에 대한 명확성이 개선되지 않는다면, 주가는 당분간 압박을 받을 수 있다. 현재로서는 UnitedHealth가 전환 국면에 있는 것으로 보이며, 지속적인 회복을 위해서는 펀더멘털의 안정성과 함께 투자자 신뢰의 회복이 필요하다.

UnitedHealth의 변동성은 매우 두드러졌다. 2025년 4월 약 600달러 부근에서 거래되던 주가는 예상보다 높은 의료비용 때문에 경영진이 이례적으로 향후 가이던스를 중단하자, 8월까지 235달러 수준으로 60% 이상 급락했다. 그 조치는 투자자 신뢰를 크게 훼손했다. 7월 가이던스가 재개되자 심리가 일시적으로 개선됐고, 10월까지 55% 넘는 반등이 나타났다. 그러나 회복은 취약했다. 최근 실적 업데이트 이후 UNH 주가는 약 20% 하락해 300달러 아래로 다시 내려왔으며, 비용 가시성과 향후 가정에 대해 이 종목이 얼마나 민감한지를 다시 한번 보여줬다.

더 넓은 정책 환경도 또 다른 우려를 더했다. 2027년 Medicare Advantage 지급률에 대한 제안 변경안은 기대에 못 미쳤고, 이는 향후 상환 증가에 대한 우려를 키웠다. Medicare Advantage는 UnitedHealth의 핵심 매출 동력이기 때문에, 지급 증가세가 둔화되면 특히 의료비가 더 빠르게 상승할 경우 마진에 압박이 가해질 수 있다. 매출 성장과 비용 인플레이션의 불일치는 이 업종의 핵심 리스크로 부상하고 있다.

투자 심리도 일련의 법적·규제적 도전으로 타격을 받았다. 경영진과 관련된 이해상충 보도를 포함해 잠재적 지배구조 문제에 대한 조사가 진행되면서, 감독과 투명성에 대한 의문이 제기됐다. 또한 회사는 Optum 부문과 보험 사업 간 관계에 대한 법무부(DoJ)의 조사, 인슐린 가격 책정과 관련된 반독점 소송에도 직면해 있다. 의회 역시 요양원 전원 관행에 대한 조사를 다시 열었다. 이 모든 사안이 합쳐져 잠재적 벌금, 운영 제한, 평판 리스크에 대한 불확실성을 키우고 있다.

기술적 관점에서도 주가 구조는 약화됐다. 400달러 상단 돌파를 유지하지 못한 뒤 주가는 하락 반전했고, 최근에는 200달러 부근의 핵심 지지 구간 아래로 떨어졌다. 이러한 붕괴는 추가 하락 위험을 높이며, 과거 저점으로 향하는 길을 열 수 있다. 가격 움직임은 투자자들이 회사의 전망을 재평가하는 가운데 매도 압력이 여전히 우세함을 시사한다.

결론: UnitedHealth의 최근 하락은 단일 이슈가 아니라 여러 문제의 동시 발생을 반영한다. 회사의 펀더멘털은 여전히 견조하지만, 약해진 가이던스, 정책 불확실성, 그리고 강화되는 규제 조사로 인해 시장 심리는 변했다.",https://www.fxleaders.com/news/2026/03/27/unh-stock-heads-to-2025-lows-after-breaking-support-as-unitedhealth-faces-a-reset/,Negative
9,UNH,2026-03-27 21:58:17,UnitedHealth Group(NYSE:UNH) 3.3% 하락 - 매도해야 할까? - MarketBeat,"UnitedHealth Group Incorporated(NYSE:UNH - 무료 보고서)는 금요일 3.3% 하락해 거래를 마쳤다. 장중 한때 주가는 255.97달러까지 떨어졌고, 마지막 거래가는 259.1520달러였다. 이날 정오 무렵 거래량은 1,066만4,771주로, 평균 거래량 986만532주 대비 8% 증가했다. 이전 종가는 268.05달러였다.

이번 주 UnitedHealth Group에 영향을 미치는 주요 뉴스는 다음과 같다:

여러 리서치 기관이 UNH에 대한 의견을 제시했다. Piper Sandler는 1월 27일(화) 보고서에서 UnitedHealth Group 주식에 대해 '비중확대' 의견을 재확인했다. Barclays는 1월 30일(금) 리서치 보고서에서 UnitedHealth Group 주식의 목표주가를 391.00달러에서 327.00달러로 낮추고, 해당 종목에 '비중확대' 의견을 제시했다. Evercore는 1월 6일(화) 리서치 노트에서 UnitedHealth Group 주식을 '강력 매수'로 상향했다. JPMorgan Chase & Co.는 2월 2일(월) 리서치 노트에서 UnitedHealth Group의 목표주가를 425.00달러에서 389.00달러로 낮추고, 회사에 대해 '비중확대' 의견을 제시했다. 마지막으로 Oppenheimer는 1월 28일(수) 리서치 노트에서 UnitedHealth Group의 목표주가를 415.00달러에서 385.00달러로 낮추고, 해당 종목에 '아웃퍼폼' 의견을 제시했다. 한 명의 리서치 애널리스트가 해당 종목에 '강력 매수' 의견을, 열일곱 명이 '매수' 의견을, 여덟 명이 '보유' 의견을, 두 명이 '매도' 의견을 제시했다. MarketBeat에 따르면, 현재 회사의 평균 투자의견은 '중간 매수'이며 합의 목표주가는 372.13달러다.

이 종목의 시가총액은 2,352억3,000만달러, 주가수익비율(PER)은 19.65, PEG 비율은 1.24, 베타는 0.41이다. 50일 단순이동평균은 291.83달러, 200일 단순이동평균은 323.04달러다. 당좌비율은 0.79, 유동비율은 0.79, 부채비율은 0.72다.

UnitedHealth Group(NYSE:UNH - 무료 보고서)은 가장 최근 분기 실적을 1월 27일(화)에 발표했다. 이 헬스케어 대기업은 해당 분기 주당순이익 2.11달러를 보고해 애널리스트 합의 추정치 2.09달러를 0.02달러 상회했다. UnitedHealth Group의 자기자본이익률(ROE)은 14.79%, 순이익률은 2.69%였다. 해당 분기 매출은 1,137억3,000만달러로, 컨센서스 추정치 1,133억8,000만달러를 웃돌았다. 전년 동기에는 주당순이익 6.81달러를 기록했다. 분기 매출은 전년 대비 12.3% 증가했다. UnitedHealth Group는 2026 회계연도 가이던스를 EPS 17.750-으로 제시했다. 리서치 애널리스트들은 UnitedHealth Group Incorporated가 올해 EPS 29.54달러를 기록할 것으로 예상한다.

회사는 또한 최근 분기 배당금을 선언했으며, 이는 3월 17일(화)에 지급됐다. 3월 9일(월) 기준 주주에게 주당 2.21달러의 배당금이 지급됐다. 이 배당은 연환산 8.84달러, 배당수익률 3.4%에 해당한다. 이 배당의 배당락일은 3월 9일(월)이었다. UnitedHealth Group의 배당성향은 67.02%다.

최근 몇몇 기관투자가들이 주식 포지션을 조정했다. Sarver Vrooman Wealth Advisors는 4분기에 UnitedHealth Group의 새로운 지분을 2만5,000달러에 취득했다. Beacon Financial Strategies CORP는 4분기 동안 UnitedHealth Group 주식의 새로운 포지션을 약 2만6,000달러에 매입했다. Anfield Capital Management LLC는 4분기 동안 UnitedHealth Group 내 포지션을 220.0% 확대했다. Anfield Capital Management LLC는 지난 분기 추가로 55주를 매입한 뒤 현재 2만6,000달러 가치의 헬스케어 대기업 주식 80주를 보유하고 있다. Joseph Group Capital Management는 4분기에 UnitedHealth Group의 새로운 포지션을 약 2만7,000달러에 매입했다. 마지막으로 Nalls Sherbakoff Group LLC는 4분기 동안 UnitedHealth Group 주식의 새로운 지분을 약 2만7,000달러에 매입했다. 주식의 87.86%는 기관투자가가 보유하고 있다.

UnitedHealth Group Inc는 미네소타주 미네통카에 본사를 둔 다각화된 헬스케어 기업으로, UnitedHealthcare와 Optum이라는 두 개의 주요 사업 플랫폼을 운영한다. 1977년에 설립된 이 회사는 개인, 고용주, 정부 기관 및 기타 조직에 폭넓은 건강보험 혜택과 의료 서비스를 제공한다. 사업 범위는 기업 고용주 후원 플랜, 개인 및 Medicare·Medicaid 프로그램, 그리고 미국 및 일부 해외 시장의 고객과 의료 시스템을 위한 서비스에 걸쳐 있다. UnitedHealthcare는 회사의 혜택 사업으로, 건강보험 플랜과 네트워크를 운영하고, 의료 제공자 관계를 관리하며, 고용주, 개인, 정부 후원 프로그램을 위한 보장 상품을 제공한다.

이 즉시 뉴스 알림은 독자에게 가장 빠른 보도와 편향 없는 정보를 제공하기 위해 MarketBeat의 서술형 뉴스 기술과 금융 데이터를 바탕으로 생성됐다. 이 기사에 대한 질문이나 의견은 contact@marketbeat.com으로 보내주시기 바란다.

UnitedHealth Group을 고려하기 전에 이 내용을 들어보라. MarketBeat는 월가 최고의 평점과 최고 성과를 내는 리서치 애널리스트들, 그리고 그들이 고객에게 추천하는 종목을 매일 추적한다. MarketBeat는 더 넓은 시장이 알아차리기 전에 지금 고객에게 조용히 매수를 권하는, 최고 애널리스트들이 꼽은 5개 종목을 찾아냈는데, UnitedHealth Group은 그 목록에 없었다. 현재 UnitedHealth Group은 애널리스트들 사이에서 '중간 매수' 평가를 받고 있지만, 최고 평점을 받은 애널리스트들은 이 5개 종목이 더 나은 매수 대상이라고 본다.

옵션 거래의 기초와 이를 활용해 수익을 높이고 위험을 관리하는 방법을 MarketBeat의 무료 보고서로 알아보라. 무료 사본을 받으려면 아래 링크를 클릭하라.

MarketBeat All Access에 가입하면 MarketBeat의 전체 리서치 도구 모음에 접근할 수 있다.

345 N Reid Place, Suite 620, Sioux Falls, SD 57103 contact@marketbeat.com (844) 978-6257 © MarketBeat Media, LLC 2010-2026. All rights reserved. © 2026 공정가치 가격은 1분마다 업데이트되며 Massive가 제공합니다. 기타 시장 데이터는 최소 10분 지연되며 Barchart Solutions에서 호스팅됩니다. 제공되는 정보는 '있는 그대로' 정보 제공만을 목적으로 하며, 거래 목적이나 조언을 위한 것이 아니고 지연이 있을 수 있습니다. 모든 거래소 지연 및 이용 약관은 Barchart의 면책조항을 참조하십시오. 최신 UnitedHealth Group 및 관련 기업에 대한 간단한 일일 요약과 애널리스트 평가를 MarketBeat의 무료 일일 평가 뉴스레터로 받으려면 아래에 이메일 주소를 입력하십시오. 당사와 파트너는 사용자 경험 개선을 위해 본 웹사이트 사용 정보에 대한 정보를 공유합니다. 자세한 내용을 보거나 제외하려면 아래의 'Do Not Sell My Information' 버튼을 클릭하십시오.",https://www.marketbeat.com/instant-alerts/unitedhealth-group-nyseunh-trading-down-33-should-you-sell-2026-03-27/,Neutral
10,UNH,2026-03-27 21:50:06,"UnitedHealth Group(UNH), 시장보다 더 큰 하락세… 투자자를 위한 몇 가지 정보 - Yahoo Finance","팁: 관련 결과를 보려면 유효한 심볼 또는 특정 회사명을 입력해 보세요.

급등한 가스 가격으로 자동차를 사는 비용은 그 어느 때보다 비싸졌다. 하지만 전기차에 기회가 열릴 수도 있다. 그 어느 때보다 많은 미국인들이 개인 대출로 눈을 돌리고 있다. 이를 이끄는 요인은 다음과 같다. 미국인들은 막 끔찍한 여행의 한 주를 견뎠다. 당분간 나아지지 않을 것이다. 집을 팔려던 사람들은 임대인이 되고 있다. 이는 임차인에게는 좋은 소식이다. 지금 시장에서는 거의 모든 것이 잘못되고 있다. S&P 500은 하락 행진을 이어갔고, 다우지수는 나스닥과 함께 조정 국면에 들어갔으며 기술주가 시가총액 수십억 달러를 증발시켰다. 상원이 미국 셧다운 종료에 표결했다. 셧다운은 공항을 마비시키고 TSA 직원들에게 임금을 지급하지 못하게 했다. 미국 증시는 하락했고, 나스닥은 이란 전쟁이 지속되며 조정 국면이 더 깊어졌다. 트럼프가 페르시아만 해협이 '저절로 열릴 것'이라고 말했던 것에서, 이란이 이 해협을 통제할 수 있다는 점을 인정하기까지 어떻게 바뀌었는가. SpaceX는 IPO 준비를 위해 4월에 투자자 대상 설명회를 예상하라고 잠재 투자자들에게 알렸다(Bloomberg). 모든 빅테크 인기주는 52주 최고가 대비 두 자릿수 퍼센트 하락했다. 나스닥은 빅테크와 반도체주 매도세, 그리고 유가의 100달러 돌파로 지수를 끌어내렸다. 주택담보대출 금리는 7개월 만에 최고치로 급등했고, 매수자 신뢰는 '흔들렸다'. 트럼프가 이란에 '너무 늦기 전에' 협상하라고 경고하자 증시는 개장과 함께 하락했다. 노동 생산성은 상승하고 있다. 그 중 얼마나 AI 때문인지는 말하기 어렵다. 곳곳의 노동자들은 자신의 고용 안정성에 대해 끔찍한 감정을 느끼고 있다. 그 이유는 다음과 같다. 월가 애널리스트들은 유가 변동성이 지속되고 중동 전쟁이 장기화되면서 경기침체 확률이 높아지고 있다고 말한다. TSA 국장은 셧다운 합의가 이뤄져도 여행 문제는 그 이후까지 이어질 가능성이 크며, 이번 여름에 '퍼펙트 스톰'이 닥칠 수 있다고 경고했다. 주가는 상승했고 유가는 100달러 아래를 유지했으며, 월가는 이란에서의 긴장 완화 기대를 저울질했다. 메타와 유튜브가 중대한 소셜미디어 중독 소송에서 책임이 있다고 보고된 것으로 전해졌다. 2개의 차트는 OpenAI가 Sora의 가동을 중단한 이유를 설명한다. 미국 증시는 미국-이란 회담 기대 속에 급등했고, 유가는 100달러 아래로 떨어졌다. 지난 100년간 두 자릿수 주가 하락을 이끈 세 가지 요인이 있다. 지금 그 세 가지가 모두 작용하고 있다. '닥터 둠'으로 알려진 이 경제학자는 이란 전쟁이 인플레이션과 금리에 심각한 영향을 미칠 수 있다고 말한다. CEO는 10억 달러 규모의 AI 운영 기업 시대가 이미 도래했다고 주장한다. 의회를 통과 중인 불리한 입법 동향 덕분에 주가가 사상 최대 폭으로 폭락했다. 증시는 다시 하락세로 돌아섰고, 나스닥이 낙폭을 주도했다. 이란 전쟁이 장기화되며 유가는 급등했다. 증시는 개장과 함께 후퇴하며, 이란 전쟁이 이어지는 가운데 월요일의 급등세를 되돌렸다. 연준은 과거 유가 충격에 어떻게 대응했고, 또 어떻게 대응하지 않았는가. 머스크의 '테라팹(Terafab)'이 마침내 등장했다. 이는 그가 자신의 기업들이 향해 가고 있는 방향에 대해 제시한 가장 거대한 통합 비전일지도 모른다. 래리 핑크의 연례 서한은 AI와 불평등에 대한 강한 경고를 담았다. 트럼프는 미국 동맹국들이 계획된 공습의 위험성을 경고한 뒤 이란과 협상을 시작했다(Bloomberg). 다우지수는 600포인트 이상 급등했고, S&P 500과 나스닥도 월가가 트럼프의 이란과의 협상 재개 신호를 환영하면서 모두 1% 이상 올랐다. 트럼프가 이란 공습을 보류하고 '매우 좋은' 협상을 추진하자 미국 증시는 급등했다. 트럼프가 이란의 발전소 공습 위협을 연기하자 다우 선물은 거의 1,000포인트 급등했고 유가는 급락했다. 세계가 필요하다는 사실을 몰랐던 사우디 송유관(Bloomberg). HELOC가 어떻게 변해 왔는지, 그리고 왜 일부 주택 소유자들은 새 규정을 좋아하지 않을 수 있는지. 가정간호 보조원은 현재 노동시장의 핵심 문제를 상징한다. 수요는 높지만 임금은 낮다. 급등한 가스 가격이 소비자, 인플레이션, 그리고 광범위한 경제에 어떤 영향을 미칠지 애널리스트들이 살펴보고 있다. 국경 차르 하먼은 ICE가 공항에서 '중대한 의미가 없는' 업무를 수행할 것이라고 말했다(Bloomberg). 파월은 법무부가 자신과 연준을 조사하는 문제가 해결될 때까지 연준 이사직에서 물러날 계획이 없다고 말했다. 이란 전쟁은 계속되고, 금리 인상 가능성도 있으며, AI의 '보여줘(show me)' 단계가 시작됐다. NASCAR 스타 조이 로가노가 포드 딜러십에 투자한 이유. 점점 더 많은 미국인들이 해외 은퇴를 고려하고 있다. 알아야 할 내용은 다음과 같다. 항공권 비용이 곧 더 비싸질 것이다. 다음 팁들이 비용을 절감해 줄 수 있다. 트럼프가 셧다운 속에서 공항에 ICE 요원을 배치하겠다고 위협했다(Bloomberg). 중고 EV가 저렴한 자동차를 찾는 미국인들에게 답이 될 수 있는 이유. 재산세는 급등하고 있다. 하지만 각 주는 세금을 줄이는 데 큰 부작용이 있다는 사실을 배우고 있다. OpenAI는 사업 확대를 가속화하며 인력을 두 배로 늘릴 예정이다(Financial Times). 월가는 신속한 폭격 캠페인을 예상했지만, 현실은 에너지 전쟁이었다.

최근 거래 세션에서 UnitedHealth Group(UNH)은 259.02달러로 마감하며 전일 대비 -3.37% 변동했다. 이 종목은 S&P 500의 일간 하락률 1.67%보다 부진했다. 다른 곳에서는 다우지수가 1.73% 하락했고, 기술주 중심의 나스닥은 2.15% 하락했다. 미국 최대 건강보험사의 주가는 지난 한 달 동안 6.49% 하락했으며, 이는 의료 섹터의 7.36% 하락을 이끌었고 S&P 500의 6.15% 하락폭보다도 낮은 성과를 보였다.

UnitedHealth Group의 आगामी 실적 발표는 투자자들의 큰 관심을 받을 전망이다. 회사의 실적 발표는 2026년 4월 21일로 예상된다. 회사는 주당순이익(EPS) 6.62달러를 보고할 것으로 예상되며, 이는 전년 동기 대비 8.06% 감소한 수치다. 한편 현재 컨센서스 추정치는 매출이 1,100억8,000만달러에 이를 것으로 전망하며, 이는 전년 동기 대비 0.46% 증가를 의미한다. 연간 기준으로는 Zacks Consensus Estimates가 애널리스트들이 주당순이익 17.7달러, 매출 4,403억6,000만달러를 예상하고 있음을 시사한다. 이는 전년 대비 각각 +8.26%, -1.61%의 변화다.

투자자들은 UnitedHealth Group에 대한 최근 애널리스트 추정치 변화에도 주목할 수 있다. 이러한 수정은 단기 사업 흐름의 끊임없는 변화를 보여준다. 따라서 긍정적인 추정치 변화는 애널리스트들이 회사의 건전성과 수익성에 대해 우호적인 전망을 갖고 있음을 나타낸다. 당사의 연구에 따르면, 이러한 추정치 수정은 단기 주가 움직임과 직접 관련이 있다. 이를 활용하기 위해 우리는 추정치 변화를 고려해 운영상 평가를 제공하는 독점 모델인 Zacks Rank를 마련했다. Zacks Rank 시스템은 #1(강력 매수)부터 #5(강력 매도)까지이며, 독립적으로 검증된 뛰어난 성과 기록을 보유하고 있다. #1 종목들은 1988년 이후 평균 연간 +25% 수익률에 기여했다.

지난 한 달 동안 Zacks Consensus EPS 추정치에는 변동이 없었다. 현재 UnitedHealth Group의 Zacks Rank는 #3(보유)다. 밸류에이션 측면에서 UnitedHealth Group은 현재 Forward P/E 15.15배에 거래되고 있다. 비교를 위해 해당 산업의 평균 Forward P/E도 15.15배로, UnitedHealth Group이 업종 대비 눈에 띄는 괴리 없이 거래되고 있음을 의미한다. 또한 UNH의 PEG 비율은 1.23이라는 점도 주목할 만하다. 이 널리 쓰이는 지표는 잘 알려진 P/E 비율과 유사하지만, 기업의 예상 이익 성장률도 함께 반영한다. Medical - HMOs 업종의 평균 PEG 비율은 어제 장 마감 기준 0.94였다. Medical - HMOs 업종은 Medical 섹터의 일부다. 이 업종은 현재 Zacks Industry Rank 230을 기록하며, 전체 250개 이상의 업종 중 하위 7%에 속한다. Zacks Industry Rank는 각 섹터 내 개별 기업들의 평균 Zacks Rank를 기준으로 최상위부터 최하위까지 순위를 매긴다. 당사의 연구에 따르면 상위 50% 평가 업종은 하위 절반보다 2대 1 비율로 우수한 성과를 낸다.

향후 거래 세션에서도 이러한 주가 영향 지표와 그 밖의 항목을 확인하려면 Zacks.com을 활용하라. Zacks Investment Research의 최신 추천을 원한다면, 지금 향후 30일을 위한 최고의 종목 7개를 다운로드할 수 있다. 무료 보고서를 받으려면 클릭하라. UnitedHealth Group Incorporated(UNH): 무료 주식 분석 보고서

이 기사는 원래 Zacks Investment Research(zacks.com)에 게재됐다. 팁: 관련 결과를 보려면 유효한 심볼 또는 특정 회사명을 입력해 보세요.",https://finance.yahoo.com/markets/stocks/articles/unitedhealth-group-unh-declines-more-215006005.html,Negative
11,UNH,2026-03-27 20:21:40,직원 표창식 추천 - 뉴햄프셔 대학교,"우리 팀의 뛰어난 구성원을 인정하는 데 시간을 내주셔서 감사합니다. 추천은 OS, PAT 및 학생 직원을 포함한 모든 HCS 직원에게 열려 있습니다. HCS 표창상 추천 양식을 작성해 기대 이상으로 헌신하는 개인들을 소개해 주시기 바랍니다. 모든 추천은 2026년 4월 17일 금요일까지 제출해 주십시오. 문의 사항이 있으면 teejay.hicks@unh.edu 또는 603-862-3463으로 Teejay Hicks에게 연락해 주십시오. 축하 행사는 2026년 5월 6일 수요일 Stillings Hall에서 열리며, 오전 8시 30분부터 오전 10시까지 케이터링 조식이 제공됩니다. 모든 피추천자와 그들을 추천한 사람들은 참석하도록 초대됩니다. 뛰어난 팀원들을 기리는 것 외에도, 행사에는 재미있는 활동, 참여형 게임, 상품을 받을 기회, 그리고 아기 사진과 익숙한 얼굴을 매칭해 보는 기회가 포함됩니다. 파일명에 본인의 이름이 포함되도록 하여 아기 사진을 여기 제출해 주십시오: HCS 공동체의 헌신, 성과, 그리고 영향력을 함께 기념하는 자리에 동참해 주십시오. 일반 문의 (603) 862-1821 ID.office@unh.edu",https://www.unh.edu/dining/employment/employee-recognition-ceremony-nomination,Neutral
