ticker,title,date,content,url,sentiment
UNH,UnitedHealth Group Incorporated $UNH Shares Sold by Appleton Partners Inc. MA - Defense World,2026-03-24 18:49:20,"Posted by Defense World Staff on Mar 24th, 2026 Appleton Partners Inc. MA cut its position in  UnitedHealth Group Incorporated (NYSE:UNH – Free Report) by 6.3% during the fourth quarter, according to its most recent Form 13F filing with the SEC. The firm owned 42,857 shares of the healthcare conglomerate’s stock after selling 2,888 shares during the period. Appleton Partners Inc. MA’s holdings in UnitedHealth Group were worth $14,148,000 at the end of the most recent quarter. Several other hedge funds and other institutional investors also recently bought and sold shares of the business. Guerra Advisors Inc acquired a new stake in  UnitedHealth Group during the 3rd quarter valued at $1,059,000.  Berkshire Hathaway Inc purchased a new stake in  UnitedHealth Group during the 2nd quarter worth about $1,572,193,000.  Carnegie Investment Counsel grew its holdings in shares of  UnitedHealth Group by 2.2% during the third quarter. Carnegie Investment Counsel now owns 105,621 shares of the healthcare conglomerate’s stock worth $36,471,000 after buying an additional 2,316 shares in the last quarter.  EverSource Wealth Advisors LLC lifted its stake in shares of  UnitedHealth Group by 48.9% during the second quarter. EverSource Wealth Advisors LLC now owns 5,790 shares of the healthcare conglomerate’s stock valued at $1,806,000 after buying an additional 1,901 shares during the period.  Finally, Phoenix Financial Ltd. boosted its holdings in shares of  UnitedHealth Group by 111.5% during the third quarter. Phoenix Financial Ltd. now owns 41,986 shares of the healthcare conglomerate’s stock worth $14,282,000 after purchasing an additional 22,137 shares during the last quarter. Institutional investors and hedge funds own  87.86% of the company’s stock. Several research firms have commented on UNH. Oppenheimer lowered their price target on UnitedHealth Group from $415.00 to $385.00 and set an “outperform” rating for the company in a report on Wednesday, January 28th. Truist Financial lowered their price target on UnitedHealth Group from $410.00 to $370.00 and set a “buy” rating for the company in a research report on Monday, February 2nd. Jefferies Financial Group decreased their price objective on shares of UnitedHealth Group from $418.00 to $340.00 and set a “buy” rating for the company in a research note on Wednesday, January 28th. Piper Sandler  reissued an “overweight” rating on shares of UnitedHealth Group in a research note on Tuesday, January 27th. Finally, Weiss Ratings downgraded UnitedHealth Group from a “hold (c-)” rating to a “sell (d+)” rating in a report on Monday, March 2nd. One research analyst  has rated the stock with a Strong Buy rating, seventeen have assigned  a Buy rating, eight have assigned  a Hold rating and two have assigned  a Sell rating to the company’s stock. According to MarketBeat.com, UnitedHealth Group currently has a consensus rating of “Moderate Buy” and a consensus price target of $372.13.Financial Markets News Here are the key news stories impacting UnitedHealth Group this week: Shares of UnitedHealth Group stock opened at $269.62 on Tuesday. UnitedHealth Group Incorporated has a 1-year low of $234.60 and a 1-year high of $606.36. The business has a 50-day moving average of $295.77 and a 200-day moving average of $324.10. The company has a debt-to-equity ratio of 0.72, a current ratio of 0.79 and a quick ratio of 0.79. The company has a market capitalization of $244.72 billion, a PE ratio of 20.44, a P/E/G ratio of 1.27 and a beta of 0.41. Recent defense news UnitedHealth Group (NYSE:UNH – Get Free Report) last released its earnings results on Tuesday, January 27th. The healthcare conglomerate reported $2.11 EPS for the quarter, beating the consensus estimate of $2.09 by $0.02. The company had revenue of $113.73 billion during the quarter, compared to analysts’ expectations of $113.38 billion. UnitedHealth Group had a return on equity of 14.79% and a net margin of 2.69%.The business’s revenue was up 12.3% on a year-over-year basis. During the same period in the prior year, the business posted $6.81 EPS. UnitedHealth Group has set its FY 2026 guidance at 17.750- EPS.  As a group, equities analysts forecast that  UnitedHealth Group Incorporated will post 29.54 EPS for the current fiscal year. The company also recently declared a quarterly dividend, which was paid on Tuesday, March 17th. Investors of record on Monday, March 9th were paid a $2.21 dividend. This represents a $8.84 dividend on an annualized basis and a yield of 3.3%. The ex-dividend date was Monday, March 9th. UnitedHealth Group’s dividend payout ratio (DPR) is 67.02%. UnitedHealth Group Inc is a diversified health care company headquartered in Minnetonka, Minnesota, that operates two primary business platforms: UnitedHealthcare and Optum. Founded in 1977, the company provides a broad range of health benefits and health care services to individuals, employers, governmental entities and other organizations. Its operations span commercial employer-sponsored plans, individual and Medicare and Medicaid programs, and services for customers and health systems in the United States and selected international markets. UnitedHealthcare is the company’s benefits business, administering health plans and networks, managing provider relationships, and offering coverage products for employers, individuals, and government-sponsored programs. Want to see what other hedge funds are holding UNH? Visit HoldingsChannel.com to get the latest 13F filings and insider trades for UnitedHealth Group Incorporated (NYSE:UNH – Free Report). Receive News & Ratings for UnitedHealth Group Daily - Enter your email address below to receive a concise daily summary of the latest news and analysts' ratings for UnitedHealth Group and related companies with MarketBeat.com's FREE daily email newsletter. Contravisory Investment Management Inc. Cuts Position in Automatic Data Processing, Inc. $ADP Assenagon Asset Management S.A. Sells 278,705 Shares of UnitedHealth Group Incorporated $UNH",https://www.defenseworld.net/2026/03/24/unitedhealth-group-incorporated-unh-shares-sold-by-appleton-partners-inc-ma.html,Neutral
UNH,"Constitution Capital LLC Sells 3,085 Shares of UnitedHealth Group Incorporated $UNH - Defense World",2026-03-24 18:49:20,"Posted by Defense World Staff on Mar 24th, 2026 Constitution Capital LLC reduced its position in shares of  UnitedHealth Group Incorporated (NYSE:UNH – Free Report) by 31.4% in the 4th quarter, according to the company in its most recent filing with the Securities and Exchange Commission. The firm owned 6,742 shares of the healthcare conglomerate’s stock after selling 3,085 shares during the period. UnitedHealth Group accounts for approximately  1.1% of Constitution Capital LLC’s holdings, making the stock its 22nd biggest position. Constitution Capital LLC’s holdings in UnitedHealth Group were worth $2,226,000 at the end of the most recent reporting period. A number of other hedge funds also recently bought and sold shares of the company. Sagard Holdings Management Inc. bought a new position in shares of  UnitedHealth Group in the second quarter worth about $29,000.  Foster Dykema Cabot & Partners LLC grew its holdings in  UnitedHealth Group by 69.4% in the 3rd quarter. Foster Dykema Cabot & Partners LLC now owns 83 shares of the healthcare conglomerate’s stock valued at $29,000 after buying an additional 34 shares during the last quarter.  1248 Management LLC acquired a new position in shares of  UnitedHealth Group during the third quarter worth approximately $29,000.  Holos Integrated Wealth LLC acquired a new stake in shares of  UnitedHealth Group in the fourth quarter worth $29,000.  Finally, Hurley Capital LLC increased its position in  UnitedHealth Group by 81.6% during the third quarter. Hurley Capital LLC now owns 89 shares of the healthcare conglomerate’s stock worth $31,000 after acquiring an additional 40 shares during the period. 87.86% of the stock is currently owned by institutional investors. Here are the key news stories impacting UnitedHealth Group this week:Recent defense news UnitedHealth Group (NYSE:UNH – Get Free Report) last issued its quarterly earnings data on Tuesday, January 27th. The healthcare conglomerate reported $2.11 earnings per share (EPS) for the quarter, beating analysts’ consensus estimates of $2.09 by $0.02. UnitedHealth Group had a return on equity of 14.79% and a net margin of 2.69%.The company had revenue of $113.73 billion during the quarter, compared to analysts’ expectations of $113.38 billion. During the same period last year, the business earned $6.81 earnings per share. The business’s revenue was up 12.3% on a year-over-year basis. UnitedHealth Group has set its FY 2026 guidance at 17.750- EPS.  On average, analysts expect that  UnitedHealth Group Incorporated will post 29.54 earnings per share for the current fiscal year. The company also recently disclosed a quarterly dividend, which was paid on Tuesday, March 17th. Stockholders of record on Monday, March 9th were issued a dividend of $2.21 per share. The ex-dividend date of this dividend was Monday, March 9th. This represents a $8.84 annualized dividend and a dividend yield of 3.3%. UnitedHealth Group’s dividend payout ratio (DPR) is presently 67.02%. Several research firms have issued reports on UNH. Morgan Stanley decreased their price target on shares of UnitedHealth Group from $411.00 to $409.00 and set an “overweight” rating on the stock in a research report on Friday, January 23rd. Sanford C. Bernstein  restated an “outperform” rating on shares of UnitedHealth Group in a research note on Wednesday, January 28th. Truist Financial reduced their price objective on UnitedHealth Group from $410.00 to $370.00 and set a “buy” rating for the company in a research report on Monday, February 2nd. Leerink Partners lowered their price objective on UnitedHealth Group from $410.00 to $345.00 and set an “outperform” rating on the stock in a research report on Wednesday, January 28th. Finally, Oppenheimer decreased their price target on shares of UnitedHealth Group from $415.00 to $385.00 and set an “outperform” rating on the stock in a research note on Wednesday, January 28th. One investment analyst  has rated the stock with a Strong Buy rating, seventeen have given a Buy rating, eight have issued  a Hold rating and two have assigned  a Sell rating to the company. Based on data from MarketBeat.com, the company  has an average rating of “Moderate Buy” and a consensus target price of $372.13.Financial Markets News UnitedHealth Group Inc is a diversified health care company headquartered in Minnetonka, Minnesota, that operates two primary business platforms: UnitedHealthcare and Optum. Founded in 1977, the company provides a broad range of health benefits and health care services to individuals, employers, governmental entities and other organizations. Its operations span commercial employer-sponsored plans, individual and Medicare and Medicaid programs, and services for customers and health systems in the United States and selected international markets. UnitedHealthcare is the company’s benefits business, administering health plans and networks, managing provider relationships, and offering coverage products for employers, individuals, and government-sponsored programs. Receive News & Ratings for UnitedHealth Group Daily - Enter your email address below to receive a concise daily summary of the latest news and analysts' ratings for UnitedHealth Group and related companies with MarketBeat.com's FREE daily email newsletter. Congress Asset Management Co. Buys 38,660 Shares of Federal Signal Corporation $FSS GE Aerospace $GE Shares Purchased by Contravisory Investment Management Inc.",https://www.defenseworld.net/2026/03/24/constitution-capital-llc-sells-3085-shares-of-unitedhealth-group-incorporated-unh.html,Neutral
UNH,Is It Worth Investing in UnitedHealth (UNH) Based on Wall Street's Bullish Views? - Yahoo Finance,2026-03-24 13:30:02,"Tip: Try a valid symbol or a specific company name for relevant results How Trump went from saying the Strait of Hormuz 'will open itself' to acknowledging Iran's power to control the waterway SpaceX tells prospective investors to anticipate briefings in April in preparation for IPO (Bloomberg) Every Big Tech darling is down double-digit percentages from its 52-week high The Nasdaq led indexes lower as Big Tech and chip stocks sold off and oil spiked above $100 Mortgage rates surged to a 7-month high as buyer confidence is 'shaken' Stocks slid at the open as Trump warned Iran to make a deal before it is 'too late' Worker productivity is on the rise. How much is because of AI is hard to say. Workers everywhere are feeling horrible about their job security. Here's why. Wall Street analysts say recession odds are rising as oil prices remain volatile and the Middle East war drags on The TSA chief says travel problems will likely outlive any shutdown deal, warning of a 'perfect storm' this summer Stocks rose and oil stayed below the $100 level, as Wall Street weighed hopes for deescalation in Iran Meta, YouTube reportedly found liable in landmark social media addiction lawsuit 2 charts explain why OpenAI just pulled the plug on Sora US stocks jump amid hopes for US-Iran talks, as oil falls below $100 Three factors have driven double-digit stock market losses in the last 100 years. They're all in play. The economist known as 'Dr. Doom' says the Iran war could have serious implications for inflation and interest rates The CEO claims the era of the $1 billion AI-run companies is already here. Shares tanked the most on record, thanks to unfavorable developments in legislation moving through Congress. Stocks resumed a slide, with the Nasdaq leading the decline. Oil jumped as the Iran war dragged on. Stocks retreated at the open, pulling back after Monday's sharp rally as the Iran war dragged on How the Fed has — and hasn't — responded to previous oil price shocks Musk's 'Terafab' is finally here. It might be his grandest overarching vision yet for where he sees his companies headed. Larry Fink's annual letter featured a stark warning about AI and inequality Trump started talks with Iran after US allies warned him about the dangers of his planned strikes (Bloomberg) The Dow jumped over 600 points, while the S&P 500 and Nasdaq both rose over 1% as Wall Street cheered Trump's signal to resume talks with Iran. US stocks soar after Trump puts Iran strikes on hold to pursue 'very good' talks Dow futures soared nearly 1,000 points and oil sank after Trump postponed threatened strikes on Iran's power plants The Saudi oil pipeline the world didn't know it needed (Bloomberg) Here's how HELOCs have changed — and why some homeowners may not like the new rules Home health aides epitomize a key problem in the current job market: High demand but low pay Analysts are looking at how surging gas prices may affect consumers, inflation, and the broader economy Border czar Homan says ICE will do ‘non-significant’ tasks at airports (Bloomberg) Powell doesn't plan to step down from the Fed Board of Governors until the DOJ investigations of him and the Fed are resolved Iran war rages on, possible rate hikes, and AI's 'show me' phase Why Nascar star Joey Logano just invested in a Ford dealership A growing number of Americans are looking to retire overseas. Here's what you need to know. Your flight is about to get more expensive. These tips could save you. Trump threatens to deploy ICE agents to airports in shutdown (Bloomberg) Why used EVs may be the answer for Americans looking for affordable cars Property taxes are skyrocketing. But states are learning that cutting them has major consequences. OpenAI to double workforce as business push intensifies (Financial Times) Wall Street priced a swift bombing campaign. What it got was an energy war. Shutdown-induced travel problems may get even worse next week. And Congress has a recess looming. Jury finds Elon Musk misled investors during Twitter purchase, absolves him of some fraud claims (Associated Press) Gas prices are just the start: Consumers will feel more pain from Iran war The Dow, S&P 500, and Nasdaq sold off to end another brutal week as the Iran war rages Wall Street resumed its sell-off, with the Nasdaq down over 1% as stocks looked headed for another brutal week. US stocks retreat as oil swings around amid Iran war jitters The robotaxi companies have wildly different problems, but the same goal The financial sector is on pace for its worst first quarter since 2020 Investors often turn to recommendations made by Wall Street analysts before making a Buy, Sell, or Hold decision about a stock. While media reports about rating changes by these brokerage-firm employed (or sell-side) analysts often affect a stock's price, do they really matter? Before we discuss the reliability of brokerage recommendations and how to use them to your advantage, let's see what these Wall Street heavyweights think about UnitedHealth Group (UNH). UnitedHealth currently has an average brokerage recommendation (ABR) of 1.83, on a scale of 1 to 5 (Strong Buy to Strong Sell), calculated based on the actual recommendations (Buy, Hold, Sell, etc.) made by 27 brokerage firms. An ABR of 1.83 approximates between Strong Buy and Buy. Of the 27 recommendations that derive the current ABR, 16 are Strong Buy and two are Buy. Strong Buy and Buy respectively account for 59.3% and 7.4% of all recommendations. Check price target & stock forecast for UnitedHealth here>>> While the ABR calls for buying UnitedHealth, it may not be wise to make an investment decision solely based on this information. Several studies have shown limited to no success of brokerage recommendations in guiding investors to pick stocks with the best price increase potential. Do you wonder why? As a result of the vested interest of brokerage firms in a stock they cover, their analysts tend to rate it with a strong positive bias. According to our research, brokerage firms assign five ""Strong Buy"" recommendations for every ""Strong Sell"" recommendation. This means that the interests of these institutions are not always aligned with those of retail investors, giving little insight into the direction of a stock's future price movement. It would therefore be best to use this information to validate your own analysis or a tool that has proven to be highly effective at predicting stock price movements. With an impressive externally audited track record, our proprietary stock rating tool, the Zacks Rank, which classifies stocks into five groups, ranging from Zacks Rank #1 (Strong Buy) to Zacks Rank #5 (Strong Sell), is a reliable indicator of a stock's near-term price performance. So, validating the Zacks Rank with ABR could go a long way in making a profitable investment decision. Although both Zacks Rank and ABR are displayed in a range of 1--5, they are different measures altogether. The ABR is calculated solely based on brokerage recommendations and is typically displayed with decimals (example: 1.28). In contrast, the Zacks Rank is a quantitative model allowing investors to harness the power of earnings estimate revisions. It is displayed in whole numbers -- 1 to 5. Analysts employed by brokerage firms have been and continue to be overly optimistic with their recommendations. Since the ratings issued by these analysts are more favorable than their research would support because of the vested interest of their employers, they mislead investors far more often than they guide. On the other hand, earnings estimate revisions are at the core of the Zacks Rank. And empirical research shows a strong correlation between trends in earnings estimate revisions and near-term stock price movements. In addition, the different Zacks Rank grades are applied proportionately to all stocks for which brokerage analysts provide current-year earnings estimates. In other words, this tool always maintains a balance among its five ranks. Another key difference between the ABR and Zacks Rank is freshness. The ABR is not necessarily up-to-date when you look at it. But, since brokerage analysts keep revising their earnings estimates to account for a company's changing business trends, and their actions get reflected in the Zacks Rank quickly enough, it is always timely in indicating future price movements. Looking at the earnings estimate revisions for UnitedHealth, the Zacks Consensus Estimate for the current year has remained unchanged over the past month at $17.7. Analysts' steady views regarding the company's earnings prospects, as indicated by an unchanged consensus estimate, could be a legitimate reason for the stock to perform in line with the broader market in the near term. The size of the recent change in the consensus estimate, along with three other factors related to earnings estimates, has resulted in a Zacks Rank #3 (Hold) for UnitedHealth. You can see the complete list of today's Zacks Rank #1 (Strong Buy) stocks here >>>> It may therefore be prudent to be a little cautious with the Buy-equivalent ABR for UnitedHealth. Want the latest recommendations from Zacks Investment Research? Today, you can download 7 Best Stocks for the Next 30 Days. Click to get this free report UnitedHealth Group Incorporated (UNH) : Free Stock Analysis Report This article originally published on Zacks Investment Research (zacks.com). Tip: Try a valid symbol or a specific company name for relevant results",https://finance.yahoo.com/markets/stocks/articles/worth-investing-unitedhealth-unh-based-133002556.html,Positive
UNH,UnitedHealth (UNH) Expands AI Investments to Boost Efficiency - Insider Monkey,2026-03-24 11:33:19,"Our #1 AI Stock Pick — 33% OFF: $9.99 (was $14.99)  Monthly picks · Ad-free browsing · 30-day money back guarantee Our #1 AI Stock Pick — 33% OFF: $9.99 (was $14.99)  Monthly picks · Ad-free browsing UnitedHealth Group Incorporated (NYSE:UNH) ranks among the best most active stocks to buy right now. On March 10, UnitedHealth Group Incorporated (NYSE:UNH) presented its strategic outlook at the Barclays 28th Annual Global Healthcare Conference, stressing growth, innovation, and operational improvements despite headwinds in certain areas of the business. The company reiterated its forecast of over 8.5% growth this year and expects to produce a minimum of $18 billion in free cash flow. Management also intends to enhance dividends, cut debt, and maintain share buybacks, with the goal of achieving a debt-to-capital ratio of around 40% by the end of the year. The company’s Optum Health posted a $600 million Q4 underperformance, attributed primarily to temporary issues and strategic initiatives. Meanwhile, Medicare Advantage bids are likely to grow by around 10%, indicating greater cost trends and risk modifications. Looking ahead, UnitedHealth Group Incorporated (NYSE:UNH) is actively investing in AI through Optum Insight to improve healthcare efficiency and lower costs beginning in 2027. UnitedHealth Group Incorporated (NYSE:UNH) is a renowned US multinational corporation that provides managed healthcare and insurance services. The company operates through four main segments: UnitedHealthcare, Optum Health, Optum Insight, and Optum Rx. While we acknowledge the risk and potential of UNH as an investment, our conviction lies in the belief that some AI stocks hold greater promise for delivering higher returns and doing so within a shorter time frame. If you are looking for an AI stock that is more promising than UNH and that has 10,000% upside potential, check out our report about this cheapest AI stock. READ NEXT: 33 Stocks That Should Double in 3 Years and 15 Stocks That Will Make You Rich in 10 Years Disclosure: None. Follow Insider Monkey on Google News. NYSE:UNHYahoo FinanceUnitedHealth Group Incorporated (NYSE:UNH) Returns since its inception in May 2014 (through February 18th, 2026) Get our editor’s daily picks straight in your inbox!",https://www.insidermonkey.com/blog/unitedhealth-unh-expands-ai-investments-to-boost-efficiency-1723251/,Growth
