ticker,title,date,content,url,sentiment
UNH,Nordea Investment Management AB Boosts Stock Position in UnitedHealth Group Incorporated $UNH - MarketBeat,2026-03-25 09:33:57,"Nordea Investment Management AB raised its stake in  UnitedHealth Group Incorporated (NYSE:UNH - Free Report) by 4.2% during the 4th quarter, according to its most recent filing with the Securities and Exchange Commission. The fund owned 91,496 shares of the healthcare conglomerate's stock after purchasing an additional 3,720 shares during the quarter. Nordea Investment Management AB's holdings in UnitedHealth Group were worth $30,287,000 at the end of the most recent reporting period. Several other hedge funds have also recently modified their holdings of the stock. Sagard Holdings Management Inc. acquired a new position in  UnitedHealth Group in the 2nd quarter valued at $29,000.  Foster Dykema Cabot & Partners LLC boosted its holdings in shares of  UnitedHealth Group by 69.4% in the third quarter. Foster Dykema Cabot & Partners LLC now owns 83 shares of the healthcare conglomerate's stock valued at $29,000 after acquiring an additional 34 shares in the last quarter.  1248 Management LLC purchased a new position in  UnitedHealth Group during the third quarter worth about $29,000.  Holos Integrated Wealth LLC purchased a new stake in  UnitedHealth Group in the 4th quarter valued at approximately $29,000.  Finally, Hurley Capital LLC increased its position in  UnitedHealth Group by 81.6% during the 3rd quarter. Hurley Capital LLC now owns 89 shares of the healthcare conglomerate's stock worth $31,000 after purchasing an additional 40 shares during the period. 87.86% of the stock is owned by institutional investors and hedge funds. UNH has been the topic of a number of analyst reports. Sanford C. Bernstein  restated an ""outperform"" rating on shares of UnitedHealth Group in a research note on Wednesday, January 28th. Royal Bank Of Canada reduced their target price on UnitedHealth Group from $408.00 to $361.00 and set an ""outperform"" rating for the company in a report on Wednesday, January 28th. Leerink Partners cut their price target on shares of UnitedHealth Group from $410.00 to $345.00 and set an ""outperform"" rating for the company in a report on Wednesday, January 28th. KeyCorp  reissued an ""overweight"" rating on shares of UnitedHealth Group in a report on Wednesday, January 28th. Finally, Jefferies Financial Group dropped their target price on shares of UnitedHealth Group from $418.00 to $340.00 and set a ""buy"" rating for the company in a report on Wednesday, January 28th. One equities research analyst  has rated the stock with a Strong Buy rating, seventeen have assigned  a Buy rating, eight have assigned  a Hold rating and two have issued  a Sell rating to the company. Based on data from MarketBeat, the stock presently has an average rating of ""Moderate Buy"" and an average target price of $372.13. Shares of NYSE UNH opened at $272.30 on Wednesday. The company has a current ratio of 0.79, a quick ratio of 0.79 and a debt-to-equity ratio of 0.72. The company's 50-day moving average price is $294.53 and its 200 day moving average price is $323.80. UnitedHealth Group Incorporated has a 52 week low of $234.60 and a 52 week high of $606.36. The stock has a market cap of $247.16 billion, a price-to-earnings ratio of 20.64, a PEG ratio of 1.24 and a beta of 0.41. UnitedHealth Group (NYSE:UNH - Get Free Report) last released its quarterly earnings results on Tuesday, January 27th. The healthcare conglomerate reported $2.11 EPS for the quarter, beating the consensus estimate of $2.09 by $0.02. UnitedHealth Group had a net margin of 2.69% and a return on equity of 14.79%. The business had revenue of $113.73 billion for the quarter, compared to analyst estimates of $113.38 billion. During the same period in the prior year, the business earned $6.81 earnings per share. The company's quarterly revenue was up 12.3% on a year-over-year basis. UnitedHealth Group has set its FY 2026 guidance at 17.750- EPS.  As a group, research analysts forecast that  UnitedHealth Group Incorporated will post 29.54 earnings per share for the current fiscal year. The business also recently declared a quarterly dividend, which was paid on Tuesday, March 17th. Stockholders of record on Monday, March 9th were issued a $2.21 dividend. This represents a $8.84 dividend on an annualized basis and a dividend yield of 3.2%. The ex-dividend date of this dividend was Monday, March 9th. UnitedHealth Group's payout ratio is 67.02%. Here are the key news stories impacting UnitedHealth Group this week: UnitedHealth Group Inc is a diversified health care company headquartered in Minnetonka, Minnesota, that operates two primary business platforms: UnitedHealthcare and Optum. Founded in 1977, the company provides a broad range of health benefits and health care services to individuals, employers, governmental entities and other organizations. Its operations span commercial employer-sponsored plans, individual and Medicare and Medicaid programs, and services for customers and health systems in the United States and selected international markets. UnitedHealthcare is the company's benefits business, administering health plans and networks, managing provider relationships, and offering coverage products for employers, individuals, and government-sponsored programs. This instant news alert was generated by narrative science technology and financial data from MarketBeat in order to provide readers with the fastest reporting and unbiased coverage. Please send any questions or comments about this story to contact@marketbeat.com. Before you consider UnitedHealth Group, you'll want to hear this. MarketBeat keeps track of Wall Street's top-rated and best performing research analysts and the stocks they recommend to their clients on a daily basis. MarketBeat has identified the five stocks that top analysts are quietly whispering to their clients to buy now before the broader market catches on... and UnitedHealth Group wasn't on the list. While UnitedHealth Group currently has a Moderate Buy rating among analysts, top-rated analysts believe these five stocks are better buys. Click the link to see MarketBeat's guide to investing in 5G and which 5G stocks show the most promise. Sign up for MarketBeat All Access to gain access to MarketBeat's full suite of research tools. 345 N Reid Place, Suite 620, Sioux Falls, SD 57103
                                        
                                        contact@marketbeat.com
                                        
                                        (844) 978-6257 © MarketBeat Media, LLC 2010-2026. All rights reserved. © 2026   Fair market value prices are updated every minute and are provided by Massive. Other market data provided is at least 10-minutes delayed and hosted by Barchart Solutions.  Information is provided 'as-is' and solely for informational purposes, not for trading purposes or advice, and is delayed. To see all exchange delays and terms of use please see Barchart's disclaimer. We and our partners share information on your use of this website to help improve your experience. For more information, or to opt out click the Do Not Sell My Information button below.",https://www.marketbeat.com/instant-alerts/filing-nordea-investment-management-ab-boosts-stock-position-in-unitedhealth-group-incorporated-unh-2026-03-25/,Neutral
UNH,Rep. Josh Gottheimer Buys UnitedHealth Group Incorporated (NYSE:UNH) Shares - Defense World,2026-03-25 07:10:16,"Posted by Defense World Staff on Mar 25th, 2026 Representative Josh Gottheimer (Democratic-New Jersey) recently bought shares of UnitedHealth Group Incorporated (NYSE:UNH). In a filing disclosed on March 16th, the Representative disclosed that they had bought between $1,001 and $15,000 in UnitedHealth Group stock on February 5th. The trade occurred in the Representative’s “MORGAN STANLEY – SELECT UMA ACCOUNT # 1” account. Financial Markets News Representative Josh Gottheimer also recently made the following trade(s): UNH stock opened at $272.30 on Wednesday. The company has a current ratio of 0.79, a quick ratio of 0.79 and a debt-to-equity ratio of 0.72. The firm’s 50-day moving average price is $294.53 and its two-hundred day moving average price is $323.80. The stock has a market capitalization of $247.16 billion, a price-to-earnings ratio of 20.64, a PEG ratio of 1.24 and a beta of 0.41. UnitedHealth Group Incorporated has a 12-month low of $234.60 and a 12-month high of $606.36. The company also recently declared a quarterly dividend, which was paid on Tuesday, March 17th. Shareholders of record on Monday, March 9th were given a dividend of $2.21 per share. The ex-dividend date of this dividend was Monday, March 9th. This represents a $8.84 annualized dividend and a yield of 3.2%. UnitedHealth Group’s dividend payout ratio  is presently 67.02%. A number of hedge funds have recently bought and sold shares of UNH. Sarver Vrooman Wealth Advisors purchased a new position in shares of  UnitedHealth Group during the 4th quarter worth $25,000.  Beacon Financial Strategies CORP bought a new position in  UnitedHealth Group in the 4th quarter worth $26,000.  Anfield Capital Management LLC grew its holdings in  UnitedHealth Group by 220.0% during the fourth quarter. Anfield Capital Management LLC now owns 80 shares of the healthcare conglomerate’s stock valued at $26,000 after purchasing an additional 55 shares during the period.  Joseph Group Capital Management bought a new position in shares of  UnitedHealth Group in the fourth quarter worth about $27,000.  Finally, Nalls Sherbakoff Group LLC bought a new position in shares of  UnitedHealth Group during the 4th quarter valued at approximately $27,000. Hedge funds and other institutional investors own  87.86% of the company’s stock. Here are the key news stories impacting UnitedHealth Group this week:Recent defense news Several research firms recently weighed in on UNH. Barclays cut their price target on UnitedHealth Group from $391.00 to $327.00 and set an “overweight” rating on the stock in a research note on Friday, January 30th. KeyCorp  reissued an “overweight” rating on shares of UnitedHealth Group in a research note on Wednesday, January 28th. Oppenheimer lowered their price target on UnitedHealth Group from $415.00 to $385.00 and set an “outperform” rating for the company in a research report on Wednesday, January 28th. Evercore raised shares of UnitedHealth Group to a “strong-buy” rating in a research report on Tuesday, January 6th. Finally, Sanford C. Bernstein  reaffirmed an “outperform” rating on shares of UnitedHealth Group in a report on Wednesday, January 28th. One research analyst  has rated the stock with a Strong Buy rating, seventeen have issued  a Buy rating, eight have assigned  a Hold rating and two have assigned  a Sell rating to the company. According to MarketBeat.com, the company  has a consensus rating of “Moderate Buy” and an average price target of $372.13.Financial Markets News Josh Gottheimer (Democratic Party) is a member of the U.S. House, representing New Jersey’s 5th Congressional District. He assumed office on January 3, 2017. His current term ends on January 3, 2027. Gottheimer (Democratic Party) is running for re-election to the U.S. House to represent New Jersey’s 5th Congressional District. He declared candidacy for the 2026 election. Gottheimer is also running for election for Governor of New Jersey. He declared candidacy for the Democratic primary scheduled on June 10, 2025. Gottheimer attended the University of Pennsylvania for his undergraduate degree. He became a Thouron Fellow at Oxford and attended Harvard Law School. Gottheimer worked as a speech writer under former President Bill Clinton (D), assisting with two State of the Union addresses, among other projects. Before running for Congress, he worked for Microsoft as a general manager for corporate strategy. UnitedHealth Group Inc is a diversified health care company headquartered in Minnetonka, Minnesota, that operates two primary business platforms: UnitedHealthcare and Optum. Founded in 1977, the company provides a broad range of health benefits and health care services to individuals, employers, governmental entities and other organizations. Its operations span commercial employer-sponsored plans, individual and Medicare and Medicaid programs, and services for customers and health systems in the United States and selected international markets. UnitedHealthcare is the company’s benefits business, administering health plans and networks, managing provider relationships, and offering coverage products for employers, individuals, and government-sponsored programs. Receive News & Ratings for UnitedHealth Group Daily - Enter your email address below to receive a concise daily summary of the latest news and analysts' ratings for UnitedHealth Group and related companies with MarketBeat.com's FREE daily email newsletter. National Bank of Canada (TSE:NA) Share Price Passes Above Two Hundred Day Moving Average   – What’s Next? Asahi Group (ASBRF) Expected to Announce Quarterly Earnings on Friday Enter your email address below to receive InsiderTrades.com’s daily insider buying and selling report for UnitedHealth Group and related companies.",https://www.defenseworld.net/2026/03/25/rep-josh-gottheimer-buys-unitedhealth-group-incorporated-nyseunh-shares.html,Neutral
UNH,Can UnitedHealth (UNH) Balance Antitrust Scrutiny With Its Ambitious Capital Return and AI Efficiency Plans? - simplywall.st,2026-03-25 02:24:38,"Capitalize on the AI infrastructure supercycle with our selection of the 34 best 'picks and shovels' of the AI gold rush converting record-breaking demand into massive cash flow. To own UnitedHealth Group today, you need to believe its diversified health insurance and Optum services model can absorb margin pressure from rising medical costs and tight reimbursement. The most important near term catalyst remains management’s ability to stabilize medical cost trends, while the biggest current risk is expanding antitrust and regulatory scrutiny. The latest DOJ probe into Optum and the FTC insulin case both directly reinforce that regulatory risk, rather than changing it. The recent Barclays conference outlook is particularly relevant here, because management reiterated plans for dividend growth, debt reduction, buybacks and AI investments from 2027, even as regulatory headwinds intensify. That contrast between capital return ambitions and legal uncertainty is central to the current story, especially with UnitedHealth now potentially standing alone in the FTC’s insulin case while also facing closer DOJ scrutiny of how Optum interacts with its insurance arm. Yet beneath those plans for efficiency and capital returns, investors should also weigh the growing policy and legal pressures that could reshape margins over time... Read the full narrative on UnitedHealth Group (it's free!) UnitedHealth Group's narrative projects $501.1 billion revenue and $20.0 billion earnings by 2028. This requires 5.8% yearly revenue growth and a $1.3 billion earnings decrease from $21.3 billion today. Uncover how UnitedHealth Group's forecasts yield a $364.62 fair value, a 34% upside to its current price. Some of the lowest tier analysts were already modeling revenue of about US$468.6 billion and earnings of US$15.8 billion by 2028, so if you are worried about government scrutiny and policy probes, their more pessimistic view shows just how far opinions can differ and how this latest antitrust news could still shift those expectations. Explore 88 other fair value estimates on UnitedHealth Group - why the stock might be worth over 2x more than the current price! Disagree with existing narratives? Extraordinary investment returns rarely come from following the herd, so go with your instincts. Don't miss your shot at the next 10-bagger. Our latest stock picks just dropped: This article by Simply Wall St is general in nature. We provide commentary based on historical data
    and analyst forecasts only using an unbiased methodology and our articles are not intended to be financial advice. It does not constitute a recommendation to buy or sell any stock, and does not take account of your objectives, or your
    financial situation. We aim to bring you long-term focused analysis driven by fundamental data.
    Note that our analysis may not factor in the latest price-sensitive company announcements or qualitative material.
    Simply Wall St has no position in any stocks mentioned. Discover if UnitedHealth Group might be undervalued or overvalued with our detailed analysis, featuring fair value estimates, potential risks, dividends, insider trades, and its financial condition. Have feedback on this article? Concerned about the content? Get in touch with us directly. Alternatively, email editorial-team@simplywallst.com Operates as a health care company in the United States and internationally. Financial Data provided by S&P Global Market Intelligence LLC, analysis provided by Simply Wall Street Pty Ltd. Copyright © 2026, S&P Global Market Intelligence LLC. All rights reserved. Simply Wall Street Pty Ltd (ACN 600 056 611), is a Corporate Authorised Representative (Authorised Representative Number: 467183) of Sanlam Private Wealth Pty Ltd (AFSL No. 337927). Any advice contained in this website is general advice only and has been prepared without considering your objectives, financial situation or needs. You should not rely on any advice and/or information contained in this website and before making any investment decision we recommend that you consider whether it is appropriate for your situation and seek appropriate financial, taxation and legal advice. Please read our Financial Services Guide before deciding whether to obtain financial services from us. © 2026 Simply Wall Street Pty Ltd, US Design Patent #29/544/281, Community and European Design Registration #2845206",https://simplywall.st/stocks/us/healthcare/nyse-unh/unitedhealth-group/news/can-unitedhealth-unh-balance-antitrust-scrutiny-with-its-amb/amp,Risk
UNH,Central Bank & Trust Co. Trims Position in UnitedHealth Group Incorporated $UNH - Defense World,2026-03-24 22:17:17,"Posted by Defense World Staff on Mar 24th, 2026 Central Bank & Trust Co. reduced its position in  UnitedHealth Group Incorporated (NYSE:UNH – Free Report) by 27.1% in the 4th quarter, according to its most recent filing with the SEC. The firm owned 7,803 shares of the healthcare conglomerate’s stock after selling 2,903 shares during the period. Central Bank & Trust Co.’s holdings in UnitedHealth Group were worth $2,576,000 at the end of the most recent reporting period. Other hedge funds and other institutional investors have also made changes to their positions in the company. Norges Bank purchased a new position in  UnitedHealth Group during the second quarter worth about $3,837,207,000.  Capital Research Global Investors increased its stake in shares of  UnitedHealth Group by 126.9% during the 3rd quarter. Capital Research Global Investors now owns 13,042,049 shares of the healthcare conglomerate’s stock valued at $4,503,419,000 after acquiring an additional 7,293,009 shares during the last quarter.  Berkshire Hathaway Inc acquired a new stake in shares of  UnitedHealth Group in the second quarter worth approximately $1,572,193,000.  Dodge & Cox increased its position in  UnitedHealth Group by 117.7% during the second quarter. Dodge & Cox now owns 8,750,560 shares of the healthcare conglomerate’s stock worth $2,729,912,000 after purchasing an additional 4,730,192 shares during the last quarter.  Finally, Capital World Investors boosted its holdings in shares of  UnitedHealth Group by 18.8% in the 3rd quarter. Capital World Investors now owns 21,766,922 shares of the healthcare conglomerate’s stock valued at $7,516,107,000 after purchasing an additional 3,439,182 shares during the last quarter. Hedge funds and other institutional investors own  87.86% of the company’s stock. Several brokerages recently weighed in on UNH. Barclays cut their target price on UnitedHealth Group from $391.00 to $327.00 and set an “overweight” rating on the stock in a research report on Friday, January 30th. JPMorgan Chase & Co. dropped their price target on UnitedHealth Group from $425.00 to $389.00 and set an “overweight” rating for the company in a research note on Monday, February 2nd. Oppenheimer decreased their target price on UnitedHealth Group from $415.00 to $385.00 and set an “outperform” rating for the company in a report on Wednesday, January 28th. KeyCorp  reissued an “overweight” rating on shares of UnitedHealth Group in a research report on Wednesday, January 28th. Finally, Morgan Stanley decreased their price objective on shares of UnitedHealth Group from $411.00 to $409.00 and set an “overweight” rating for the company in a research note on Friday, January 23rd. One research analyst  has rated the stock with a Strong Buy rating, seventeen have assigned  a Buy rating, eight have given a Hold rating and two have assigned  a Sell rating to the company’s stock. According to data from MarketBeat.com, UnitedHealth Group currently has an average rating of “Moderate Buy” and an average price target of $372.13.Financial Markets News Shares of NYSE:UNH opened at $269.62 on Tuesday. The company has a market cap of $244.72 billion, a P/E ratio of 20.44, a PEG ratio of 1.27 and a beta of 0.41. UnitedHealth Group Incorporated has a one year low of $234.60 and a one year high of $606.36. The business’s 50-day simple moving average is $295.77 and its 200 day simple moving average is $324.10. The company has a debt-to-equity ratio of 0.72, a quick ratio of 0.79 and a current ratio of 0.79. UnitedHealth Group (NYSE:UNH – Get Free Report) last issued its quarterly earnings data on Tuesday, January 27th. The healthcare conglomerate reported $2.11 earnings per share (EPS) for the quarter, beating the consensus estimate of $2.09 by $0.02. UnitedHealth Group had a net margin of 2.69% and a return on equity of 14.79%. The company had revenue of $113.73 billion during the quarter, compared to the consensus estimate of $113.38 billion. During the same quarter last year, the company earned $6.81 earnings per share. UnitedHealth Group’s revenue for the quarter was up 12.3% on a year-over-year basis. UnitedHealth Group has set its FY 2026 guidance at 17.750- EPS.  On average, sell-side analysts forecast that  UnitedHealth Group Incorporated will post 29.54 earnings per share for the current fiscal year. The company also recently disclosed a quarterly dividend, which was paid on Tuesday, March 17th. Shareholders of record on Monday, March 9th were issued a $2.21 dividend. The ex-dividend date was Monday, March 9th. This represents a $8.84 dividend on an annualized basis and a yield of 3.3%. UnitedHealth Group’s payout ratio is currently 67.02%. Here are the key news stories impacting UnitedHealth Group this week:Recent defense news UnitedHealth Group Inc is a diversified health care company headquartered in Minnetonka, Minnesota, that operates two primary business platforms: UnitedHealthcare and Optum. Founded in 1977, the company provides a broad range of health benefits and health care services to individuals, employers, governmental entities and other organizations. Its operations span commercial employer-sponsored plans, individual and Medicare and Medicaid programs, and services for customers and health systems in the United States and selected international markets. UnitedHealthcare is the company’s benefits business, administering health plans and networks, managing provider relationships, and offering coverage products for employers, individuals, and government-sponsored programs. Want to see what other hedge funds are holding UNH? Visit HoldingsChannel.com to get the latest 13F filings and insider trades for UnitedHealth Group Incorporated (NYSE:UNH – Free Report). Receive News & Ratings for UnitedHealth Group Daily - Enter your email address below to receive a concise daily summary of the latest news and analysts' ratings for UnitedHealth Group and related companies with MarketBeat.com's FREE daily email newsletter. Central Bank & Trust Co. Boosts Stake in Netflix, Inc. $NFLX",https://www.defenseworld.net/2026/03/24/central-bank-trust-co-trims-position-in-unitedhealth-group-incorporated-unh.html,Neutral
