id,ticker,date,title,content,url,sentiment
1,UNH,2026-03-28 21:23:25,에이버리 AI 출시가 새로운 관심을 끌면서 본 UnitedHealth Group(UNH)의 밸류에이션 점검 - simplywall.st,"UnitedHealth Group(UNH)이 회원용 생성형 AI 동반자 에이버리(Avery)를 출시한 이후 관심이 높아졌다. 이는 규제 및 구조적 감시가 계속되는 가운데 디지털 헬스 이니셔티브가 어떻게 전개되고 있는지를 보여준다. 에이버리 출시 시점은 UnitedHealth Group의 주가가 직전 종가 US$259.02를 기록한 가운데 압박을 받고 있는 상황과 맞물린다. 30일 주가 수익률은 8.86%였고, 1년 총주주수익률은 48.39% 하락했다. 이는 투자자들이 디지털 헬스 노력의 잠재력과 규제 조사, 사이버 리스크, 실적 불확실성을 저울질하면서 모멘텀이 약화되고 있음을 시사한다. 에이버리의 AI 행보가 관심을 끌었다면, 의료 기술 전반으로 시야를 넓혀볼 만하다. 스크리너를 활용해 의료 AI 종목 34개를 찾아보세요. UnitedHealth Group이 US$259.02에 거래되고 있고, 내재가치 대비 68.29% 할인으로 보고된 수치와 38.57% 괴리를 시사하는 애널리스트 목표주가 등과 같은 지표를 고려하면, 투자자들은 이것이 실제 가치인지, 아니면 시장이 이미 미래 성장을 반영하고 있는지 궁금해할 수 있다. 직전 종가 $259.02를 기준으로, WallStreetWontons에 따르면 가장 많이 참고되는 밸류에이션 내러티브는 공정가치가 $486.86라고 보며, 투자자들이 UnitedHealth Group의 핵심 사업과 더불어 신규 디지털 역량에 대해 긴 성장 여정을 반영하고 있다고 가정한다. 프리미엄 기반 확대: UNH의 보험료 기반은 계속 성장하고 있으며, 매출 성장에 기여하고 있다. 계약 수주: 회사는 최근 미시간주에서 Medicaid 수혜자 서비스를 제공하는 계약 수주와 같은 계약 및 갱신을 확보하고 있다. Optum 사업의 강세: UNH의 자회사인 Optum은 전반적 실적에 크게 기여하고 있다. 견조한 재무 상태: UNH의 재무 안정성은 투자자 신뢰를 강화한다. 고령화 인구: 미국의 고령화는 UNH의 Medicare 플랜 수요를 지속적으로 지탱한다. 인상적인 실적 서프라이즈 이력: UNH는 일관되게 실적 추정치를 상회해 왔다. 견고한 성장 전망: 2024년과 2025년 컨센서스 추정치는 이익과 매출 모두의 성장을 시사한다. 높은 자기자본이익률: UNH는 업계 평균보다 높은 ROE로 주주 자본을 효율적으로 활용한다. 시장 가격과 해당 공정가치 간의 약 47% 갭을 뒷받침하는 요인이 궁금하신가요? 이 내러티브는 장기적인 매출 확대, 안정적인 마진, 그리고 현재 시장이 부여하고 있는 것보다 더 높은 이익 배수를 크게 강조한다. 전체 내러티브를 읽고 전망의 배경을 이해해 보세요. 다만 이는 규제 결정과 실행에 달려 있으며, 정책 변화나 Optum 서비스 통합 과정의 실수는 이 저평가 논리를 무너뜨릴 수 있다. 이 UnitedHealth Group 내러티브의 핵심 리스크를 확인해 보세요. 이처럼 기회와 우려가 섞인 조합은 무시하기 어렵다. 직접 수치를 검토하고 4가지 핵심 호재와 1가지 중요한 경고 신호를 통해 양쪽 관점에서 스토리를 점검해 보자. 하나의 회사에만 머물러 있으면 목표에 더 잘 맞는 기회를 놓칠 수 있으므로, Simply Wall St Screener의 맞춤형 종목 아이디어로 관심 목록을 넓혀보세요. 이 기사는 Simply Wall St의 일반적인 성격의 글입니다. 우리는 편향 없는 방법론을 사용해 역사적 데이터와 애널리스트 전망에 근거한 논평만 제공하며, 기사 내용은 금융 자문이 아닙니다. 특정 주식의 매수 또는 매도를 추천하는 것이 아니며, 귀하의 목적이나 재무 상황을 고려하지 않습니다. 우리는 기초 데이터를 바탕으로 장기적인 관점의 분석을 제공하는 것을 목표로 합니다. 당사의 분석은 최근의 주가 민감 공시나 정성적 자료를 반영하지 못할 수 있습니다. Simply Wall St는 언급된 어떤 주식도 보유하고 있지 않습니다. 새로운 AI 주식 스크리너는 매일 시장을 스캔해 기회를 포착합니다. • 배당 강자(수익률 3%+) • 내부자 매수가 있는 저평가 소형주 • 고성장 기술 및 AI 기업들 또는 50개 이상의 지표로 직접 구성할 수 있습니다. 이 기사에 대한 의견이 있으신가요? 내용이 우려되시나요? 직접 문의해 주세요. 또는 editorial-team@simplywallst.com으로 이메일을 보내주세요. 미국 및 해외에서 헬스케어 회사로 운영되고 있습니다. 금융 데이터는 S&P Global Market Intelligence LLC가 제공하며, 분석은 Simply Wall Street Pty Ltd가 제공합니다. Copyright © 2026, S&P Global Market Intelligence LLC. All rights reserved. Simply Wall Street Pty Ltd (ACN 600 056 611)는 Sanlam Private Wealth Pty Ltd(AFSL No. 337927)의 기업 공인 대리인(공인 대리인 번호: 467183)입니다. 본 웹사이트에 포함된 어떠한 조언도 일반적인 조언에 불과하며, 귀하의 목적, 재무 상황 또는 필요를 고려하지 않고 작성되었습니다. 본 웹사이트의 조언 및/또는 정보에 의존해서는 안 되며, 투자 결정을 내리기 전에 귀하의 상황에 적합한지 검토하고 적절한 재무, 세무 및 법률 자문을 구할 것을 권장합니다. 금융 서비스 이용 여부를 결정하기 전에 당사의 금융 서비스 가이드를 읽어보시기 바랍니다. © 2026 Simply Wall Street Pty Ltd, 미국 디자인 특허 #29/544/281, 커뮤니티 및 유럽 디자인 등록 #2845206",https://simplywall.st/stocks/us/healthcare/nyse-unh/unitedhealth-group/news/a-look-at-unitedhealth-group-unh-valuation-as-avery-ai-launc,Growth
2,UNH,2026-03-28 12:02:29,"Wealthcare Capital Partners LLC, UnitedHealth Group Incorporated(UNH) 37,566주 매도 - MarketBeat","Wealthcare Capital Partners LLC는 최근 SEC 공시에 따르면 4분기 동안 UnitedHealth Group Incorporated(NYSE:UNH - Free Report) 보유 지분을 94.3% 줄였다. 이 기관투자자는 해당 기간 37,566주를 매도한 뒤 헬스케어 대기업 주식 2,281주를 보유하고 있었다. Wealthcare Capital Partners LLC의 UnitedHealth Group 보유 지분 가치는 최근 SEC 신고 기준 $753,000이었다. 다른 여러 기관투자자들도 UNH 지분을 추가하거나 줄였다. Brighton Jones LLC는 4분기 중 UnitedHealth Group 지분을 176.2% 늘렸다. Brighton Jones LLC는 지난 분기 추가로 28,231주를 매수한 뒤 현재 헬스케어 대기업 주식 44,249주를 보유하고 있으며, 가치는 $22,384,000이다. Revolve Wealth Partners LLC는 4분기 UnitedHealth Group 지분을 137.1% 늘렸다. Revolve Wealth Partners LLC는 지난 분기 2,324주를 추가 매수한 뒤 현재 헬스케어 대기업 주식 4,019주를 보유하고 있으며 가치는 $2,033,000이다. CMT Capital Markets Trading GmbH는 2분기에 UnitedHealth Group 주식의 신규 포지션을 $340,000어치 매입했다. Northwestern Mutual Wealth Management Co.는 2분기 동안 UnitedHealth Group 지분을 3.7% 늘렸다. Northwestern Mutual Wealth Management Co.는 지난 분기 추가로 8,554주를 취득한 뒤 현재 헬스케어 대기업 주식 242,829주를 보유하고 있으며 가치는 $75,755,000이다. 마지막으로, Quadrature Capital Ltd는 2분기 UnitedHealth Group 지분을 6,493.3% 늘렸다. Quadrature Capital Ltd는 지난 분기 추가로 560,241주를 취득한 뒤 현재 헬스케어 대기업 주식 568,869주를 보유하고 있으며 가치는 $177,328,000이다. 현재 주식의 87.86%는 기관투자자가 보유하고 있다. UNH 주식은 금요일 $259.15에 시작했다. 회사의 부채비율은 0.72, 당좌비율은 0.79, 유동비율은 0.79이다. UnitedHealth Group Incorporated의 52주 최저가는 $234.60, 52주 최고가는 $606.36이다. 회사의 시가총액은 $235.23 billion이며, 주가수익비율(P/E)은 19.65, PEG 비율은 1.23, 베타는 0.41이다. 주식의 50일 이동평균 가격은 $290.39, 200일 이동평균 가격은 $322.62이다. UnitedHealth Group(NYSE:UNH - Get Free Report)은 마지막으로 1월 27일 화요일 분기 실적을 발표했다. 이 헬스케어 대기업은 분기 주당순이익(EPS) $2.11을 보고해 애널리스트 컨센서스 추정치 $2.09를 $0.02 상회했다. 회사의 해당 분기 매출은 $113.73 billion으로, 애널리스트 추정치 $113.38 billion과 비교됐다. UnitedHealth Group의 순이익률은 2.69%, 자기자본이익률(ROE)은 14.79%였다. 매출은 전년 동기 대비 12.3% 증가했다. 전년 같은 기간에는 EPS $6.81을 기록했다. UnitedHealth Group은 FY 2026 가이던스를 EPS 17.750-으로 제시했다. 애널리스트들은 UnitedHealth Group Incorporated가 현재 연도에 주당순이익 29.54를 기록할 것으로 예상한다. 또한 회사는 최근 분기 배당을 ঘোষণা했으며, 3월 17일 화요일에 지급됐다. 3월 9일 월요일 기준 주주들에게 주당 $2.21의 배당금이 지급됐다. 이는 연환산 기준 배당금 $8.84, 배당수익률 3.4%에 해당한다. 이 배당의 배당락일은 3월 9일 월요일이었다. UnitedHealth Group의 현재 배당성향은 67.02%다. 최근 여러 주식 애널리스트들이 UNH 주식에 대한 보고서를 발표했다. Morgan Stanley는 1월 23일 금요일 보고서에서 UnitedHealth Group의 목표주가를 $411.00에서 $409.00으로 낮추고, 회사에 대해 '비중확대' 의견을 제시했다. Weiss Ratings는 3월 2일 월요일 리서치 보고서에서 UnitedHealth Group을 '보유(c-)'에서 '매도(d+)'로 하향했다. Leerink Partners는 1월 28일 수요일 리서치 보고서에서 UnitedHealth Group 목표주가를 $410.00에서 $345.00으로 낮추고, 해당 종목에 '시장수익률 상회' 의견을 제시했다. Wells Fargo & Company는 1월 30일 금요일 리서치 नोट에서 UnitedHealth Group 목표주가를 $400.00에서 $370.00으로 낮추고 회사에 대해 '비중확대' 의견을 제시했다. 마지막으로, Sanford C. Bernstein은 1월 28일 수요일 리서치 보고서에서 UnitedHealth Group 주식에 대해 '시장수익률 상회' 의견을 재확인했다. 한 명의 투자 애널리스트가 강력 매수(Strong Buy), 열일곱 명이 매수(Buy), 여덟 명이 보유(Hold), 두 명이 매도(Sell) 의견을 제시했다. MarketBeat 데이터에 따르면 UnitedHealth Group의 평균 투자의견은 '중립적 매수(Moderate Buy)'이며, 컨센서스 목표주가는 $372.13이다. 여기에서 UnitedHealth Group에 대한 최신 리서치 보고서를 읽어보세요. 이번 주 UnitedHealth Group에 영향을 미치는 주요 뉴스는 다음과 같다. UnitedHealth Group Inc는 미네소타주 민넷카에 본사를 둔 다각화된 헬스케어 회사로, UnitedHealthcare와 Optum이라는 두 개의 주요 사업 플랫폼을 운영한다. 1977년에 설립된 이 회사는 개인, 고용주, 정부 기관 및 기타 조직에 광범위한 건강보험 혜택과 헬스케어 서비스를 제공한다. 사업은 상업용 고용주 제공 플랜, 개인 및 Medicare·Medicaid 프로그램, 그리고 미국 및 일부 해외 시장의 고객과 의료 시스템을 위한 서비스까지 아우른다. UnitedHealthcare는 회사의 혜택 사업 부문으로, 건강보험 플랜과 네트워크를 운영하고, 의료 제공자와의 관계를 관리하며, 고용주·개인·정부 지원 프로그램을 위한 보장 상품을 제공한다. 다른 헤지펀드들이 UNH를 어떻게 보유하고 있는지 보고 싶으신가요? HoldingsChannel.com을 방문하면 UnitedHealth Group Incorporated(NYSE:UNH - Free Report)의 최신 13F 제출 및 내부자 거래 내역을 확인할 수 있다. 이 즉시 뉴스 알림은 독자에게 가장 빠른 보도와 편향되지 않은 보도를 제공하기 위해 MarketBeat의 내러티브 과학 기술과 금융 데이터를 기반으로 생성됐다. 이 기사에 대한 질문이나 의견은 contact@marketbeat.com으로 보내 주세요. UnitedHealth Group을 고려하기 전에, 이것을 먼저 들어보세요. MarketBeat는 월가 최고 평점 및 최고 성과를 낸 리서치 애널리스트들과 그들이 고객에게 추천하는 종목을 매일 추적한다. MarketBeat는 시장이 널리 알아채기 전에 지금 고객에게 몰래 매수하라고 속삭이는 상위 5개 종목을 식별했으며, UnitedHealth Group은 그 목록에 없었다. 현재 UnitedHealth Group은 애널리스트들 사이에서 중립적 매수(Moderate Buy) 평가를 받고 있지만, 최고 평점 애널리스트들은 이 다섯 종목이 더 나은 매수 대상이라고 본다. 데이터센터와 전기차의 확산으로 전력망에 대한 부담은 더욱 커질 것이다. 전 세계 에너지 수요가 계속 증가하는 가운데 에너지주가 포트폴리오에서 어떤 역할을 할 수 있는지 알아보려면 이 보고서를 다운로드하세요. MarketBeat의 전체 리서치 도구 모음을 이용하려면 MarketBeat All Access에 가입하세요. 345 N Reid Place, Suite 620, Sioux Falls, SD 57103 contact@marketbeat.com (844) 978-6257 © MarketBeat Media, LLC 2010-2026. All rights reserved. © 2026 공정가치 가격은 매분 업데이트되며 Massive에서 제공됩니다. 기타 시장 데이터는 최소 10분 지연되며 Barchart Solutions에서 호스팅됩니다. 정보는 '있는 그대로' 정보 제공 목적에 한해 제공되며, 거래 목적이나 조언을 위한 것이 아니고 지연 제공됩니다. 모든 거래소 지연 정보 및 이용 약관은 Barchart의 면책 조항을 참조하십시오. 당사와 파트너사는 귀하의 웹사이트 이용 정보를 공유하여 경험 개선에 도움을 줍니다. 자세한 정보나 거부를 원하시면 아래의 '내 정보를 판매하지 말 것(Do Not Sell My Information)' 버튼을 클릭하십시오.",https://www.marketbeat.com/instant-alerts/filing-wealthcare-capital-partners-llc-sells-37566-shares-of-unitedhealth-group-incorporated-unh-2026-03-28/,Neutral
3,UNH,2026-03-28 11:08:20,"Mirador Capital Partners LP, UnitedHealth Group Incorporated(UNH) 포지션 확대 - MarketBeat","Mirador Capital Partners LP는 최근 증권거래위원회(SEC) 제출 서류에 따르면 4분기 동안 UnitedHealth Group Incorporated(NYSE:UNH - Free Report) 지분을 1,738.5% 늘렸다. 이 기관투자자는 해당 기간 23,592주를 추가 매수한 뒤 헬스케어 대기업 주식 24,949주를 보유하고 있다. UnitedHealth Group은 Mirador Capital Partners LP 보유 자산의 약 1.1%를 차지하며, 이는 20번째로 큰 포지션이다. Mirador Capital Partners LP의 UnitedHealth Group 보유 지분 가치는 최근 SEC 신고 기준 $8,236,000이었다. 다른 여러 헤지펀드와 기관투자자들도 이 종목을 사고팔았다. Norges Bank는 2분기에 UnitedHealth Group 주식의 신규 포지션을 약 $3,837,207,000어치 매입했다. Capital Research Global Investors는 3분기 동안 UnitedHealth Group 지분을 126.9% 늘렸다. Capital Research Global Investors는 해당 기간 7,293,009주를 추가 취득한 뒤 현재 헬스케어 대기업 주식 13,042,049주를 보유하고 있으며, 가치는 $4,503,419,000이다. Berkshire Hathaway Inc는 2분기에 UnitedHealth Group 주식의 신규 포지션을 약 $1,572,193,000어치 매입했다. Dodge & Cox는 2분기 UnitedHealth Group 지분을 117.7% 늘렸다. Dodge & Cox는 지난 분기 4,730,192주를 추가 매수한 뒤 현재 헬스케어 대기업 주식 8,750,560주를 보유하고 있으며, 가치는 $2,729,912,000이다. 마지막으로, Capital World Investors는 3분기 동안 UnitedHealth Group 지분을 18.8% 늘렸다. Capital World Investors는 지난 분기 3,439,182주를 추가 매수한 뒤 현재 헬스케어 대기업 주식 21,766,922주를 보유하고 있으며, 가치는 $7,516,107,000이다. 헤지펀드와 기타 기관투자자들이 회사 주식의 87.86%를 보유하고 있다. 이번 주 UnitedHealth Group에 영향을 미치는 주요 뉴스는 다음과 같다. UNH는 최근 여러 애널리스트 보고서의 대상이 되었다. Weiss Ratings는 3월 2일 월요일 리서치 노트에서 UnitedHealth Group을 '보유(c-)'에서 '매도(d+)'로 낮췄다. Oppenheimer는 1월 28일 수요일 리서치 보고서에서 UnitedHealth Group의 목표주가를 $415.00에서 $385.00으로 낮추고, 회사에 대해 '시장수익률 상회' 의견을 제시했다. Piper Sandler는 1월 27일 화요일 보고서에서 UnitedHealth Group 주식에 대해 '비중확대' 의견을 재확인했다. Morgan Stanley는 1월 23일 금요일 보고서에서 UnitedHealth Group 주식의 목표주가를 $411.00에서 $409.00으로 낮추고 회사에 대해 '비중확대' 의견을 제시했다. 마지막으로, Barclays는 1월 30일 금요일 리서치 보고서에서 UnitedHealth Group 주식의 목표주가를 $391.00에서 $327.00으로 낮추고, 회사에 대해 '비중확대' 의견을 제시했다. 한 명의 리서치 애널리스트가 강력 매수(Strong Buy), 열일곱 명이 매수(Buy), 여덟 명이 보유(Hold), 두 명이 매도(Sell) 의견을 제시했다. MarketBeat 데이터에 따르면 현재 회사의 평균 투자의견은 '중립적 매수(Moderate Buy)'이며, 컨센서스 목표주가는 $372.13이다. NYSE:UNH는 금요일 $259.15에 개장했다. 회사의 부채비율은 0.72, 유동비율은 0.79, 당좌비율은 0.79이다. 시가총액은 $235.23 billion이며, 주가수익비율은 19.65, PEG 비율은 1.23, 베타는 0.41이다. UnitedHealth Group Incorporated의 1년 최저가는 $234.60, 1년 최고가는 $606.36이다. 주식의 50일 단순이동평균은 $290.39, 200일 단순이동평균은 $322.62이다. UnitedHealth Group(NYSE:UNH - Get Free Report)은 마지막으로 1월 27일 화요일 분기 실적을 발표했다. 이 헬스케어 대기업은 분기 주당순이익(EPS) $2.11을 보고해 애널리스트 컨센서스 추정치 $2.09를 $0.02 상회했다. UnitedHealth Group의 순이익률은 2.69%, 자기자본이익률(ROE)은 14.79%였다. 회사의 해당 분기 매출은 $113.73 billion으로, 컨센서스 추정치 $113.38 billion과 비교됐다. 전년 같은 기간에는 주당순이익 $6.81을 기록했다. 분기 매출은 전년 동기 대비 12.3% 증가했다. UnitedHealth Group은 FY 2026 가이던스를 EPS 17.750-으로 제시했다. 애널리스트들은 UnitedHealth Group Incorporated가 현재 회계연도에 주당순이익 29.54를 기록할 것으로 예상한다. 회사는 또한 최근 분기 배당을 공시했으며, 3월 17일 화요일에 지급됐다. 3월 9일 월요일 기준 주주들에게 주당 $2.21이 지급됐다. 배당락일은 3월 9일 월요일이었다. 이는 연환산 배당금 $8.84, 배당수익률 3.4%에 해당한다. UnitedHealth Group의 배당성향(DPR)은 현재 67.02%다. UnitedHealth Group Inc는 미네소타주 민넷카에 본사를 둔 다각화된 헬스케어 회사로, UnitedHealthcare와 Optum이라는 두 개의 주요 사업 플랫폼을 운영한다. 1977년에 설립된 이 회사는 개인, 고용주, 정부 기관 및 기타 조직에 광범위한 건강보험 혜택과 헬스케어 서비스를 제공한다. 사업은 상업용 고용주 제공 플랜, 개인 및 Medicare·Medicaid 프로그램, 그리고 미국 및 일부 해외 시장의 고객과 의료 시스템을 위한 서비스까지 아우른다. UnitedHealthcare는 회사의 혜택 사업 부문으로, 건강보험 플랜과 네트워크를 운영하고, 의료 제공자와의 관계를 관리하며, 고용주·개인·정부 지원 프로그램을 위한 보장 상품을 제공한다. 다른 헤지펀드들이 UNH를 어떻게 보유하고 있는지 보고 싶으신가요? HoldingsChannel.com을 방문하면 UnitedHealth Group Incorporated(NYSE:UNH - Free Report)의 최신 13F 제출 및 내부자 거래 내역을 확인할 수 있다. 이 즉시 뉴스 알림은 독자에게 가장 빠른 보도와 편향되지 않은 보도를 제공하기 위해 MarketBeat의 내러티브 과학 기술과 금융 데이터를 기반으로 생성됐다. 이 기사에 대한 질문이나 의견은 contact@marketbeat.com으로 보내 주세요. UnitedHealth Group을 고려하기 전에, 이것을 먼저 들어보세요. MarketBeat는 월가 최고 평점 및 최고 성과를 낸 리서치 애널리스트들과 그들이 고객에게 추천하는 종목을 매일 추적한다. MarketBeat는 시장이 널리 알아채기 전에 지금 고객에게 몰래 매수하라고 속삭이는 상위 5개 종목을 식별했으며, UnitedHealth Group은 그 목록에 없었다. 현재 UnitedHealth Group은 애널리스트들 사이에서 중립적 매수(Moderate Buy) 평가를 받고 있지만, 최고 평점 애널리스트들은 이 다섯 종목이 더 나은 매수 대상이라고 본다. 일론 머스크의 가장 대담한 최신 행보를 살펴보세요. AI와 자율주행부터 우주 식민화까지, 투자자들이 다음 혁신의 물결을 어떻게 활용할 수 있는지 알아보세요. MarketBeat All Access에 가입하면 MarketBeat의 전체 리서치 도구 모음을 이용할 수 있습니다. 345 N Reid Place, Suite 620, Sioux Falls, SD 57103 contact@marketbeat.com (844) 978-6257 © MarketBeat Media, LLC 2010-2026. All rights reserved. © 2026 공정가치 가격은 매분 업데이트되며 Massive에서 제공됩니다. 기타 시장 데이터는 최소 10분 지연되며 Barchart Solutions에서 호스팅됩니다. 정보는 '있는 그대로' 정보 제공 목적에 한해 제공되며, 거래 목적이나 조언을 위한 것이 아니고 지연 제공됩니다. 모든 거래소 지연 정보 및 이용 약관은 Barchart의 면책 조항을 참조하십시오. 당사와 파트너사는 귀하의 웹사이트 이용 정보를 공유하여 경험 개선에 도움을 줍니다. 자세한 정보나 거부를 원하시면 아래의 '내 정보를 판매하지 말 것(Do Not Sell My Information)' 버튼을 클릭하십시오.",https://www.marketbeat.com/instant-alerts/filing-mirador-capital-partners-lp-raises-position-in-unitedhealth-group-incorporated-unh-2026-03-28/,Neutral
