id,ticker,date,title,content,url
1,ABBV,2026-03-27 18:42:21,"AbbVie: 강한 2026년 전망, 배당 인상 기대 (NYSE:ABBV) - Seeking Alpha","AbbVie Inc. (ABBV) 주가는 지난 2025년 10월 업데이트 이후 약 10% 하락했는데, 당시 저는 강한 상업적 진전과 비만 시장에서의 회사의 부상하는 노력을 설명했습니다. 저는 Growth Stock Forum에서 최고의 아이디어와 주요 커버리지를 게시합니다. 바이오테크에 초점을 맞춘 훌륭한 성장주를 찾고 있다면 가입을 고려해 보세요. 우리는 매력적인 위험/보상 구도에 집중하며, 포트폴리오와 관심종목에 있는 각 종목을 면밀히 추적합니다. 우리의 바이오테크 Top Picks는 지난해 137.6% 상승했고 2017년 이후 CAGR 35.3%를 기록했으며, 핵심 포트폴리오 LTGP는 23.2% CAGR을 기록했습니다(CAGR 성과는 2026년 3월 20일 기준). 제 공개 기사와 블로그에 대한 이메일 알림을 받으려면 팔로우 버튼을 클릭해 주세요. 더 깊이 있는 내용을 보려면 Growth Stock Forum에 가입하세요. 애널리스트 공시: 본인/당사는 언급된 어느 회사에 대해서도 주식, 옵션 또는 이와 유사한 파생상품 포지션을 보유하고 있지 않으며, 향후 72시간 내에 그러한 포지션을 개시할 계획도 없습니다. 저는 이 글을 직접 작성했으며, 제 개인적인 견해를 담고 있습니다. 이에 대한 보수를 받지 않았습니다(Seeking Alpha로부터의 보수 외). 본 기사에 언급된 어느 회사와도 사업상 관계가 없습니다. 이 기사는 작성자의 견해를 반영한 것이며, 어떤 방식으로도 매수 또는 매도 추천이나 투자 조언으로 간주되어서는 안 됩니다. Seeking Alpha 공시: 과거 실적은 향후 결과를 보장하지 않습니다. 어떤 투자 상품이 특정 투자자에게 적합한지에 대한 추천이나 조언은 제공되지 않습니다. 위에 표현된 견해나 의견은 Seeking Alpha 전체의 견해를 반영하지 않을 수 있습니다. Seeking Alpha는 공인된 증권 딜러, 브로커 또는 미국 투자자문업자나 투자은행이 아닙니다. 당사의 애널리스트는 전문 투자자와 개인 투자자를 모두 포함하는 제3자 작성자로, 이들은 어떤 기관이나 규제 당국의 면허나 인증을 받지 않았을 수 있습니다.",https://seekingalpha.com/article/4886675-abbvie-strong-2026-outlook-expect-dividend-increases
2,ABBV,2026-03-27 12:10:23,"World Investment Advisors, AbbVie Inc. $ABBV 지분 확대 - MarketBeat","World Investment Advisors는 SEC에 제출한 최신 Form 13F에 따르면 4분기 동안 AbbVie Inc. (NYSE:ABBV - Free Report) 보유 지분을 12.0% 늘렸습니다. 이 펀드는 해당 기간 동안 13,698주를 추가 매수한 뒤 회사 주식 127,623주를 보유했습니다. World Investment Advisors의 AbbVie 보유 지분 가치는 최근 보고 기간 말 기준 29,161,000달러였습니다. 다른 헤지펀드들도 최근 이 회사 주식을 사고팔았습니다. Evolution Wealth Management Inc.는 2분기에 약 26,000달러 상당의 AbbVie 주식을 새로 매수했습니다. Chelsea Counsel Co.는 3분기에 26,000달러어치 AbbVie 주식을 신규 취득했습니다. Litman Gregory Wealth Management LLC는 4분기에 28,000달러 상당의 AbbVie 지분을 새로 확보했습니다. Westend Capital Management LLC는 4분기에 29,000달러 상당의 AbbVie 신규 포지션을 매수했습니다. 마지막으로 Imprint Wealth LLC는 4분기 동안 AbbVie 지분을 56.3% 늘렸습니다. Imprint Wealth LLC는 지난 분기 45주를 추가로 취득한 뒤 현재 회사 주식 125주를 보유하고 있으며, 가치는 29,000달러입니다. 기관투자자와 헤지펀드는 회사 주식의 70.23%를 보유하고 있습니다. 최근 여러 주식 리서치 애널리스트들도 이 종목에 대해 의견을 냈습니다. Goldman Sachs Group은 1월 28일 수요일 리서치 보고서에서 AbbVie에 대해 '중립' 의견을 재확인하고 목표주가 223.00달러를 제시했습니다. UBS Group은 2월 5일 목요일 리서치 보고서에서 AbbVie 목표주가를 240.00달러에서 230.00달러로 낮추고 '중립' 의견을 제시했습니다. BMO Capital Markets는 3월 9일 월요일 리서치 노트에서 AbbVie에 대해 '시장수익률 상회(outperform)' 의견을 재확인했습니다. Citigroup은 1월 27일 화요일 보고서에서 AbbVie의 목표주가를 235.00달러에서 230.00달러로 낮추고 회사에 대해 '중립' 의견을 제시했습니다. 마지막으로 Sanford C. Bernstein은 2월 5일 목요일 보고서에서 AbbVie에 대해 '시장수익률(match market perform)' 의견을 재확인했습니다. 주식 리서치 애널리스트 2명은 Strong Buy 의견을, 14명은 Buy 의견을, 9명은 Hold 의견을 제시했습니다. MarketBeat 데이터에 따르면 현재 회사의 평균 의견은 'Moderate Buy'이며 평균 목표주가는 253.15달러입니다. 관련 소식으로, SVP David Ryan Purdue는 3월 4일 수요일 거래에서 회사 주식 5,230주를 매도했습니다. 주식은 평균 233.56달러에 매도되어 총 거래금액은 1,221,518.80달러였습니다. 거래 완료 후 수석 부사장은 회사 주식 2,654주를 직접 보유하게 되었으며, 가치는 619,868.24달러였습니다. 이는 보유 지분이 66.34% 감소한 것을 의미합니다. 해당 매도는 증권거래위원회(SEC)에 제출된 신고서에 공시되었으며, 이 하이퍼링크를 통해 확인할 수 있습니다. 또한 EVP Perry C. Siatis는 2월 25일 수요일 거래에서 주식 22,381주를 매도했습니다. 주식은 평균 230.00달러에 매도되어 총 가치는 5,147,630.00달러였습니다. 매도 완료 후 해당 executive vice president는 회사 주식 38,137주를 직접 보유하게 되었으며, 가치는 8,771,510달러였습니다. 이는 주식 보유가 36.98% 감소한 것입니다. 이 매도 공시는 SEC 신고서에서 확인할 수 있습니다. 회사 내부자는 회사 주식의 0.25%를 보유하고 있습니다. AbbVie 주가는 금요일에 211.12달러로 시작했습니다. 이 회사의 50일 이동평균은 222.06달러이며 200일 이동평균은 224.53달러입니다. AbbVie Inc.의 1년 최저가는 164.39달러, 1년 최고가는 244.81달러입니다. 회사의 시가총액은 3,732억9,000만 달러이며, 주가수익비율(P/E)은 89.46, PEG 비율은 0.72, 베타는 0.34입니다. AbbVie(NYSE:ABBV - Get Free Report)는 지난 2월 4일 수요일 최근 분기 실적을 발표했습니다. 회사는 해당 분기 주당순이익(EPS) 2.71달러를 보고해, 애널리스트 컨센서스 2.65달러를 0.06달러 상회했습니다. AbbVie의 순이익률은 6.91%였고 자기자본이익률(ROE)은 -1,579.75%였습니다. 해당 분기 매출은 166억2,000만 달러로, 컨센서스 예상치 163억9,000만 달러를 웃돌았습니다. 전년 동기 같은 분기에는 EPS 2.16달러를 기록했습니다. 해당 분기 매출은 전년 동기 대비 10.0% 증가했습니다. AbbVie는 2026 회계연도 가이던스를 EPS 14.370~14.570달러, 2026년 1분기 가이던스를 EPS 2.970~3.010달러로 제시했습니다. 애널리스트들은 평균적으로 AbbVie Inc.가 올해 EPS 12.31달러를 기록할 것으로 예상합니다. 회사는 또한 최근 분기 배당을 ঘোষণা했으며, 배당금은 5월 15일 금요일 지급될 예정입니다. 4월 15일 수요일 기준 주주명부에 오른 주주들은 주당 1.73달러의 배당을 받게 됩니다. 이는 연환산 기준 배당금 6.92달러, 배당수익률 3.3%를 의미합니다. 배당락일은 4월 15일 수요일입니다. AbbVie의 배당성향은 현재 293.22%입니다. AbbVie는 2013년 Abbott Laboratories에서 분사해 설립된 글로벌 연구 중심 바이오제약 회사로, 본사는 일리노이주 노스시카고에 있습니다. 이 회사는 복잡하고 종종 만성적인 의학적 질환에 대한 치료법을 발견, 개발 및 상용화하는 데 집중하고 있습니다. 연구개발, 제조, 규제업무 및 상용화 전반에 걸쳐 사업을 운영하며, 여러 치료 영역에서 특화 의약품을 시장에 출시하는 데 중점을 둡니다. AbbVie의 제품 포트폴리오와 파이프라인은 면역학, 종양학, 신경과학, 바이러스학, 여성 건강 등 여러 주요 치료 범주를 포괄합니다. 이 즉시 뉴스 알림은 독자에게 가장 빠른 보도와 편향되지 않은 커버리지를 제공하기 위해 MarketBeat의 내러티브 과학 기술과 금융 데이터를 바탕으로 생성되었습니다. 이 기사에 대한 질문이나 의견은 contact@marketbeat.com으로 보내 주십시오. AbbVie를 고려하기 전에 이것을 들어보시기 바랍니다. MarketBeat는 월가의 최고 평가 및 최고 성과 연구 애널리스트들과 그들이 고객에게 추천하는 종목을 매일 추적합니다. MarketBeat는 시장이 더 넓게 알아채기 전에 지금 조용히 고객에게 매수를 권하는 상위 애널리스트들의 5개 종목을 찾아냈으며, AbbVie는 그 목록에 없었습니다. AbbVie는 현재 애널리스트들 사이에서 Moderate Buy 의견을 받고 있지만, 최고 평점 애널리스트들은 이 5개 종목이 더 나은 매수 대상이라고 생각합니다. Meta, Roblox 또는 Unity에 투자할 생각이신가요? 투자하기 전에 메타버스와 공개 시장에 대해 streetwise 투자자들이 알아야 할 내용을 배우려면 링크를 클릭하세요. MarketBeat의 전체 연구 도구를 이용하려면 MarketBeat All Access에 가입하세요. 345 N Reid Place, Suite 620, Sioux Falls, SD 57103 contact@marketbeat.com (844) 978-6257 © MarketBeat Media, LLC 2010-2026. 모든 권리 보유. © 2026 공정가치 가격은 매분 업데이트되며 Massive가 제공합니다. 기타 시장 데이터는 최소 10분 지연되며 Barchart Solutions가 호스팅합니다. 정보는 '있는 그대로' 제공되며 거래 목적이나 조언이 아닌 정보 제공 목적으로만 제공되고 지연될 수 있습니다. 모든 거래소 지연 및 이용약관은 Barchart의 면책조항을 참조하세요. 아래에 이메일 주소를 입력하면 AbbVie 및 관련 회사의 최신 뉴스와 애널리스트 등급에 대한 간결한 일일 요약을 MarketBeat.com의 무료 일일 등급 뉴스레터로 받아볼 수 있습니다. 당사와 파트너사는 귀하의 사용자 경험 개선을 위해 본 웹사이트 사용에 대한 정보를 공유합니다. 자세한 내용이나 제외를 원하시면 아래의 내 정보 판매 금지(Do Not Sell My Information) 버튼을 클릭하세요.",https://www.marketbeat.com/instant-alerts/filing-world-investment-advisors-increases-position-in-abbvie-inc-abbv-2026-03-27/
3,ABBV,2026-03-27 11:21:52,"Global X Japan Co. Ltd., AbbVie Inc. $ABBV 주식 보유 확대 - MarketBeat","Global X Japan Co. Ltd.는 증권거래위원회(SEC)에 제출한 최신 13F 보고서에 따르면 4분기 동안 AbbVie Inc. (NYSE:ABBV - Free Report) 보유 지분을 294.6% 늘렸습니다. 이 기관투자자는 해당 분기 동안 75,595주를 추가 취득한 뒤 회사 주식 101,259주를 보유했습니다. AbbVie는 Global X Japan Co. Ltd. 보유 지분의 약 1.8%를 차지하며, 이는 17번째로 큰 포지션입니다. 최근 분기 말 기준 Global X Japan Co. Ltd.의 AbbVie 보유 가치는 23,137,000달러였습니다. 다른 기관투자자와 헤지펀드들도 회사 보유 지분을 조정했습니다. Brighton Jones LLC는 4분기 동안 AbbVie 지분을 17.4% 늘렸습니다. Brighton Jones LLC는 해당 기간 3,401주를 추가 매수한 뒤 현재 회사 주식 22,912주를 보유하고 있으며, 가치는 4,072,000달러입니다. Revolve Wealth Partners LLC는 4분기 AbbVie 주식 지분을 72.7% 늘렸습니다. Revolve Wealth Partners LLC는 해당 기간 3,064주를 추가 취득한 뒤 현재 회사 주식 7,279주를 보유하고 있으며, 가치는 1,294,000달러입니다. Schnieders Capital Management LLC.는 2분기 동안 AbbVie 주식 지분을 5.0% 늘렸습니다. Schnieders Capital Management LLC.는 해당 기간 789주를 추가 취득한 뒤 현재 회사 주식 16,466주를 보유하고 있으며, 가치는 3,056,000달러입니다. Richmond Investment Services LLC는 2분기에 약 283,000달러 상당의 AbbVie 주식을 새로 매수했습니다. 마지막으로 Maia Wealth LLC는 2분기 동안 AbbVie 보유 지분을 2.2% 늘렸습니다. Maia Wealth LLC는 지난 분기 67주를 추가 매수한 뒤 현재 회사 주식 3,113주를 보유하고 있으며, 가치는 578,000달러입니다. 기관투자자는 회사 주식의 70.23%를 보유하고 있습니다. ABBV 주가는 금요일에 211.12달러로 시작했습니다. AbbVie Inc.의 12개월 최저가는 164.39달러, 12개월 최고가는 244.81달러입니다. 해당 주식의 시가총액은 3,732억9,000만 달러이며, 주가수익비율(P/E)은 89.46, P/E/G 비율은 0.72, 베타는 0.34입니다. 회사의 50일 단순이동평균은 222.06달러, 200일 단순이동평균은 224.53달러입니다. AbbVie(NYSE:ABBV - Get Free Report)는 지난 2월 4일 수요일 최근 분기 실적을 발표했습니다. 회사는 해당 분기 주당순이익(EPS) 2.71달러를 보고해, 애널리스트 컨센서스 2.65달러를 0.06달러 상회했습니다. AbbVie의 순이익률은 6.91%였고 자기자본이익률(ROE)은 -1,579.75%였습니다. 해당 분기 매출은 166억2,000만 달러로, 애널리스트 예상치 163억9,000만 달러를 웃돌았습니다. 전년 같은 분기에는 EPS 2.16달러를 기록했습니다. 회사의 매출은 전년 동기 대비 10.0% 증가했습니다. AbbVie는 2026 회계연도 가이던스를 EPS 14.370~14.570달러, 2026년 1분기 가이던스를 EPS 2.970~3.010달러로 제시했습니다. 애널리스트들은 현재 회계연도에 AbbVie Inc.가 EPS 12.31달러를 기록할 것으로 예상합니다. 회사는 또한 최근 분기 배당을 발표했으며, 배당금은 5월 15일 금요일 지급될 예정입니다. 4월 15일 수요일 기준 주주명부에 오른 주주들은 주당 1.73달러의 배당을 받게 됩니다. 이는 연환산 배당금 6.92달러, 수익률 3.3%를 의미합니다. 이 배당의 배당락일은 4월 15일 수요일입니다. AbbVie의 현재 배당성향은 293.22%입니다. 다른 소식으로, EVP Perry C. Siatis는 2월 25일 수요일 거래에서 AbbVie 주식 22,381주를 매도했습니다. 주식은 평균 230.00달러에 매도되어 총 가치는 5,147,630.00달러였습니다. 거래 후 executive vice president는 회사 주식 38,137주를 직접 보유하게 되었으며, 가치는 약 8,771,510달러였습니다. 이는 해당 주식 보유가 36.98% 감소한 것입니다. 이 거래는 SEC 웹사이트를 통해 확인할 수 있는 SEC 제출 문서에 공시되었습니다. 또한 SVP David Ryan Purdue는 3월 4일 수요일 거래에서 AbbVie 주식 5,230주를 매도했습니다. 주식은 평균 233.56달러에 매도되어 총 거래금액은 1,221,518.80달러였습니다. 거래 후 수석 부사장은 회사 주식 2,654주를 직접 보유하게 되었으며, 가치는 약 619,868.24달러였습니다. 이는 주식 보유가 66.34% 감소한 것을 의미합니다. 이 매도의 SEC 신고서에는 추가 정보가 제공됩니다. 회사 내부자는 회사 주식의 0.25%를 보유하고 있습니다. AbbVie는 2013년 Abbott Laboratories에서 분사해 설립된 글로벌 연구 중심 바이오제약 회사로, 본사는 일리노이주 노스시카고에 있습니다. 이 회사는 복잡하고 종종 만성적인 의학적 질환에 대한 치료법을 발견, 개발 및 상용화하는 데 집중하고 있습니다. 연구개발, 제조, 규제업무 및 상용화 전반에 걸쳐 사업을 운영하며, 여러 치료 영역에서 특화 의약품을 시장에 출시하는 데 중점을 둡니다. AbbVie의 제품 포트폴리오와 파이프라인은 면역학, 종양학, 신경과학, 바이러스학, 여성 건강 등 여러 주요 치료 범주를 포괄합니다. 다른 헤지펀드들이 ABBV를 어떻게 보유하고 있는지 보고 싶으신가요? AbbVie Inc. (NYSE:ABBV - Free Report)의 최신 13F 제출 내역과 내부자 거래를 확인하려면 HoldingsChannel.com을 방문하세요. 이 즉시 뉴스 알림은 독자에게 가장 빠른 보도와 편향되지 않은 커버리지를 제공하기 위해 MarketBeat의 내러티브 과학 기술과 금융 데이터를 바탕으로 생성되었습니다. 이 기사에 대한 질문이나 의견은 contact@marketbeat.com으로 보내 주십시오. AbbVie를 고려하기 전에 이것을 들어보시기 바랍니다. MarketBeat는 월가의 최고 평가 및 최고 성과 연구 애널리스트들과 그들이 고객에게 추천하는 종목을 매일 추적합니다. MarketBeat는 시장이 더 넓게 알아채기 전에 지금 조용히 고객에게 매수를 권하는 상위 애널리스트들의 5개 종목을 찾아냈으며, AbbVie는 그 목록에 없었습니다. AbbVie는 현재 애널리스트들 사이에서 Moderate Buy 의견을 받고 있지만, 최고 평점 애널리스트들은 이 5개 종목이 더 나은 매수 대상이라고 생각합니다. 주식 시장에 막 입문하셨나요? 다음 10개 단순한 종목은 옵션, 기술적 분석 또는 기타 고급 전략을 몰라도 초보 투자자가 장기적인 자산을 쌓는 데 도움이 될 수 있습니다. MarketBeat의 전체 연구 도구를 이용하려면 MarketBeat All Access에 가입하세요. 345 N Reid Place, Suite 620, Sioux Falls, SD 57103 contact@marketbeat.com (844) 978-6257 © MarketBeat Media, LLC 2010-2026. 모든 권리 보유. © 2026 공정가치 가격은 매분 업데이트되며 Massive가 제공합니다. 기타 시장 데이터는 최소 10분 지연되며 Barchart Solutions가 호스팅합니다. 정보는 '있는 그대로' 제공되며 거래 목적이나 조언이 아닌 정보 제공 목적으로만 제공되고 지연될 수 있습니다. 모든 거래소 지연 및 이용약관은 Barchart의 면책조항을 참조하세요. 당사와 파트너사는 귀하의 사용자 경험 개선을 위해 본 웹사이트 사용에 대한 정보를 공유합니다. 자세한 내용이나 제외를 원하시면 아래의 내 정보 판매 금지(Do Not Sell My Information) 버튼을 클릭하세요.",https://www.marketbeat.com/instant-alerts/filing-global-x-japan-co-ltd-increases-stock-position-in-abbvie-inc-abbv-2026-03-27/
