ticker,title,date,content,url
ABBV,Golden Reserve Retirement LLC Invests $1.68 Million in AbbVie Inc. $ABBV - MarketBeat,2026-04-25 08:38:05,"Golden Reserve Retirement LLC purchased a new position in shares of  AbbVie Inc. (NYSE:ABBV - Free Report) in the 4th quarter, according to its most recent filing with the Securities and Exchange Commission (SEC). The institutional investor  purchased 7,346 shares of the company's stock, valued at approximately $1,678,000. AbbVie makes up   0.3% of Golden Reserve Retirement LLC's holdings, making the stock its 13th largest holding. A number of other institutional investors and hedge funds have also bought and sold shares of ABBV. Brighton Jones LLC increased its holdings in  AbbVie by 17.4% in the fourth quarter. Brighton Jones LLC now owns 22,912 shares of the company's stock valued at $4,072,000 after purchasing an additional 3,401 shares during the period.  Revolve Wealth Partners LLC increased its holdings in  AbbVie by 72.7% in the fourth quarter. Revolve Wealth Partners LLC now owns 7,279 shares of the company's stock valued at $1,294,000 after purchasing an additional 3,064 shares during the period.  Schnieders Capital Management LLC. increased its holdings in  AbbVie by 5.0% in the second quarter. Schnieders Capital Management LLC. now owns 16,466 shares of the company's stock valued at $3,056,000 after purchasing an additional 789 shares during the period.  Ieq Capital LLC increased its holdings in  AbbVie by 4.6% in the second quarter. Ieq Capital LLC now owns 120,035 shares of the company's stock valued at $22,281,000 after purchasing an additional 5,274 shares during the period.  Finally, Worldquant Millennium Advisors LLC increased its holdings in  AbbVie by 117.3% in the second quarter. Worldquant Millennium Advisors LLC now owns 1,135,034 shares of the company's stock valued at $210,685,000 after purchasing an additional 612,702 shares during the period. 70.23% of the stock is currently owned by institutional investors and hedge funds. Shares of AbbVie stock opened at $198.71 on Friday. The business has a 50-day moving average price of $216.68 and a two-hundred day moving average price of $222.40. AbbVie Inc. has a 1-year low of $176.57 and a 1-year high of $244.81. The company has a market cap of $351.35 billion, a P/E ratio of 84.20, a PEG ratio of 0.72 and a beta of 0.38. AbbVie (NYSE:ABBV - Get Free Report) last issued its quarterly earnings results on Wednesday, February 4th. The company reported $2.71 earnings per share for the quarter, topping analysts' consensus estimates of $2.65 by $0.06. AbbVie had a negative return on equity of 1,579.75% and a net margin of 6.91%.The firm had revenue of $16.62 billion during the quarter, compared to the consensus estimate of $16.39 billion. During the same period last year, the business posted $2.16 EPS. The business's revenue was up 10.0% compared to the same quarter last year. AbbVie has set its FY 2026 guidance at 14.370-14.570 EPS and its Q1 2026 guidance at 2.970-3.010 EPS.  Equities research analysts forecast that  AbbVie Inc. will post 14.21 EPS for the current fiscal year. The firm also recently declared a quarterly dividend, which will be paid on Friday, May 15th. Shareholders of record on Wednesday, April 15th will be issued a dividend of $1.73 per share. This represents a $6.92 dividend on an annualized basis and a yield of 3.5%. The ex-dividend date is Wednesday, April 15th. AbbVie's dividend payout ratio (DPR) is presently 293.22%. Here are the key news stories impacting AbbVie this week: A number of analysts recently weighed in on the company. Barclays assumed coverage on AbbVie in a report on Thursday, February 19th. They issued an ""overweight"" rating and a $275.00 price objective for the company. Piper Sandler decreased their price objective on AbbVie from $299.00 to $294.00 and set an ""overweight"" rating for the company in a report on Thursday. BMO Capital Markets  restated an ""outperform"" rating on shares of AbbVie in a report on Monday, March 9th. Evercore decreased their price objective on AbbVie from $232.00 to $228.00 and set an ""outperform"" rating for the company in a report on Wednesday, February 4th. Finally, Citigroup decreased their price objective on AbbVie from $235.00 to $230.00 and set a ""neutral"" rating for the company in a report on Tuesday, January 27th. Three investment analysts have rated the stock with a Strong Buy rating, fourteen have issued  a Buy rating and nine have given a Hold rating to the stock. Based on data from MarketBeat.com, the company presently has a consensus rating of ""Moderate Buy"" and an average target price of $253.19. In other news, EVP Perry C. Siatis sold 22,381 shares of the firm's stock in a transaction dated Wednesday, February 25th. The stock was sold at an average price of $230.00, for a total value of $5,147,630.00. Following the completion of the sale, the executive vice president directly owned 38,137 shares in the company, valued at $8,771,510. This trade represents a 36.98% decrease in their position. The sale was disclosed in a filing with the SEC, which is available at this link. Also, SVP David Ryan Purdue sold 5,230 shares of the firm's stock in a transaction dated Wednesday, March 4th. The shares were sold at an average price of $233.56, for a total value of $1,221,518.80. Following the completion of the sale, the senior vice president owned 2,654 shares of the company's stock, valued at approximately $619,868.24. This represents a 66.34% decrease in their ownership of the stock. Additional details regarding this sale are available in the official SEC disclosure. Company insiders own  0.06% of the company's stock. AbbVie is a global, research-driven biopharmaceutical company that was created as a spin-off from Abbott Laboratories in 2013 and is headquartered in North Chicago, Illinois. The company focuses on discovering, developing and commercializing therapies for complex and often chronic medical conditions. Its operations span research and development, manufacturing, regulatory affairs and commercialization, with an emphasis on bringing specialty medicines to market across multiple therapeutic areas. AbbVie's product portfolio and pipeline cover several major therapeutic categories, including immunology, oncology, neuroscience, virology and women's health. Want to see what other hedge funds are holding ABBV? Visit HoldingsChannel.com to get the latest 13F filings and insider trades for AbbVie Inc. (NYSE:ABBV - Free Report). This instant news alert was generated by narrative science technology and financial data from MarketBeat in order to provide readers with the fastest reporting and unbiased coverage. Please send any questions or comments about this story to contact@marketbeat.com. Before you consider AbbVie, you'll want to hear this. MarketBeat keeps track of Wall Street's top-rated and best performing research analysts and the stocks they recommend to their clients on a daily basis. MarketBeat has identified the five stocks that top analysts are quietly whispering to their clients to buy now before the broader market catches on... and AbbVie wasn't on the list. While AbbVie currently has a Moderate Buy rating among analysts, top-rated analysts believe these five stocks are better buys. With the proliferation of data centers and electric vehicles, the electric grid will only get more strained. Download this report to learn how energy stocks can play a role in your portfolio as the global demand for energy continues to grow. Sign up for MarketBeat All Access to gain access to MarketBeat's full suite of research tools. 345 N Reid Place, Suite 620, Sioux Falls, SD 57103
                                        
                                        contact@marketbeat.com
                                        
                                        (844) 978-6257 © MarketBeat Media, LLC 2010-2026. All rights reserved. © 2026   Fair market value prices are updated every minute and are provided by Massive. Other market data provided is at least 10-minutes delayed and hosted by Barchart Solutions.  Information is provided 'as-is' and solely for informational purposes, not for trading purposes or advice, and is delayed. To see all exchange delays and terms of use please see Barchart's disclaimer. Enter your email address below to receive a concise daily summary of the latest news and analysts’ ratings for AbbVie and related companies with MarketBeat.com’s FREE daily ratings newsletter.",https://www.marketbeat.com/instant-alerts/filing-golden-reserve-retirement-llc-invests-168-million-in-abbvie-inc-abbv-2026-04-25/
ABBV,Calamos Advisors LLC Grows Stock Holdings in AbbVie Inc. $ABBV - MarketBeat,2026-04-25 07:42:07,"Calamos Advisors LLC boosted its holdings in  AbbVie Inc. (NYSE:ABBV - Free Report) by 3.4% in the fourth quarter, according to its most recent 13F filing with the Securities and Exchange Commission. The institutional investor  owned 466,290 shares of the company's stock after buying an additional 15,458 shares during the period. Calamos Advisors LLC's holdings in AbbVie were worth $106,543,000 as of its most recent filing with the Securities and Exchange Commission. A number of other hedge funds have also bought and sold shares of ABBV. Chelsea Counsel Co. purchased a new position in shares of  AbbVie during the 3rd quarter valued at $26,000.  Westend Capital Management LLC purchased a new position in shares of  AbbVie during the 4th quarter valued at $29,000.  Texas Capital Bancshares Inc TX purchased a new position in shares of  AbbVie during the 3rd quarter valued at $31,000.  WestEnd Advisors LLC grew its position in shares of  AbbVie by 160.4% during the 4th quarter. WestEnd Advisors LLC now owns 138 shares of the company's stock valued at $32,000 after purchasing an additional 85 shares in the last quarter.  Finally, Caitlin John LLC purchased a new position in shares of  AbbVie during the 3rd quarter valued at $33,000. 70.23% of the stock is currently owned by hedge funds and other institutional investors. A number of research analysts have recently commented on ABBV shares. Canaccord Genuity Group started coverage on shares of AbbVie in a research report on Monday. They set a ""buy"" rating and a $262.00 price target for the company. Barclays started coverage on shares of AbbVie in a research report on Thursday, February 19th. They set an ""overweight"" rating and a $275.00 price target for the company. Cantor Fitzgerald reduced their price target on shares of AbbVie from $250.00 to $240.00 and set an ""overweight"" rating for the company in a research report on Wednesday, April 8th. Sanford C. Bernstein  restated a ""market perform"" rating on shares of AbbVie in a research report on Thursday, February 5th. Finally, William Blair  restated an ""outperform"" rating on shares of AbbVie in a research report on Monday, March 9th. Three investment analysts have rated the stock with a Strong Buy rating, fourteen have assigned  a Buy rating and nine have issued  a Hold rating to the company's stock. According to data from MarketBeat.com, the company currently has a consensus rating of ""Moderate Buy"" and an average target price of $253.19. Here are the key news stories impacting AbbVie this week: NYSE ABBV opened at $198.71 on Friday. AbbVie Inc. has a 52-week low of $176.57 and a 52-week high of $244.81. The company has a market capitalization of $351.35 billion, a P/E ratio of 84.20, a P/E/G ratio of 0.72 and a beta of 0.38. The company has a fifty day moving average of $216.68 and a 200-day moving average of $222.40. AbbVie (NYSE:ABBV - Get Free Report) last posted its quarterly earnings data on Wednesday, February 4th. The company reported $2.71 earnings per share (EPS) for the quarter, topping analysts' consensus estimates of $2.65 by $0.06. AbbVie had a net margin of 6.91% and a negative return on equity of 1,579.75%. The company had revenue of $16.62 billion during the quarter, compared to the consensus estimate of $16.39 billion. During the same period in the previous year, the firm posted $2.16 EPS. The firm's revenue was up 10.0% compared to the same quarter last year. AbbVie has set its FY 2026 guidance at 14.370-14.570 EPS and its Q1 2026 guidance at 2.970-3.010 EPS.  As a group, analysts forecast that  AbbVie Inc. will post 14.21 EPS for the current fiscal year. The business also recently disclosed a quarterly dividend, which will be paid on Friday, May 15th. Stockholders of record on Wednesday, April 15th will be issued a $1.73 dividend. The ex-dividend date is Wednesday, April 15th. This represents a $6.92 annualized dividend and a dividend yield of 3.5%. AbbVie's payout ratio is currently 293.22%. In other news, SVP David Ryan Purdue sold 5,230 shares of the business's stock in a transaction dated Wednesday, March 4th. The stock was sold at an average price of $233.56, for a total value of $1,221,518.80. Following the completion of the sale, the senior vice president owned 2,654 shares of the company's stock, valued at approximately $619,868.24. The trade was a 66.34% decrease in their position. The transaction was disclosed in a legal filing with the SEC, which is accessible through this link. Also, EVP Perry C. Siatis sold 22,381 shares of the firm's stock in a transaction that occurred on Wednesday, February 25th. The stock was sold at an average price of $230.00, for a total value of $5,147,630.00. Following the transaction, the executive vice president owned 38,137 shares in the company, valued at approximately $8,771,510. The trade was a 36.98% decrease in their ownership of the stock. Additional details regarding this sale are available in the official SEC disclosure. Insiders own  0.06% of the company's stock. AbbVie is a global, research-driven biopharmaceutical company that was created as a spin-off from Abbott Laboratories in 2013 and is headquartered in North Chicago, Illinois. The company focuses on discovering, developing and commercializing therapies for complex and often chronic medical conditions. Its operations span research and development, manufacturing, regulatory affairs and commercialization, with an emphasis on bringing specialty medicines to market across multiple therapeutic areas. AbbVie's product portfolio and pipeline cover several major therapeutic categories, including immunology, oncology, neuroscience, virology and women's health. This instant news alert was generated by narrative science technology and financial data from MarketBeat in order to provide readers with the fastest reporting and unbiased coverage. Please send any questions or comments about this story to contact@marketbeat.com. Before you consider AbbVie, you'll want to hear this. MarketBeat keeps track of Wall Street's top-rated and best performing research analysts and the stocks they recommend to their clients on a daily basis. MarketBeat has identified the five stocks that top analysts are quietly whispering to their clients to buy now before the broader market catches on... and AbbVie wasn't on the list. While AbbVie currently has a Moderate Buy rating among analysts, top-rated analysts believe these five stocks are better buys. Click the link to see MarketBeat's list of seven stocks and why their long-term outlooks are very promising. Sign up for MarketBeat All Access to gain access to MarketBeat's full suite of research tools. 345 N Reid Place, Suite 620, Sioux Falls, SD 57103
                                        
                                        contact@marketbeat.com
                                        
                                        (844) 978-6257 © MarketBeat Media, LLC 2010-2026. All rights reserved. © 2026   Fair market value prices are updated every minute and are provided by Massive. Other market data provided is at least 10-minutes delayed and hosted by Barchart Solutions.  Information is provided 'as-is' and solely for informational purposes, not for trading purposes or advice, and is delayed. To see all exchange delays and terms of use please see Barchart's disclaimer.",https://www.marketbeat.com/instant-alerts/filing-calamos-advisors-llc-grows-stock-holdings-in-abbvie-inc-abbv-2026-04-25/
ABBV,AbbVie (NYSE:ABBV) Trading Down 1.1% - Time to Sell? - MarketBeat,2026-04-24 21:30:30,"AbbVie Inc. (NYSE:ABBV - Get Free Report)'s stock price dropped 1.1% during mid-day trading on Friday . The stock traded as low as $197.14 and last traded at $198.7110. Approximately 7,602,917 shares were traded  during trading, an increase of 6% from the average daily volume of 7,171,604 shares. The stock had previously closed at $200.95. Here are the key news stories impacting AbbVie this week: ABBV has been the subject of several research analyst reports. UBS Group lowered their price target on shares of AbbVie from $240.00 to $230.00 and set a ""neutral"" rating for the company in a report on Thursday, February 5th. Cantor Fitzgerald lowered their price target on shares of AbbVie from $250.00 to $240.00 and set an ""overweight"" rating for the company in a report on Wednesday, April 8th. Weiss Ratings  reiterated a ""hold (c)"" rating on shares of AbbVie in a report on Wednesday, January 21st. Canaccord Genuity Group initiated coverage on shares of AbbVie in a report on Monday. They set a ""buy"" rating and a $262.00 price target for the company. Finally, BMO Capital Markets  reiterated an ""outperform"" rating on shares of AbbVie in a report on Monday, March 9th. Three equities research analysts have rated the stock with a Strong Buy rating, fourteen have assigned  a Buy rating and nine have issued  a Hold rating to the stock. Based on data from MarketBeat.com, the stock currently has a consensus rating of ""Moderate Buy"" and a consensus target price of $253.19. The firm has a market capitalization of $351.35 billion, a price-to-earnings ratio of 84.20, a P/E/G ratio of 0.72 and a beta of 0.38. The stock has a fifty day moving average of $217.33 and a two-hundred day moving average of $222.62. AbbVie (NYSE:ABBV - Get Free Report) last posted its quarterly earnings data on Wednesday, February 4th. The company reported $2.71 earnings per share for the quarter, beating analysts' consensus estimates of $2.65 by $0.06. The business had revenue of $16.62 billion during the quarter, compared to the consensus estimate of $16.39 billion. AbbVie had a negative return on equity of 1,579.75% and a net margin of 6.91%.AbbVie's quarterly revenue was up 10.0% on a year-over-year basis. During the same period in the prior year, the business posted $2.16 earnings per share. AbbVie has set its FY 2026 guidance at 14.370-14.570 EPS and its Q1 2026 guidance at 2.970-3.010 EPS.  On average, research analysts forecast that  AbbVie Inc. will post 14.22 EPS for the current year. The business also recently disclosed a quarterly dividend, which will be paid on Friday, May 15th. Investors of record on Wednesday, April 15th will be issued a $1.73 dividend. This represents a $6.92 dividend on an annualized basis and a yield of 3.5%. The ex-dividend date is Wednesday, April 15th. AbbVie's dividend payout ratio  is presently 293.22%. In related news, EVP Perry C. Siatis sold 22,381 shares of the stock in a transaction on Wednesday, February 25th. The stock was sold at an average price of $230.00, for a total value of $5,147,630.00. Following the completion of the sale, the executive vice president directly owned 38,137 shares in the company, valued at $8,771,510. This represents a 36.98% decrease in their ownership of the stock. The transaction was disclosed in a document filed with the SEC, which is available at this hyperlink. Also, SVP David Ryan Purdue sold 5,230 shares of the stock in a transaction dated Wednesday, March 4th. The stock was sold at an average price of $233.56, for a total value of $1,221,518.80. Following the sale, the senior vice president owned 2,654 shares of the company's stock, valued at approximately $619,868.24. The trade was a 66.34% decrease in their ownership of the stock. Additional details regarding this sale are available in the official SEC disclosure. Corporate insiders own  0.06% of the company's stock. A number of large investors have recently bought and sold shares of ABBV. Chelsea Counsel Co. acquired a new stake in  AbbVie during the 3rd quarter worth about $26,000.  Litman Gregory Wealth Management LLC acquired a new stake in  AbbVie during the 4th quarter worth about $28,000.  Westend Capital Management LLC acquired a new stake in  AbbVie during the 4th quarter worth about $29,000.  Imprint Wealth LLC grew its holdings in  AbbVie by 56.3% during the 4th quarter. Imprint Wealth LLC now owns 125 shares of the company's stock worth $29,000 after acquiring an additional 45 shares during the period.  Finally, Texas Capital Bancshares Inc TX acquired a new stake in  AbbVie during the 3rd quarter worth about $31,000. 70.23% of the stock is currently owned by institutional investors and hedge funds. AbbVie is a global, research-driven biopharmaceutical company that was created as a spin-off from Abbott Laboratories in 2013 and is headquartered in North Chicago, Illinois. The company focuses on discovering, developing and commercializing therapies for complex and often chronic medical conditions. Its operations span research and development, manufacturing, regulatory affairs and commercialization, with an emphasis on bringing specialty medicines to market across multiple therapeutic areas. AbbVie's product portfolio and pipeline cover several major therapeutic categories, including immunology, oncology, neuroscience, virology and women's health. This instant news alert was generated by narrative science technology and financial data from MarketBeat in order to provide readers with the fastest reporting and unbiased coverage. Please send any questions or comments about this story to contact@marketbeat.com. Before you consider AbbVie, you'll want to hear this. MarketBeat keeps track of Wall Street's top-rated and best performing research analysts and the stocks they recommend to their clients on a daily basis. MarketBeat has identified the five stocks that top analysts are quietly whispering to their clients to buy now before the broader market catches on... and AbbVie wasn't on the list. While AbbVie currently has a Moderate Buy rating among analysts, top-rated analysts believe these five stocks are better buys. Market downturns give many investors pause, and for good reason. Wondering how to offset this risk? Click the link to learn more about using beta to protect your portfolio. Sign up for MarketBeat All Access to gain access to MarketBeat's full suite of research tools. 345 N Reid Place, Suite 620, Sioux Falls, SD 57103
                                        
                                        contact@marketbeat.com
                                        
                                        (844) 978-6257 © MarketBeat Media, LLC 2010-2026. All rights reserved. © 2026   Fair market value prices are updated every minute and are provided by Massive. Other market data provided is at least 10-minutes delayed and hosted by Barchart Solutions.  Information is provided 'as-is' and solely for informational purposes, not for trading purposes or advice, and is delayed. To see all exchange delays and terms of use please see Barchart's disclaimer.",https://www.marketbeat.com/instant-alerts/abbvie-nyseabbv-trading-down-11-time-to-sell-2026-04-24/
