ticker,title,date,content,url
ABBV,"Savvy Advisors Inc. Buys 6,646 Shares of AbbVie Inc. $ABBV - MarketBeat",2026-04-05 09:52:08,"Savvy Advisors Inc. boosted its stake in  AbbVie Inc. (NYSE:ABBV - Free Report) by 22.2% during the fourth quarter, according to the company in its most recent filing with the SEC. The fund owned 36,568 shares of the company's stock after buying an additional 6,646 shares during the period. Savvy Advisors Inc.'s holdings in AbbVie were worth $8,355,000 as of its most recent filing with the SEC. Other large investors have also recently bought and sold shares of the company. Evolution Wealth Management Inc. bought a new stake in shares of  AbbVie during the second quarter worth approximately $26,000.  Chelsea Counsel Co. bought a new position in shares of  AbbVie during the third quarter worth approximately $26,000.  Westend Capital Management LLC acquired a new stake in  AbbVie during the 4th quarter worth approximately $29,000.  Texas Capital Bancshares Inc TX acquired a new stake in  AbbVie during the 3rd quarter worth approximately $31,000.  Finally, Caitlin John LLC bought a new stake in  AbbVie in the 3rd quarter valued at $33,000. 70.23% of the stock is owned by institutional investors. ABBV has been the topic of several recent research reports. BMO Capital Markets  reiterated an ""outperform"" rating on shares of AbbVie in a research report on Monday, March 9th. Weiss Ratings  reissued a ""hold (c)"" rating on shares of AbbVie in a research report on Wednesday, January 21st. Citigroup decreased their price target on shares of AbbVie from $235.00 to $230.00 and set a ""neutral"" rating on the stock in a research note on Tuesday, January 27th. UBS Group lowered their price target on shares of AbbVie from $240.00 to $230.00 and set a ""neutral"" rating on the stock in a research report on Thursday, February 5th. Finally, William Blair  reiterated an ""outperform"" rating on shares of AbbVie in a research note on Monday, March 9th. Two equities research analysts have rated the stock with a Strong Buy rating, fourteen have assigned  a Buy rating and nine have assigned  a Hold rating to the company. Based on data from MarketBeat.com, AbbVie currently has an average rating of ""Moderate Buy"" and a consensus target price of $253.15. In other news, SVP David Ryan Purdue sold 5,230 shares of the business's stock in a transaction that occurred on Wednesday, March 4th. The shares were sold at an average price of $233.56, for a total value of $1,221,518.80. Following the completion of the transaction, the senior vice president directly owned 2,654 shares in the company, valued at approximately $619,868.24. The trade was a 66.34% decrease in their position. The sale was disclosed in a filing with the Securities & Exchange Commission, which can be accessed through this hyperlink. Also, EVP Perry C. Siatis sold 22,381 shares of the company's stock in a transaction that occurred on Wednesday, February 25th. The stock was sold at an average price of $230.00, for a total transaction of $5,147,630.00. Following the sale, the executive vice president directly owned 38,137 shares of the company's stock, valued at approximately $8,771,510. This trade represents a 36.98% decrease in their position. Additional details regarding this sale are available in the official SEC disclosure. 0.25% of the stock is currently owned by insiders. Shares of NYSE ABBV opened at $208.79 on Friday. The business has a fifty day moving average price of $221.58 and a two-hundred day moving average price of $224.47. The stock has a market capitalization of $369.17 billion, a PE ratio of 88.47, a P/E/G ratio of 0.73 and a beta of 0.38. AbbVie Inc. has a fifty-two week low of $164.39 and a fifty-two week high of $244.81. AbbVie (NYSE:ABBV - Get Free Report) last released its earnings results on Wednesday, February 4th. The company reported $2.71 earnings per share (EPS) for the quarter, topping the consensus estimate of $2.65 by $0.06. AbbVie had a negative return on equity of 1,579.75% and a net margin of 6.91%.The company had revenue of $16.62 billion for the quarter, compared to analyst estimates of $16.39 billion. During the same period in the prior year, the firm posted $2.16 EPS. AbbVie's quarterly revenue was up 10.0% on a year-over-year basis. AbbVie has set its FY 2026 guidance at 14.370-14.570 EPS and its Q1 2026 guidance at 2.970-3.010 EPS.  On average, equities analysts expect that  AbbVie Inc. will post 12.31 EPS for the current year. The company also recently announced a quarterly dividend, which will be paid on Friday, May 15th. Shareholders of record on Wednesday, April 15th will be issued a $1.73 dividend. This represents a $6.92 annualized dividend and a yield of 3.3%. The ex-dividend date of this dividend is Wednesday, April 15th. AbbVie's dividend payout ratio (DPR) is currently 293.22%. AbbVie is a global, research-driven biopharmaceutical company that was created as a spin-off from Abbott Laboratories in 2013 and is headquartered in North Chicago, Illinois. The company focuses on discovering, developing and commercializing therapies for complex and often chronic medical conditions. Its operations span research and development, manufacturing, regulatory affairs and commercialization, with an emphasis on bringing specialty medicines to market across multiple therapeutic areas. AbbVie's product portfolio and pipeline cover several major therapeutic categories, including immunology, oncology, neuroscience, virology and women's health. This instant news alert was generated by narrative science technology and financial data from MarketBeat in order to provide readers with the fastest reporting and unbiased coverage. Please send any questions or comments about this story to contact@marketbeat.com. Before you consider AbbVie, you'll want to hear this. MarketBeat keeps track of Wall Street's top-rated and best performing research analysts and the stocks they recommend to their clients on a daily basis. MarketBeat has identified the five stocks that top analysts are quietly whispering to their clients to buy now before the broader market catches on... and AbbVie wasn't on the list. While AbbVie currently has a Moderate Buy rating among analysts, top-rated analysts believe these five stocks are better buys. Market downturns give many investors pause, and for good reason. Wondering how to offset this risk? Click the link to learn more about using beta to protect your portfolio. Sign up for MarketBeat All Access to gain access to MarketBeat's full suite of research tools. 345 N Reid Place, Suite 620, Sioux Falls, SD 57103
                                        
                                        contact@marketbeat.com
                                        
                                        (844) 978-6257 © MarketBeat Media, LLC 2010-2026. All rights reserved. © 2026   Fair market value prices are updated every minute and are provided by Massive. Other market data provided is at least 10-minutes delayed and hosted by Barchart Solutions.  Information is provided 'as-is' and solely for informational purposes, not for trading purposes or advice, and is delayed. To see all exchange delays and terms of use please see Barchart's disclaimer. We and our partners share information on your use of this website to help improve your experience. For more information, or to opt out click the Do Not Sell My Information button below.",https://www.marketbeat.com/instant-alerts/filing-savvy-advisors-inc-buys-6646-shares-of-abbvie-inc-abbv-2026-04-05/
ABBV,AbbVie Inc. $ABBV is Advocate Group LLC's 4th Largest Position - MarketBeat,2026-04-05 07:09:56,"Advocate Group LLC trimmed its stake in shares of  AbbVie Inc. (NYSE:ABBV - Free Report) by 7.3% in the 4th quarter, according to its most recent 13F filing with the Securities and Exchange Commission (SEC). The institutional investor  owned 76,212 shares of the company's stock after selling 6,035 shares during the quarter. AbbVie accounts for  2.8% of Advocate Group LLC's holdings, making the stock its 4th largest holding. Advocate Group LLC's holdings in AbbVie were worth $17,414,000 as of its most recent filing with the Securities and Exchange Commission (SEC). Other hedge funds also recently bought and sold shares of the company. Brighton Jones LLC raised its holdings in  AbbVie by 17.4% in the fourth quarter. Brighton Jones LLC now owns 22,912 shares of the company's stock valued at $4,072,000 after acquiring an additional 3,401 shares in the last quarter.  Revolve Wealth Partners LLC lifted its stake in  AbbVie by 72.7% in the fourth quarter. Revolve Wealth Partners LLC now owns 7,279 shares of the company's stock worth $1,294,000 after acquiring an additional 3,064 shares during the last quarter.  Schnieders Capital Management LLC. grew its holdings in  AbbVie by 5.0% during the 2nd quarter. Schnieders Capital Management LLC. now owns 16,466 shares of the company's stock worth $3,056,000 after acquiring an additional 789 shares in the last quarter.  1832 Asset Management L.P. increased its position in shares of  AbbVie by 158.7% in the 2nd quarter. 1832 Asset Management L.P. now owns 20,590 shares of the company's stock valued at $3,822,000 after purchasing an additional 12,631 shares during the last quarter.  Finally, SCS Capital Management LLC raised its holdings in shares of  AbbVie by 39.6% in the 2nd quarter. SCS Capital Management LLC now owns 24,578 shares of the company's stock valued at $4,562,000 after purchasing an additional 6,978 shares in the last quarter. Institutional investors and hedge funds own  70.23% of the company's stock. Shares of NYSE ABBV opened at $208.79 on Friday. The stock has a market cap of $369.17 billion, a P/E ratio of 88.47, a P/E/G ratio of 0.73 and a beta of 0.38. AbbVie Inc. has a twelve month low of $164.39 and a twelve month high of $244.81. The stock has a 50 day moving average of $221.58 and a two-hundred day moving average of $224.47. AbbVie (NYSE:ABBV - Get Free Report) last announced its earnings results on Wednesday, February 4th. The company reported $2.71 earnings per share (EPS) for the quarter, topping analysts' consensus estimates of $2.65 by $0.06. AbbVie had a net margin of 6.91% and a negative return on equity of 1,579.75%. The business had revenue of $16.62 billion for the quarter, compared to analyst estimates of $16.39 billion. During the same period last year, the firm posted $2.16 earnings per share. The company's revenue for the quarter was up 10.0% compared to the same quarter last year. AbbVie has set its FY 2026 guidance at 14.370-14.570 EPS and its Q1 2026 guidance at 2.970-3.010 EPS.  As a group, research analysts predict that  AbbVie Inc. will post 12.31 earnings per share for the current year. The business also recently declared a quarterly dividend, which will be paid on Friday, May 15th. Investors of record on Wednesday, April 15th will be issued a dividend of $1.73 per share. The ex-dividend date of this dividend is Wednesday, April 15th. This represents a $6.92 dividend on an annualized basis and a dividend yield of 3.3%. AbbVie's dividend payout ratio (DPR) is currently 293.22%. In other AbbVie news, SVP David Ryan Purdue sold 5,230 shares of the stock in a transaction that occurred on Wednesday, March 4th. The stock was sold at an average price of $233.56, for a total transaction of $1,221,518.80. Following the completion of the sale, the senior vice president directly owned 2,654 shares of the company's stock, valued at approximately $619,868.24. This trade represents a 66.34% decrease in their position. The transaction was disclosed in a legal filing with the Securities & Exchange Commission, which can be accessed through the SEC website. Also, EVP Perry C. Siatis sold 22,381 shares of AbbVie stock in a transaction that occurred on Wednesday, February 25th. The shares were sold at an average price of $230.00, for a total value of $5,147,630.00. Following the completion of the transaction, the executive vice president owned 38,137 shares in the company, valued at $8,771,510. This trade represents a 36.98% decrease in their ownership of the stock. Additional details regarding this sale are available in the official SEC disclosure. Insiders own  0.25% of the company's stock. ABBV has been the topic of a number of recent analyst reports. UBS Group dropped their price objective on AbbVie from $240.00 to $230.00 and set a ""neutral"" rating on the stock in a report on Thursday, February 5th. BMO Capital Markets  restated an ""outperform"" rating on shares of AbbVie in a research report on Monday, March 9th. Berenberg Bank  set a $275.00 target price on shares of AbbVie in a research report on Tuesday, January 20th. Evercore cut their price target on shares of AbbVie from $232.00 to $228.00 and set an ""outperform"" rating on the stock in a research note on Wednesday, February 4th. Finally, Citigroup reduced their price target on shares of AbbVie from $235.00 to $230.00 and set a ""neutral"" rating for the company in a research report on Tuesday, January 27th. Two analysts have rated the stock with a Strong Buy rating, fourteen have assigned  a Buy rating and nine have issued  a Hold rating to the company's stock. According to MarketBeat, the company presently has a consensus rating of ""Moderate Buy"" and an average price target of $253.15. AbbVie is a global, research-driven biopharmaceutical company that was created as a spin-off from Abbott Laboratories in 2013 and is headquartered in North Chicago, Illinois. The company focuses on discovering, developing and commercializing therapies for complex and often chronic medical conditions. Its operations span research and development, manufacturing, regulatory affairs and commercialization, with an emphasis on bringing specialty medicines to market across multiple therapeutic areas. AbbVie's product portfolio and pipeline cover several major therapeutic categories, including immunology, oncology, neuroscience, virology and women's health. This instant news alert was generated by narrative science technology and financial data from MarketBeat in order to provide readers with the fastest reporting and unbiased coverage. Please send any questions or comments about this story to contact@marketbeat.com. Before you consider AbbVie, you'll want to hear this. MarketBeat keeps track of Wall Street's top-rated and best performing research analysts and the stocks they recommend to their clients on a daily basis. MarketBeat has identified the five stocks that top analysts are quietly whispering to their clients to buy now before the broader market catches on... and AbbVie wasn't on the list. While AbbVie currently has a Moderate Buy rating among analysts, top-rated analysts believe these five stocks are better buys. MarketBeat's analysts have just released their top five short plays for April 2026. Learn which stocks have the most short interest and how to trade them. Click the link to see which companies made the list. Sign up for MarketBeat All Access to gain access to MarketBeat's full suite of research tools. 345 N Reid Place, Suite 620, Sioux Falls, SD 57103
                                        
                                        contact@marketbeat.com
                                        
                                        (844) 978-6257 © MarketBeat Media, LLC 2010-2026. All rights reserved. © 2026   Fair market value prices are updated every minute and are provided by Massive. Other market data provided is at least 10-minutes delayed and hosted by Barchart Solutions.  Information is provided 'as-is' and solely for informational purposes, not for trading purposes or advice, and is delayed. To see all exchange delays and terms of use please see Barchart's disclaimer. Enter your email address below to receive InsiderTrades.com’s daily insider buying and selling report for AbbVie and related companies. We and our partners share information on your use of this website to help improve your experience. For more information, or to opt out click the Do Not Sell My Information button below.",https://www.marketbeat.com/instant-alerts/filing-abbvie-inc-abbv-is-advocate-group-llcs-4th-largest-position-2026-04-05/
ABBV,ABBV Technical Analysis & Stock Price Forecast - Intellectia AI,2026-04-04 13:44:59,"Technical Sentiment Analysis for AbbVie Inc (ABBV) As of 2026-04-02, AbbVie Inc (ABBV) is exhibiting a Strong Sell technical sentiment. Our proprietary analysis, which aggregates 14 technical signals, shows that 1 indicators are flashing buy, while 13 are indicating sell. Momentum Indicators: RSI, MACD & Overbought/Oversold Status Currently, the Relative Strength Index (RSI) for ABBV stands at 40.009, which suggests a Neutral condition. Meanwhile, the MACD (12, 26) indicator is at -3.677, providing a Sell signal for short-term momentum. Other oscillators like the Stochastic Oscillator at 46.279 and the Commodity Channel Index (CCI) at -49.888 further confirm a 2.61 outlook for the stock. Support, Resistance & Moving Averages From a structural perspective, ABBV is trading above its 60-day moving average of $221.361 and above its 200-day long-term moving average of $216.164. Key price levels to watch include the immediate resistance at $219.522 and strong support at $200.872. A break above $219.522 could signal a bull continuation, while falling below $200.872 may test the next Fibonacci floor at $192.011. Copyright © 2026 Intellectia.AI. All Rights Reserved.",https://intellectia.ai/stock/ABBV/technical
ABBV,AbbVie Inc. $ABBV Shares Bought by SteelPeak Wealth LLC - MarketBeat,2026-04-04 10:44:46,"SteelPeak Wealth LLC raised its stake in shares of  AbbVie Inc. (NYSE:ABBV - Free Report) by 58.6% during the 4th quarter, according to the company in its most recent 13F filing with the Securities and Exchange Commission. The firm owned 40,949 shares of the company's stock after buying an additional 15,135 shares during the period. SteelPeak Wealth LLC's holdings in AbbVie were worth $9,356,000 as of its most recent SEC filing. Other hedge funds and other institutional investors also recently modified their holdings of the company. Vanguard Group Inc. raised its position in  AbbVie by 0.3% in the third quarter. Vanguard Group Inc. now owns 177,747,261 shares of the company's stock worth $41,155,601,000 after acquiring an additional 448,554 shares in the last quarter.  Legal & General Group Plc lifted its position in shares of  AbbVie by 4.3% in the 3rd quarter. Legal & General Group Plc now owns 12,004,084 shares of the company's stock valued at $2,779,426,000 after acquiring an additional 493,420 shares in the last quarter.  Wellington Management Group LLP lifted its holdings in shares of  AbbVie by 457.4% in the third quarter. Wellington Management Group LLP now owns 10,536,901 shares of the company's stock valued at $2,439,714,000 after purchasing an additional 8,646,424 shares in the last quarter.  Amundi boosted its position in  AbbVie by 15.6% during the 3rd quarter. Amundi now owns 10,508,317 shares of the company's stock worth $2,418,909,000 after acquiring an additional 1,414,621 shares during the period.  Finally, Ameriprise Financial Inc. boosted its holdings in shares of  AbbVie by 4.4% during the third quarter. Ameriprise Financial Inc. now owns 9,675,877 shares of the company's stock worth $2,241,363,000 after purchasing an additional 408,426 shares during the period. Institutional investors own  70.23% of the company's stock. Shares of NYSE:ABBV opened at $208.79 on Friday. The firm has a market cap of $369.17 billion, a P/E ratio of 88.47, a P/E/G ratio of 0.73 and a beta of 0.38. The company's 50-day moving average price is $221.58 and its two-hundred day moving average price is $224.41. AbbVie Inc. has a 12 month low of $164.39 and a 12 month high of $244.81. AbbVie (NYSE:ABBV - Get Free Report) last posted its quarterly earnings data on Wednesday, February 4th. The company reported $2.71 earnings per share for the quarter, topping the consensus estimate of $2.65 by $0.06. The firm had revenue of $16.62 billion during the quarter, compared to analysts' expectations of $16.39 billion. AbbVie had a net margin of 6.91% and a negative return on equity of 1,579.75%. AbbVie's revenue was up 10.0% on a year-over-year basis. During the same quarter in the previous year, the company posted $2.16 EPS. AbbVie has set its FY 2026 guidance at 14.370-14.570 EPS and its Q1 2026 guidance at 2.970-3.010 EPS.  As a group, equities analysts predict that  AbbVie Inc. will post 12.31 earnings per share for the current fiscal year. The firm also recently declared a quarterly dividend, which will be paid on Friday, May 15th. Investors of record on Wednesday, April 15th will be paid a dividend of $1.73 per share. This represents a $6.92 dividend on an annualized basis and a dividend yield of 3.3%. The ex-dividend date of this dividend is Wednesday, April 15th. AbbVie's payout ratio is 293.22%. A number of analysts recently issued reports on the company. Sanford C. Bernstein  reissued a ""market perform"" rating on shares of AbbVie in a research report on Thursday, February 5th. Weiss Ratings  reaffirmed a ""hold (c)"" rating on shares of AbbVie in a report on Wednesday, January 21st. Evercore lowered their target price on AbbVie from $232.00 to $228.00 and set an ""outperform"" rating on the stock in a report on Wednesday, February 4th. William Blair  restated an ""outperform"" rating on shares of AbbVie in a report on Monday, March 9th. Finally, Berenberg Bank  set a $275.00 price objective on AbbVie in a research report on Tuesday, January 20th. Two investment analysts have rated the stock with a Strong Buy rating, fourteen have given a Buy rating and nine have assigned  a Hold rating to the company's stock. According to MarketBeat, the stock currently has a consensus rating of ""Moderate Buy"" and a consensus target price of $253.15. In other AbbVie news, SVP David Ryan Purdue sold 5,230 shares of the company's stock in a transaction on Wednesday, March 4th. The shares were sold at an average price of $233.56, for a total transaction of $1,221,518.80. Following the completion of the sale, the senior vice president owned 2,654 shares in the company, valued at approximately $619,868.24. The trade was a 66.34% decrease in their position. The sale was disclosed in a legal filing with the SEC, which is accessible through this hyperlink. Also, EVP Perry C. Siatis sold 22,381 shares of the company's stock in a transaction dated Wednesday, February 25th. The shares were sold at an average price of $230.00, for a total value of $5,147,630.00. Following the completion of the sale, the executive vice president owned 38,137 shares of the company's stock, valued at $8,771,510. This represents a 36.98% decrease in their position. The SEC filing for this sale provides additional information. Insiders own  0.25% of the company's stock. AbbVie is a global, research-driven biopharmaceutical company that was created as a spin-off from Abbott Laboratories in 2013 and is headquartered in North Chicago, Illinois. The company focuses on discovering, developing and commercializing therapies for complex and often chronic medical conditions. Its operations span research and development, manufacturing, regulatory affairs and commercialization, with an emphasis on bringing specialty medicines to market across multiple therapeutic areas. AbbVie's product portfolio and pipeline cover several major therapeutic categories, including immunology, oncology, neuroscience, virology and women's health. Want to see what other hedge funds are holding ABBV? Visit HoldingsChannel.com to get the latest 13F filings and insider trades for AbbVie Inc. (NYSE:ABBV - Free Report). This instant news alert was generated by narrative science technology and financial data from MarketBeat in order to provide readers with the fastest reporting and unbiased coverage. Please send any questions or comments about this story to contact@marketbeat.com. Before you consider AbbVie, you'll want to hear this. MarketBeat keeps track of Wall Street's top-rated and best performing research analysts and the stocks they recommend to their clients on a daily basis. MarketBeat has identified the five stocks that top analysts are quietly whispering to their clients to buy now before the broader market catches on... and AbbVie wasn't on the list. While AbbVie currently has a Moderate Buy rating among analysts, top-rated analysts believe these five stocks are better buys. Wondering where to start (or end) with AI stocks? These 10 simple stocks can help investors build long-term wealth as artificial intelligence continues to grow into the future. Sign up for MarketBeat All Access to gain access to MarketBeat's full suite of research tools. 345 N Reid Place, Suite 620, Sioux Falls, SD 57103
                                        
                                        contact@marketbeat.com
                                        
                                        (844) 978-6257 © MarketBeat Media, LLC 2010-2026. All rights reserved. © 2026   Fair market value prices are updated every minute and are provided by Massive. Other market data provided is at least 10-minutes delayed and hosted by Barchart Solutions.  Information is provided 'as-is' and solely for informational purposes, not for trading purposes or advice, and is delayed. To see all exchange delays and terms of use please see Barchart's disclaimer. We and our partners share information on your use of this website to help improve your experience. For more information, or to opt out click the Do Not Sell My Information button below.",https://www.marketbeat.com/instant-alerts/filing-abbvie-inc-abbv-shares-bought-by-steelpeak-wealth-llc-2026-04-04/
