id,ticker,date,title,content,url
1,ABBV,2026-03-26 17:15:23,"독립 의장 추진, AbbVie의 지배구조와 밸류에이션 기대치에 압박 - simplywall.st","AbbVie(NYSE:ABBV)를 따라가고 있는 투자자들에게 이번 지배구조 논쟁은 주가가 약 207.18달러에 거래되는 가운데, 지난 1년간 6.4%, 지난 5년간 131.8%의 수익률을 기록한 시점에 제기되고 있다. 단기 성과는 다소 부진했으며, 지난 한 달과 연초 이후 각각 9.7% 하락해, 이사회가 주주 우려에 어떻게 대응하는지에 대한 관심을 더 키울 수 있다. 독립적인 이사회 의장 선임 요구는 투자자들이 회사 최상단의 견제와 균형을 어떻게 보느냐에 영향을 줄 수 있다. 2026년 정기주주총회(AGM)가 다가오는 가운데, 이번 표결의 결과는 투명성, 이사회 책임성, 그리고 회사가 가장 큰 주주들과 어떻게 소통하는지에 대한 기대를 형성할 수 있다. AbbVie를 관심 종목 또는 포트폴리오에 추가해 가장 중요한 뉴스 업데이트를 받아보세요. 또는 커뮤니티를 둘러보고 AbbVie에 대한 새로운 관점을 발견해 보세요. 이번 최신 뉴스 이후 내부자들이 AbbVie를 매수하고 있는지, 매수 및 매도하고 있는지 확인해 보세요. AbbVie를 매수, 매도 또는 보유할 적절한 시점은 단 하나의 방법으로만 알 수 있습니다. Simply Wall St의 회사 보고서로 이동해 AbbVie의 공정가치에 대한 최신 분석을 확인하세요. 더 많은 위험과 보상을 포함한 전체 그림은 AbbVie의 전체 분석에서 확인할 수 있습니다. 또는 AbbVie의 커뮤니티 페이지를 방문해 다른 투자자들이 이번 최신 뉴스가 회사의 내러티브에 어떤 영향을 미칠 것으로 보는지 확인할 수 있습니다. 이 기사는 Simply Wall St가 일반적인 정보 제공을 위해 작성한 것입니다. 우리는 편향되지 않은 방법론을 사용해 과거 데이터와 애널리스트 전망에 근거한 해설만을 제공하며, 당사의 기사는 금융 자문을 목적으로 하지 않습니다. 이는 어떤 주식의 매수 또는 매도 추천을 구성하지 않으며, 귀하의 목표나 재무 상황을 고려하지 않습니다. 우리는 기본적 데이터에 기반한 장기 중심의 분석을 제공하는 것을 목표로 합니다. 당사의 분석은 최근의 주가 민감 공시나 정성적 요소를 반영하지 못할 수 있습니다. Simply Wall St는 언급된 어떤 종목도 보유하고 있지 않습니다. 우리는 주식 투자자를 위한 궁극의 포트폴리오 동반 도구를 만들었으며, 이는 무료입니다. • 무제한 수의 포트폴리오를 연결하고 모든 자산을 하나의 통화로 확인 • 이메일 또는 모바일로 새로운 경고 신호나 리스크 알림 수신 • 보유 주식의 공정가치 추적 이 기사에 대한 피드백이 있으신가요? 내용이 우려되시나요? 저희에게 직접 연락해 주세요. 또는 editorial-team@simplywallst.com 으로 이메일을 보내세요. 연구 기반 바이오의약품 회사로서, 전 세계적으로 의약품과 치료제의 연구 및 개발, 제조, 상업화, 판매를 영위한다. 합리적인 성장 잠재력과 배당을 제공하는 중간 수준의 위험. 금융 데이터는 S&P Global Market Intelligence LLC가 제공하고, 분석은 Simply Wall Street Pty Ltd가 제공합니다. Copyright © 2026, S&P Global Market Intelligence LLC. All rights reserved. Simply Wall Street Pty Ltd (ACN 600 056 611)는 Sanlam Private Wealth Pty Ltd(AFSL No. 337927)의 법인 공인 대리인(Corporate Authorised Representative, Authorised Representative Number: 467183)입니다. 본 웹사이트에 포함된 모든 조언은 일반적인 조언일 뿐이며, 귀하의 목표, 재무 상황 또는 필요를 고려하지 않고 작성되었습니다. 본 웹사이트의 조언 및/또는 정보에 의존해서는 안 되며, 어떠한 투자 결정을 내리기 전에 귀하의 상황에 적합한지 검토하고 적절한 재무, 세무 및 법률 자문을 구할 것을 권고합니다. 금융 서비스를 이용할지 결정하기 전에 당사의 금융서비스가이드를 읽어 주시기 바랍니다. © 2026 Simply Wall Street Pty Ltd, US Design Patent #29/544/281, Community and European Design Registration #2845206",https://simplywall.st/stocks/us/pharmaceuticals-biotech/nyse-abbv/abbvie/news/independent-chair-push-tests-abbvie-governance-and-valuation
2,ABBV,2026-03-26 15:29:16,2026년 켄터키에서 가장 많이 검색된 문자 약어 - WKDQ 99.5,"10대 자녀가 당신이 도무지 무슨 뜻인지 모를 약어를 문자로 보내온다고 해도, 당신만 그런 것은 아닙니다. 이것은 2026년 켄터키에서 가장 많이 검색된 문자 약어들입니다. 밀레니얼 세대로 성장하면서, 우리는 일종의 약어와 축약어를 선도했습니다. 예전에는 친구들에게 문자를 보낼 때 휴대폰에 키보드가 없었기 때문입니다. 숫자 키패드만 있었습니다. 즉, 단어를 철자대로 쓰려면 플립폰에서 특정 숫자를 여러 번 눌러야만 한 글자에 도달할 수 있었습니다. 그래서 “on my way” 대신 “OMW”를, “talk to you later” 대신 “TTYL”을 입력하는 편이 더 쉬웠습니다. 그래요, 얘들아... 우리가 그렇게 했던 겁니다. 하지만 세월이 흐르면서 문자 약어도 바뀌었습니다. 늘 새로 사용되는 것들이 있습니다. 제 십대 자녀들이 아내와 저에게 와서 이 약어, 저 약어가 문자 메시지에서 무슨 뜻인지 아느냐고 묻는 횟수가 셀 수 없을 정도입니다. 솔직히 말하면, 그들이 문자로 보내거나 알려주는 것 중에는 저도 찾아봐야 하는 것들이 있습니다. 아마 저만 그런 것은 아닐 겁니다. 최근 Unscramblerer.com은 Google Trends를 사용해 가장 유행하는 문자 약어를 찾아냈고, Ahrefs를 사용해 월간 검색량을 파악하여 미국에서 가장 인기 있는 문자 약어를 알아냈습니다. 주(州)별로도 나눴습니다. 그렇다면 켄터키 주민들은 어떤 문자 약어의 뜻을 가장 많이 구글에서 검색하고 있을까요? 상위 10개는 다음과 같습니다. 말씀드리자면... 제 십대 자녀들이 그런 표현을 제 앞에서나 저에게 쓴다면, 약어 하나 없이 아주 진지한 대화를 하게 될 겁니다! 어쨌든, 이런 표현을 본 적이 있으신가요? 그 당시 무슨 뜻인지 몰랐다면, 이제는 아실 겁니다. 아, 그리고 혹시 미국에서 가장 많이 검색된 문자 약어가 무엇인지 궁금하셨다면... 자녀들이 무슨 말을 하는지 알아두기 위해서 말이죠, Unscramblerer.com이 그것도 찾아드렸습니다! 35. BTA- “Better than average” 또는 “But then again”. 다시 말하지만, 이런 표현들 중 일부는 자녀들이 말하는 것을 원치 않을 만한 것들이라서 알아두면 꽤 유용합니다. 특히 자녀들이 당신이 뜻을 모른다고 생각한다면 더 그렇습니다. 반대로, 자녀들만의 문자 표현을 써서 계속 귀찮게 만들 수도 있습니다. 그냥, 괴롭히기 위해서요.",https://wkdq.com/common-texting-acronyms-kentucky/
3,ABBV,2026-03-26 11:40:21,"Piper Sandler, AbbVie(ABBV.US)에 대해 매수 의견 유지, 목표주가 299달러 유지 - 富途牛牛","Piper Sandler 애널리스트 David Amsellem은 $AbbVie (ABBV.US)$에 대해 매수 의견을 유지하고, 목표주가도 299달러로 유지했다. TipRanks 데이터에 따르면, 해당 애널리스트의 성공률은 50.9%이며 지난 1년간 총 평균 수익률은 6.5%였다. 독립적인 제3자인 TipRanks는 금융 애널리스트의 분석 데이터를 제공하고 애널리스트 추천의 평균 수익률과 성공률을 계산한다. 여기에 제시된 정보는 투자 추천이 아니며 정보 제공 목적으로만 사용된다. 성공률은 지난 1년간 애널리스트의 전체 투자의견 수 대비 성공한 투자의견 수의 비율이다. 성공한 투자의견이란 TipRanks의 가상 포트폴리오가 해당 주식에서 플러스 수익률을 기록한 경우를 의미한다. 총 평균 수익률은 TipRanks의 가상 포트폴리오가 지난 1년간 거둔 평균 수익률이다. 이 포트폴리오는 애널리스트의 초기 투자의견을 바탕으로 설정되며, 투자의견 변경에 따라 조정된다. TipRanks는 각 애널리스트에 대해 최대 5성급의 순위를 제공하며, 이는 해당 애널리스트의 모든 추천을 대표한다. 애널리스트의 과거 성과는 1성에서 5성까지의 척도로 평가되며, 별점이 높을수록 성과가 더 좋음을 의미한다. 별점 수준은 총 성공률과 평균 수익률에 의해 결정된다. 브라우저의 공유 버튼을 사용해 친구들과 페이지를 공유하세요.",https://news.futunn.com/en/post/70665931/piper-sandler-maintains-abbvie-abbvus-with-buy-rating-maintains-target?level=1&data_ticket=1774574872793032
4,ABBV,2026-03-25 21:07:08,AbbVie(ABBV)는 최근 주가 약세 이후 이제 가치를 제공하고 있는가? - Yahoo Finance,"팁: 관련 결과를 보려면 유효한 티커 심볼 또는 특정 회사명을 입력해 보세요. 트럼프가 호르무즈 해협에 대해 “스스로 열릴 것”이라고 말하던 입장에서 이란이 수로를 통제할 수 있는 힘을 인정하기까지의 변화 SpaceX, 잠재적 투자자들에게 IPO 준비를 위해 4월 브리핑이 있을 것이라고 전달 (Bloomberg) 모든 빅테크 인기 종목이 52주 최고가 대비 두 자릿수 비율 하락 나스닥이 빅테크와 반도체 주식 매도로 지수를 끌어내리자 하락 주도, 유가는 100달러를 웃돌아 주택담보대출 금리가 7개월 만의 최고치로 급등, 매수자 신뢰는 “흔들려” 개장과 함께 주가 하락, 트럼프가 이란에 너무 늦기 전에 합의하라고 경고 노동생산성이 상승 중. 그중 얼마나 AI 덕분인지는 말하기 어렵다. 어디서나 노동자들은 자신의 고용안정성에 대해 끔찍한 기분을 느끼고 있다. 그 이유는 다음과 같다. 월가 애널리스트들은 유가 변동성이 계속되고 중동 전쟁이 장기화하면서 경기침체 가능성이 높아지고 있다고 말한다. TSA 국장은 여행 문제들이 어떤 셧다운 합의보다도 더 오래 지속될 가능성이 있다고 말하며 올여름 “완벽한 폭풍”을 경고했다. 주가는 상승하고 유가는 100달러 아래에 머물렀으며, 월가는 이란 긴장 완화 기대를 저울질했다. Meta와 YouTube가 획기적인 소셜미디어 중독 소송에서 책임이 있는 것으로 보도됨 OpenAI가 방금 Sora를 중단한 이유를 설명하는 두 개의 차트 미국 주식은 미국-이란 회담 기대에 힘입어 급등, 유가는 100달러 아래로 하락 지난 100년간 주식시장의 두 자릿수 손실을 이끈 세 가지 요인. 현재 모두 작용 중이다. '닥터 둠'으로 알려진 경제학자는 이란 전쟁이 인플레이션과 금리에 심각한 영향을 미칠 수 있다고 말한다 CEO는 10억 달러 AI 운영 기업의 시대가 이미 도래했다고 주장한다. 의회에서 진행 중인 법안의 불리한 전개 덕분에 주가는 기록상 가장 큰 폭으로 폭락했다. 나스닥이 하락을 주도하며 주가가 다시 하락세를 보였다. 이란 전쟁이 장기화되면서 유가는 급등했다. 월요일의 급격한 랠리 이후, 이란 전쟁이 계속되는 가운데 주가는 개장과 함께 후퇴했다. 과거 유가 충격에 대해 연준이 어떻게 반응했고, 어떻게 반응하지 않았는가 Musk의 ‘Terafab’가 마침내 공개됐다. 이는 그가 자신의 회사들이 향하는 방향에 대해 그리는 가장 웅대한 총체적 비전일지도 모른다. 래리 핑크의 연례 서한에는 AI와 불평등에 대한 강경한 경고가 담겼다. 미국의 동맹국들이 계획된 공습의 위험성을 경고한 뒤 트럼프가 이란과의 협상을 시작했다 (Bloomberg) 다우지수는 600포인트 이상 급등했고, S&P 500과 나스닥도 모두 1% 이상 상승하며 월가가 트럼프의 이란과의 협상 재개 신호를 환영했다. 트럼프가 이란 공습을 보류하고 “매우 좋은” 협상을 추진하면서 미국 주식 급등 다우 선물은 거의 1,000포인트 급등했고, 트럼프가 이란의 발전소 공습 위협을 연기한 뒤 유가는 급락했다. 세계가 몰랐던, 그러나 필요했던 사우디 석유 파이프라인 (Bloomberg) HELOC가 어떻게 바뀌었는지 — 그리고 일부 주택 소유자들이 새 규정을 달가워하지 않을 수 있는 이유 홈헬스 보조원은 현재 노동시장의 핵심 문제를 상징한다: 수요는 높지만 임금은 낮다 애널리스트들은 급등한 휘발유 가격이 소비자, 인플레이션, 더 넓은 경제에 어떤 영향을 미칠지 보고 있다. 국경 차르 호먼은 ICE가 공항에서 ‘비중요’ 업무를 수행할 것이라고 말한다 (Bloomberg) 파월은 법무부와 연준에 대한 조사들이 해결될 때까지 연준 이사회에서 물러날 계획이 없다고 말했다 이란 전쟁 지속, 가능성 있는 금리 인상, 그리고 AI의 ‘보여줘’ 단계 나스카 스타 조이 로가노가 포드 딜러십에 막 투자한 이유 점점 더 많은 미국인들이 해외 은퇴를 고려하고 있다. 알아야 할 것은 다음과 같다. 당신의 비행기 여행 비용이 곧 더 비싸질 것이다. 이 팁들이 비용을 아껴줄 수 있다. 트럼프가 셧다운 속 공항에 ICE 요원을 배치하겠다고 위협 (Bloomberg) 중고 EV가 저렴한 차를 찾는 미국인들에게 해답이 될 수 있는 이유 재산세는 급등하고 있다. 하지만 주정부들은 이를 삭감하는 데 중대한 결과가 따른다는 사실을 배우고 있다. OpenAI, 사업 확대 강화를 위해 인력 두 배로 늘린다 (Financial Times) 월가는 신속한 폭격 작전을 반영해 가격을 매겼다. 그러나 실제로 얻은 것은 에너지 전쟁이었다. 셧다운으로 인한 여행 문제는 다음 주 더 악화될 수 있다. 게다가 의회 휴회가 다가오고 있다. 배심원단은 엘론 머스크가 트위터 인수 과정에서 투자자들을 오도했다고 판단했지만 일부 사기 주장에 대해서는 그를 무죄로 봤다 (Associated Press) 휘발유 가격은 시작에 불과하다: 소비자들은 이란 전쟁으로 더 큰 고통을 느끼게 될 것이다 다우, S&P 500, 나스닥은 이란 전쟁이 지속되는 가운데 또 다른 험난한 한 주를 마감하며 하락했다. 월가는 매도세를 재개했고, 나스닥은 1% 넘게 하락하며 주가가 또 한 번의 혹독한 한 주를 향하는 모습이었다. 미국 증시는 이란 전쟁 관련 불안 속 유가 급등락에 하락했다 로보택시 기업들은 각자 전혀 다른 문제를 안고 있지만, 목표는 같다 금융 섹터는 2020년 이후 최악의 1분기를 기록할 속도다 Simply Wall St에서 전 세계 700만 명 이상의 개인 투자자로 구성된 글로벌 커뮤니티의 수천 개 종목에 대한 인사이트를 확인하세요. AbbVie가 주당 약 205달러 수준에서 좋은 가치인지 여부가 궁금하다면, 최근 성과와 밸류에이션을 나란히 놓고 살펴보는 것이 도움이 된다. 이 주식은 현재 약 205.20달러로, 지난 1주일간 6.6% 하락했고 지난 한 달간 8.7% 하락했으며 연초 이후로는 10.5% 하락했지만, 1년 기준 5.3%, 3년 기준 44.5%, 5년 기준 132.7%의 수익률을 여전히 기록하고 있다. 최근 주가 움직임은 AbbVie의 제품 포트폴리오와 미국 대형 제약사들 사이에서의 위치에 대한 지속적인 관심 속에서 나타나고 있으며, 투자자들은 장기적인 신약 파이프라인과 기존 프랜차이즈를 함께 저울질하고 있다. 동시에 헬스케어 전반의 섹터 자금 흐름과 위험 선호도 변화는 많은 투자자들 사이에서 밸류에이션을 계속 주요 관심사로 만들고 있다. Simply Wall St의 AbbVie 가치 점수는 6점 만점에 3점이다. 이는 6개 점검 항목 중 절반에서 저평가로 나타난다는 뜻이다. 다음 섹션에서는 이를 여러 밸류에이션 접근법으로 나눠 살펴본 뒤, 단일 모델을 넘어서는 가치 판단 방법으로 마무리할 것이다. AbbVie의 지난 1년간 5.3% 수익률이 동종 기업들보다 뒤처지는 이유를 확인해 보세요. 할인현금흐름(DCF) 모델은 기업이 미래에 창출할 수 있는 현금을 추정하고 그 금액을 현재로 할인해, 해당 현금흐름을 바탕으로 지금 회사가 얼마의 가치가 있을지 추정한다. AbbVie의 경우 이 모델은 2단계 주주자유현금흐름(Free Cash Flow to Equity) 방식을 사용한다. 최근 12개월 주주자유현금흐름은 약 180억 달러다. 애널리스트들은 2030년까지의 명시적 주주자유현금흐름 추정치를 제공하며, Simply Wall St는 그 이후 구간을 추가로 추정한다. 예를 들어 2030년 예상 주주자유현금흐름은 315억 달러다. 이러한 현금흐름을 현재 가치로 할인한 결과, 이 모델은 주당 내재가치를 366.91달러로 산출한다. 현재 주가가 약 205달러인 점을 감안하면, 이는 해당 DCF 추정치보다 약 44.1% 낮은 수준으로, 이 모델상 저평가로 분류된다. 우리의 할인현금흐름(DCF) 분석에 따르면 AbbVie는 44.1% 저평가되어 있다. 이를 관심 종목 또는 포트폴리오에 추가해 추적하거나, 고품질 저평가 종목 58개를 더 찾아보세요. AbbVie의 공정가치를 도출하는 방식에 대한 더 자세한 내용은 회사 보고서의 밸류에이션 섹션에서 확인할 수 있다. AbbVie처럼 수익성이 있는 기업의 경우, P/E 비율은 주당 얼마를 지불하는지와 회사가 현재 창출하는 이익을 연결해 주기 때문에 유용한 빠른 점검 지표다. 이는 투자자들이 현재 AbbVie의 이익 1달러에 대해 얼마를 지불할 의향이 있는지를 간단히 보여주는 방식이다. ‘정상적인’ P/E가 얼마인지는 시장이 해당 기업의 성장 잠재력과 위험을 어떻게 보느냐에 달려 있다. 기대 성장률이 높고 인식되는 위험이 낮을수록 더 높은 P/E 배수를 지지하는 경향이 있으며, 성장률이 낮거나 불확실성이 높을수록 일반적으로 더 낮은 P/E 수준과 함께한다. AbbVie는 P/E 86.68배에 거래되고 있으며, 동종 기업 평균 22.56배, 바이오테크 산업 평균 P/E 16.90배와 비교된다. Simply Wall St의 AbbVie 공정비율(Fair Ratio)은 38.23배다. 공정비율은 AbbVie의 이익 성장 프로필, 산업, 이익률, 시가총액 및 핵심 위험을 감안했을 때 가능한 P/E 수준에 대한 독자적 추정치다. 이는 단순히 동종 기업이나 광범위한 산업과 비교하는 것보다 회사 고유 특성을 조정하기 때문에 더 맞춤형인 경향이 있다. 이 지표에서 AbbVie의 실제 P/E 86.68배는 공정비율 38.23배를 훨씬 상회하므로, 이 접근법에서는 주가가 고평가된 것으로 나타난다. P/E 비율은 하나의 이야기를 들려주지만, 진짜 기회는 다른 곳에 있을 수도 있다. 경영진이 아니라 유산에 투자하세요. 창업자 주도 기업 상위 20곳을 확인해 보세요. 앞서 가치 평가를 이해하는 데는 더 나은 방법이 있다고 언급했는데, 그것이 바로 내러티브다. 내러티브를 통해 AbbVie의 의약품, 위험, 기회에 대한 관점을 매출, 이익, 마진, 공정가치에 대한 구체적 전망과 연결하는 명확한 이야기를 설정할 수 있다. 그런 다음 그 공정가치를 현재 주가와 비교해 행동할지 기다릴지 판단하는 데 도움을 받을 수 있다. Simply Wall St의 커뮤니티 페이지에서는 내러티브를 수백만 명의 투자자들이 사용하는 쉬운 도구로 제공한다. 뉴스나 실적 같은 새로운 정보가 추가되면 자동으로 업데이트되므로, 매번 모델을 다시 만들지 않아도 자신의 이야기, 수치, 공정가치 추정치가 계속 일치하게 유지된다. AbbVie의 경우 한 투자자는 2026년 EPS 14.47달러와 선행 P/E 17.5배를 사용해 주당 약 253달러의 공정가치를 내러티브로 구성할 수 있다. 다른 투자자는 2029년 이익 전망에 24.0배 P/E를 적용해 주당 약 249달러의 공정가치를 선호할 수도 있다. 주가 약 205달러와 대비한 이런 서로 다른 공정가치를 나란히 보면, 자신의 의사결정에 어떤 이야기가 더 현실적인지 판단하는 데 도움이 된다. AbbVie에 더 많은 이야기가 있다고 생각하시나요? 커뮤니티로 가서 다른 사람들이 무엇을 말하는지 확인해 보세요! 이 기사는 Simply Wall St가 일반적인 정보 제공을 위해 작성한 것입니다. 우리는 편향되지 않은 방법론을 사용해 과거 데이터와 애널리스트 전망에 근거한 해설만을 제공하며, 당사의 기사는 금융 자문을 목적으로 하지 않습니다. 이는 어떤 주식의 매수 또는 매도 추천을 구성하지 않으며, 귀하의 목표나 재무 상황을 고려하지 않습니다. 우리는 기본적 데이터에 기반한 장기 중심의 분석을 제공하는 것을 목표로 합니다. 당사의 분석은 최근의 주가 민감 공시나 정성적 요소를 반영하지 못할 수 있습니다. Simply Wall St는 언급된 어떤 종목도 보유하고 있지 않습니다. 이 기사에 대한 피드백이 있으신가요? 내용이 우려되시나요? 저희에게 직접 연락해 주세요. 또는 editorial-team@simplywallst.com 으로 이메일을 보내세요. 팁: 관련 결과를 보려면 유효한 티커 심볼 또는 특정 회사명을 입력해 보세요.",https://finance.yahoo.com/markets/stocks/articles/abbvie-abbv-now-offering-value-210708910.html
