ticker,title,date,content,url
ABBV,"Thurston Springer Miller Herd & Titak Inc. Acquires 6,946 Shares of AbbVie Inc. $ABBV - MarketBeat",2026-04-04 10:34:03,"Thurston Springer Miller Herd & Titak Inc. raised its holdings in shares of  AbbVie Inc. (NYSE:ABBV - Free Report) by 966.1% in the fourth quarter, according to the company in its most recent Form 13F filing with the Securities & Exchange Commission. The fund owned 7,665 shares of the company's stock after buying an additional 6,946 shares during the quarter. Thurston Springer Miller Herd & Titak Inc.'s holdings in AbbVie were worth $1,752,000 as of its most recent SEC filing. Several other hedge funds also recently modified their holdings of ABBV. SteelPeak Wealth LLC grew its stake in shares of  AbbVie by 58.6% in the 4th quarter. SteelPeak Wealth LLC now owns 40,949 shares of the company's stock valued at $9,356,000 after purchasing an additional 15,135 shares during the period.  Analyst IMS Investment Management Services Ltd. lifted its position in shares of  AbbVie by 73.2% during the 4th quarter. Analyst IMS Investment Management Services Ltd. now owns 4,781 shares of the company's stock worth $1,092,000 after buying an additional 2,020 shares during the period.  1900 Wealth Management LLC lifted its position in shares of  AbbVie by 47.3% during the 4th quarter. 1900 Wealth Management LLC now owns 7,370 shares of the company's stock worth $1,684,000 after buying an additional 2,365 shares during the period.  Toth Financial Advisory Corp boosted its stake in  AbbVie by 6.9% in the 4th quarter. Toth Financial Advisory Corp now owns 51,282 shares of the company's stock valued at $11,718,000 after buying an additional 3,300 shares in the last quarter.  Finally, Aspiriant LLC boosted its stake in  AbbVie by 2.2% in the 4th quarter. Aspiriant LLC now owns 9,442 shares of the company's stock valued at $2,157,000 after buying an additional 207 shares in the last quarter. 70.23% of the stock is owned by institutional investors. In related news, EVP Perry C. Siatis sold 22,381 shares of the company's stock in a transaction on Wednesday, February 25th. The shares were sold at an average price of $230.00, for a total value of $5,147,630.00. Following the completion of the transaction, the executive vice president directly owned 38,137 shares of the company's stock, valued at approximately $8,771,510. This represents a 36.98% decrease in their position. The sale was disclosed in a document filed with the Securities & Exchange Commission, which is accessible through this link. Also, SVP David Ryan Purdue sold 5,230 shares of the stock in a transaction dated Wednesday, March 4th. The stock was sold at an average price of $233.56, for a total value of $1,221,518.80. Following the transaction, the senior vice president owned 2,654 shares of the company's stock, valued at approximately $619,868.24. This trade represents a 66.34% decrease in their position. The disclosure for this sale is available in the SEC filing. 0.25% of the stock is currently owned by corporate insiders. Several equities research analysts have recently weighed in on ABBV shares. Morgan Stanley upped their target price on shares of AbbVie from $269.00 to $270.00 and gave the stock an ""overweight"" rating in a report on Thursday, February 5th. Citigroup reduced their price target on shares of AbbVie from $235.00 to $230.00 and set a ""neutral"" rating on the stock in a research report on Tuesday, January 27th. HSBC raised shares of AbbVie from a ""hold"" rating to a ""buy"" rating and upped their price objective for the stock from $225.00 to $265.00 in a research note on Wednesday, December 10th. Evercore dropped their price objective on shares of AbbVie from $232.00 to $228.00 and set an ""outperform"" rating for the company in a report on Wednesday, February 4th. Finally, UBS Group cut their target price on shares of AbbVie from $240.00 to $230.00 and set a ""neutral"" rating for the company in a research note on Thursday, February 5th. Two research analysts have rated the stock with a Strong Buy rating, fourteen have given a Buy rating and nine have assigned  a Hold rating to the stock. According to data from MarketBeat, AbbVie  has a consensus rating of ""Moderate Buy"" and an average price target of $253.15. AbbVie stock opened at $208.79 on Friday. AbbVie Inc. has a 1 year low of $164.39 and a 1 year high of $244.81. The company has a market cap of $369.17 billion, a PE ratio of 88.47, a PEG ratio of 0.73 and a beta of 0.38. The company's 50-day moving average is $221.58 and its two-hundred day moving average is $224.41. AbbVie (NYSE:ABBV - Get Free Report) last posted its quarterly earnings results on Wednesday, February 4th. The company reported $2.71 earnings per share (EPS) for the quarter, topping the consensus estimate of $2.65 by $0.06. AbbVie had a negative return on equity of 1,579.75% and a net margin of 6.91%.The business had revenue of $16.62 billion for the quarter, compared to analyst estimates of $16.39 billion. During the same period last year, the company earned $2.16 EPS. The firm's revenue was up 10.0% on a year-over-year basis. AbbVie has set its FY 2026 guidance at 14.370-14.570 EPS and its Q1 2026 guidance at 2.970-3.010 EPS.  Research analysts forecast that  AbbVie Inc. will post 12.31 EPS for the current year. The firm also recently disclosed a quarterly dividend, which will be paid on Friday, May 15th. Investors of record on Wednesday, April 15th will be given a $1.73 dividend. The ex-dividend date is Wednesday, April 15th. This represents a $6.92 annualized dividend and a dividend yield of 3.3%. AbbVie's payout ratio is currently 293.22%. AbbVie is a global, research-driven biopharmaceutical company that was created as a spin-off from Abbott Laboratories in 2013 and is headquartered in North Chicago, Illinois. The company focuses on discovering, developing and commercializing therapies for complex and often chronic medical conditions. Its operations span research and development, manufacturing, regulatory affairs and commercialization, with an emphasis on bringing specialty medicines to market across multiple therapeutic areas. AbbVie's product portfolio and pipeline cover several major therapeutic categories, including immunology, oncology, neuroscience, virology and women's health. This instant news alert was generated by narrative science technology and financial data from MarketBeat in order to provide readers with the fastest reporting and unbiased coverage. Please send any questions or comments about this story to contact@marketbeat.com. Before you consider AbbVie, you'll want to hear this. MarketBeat keeps track of Wall Street's top-rated and best performing research analysts and the stocks they recommend to their clients on a daily basis. MarketBeat has identified the five stocks that top analysts are quietly whispering to their clients to buy now before the broader market catches on... and AbbVie wasn't on the list. While AbbVie currently has a Moderate Buy rating among analysts, top-rated analysts believe these five stocks are better buys. Discover the 10 Best High-Yield Dividend Stocks for 2026 and secure reliable income in uncertain markets. Download the report now to identify top dividend payers and avoid common yield traps. Sign up for MarketBeat All Access to gain access to MarketBeat's full suite of research tools. 345 N Reid Place, Suite 620, Sioux Falls, SD 57103
                                        
                                        contact@marketbeat.com
                                        
                                        (844) 978-6257 © MarketBeat Media, LLC 2010-2026. All rights reserved. © 2026   Fair market value prices are updated every minute and are provided by Massive. Other market data provided is at least 10-minutes delayed and hosted by Barchart Solutions.  Information is provided 'as-is' and solely for informational purposes, not for trading purposes or advice, and is delayed. To see all exchange delays and terms of use please see Barchart's disclaimer. We and our partners share information on your use of this website to help improve your experience. For more information, or to opt out click the Do Not Sell My Information button below.",https://www.marketbeat.com/instant-alerts/filing-thurston-springer-miller-herd-titak-inc-acquires-6946-shares-of-abbvie-inc-abbv-2026-04-04/
ABBV,"C2P Capital Advisory Group LLC d.b.a. Prosperity Capital Advisors Sells 8,610 Shares of AbbVie Inc. $ABBV - MarketBeat",2026-04-04 08:44:58,"C2P Capital Advisory Group LLC d.b.a. Prosperity Capital Advisors lowered its position in  AbbVie Inc. (NYSE:ABBV - Free Report) by 29.8% during the fourth quarter, according to the company in its most recent filing with the Securities & Exchange Commission. The fund owned 20,322 shares of the company's stock after selling 8,610 shares during the period. C2P Capital Advisory Group LLC d.b.a. Prosperity Capital Advisors' holdings in AbbVie were worth $4,643,000 as of its most recent SEC filing. Several other large investors have also recently modified their holdings of the company. Evolution Wealth Management Inc. purchased a new position in  AbbVie during the 2nd quarter worth $26,000.  Chelsea Counsel Co. purchased a new stake in  AbbVie in the third quarter valued at about $26,000.  Westend Capital Management LLC acquired a new stake in  AbbVie in the fourth quarter worth about $29,000.  Texas Capital Bancshares Inc TX acquired a new stake in  AbbVie in the third quarter worth about $31,000.  Finally, Caitlin John LLC purchased a new stake in shares of  AbbVie during the third quarter worth about $33,000. Institutional investors own  70.23% of the company's stock. In other news, SVP David Ryan Purdue sold 5,230 shares of the business's stock in a transaction dated Wednesday, March 4th. The stock was sold at an average price of $233.56, for a total value of $1,221,518.80. Following the completion of the transaction, the senior vice president owned 2,654 shares of the company's stock, valued at $619,868.24. The trade was a 66.34% decrease in their position. The sale was disclosed in a filing with the SEC, which is available through the SEC website. Also, EVP Perry C. Siatis sold 22,381 shares of the company's stock in a transaction dated Wednesday, February 25th. The stock was sold at an average price of $230.00, for a total value of $5,147,630.00. Following the completion of the sale, the executive vice president owned 38,137 shares in the company, valued at $8,771,510. The trade was a 36.98% decrease in their position. Additional details regarding this sale are available in the official SEC disclosure. Insiders own  0.25% of the company's stock. Several equities analysts have recently issued reports on the stock. Royal Bank Of Canada began coverage on shares of AbbVie in a report on Tuesday, February 24th. They set an ""outperform"" rating and a $260.00 price objective on the stock. Wall Street Zen raised shares of AbbVie from a ""buy"" rating to a ""strong-buy"" rating in a research report on Saturday, February 28th. BMO Capital Markets  reaffirmed an ""outperform"" rating on shares of AbbVie in a report on Monday, March 9th. Weiss Ratings  reiterated a ""hold (c)"" rating on shares of AbbVie in a research note on Wednesday, January 21st. Finally, Evercore dropped their price objective on shares of AbbVie from $232.00 to $228.00 and set an ""outperform"" rating on the stock in a report on Wednesday, February 4th. Two research analysts have rated the stock with a Strong Buy rating, fourteen have given a Buy rating and nine have assigned  a Hold rating to the company's stock. According to data from MarketBeat.com, AbbVie currently has an average rating of ""Moderate Buy"" and an average price target of $253.15. Shares of NYSE ABBV opened at $208.79 on Friday. The business's 50 day moving average price is $221.58 and its 200 day moving average price is $224.41. The firm has a market cap of $369.17 billion, a P/E ratio of 88.47, a P/E/G ratio of 0.73 and a beta of 0.38. AbbVie Inc. has a 52 week low of $164.39 and a 52 week high of $244.81. AbbVie (NYSE:ABBV - Get Free Report) last posted its quarterly earnings results on Wednesday, February 4th. The company reported $2.71 earnings per share (EPS) for the quarter, topping analysts' consensus estimates of $2.65 by $0.06. AbbVie had a net margin of 6.91% and a negative return on equity of 1,579.75%. The company had revenue of $16.62 billion during the quarter, compared to analyst estimates of $16.39 billion. During the same period last year, the firm posted $2.16 EPS. AbbVie's revenue for the quarter was up 10.0% compared to the same quarter last year. AbbVie has set its FY 2026 guidance at 14.370-14.570 EPS and its Q1 2026 guidance at 2.970-3.010 EPS.  As a group, research analysts expect that  AbbVie Inc. will post 12.31 earnings per share for the current year. The firm also recently announced a quarterly dividend, which will be paid on Friday, May 15th. Investors of record on Wednesday, April 15th will be issued a dividend of $1.73 per share. This represents a $6.92 annualized dividend and a dividend yield of 3.3%. The ex-dividend date of this dividend is Wednesday, April 15th. AbbVie's dividend payout ratio (DPR) is 293.22%. AbbVie is a global, research-driven biopharmaceutical company that was created as a spin-off from Abbott Laboratories in 2013 and is headquartered in North Chicago, Illinois. The company focuses on discovering, developing and commercializing therapies for complex and often chronic medical conditions. Its operations span research and development, manufacturing, regulatory affairs and commercialization, with an emphasis on bringing specialty medicines to market across multiple therapeutic areas. AbbVie's product portfolio and pipeline cover several major therapeutic categories, including immunology, oncology, neuroscience, virology and women's health. Want to see what other hedge funds are holding ABBV? Visit HoldingsChannel.com to get the latest 13F filings and insider trades for AbbVie Inc. (NYSE:ABBV - Free Report). This instant news alert was generated by narrative science technology and financial data from MarketBeat in order to provide readers with the fastest reporting and unbiased coverage. Please send any questions or comments about this story to contact@marketbeat.com. Before you consider AbbVie, you'll want to hear this. MarketBeat keeps track of Wall Street's top-rated and best performing research analysts and the stocks they recommend to their clients on a daily basis. MarketBeat has identified the five stocks that top analysts are quietly whispering to their clients to buy now before the broader market catches on... and AbbVie wasn't on the list. While AbbVie currently has a Moderate Buy rating among analysts, top-rated analysts believe these five stocks are better buys. Click the link to see MarketBeat's list of seven stocks and why their long-term outlooks are very promising. Sign up for MarketBeat All Access to gain access to MarketBeat's full suite of research tools. 345 N Reid Place, Suite 620, Sioux Falls, SD 57103
                                        
                                        contact@marketbeat.com
                                        
                                        (844) 978-6257 © MarketBeat Media, LLC 2010-2026. All rights reserved. © 2026   Fair market value prices are updated every minute and are provided by Massive. Other market data provided is at least 10-minutes delayed and hosted by Barchart Solutions.  Information is provided 'as-is' and solely for informational purposes, not for trading purposes or advice, and is delayed. To see all exchange delays and terms of use please see Barchart's disclaimer. We and our partners share information on your use of this website to help improve your experience. For more information, or to opt out click the Do Not Sell My Information button below.",https://www.marketbeat.com/instant-alerts/filing-c2p-capital-advisory-group-llc-dba-prosperity-capital-advisors-sells-8610-shares-of-abbvie-inc-abbv-2026-04-04/
ABBV,"How Investors Are Reacting To AbbVie (ABBV) Dermatology Data, Governance Debate and Rising Tariff Risk - simplywall.st",2026-04-03 05:06:47,"Uncover the next big thing with 31 elite penny stocks that balance risk and reward. To own AbbVie, you have to believe its immunology and neuroscience engines, led by drugs like Skyrizi and Rinvoq, can support earnings despite patent cycles, pricing pressure and higher debt. The key near term catalyst remains execution in immunology, while the biggest emerging risk is policy driven, with potential US tariffs on imported branded drugs adding another layer of uncertainty to existing drug pricing and reimbursement pressures. So far, the tariff headlines look more sentiment driven than fundamentally specific to AbbVie. The most relevant recent update is AbbVie’s extensive new dermatology data for Skyrizi and Rinvoq at the AAD 2026 meeting, which reinforced long term safety, disease control and quality of life outcomes across psoriasis and atopic dermatitis. For investors focused on AbbVie’s immunology narrative, this kind of real world and late stage evidence helps support confidence in the durability of the franchise at a time when both competition and policy risk are firmly in the spotlight. Yet for investors, the tariff and broader drug pricing risk is something you really need to understand before you... AbbVie's narrative projects $77.7 billion revenue and $22.8 billion earnings by 2029. This requires 8.3% yearly revenue growth and a $18.6 billion earnings increase from $4.2 billion today. Uncover how AbbVie's forecasts yield a $249.14 fair value, a 19% upside to its current price. Four fair value estimates from the Simply Wall St Community range from about US$249 to US$369, underlining how differently you and other investors can view AbbVie. Against that spread, the risk of tighter government drug price controls and potential tariffs on imported branded medicines could be an important factor shaping how resilient AbbVie’s future earnings profile really looks. Explore 4 other fair value estimates on AbbVie - why the stock might be worth as much as 77% more than the current price! Disagree with existing narratives? Extraordinary investment returns rarely come from following the herd, so go with your instincts. The market won't wait. These fast-moving stocks are hot now. Grab the list before they run: This article by Simply Wall St is general in nature. We provide commentary based on historical data
    and analyst forecasts only using an unbiased methodology and our articles are not intended to be financial advice. It does not constitute a recommendation to buy or sell any stock, and does not take account of your objectives, or your
    financial situation. We aim to bring you long-term focused analysis driven by fundamental data.
    Note that our analysis may not factor in the latest price-sensitive company announcements or qualitative material.
    Simply Wall St has no position in any stocks mentioned. We've created the ultimate portfolio companion for stock investors, and it's free. • Connect an unlimited number of Portfolios and see your total in one currency• Be alerted to new Warning Signs or Risks via email or mobile• Track the Fair Value of your stocks Have feedback on this article? Concerned about the content? Get in touch with us directly. Alternatively, email editorial-team@simplywallst.com A research-based biopharmaceutical company, engages in the research and development, manufacturing, commercializing, and sale of medicines and therapies worldwide. Moderate risk with reasonable growth potential and pays a dividend. Financial Data provided by S&P Global Market Intelligence LLC, analysis provided by Simply Wall Street Pty Ltd. Copyright © 2026, S&P Global Market Intelligence LLC. All rights reserved. Simply Wall Street Pty Ltd (ACN 600 056 611), is a Corporate Authorised Representative (Authorised Representative Number: 467183) of Sanlam Private Wealth Pty Ltd (AFSL No. 337927). Any advice contained in this website is general advice only and has been prepared without considering your objectives, financial situation or needs. You should not rely on any advice and/or information contained in this website and before making any investment decision we recommend that you consider whether it is appropriate for your situation and seek appropriate financial, taxation and legal advice. Please read our Financial Services Guide before deciding whether to obtain financial services from us. © 2026 Simply Wall Street Pty Ltd, US Design Patent #29/544/281, Community and European Design Registration #2845206",https://simplywall.st/stocks/us/pharmaceuticals-biotech/nyse-abbv/abbvie/news/how-investors-are-reacting-to-abbvie-abbv-dermatology-data-g
