ticker,title,date,content,url
ABBV,"Here's How Many Shares of AbbVie (ABBV) Stock You'd Need for $10,000 in Yearly Dividends - AOL.com",2026-04-05 21:26:36,"AbbVie has increased its dividend by more than 330% since 2013. It has a robust pipeline of drugs in development and growing revenue, too. It's smart to seek dividend income from your investments because it can be used to help pay living expenses or to buy more stock. A solid dividend-paying stock to consider is pharmaceutical company AbbVie (NYSE: ABBV), which was spun off from Abbott Laboratories in 2013. The stock recently sported a 3.38% dividend yield, far above the average yield of 1.1% for stocks in the S&P 500. If you're looking for, say, $10,000 in annual dividend income, how many shares of AbbVie do you need to buy? Will AI create the world's first trillionaire? Our team just released a report on the one little-known company, called an ""Indispensable Monopoly"" providing the critical technology Nvidia and Intel both need. Continue » Well, start by noting that the company's last quarterly dividend payment was $1.73 per share. The yearly run rate, then, is $6.92 per share. So divide $10,000 by $6.92, and you'll get 1,445 -- the number of shares you'd need. With the stock recently trading around $205 per share (as of March 24), those 1,445 shares would cost you a hefty $296,225. (Fortunately, you can always buy fewer than 1,445 shares!) One reason to consider investing in AbbVie is that it's a rather reliable dividend payer -- and dividend grower. Since 2013, it has upped its payout by more than 330%. Better still, when you combine its history with that of Abbott Labs, you'll see that it has increased its payout annually for more than 25 years. So the $10,000 (or other sum) that you collect in dividends this year could be much more after a few years. The dividend is not the only reason to consider AbbVie. It's a strong grower in general, with its stock averaging annual gains of 16.2% over the past decade. Its 2025 revenue was up 8.6% over the year before -- despite its having lost patent protection for its blockbuster drug, Humira. Its pipeline of 90-plus drugs in development is promising, too. AbbVie's stock is reasonably priced, with a recent forward-looking price-to-earnings (P/E) ratio of 14, a bit above the five-year average of 13. The Motley Fool Stock Advisor analyst team just identified what they believe are the 10 best stocks for investors to buy now… and AbbVie wasn’t one of them. The 10 stocks that made the cut could produce monster returns in the coming years. Consider when Netflix made this list on December 17, 2004... if you invested $1,000 at the time of our recommendation, you’d have $497,659!* Or when Nvidia made this list on April 15, 2005... if you invested $1,000 at the time of our recommendation, you’d have $1,095,404!* Now, it’s worth noting Stock Advisor’s total average return is 912% — a market-crushing outperformance compared to 185% for the S&P 500. Don't miss the latest top 10 list, available with Stock Advisor, and join an investing community built by individual investors for individual investors. Selena Maranjian has positions in AbbVie. The Motley Fool has positions in and recommends AbbVie and Abbott Laboratories. The Motley Fool has a disclosure policy.",https://www.aol.com/finance/heres-many-shares-abbvie-abbv-100600026.html
ABBV,AbbVie Inc. $ABBV Shares Purchased by Kelleher Financial Advisors - MarketBeat,2026-04-05 10:50:18,"Kelleher Financial Advisors boosted its position in shares of  AbbVie Inc. (NYSE:ABBV - Free Report) by 80.7% in the 4th quarter, according to its most recent filing with the Securities & Exchange Commission. The institutional investor  owned 11,903 shares of the company's stock after acquiring an additional 5,315 shares during the period. Kelleher Financial Advisors' holdings in AbbVie were worth $2,720,000 as of its most recent SEC filing. A number of other large investors also recently modified their holdings of the company. Vanguard Group Inc. lifted its position in shares of  AbbVie by 0.3% during the 3rd quarter. Vanguard Group Inc. now owns 177,747,261 shares of the company's stock worth $41,155,601,000 after purchasing an additional 448,554 shares during the last quarter.  Legal & General Group Plc increased its holdings in  AbbVie by 4.3% in the third quarter. Legal & General Group Plc now owns 12,004,084 shares of the company's stock valued at $2,779,426,000 after buying an additional 493,420 shares during the last quarter.  Wellington Management Group LLP raised its stake in  AbbVie by 457.4% in the third quarter. Wellington Management Group LLP now owns 10,536,901 shares of the company's stock valued at $2,439,714,000 after buying an additional 8,646,424 shares in the last quarter.  Amundi raised its stake in  AbbVie by 15.6% in the third quarter. Amundi now owns 10,508,317 shares of the company's stock valued at $2,418,909,000 after buying an additional 1,414,621 shares in the last quarter.  Finally, Ameriprise Financial Inc. lifted its holdings in  AbbVie by 4.4% during the 3rd quarter. Ameriprise Financial Inc. now owns 9,675,877 shares of the company's stock worth $2,241,363,000 after buying an additional 408,426 shares during the last quarter. 70.23% of the stock is owned by hedge funds and other institutional investors. In related news, EVP Perry C. Siatis sold 22,381 shares of the stock in a transaction on Wednesday, February 25th. The shares were sold at an average price of $230.00, for a total transaction of $5,147,630.00. Following the completion of the sale, the executive vice president owned 38,137 shares in the company, valued at $8,771,510. This represents a 36.98% decrease in their position. The sale was disclosed in a document filed with the Securities & Exchange Commission, which is available at the SEC website. Also, SVP David Ryan Purdue sold 5,230 shares of the firm's stock in a transaction on Wednesday, March 4th. The stock was sold at an average price of $233.56, for a total transaction of $1,221,518.80. Following the transaction, the senior vice president directly owned 2,654 shares in the company, valued at $619,868.24. The trade was a 66.34% decrease in their ownership of the stock. The SEC filing for this sale provides additional information. Company insiders own  0.25% of the company's stock. ABBV opened at $208.79 on Friday. AbbVie Inc. has a one year low of $164.39 and a one year high of $244.81. The stock has a market capitalization of $369.17 billion, a P/E ratio of 88.47, a price-to-earnings-growth ratio of 0.73 and a beta of 0.38. The business's 50-day simple moving average is $221.58 and its 200-day simple moving average is $224.47. AbbVie (NYSE:ABBV - Get Free Report) last announced its earnings results on Wednesday, February 4th. The company reported $2.71 earnings per share (EPS) for the quarter, beating analysts' consensus estimates of $2.65 by $0.06. The firm had revenue of $16.62 billion during the quarter, compared to analysts' expectations of $16.39 billion. AbbVie had a negative return on equity of 1,579.75% and a net margin of 6.91%.The business's revenue was up 10.0% on a year-over-year basis. During the same period in the prior year, the firm earned $2.16 EPS. AbbVie has set its FY 2026 guidance at 14.370-14.570 EPS and its Q1 2026 guidance at 2.970-3.010 EPS.  On average, equities research analysts forecast that  AbbVie Inc. will post 12.31 EPS for the current fiscal year. The firm also recently announced a quarterly dividend, which will be paid on Friday, May 15th. Stockholders of record on Wednesday, April 15th will be given a dividend of $1.73 per share. The ex-dividend date is Wednesday, April 15th. This represents a $6.92 dividend on an annualized basis and a dividend yield of 3.3%. AbbVie's dividend payout ratio (DPR) is 293.22%. ABBV has been the subject of several analyst reports. Guggenheim  reaffirmed a ""buy"" rating on shares of AbbVie in a research report on Thursday, March 12th. BMO Capital Markets  restated an ""outperform"" rating on shares of AbbVie in a research note on Monday, March 9th. HSBC raised AbbVie from a ""hold"" rating to a ""buy"" rating and upped their price target for the company from $225.00 to $265.00 in a report on Wednesday, December 10th. Barclays initiated coverage on shares of AbbVie in a research note on Thursday, February 19th. They issued an ""overweight"" rating and a $275.00 price target on the stock. Finally, Piper Sandler raised their price objective on shares of AbbVie from $289.00 to $299.00 and gave the stock an ""overweight"" rating in a report on Wednesday, February 18th. Two investment analysts have rated the stock with a Strong Buy rating, fourteen have issued  a Buy rating and nine have issued  a Hold rating to the stock. According to data from MarketBeat.com, the company presently has an average rating of ""Moderate Buy"" and an average price target of $253.15. AbbVie is a global, research-driven biopharmaceutical company that was created as a spin-off from Abbott Laboratories in 2013 and is headquartered in North Chicago, Illinois. The company focuses on discovering, developing and commercializing therapies for complex and often chronic medical conditions. Its operations span research and development, manufacturing, regulatory affairs and commercialization, with an emphasis on bringing specialty medicines to market across multiple therapeutic areas. AbbVie's product portfolio and pipeline cover several major therapeutic categories, including immunology, oncology, neuroscience, virology and women's health. This instant news alert was generated by narrative science technology and financial data from MarketBeat in order to provide readers with the fastest reporting and unbiased coverage. Please send any questions or comments about this story to contact@marketbeat.com. Before you consider AbbVie, you'll want to hear this. MarketBeat keeps track of Wall Street's top-rated and best performing research analysts and the stocks they recommend to their clients on a daily basis. MarketBeat has identified the five stocks that top analysts are quietly whispering to their clients to buy now before the broader market catches on... and AbbVie wasn't on the list. While AbbVie currently has a Moderate Buy rating among analysts, top-rated analysts believe these five stocks are better buys. Wondering what the next stocks will be that hit it big, with solid fundamentals? Click the link to see which stocks MarketBeat analysts could become the next blockbuster growth stocks. Sign up for MarketBeat All Access to gain access to MarketBeat's full suite of research tools. 345 N Reid Place, Suite 620, Sioux Falls, SD 57103
                                        
                                        contact@marketbeat.com
                                        
                                        (844) 978-6257 © MarketBeat Media, LLC 2010-2026. All rights reserved. © 2026   Fair market value prices are updated every minute and are provided by Massive. Other market data provided is at least 10-minutes delayed and hosted by Barchart Solutions.  Information is provided 'as-is' and solely for informational purposes, not for trading purposes or advice, and is delayed. To see all exchange delays and terms of use please see Barchart's disclaimer. We and our partners share information on your use of this website to help improve your experience. For more information, or to opt out click the Do Not Sell My Information button below.",https://www.marketbeat.com/instant-alerts/filing-abbvie-inc-abbv-shares-purchased-by-kelleher-financial-advisors-2026-04-05/
ABBV,AbbVie Inc. $ABBV Shares Purchased by JB Capital LLC - MarketBeat,2026-04-05 10:16:22,"JB Capital LLC boosted its position in shares of  AbbVie Inc. (NYSE:ABBV - Free Report) by 269.7% in the fourth quarter, according to its most recent filing with the Securities and Exchange Commission (SEC). The firm owned 16,913 shares of the company's stock after acquiring an additional 12,338 shares during the quarter. JB Capital LLC's holdings in AbbVie were worth $3,864,000 at the end of the most recent quarter. A number of other institutional investors and hedge funds also recently bought and sold shares of ABBV. Diversified Trust Co boosted its position in  AbbVie by 23.6% in the 3rd quarter. Diversified Trust Co now owns 57,076 shares of the company's stock valued at $13,215,000 after buying an additional 10,891 shares during the period.  Permanent Capital Management LP purchased a new stake in shares of  AbbVie during the third quarter worth $720,000.  Railway Pension Investments Ltd raised its stake in shares of  AbbVie by 33.0% in the third quarter. Railway Pension Investments Ltd now owns 853,949 shares of the company's stock valued at $197,723,000 after acquiring an additional 211,800 shares in the last quarter.  World Investment Advisors raised its stake in shares of  AbbVie by 9.4% in the third quarter. World Investment Advisors now owns 113,925 shares of the company's stock valued at $26,378,000 after acquiring an additional 9,811 shares in the last quarter.  Finally, Charles Schwab Trust Co boosted its holdings in  AbbVie by 93.4% in the third quarter. Charles Schwab Trust Co now owns 32,105 shares of the company's stock valued at $7,434,000 after purchasing an additional 15,502 shares during the period. 70.23% of the stock is currently owned by hedge funds and other institutional investors. Shares of NYSE ABBV opened at $208.79 on Friday. The business has a 50-day moving average of $221.58 and a two-hundred day moving average of $224.47. The company has a market capitalization of $369.17 billion, a price-to-earnings ratio of 88.47, a price-to-earnings-growth ratio of 0.73 and a beta of 0.38. AbbVie Inc. has a 1 year low of $164.39 and a 1 year high of $244.81. AbbVie (NYSE:ABBV - Get Free Report) last released its quarterly earnings data on Wednesday, February 4th. The company reported $2.71 EPS for the quarter, beating analysts' consensus estimates of $2.65 by $0.06. The business had revenue of $16.62 billion for the quarter, compared to the consensus estimate of $16.39 billion. AbbVie had a negative return on equity of 1,579.75% and a net margin of 6.91%.The business's revenue for the quarter was up 10.0% on a year-over-year basis. During the same quarter in the prior year, the business posted $2.16 EPS. AbbVie has set its FY 2026 guidance at 14.370-14.570 EPS and its Q1 2026 guidance at 2.970-3.010 EPS.  As a group, equities research analysts expect that  AbbVie Inc. will post 12.31 earnings per share for the current year. The business also recently disclosed a quarterly dividend, which will be paid on Friday, May 15th. Shareholders of record on Wednesday, April 15th will be issued a dividend of $1.73 per share. The ex-dividend date of this dividend is Wednesday, April 15th. This represents a $6.92 dividend on an annualized basis and a yield of 3.3%. AbbVie's dividend payout ratio (DPR) is presently 293.22%. In related news, SVP David Ryan Purdue sold 5,230 shares of the stock in a transaction on Wednesday, March 4th. The shares were sold at an average price of $233.56, for a total value of $1,221,518.80. Following the transaction, the senior vice president directly owned 2,654 shares of the company's stock, valued at $619,868.24. This trade represents a 66.34% decrease in their position. The transaction was disclosed in a filing with the SEC, which is accessible through the SEC website. Also, EVP Perry C. Siatis sold 22,381 shares of AbbVie stock in a transaction on Wednesday, February 25th. The stock was sold at an average price of $230.00, for a total transaction of $5,147,630.00. Following the sale, the executive vice president owned 38,137 shares in the company, valued at $8,771,510. This represents a 36.98% decrease in their ownership of the stock. Additional details regarding this sale are available in the official SEC disclosure. 0.25% of the stock is currently owned by company insiders. Several equities research analysts have weighed in on ABBV shares. BMO Capital Markets  restated an ""outperform"" rating on shares of AbbVie in a report on Monday, March 9th. Wall Street Zen upgraded shares of AbbVie from a ""buy"" rating to a ""strong-buy"" rating in a research note on Saturday, February 28th. The Goldman Sachs Group  reaffirmed a ""neutral"" rating and issued a $223.00 target price on shares of AbbVie in a report on Wednesday, January 28th. Morgan Stanley lifted their price target on shares of AbbVie from $269.00 to $270.00 and gave the stock an ""overweight"" rating in a research note on Thursday, February 5th. Finally, Evercore lowered their price target on shares of AbbVie from $232.00 to $228.00 and set an ""outperform"" rating for the company in a report on Wednesday, February 4th. Two investment analysts have rated the stock with a Strong Buy rating, fourteen have issued  a Buy rating and nine have assigned  a Hold rating to the company's stock. Based on data from MarketBeat, the company  has a consensus rating of ""Moderate Buy"" and an average target price of $253.15. AbbVie is a global, research-driven biopharmaceutical company that was created as a spin-off from Abbott Laboratories in 2013 and is headquartered in North Chicago, Illinois. The company focuses on discovering, developing and commercializing therapies for complex and often chronic medical conditions. Its operations span research and development, manufacturing, regulatory affairs and commercialization, with an emphasis on bringing specialty medicines to market across multiple therapeutic areas. AbbVie's product portfolio and pipeline cover several major therapeutic categories, including immunology, oncology, neuroscience, virology and women's health. This instant news alert was generated by narrative science technology and financial data from MarketBeat in order to provide readers with the fastest reporting and unbiased coverage. Please send any questions or comments about this story to contact@marketbeat.com. Before you consider AbbVie, you'll want to hear this. MarketBeat keeps track of Wall Street's top-rated and best performing research analysts and the stocks they recommend to their clients on a daily basis. MarketBeat has identified the five stocks that top analysts are quietly whispering to their clients to buy now before the broader market catches on... and AbbVie wasn't on the list. While AbbVie currently has a Moderate Buy rating among analysts, top-rated analysts believe these five stocks are better buys. Click the link to see MarketBeat's list of ten stocks that are set to soar in 2026, despite the threat of tariffs and other economic uncertainty. These ten stocks are incredibly resilient and are likely to thrive in any economic environment. Sign up for MarketBeat All Access to gain access to MarketBeat's full suite of research tools. 345 N Reid Place, Suite 620, Sioux Falls, SD 57103
                                        
                                        contact@marketbeat.com
                                        
                                        (844) 978-6257 © MarketBeat Media, LLC 2010-2026. All rights reserved. © 2026   Fair market value prices are updated every minute and are provided by Massive. Other market data provided is at least 10-minutes delayed and hosted by Barchart Solutions.  Information is provided 'as-is' and solely for informational purposes, not for trading purposes or advice, and is delayed. To see all exchange delays and terms of use please see Barchart's disclaimer. We and our partners share information on your use of this website to help improve your experience. For more information, or to opt out click the Do Not Sell My Information button below.",https://www.marketbeat.com/instant-alerts/filing-abbvie-inc-abbv-shares-purchased-by-jb-capital-llc-2026-04-05/
