ticker,title,date,content,url
ABBV,Turtle Creek Wealth Advisors LLC Has $4.74 Million Stock Holdings in AbbVie Inc. $ABBV - MarketBeat,2026-04-24 12:57:48,"Turtle Creek Wealth Advisors LLC increased its position in  AbbVie Inc. (NYSE:ABBV - Free Report) by 70.2% in the 4th quarter, according to the company in its most recent 13F filing with the Securities and Exchange Commission (SEC). The firm owned 20,751 shares of the company's stock after buying an additional 8,559 shares during the period. Turtle Creek Wealth Advisors LLC's holdings in AbbVie were worth $4,741,000 at the end of the most recent reporting period. Several other large investors also recently made changes to their positions in the company. Chelsea Counsel Co. bought a new position in shares of  AbbVie during the 3rd quarter worth approximately $26,000.  Westend Capital Management LLC bought a new position in shares of  AbbVie in the fourth quarter valued at approximately $29,000.  Texas Capital Bancshares Inc TX purchased a new stake in shares of  AbbVie during the third quarter valued at approximately $31,000.  WestEnd Advisors LLC lifted its holdings in  AbbVie by 160.4% during the fourth quarter. WestEnd Advisors LLC now owns 138 shares of the company's stock worth $32,000 after acquiring an additional 85 shares during the period.  Finally, Caitlin John LLC purchased a new position in  AbbVie in the third quarter worth $33,000. 70.23% of the stock is currently owned by institutional investors and hedge funds. Here are the key news stories impacting AbbVie this week: In other AbbVie news, SVP David Ryan Purdue sold 5,230 shares of the firm's stock in a transaction dated Wednesday, March 4th. The shares were sold at an average price of $233.56, for a total value of $1,221,518.80. Following the completion of the sale, the senior vice president directly owned 2,654 shares in the company, valued at $619,868.24. This trade represents a 66.34% decrease in their ownership of the stock. The sale was disclosed in a filing with the SEC, which is available at this link. Also, EVP Perry C. Siatis sold 22,381 shares of the firm's stock in a transaction dated Wednesday, February 25th. The stock was sold at an average price of $230.00, for a total transaction of $5,147,630.00. Following the completion of the sale, the executive vice president owned 38,137 shares of the company's stock, valued at $8,771,510. This trade represents a 36.98% decrease in their ownership of the stock. The disclosure for this sale is available in the SEC filing. Corporate insiders own  0.06% of the company's stock. ABBV has been the topic of several research analyst reports. Barclays initiated coverage on AbbVie in a research report on Thursday, February 19th. They issued an ""overweight"" rating and a $275.00 price objective on the stock. Morgan Stanley boosted their price objective on AbbVie from $269.00 to $270.00 and gave the stock an ""overweight"" rating in a research report on Thursday, February 5th. Weiss Ratings  reissued a ""hold (c)"" rating on shares of AbbVie in a research report on Wednesday, January 21st. Citigroup lowered their price target on shares of AbbVie from $235.00 to $230.00 and set a ""neutral"" rating on the stock in a report on Tuesday, January 27th. Finally, Evercore dropped their price objective on AbbVie from $232.00 to $228.00 and set an ""outperform"" rating on the stock in a research note on Wednesday, February 4th. Three equities research analysts have rated the stock with a Strong Buy rating, fourteen have given a Buy rating and nine have assigned  a Hold rating to the company's stock. According to data from MarketBeat.com, AbbVie presently has an average rating of ""Moderate Buy"" and a consensus price target of $253.19. AbbVie stock opened at $200.97 on Friday. The stock has a market cap of $355.34 billion, a P/E ratio of 85.15, a PEG ratio of 0.72 and a beta of 0.38. AbbVie Inc. has a fifty-two week low of $176.11 and a fifty-two week high of $244.81. The firm's fifty day moving average price is $217.33 and its 200-day moving average price is $222.62. AbbVie (NYSE:ABBV - Get Free Report) last released its earnings results on Wednesday, February 4th. The company reported $2.71 EPS for the quarter, beating analysts' consensus estimates of $2.65 by $0.06. AbbVie had a negative return on equity of 1,579.75% and a net margin of 6.91%.The business had revenue of $16.62 billion for the quarter, compared to analysts' expectations of $16.39 billion. During the same quarter in the prior year, the firm earned $2.16 earnings per share. The firm's revenue was up 10.0% on a year-over-year basis. AbbVie has set its FY 2026 guidance at 14.370-14.570 EPS and its Q1 2026 guidance at 2.970-3.010 EPS.  Sell-side analysts predict that  AbbVie Inc. will post 14.22 earnings per share for the current year. The company also recently announced a quarterly dividend, which will be paid on Friday, May 15th. Stockholders of record on Wednesday, April 15th will be issued a dividend of $1.73 per share. This represents a $6.92 dividend on an annualized basis and a dividend yield of 3.4%. The ex-dividend date is Wednesday, April 15th. AbbVie's dividend payout ratio  is currently 293.22%. AbbVie is a global, research-driven biopharmaceutical company that was created as a spin-off from Abbott Laboratories in 2013 and is headquartered in North Chicago, Illinois. The company focuses on discovering, developing and commercializing therapies for complex and often chronic medical conditions. Its operations span research and development, manufacturing, regulatory affairs and commercialization, with an emphasis on bringing specialty medicines to market across multiple therapeutic areas. AbbVie's product portfolio and pipeline cover several major therapeutic categories, including immunology, oncology, neuroscience, virology and women's health. This instant news alert was generated by narrative science technology and financial data from MarketBeat in order to provide readers with the fastest reporting and unbiased coverage. Please send any questions or comments about this story to contact@marketbeat.com. Before you consider AbbVie, you'll want to hear this. MarketBeat keeps track of Wall Street's top-rated and best performing research analysts and the stocks they recommend to their clients on a daily basis. MarketBeat has identified the five stocks that top analysts are quietly whispering to their clients to buy now before the broader market catches on... and AbbVie wasn't on the list. While AbbVie currently has a Moderate Buy rating among analysts, top-rated analysts believe these five stocks are better buys. Nuclear energy is entering a new growth cycle as rising power demand, expanding data centers, and renewed policy support bring the sector back into focus. After strong gains in recent years, the most impactful phase of nuclear investment may still be ahead.

This report highlights seven nuclear energy stocks positioned across the value chain—combining near-term revenue with long-term upside as next-generation technologies scale. Click the link below to unlock the full list. Sign up for MarketBeat All Access to gain access to MarketBeat's full suite of research tools. 345 N Reid Place, Suite 620, Sioux Falls, SD 57103
                                        
                                        contact@marketbeat.com
                                        
                                        (844) 978-6257 © MarketBeat Media, LLC 2010-2026. All rights reserved. © 2026   Fair market value prices are updated every minute and are provided by Massive. Other market data provided is at least 10-minutes delayed and hosted by Barchart Solutions.  Information is provided 'as-is' and solely for informational purposes, not for trading purposes or advice, and is delayed. To see all exchange delays and terms of use please see Barchart's disclaimer. Enter your email address below to receive InsiderTrades.com’s daily insider buying and selling report for AbbVie and related companies.",https://www.marketbeat.com/instant-alerts/filing-turtle-creek-wealth-advisors-llc-has-474-million-stock-holdings-in-abbvie-inc-abbv-2026-04-24/
ABBV,"Guggenheim Maintains AbbVie(ABBV.US) With Buy Rating, Maintains Target Price $249 - 富途牛牛",2026-04-24 11:58:05,"Guggenheim analyst Vamil Divan maintains $AbbVie (ABBV.US)$ with a buy rating, and maintains the target price at $249. According to TipRanks data, the analyst has a success rate of 55.6% and a total average return of 11.1% over the past year. TipRanks, an independent third party, provides analysis data from financial analysts and calculates the Average Returns and Success Rates of the analysts' recommendations. The information presented is not an investment recommendation and is intended for informational purposes only. Success rate is the number of the analyst's successful ratings, divided by his/her total number of ratings over the past year. A successful rating is one based on if TipRanks' virtual portfolio earned a positive return from the stock. Total average return is the average rate of return that the TipRanks' virtual portfolio has earned over the past year. These portfolios are established based on the analyst's preliminary rating and are adjusted according to the changes in the rating. TipRanks provides a ranking of each analyst up to 5 stars, which is representative of all recommendations from the analyst. An analyst's past performance is evaluated on a scale of 1 to 5 stars, with more stars indicating better performance. The star level is determined by his/her total success rate and average return. Use the share button in your browser  to share the page with your friends",https://news.futunn.com/en/post/72017615/guggenheim-maintains-abbvie-abbvus-with-buy-rating-maintains-target-price?level=1&data_ticket=1777169463151857
ABBV,AbbVie Inc. $ABBV Shares Sold by Torray Investment Partners LLC - MarketBeat,2026-04-24 10:34:26,"Torray Investment Partners LLC cut its position in  AbbVie Inc. (NYSE:ABBV - Free Report) by 8.8% in the 4th quarter, according to the company in its most recent 13F filing with the Securities and Exchange Commission (SEC). The firm owned 92,687 shares of the company's stock after selling 8,945 shares during the period. AbbVie accounts for approximately  3.0% of Torray Investment Partners LLC's investment portfolio, making the stock its 10th biggest holding. Torray Investment Partners LLC's holdings in AbbVie were worth $21,178,000 at the end of the most recent reporting period. Several other large investors have also added to or reduced their stakes in the business. Financial Symmetry Inc bought a new position in  AbbVie in the 4th quarter valued at about $228,000.  Nvest Wealth Strategies Inc. bought a new position in  AbbVie in the 4th quarter valued at about $60,000.  B. Metzler seel. Sohn & Co. AG lifted its position in  AbbVie by 67.2% in the 4th quarter. B. Metzler seel. Sohn & Co. AG now owns 833,677 shares of the company's stock valued at $190,659,000 after acquiring an additional 335,055 shares in the last quarter.  Milestone Asset Management LLC lifted its position in  AbbVie by 276.4% in the 4th quarter. Milestone Asset Management LLC now owns 26,001 shares of the company's stock valued at $5,941,000 after acquiring an additional 19,094 shares in the last quarter.  Finally, Teacher Retirement System of Texas lifted its position in  AbbVie by 2.6% in the 4th quarter. Teacher Retirement System of Texas now owns 589,752 shares of the company's stock valued at $134,752,000 after acquiring an additional 14,801 shares in the last quarter. Institutional investors own  70.23% of the company's stock. In related news, EVP Perry C. Siatis sold 22,381 shares of AbbVie stock in a transaction that occurred on Wednesday, February 25th. The shares were sold at an average price of $230.00, for a total value of $5,147,630.00. Following the completion of the transaction, the executive vice president directly owned 38,137 shares in the company, valued at approximately $8,771,510. The trade was a 36.98% decrease in their position. The transaction was disclosed in a filing with the Securities & Exchange Commission, which is accessible through this hyperlink. Also, SVP David Ryan Purdue sold 5,230 shares of AbbVie stock in a transaction that occurred on Wednesday, March 4th. The shares were sold at an average price of $233.56, for a total transaction of $1,221,518.80. Following the completion of the transaction, the senior vice president owned 2,654 shares of the company's stock, valued at $619,868.24. This represents a 66.34% decrease in their ownership of the stock. The disclosure for this sale is available in the SEC filing. 0.06% of the stock is currently owned by insiders. Here are the key news stories impacting AbbVie this week: Several equities analysts recently weighed in on ABBV shares. Cantor Fitzgerald dropped their price target on shares of AbbVie from $250.00 to $240.00 and set an ""overweight"" rating on the stock in a research report on Wednesday, April 8th. Berenberg Bank  set a $275.00 target price on shares of AbbVie in a research report on Tuesday, January 20th. Piper Sandler dropped their target price on shares of AbbVie from $299.00 to $294.00 and set an ""overweight"" rating on the stock in a research report on Thursday. The Goldman Sachs Group  reissued a ""neutral"" rating and set a $223.00 target price on shares of AbbVie in a research report on Wednesday, January 28th. Finally, Canaccord Genuity Group started coverage on shares of AbbVie in a research report on Monday. They set a ""buy"" rating and a $262.00 target price on the stock. Three equities research analysts have rated the stock with a Strong Buy rating, fourteen have issued  a Buy rating and nine have assigned  a Hold rating to the company's stock. According to data from MarketBeat.com, the stock presently has an average rating of ""Moderate Buy"" and an average target price of $253.19. NYSE:ABBV opened at $200.97 on Friday. The stock has a market capitalization of $355.34 billion, a PE ratio of 85.15, a price-to-earnings-growth ratio of 0.72 and a beta of 0.38. The firm's 50 day moving average is $217.33 and its 200 day moving average is $222.62. AbbVie Inc. has a 12 month low of $176.11 and a 12 month high of $244.81. AbbVie (NYSE:ABBV - Get Free Report) last posted its quarterly earnings results on Wednesday, February 4th. The company reported $2.71 EPS for the quarter, topping analysts' consensus estimates of $2.65 by $0.06. AbbVie had a net margin of 6.91% and a negative return on equity of 1,579.75%. The company had revenue of $16.62 billion for the quarter, compared to analysts' expectations of $16.39 billion. During the same quarter in the previous year, the firm posted $2.16 EPS. AbbVie's revenue was up 10.0% on a year-over-year basis. AbbVie has set its FY 2026 guidance at 14.370-14.570 EPS and its Q1 2026 guidance at 2.970-3.010 EPS.  Research analysts predict that  AbbVie Inc. will post 14.22 earnings per share for the current year. The firm also recently disclosed a quarterly dividend, which will be paid on Friday, May 15th. Investors of record on Wednesday, April 15th will be paid a $1.73 dividend. This represents a $6.92 dividend on an annualized basis and a yield of 3.4%. The ex-dividend date is Wednesday, April 15th. AbbVie's payout ratio is currently 293.22%. AbbVie is a global, research-driven biopharmaceutical company that was created as a spin-off from Abbott Laboratories in 2013 and is headquartered in North Chicago, Illinois. The company focuses on discovering, developing and commercializing therapies for complex and often chronic medical conditions. Its operations span research and development, manufacturing, regulatory affairs and commercialization, with an emphasis on bringing specialty medicines to market across multiple therapeutic areas. AbbVie's product portfolio and pipeline cover several major therapeutic categories, including immunology, oncology, neuroscience, virology and women's health. This instant news alert was generated by narrative science technology and financial data from MarketBeat in order to provide readers with the fastest reporting and unbiased coverage. Please send any questions or comments about this story to contact@marketbeat.com. Before you consider AbbVie, you'll want to hear this. MarketBeat keeps track of Wall Street's top-rated and best performing research analysts and the stocks they recommend to their clients on a daily basis. MarketBeat has identified the five stocks that top analysts are quietly whispering to their clients to buy now before the broader market catches on... and AbbVie wasn't on the list. While AbbVie currently has a Moderate Buy rating among analysts, top-rated analysts believe these five stocks are better buys. With the proliferation of data centers and electric vehicles, the electric grid will only get more strained. Download this report to learn how energy stocks can play a role in your portfolio as the global demand for energy continues to grow. Sign up for MarketBeat All Access to gain access to MarketBeat's full suite of research tools. 345 N Reid Place, Suite 620, Sioux Falls, SD 57103
                                        
                                        contact@marketbeat.com
                                        
                                        (844) 978-6257 © MarketBeat Media, LLC 2010-2026. All rights reserved. © 2026   Fair market value prices are updated every minute and are provided by Massive. Other market data provided is at least 10-minutes delayed and hosted by Barchart Solutions.  Information is provided 'as-is' and solely for informational purposes, not for trading purposes or advice, and is delayed. To see all exchange delays and terms of use please see Barchart's disclaimer.",https://www.marketbeat.com/instant-alerts/filing-abbvie-inc-abbv-shares-sold-by-torray-investment-partners-llc-2026-04-24/
ABBV,Earnings Preview: AbbVie to Report Financial Results Pre-market on April 29 - Moomoo,2026-04-24 01:21:06,"To create a seamless experience and for website quality and improvement purposes, we use cookie technologies for verification and quality purposes, to personalize the content presented, and to provide advertising that may be of specific interest to you. Learn our Privacy Policy here. $AbbVie (ABBV.US)$ is scheduled to release its financial results pre-market on April 29 ET. Analysts estimate $AbbVie (ABBV.US)$ to post revenue of USD14.72B for 2026Q1, up 10.29% YOY; The accounting standard used for the above data is US-GAAP. US-listed companies have full discretion in choosing their accounting year-end date, without being subject to any mandatory requirements. Consequently, every financial reporting period can act as the annual report cutoff date for a company, rather than following a natural calendar year as the fiscal year. Typically, companies host conference call around the date of the financial report publication to discuss the most recent financial results and operational performance while engaging with investors, analysts, and media. Investors are free to attend either through offline meetings or online conference calls. Use the share button in your browser  to share the page with your friends Investment products and services are offered through Moomoo Financial Inc., Member SIPC./FINRA. For further information about Moomoo Financial Inc., please visit Financial Industry Regulatory Authority (FINRA)’s BrokerCheck. Options trading entails significant risk and is not appropriate for all customers. It is important that investors read Characteristics and Risks of Standardized Options before engaging in any options trading strategies. Options transactions are often complex and may involve the potential of losing the entire investment in a relatively short period of time. Certain complex options strategies carry additional risk, including the potential for losses that may exceed the original investment amount. Supporting documentation for any claims, if applicable, will be furnished upon request. $0 commission trading is available only to U.S. residents trading in the U.S. markets through Moomoo Financial Inc. Other fees may apply. For more info, visit moomoo.com/us/pricing Investing involves risk and the potential to lose principal. Electronic trading also involves risks. The responsiveness of the trading system may vary due to market conditions, system performance, and other factors. Account access and trade execution may be affected by factors such as market volatility. Investment products are not insured by the FDIC, not a deposit, and may decline in value. The services and products offered on the website are subject to applicable laws and regulations, as well as relevant service terms and policies. The services and products are not available to all customers or in all geographic areas or in any jurisdiction where it is unlawful for us to offer such services and products. Company Address：Moomoo Financial Inc. and Moomoo Technologies Inc, 185 Hudson St Ste. 2600, Jersey City, NJ 07302 Copyright © 2026 Moomoo Technologies Inc. All Rights Reserved.",https://www.moomoo.com/news/post/68800704/earnings-preview-abbvie-to-report-financial-results-pre-market-on?level=1&data_ticket=1777166635629794
