ticker,title,date,content,url
CVX,Farther Finance Advisors LLC Boosts Holdings in Chevron Corporation $CVX - MarketBeat,2026-04-15 08:34:53,"Farther Finance Advisors LLC increased its stake in shares of  Chevron Corporation (NYSE:CVX - Free Report) by 16.9% in the fourth quarter, according to its most recent Form 13F filing with the SEC. The fund owned 123,947 shares of the oil and gas company's stock after buying an additional 17,964 shares during the period. Farther Finance Advisors LLC's holdings in Chevron were worth $18,891,000 as of its most recent SEC filing. A number of other large investors have also added to or reduced their stakes in CVX. Decker Retirement Planning Inc. purchased a new stake in  Chevron in the third quarter worth $34,000.  Marquette Asset Management LLC purchased a new stake in  Chevron in the third quarter worth $41,000.  Barnes Dennig Private Wealth Management LLC increased its position in  Chevron by 306.1% in the third quarter. Barnes Dennig Private Wealth Management LLC now owns 268 shares of the oil and gas company's stock worth $42,000 after buying an additional 202 shares during the last quarter.  Daytona Street Capital LLC purchased a new stake in  Chevron in the fourth quarter worth $44,000.  Finally, Evolution Wealth Management Inc. purchased a new stake in  Chevron in the second quarter worth $49,000. Hedge funds and other institutional investors own  72.42% of the company's stock. In related news, CFO Eimear P. Bonner sold 32,100 shares of the business's stock in a transaction that occurred on Friday, January 30th. The shares were sold at an average price of $175.01, for a total transaction of $5,617,821.00. Following the completion of the transaction, the chief financial officer owned 4,366 shares of the company's stock, valued at approximately $764,093.66. The trade was a 88.03% decrease in their ownership of the stock. The sale was disclosed in a legal filing with the Securities & Exchange Commission, which is accessible through the SEC website. Also, insider R. Hewitt Pate sold 58,000 shares of the business's stock in a transaction that occurred on Monday, March 2nd. The shares were sold at an average price of $188.65, for a total transaction of $10,941,700.00. Following the transaction, the insider directly owned 8,558 shares of the company's stock, valued at approximately $1,614,466.70. This represents a 87.14% decrease in their position. Additional details regarding this sale are available in the official SEC disclosure. Insiders have sold 779,407 shares of company stock valued at $145,972,971 in the last quarter. 0.20% of the stock is currently owned by company insiders. Here are the key news stories impacting Chevron this week: Shares of NYSE CVX opened at $186.95 on Wednesday. The stock has a market cap of $372.46 billion, a PE ratio of 28.07, a price-to-earnings-growth ratio of 1.42 and a beta of 0.60. Chevron Corporation has a fifty-two week low of $132.33 and a fifty-two week high of $214.71. The company has a debt-to-equity ratio of 0.21, a quick ratio of 0.86 and a current ratio of 1.15. The stock has a fifty day moving average of $192.03 and a 200-day moving average of $168.52. Chevron (NYSE:CVX - Get Free Report) last announced its quarterly earnings results on Friday, January 30th. The oil and gas company reported $1.52 earnings per share for the quarter, beating the consensus estimate of $1.44 by $0.08. The company had revenue of $45.79 billion during the quarter, compared to analysts' expectations of $48.18 billion. Chevron had a return on equity of 7.89% and a net margin of 6.51%.The firm's quarterly revenue was down 10.2% compared to the same quarter last year. During the same period in the previous year, the business earned $2.06 earnings per share.  Equities research analysts anticipate that  Chevron Corporation will post 10.79 earnings per share for the current year. The company also recently disclosed a quarterly dividend, which was paid on Tuesday, March 10th. Investors of record on Tuesday, February 17th were paid a dividend of $1.78 per share. This is an increase from Chevron's previous quarterly dividend of $1.71. This represents a $7.12 annualized dividend and a yield of 3.8%. The ex-dividend date of this dividend was Tuesday, February 17th. Chevron's dividend payout ratio  is presently 106.91%. CVX has been the subject of a number of recent research reports. Argus  set a $203.00 target price on Chevron in a research report on Tuesday, February 3rd. Zacks Research upgraded shares of Chevron from a ""hold"" rating to a ""strong-buy"" rating in a research note on Friday, April 3rd. Weiss Ratings  reiterated a ""hold (c)"" rating on shares of Chevron in a research note on Wednesday, January 21st. Freedom Capital downgraded shares of Chevron from a ""hold"" rating to a ""strong sell"" rating in a research note on Tuesday, January 6th. Finally, HSBC upgraded shares of Chevron from a ""hold"" rating to a ""buy"" rating and set a $215.00 target price for the company in a research note on Friday, March 20th. One equities research analyst  has rated the stock with a Strong Buy rating, sixteen have assigned  a Buy rating, five have given a Hold rating and three have issued  a Sell rating to the stock. According to data from MarketBeat, the company  has an average rating of ""Moderate Buy"" and an average price target of $195.09. Chevron Corporation NYSE: CVX is an American multinational energy company engaged in virtually all aspects of the oil and gas industry. As an integrated energy firm, Chevron's core activities include upstream oil and natural gas exploration and production, midstream transportation and storage, downstream refining and marketing of fuels and lubricants, and petrochemical manufacturing through joint ventures and subsidiaries. The company markets fuels under brands such as Chevron, Texaco and Caltex and supplies a range of products and services to retail customers, industrial users and commercial fleets worldwide. Chevron traces its corporate lineage to the early petroleum companies that eventually became Standard Oil of California and has evolved through significant mergers and restructurings, including the acquisitions of Gulf Oil and Texaco. This instant news alert was generated by narrative science technology and financial data from MarketBeat in order to provide readers with the fastest reporting and unbiased coverage. Please send any questions or comments about this story to contact@marketbeat.com. Before you consider Chevron, you'll want to hear this. MarketBeat keeps track of Wall Street's top-rated and best performing research analysts and the stocks they recommend to their clients on a daily basis. MarketBeat has identified the five stocks that top analysts are quietly whispering to their clients to buy now before the broader market catches on... and Chevron wasn't on the list. While Chevron currently has a Moderate Buy rating among analysts, top-rated analysts believe these five stocks are better buys. Looking to profit from the electric vehicle mega-trend? Click the link to see our list of which EV stocks show the most long-term potential. Sign up for MarketBeat All Access to gain access to MarketBeat's full suite of research tools. 345 N Reid Place, Suite 620, Sioux Falls, SD 57103
                                        
                                        contact@marketbeat.com
                                        
                                        (844) 978-6257 © MarketBeat Media, LLC 2010-2026. All rights reserved. © 2026   Fair market value prices are updated every minute and are provided by Massive. Other market data provided is at least 10-minutes delayed and hosted by Barchart Solutions.  Information is provided 'as-is' and solely for informational purposes, not for trading purposes or advice, and is delayed. To see all exchange delays and terms of use please see Barchart's disclaimer. Enter your email below to receive daily updates and analyst ratings for Chevron and related companies from Earnings360.com. We and our partners share information on your use of this website to help improve your experience. For more information, or to opt out click the Do Not Sell My Information button below.",https://www.marketbeat.com/instant-alerts/filing-farther-finance-advisors-llc-boosts-holdings-in-chevron-corporation-cvx-2026-04-15/
CVX,Bingham Private Wealth LLC Makes New Investment in Chevron Corporation $CVX - MarketBeat,2026-04-15 07:34:35,"Bingham Private Wealth LLC acquired a new position in shares of  Chevron Corporation (NYSE:CVX - Free Report) during the fourth quarter, according to the company in its most recent 13F filing with the Securities and Exchange Commission. The firm acquired 6,926 shares of the oil and gas company's stock, valued at approximately $1,056,000. A number of other hedge funds have also recently added to or reduced their stakes in CVX. Vanguard Group Inc. increased its stake in  Chevron by 17.9% during the 3rd quarter. Vanguard Group Inc. now owns 183,790,028 shares of the oil and gas company's stock worth $28,540,753,000 after acquiring an additional 27,961,463 shares during the period.  State Street Corp boosted its holdings in shares of  Chevron by 9.1% in the 3rd quarter. State Street Corp now owns 152,605,988 shares of the oil and gas company's stock valued at $23,698,184,000 after purchasing an additional 12,789,399 shares in the last quarter.  Primecap Management Co. CA acquired a new stake in shares of  Chevron in the 3rd quarter valued at $988,083,000.  Bank of New York Mellon Corp boosted its holdings in shares of  Chevron by 27.9% in the 3rd quarter. Bank of New York Mellon Corp now owns 19,627,146 shares of the oil and gas company's stock valued at $3,047,900,000 after purchasing an additional 4,279,918 shares in the last quarter.  Finally, Amundi boosted its holdings in shares of  Chevron by 41.8% in the 3rd quarter. Amundi now owns 11,760,376 shares of the oil and gas company's stock valued at $1,811,333,000 after purchasing an additional 3,464,058 shares in the last quarter. Institutional investors own  72.42% of the company's stock. A number of equities research analysts have weighed in on CVX shares. Tudor Pickering raised Chevron from a ""hold"" rating to a ""buy"" rating and set a $225.00 target price on the stock in a report on Thursday, April 9th. Jefferies Financial Group raised their target price on Chevron from $174.00 to $189.00 and gave the company a ""buy"" rating in a report on Wednesday, January 14th. Citigroup raised their target price on Chevron from $210.00 to $235.00 and gave the company a ""buy"" rating in a report on Thursday, April 2nd. Zacks Research raised Chevron from a ""hold"" rating to a ""strong-buy"" rating in a report on Friday, April 3rd. Finally, Morgan Stanley raised their target price on Chevron from $174.00 to $212.00 and gave the company an ""overweight"" rating in a report on Friday, March 27th. One research analyst  has rated the stock with a Strong Buy rating, sixteen have given a Buy rating, five have assigned  a Hold rating and three have given a Sell rating to the company's stock. According to MarketBeat.com, the company presently has an average rating of ""Moderate Buy"" and a consensus target price of $195.09. NYSE CVX opened at $186.95 on Wednesday. The company has a market cap of $372.46 billion, a price-to-earnings ratio of 28.07, a price-to-earnings-growth ratio of 1.42 and a beta of 0.60. The company has a quick ratio of 0.86, a current ratio of 1.15 and a debt-to-equity ratio of 0.21. Chevron Corporation has a twelve month low of $132.33 and a twelve month high of $214.71. The business's fifty day moving average is $192.03 and its 200 day moving average is $168.52. Chevron (NYSE:CVX - Get Free Report) last announced its earnings results on Friday, January 30th. The oil and gas company reported $1.52 earnings per share (EPS) for the quarter, topping the consensus estimate of $1.44 by $0.08. The business had revenue of $45.79 billion during the quarter, compared to analyst estimates of $48.18 billion. Chevron had a return on equity of 7.89% and a net margin of 6.51%.Chevron's revenue for the quarter was down 10.2% compared to the same quarter last year. During the same period last year, the company earned $2.06 EPS.  As a group, sell-side analysts expect that  Chevron Corporation will post 10.79 EPS for the current fiscal year. The business also recently announced a quarterly dividend, which was paid on Tuesday, March 10th. Investors of record on Tuesday, February 17th were given a dividend of $1.78 per share. The ex-dividend date of this dividend was Tuesday, February 17th. This represents a $7.12 annualized dividend and a yield of 3.8%. This is an increase from Chevron's previous quarterly dividend of $1.71. Chevron's dividend payout ratio  is 106.91%. In related news, Vice Chairman Mark A. Nelson sold 139,600 shares of the firm's stock in a transaction on Monday, March 2nd. The stock was sold at an average price of $187.92, for a total transaction of $26,233,632.00. Following the completion of the transaction, the insider directly owned 11,337 shares of the company's stock, valued at $2,130,449.04. This trade represents a 92.49% decrease in their position. The sale was disclosed in a document filed with the Securities & Exchange Commission, which is available at this hyperlink. Also, CEO Michael K. Wirth sold 272,624 shares of the firm's stock in a transaction on Monday, March 2nd. The stock was sold at an average price of $189.35, for a total value of $51,621,354.40. Following the transaction, the chief executive officer directly owned 31,266 shares of the company's stock, valued at approximately $5,920,217.10. This represents a 89.71% decrease in their ownership of the stock. The disclosure for this sale is available in the SEC filing. Insiders sold 779,407 shares of company stock worth $145,972,971 over the last 90 days. Company insiders own  0.20% of the company's stock. Here are the key news stories impacting Chevron this week: Chevron Corporation NYSE: CVX is an American multinational energy company engaged in virtually all aspects of the oil and gas industry. As an integrated energy firm, Chevron's core activities include upstream oil and natural gas exploration and production, midstream transportation and storage, downstream refining and marketing of fuels and lubricants, and petrochemical manufacturing through joint ventures and subsidiaries. The company markets fuels under brands such as Chevron, Texaco and Caltex and supplies a range of products and services to retail customers, industrial users and commercial fleets worldwide. Chevron traces its corporate lineage to the early petroleum companies that eventually became Standard Oil of California and has evolved through significant mergers and restructurings, including the acquisitions of Gulf Oil and Texaco. This instant news alert was generated by narrative science technology and financial data from MarketBeat in order to provide readers with the fastest reporting and unbiased coverage. Please send any questions or comments about this story to contact@marketbeat.com. Before you consider Chevron, you'll want to hear this. MarketBeat keeps track of Wall Street's top-rated and best performing research analysts and the stocks they recommend to their clients on a daily basis. MarketBeat has identified the five stocks that top analysts are quietly whispering to their clients to buy now before the broader market catches on... and Chevron wasn't on the list. While Chevron currently has a Moderate Buy rating among analysts, top-rated analysts believe these five stocks are better buys. Discover the 10 Best High-Yield Dividend Stocks for 2026 and secure reliable income in uncertain markets. Download the report now to identify top dividend payers and avoid common yield traps. Sign up for MarketBeat All Access to gain access to MarketBeat's full suite of research tools. 345 N Reid Place, Suite 620, Sioux Falls, SD 57103
                                        
                                        contact@marketbeat.com
                                        
                                        (844) 978-6257 © MarketBeat Media, LLC 2010-2026. All rights reserved. © 2026   Fair market value prices are updated every minute and are provided by Massive. Other market data provided is at least 10-minutes delayed and hosted by Barchart Solutions.  Information is provided 'as-is' and solely for informational purposes, not for trading purposes or advice, and is delayed. To see all exchange delays and terms of use please see Barchart's disclaimer. We and our partners share information on your use of this website to help improve your experience. For more information, or to opt out click the Do Not Sell My Information button below.",https://www.marketbeat.com/instant-alerts/filing-bingham-private-wealth-llc-makes-new-investment-in-chevron-corporation-cvx-2026-04-15/
