ticker,title,date,content,url
CVX,Chevron (NYSE:CVX) Stock Price Down 1.2% - Here's What Happened - MarketBeat,2026-04-15 21:33:50,"Chevron Corporation (NYSE:CVX - Get Free Report) shares dropped 1.2% during mid-day trading on Wednesday . The stock traded as low as $184.04 and last traded at $184.86. Approximately 8,633,484 shares changed hands during trading, a decline of 34% from the average daily volume of 13,060,772 shares. The stock had previously closed at $187.02. Here are the key news stories impacting Chevron this week: CVX has been the topic of several analyst reports. Barclays increased their target price on Chevron from $172.00 to $180.00 and gave the stock an ""equal weight"" rating in a report on Monday, March 16th. HSBC raised Chevron from a ""hold"" rating to a ""buy"" rating and set a $215.00 target price on the stock in a report on Friday, March 20th. Jefferies Financial Group increased their target price on Chevron from $174.00 to $189.00 and gave the stock a ""buy"" rating in a report on Wednesday, January 14th. Weiss Ratings  reissued a ""hold (c)"" rating on shares of Chevron in a report on Wednesday, January 21st. Finally, Melius Research raised Chevron from a ""hold"" rating to a ""buy"" rating and set a $205.00 target price on the stock in a report on Tuesday, February 17th. One equities research analyst  has rated the stock with a Strong Buy rating, sixteen have assigned  a Buy rating, five have issued  a Hold rating and three have issued  a Sell rating to the company's stock. According to MarketBeat.com, Chevron  has an average rating of ""Moderate Buy"" and a consensus price target of $195.09. The company has a current ratio of 1.15, a quick ratio of 0.86 and a debt-to-equity ratio of 0.21. The firm has a market capitalization of $368.29 billion, a P/E ratio of 27.76, a P/E/G ratio of 1.42 and a beta of 0.60. The firm has a 50-day moving average of $192.03 and a two-hundred day moving average of $168.52. Chevron (NYSE:CVX - Get Free Report) last announced its quarterly earnings data on Friday, January 30th. The oil and gas company reported $1.52 earnings per share for the quarter, topping the consensus estimate of $1.44 by $0.08. Chevron had a return on equity of 7.89% and a net margin of 6.51%.The business had revenue of $45.79 billion during the quarter, compared to the consensus estimate of $48.18 billion. During the same period in the prior year, the company earned $2.06 EPS. Chevron's revenue for the quarter was down 10.2% on a year-over-year basis.  On average, analysts anticipate that  Chevron Corporation will post 10.79 EPS for the current year. The firm also recently disclosed a quarterly dividend, which was paid on Tuesday, March 10th. Investors of record on Tuesday, February 17th were given a dividend of $1.78 per share. The ex-dividend date was Tuesday, February 17th. This represents a $7.12 annualized dividend and a dividend yield of 3.9%. This is an increase from Chevron's previous quarterly dividend of $1.71. Chevron's dividend payout ratio  is currently 106.91%. In other Chevron news, insider Andrew Benjamin Walz sold 11,600 shares of the company's stock in a transaction dated Monday, March 2nd. The stock was sold at an average price of $188.58, for a total value of $2,187,528.00. The sale was disclosed in a legal filing with the Securities & Exchange Commission, which is accessible through this hyperlink. Also, Vice Chairman Mark A. Nelson sold 139,600 shares of the company's stock in a transaction dated Monday, March 2nd. The stock was sold at an average price of $187.92, for a total value of $26,233,632.00. Following the completion of the transaction, the insider directly owned 11,337 shares of the company's stock, valued at approximately $2,130,449.04. The trade was a 92.49% decrease in their position. The disclosure for this sale is available in the SEC filing. Insiders sold 779,407 shares of company stock worth $145,972,971 over the last quarter. 0.20% of the stock is currently owned by company insiders. A number of institutional investors and hedge funds have recently bought and sold shares of the company. WESPAC Advisors SoCal LLC acquired a new position in  Chevron in the 1st quarter valued at approximately $239,000.  McAlvany Wealth Management LLC acquired a new position in  Chevron in the 4th quarter valued at approximately $1,729,000.  J. Derek Lewis & Associates Inc. acquired a new position in  Chevron in the 4th quarter valued at approximately $694,000.  Cornerstone Planning LLC acquired a new position in  Chevron in the 4th quarter valued at approximately $2,986,000.  Finally, Rockefeller Capital Management L.P. increased its position in  Chevron by 13.0% in the 4th quarter. Rockefeller Capital Management L.P. now owns 1,456,172 shares of the oil and gas company's stock valued at $221,936,000 after acquiring an additional 167,792 shares during the period. Institutional investors and hedge funds own  72.42% of the company's stock. Chevron Corporation NYSE: CVX is an American multinational energy company engaged in virtually all aspects of the oil and gas industry. As an integrated energy firm, Chevron's core activities include upstream oil and natural gas exploration and production, midstream transportation and storage, downstream refining and marketing of fuels and lubricants, and petrochemical manufacturing through joint ventures and subsidiaries. The company markets fuels under brands such as Chevron, Texaco and Caltex and supplies a range of products and services to retail customers, industrial users and commercial fleets worldwide. Chevron traces its corporate lineage to the early petroleum companies that eventually became Standard Oil of California and has evolved through significant mergers and restructurings, including the acquisitions of Gulf Oil and Texaco. This instant news alert was generated by narrative science technology and financial data from MarketBeat in order to provide readers with the fastest reporting and unbiased coverage. Please send any questions or comments about this story to contact@marketbeat.com. Before you consider Chevron, you'll want to hear this. MarketBeat keeps track of Wall Street's top-rated and best performing research analysts and the stocks they recommend to their clients on a daily basis. MarketBeat has identified the five stocks that top analysts are quietly whispering to their clients to buy now before the broader market catches on... and Chevron wasn't on the list. While Chevron currently has a Moderate Buy rating among analysts, top-rated analysts believe these five stocks are better buys. Market downturns give many investors pause, and for good reason. Wondering how to offset this risk? Click the link to learn more about using beta to protect your portfolio. Sign up for MarketBeat All Access to gain access to MarketBeat's full suite of research tools. 345 N Reid Place, Suite 620, Sioux Falls, SD 57103
                                        
                                        contact@marketbeat.com
                                        
                                        (844) 978-6257 © MarketBeat Media, LLC 2010-2026. All rights reserved. © 2026   Fair market value prices are updated every minute and are provided by Massive. Other market data provided is at least 10-minutes delayed and hosted by Barchart Solutions.  Information is provided 'as-is' and solely for informational purposes, not for trading purposes or advice, and is delayed. To see all exchange delays and terms of use please see Barchart's disclaimer. We and our partners share information on your use of this website to help improve your experience. For more information, or to opt out click the Do Not Sell My Information button below.",https://www.marketbeat.com/instant-alerts/chevron-nysecvx-stock-price-down-12-heres-what-happened-2026-04-15/
CVX,"Sold $CVX at $185 (-3%). From @Grok (API): ""We're exiting ou - KuCoin",2026-04-15 21:13:10,"Sold $CVX at $185 (-3%).
From @Grok (API): ""We're exiting our long position as CVX shows persistent near-term weakness, lower highs, and bearish daily technical signals amid this post-earnings pullback. "" https://t.co/bM93P3klxl https://t.co/zAe8uJ2nMQ When you visit any website, it may store or retrieve information on your browser, mostly in the form of cookies. This information might be about you, your preferences, or your device, and is mostly used to make the site work as you expect. The information does not usually identify you directly, but it can give you a more personalized web experience. Because we respect your right to privacy, you can choose not to allow some types of cookies. Click on the different category headings to learn more and change our default settings. Blocking some types of cookies may impact your experience of the site and the services we are able to offer.
            Cookie Policy These cookies are necessary for the website to function and cannot be switched off in our systems. They are usually only set in response to actions made by you which amount to a request for services, such as setting your privacy preferences, logging in or filling in forms. You can set your browser to block or alert you about these cookies, but some parts of the site will not then work. These cookies do not store any personally identifiable information. These cookies enable the website to provide enhanced functionality and personalisation. They may be set by us or by third party providers whose services we have added to our pages. If you do not allow these cookies then some or all of these services may not function properly. These cookies may be set through our site by our advertising partners. They may be used by those companies to build a profile of your interests and show you relevant adverts on other sites. They do not store directly personal information, but are based on uniquely identifying your browser and internet device. If you do not allow these cookies, you will experience less targeted advertising. These cookies allow us to count visits and traffic sources so we can measure and improve the performance of our site. They help us to know which pages are the most and least popular and see how visitors move around the site. All information these cookies collect is aggregated and therefore anonymous. If you do not allow these cookies we will not know when you have visited our site, and will not be able to monitor its performance.",https://www.kucoin.com/news/insight/CVX/69dff765ece611000748cb27
CVX,Is Chevron (CVX) Trading Long-Term Risk for Cash Flow With Its Venezuela Heavy Oil Bet? - Yahoo Finance,2026-04-15 21:06:27,"Tip: Try a valid symbol or a specific company name for relevant results Tax refunds shoot up as Americans take advantage of new deductions S&P 500 closes above 7,000 for the first time, Nasdaq hits record as stocks erase Iran war losses The former sneaker company's stock rose over 600% after announcing its rebrand as an AI company S&P 500, Nasdaq rise as Dow falls amid hopes for US-Iran talks The S&P 500 and Nasdaq rallied toward record highs on hopes of an Iran deal while oil tumbled Bitcoin bounced above $74,000, but Wall Street warns it could go lower before it goes higher US stocks rise amid Iran deal hopes, earnings rush, cooler-than-expected PPI JPMorgan profits rise 13%, Dimon warns of 'increasingly complex set of risks' US stocks sink after Trump orders Hormuz blockade against Iran Goldman Sachs Q1 profits climb thanks to jumps in M&A dealmaking and record equity trading The stock market's latest rally is reviving a familiar trade — but not all of the Magnificent Seven are coming along for the ride. Gen Z is driving IRA contributions to record highs. Here's how to get started. Wall Street strategists say it's time to 'jump in' with tech stocks Trump says US will blockade Strait of Hormuz after Iran talks fail (Bloomberg) Bank earnings, US-Iran talks, and signs of stability for stocks: What to watch this week Shaq, in NYC discussing his new investment with retailer tm:rw, said the NBA dunk contest isn't what it used to be. Used car prices hit highest levels since 2023 and could push higher What to know about X Money, Elon Musk's fintech app that claims to pay 6% on savings The housing market is shifting toward buyers. Just not in New Jersey. Wall Street's biggest banks are riding into the first quarter earnings season on far less certain ground than where they began 2026. Watch: OpenAI CEO Sam Altman's house was reportedly the target of a Molotov cocktail attack on Friday. Yahoo Finance's Dan Howley explains. Stocks post second straight winning week amid fragile US-Iran ceasefire US tariff revenue dropped by over $4 billion in March. It's down almost 30% since October. US stocks open higher after March CPI inflation data shows energy surge Inflation soars by most since 2022 as gas prices bite Americans close to retirement are saving for later, but they're worried about getting by right now Government data out Friday will show how much consumer prices rose in March — and forecasts point to soaring inflation. Palantir plunges after 'Big Short' investor Michael Burry says Anthropic is eating its lunch Stocks rebounded to extend their winning streak, while oil rose ahead of US-Iran talks Stocks turned positive after Israel agreed to talks with Lebanon, reviving optimism for the US-Iran ceasefire US stocks pull back, oil surges as US-Iran ceasefire looks increasingly shaky Sticky reading on inflation pre-war will keep Fed on hold The New York Times may have found bitcoin founder Satoshi Nakamoto. Here's what you need to know. Fed officials saw risks of the Iran war increasing inflation and delaying rate cuts in a March meeting The Strait of Hormuz has immediately become the first major flash point of Trump's 'fragile' ceasefire US stocks surged while oil prices plunged as relief from a fragile US-Iran ceasefire rippled through markets US stocks soar, with Dow surging nearly 1,400 points as Iran truce restarts Hormuz traffic Delta beats on Q1 earnings, maintains guidance despite fuel spike, TSA headwinds Investors are turning to social media and following 'finfluencers' to inform their investment decisions High new car prices, rising gas costs, and rising interest rates brought buyers to used car lots Dow, S&P 500, Nasdaq futures soar after Trump calls for two-week ceasefire Markets weigh the chances of economic fallout from an attack on Iran against previous threats from Trump The S&P 500 and Nasdaq ended the day slightly higher on hopes of an Iran deadline extension Anthropic launches cybersecurity partnership with Amazon, Apple, Google, Microsoft, Nvidia, and others Tech is doing everything right and getting left behind. Here's what could turn that around. US stocks drift lower as Trump's deadline for Iran ultimatum looms US gas prices risk topping $5 per gallon if the Strait of Hormuz stays closed, JPMorgan says Netflix stands to get richer after losing Warner Bros. bidding war. Here's why. Goldman Sachs delivered a warning to laid-off tech workers that it will take more time to find a new job than expected The above button links to Coinbase. Yahoo Finance is not a broker-dealer or investment adviser and does not offer securities or cryptocurrencies for sale or facilitate trading. Coinbase pays us for certain activity generated through this link. Prices displayed are informational. In early April 2026, Chevron confirmed a new oil discovery at the Bandit prospect in the Gulf of America and expanded its heavy crude footprint in Venezuela through asset-swap agreements with PDVSA that increased its stake in the Petroindependencia joint venture and secured additional Orinoco Belt acreage. Together with rising geopolitical tensions and supply disruptions, these moves highlight how Chevron is leaning further into complex, long-lived upstream projects at the same time as investors press the company on human rights, Indigenous rights, and board governance via multiple shareholder proposals. We’ll now examine how Chevron’s deepening commitment to Venezuelan heavy oil reshapes its investment narrative around future cash flows and risk. AI is about to change healthcare. These 34 stocks are working on everything from early diagnostics to drug discovery. The best part - they are all under $10b in market cap - there's still time to get in early. To own Chevron today, you need to believe its large, long-life oil and gas portfolio will keep converting volatile commodity prices into durable cash flows, even as the energy transition and governance scrutiny intensify. The Bandit discovery and expanded Venezuelan heavy oil exposure are incremental positives for future production, but the more immediate swing factor remains how current supply disruptions, sanctions shifts, and any operational downtime feed through to near term earnings, while ESG and geopolitical risks stay elevated but not yet thesis breaking. The expanded heavy crude footprint in Venezuela, via the asset swap that lifts Chevron’s Petroindependencia stake to 49% and adds Orinoco Belt acreage, ties directly into that near term cash flow story by concentrating the portfolio in higher impact upstream barrels. At the same time, the cluster of April shareholder proposals on human rights, Indigenous rights, and board structure underlines that any cash flow benefits from Venezuelan growth may come with heightened governance and ESG risk that investors will need to track closely. Yet behind the production upside, investors should be aware of how Chevron’s growing exposure to complex, long lived projects could... Chevron’s narrative projects $199.9 billion revenue and $19.1 billion earnings by 2029. This requires 2.7% yearly revenue growth and a $6.8 billion earnings increase from $12.3 billion today. Uncover how Chevron's forecasts yield a $203.00 fair value, a 9% upside to its current price. Seventeen members of the Simply Wall St Community currently see Chevron’s fair value anywhere between US$133.51 and US$375.99, reflecting very different expectations for its future. When you set those views against Chevron’s increased focus on capital intensive, long life projects, it becomes even more important to compare multiple risk and return assumptions before deciding how this stock fits into your portfolio. Explore 17 other fair value estimates on Chevron - why the stock might be worth over 2x more than the current price! Don't just follow the ticker - dig into the data and build a conviction that's truly your own. A great starting point for your Chevron research is our analysis highlighting 2 key rewards and 2 important warning signs that could impact your investment decision. Our free Chevron research report provides a comprehensive fundamental analysis summarized in a single visual - the Snowflake - making it easy to evaluate Chevron's overall financial health at a glance. Our top stock finds are flying under the radar-for now. Get in early: We've uncovered the 12 dividend fortresses yielding 5%+ that don't just survive market storms, but thrive in them. Find 57 companies with promising cash flow potential yet trading below their fair value. Capitalize on the AI infrastructure supercycle with our selection of the 37 best 'picks and shovels' of the AI gold rush converting record-breaking demand into massive cash flow. This article by Simply Wall St is general in nature. We provide commentary based on historical data and analyst forecasts only using an unbiased methodology and our articles are not intended to be financial advice. It does not constitute a recommendation to buy or sell any stock, and does not take account of your objectives, or your financial situation. We aim to bring you long-term focused analysis driven by fundamental data. Note that our analysis may not factor in the latest price-sensitive company announcements or qualitative material. Simply Wall St has no position in any stocks mentioned. Have feedback on this article? Concerned about the content? Get in touch with us directly. Alternatively, email editorial-team@simplywallst.com Tip: Try a valid symbol or a specific company name for relevant results",https://finance.yahoo.com/sectors/energy/articles/chevron-cvx-trading-long-term-210627322.html
