ticker,title,date,content,url
CVX,"The Zacks Analyst Blog Highlights Chevron, HSBC and Advantest - The Globe and Mail",2026-04-14 11:18:00,"Chicago, IL – April 14, 2026 – Zacks.com announces the list of stocks featured in the Analyst Blog. Every day the Zacks Equity Research analysts discuss the latest news and events impacting stocks and the financial markets. Stocks recently featured in the blog include: Chevron CVX, HSBC HSBC and Advantest ATEYY. Q1 Reports Spill Details & Outlooks: Global Week Ahead In terms of events & data, this trading week’s newsflow will center on the Iran conflict. Finally, world finance leaders have plenty to talk about. They gather in Washington DC, for their Annual IMF and World Bank spring meetings. Next are Reuters’ five world market themes, re-ordered for equity traders— (1) U.S. Money Center Banks Kick Off Q1-26 S&P500 Earnings Season We'll also start to get a sense of what the war has meant for companies as results from major U.S. banks and some other big global names are due. Strong interest income and investment banking fees are expected to ‌help them post higher quarterly earnings. S&P500 earnings are estimated to have climbed more than +14%. But fallout from the war will cloud the reports, including ripple effects from energy-driven inflation. (2) Over the Weekend, Negotiations Between Iran and the U.S. Began Almost every ‌financial market in the world has been trading in response to the oil price since the Iran war began, and it is hard to see that changing any time soon. That means investors will be spending their weekend checking for any news from the peace talks between the U.S. and Iran in Pakistan's Islamabad. The announcement of a ceasefire late Tuesday sent benchmark oil prices back below $100 a barrel, and sparked a surge in global stocks. The two sides continue to disagree on key aspects, however, including whether it applies to Lebanon, which Israel continues to strike. A new proposed blockade of the Strait of Hormuz, which has caused the worst-ever disruption to global energy supplies, comes from the U.S. this morning, as naval ships make their way to the region. And while benchmark oil futures remain off their highs — even if far above prewar levels — prices in the physical market are at record levels and pain in real economies is starting to bite. (3) On Sunday, Hungary Went to the Polls to Elect a President After 16 years of Viktor Orban's rule in Hungary, investors are primed for the once-unthinkable prospect that the firebrand prime minister and long-term thorn in the European Union's side has been voted out of power over the weekend in what has been billed as Europe's most market-sensitive election of the year. Three years of economic stagnation, the biggest inflation shock since the 1990s and revelations about his ties to Russia had opinion polls predicting the 62-year-old would be beaten by his former ally-turned-foe Peter Magyar, who is promising a reset with Brussels that would unlock billions in EU funding. Judging by some, the sharp share price drops of companies linked to Orban and the relative outperformance of Hungary's currency and bonds in recent months, investors are betting on change. But markets are bracing for volatility. ""Preliminary election results, based on more than 98% of counted votes, put the opposition Tisza party on course for an extraordinary 138 seat victory, with Viktor Orbán's ruling Fidesz party on 55 and the far-right Our Homeland on six."" ""Peter Magyar, a 45-year-old former party insider, brought Viktor Orban's 16 years in power to an end.” There's an election happening over in Peru too, although with a record 35 candidates in the mix, it will almost certainly need a deciding run-off vote in June. (4) How Is the Mainland China Economy? Thursday Shows Q1 Real GDP Growth Key Chinese data on Thursday will offer a first look at how the world's second biggest economy is adapting to a slower growth trajectory and the war. Beijing is expected to say first quarter Gross Domestic Product (GDP) grew at 5% year-on-year, according to the median forecast in a LSEG poll ???of 11 analysts. China's GDP growth slowed to a three-year low of 4.5% in the final quarter of 2025, and in March, the government set a slightly lower target for 2026 as they seek to rebalance the economy and stay competitive with the United States. (5) Across This Week, the Annual IMF and World Bank Spring Meetings Occur The impact from the Iran war and rising geopolitical risks is going to be at the top of the agenda for finance chiefs from around the globe who gather in Washington for spring meetings of the International Monetary Fund and the World Bank Group. The week will be sprinkled with reports and forecasts — the Fund's World Economic Outlook and Global Financial Stability reports are due on Tuesday and regional updates thereafter — with no one expecting good news. Both G7 and G20 finance ministers and central bank governors will also meet. The war is expected to crimp growth, raise food insecurity and borrowing costs, and ramp up price pressures thanks to higher energy costs. Faced with yet another shock after COVID-19, Russia's war with Ukraine and trade turmoil, a number of developing nations are expected to ask the Fund for more help. Three large-cap Zacks #1 (STRONG BUY) picks, that should keep trader’s interests. (1) Chevron: This is a $190 a share oil stock, with a market cap of $379.3B. It is found in Zacks Oil & Gas Integrated industry. The stock holds a Zacks Value score of C, a Zacks Growth score of D, and a Zacks Momentum score of A. Chevron is one of the largest publicly traded oil and gas companies in the world with operations that span almost every corner of the globe. The only energy component of the Dow Jones Industrial Average, Chevron is fully integrated, meaning it participates in every aspect related to energy from oil production, to refining and marketing. Chevron remains well positioned to navigate the volatility in oil and gas prices. Being an integrated firm engaged in all aspects of the oil and gas business. Chevron divides its operations into two main segments: Upstream and Downstream. Chevron's other activities include transportation and chemicals. Chevron's current oil and gas development project pipeline is among the best in the industry. (2) HSBC: This is a $90 a share bank stock, with a market cap of $310B. It is found in the Zacks Foreign Bank industry. The stock holds a Zacks Value score of C, a Zacks Growth score of D, and a Zacks Momentum score of C. HSBC Holdings plc is a major global banking and financial services firm. Operating through an international network of various offices in Europe, Asia, the Middle East and North Africa, North and Latin America. HSBC manages its operations through the following groups — Wealth and Personal Banking (WPB): In February 2020, this group was formed after the combination of the former retail banking and wealth management, and global private banking businesses. The HSBC private bank offers its clients both traditional and innovative ways to manage and preserve wealth, while optimizing returns. Commercial Banking: Corporate and Business Banking are two segments under this group. While the Corporate segment serves both Corporate and mid-market companies with more sophisticated financial needs, Business Banking caters to the small and medium-sized enterprises sector. Global Banking and Markets (GBM): GBM is managed under two principal business lines: Global Markets and Global Banking. (3) Advantest: This is a $159 a share tech stock, with a market cap of $116.7B. It is found in the Zacks Electronics-Measuring Instrument industry. The stock holds a Zacks Value score of F, a Zacks Growth score of A, and a Zacks Momentum score of B. Advantest Corp. is one of the world's leading automatic test equipment suppliers to the semiconductor industry, and is also a producer of electronic and optoelectronic instruments and systems. A global company, Advantest has long offered total Automated Test Equipment (ATE) solutions, and serves the industry in every component of semiconductor test: tester, handler, mechanical and electrical interfaces, and software. Its logic, memory, mixed-signal and RF testers, and device handlers, are integrated into the most advanced semiconductor fabrication lines in the world. Since 2000, our top stock-picking strategies have blown away the S&P's +7.7% average gain per year. Amazingly, they soared with average gains of +48.4%, +50.2% and +56.7% per year. Today you can access their live picks without cost or obligation. Past performance is no guarantee of future results. Inherent in any investment is the potential for loss. This material is being provided for informational purposes only and nothing herein constitutes investment, legal, accounting or tax advice, or a recommendation to buy, sell or hold a security. No recommendation or advice is being given as to whether any investment is suitable for a particular investor. It should not be assumed that any investments in securities, companies, sectors or markets identified and described were or will be profitable. All information is current as of the date of herein and is subject to change without notice. Any views or opinions expressed may not reflect those of the firm as a whole. Zacks Investment Research does not engage in investment banking, market making or asset management activities of any securities. These returns are from hypothetical portfolios consisting of stocks with Zacks Rank = 1 that were rebalanced monthly with zero transaction costs. These are not the returns of actual portfolios of stocks. The S&P 500 is an unmanaged index. Visit https://www.zacks.com/performance for information about the performance numbers displayed in this press release. The AI revolution has already minted millionaires. But the stocks everyone knows about aren't likely to keep delivering the biggest profits. Little-known AI firms tackling the world's biggest problems may be more lucrative in the coming months and years. This article originally published on Zacks Investment Research (zacks.com). All market data (will open in new tab) is provided by Barchart Solutions. Copyright © 2026. Information is provided 'as is' and solely for informational purposes, not for trading purposes or advice. For exchange delays and terms of use, please read disclaimer (will open in new tab).",https://www.theglobeandmail.com/investing/markets/stocks/CVX/pressreleases/1292506/the-zacks-analyst-blog-highlights-chevron-hsbc-and-advantest/
CVX,"Transcend Capital Advisors LLC Sells 5,407 Shares of Chevron Corporation $CVX - MarketBeat",2026-04-14 11:07:46,"Transcend Capital Advisors LLC lessened its holdings in shares of  Chevron Corporation (NYSE:CVX - Free Report) by 20.2% in the fourth quarter, according to the company in its most recent 13F filing with the Securities and Exchange Commission. The fund owned 21,347 shares of the oil and gas company's stock after selling 5,407 shares during the quarter. Transcend Capital Advisors LLC's holdings in Chevron were worth $3,253,000 at the end of the most recent quarter. A number of other large investors have also recently modified their holdings of the business. High Net Worth Advisory Group LLC lifted its position in  Chevron by 13.8% in the 4th quarter. High Net Worth Advisory Group LLC now owns 10,753 shares of the oil and gas company's stock worth $1,639,000 after buying an additional 1,303 shares during the last quarter.  Whitener Capital Management Inc. lifted its position in  Chevron by 0.5% in the 4th quarter. Whitener Capital Management Inc. now owns 23,351 shares of the oil and gas company's stock worth $3,559,000 after buying an additional 124 shares during the last quarter.  Guyasuta Investment Advisors Inc. lifted its position in  Chevron by 0.8% in the 4th quarter. Guyasuta Investment Advisors Inc. now owns 264,553 shares of the oil and gas company's stock worth $40,320,000 after buying an additional 2,101 shares during the last quarter.  Gilliland Jeter Wealth Management LLC lifted its position in  Chevron by 1.1% in the 4th quarter. Gilliland Jeter Wealth Management LLC now owns 25,501 shares of the oil and gas company's stock worth $3,887,000 after buying an additional 273 shares during the last quarter.  Finally, Aua Capital Management LLC lifted its position in  Chevron by 66.5% in the 4th quarter. Aua Capital Management LLC now owns 3,915 shares of the oil and gas company's stock worth $597,000 after buying an additional 1,564 shares during the last quarter. Institutional investors own  72.42% of the company's stock. Shares of Chevron stock opened at $191.54 on Tuesday. The company has a debt-to-equity ratio of 0.21, a current ratio of 1.15 and a quick ratio of 0.86. The business's 50 day simple moving average is $191.85 and its two-hundred day simple moving average is $168.33. The stock has a market capitalization of $381.61 billion, a P/E ratio of 28.76, a price-to-earnings-growth ratio of 1.40 and a beta of 0.60. Chevron Corporation has a one year low of $132.33 and a one year high of $214.71. Chevron (NYSE:CVX - Get Free Report) last announced its quarterly earnings results on Friday, January 30th. The oil and gas company reported $1.52 EPS for the quarter, topping analysts' consensus estimates of $1.44 by $0.08. The business had revenue of $45.79 billion for the quarter, compared to analysts' expectations of $48.18 billion. Chevron had a return on equity of 7.89% and a net margin of 6.51%.The business's quarterly revenue was down 10.2% on a year-over-year basis. During the same period in the previous year, the firm earned $2.06 EPS.  Analysts forecast that  Chevron Corporation will post 10.79 EPS for the current year. The business also recently declared a quarterly dividend, which was paid on Tuesday, March 10th. Shareholders of record on Tuesday, February 17th were paid a $1.78 dividend. This is an increase from Chevron's previous quarterly dividend of $1.71. The ex-dividend date of this dividend was Tuesday, February 17th. This represents a $7.12 dividend on an annualized basis and a yield of 3.7%. Chevron's payout ratio is presently 106.91%. In other Chevron news, Vice Chairman Mark A. Nelson sold 139,600 shares of Chevron stock in a transaction that occurred on Monday, March 2nd. The stock was sold at an average price of $187.92, for a total value of $26,233,632.00. Following the transaction, the insider directly owned 11,337 shares of the company's stock, valued at $2,130,449.04. The trade was a 92.49% decrease in their position. The sale was disclosed in a document filed with the Securities & Exchange Commission, which is available at the SEC website. Also, insider Andrew Benjamin Walz sold 22,200 shares of Chevron stock in a transaction that occurred on Tuesday, February 3rd. The stock was sold at an average price of $176.53, for a total value of $3,918,966.00. Following the completion of the transaction, the insider directly owned 666 shares in the company, valued at $117,568.98. This trade represents a 97.09% decrease in their ownership of the stock. The disclosure for this sale is available in the SEC filing. Over the last ninety days, insiders sold 782,607 shares of company stock worth $146,510,571. 0.20% of the stock is currently owned by corporate insiders. CVX has been the subject of a number of recent research reports. BMO Capital Markets  restated an ""outperform"" rating and issued a $190.00 target price on shares of Chevron in a research report on Monday, February 2nd. HSBC upgraded Chevron from a ""hold"" rating to a ""buy"" rating and set a $215.00 target price for the company in a research report on Friday, March 20th. Wall Street Zen upgraded Chevron from a ""sell"" rating to a ""hold"" rating in a research report on Saturday, January 31st. Argus  set a $203.00 target price on Chevron in a research report on Tuesday, February 3rd. Finally, TD Cowen dropped their target price on Chevron from $214.00 to $204.00 and set a ""hold"" rating for the company in a research report on Monday. One analyst  has rated the stock with a Strong Buy rating, sixteen have given a Buy rating, five have issued  a Hold rating and four have given a Sell rating to the company's stock. According to MarketBeat, the stock currently has a consensus rating of ""Moderate Buy"" and an average target price of $192.79. Here are the key news stories impacting Chevron this week: Chevron Corporation NYSE: CVX is an American multinational energy company engaged in virtually all aspects of the oil and gas industry. As an integrated energy firm, Chevron's core activities include upstream oil and natural gas exploration and production, midstream transportation and storage, downstream refining and marketing of fuels and lubricants, and petrochemical manufacturing through joint ventures and subsidiaries. The company markets fuels under brands such as Chevron, Texaco and Caltex and supplies a range of products and services to retail customers, industrial users and commercial fleets worldwide. Chevron traces its corporate lineage to the early petroleum companies that eventually became Standard Oil of California and has evolved through significant mergers and restructurings, including the acquisitions of Gulf Oil and Texaco. Want to see what other hedge funds are holding CVX? Visit HoldingsChannel.com to get the latest 13F filings and insider trades for Chevron Corporation (NYSE:CVX - Free Report). This instant news alert was generated by narrative science technology and financial data from MarketBeat in order to provide readers with the fastest reporting and unbiased coverage. Please send any questions or comments about this story to contact@marketbeat.com. Before you consider Chevron, you'll want to hear this. MarketBeat keeps track of Wall Street's top-rated and best performing research analysts and the stocks they recommend to their clients on a daily basis. MarketBeat has identified the five stocks that top analysts are quietly whispering to their clients to buy now before the broader market catches on... and Chevron wasn't on the list. While Chevron currently has a Moderate Buy rating among analysts, top-rated analysts believe these five stocks are better buys. Just getting into the stock market? These 10 simple stocks can help beginning investors build long-term wealth without knowing options, technicals, or other advanced strategies. Sign up for MarketBeat All Access to gain access to MarketBeat's full suite of research tools. 345 N Reid Place, Suite 620, Sioux Falls, SD 57103
                                        
                                        contact@marketbeat.com
                                        
                                        (844) 978-6257 © MarketBeat Media, LLC 2010-2026. All rights reserved. © 2026   Fair market value prices are updated every minute and are provided by Massive. Other market data provided is at least 10-minutes delayed and hosted by Barchart Solutions.  Information is provided 'as-is' and solely for informational purposes, not for trading purposes or advice, and is delayed. To see all exchange delays and terms of use please see Barchart's disclaimer. We and our partners share information on your use of this website to help improve your experience. For more information, or to opt out click the Do Not Sell My Information button below.",https://www.marketbeat.com/instant-alerts/filing-transcend-capital-advisors-llc-sells-5407-shares-of-chevron-corporation-cvx-2026-04-14/
CVX,Chevron (CVX) Expands Venezuelan Operations Through Strategic As - GuruFocus,2026-04-14 09:11:15,"This website is using a security service to protect itself from online attacks. The action you just performed triggered the security solution. There are several actions that could trigger this block including submitting a certain word or phrase, a SQL command or malformed data. You can email the site owner to let them know you were blocked. Please include what you were doing when this page came up and the Cloudflare Ray ID found at the bottom of this page. Cloudflare Ray ID: 9ecfa46f4fc9061d
•

        Your IP:
        Click to reveal
172.174.167.16
•

Performance & security by Cloudflare",https://www.gurufocus.com/news/8790803/chevron-cvx-expands-venezuelan-operations-through-strategic-asset-swap?mobile=true%3Fmobile%3Dtrue&mobile=true%3Fmobile%3Dtrue%3Fmobile%3Dtrue&mobile=true&mobile=true
CVX,Does Chevron Stock Still Have Room to Run? - Trefis,2026-04-14 08:47:05,"Chevron (CVX) stock is at an interesting point right now. It has strong momentum, and if you bet on it, you are betting on a company with strong margin, good cash flow, low-debt capital structure, and good tailwinds. But is that enough? The primary long thesis is that Chevron’s operational execution in a capital-heavy industry will drive superior shareholder returns, even in a flat-to-down commodity price environment. The market is rewarding the company for its volume-led growth, which is less dependent on volatile energy prices. Below is a quick comparison of CVX fundamentals with S&P medians. The current investment debate on CVX is centered around: Can record production growth and cost discipline offset the negative impact of weakening commodity prices and softening global demand? The prevailing sentiment is bearish. The macro picture is deteriorating. Record production is being met with weakening demand and falling prices. Downward EPS revisions and declining free cash flow show the thesis of ‘volume over price’ is cracking. You can evaluate more on which view to bet on by visiting CVX Investment Highlights & Full Analysis We chose these stocks using the following criteria: A portfolio that was built starting 12/31/2016 with stocks that fulfill the criteria above would have performed as follows: Stocks soar and sink – the key is staying invested. A balanced portfolio helps you ride market volatility, boosts gains, and reduces single stock risk. Why settle for average market returns? The Trefis High Quality (HQ) Portfolio invests in a diverse group of 30 stocks that have collectively delivered stronger upside with reduced volatility compared to the broader indices. Discover the methodology behind these smoother, higher returns by checking the HQ Portfolio performance data. Hut 8 Stock On Fire: Up 44% With 6-Day Winning Streak 6-Day Rally Sends Seagate Technology Stock Up 37% Keysight Technologies Stock Surges 18%, With A 6-Day Winning Spree Bank of New York Mellon Stock Surges 12%, With A 7-Day Winning Spree Should You Pay Attention To Chevron Stock’s Momentum? Chevron Stock Hands $123 Bil Back – Worth a Look? Should You Pay Attention To Chevron Stock’s Momentum? Where Will Oil Prices Be On March 31? Does Chevron Stock Have More Upside? How Low Can Chevron Stock Really Go? Why Isn’t Chevron Stock Moving in 2025? What To Expect From Chevron’s Q2 Earnings Report? Better Bet Than Chevron Stock: Pay Less To Get More From YPF ©Copyright 2026 Insight Guru Inc. All Rights Reserved. By using the Site, you agree to be bound by our Terms of
		Use.  Financial market data powered by Quotemedia.com.
		Consensus EPS estimates are from QuoteMedia and are updated every weekday.
		All rights reserved. NYSE/AMEX data delayed 20 minutes.  NASDAQ and other
		data delayed 15 minutes unless indicated.",https://www.trefis.com/stock/cvx/articles2/596503/does-chevron-stock-still-have-room-to-run/2026-04-14
