ticker,title,date,content,url
GS,An Hye-jin vows to clinch GS Caltex title at home after Gimcheon win - CHOSUNBIZ - Chosunbiz,2026-04-03 22:15:00,"With GS Caltex setter An Hye-jin's one line, all the emotions of that day's match were captured. It was a precious victory earned after a cliff-edge battle. GS Caltex defeated Korea Expressway Corporation (KEC) after a full five-set duel in the Jin Air 2025-2026 V League women's championship final game 2 held at Gimcheon Gymnasium on the 3rd. Having won both games 1 and 2, GS Caltex was left with just one win to secure the championship. Ace Silva erupted for 35 points, playing the role of a finisher to full effect. Yoo Seo-yeon (11 points) and Leina (10 points) also contributed, completing a balanced attack. After the match, An Hye-jin said, ""The service points were so thrilling and I finally tasted the joy of blocking after a long time,"" and laughed, ""I was flustered because things didn't go well at the start, but I'm really happy we could win by taking it to the fifth set."" Having advanced to the championship final through the quarterfinals and semifinals, the players also faced a heavy physical burden. But the players' morale instead became stronger. An Hye-jin said, ""The mood is so good that the players even say, 'It doesn't feel like we're going to lose,'"" and added, ""There were anxious moments during the season, but continuous wins have built confidence."" She added, ""It would be a lie to say we're not hurt, but if we overcome this, the joy doubles."" Now attention turns to game 3. GS Caltex will have a chance to clinch the title at Jangchung Arena in Seoul on the 5th. An Hye-jin said, ""I have absolutely no desire to return to Gimcheon,"" and vowed, ""I want to finish it at home. I heard it's already sold out, so I'll repay the many fans with a good game."" Unlike five years ago when they waited as the regular season's top team, this time they climbed step by step to challenge the summit. On this, An Hye-jin said, ""It's actually good because we can maintain our match sense,"" and added, ""Playing continuous games reduced my anxiety and increased my confidence. I'm really enjoying it right now."" Finally, she also expressed her trust in ace Silva. An Hye-jin said, ""She is truly an amazing player. Her sense of responsibility and competitive spirit are tremendous,"" and laughed, ""Even when it's tough she keeps asking for the ball. I thought if we don't give it to her, it would be a disaster."" She added, ""Even in difficult situations late in the match, she solved them, which gave me more confidence."" We use cookies to enhance your experience and analyze traffic. By continuing to       browse this site, you agree to our use of cookies.       Learn More",https://biz.chosun.com/en/en-sports/2026/04/04/4JWY7QVFSBBFZI3QU6C3C4TL4Y/
GS,"GS Caltex Edges Korea Expressway in Five-Set Thriller, Closes in on Title - 조선일보",2026-04-03 22:13:23,"Setter Ahn Hye-jin vows to clinch championship at home amid sold-out third game in Seoul [OSEN=Gimcheon, Reporter Son Chan-ik] “It’s so fun and thrilling.” A single sentence from GS Caltex setter Ahn Hye-jin encapsulated all the emotions of the day’s match. It was a hard-fought victory seized after a cliffhanger battle. GS Caltex won the second game of the Jin Air 2025-2026 V-League Women’s Division Championship Finals against Korea Expressway Corporation on the 3rd at Gimcheon Gymnasium, prevailing in a full five-set thriller. Having taken both the first and second games, GS Caltex now needs only one more win to clinch the championship. Ace Silva delivered a standout performance with 35 points, serving as the key problem-solver. Yu Seo-yeon (11 points) and Reina (10 points) also contributed, completing a balanced attack. After the match, Ahn Hye-jin said, “The serve points were so thrilling, and I finally felt the joy of blocking again after a long time. I was flustered when things didn’t go well early on, but I’m really happy we could win after going to the fifth set,” she smiled. Having advanced to the championship finals through the semifinals and playoffs, the physical burden was significant. However, the players’ morale grew even stronger. Ahn Hye-jin explained, “The atmosphere is so good that the players say, ‘I don’t feel like we’re going to lose.’ There were times during the season when we felt uneasy, but winning continuously has boosted our confidence.” She added, “It would be a lie to say I’m not hurt, but overcoming this makes the joy twice as big.” Now, attention turns to the third game. GS Caltex will have the chance to secure the championship at Seoul’s Jangchung Gymnasium on the 5th. Ahn Hye-jin stated, “I have no desire to return to Gimcheon. I want to finish it at home. I heard tickets are already sold out, so I’ll repay the fans with a great game in front of them,” she vowed. Unlike five years ago, when they waited as the regular league champions, this time they are challenging for the top spot after climbing step by step. Regarding this, Ahn Hye-jin said, “It’s actually better because we can maintain our game sense. The more we play, the less anxious we feel and the more confident we become. Right now, we’re really enjoying it.” Finally, she expressed trust in ace Silva. “She’s truly amazing. Her sense of responsibility and competitive spirit are immense. Even when she must be tired, she keeps asking for the ball. I thought something bad would happen if I didn’t give it to her,” she laughed. She added, “Even in tough situations late in the game, she resolved them, which gave me more confidence.”",https://www.chosun.com/english/sports-en/2026/04/04/R27GPLVVU5EHRFAWE5PJYBFEG4/
GS,Aetna Escapes COVID Testing Payment Suit In Calif. - Law360,2026-04-03 18:43:00,"By Mark Payne · April 3, 2026,  2:43 PM EDT © 2026, Portfolio Media, Inc. | About Healthcare Authority | Contact Us | Terms | Privacy Policy | Trust Center | Cookie Settings | Ad Choices PLEASE NOTE: A verification email will be sent to your address before you can access your trial. Law360 Healthcare Authority may contact you in your professional capacity with information about our other products, services and events that we believe may be of interest.You’ll be able to update your communication preferences via the unsubscribe link provided within our communications.We take your privacy seriously. Please see our Privacy Policy. Law360 Healthcare Authority takes your privacy seriously. Please see our Privacy Policy.",https://www.law360.com/healthcare-authority/deals-corporate-governance/articles/2461451/aetna-escapes-covid-testing-payment-suit-in-calif-
GS,Tennis Sweeps Past Georgia Southern in Fetters' 100th Career Win - App State Athletics,2026-04-03 17:56:51,The use of software that blocks ads hinders our ability to serve you the content you came here to enjoy. We ask that you consider turning off your ad blocker so we can deliver you the best experience possible while you are here.,https://appstatesports.com/news/2026/4/3/tennis-sweeps-past-georgia-southern-in-fetters-100th-career-win.aspx
GS,Key Takeaways From Becky G’s ‘Call Her Daddy’ Interview - HipLatina,2026-04-03 17:39:00,"Becky G is the latest guest to sit down on Call Her Daddy, and she used her time with host Alex Cooper to get candid about the parts of her story that don’t always make it into headlines. Over the course of the conversation, the singer opened up about growing up as the financial backbone of her family, navigating a complicated relationship with her father, and the emotional weight of being a provider at a young age. She also addressed her very public relationship, speaking for the first time in depth about infidelity, calling off her engagement, and the decision to reconcile—on her own terms. The interview arrives at a time when Becky G is entering a new chapter personally and professionally, but what stood out most wasn’t a career update—it was the clarity. There’s a throughline in how she talks about responsibility, boundaries, and healing, especially as a Latina navigating expectations around family, loyalty, and sacrifice. Este sitio está protegido por reCAPTCHA y Google Política de privacidad y Se aplican las Condiciones de servicio. Thank You!                    
											You are already subscribed to our newsletter Here are the biggest takeaways from the conversation: “There was external pressure from the system around me to step up in some kind of way.” “I had a lot of anger. Anger wasn’t an easy emotion for me to process… I just thought that the more successful I became, the more [money] I made, the less this would be an issue… maybe [my father] would figure it out. You can’t do the work for someone else.” “I don’t think our parents go through life saying ‘I want to cause our kids harm;’ these are things that just systematically exist.” “I don’t make decisions passively… I called off my engagement. I took off my ring. There are things here that took place behind closed doors, privately between me and this person.” “To stay or to leave is anyone’s choice to make for themselves and I made my choice and I made it from parts of me that really worked on and earned to feel good about that decision.” “We live in such a hustle culture where we’re like proud to be like ‘I’m burnt out! Like ‘omg I haven’t slept’… Don’t be proud of that, mama. Rest. Recover. Prioritize your well-being. These are things that I had to learn.” Este sitio está protegido por reCAPTCHA y Google Política de privacidad y Se aplican las Condiciones de servicio. Thank You!                    
											You are already subscribed to our newsletter Este sitio está protegido por reCAPTCHA y Google Política de privacidad y Se aplican las Condiciones de servicio. Thank You!                    
											You are already subscribed to our newsletter We won't sell or share your personal information to inform the ads you see. You may still see interest-based ads if your information is sold or shared by other companies or was sold or shared previously. These cookies may be set through our site by our advertising partners. They may be used by those companies to build a profile of your interests and show you relevant adverts on other sites. They do not store directly personal information, but are based on uniquely identifying your browser and internet device. If you do not allow these cookies, you will experience less targeted advertising. These cookies allow us to count visits and traffic sources so we can measure and improve the performance of our site. They help us to know which pages are the most and least popular and see how visitors move around the site. All information these cookies collect is aggregated and therefore anonymous. If you do not allow these cookies we will not know when you have visited our site, and will not be able to monitor its performance. These cookies are necessary for the website to function and cannot be switched off in our systems. They are usually only set in response to actions made by you which amount to a request for services, such as setting your privacy preferences, logging in or filling in forms. You can set your browser to block or alert you about these cookies, but some parts of the site will not then work. These cookies do not store any personally identifiable information. These cookies enable the website to provide enhanced functionality and personalisation. They may be set by us or by third party providers whose services we have added to our pages. If you do not allow these cookies then some or all of these services may not function properly.",https://hiplatina.com/takeaways-becky-g-call-her-daddy-family-cheating-interview/
GS,"CAROL GS-57 XLR Dynamic Microphone - Cardioid Vocal Mic For Stage, Karaoke & Singing With On/Off Switch - ruhrkanal.news",2026-04-03 16:48:05,"Es konnten keine passenden Inhalte gefunden werden. Vielleicht kann Ihnen die Suchfunktion weiterhelfen. Hattingen- Zu einer Laufdemo am heutigen Samstag (3. Februar 2024) hat die Gruppen „Für Vielfalt und Demokratie“ aufgerufen. Hunderte trafen sich am Rathaus um ein… Hattingen – Am heutigen Montagmorgen (12. August 2024) war im Hattinger Amtsgericht eine Hauptverhandlung vorgesehen, bei der ein Mann und eine Frau wegen einer Straftat… Sei auf dem Laufenden und gib deine Email Adresse ein um RuhrkanalNEWS zu abonnieren Falls Sie Fragen oder Anregungen haben schicken Sie uns einfach eine Email an re*******@*******al.news Copyright RuhrkanalNEWS® © 2026 Hattingen/Sprockhövel",https://ruhrkanal.news/Dynamic-Microphone-Cardioid-Vocal-Mic-For-Stage-Karaoke-775254
GS,TENNESSEE VOLS BASEBALL: LSU set for SEC battle - roundtable.io,2026-04-03 15:51:59,"Tennessee will look to get back on track in Southeastern Conference play as it hosts defending national champion LSU in an important series this weekend at Lindsey Nelson Stadium. Both the Volunteers and Tigers are off to unexpected slow starts in league play and will be looking for a big series win this weekend in Knoxville. Game 1 – Friday (5:30 pm on SEC Network):   UT: RHP Landon Mack (7 GS, 3-2, 3.89 ERA)LSU: RHP Casan Evans (7 GS, 2-1, 5.00 ERA) Game 2 – Saturday (6 pm on ESPN2):UT: RHP Tegan Kuhns (6 GS, 1-3, 4.08 ERA)LSU: RHP William Schmidt (7 GS, 4-1, 2.55 ERA) Game 3 – Sunday (1 pm on SEC Network+):UT: LHP Evan Blanco (7 GS, 2-2, 4.00 ERA)LSU: RHP Gavin Guidry (2 GS, 3-3, 6.64 ERA)",https://roundtable.io/sports/ncaa/tennessee/game-day/tennessee-vols-baseball-lsu-set-for-sec-battle
GS,MLB DFS Picks: Starting Pitcher Rankings for Friday 4/3/26 - DraftKings Network,2026-04-03 15:45:00,"Dylan Cease, Framber Valdez and MacKenzie Gore highlight another jam-packed slate of MLB action. Sam Connon shares his DFS pitcher rankings, highlighting which aces could be worth a big chunk of your budget on Friday. Following a handful of days off across the league, the MLB schedule is once again packed on Friday. All 30 clubs are taking the field, so there is no better time to dive right into the action. Pitchers are already ranked by price, with the ones who are projected to perform better eating up more of your budget, but I am here to add my two cents. I’ll be sharing my own rankings for the top 10 starting pitchers for DFS in the 10-game Friday afternoon contest. Set your DraftKings fantasy baseball lineups here: MLB $300K Mega 8’s ($100K to 1st) 2025 Stats: 32 G, 32 GS, 168.0 IP, 8-12, 4.55 ERA, 1.33 WHIP, 215 K, 71 BB, 3.4 WAR2026 Stats: 1 G, 1 GS, 5.1 IP, 0-0, 1.69 ERA, 0.94 WHIP, 12 K, 2 BB, 0.4 WAR2026 FanGraphs Projections: 30 G, 30 GS, 171.0 IP, 12-9, 3.45 ERA, 1.20 WHIP, 208 K, 64 BB, 3.8 WAR (Steamer) 2025 Stats: 30 G, 30 GS, 159.2 IP, 5-15, 4.17 ERA, 1.35 WHIP, 185 K, 64 BB, 2.9 WAR2026 Stats: 1 G, 1 GS, 5.1 IP, 1-0, 3.38 ERA, 0.94 WHIP, 7 K, 3 BB, 0.1 WAR2026 FanGraphs Projections: 28 G, 28 GS, 155.0 IP, 10-9, 3.75 ERA, 1.25 WHIP, 179 K, 61 BB, 2.7 WAR (Steamer) 2025 Stats: 31 G, 31 GS, 192.0 IP, 13-11, 3.66 ERA, 1.24 WHIP, 187 K, 68 BB, 4.0 WAR2026 Stats: 1 G, 1 GS, 6.0 IP, 0-0, 1.50 ERA, 1.33 WHIP, 5 K, 1 BB, 0.2 WAR2026 FanGraphs Projections: 30 G, 30 GS, 183.0 IP, 12-10, 3.42 ERA, 1.27 WHIP, 172 K, 61 BB, 3.6 WAR (Steamer) 2025 Stats: 15 G, 15 GS, 73.1 IP, 5-3, 3.44 ERA, 1.20 WHIP, 76 K, 26 BB, 0.8 WAR2026 Stats: 1 G, 1 GS, 5.0 IP, 0-0, 0.00 ERA, 1.00 WHIP, 6 K, 4 BB, 0.1 WAR2026 FanGraphs Projections: 28 G, 28 GS, 160.0 IP, 10-9, 3.75 ERA, 1.25 WHIP, 170 K, 58 BB, 2.8 WAR (Steamer) 2025 Stats: 6 G, 6 GS, 32.0 IP, 1-1, 2.53 ERA, 1.03 WHIP, 47 K, 10 BB, 1.1 WAR2026 Stats: 1 G, 1 GS, 4.2 IP, 0-1, 3.86 ERA, 1.07 WHIP, 4 K, 3 BB, 0.0 WAR2026 FanGraphs Projections: 27 G, 27 GS, 148.0 IP, 10-8, 3.70 ERA, 1.24 WHIP, 158 K, 48 BB, 3.0 WAR (Steamer) 2025 Stats: 32 G, 32 GS, 180.2 IP, 14-8, 4.28 ERA, 1.23 WHIP, 201 K, 38 BB, 3.6 WAR2026 Stats: 1 G, 1 GS, 4.0 IP, 0-0, 6.75 ERA, 1.75 WHIP, 5 K, 1 BB, 0.0 WAR2026 FanGraphs Projections: 30 G, 30 GS, 173.0 IP, 11-10, 3.63 ERA, 1.20 WHIP, 184 K, 47 BB, 3.8 WAR (Steamer) 2025 Stats: 17 G, 17 GS, 94.1 IP, 5-10, 6.01 ERA, 1.35 WHIP, 97 K, 28 BB, 0.9 WAR2026 Stats: 1 G, 1 GS, 5.0 IP, 0-0, 5.40 ERA, 1.40 WHIP, 7 K, 2 BB, -0.1 WAR2026 FanGraphs Projections: 30 G, 30 GS, 173.0 IP, 11-10, 3.91 ERA, 1.22 WHIP, 172 K, 46 BB, 3.0 WAR (Steamer) 2025 Stats: 20 G, 20 GS, 95.1 IP, 7-6, 4.25 ERA, 1.05 WHIP, 105 K, 32 BB, 1.9 WAR2026 Stats: 1 G, 1 GS, 7.0 IP, 0-0, 3.86 ERA, 0.86 WHIP, 8 K, 1 BB, 0.0 WAR2026 FanGraphs Projections: 27 G, 27 GS, 149.0 IP, 9-9, 3.95 ERA, 1.21 WHIP, 169 K, 52 BB, 2.6 WAR (Steamer) 2025 Stats: 23 G, 22 GS, 118.0 IP, 11-4, 2.67 ERA, 1.08 WHIP, 97 K, 22 BB, 2.2 WAR2026 Stats: 1 G, 1 GS, 6.1 IP, 1-0, 2.84 ERA, 0.79 WHIP, 4 K, 1 BB, 0.0 WAR2026 FanGraphs Projections: 23 G, 23 GS, 130.0 IP, 8-8, 4.27 ERA, 1.32 WHIP, 115 K, 45 BB, 1.3 WAR (Steamer) 2025 Stats: 33 G, 33 GS, 162.1 IP, 9-8, 4.44 ERA, 1.37 WHIP, 171 K, 65 BB, 2.1 WAR2026 Stats: 1 G, 1 GS, 4.1 IP, 0-0, 2.08 ERA, 1.62 WHIP, 3 K, 2 BB, 0.1 WAR2026 FanGraphs Projections: 41 G, 20 GS, 128.0 IP, 8-8, 3.98 ERA, 1.30 WHIP, 127 K, 46 BB, 1.4 WAR (Steamer) Sam joined DraftKings in 2025 following five years with Sports Illustrated’s “On SI” network. He has covered the UCLA Bruins, New England Patriots, Tampa Bay Rays, MLB, MiLB and NBA, on top of earning awards from the Society of Professional Journalists and College Media Association during his time as a student at UCLA. All views expressed are my own. I am an employee of DraftKings and am ineligible to play in public DFS or DKSB contests. The Crown Is Yours: Sign up for DraftKingsopens in a new tab and experience the ultimate host for games and betting experiences! All odds and lines provided by DraftKings Sportsbook and are subject to change. Stan Son provides the latest injury status update for Pacers forward Pascal Siakam on Friday, April 3. DraftKings Network has you covered with the latest NBA injury report, news and top plays for Friday, 4/3/26. Check out the latest updates regarding Twins outfielder Byron Buxton’s injury status after he left Friday’s game against the Rays. Stan Son breaks down how the Lakers’ NBA championship odds are affected by the recent Luka Doncic injury. GAMBLING PROBLEM? CALL 1-800-GAMBLER, (800) 327-5050opens in a new tab or visit gamblinghelplinema.orgopens in a new tab (MA). Call 877-8-HOPENY/text HOPENY (467369) (NY).Please Gamble Responsibly. 888-789-7777/visit ccpg.orgopens in a new tab (CT), or visit www.mdgamblinghelp.orgopens in a new tab (MD).21+ and present in most states. (18+ DC/KY/NH/WY). Void in ONT. Eligibility restrictions apply. Terms: draftkings.com/sportsbookopens in a new tab. On behalf of Boot Hill Casino & Resort (KS). Pass-thru of per wager tax may apply in IL.",https://dknetwork.draftkings.com/2026/04/03/mlb-dfs-picks-starting-pitcher-rankings-for-friday-4-3-26/
GS,"GS Caltex Sweeps First Two Matches, Coach Vows All-Out Third Match - 조선일보",2026-04-03 13:52:15,"Silva's 35 points and Coach Lee's determination fuel championship push ahead of decisive clash [OSEN=Gimcheon, Son Chan-ik Reporter] GS Caltex head coach Lee Young-taek, who secured both the 1st and 2nd matches of the championship decider, gave a thumbs-up to his players' fighting spirit. GS Caltex defeated Korea Expressway Corporation in a full-set battle in the 2nd match of the Jin Air 2025-2026 V-League Women's Division Championship Decider held at the Gimcheon Gymnasium on the 3rd. With this victory, GS Caltex swept both the 1st and 2nd matches, leaving only one win remaining until the championship. Ace Silva showcased his problem-solving instincts to the fullest with an explosive 35 points. Yoo Seo-yeon contributed 11 points, and Reina added 10 points, bolstering the victory. After the match, Coach Lee Young-taek said, “Beyond performance, I can only speak of the players' fighting spirit. Whether they started or came off the bench, everyone worked really hard to fulfill their roles. Because that determination came together as one, we were able to win.” Silva’s presence stood out particularly. Even in a situation where the physical burden was not light, he recorded the most points among both teams, showcasing the dignity of an ace. Regarding this, Coach Lee praised, “Even though Silva looked tired today, he delivered in crucial moments. He truly lives up to being our team’s ace.” He added, “When the flow was good, substitute players stepped in, allowing the starters to catch their breath for a moment. That aspect greatly helped maintain overall performance.” Asked about the possibility of managing Silva’s stamina in the 3rd match, Coach Lee was firm. “Although the time to recover condition is tight, Silva probably doesn’t want to rest either,” he emphasized. “We will go all-out in the 3rd match just like the 1st and 2nd matches.” On the other hand, Korea Expressway Corporation’s acting head coach Kim Young-bae, who lost both the 1st and 2nd matches and was pushed to the brink, couldn’t hide his disappointment. He said, “I don’t know what to say right now. The parts I trusted wavered a bit. The plays I wanted didn’t come out well, making our attack patterns monotonous. We need to resolve this through dialogue with the players.” Acting Coach Kim reflected, “The timing between the setter and attackers was disappointing. It didn’t sync well,” and added, “Above all, failing to control the opposing ace Silva in crucial moments was painful.” All eyes are on the 3rd match of the championship decider: Will the cornered Korea Expressway Corporation lay the groundwork for a counterattack, or will GS Caltex continue their upward trend and lift the championship trophy? /what@osen.co.kr",https://www.chosun.com/english/sports-en/2026/04/03/LPIDOJYXVVHGBBSW6BR3MN6JKY/
GS,BMW F 450 GS - Additional Media Assets. - PressClub Global.,2026-04-03 13:35:00,"Juliane DreslerBMW Group
            

            Tel: +49-151-601-95733



              send an e-mail Additional photos of the new BMW F 450 GS - Shot on site at the
  International Media Launch in Sicily, March 2026. 18 March 2026. Watch the on-demand webcast of the new BMW i3 Design Premiere here. Playful in handling, versatile in use – ultimate GS expertise for the 48 hp class.",https://www.press.bmwgroup.com/global/article/detail/T0456893EN/bmw-f-450-gs-additional-media-assets
