ticker,title,date,content,url
GS,How to Play Goldman Stock Ahead of Its Q1 Earnings Release? - TradingView,2026-04-09 13:59:00,"The Goldman Sachs Group, Inc. GS is scheduled to release first-quarter 2026 earnings on April 13, 2026, before the opening bell. GS’s 2025 performance was impressive, driven by strong investment banking (IB) and trading, and solid revenue growth in the Global Banking & Markets, and Asset & Wealth Management divisions. However, the overall quarterly results were tempered by elevated operating expenses. Goldman has a strong history of earnings surprises. The company’s earnings outpaced the Zacks Consensus Estimate in the trailing four quarters, with an average earnings surprise of 14.02%. Let us see how GS is expected to fare in terms of revenues and earnings this time around. The Zacks Consensus Estimate for first-quarter 2026 revenues is pegged at $17.01 billion, calling for a 12.9% rise from the year-ago quarter's reported figure. In the past seven days, the consensus estimate for quarterly earnings has been unchanged at $16.48 per share. The projection suggests an increase of 16.7% from the year-ago quarter's reported figure. Market-Making Revenues: The first quarter saw solid client activities and market volatility. Major factors that influenced trading business in the quarter included shifting expectations around artificial intelligence (AI), rising geopolitical tensions, particularly concerns over the Middle East, persistent inflation concerns and uncertainty around the Fed’s monetary policy stance. Additionally, volatility was high in equity markets and other asset classes, including commodities, bonds and foreign exchange. Therefore, Goldman's market-making revenues are likely to have witnessed a rise in the quarter to be reported. IB Fees: Deal-making activity was impressive in the first quarter of 2026, despite the Middle Eastern conflict and the ensuing uncertainty about its impact on the economy in the last month of the quarter. Though global mergers and acquisitions (M&As) volume declined year over year, deal value was up as big transactions dominated the space. The quarter saw a rise in the deal value, driven by lower capital costs, and a focus on scale and AI integration. With the IB backlog at a four-year high and a leadership position, the company is likely to have witnessed higher advisory fees in the quarter to be reported. The initial public offering (IPO) market in the first quarter performed impressively, with issuance volume improving despite fewer companies getting listed. Also, global bond issuance volume was solid. As such, GS’s leadership position in worldwide announced and completed M&As, equity and equity-related offerings is likely to have provided it an edge over its peers, offering support to the company’s quarterly IB revenues. The Zacks Consensus Estimate for IB revenues is pegged at $2.6 billion, suggesting a 33.1% rise from the year-ago quarter’s actual. Net Interest Income (NII): Per the Fed’s latest data, the demand for overall loans was decent in the first two months of the quarter. This is likely to have aided Goldman's loan growth. Also, the Fed kept interest rates steady in the first quarter of 2026. Hence, a decent lending scenario and stabilizing funding/deposit costs are likely to have supported GS’s NII in the first quarter. The Zacks Consensus Estimate for NII is pegged at $3.7 billion, suggesting a 27.2% rise from the year-ago quarter’s actual. Expenses: Goldman’s investments in technology and market development expenses for business expansion, along with a rise in transaction-based expenses due to higher client activities, are anticipated to have led to increased expenses in the to-be-reported quarter. Our proven model conclusively predicts an earnings beat for GS this time. The combination of a positive Earnings ESP and Zacks Rank #1 (Strong Buy), 2 (Buy) or 3 (Hold) increases the odds of an earnings beat. That is the case here, as you can see below. Goldman has an Earnings ESP of +1.48%. You can uncover the best stocks to buy or sell before they are reported with our Earnings ESP Filter. GS carries a Zacks Rank #3 at present. You can see the complete list of today’s Zacks #1 Rank stocks here. In the first quarter of 2026, Goldman's shares lost 3.7% compared with the industry’s decline of 8.6%. Its close peer JPMorgan JPM and Morgan Stanley’s MS shares also plunged. JPMorgan shares fell 8.7% and Morgan Stanley declined 7.3%. Let us look at the value GS offers investors at the current levels. Currently, Goldman is trading at 16.98X forward 12-month price/earnings (P/E). Meanwhile, the industry’s forward earnings multiple sits at 15.13X. The company’s valuation looks somewhat expensive compared with the industry average. Its peer, JPMorgan, is trading at a forward 12-month P/E of 13.95X, whereas Morgan Stanley is trading at 15.17X. Goldman continues to streamline its operations by exiting underperforming, non-core consumer banking ventures and sharpening its focus on its core strengths, particularly its asset and wealth management businesses. This strategic shift is aimed at building a more stable and recurring revenue base. A robust M&A environment and a healthy deal pipeline continue to support momentum in investment banking. Goldman’s expanding private credit and alternatives platform, rising assets under supervision, and firmwide AI transformation through initiatives like OneGS 3.0 position the company to improve efficiency, enhance client offerings and generate higher fee-based revenues. The firm’s strong capital base, attractive dividend yield and active share-repurchase program further reinforce shareholder returns. Operational efficiency remains central to Goldman’s growth strategy. The company is making steady progress toward its mid-term targets of a 14-16% return on equity and a 60% efficiency ratio. However, despite solid fundamentals and promising growth prospects, broader macroeconomic and policy trends that could materially shape the company’s performance trajectory should be carefully considered. Goldman’s stock is also currently trading at a premium relative to the industry average. As such, investors looking to initiate a position in GS stock may benefit from waiting until after the quarterly earnings release for greater clarity and potentially a more attractive entry point. Existing shareholders can consider holding on to the stock, as its long-term outlook remains strong and it is unlikely to disappoint over time. Free Report: Profiting from the 2nd Wave of AI Explosion The next phase of the AI explosion is poised to create significant wealth for investors, especially those who get in early. It will add literally trillion of dollars to the economy and revolutionize nearly every part of our lives. Investors who bought shares like Nvidia at the right time have had a shot at huge gains. But the rocket ride in the ""first wave"" of AI stocks may soon come to an end. The sharp upward trajectory of these stocks will begin to level off, leaving exponential growth to a new wave of cutting-edge companies. Zacks' AI Boom 2.0: The Second Wave report reveals 4 under-the-radar companies that may soon be shining stars of AI’s next leap forward.Access AI Boom 2.0 now, absolutely free >> Want the latest recommendations from Zacks Investment Research? Today, you can download 7 Best Stocks for the Next 30 Days. Click to get this free report The Goldman Sachs Group, Inc. (GS): Free Stock Analysis Report JPMorgan Chase & Co. (JPM): Free Stock Analysis Report This article originally published on Zacks Investment Research (zacks.com). Select market data provided by ICE Data Services. Select reference data provided by FactSet. Copyright © 2026 FactSet Research Systems Inc.Copyright © 2026, American Bankers Association. CUSIP Database provided by FactSet Research Systems Inc. All rights reserved. SEC fillings and other documents provided by Quartr.© 2026 TradingView, Inc.",https://www.tradingview.com/news/zacks:f7ab3c2b6094b:0-how-to-play-goldman-stock-ahead-of-its-q1-earnings-release/
GS,"V Square Quantitative Management LLC Invests $2.64 Million in The Goldman Sachs Group, Inc. $GS - MarketBeat",2026-04-09 11:49:07,"V Square Quantitative Management LLC acquired a new stake in shares of  The Goldman Sachs Group, Inc. (NYSE:GS - Free Report) during the 4th quarter, according to the company in its most recent 13F filing with the SEC. The firm acquired 3,005 shares of the investment management company's stock, valued at approximately $2,641,000. Other hedge funds and other institutional investors also recently added to or reduced their stakes in the company. Wellington Management Group LLP boosted its stake in  The Goldman Sachs Group by 110.8% in the third quarter. Wellington Management Group LLP now owns 1,780,620 shares of the investment management company's stock worth $1,417,997,000 after buying an additional 936,015 shares in the last quarter.  Ameriprise Financial Inc. lifted its holdings in shares of  The Goldman Sachs Group by 18.2% in the 2nd quarter. Ameriprise Financial Inc. now owns 1,895,752 shares of the investment management company's stock worth $1,345,924,000 after acquiring an additional 291,280 shares during the last quarter.  Danske Bank A S purchased a new stake in shares of  The Goldman Sachs Group in the 3rd quarter valued at $178,941,000.  Alliancebernstein L.P. grew its holdings in shares of  The Goldman Sachs Group by 14.4% during the 2nd quarter. Alliancebernstein L.P. now owns 1,710,516 shares of the investment management company's stock valued at $1,210,618,000 after purchasing an additional 215,230 shares during the last quarter.  Finally, Holocene Advisors LP bought a new position in shares of  The Goldman Sachs Group during the 2nd quarter valued at $152,166,000. 71.21% of the stock is currently owned by hedge funds and other institutional investors. Here are the key news stories impacting The Goldman Sachs Group this week: Shares of The Goldman Sachs Group stock opened at $906.27 on Thursday. The Goldman Sachs Group, Inc. has a 1 year low of $447.11 and a 1 year high of $984.70. The firm has a market cap of $267.34 billion, a price-to-earnings ratio of 17.67, a PEG ratio of 1.13 and a beta of 1.32. The company has a 50-day moving average of $871.68 and a 200 day moving average of $852.68. The company has a debt-to-equity ratio of 2.60, a current ratio of 0.66 and a quick ratio of 0.66. The Goldman Sachs Group (NYSE:GS - Get Free Report) last issued its quarterly earnings results on Thursday, January 15th. The investment management company reported $13.55 EPS for the quarter, topping analysts' consensus estimates of $11.52 by $2.03. The firm had revenue of $15.71 billion for the quarter, compared to analysts' expectations of $14.30 billion. The Goldman Sachs Group had a return on equity of 15.72% and a net margin of 13.73%.The business's revenue for the quarter was down 3.0% compared to the same quarter last year. During the same period in the previous year, the firm posted $11.95 EPS.  As a group, sell-side analysts anticipate that  The Goldman Sachs Group, Inc. will post 47.12 earnings per share for the current fiscal year. The business also recently declared a quarterly dividend, which was paid on Monday, March 30th. Stockholders of record on Monday, March 2nd were issued a dividend of $4.50 per share. The ex-dividend date was Monday, March 2nd. This is a boost from The Goldman Sachs Group's previous quarterly dividend of $4.00. This represents a $18.00 annualized dividend and a dividend yield of 2.0%. The Goldman Sachs Group's dividend payout ratio  is 35.09%. Several analysts have weighed in on the stock. BMO Capital Markets lowered their price target on shares of The Goldman Sachs Group from $985.00 to $905.00 and set a ""market perform"" rating for the company in a research note on Monday. Daiwa Securities Group reduced their price objective on The Goldman Sachs Group from $940.00 to $891.00 and set a ""neutral"" rating on the stock in a research note on Tuesday. UBS Group dropped their target price on The Goldman Sachs Group from $990.00 to $930.00 and set a ""neutral"" rating for the company in a report on Tuesday. Rothschild & Co Redburn dropped their price objective on The Goldman Sachs Group from $843.00 to $839.00 and set a ""neutral"" rating for the company in a research note on Tuesday. Finally, BNP Paribas Exane boosted their price target on The Goldman Sachs Group from $775.00 to $970.00 and gave the company a ""neutral"" rating in a report on Friday, January 16th. Eight research analysts have rated the stock with a Buy rating and fourteen have assigned  a Hold rating to the company. Based on data from MarketBeat.com, the stock currently has a consensus rating of ""Hold"" and a consensus price target of $924.24. In other news, insider Kathryn H. Ruemmler sold 9,589 shares of the business's stock in a transaction on Friday, January 23rd. The stock was sold at an average price of $927.51, for a total value of $8,893,893.39. Following the completion of the transaction, the insider owned 18,533 shares in the company, valued at $17,189,542.83. The trade was a 34.10% decrease in their ownership of the stock. The transaction was disclosed in a document filed with the Securities & Exchange Commission, which is available through this link. Also, CFO Denis P. Coleman sold 11,623 shares of the company's stock in a transaction on Monday, February 9th. The shares were sold at an average price of $941.57, for a total value of $10,943,868.11. Following the transaction, the chief financial officer directly owned 29,342 shares in the company, valued at approximately $27,627,546.94. The trade was a 28.37% decrease in their ownership of the stock. Additional details regarding this sale are available in the official SEC disclosure. Insiders have sold a total of 117,283 shares of company stock worth $112,016,033 over the last quarter. 0.55% of the stock is owned by insiders. The Goldman Sachs Group, Inc is a global investment banking and financial services firm headquartered in New York City. Founded in 1869 as a commercial paper business, the company has grown into a diversified financial institution that provides a broad range of services to corporations, financial institutions, governments and individuals. The firm is led by Chief Executive Officer David M. Solomon and operates across major financial centers worldwide. Goldman Sachs' core businesses include investment banking, global markets, asset and wealth management, and consumer banking. This instant news alert was generated by narrative science technology and financial data from MarketBeat in order to provide readers with the fastest reporting and unbiased coverage. Please send any questions or comments about this story to contact@marketbeat.com. Before you consider The Goldman Sachs Group, you'll want to hear this. MarketBeat keeps track of Wall Street's top-rated and best performing research analysts and the stocks they recommend to their clients on a daily basis. MarketBeat has identified the five stocks that top analysts are quietly whispering to their clients to buy now before the broader market catches on... and The Goldman Sachs Group wasn't on the list. While The Goldman Sachs Group currently has a Hold rating among analysts, top-rated analysts believe these five stocks are better buys. MarketBeat just released its list of the 7 hottest IPOs expected to hit Wall Street in 2026. See which companies are preparing to go public and why investors are watching closely. Sign up for MarketBeat All Access to gain access to MarketBeat's full suite of research tools. 345 N Reid Place, Suite 620, Sioux Falls, SD 57103
                                        
                                        contact@marketbeat.com
                                        
                                        (844) 978-6257 © MarketBeat Media, LLC 2010-2026. All rights reserved. © 2026   Fair market value prices are updated every minute and are provided by Massive. Other market data provided is at least 10-minutes delayed and hosted by Barchart Solutions.  Information is provided 'as-is' and solely for informational purposes, not for trading purposes or advice, and is delayed. To see all exchange delays and terms of use please see Barchart's disclaimer. Enter your email address below to receive a concise daily summary of dividend news for The Goldman Sachs Group, new dividend declarations and stocks going ex-dividend with DividendStocks.com’s free newsletter.",https://www.marketbeat.com/instant-alerts/filing-v-square-quantitative-management-llc-invests-264-million-in-the-goldman-sachs-group-inc-gs-2026-04-09/
GS,GS Apr 2026 742.500 put (GS260410P00742500) interactive stock chart - Yahoo Finance UK,2026-04-09 10:53:55,"Tip: Try a valid symbol or a specific company name for relevant results ⚡️Stocks rally 📈 after US and Iran agree two-week ceasefire ⚡️ ⚡️ Stocks waver as Trump's Iran 🇮🇷 deadline looms ⚡️ Stocks fall 📉 after Trump threatens to hit Iran ‘extremely hard’ 🇮🇷 💷 Pound jumps 📈 on hopes that Middle East war will end soon 📈 Stocks rally after Trump says US could leave Iran in a few weeks 📉 Gold prices 👑 set for worst month since 2008 as Iran war 🇮🇷 continues Oil prices 🛢️ pull lower following reports of Trump 🇺🇸 considering end to Middle East conflict Pound ticks higher as UK GDP growth 🇬🇧 confirmed as nearly stagnant in Q4 📊 Stocks set to rise 📈 as Trump willing to end Iran war 🇮🇷 without Hormuz deal Average UK house price 🏡 rises to £277,186 in March 📈 Mortgage approvals ✔️ jump by most since November, Bank of England 🏦 says Brent crude 🛢️ prices up to $115 a barrel 📈 as traders assess Trump peace deal claims Pound 💷 set for biggest monthly loss against dollar 💲 since October Stocks set to tumble as Middle East conflict intensifies Gold and silver prices rise 📈 with eyes on central banks and Iran war 💷 UK currency dips amid weaker retail sales while Middle East war ramps up inflation fears 💷 Stocks muted as Trump delays strikes on Iran power plants 🌍 Pound 💷 dips against dollar as OECD warns Middle East conflict will drive up UK inflation ⛽🛍️ Oil prices 🛢️ higher as Trump claims Iran doesn't want to admit they spoke 🗣️ Bitcoin price struggles near $70K as peace talk hopes falter Pound 💷 steady as Bank of England 🏦 interest rate rise bets ease Gold 🪙 price jumps ⬆️ 3% as oil slump eases inflation fears amid Trump Iran plan Stocks rise 📈 on reports of Trump offering 15-point ceasefire plan to Iran 🗒️ Oil price ⛽ plunges 📉 as Trump announces plan to end Iran war 💷 Pound dips against dollar 💵 as speculation around UK interest rates grow ⚡️ ASML, Estée Lauder, Bellway, Kingfisher and Fevertree ⚡️ ⚡️ Gold and silver price moves muted amid inflation and interest rate hike risks ⚡️ ⚡️ Stocks lack direction as traders assess Middle East conflict ⚡️ 🛢️Tehran's denial of negotiations clouds prospect of reopening Strait of Hormuz and ending conflict 🛢️ Pound 💷 dips against dollar 💲 amid mounting expectations of Bank of England 🏦 rate increase Gold 🪙 and silver erase 2026 gains as Middle East inflation fears stoke bets on higher rates London plunges into correction territory as Trump gives Iran ultimatum Oil prices ⛽ gain as Trump and Starmer discuss need to reopen Hormuz ⚡️ UK inflation, BYD, Next, Kingfisher and Bellway ⚡️ Gold 👑 set for third weekly fall 📉 as strong dollar and Fed stance weigh Pound steady 🇬🇧 as investors digest UK borrowing data 📊 and interest rate decisions Stocks higher 📈 as Netanyahu 🇮🇱 says he will 'hold off' on gas field attacks Oil prices 🛢️ fall as Netanyahu signals pause in Iran strikes 🇮🇷 Government borrowing rose 📈 by more than expected to £14.3bn in February Tip: Try a valid symbol or a specific company name for relevant results",https://uk.finance.yahoo.com/quote/GS260410P00742500/chart/#eyJsYXlvdXQiOnsiY2hhcnRUeXBlIjoibW91bnRhaW4iLCJoZWFkc1VwIjp7InN0YXRpYyI6dHJ1ZSwiZHluYW1pYyI6ZmFsc2UsImZsb2F0aW5nIjpmYWxzZX0sImxpbmVXaWR0aCI6MiwiY3Jvc3NoYWlyIjpmYWxzZSwiY2hhcnRTY2FsZSI6ImxpbmVhciIsImV4dGVuZGVkIjpmYWxzZSwiZnVsbFNjcmVlbiI6dHJ1ZSwic3RyaXBlZEJhY2tncm91bmQiOnRydWUsImNvbG9yIjoiIzAwODFmMiIsImNyb3NzaGFpclN0aWNreSI6ZmFsc2UsInNldFNwYW4iOnsibXVsdGlwbGllciI6MSwiYmFzZSI6InRvZGF5IiwicGVyaW9kaWNpdHkiOnsiaW50ZXJ2YWwiOjEsInBlcmlvZCI6MSwidGltZVVuaXQiOiJtaW51dGUifSwic2hvd0V2ZW50c1F1b3RlIjp0cnVlfX0sImV2ZW50cyI6eyJkaXZzIjp0cnVlLCJzcGxpdHMiOnRydWUsInRyYWRpbmdIb3Jpem9uIjoibm9uZSIsInNpZ0RldkV2ZW50cyI6W119LCJkcmF3aW5ncyI6bnVsbCwicHJlZmVyZW5jZXMiOnsiY3VycmVudFByaWNlTGluZSI6dHJ1ZSwiZGlzcGxheUNyb3NzaGFpcnNXaXRoRHJhd2luZ1Rvb2wiOmZhbHNlLCJkcmFnZ2luZyI6eyJzZXJpZXMiOnRydWUsInN0dWR5IjpmYWxzZSwieWF4aXMiOnRydWV9LCJkcmF3aW5ncyI6bnVsbCwiaGlnaGxpZ2h0c1JhZGl1cyI6MTAsImhpZ2hsaWdodHNUYXBSYWRpdXMiOjMwLCJtYWduZXQiOmZhbHNlLCJob3Jpem9udGFsQ3Jvc3NoYWlyRmllbGQiOm51bGwsImxhYmVscyI6dHJ1ZSwibGFuZ3VhZ2UiOm51bGwsInRpbWVab25lIjoiQW1lcmljYS9OZXdfWW9yayIsIndoaXRlc3BhY2UiOjAsInpvb21JblNwZWVkIjpudWxsLCJ6b29tT3V0U3BlZWQiOm51bGwsInpvb21BdEN1cnJlbnRNb3VzZVBvc2l0aW9uIjpmYWxzZX19
GS,BMW F 450 GS set for India launch on April 23 - News.az,2026-04-09 08:49:26,"BMW Motorrad has confirmed that its new adventure motorcycle, the BMW F 450 GS, will launch in India on April 23, marking the arrival of the brand’s new entry-level model in its popular GS lineup. The motorcycle will be locally manufactured at TVS Motor Company Hosur Facility, strengthening BMW’s long-standing partnership with TVS in India and supporting local production for the premium mid-capacity segment, News.Az reports, citing Car and Bike. The F 450 GS is expected to replace the discontinued G 310 GS as BMW’s most accessible adventure bike. It was first introduced as a concept at EICMA 2024 and later revealed in production form at EICMA 2025, generating strong interest among motorcycle enthusiasts. The new model carries BMW’s signature GS design language, including a bold front end with an X-shaped LED daytime running light inspired by the flagship R 1300 GS. It also features a 6.5-inch TFT display for rider information and connectivity. The bike rides on a 19-inch front and 17-inch rear wheel setup with dual-purpose tyres, reinforcing its off-road capability. Power comes from a 420 cc liquid-cooled parallel-twin engine producing 47 bhp and 43 Nm of torque, paired with a six-speed gearbox. The motorcycle also includes a slipper clutch and bi-directional quickshifter as standard. BMW claims a top speed of around 165 km/h and a 0–100 km/h acceleration time of 5.9 seconds. It is equipped with a 14-litre fuel tank and delivers a claimed fuel efficiency of over 26 km/l. The F 450 GS will be offered in multiple trims, including Basic, Exclusive, Sport, and the off-road-focused GS Trophy variant. Higher trims are expected to include BMW’s Easy Ride Clutch system for improved low-speed and off-road control. Positioned in the growing sub-500 cc adventure segment, the F 450 GS is expected to be priced above ₹5 lakh (ex-showroom), targeting riders seeking a premium yet compact adventure motorcycle. News.Az is an Azerbaijani informational-analytical news portal that publishes a wide range of content, including analytical materials, 
												in-depth articles, insightful commentaries, and the latest news. © 2009-2026							NEWS.AZ | Any use of materials is allowed only if there is a hyperlink to News.Az. All rights are reserved.",https://news.az/news/bmw-f-450-gs-set-for-india-launch-on-april-23
GS,2026 Mazda CX-5 GS comparison - The Car Guide - Le Guide de l'auto,2026-04-09 08:10:15,"Don't miss any updates.Sign up for our newsletter now! Please select at least another vehicle, then click Compare. Sign up for the Car Guide Newsletter to get the latest updates, road test drives, and expert analyses on the best car buys.",https://www.guideautoweb.com/en/new-cars/compare/52759/
