ticker,title,date,content,url
GS,Thermo Fisher Scientific Launches Gibco CHOvantage GS Cell Line Development Kit To Accelerate Biologics Development - BioPharma APAC,2026-04-03 01:29:15,"Gibco™ CHOvantage™ GS Cell Line Development Kit delivers high productivity, streamlined timelines and royalty-free, clinical stage licensing options to support scalable manufacturing. Gibco CHOvantage GS Cell Line Development Kit delivers high productivity, streamlined timelines and royalty-free, clinical-stage licensing options to support scalable manufacturing Thermo Fisher Scientific Inc., the world leader in serving science,  announced a next-generation, integrated cell line development platform that enables biologics developers to accelerate time to clinic while maintaining regulatory confidence and commercial scalability. Global pipelines for protein therapeutics, including complex biologics and biosimilars used to treat conditions ranging from cancer to autoimmune and rare diseases, continue to expand. This growth is placing increasing pressure on manufacturers to shorten time to clinic, improve manufacturing consistency and control cost of goods without compromising quality or regulatory compliance. At the same time, regulatory agencies are placing greater emphasis on demonstrating product quality and comparability to innovator molecules. The Gibco™ CHOvantage™ GS Cell Line Development (CLD) Kit enables researchers to generate high-performing, CHO cell lines, achieving protein titers of ≥7 g/L in fed-batch cultures, establishing stable pools in as little as four weeks, and supporting selection of stable clones within 14 weeks, helping to streamline progression from early development to commercial manufacturing. “Biologics developers face increasing pressure to deliver therapies faster while managing cost, quality and regulatory complexity,” said Sara Henneman, vice president and general manager of Thermo Fisher Scientific’s cell culture and cell therapy business. “With the CHOvantage GS CLD Kit, we’re helping customers compress development timelines, increase confidence in quality and lower overall costs through a royalty-free, clinical-stage licensing model that helps minimize barriers to market. This platform reflects our commitment to simplifying and standardizing biologics development workflows from research through commercial production.” Patent expirations are accelerating the development of lower-cost biosimilar medicines, increasing demand for reliable and scalable technologies that can help manufacturers bring these treatments to market more quickly while maintaining strict quality and regulatory standards. Integrated development platforms can help simplify complex manufacturing processes, shorten development timelines and support consistent large-scale production. “The CHOvantage GS CLD Kit is our newest example of how we are advancing cell line productivity and process consistency across the biologics lifecycle,” said Andy Campbell, senior director of research and development at Thermo Fisher Scientific. “By integrating a transposon-based vector system with our Efficient-Pro media and feeds, we’re giving customers a reliable, high-quality, streamlined platform that helps to save time, reduces variability and supports scalability. Importantly, this harmonized workflow is designed to simplify tech transfer and enable a smoother transition from development to manufacturing.” BioFactura (a developer and manufacturer of high-value biosimilars and novel drugs) was a key pre-launch testing partner for the Gibco CHOvantage GS Cell Line Development Kit. Lead Cell Line Development Scientist Carson Brackna stated, ""Combining transposon vectors and optimized media and feeds, the CHOvantage platform offered a robust, end-to-end cell line package while remaining user-friendly and yielding quality protein with high productivity on a tight schedule.” Simplified Licensing, No Clinical-Stage RoyaltiesMany cell line development systems require royalties or milestone payments during the clinical stage. The CHOvantage GS CLD Kit includes research-use rights with purchase, avoiding these common fees during development. Royalty-free, clinical-stage licensing options provide greater cost predictability and commercial flexibility, enabling a more seamless transition from development through full-scale production. Turning Frontline Reality Into Policy Action For Cancer Care In Asia Closing Asia’s Cancer Evidence Gap Through Translational Science And Policy Leadership China Originated Innovation Is Rising. Global Expectations Are Rising Even Faster. Sign up to our free newsletter and get the latest news sent direct to your inbox Lost your password? Please enter your email address. You will receive a link to create a new password.",https://biopharmaapac.com/news/28/7775/thermo-fisher-scientific-launches-gibco-chovantage-gs-cell-line-development-kit-to-accelerate-biologics-development.html
GS,"Special Stock Report: GS Yuasa (5.01% → 3.08%) Nomura Securities, etc. - moomoo.com",2026-04-03 00:46:00,"To create a seamless experience and for website quality and improvement purposes, we use cookie technologies for verification and quality purposes, to personalize the content presented, and to provide advertising that may be of specific interest to you. Learn our Privacy Policy here. ＜保有目的＞            証券業務に係る商品在庫、及び累積投資業務の運営目的として保有している。 ＜担保契約等重要な契約＞消費貸借契約により、野村アセットマネジメント株式会社から400,000株 借入れている。 消費貸借契約により、ノムラ　インターナショナル　ピーエルシー（ＮＯＭＵＲＡ　ＩＮＴＥＲＮＡＴＩＯＮＡＬ　ＰＬＣ）へ142,072株、機関投資家へ246,300株 貸出している。 【提出者／２】          ノムラ　インターナショナル　ピーエルシー（ＮＯＭＵＲＡ　ＩＮＴＥＲＮＡＴＩＯＮＡＬ　ＰＬＣ） ＜担保契約等重要な契約＞消費貸借契約により、野村證券株式会社から142,072株、機関投資家等から276,000株 借入れている。 ＜担保契約等重要な契約＞消費貸借契約により、野村證券株式会社へ400,000株、三菱ＵＦＪモルガン・スタンレー証券株式会社へ100株 貸出している。 Submitted Document: Amendment Report (Special Case Target Shares) (Cover Page = Amendment Report NO. 1) Reason for Filing Amendment Report: A decrease of more than 1% in the holding ratio of shares and similar securities. The shares are held for the purpose of managing inventory related to securities operations and cumulative investment activities. Under a securities lending agreement, 400,000 shares have been borrowed from Nomura Asset Management Co., Ltd. Under a securities lending agreement, 142,072 shares have been lent to Nomura International PLC (NOMURA INTERNATIONAL PLC) and 246,300 shares to institutional investors. Held for the purpose of maintaining inventory of products related to securities operations. Under a securities lending agreement, 142,072 shares have been borrowed from Nomura Securities Co., Ltd. and 276,000 shares from institutional investors and others. Under a securities lending agreement, 60,487 shares have been lent to institutional investors and others. This will be an addition to the list of co-holders. Submitter/Third Party: Nomura Asset Management Co., Ltd. Under a securities lending agreement, 400,000 shares have been lent to Nomura Securities Co., Ltd. and 100 shares to Mitsubishi UFJ Morgan Stanley Securities Co., Ltd. This news is an excerpt and edited version of certain items based on the XBRL submitted by the filer to the Financial Services Agency's EDINET. The content is a direct reproduction of the XBRL data. Use the share button in your browser  to share the page with your friends Investment products and services are offered through Moomoo Financial Inc., Member SIPC./FINRA. For further information about Moomoo Financial Inc., please visit Financial Industry Regulatory Authority (FINRA)’s BrokerCheck. Options trading entails significant risk and is not appropriate for all customers. It is important that investors read Characteristics and Risks of Standardized Options before engaging in any options trading strategies. Options transactions are often complex and may involve the potential of losing the entire investment in a relatively short period of time. Certain complex options strategies carry additional risk, including the potential for losses that may exceed the original investment amount. Supporting documentation for any claims, if applicable, will be furnished upon request. $0 commission trading is available only to U.S. residents trading in the U.S. markets through Moomoo Financial Inc. Other fees may apply. For more info, visit moomoo.com/us/pricing Investing involves risk and the potential to lose principal. Electronic trading also involves risks. The responsiveness of the trading system may vary due to market conditions, system performance, and other factors. Account access and trade execution may be affected by factors such as market volatility. Investment products are not insured by the FDIC, not a deposit, and may decline in value. The services and products offered on the website are subject to applicable laws and regulations, as well as relevant service terms and policies. The services and products are not available to all customers or in all geographic areas or in any jurisdiction where it is unlawful for us to offer such services and products. Company Address：Moomoo Financial Inc. and Moomoo Technologies Inc, 185 Hudson St Ste. 2600, Jersey City, NJ 07302 Copyright © 2026 Moomoo Technologies Inc. All Rights Reserved.",https://www.moomoo.com/news/post/67868130/special-stock-report-gs-yuasa-5-01-3-08-nomura?level=1&data_ticket=1775265334837091
GS,"AXIL GS Extreme 3.0: Little Changes, Big Improvement [Review] - Pew Pew Tactical",2026-04-02 21:48:48,"We’ve built dozens of AR’s and we’ll cover all the best AR-15 upgrades such as handguards, triggers, BCGs, gas blocks, and more. Learn all the important stuff about handguns...with none of the attitude. Get proficient on YOUR time. The AXIL GS Extreme 3.0 is better than its predecessor in three key ways: it fits better, the audio quality is better, and the battery lasts longer. This is the best version yet, and it’s further evidence that steady refinement is the way to go when it comes to product development. The best products usually aren’t the result of catching lightning in a bottle, but consistently making small improvements over time. Just look at the new Glock Gen 6 pistols or the current Porsche 911 to see what I mean. AXIL’s GS Extreme hearing protection is another example. The first generation introduced Bluetooth ear pro that was tethered side to side. The subsequent release made significant improvements to functionality. Now, AXIL GS Extreme 3.0 ear pro is on the scene, touting ergonomic and technological updates. Is this shooters’ best in-ear hearing protection of the year? Here’s my take after live-fire testing at the range and a few bonus tests around the house. AXIL’s GS line goes back several years to the original Ghost Stryke (hence the GS name). Back in 2020, early reviews praised the comfort of electronic in-ear hearing protection, but the early model wasn’t without its drawbacks. I remember the earbuds falling out from time to time, and the electronics were susceptible to glitchy behavior. Eventually, mine kicked the bucket. In 2023, AXIL launched the next generation. In our AXIL GS Extreme 2.0 review, Pew Pew Tactical Content Producer & Lead Review Analyst Sean Curtis praised the updated earbuds for being compact, cool, and effective. It seemed like AXIL sorted out the early teething problems often associated with new products. Now, AXIL offers the GS Extreme 3.0 with improved ergonomics, more battery run time, and updated software. These tethered earbuds sit alongside the totally wireless AXIL XCOR PRO, which will set you back about $80 more. I currently use the XCOR PRO for everything from range days and yardwork to virtual meetings, so I was curious to see how the new GS Extreme 3.0 compares. At the time of writing, AXIL still offers the GS Extreme 2.0. The outgoing model is marked down to $99.99 compared to $119.99 for the GS Extreme 3.0, but its MSRP is actually higher – $199.99 compared to $184.60. After spending some time with the AXIL GS Extreme 3.0 on and off the range, here’s what I learned. My live-fire testing consisted of a full range session using 5.56 NATO and 9mm ammo. For a portion of this time, I was also testing a bunch of rifle slings. This gave me a great opportunity to see how well the GS Extreme 3.0 stayed put when I was switching slings and getting in and out of my plate carrier. In this clip, I hadn’t even bothered to wrap the cord over my ears and the earbuds still stayed in place. I’m happy to report that this ear pro was easy to set up and use, and it didn’t get knocked out of my ears during testing. Three points of contact per earbud (the ear tip, ear hook, and moldable cable) make them very secure. The touchpoints responded when I was wearing shooting gloves, even if they weren’t touchscreen compatible. That’s really handy, because it would be a nuisance to have to peel my gloves off every time I wanted to adjust ambient volume. Right away, I also noticed improved audio quality. AXIL might have made this update for listening to music via Bluetooth, but both firearms took on a more pleasant boom than a tinny crack each time I fired. Maybe I’m an audiophile, but that made a difference in overall enjoyment over the course of a range day. Beyond that, AXIL did a great job of knocking down harmful volume spikes to a claimed maximum of 85 decibels while boosting more subtle sounds. When I loaded magazines, rummaged around in my range bag, and even adjusted settings on my camera, I was able to hear little clicks and scrapes that kept me in tune with what I was doing. One common bugaboo with shooting ear pro is that certain stocks have a habit of knocking them out of place with recoil. For some reason, my hunting rifle seems to do that. The GS Extreme 3.0 leaves the entire cheek area below and forward of the ear exposed, making room for the stock to move around without dislodging the earbuds. In addition to using the AXIL GS Extreme 3.0 as shooting hearing protection, I also wore this ear pro around the house to attend remote meetings, listen to music and podcasts, and work with power tools. When it comes to active hearing protection, ergonomics breaks down into two categories: how comfortable they are, and how easy the controls are to use. One thing I noticed about previous generations of GS hearing protection is that the weight of the tether tugged on the earbuds enough that they’d make my ear canals sore over the span of a training session. AXIL solved that problem by adding soft, rubber hooks that hold the earbud in place using the antihelix (the prominent ridge in your outer ear) for support. There are three sizes to choose from, so you should be able to find something that works for you. There are also two types of ear tips: silicone and foam. I found the silicone tips easier to put in and take out of my ears, but they didn’t offer as much protection. For shooting, I recommend taking an extra second to squish down the foam inserts and get a better seal inside the ear canal. Between the hooks and the dense foam plugs, I had more than enough support to make the GS Extreme 3.0 feel weightless for the duration of lengthy shooting sessions. I love the simplicity of standalone earbuds like the AXIL XCOR PRO, but I have to admit I get confused by the controls from time to time. When every function requires a sequence of taps and holds, it’s easy to get lost in the invisible controls. The GS Extreme 3.0 simplifies things with physical buttons on the control stick for power, pairing, and Bluetooth volume. There’s also a light that indicates when the unit is pairing, low on power, or charging. Ambient hearing and volume is still accessed with touchpads on the earbuds. I love being able to control Bluetooth and ambient volume separately, especially with dedicated controls for each. As a piece of personal protective equipment, the AXIL GS Extreme 3.0 earned a thumbs-up during my testing. My critiques are centered around audio quality, which admittedly isn’t AXIL’s primary focus. The improved bass is much appreciated, but trebles lack definition and that constant ambient hiss is a little distracting. I think the XCOR PRO has more refined audio quality. If AXIL can close that gap, I might reach for the GS Extreme 3.0 for travel and gym duty instead. The AXIL GS Extreme 3.0 earbuds are good for most types of shooting, but I think they’re particularly useful for shooting outdoors. They’re pretty handy for home improvement projects and yardwork, too. When I shoot certain rifles in certain positions (my hunting rifle, in particular), there are times when earmuffs get knocked off my ears just in time to subject me to painful ringing. In-ear hearing protection typically solves that problem as long as I’ve chosen the right inserts. The problem with most earbuds is that they’re very easy to lose. If I’m shooting with a group or hunting, it’s nice to be able to pop my ear pro in and out without worrying about dropping it or having the foam tips fall off in my pocket. Between the tether and the more tactile controls on the GS Extreme 3.0, this hearing protection is much more field-friendly than a lot of in-ear hearing protection. That said, there are people who should look elsewhere. If you primarily shoot indoors, I recommend doubling up with old-school foamies and a pair of active earmuffs. Gunshots are drastically more harmful to your hearing in a concrete box than they are in an open landscape, and most hearing protection is going to struggle on a busy indoor firing line. That’s not a knock against AXIL or anyone else, it’s just the reality of shooting in an echo chamber. I experienced no reliability issues during testing. The addition of ear hooks is a small but very significant update. I remain a fan of separate control interfaces for ambient and Bluetooth volume. Gunshots and Bluetooth audio sounded great. I still don’t like the constant hiss from the ambient audio signal. AXIL provides three sizes of ear hooks, silicone tips, and six sizes of foam tips. This should create enough combinations for everyone to get a perfect fit. The GS Extreme 3.0 is a great do-it-all option. Use it for shooting, chores, and listening to music while traveling. This is a great option for people who shoot outdoors and want active, Bluetooth-equipped hearing protection. ShellShock Protection EXO Passive Earmuff I typically recommend foam earplugs and active earmuffs for shooting indoors, but I suppose you could reverse that recipe. If you love the AXIL GS Extreme 3.0 for everything else, you could also pair them with inexpensive, passive earmuffs for occasional indoor use. Electronic ear pro only works if the battery is charged, and I’d be lying if I said I’ve never had a battery tap out in the middle of a training session. If you find yourself doing a lot of all-day shooting events, having a power bank in your range bag will let you top off your battery over lunch or during a few minutes of downtime. To get a feel for everything this ear pro offers, I tested the AXIL GS Extreme in a variety of settings. This gave it a chance to shine and expose any shortcomings. This is, first and foremost, shooting hearing protection for you and me. I took the AXIL GS Extreme 3.0 to the range for some training with a 9mm pistol and an AR-15 chambered for 5.56 NATO – no suppressors allowed, this time. In addition to shooting, I used the GS Extreme 3.0 around the house. There’s always some kind of project going on around here, so I used this hearing protection while using a circular saw, impact driver, and lawnmower. Last but not least, I paired the GS Extreme 3.0 with my phone to listen to podcasts, crank up tunes in the gym, and make phone calls. This article comes to you from editor and senior review analyst Scott Murdock. In addition to his military and civilian shooting experience, Scott has extensive experience testing and reviewing hearing protection. That includes active, passive, over-ear, and in-ear products in a wide range of testing environments. While most of Scott’s shooting is solo and outdoors, he also brings ear pro to indoor shooting ranges and group settings to evaluate its performance. Editor-in-Chief Jacki Billings runs our experienced team of reviewers and edited this review. She is an NRA-certified Basic Pistol Instructor as well as a member of the Society of Professional Journalists, ACES: Society for Editing, and the Professional Outdoor Media Association. Jacki has a bachelor’s degree in journalism and has worked as a media professional for close to 20 years, specializing in gun media for almost 10 years. With 2,000+ articles to her name, she uses her professional journalism and editing experience to set testing protocols and editorial standards for Pew Pew Tactical. The AXIL GS Extreme 2.0 was good, but the GS Extreme 3.0 is better. AXIL is making steady progress where it counts, and the fact that they’re doing it without a spike in price is very encouraging. This is a great option for people who want one set of earbuds for everything – shooting, chores, working out, and just listening to music on the go. What’s your current go-to hearing protection? Let us know in the comments. Looking for more great protective gear? Check out our guide to the Best Shooting Glasses! [Review] Benelli M4 EXT: Better Than the Original? New Product Highlight: Osight XR Enclosed-Emitter Pistol Red Dot New Product Highlight: AT3 Tactical Nano Polymer Micro Red Dot Best Comped Pistols: Gimmick or Must-Have Upgrade? Scott Murdock is a Marine Corps veteran with a basic working knowledge of shooting, written English, and photography. He's passionate about helping readers find quality gear that's worthy of their money. You can find more of his work at Task & Purpose, Free Range American, and Outdoor Life. Subscribe to Pew Pew Tactical's sales and deals email. I purchased a set of these hearing protectors and no matter what I do, they will not link to my cell phone. This product does not fit everyone.  I purchase a set and the constantly work loose. It's not the product it is my ear shape. The foam tips are not long enough for everyone so check that as soon as you make a purchase so you can possibly return them. Also, I've worked with hearing protection longer than axil has been in business so I am well versed in how to properly use all types. I add this because when you call axil with a fit question they will assume you don't know how to wear hearing protection. I must add that I love the product concept and use mine like an ear bud but never for hearing protection. Get Our Top Shooting Drills and Zeroing Targets ($47 value - but FREE for a limited time). And stay in touch with newsletters of our best articles on techniques, guns, & gear. I may earn a small part of the sale from links to any products or services on this site. You do not pay
                anything extra and your
                purchase helps support my work in bringing you more awesome gun and gear articles. Copyright © 2026 Pew Pew Media, Inc. All rights reserved. We hate SPAM and promise to keep your email address safe.",https://www.pewpewtactical.com/axil-gs-extreme-3-0-review/
