ticker,title,date,content,url
GS,2027 BMW F 450 GS First Ride - Cycle World,2026-04-02 20:50:54,"Right now is a great time to be in the market for a sub-500cc lightweight adventure motorcycle. Dealerships are flush with choices, and you’d be happy with most of the latest generation of these small-displacement travel motos. But what about if you are a BMW Motorrad fan? BMW’s G 310 GS is long in the tooth, but the 2027 F 450 GS is just on the horizon and headed to US shores November 2027. Should you hold onto your dollars until it arrives or run down to the dealer to place your pre-order deposit? We headed to Sicily to find out. BMW has not announced the price for the F 450 GS, so making a determination of value for dollars is not entirely possible. We do know that in the UK it will start at £7000 and is £7760 for the most expensive Trophy Edition, that’s $9300 to $10,275 in a straight currency conversion, but other factors could make that number higher or lower. That is a premium price tag, but can the as-standard features make the spend a reasonable proposition? A 420cc DOHC parallel-twin engine features a 135-degree crank—an outlier in a segment flush with 270-degree twins. But why a 135-degree instead of the seemingly ubiquitous 270 crank pin spacing? BMW says the 135 not only gives the engine a unique tone that is a bit rumbly and bumbly while delivering a strong-for-the-displacement claimed 48hp and 32 ft.-lb. of torque but it also creates a smooth engine using a single balancer shaft. And there is no misrepresentation there from BMW. The first thing you notice is the engine feel and tone is unique but not entirely dissimilar to a 270-degree configuration, but there’s less gruffness or V-twin-like character. Roll on the throttle and the power is strong right of the bottom and pulls with authority all the way to the redline. There are a couple points in the rpm range where the output is more immediate– around 6000 things really get cooking. Smoothness down low mutes the character a bit and past 7000 rpm it gets a bit buzzy on the road. But overall I found myself describing the power as electric-like during conversations: immediate and strong for a small-displacement parallel-twin. That immediacy not only works for lofting the 19-inch front wheel over bumps and holes when off-roading, but it’s got plenty of oomph to make passes on the highway without worry of running out of steam. It’s a flexible powerplant, and that is what BMW is looking for in any of its GS models. According to Astrid Neudecker, product manager of the F 450 GS, it had to be a real GS. “A GS is the best of both worlds” said Neudecker explaining the role of the F 450 GS. “So we have a solid off-road performance combined with maximum stability, agility and comfort on the road.” Complimenting the solid engine performance is BMW’s full suite of electronic rider aids. This area is where some of the 450 GS’s competition have scaled back, but not BMW. There are three standard ride modes (Rain, Road, Enduro) and an Enduro Pro mode that comes on the three of the four available variants. Each is packed with all the same acronyms found on bigger GS models that affect braking and traction: ABS Pro, DBC (Dynamic Brake Control), DTC (Dynamic Traction Control), and MSR (Motor Slip Regulation), BMW’s version engine drag torque control. Each electronic rider aid is tailored to one of the ride modes with highest levels of intervention in Rain and the least in Enduro Pro. You can also completely turn off DTC via a button on the left switch pod. Modes are selected on the left. You can also customize each mode’s attributes via the very same 6.5-inch Bluetooth connected TFT dash found on the R 1300 GS. Also, on the left outboard of the switch pod is BMW’s scrolling multi-function controller wheel. All of this is indicative of the feature set expected from a GS. One feature not found on any other GS is BMW’s Easy Ride Clutch. This centrifugal clutch system eliminates the need to use the clutch lever to shift, stop, or start. Traditional modulation of the clutch is still active after the centrifugal section of the clutch locks up. It also stays locked on deceleration or coasting on downhills, while the slipper function is active. It’s quite a unique construction and it took an explanation over a post-ride dinner with BMW’s F 450 GS chief engineer, Claudio de Martino. Basically a centrifugal unit with weighted ramps is the first layer inside the clutch drive basket. This unit pushes against two fiber clutch plates separated by a steel plate which then in turn pushes against the main clutch pack carrier or “hub” that houses the rest of the clutch plates and the slip/assist parts. The centrifugal clutch engages or “locks up” at 2800 rpm, and once that happens the unit acts like any other manual clutch. When the rpm returns to idle, the centrifugal section disengages the entire hub. While riding the Easy Ride Clutch is, well, easy to use. You only need to pull in the clutch one time to engage first gear and then you don’t need to use the lever again. BMW’s Shift Assistant Pro provides clutchless upshifts and downshifts, completing the auto-clutch equation. Just click away through the tight transmission. If you have big feet you will find the shift lever to be short and will make for the occasional missed upshift. On the road, getting away from lights and stopping for traffic is worry-free and simple. Just remember to downshift when you come to a stop. If you don’t, the bike will remind you. The ERC is a no-brainer if you are spending most of your time on asphalt. Off-road, the benefit is a bit more nuanced. For a beginner who’s worried about stalling, the ERC is a clear advantage. For more experienced riders, there are situations where the centrifugal feature hinders feel and control. As part of complying with Euro 5+ emissions, the F 450 GS has to run 1500 rpm at idle, and for a margin of safety the centrifugal clutch locks up at 2800 rpm. That means there’s no riding the clutch at slow speeds and low rpm in that 1300rpm-wide dead zone. The bike just won’t move forward. And if you want to ride the friction zone, you have to rev the bike to 3000 rpm or more. Not ideal in this specific situation. But that begs the question: why make the Easy Ride Clutch standard the most dirt-ready of the F 450 GS, the Trophy Edition? It can be assumed that it is the model that more accomplished riders would gravitate toward and may find issue with the clutch-engagement “dead zone.” For the other three variants (Base, Exclusive, and Sport) the ERC is optional. It’s a slick system that makes the bike easier to operate in most situations. Both the Sport and GS Trophy variants we tested are equipped with Sport suspension that provides adjustment for compression and rebound damping on the 43mm KYB fork and a monoshock adjustable for spring preload and rebound. Both ends stroke through 180mm or 7.1 inches. Action on the road is fairly firm even for my geared-up 240-pound frame. You will feel the nastier potholes and pavement seams. But that suspension provides excellent holdup during braking and cornering. In the dirt, the suspension is firm enough to allow a quick pace as long as you don’t hit big g-outs or jumps. Damping and spring rate is spot on for its intended mission as a BMW ADV. It stops short of hardcore shredding. A true GS should be just as good on-road as it is off, and this is a true GS. On-road handling is quick and light, the bike entering corners with the slightest effort. Standard Maxxis Maxx Pro ADV tires wrap cast-aluminum wheels, 19-inch in front and 17-inch at the rear. This wheel size is ideal for street work, however the standard tires on cold, wet roads exhibit a tendency to flop into the corners, resulting in less front-end confidence. No such issues on the accessory Metzeler Karoo 4 tires. Off-road testing in Sicily consisted of some sandy beach roads and muddy mountain paths strewn with large, unyielding rock patches. When the going gets soft, the 19-inch front wheel—even with the chunkier Karoo 4s and spoked wheels—knifes or pushes depending on the amount of throttle application. On flowing dirt fire roads the 450 GS is a blast, sliding predictably. Its 392-pound wet weight feels less than that, and the wide handlebar and enduro footpegs allow you to toss the bike around with ease. Braking performance is quite good. The front brake is half of an R 1300 GS with a single 310mm disc mated to a four-piston Brembo monoblock caliper. Feedback is excellent through the adjustable lever (the clutch lever is also adjustable) and the ABS Pro works well on all surfaces without intervening too early. In the dirt, Enduro Pro removes ABS from the 240mm rear disc and single-piston caliper, allowing for full lock up. Actuation is abrupt on the rear, but not quite what we’d call lightswitch. Sat behind the bars on the F 450 GS at 6000 rpm at 65 mph, wind protection on the Sport is passable but once speed move past that, buffeting and windblast is significant. The shorter, tinted screen on the Trophy is even less comfortable on the highway. The rest of the ergonomics are classic BMW: comfortable and roomy with well-sorted touch points. Seat height is a claimed 33.3 inches which isn’t particularly low for a small adventure motorcycle; there is an accessory low seat that brings that number down to 32.6 inches. This F 450 GS, despite being one of the smaller units on offer from the brand, has the fit and finish on the level with the $30K-plus R 1300 GSA. BMW’s goal of striking an equal balance of on- and off-road performance is highly successful overall. On the road it’s a comfortable, stable, yet easy-to-handle motorcycle with an impressive feature set that even includes heated grips, the very same dash that’s on the big models, and multiple, customizable ride modes. And when the road ends, the Sport suspension handles just about anything you throw at it. So should you wait? For anyone who is a BMW fan or looking to get into the brand, it’s a resounding yes. If you want a premium, well-built small ADV that delivers value via an impressive host of electronics and exceptional fit and finish, absolutely. And for those shopping the many choices in the lightweight ADV segment, it all depends how much patience (and likely budget) you can muster. What’s that saying about good things and waiting? Jacket: Alpinestars Maxdura Drystar XF Laminated Armored Shell Many products featured on this site were editorially chosen. Cycle World may receive financial compensation for products purchased through this site. Copyright © 2026 Cycle World. An Octane Media, LLC Publication. All rights reserved. Reproduction in whole or in part without permission is prohibited. These cookies enable the website to provide enhanced functionality and personalisation. They may be set by us or by third party providers whose services we have added to our pages. If you do not allow these cookies then some or all of these services may not function properly. These cookies allow us to count visits and traffic sources so we can measure and improve the performance of our site. They help us to know which pages are the most and least popular and see how visitors move around the site. All information these cookies collect is aggregated and therefore anonymous. If you do not allow these cookies we will not know when you have visited our site, and will not be able to monitor its performance. These cookies are necessary for the website to function and cannot be switched off in our systems. They are usually only set in response to actions made by you which amount to a request for services, such as setting your privacy preferences, logging in or filling in forms. You can set your browser to block or alert you about these cookies, but some parts of the site will not then work. These cookies do not store any personally identifiable information. These cookies may be set through our site by our advertising partners. They may be used by those companies to build a profile of your interests and show you relevant adverts on other sites. They do not store directly personal information, but are based on uniquely identifying your browser and internet device. If you do not allow these cookies, you will experience less targeted advertising.",https://www.cycleworld.com/motorcycle-reviews/bmw-f-450-gs-first-ride/
GS,MLB DFS Picks: Starting Pitcher Rankings for Thursday 4/2/26 - DraftKings Network,2026-04-02 15:30:00,"Cole Ragans, Taj Bradley and Reynaldo Lopez highlight a lighter slate of MLB action. Sam Connon shares his DFS pitcher rankings, highlighting which aces could be worth a big chunk of your budget on Thursday. After a full week of jam-packed slates, the MLB schedule is a little lighter Thursday. But even if there are only six teams in action while the rest of the league is traveling, there is no better time to dive right into the action. Pitchers are already ranked by price, with the ones who are projected to perform better eating up more of your budget, but I am here to add my two cents. I’ll be sharing my own rankings for the top six starting pitchers for DFS in the three-game Thursday afternoon contest. Set your DraftKings fantasy baseball lineups here: MLB $150K Walk-Off Home Run ($50K to 1st) 2025 Stats: 32 G, 32 GS, 182.1 IP, 11-8, 3.65 ERA, 1.21 WHIP, 186 K, 73 BB, 2.2 WAR2026 Stats: 1 G, 1 GS, 5.1 IP, 0-1, 3.38 ERA, 0.94 WHIP, 4 K, 0 BB, 0.0 WAR2026 FanGraphs Projections: 30 G, 30 GS, 173.0 IP, 10-11, 4.14 ERA, 1.30 WHIP, 182 K, 66 BB, 1.7 WAR (Steamer) 2025 Stats: 13 G, 13 GS, 61.2 IP, 3-3, 4.67 ERA, 1.18 WHIP, 98 K, 20 BB, 2.1 WAR2026 Stats: 1 G, 1 GS, 4.0 IP, 0-1, 9.00 ERA, 2.50 WHIP, 5 K, 4 BB, -0.3 WAR2026 FanGraphs Projections: 28 G, 28 GS, 165.0 IP, 11-8, 3.32 ERA, 1.19 WHIP, 205 K, 63 BB, 3.8 WAR (Steamer) 2025 Stats: 30 G, 30 GS, 168.2 IP, 9-6, 4.22 ERA, 1.37 WHIP, 150 K, 65 BB, 3.1 WAR2026 Stats: 1 G, 1 GS, 5.1 IP, 0-0, 0.00 ERA, 1.50 WHIP, 3 K, 2 BB, 0.1 WAR2026 FanGraphs Projections: 28 G, 28 GS, 163.0 IP, 11-9, 3.61 ERA, 1.35 WHIP, 146 K, 64 BB, 2.2 WAR (Steamer) 2025 Stats: 27 G, 27 GS, 142.2 IP, 6-8, 5.05 ERA, 1.31 WHIP, 127 K, 56 BB, 1.8 WAR2026 Stats: 1 G, 1 GS, 4.1 IP, 0-0, 2.08 ERA, 1.38 WHIP, 9 K, 3 BB, 0.2 WAR2026 FanGraphs Projections: 33 G, 24 GS, 138.0 IP, 8-9, 4.12 ERA, 1.31 WHIP, 141 K, 51 BB, 1.9 WAR (Steamer) 2025 Stats: 1 G, 1 GS, 5.0 IP, 0-0, 5.40 ERA, 2.20 WHIP, 1 K, 2 BB, -0.1 WAR2026 Stats: 1 G, 1 GS, 6.0 IP, 0-0, 1.50 ERA, 0.83 WHIP, 3 K, 2 BB, 0.0 WAR2026 FanGraphs Projections: 33 G, 23 GS, 145.0 IP, 9-8, 4.09 ERA, 1.30 WHIP, 146 K, 52 BB, 1.7 WAR (Steamer) 2025 Stats: 33 G, 23 GS, 154.0 IP, 0-0, 3.39 ERA, 1.07 WHIP, 132 K, 41 BB, 2.0 WAR2026 Stats: 1 G, 1 GS, 4.2 IP, 0-0, 7.71 ERA, 1.07 WHIP, 4 K, 3 BB, -0.2 WAR2026 FanGraphs Projections: 36 G, 27 GS, 157.0 IP, 9-10, 4.30 ERA, 1.32 WHIP, 134 K, 47 BB, 1.5 WAR (Steamer) Sam joined DraftKings in 2025 following five years with Sports Illustrated’s “On SI” network. He has covered the UCLA Bruins, New England Patriots, Tampa Bay Rays, MLB, MiLB and NBA, on top of earning awards from the Society of Professional Journalists and College Media Association during his time as a student at UCLA. All views expressed are my own. I am an employee of DraftKings and am ineligible to play in public DFS or DKSB contests. The Crown Is Yours: Sign up for DraftKingsopens in a new tab and experience the ultimate host for games and betting experiences! All odds and lines provided by DraftKings Sportsbook and are subject to change. Stan Son provides the latest injury status update for Pacers forward Pascal Siakam on Friday, April 3. DraftKings Network has you covered with the latest NBA injury report, news and top plays for Friday, 4/3/26. Check out the latest updates regarding Twins outfielder Byron Buxton’s injury status after he left Friday’s game against the Rays. Stan Son breaks down how the Lakers’ NBA championship odds are affected by the recent Luka Doncic injury. GAMBLING PROBLEM? CALL 1-800-GAMBLER, (800) 327-5050opens in a new tab or visit gamblinghelplinema.orgopens in a new tab (MA). Call 877-8-HOPENY/text HOPENY (467369) (NY).Please Gamble Responsibly. 888-789-7777/visit ccpg.orgopens in a new tab (CT), or visit www.mdgamblinghelp.orgopens in a new tab (MD).21+ and present in most states. (18+ DC/KY/NH/WY). Void in ONT. Eligibility restrictions apply. Terms: draftkings.com/sportsbookopens in a new tab. On behalf of Boot Hill Casino & Resort (KS). Pass-thru of per wager tax may apply in IL.",https://dknetwork.draftkings.com/2026/04/02/mlb-dfs-picks-starting-pitcher-rankings-for-thursday-4-2-26/
GS,GS Biomats signs major commercial partnership with packaging giant - World Bio Market Insights,2026-04-02 14:30:52,"Chinese bio-based materials company GS Biomats signed a kiloton-level supply agreement with Henan Yinjinda Group on March 26, marking one of the largest commercial deals for bio-derived plastic ingredients in Asia. The contract covers 2,5-Furandicarboxylic acid (FDCA), a chemical building block used to make bio-based plastics. FDCA can replace petroleum-derived components in packaging materials and fibers. GS Biomats specializes in furan-based chemicals and has developed continuous flow production processes for compounds including FDCA and 5-hydroxymethylfurfural (HMF). The company says its materials have already been commercialized in packaging, fibers, and aramid applications. Yinjinda Group is Asia’s largest manufacturer of PETG shrink film, a plastic material widely used in product labels and packaging. The company operates its own raw materials plants and four production lines, along with printing facilities and a research center. The partnership suggests bio-based materials are moving beyond pilot scale in China’s packaging sector. Yinjinda has been expanding into eco-friendly materials including biodegradable PETG and crystallizable PET. FDCA is derived from plant biomass rather than fossil fuels. While it offers a renewable alternative to conventional plastic ingredients, commercial adoption has been limited by production costs and scale constraints. The kiloton-level agreement represents a significant volume commitment. Please note: World Bio Market Insights is owned and operated by World Bio Markets Ltd.",https://worldbiomarketinsights.com/gs-biomats-signs-major-commercial-partnership-with-packaging-giant/
GS,TMO Stock May Gain From the Rollout of Gibco CHOvantage GS CLD Kit - Yahoo Finance,2026-04-02 12:00:00,"Tip: Try a valid symbol or a specific company name for relevant results Thermo Fisher Scientific TMO has launched its latest innovation, the Gibco CHOvantage GS Cell Line Development (“CLD”) Kit. This next-generation, integrated cell line development platform allows biologics developers to speed up time to clinic while maintaining regulatory confidence and commercial scalability. The development is expected to significantly boost the company’s cell culture and cell therapy business, part of its Life Sciences Solutions segment. After the announcement yesterday, TMO shares rose 0.6% to close the session at $494.54. The new Gibco CHOvantage GS CLD Kit reflects the company’s efforts to enhance cell line productivity and process consistency across the biologics lifecycle. The platform is designed to shorten development timelines, increase confidence in quality and reduce overall costs through a royalty-free, clinical-stage licensing model that helps minimize barriers to market. We expect the latest news to positively boost TMO stock’s performance. Thermo Fisher has a market capitalization of $182.6 billion. The company’s earnings yield of 5.02% favorably compares with the industry’s 0.9% yield. It surpassed earnings estimates in each of the trailing four quarters, delivering an earnings surprise of 2.8%. The global pipelines for protein therapeutics — including complex biologics and biosimilars to treat conditions ranging from cancer to autoimmune and rare diseases — continue to expand. As a result, manufacturers face heightened pressure to shorten time to clinic, improve production consistency and control costs while maintaining quality and regulatory compliance. Regulatory agencies are also increasing their focus on demonstrating product quality and comparability to innovator molecules. Thermo Fisher’s Gibco CHOvantage GS CLD Kit enables researchers to generate high-performing, CHO cell lines, achieving protein titers of ≥7 g/L in fed-batch cultures, establishing stable pools in as little as four weeks and supporting selection of stable clones within 14 weeks, helping streamline progression from early development to commercial manufacturing. Patent expirations are accelerating the development of lower-cost biosimilar medicines, increasing demand for reliable and scalable technologies that can help manufacturers bring these treatments to market more quickly while maintaining strict quality and regulatory standards. Integrated development platforms can help simplify complex manufacturing processes, shorten development timelines and support consistent large-scale production. Unlike many cell line development systems, the CHOvantage GS CLD Kit includes research-use rights with purchase and royalty-free, clinical-stage licensing options for greater cost predictability. According to Precedence Research, the global biologics market was valued at $487 billion in 2025 and is projected to expand at a CAGR of 9.8% through 2035. Rising prevalence and diagnosis of chronic diseases are driving demand for advanced diagnostics and treatment medications, supporting growth in this market. Comprehensive healthcare finance plans in some countries are expected to play a crucial role. Thermo Fisher recently introduced the Thermo Scientific Glacios 3 Cryo-TEM, a next-generation cryogenic transmission electron microscope (cryo-TEM) designed to help scientists understand structural biology with greater clarity and accessible in more lab environments than ever before. The innovation offers researchers the next major advancement in 200 kV imaging and structural analysis. Over the past 12 months, TMO shares have risen 5.2% compared with the industry’s modest 0.4% growth. Thermo Fisher currently carries a Zacks Rank #3 (Hold). Some better-ranked stocks in the broader medical space are Envista NVST, Globus Medical GMED and BrightSpring Health Services BTSG. Each of these sports a Zacks Rank #1 (Strong Buy) at present. You can see the complete list of today’s Zacks #1 Rank stocks here. Estimates for Envista’s 2026 EPS have increased 11.9% in the past 60 days. Shares of the company have surged 60.9% in the past year against the industry’s 20.5% decline. NVST’s earnings surpassed estimates in each of the trailing four quarters, the average surprise being 16.4%. In the last reported quarter, it delivered an earnings surprise of 18.8%. Globus Medical shares have risen 21.8% in the past year. Estimates for the company’s 2026 EPS have increased 11.2% to $4.46 in the past 30 days. GMED’s earnings beat estimates in three of the trailing four quarters and missed on one occasion, delivering an average surprise of 18.8%. In the last reported quarter, it posted an earnings surprise of 20.8%. BrightSpring Health Services shares have soared 136.4% in the past year. Estimates for the company’s 2026 EPS have jumped 20.1% to $1.61 in the past 30 days. BTSG’s earnings topped estimates in three of the trailing four quarters and missed on one occasion, delivering an average surprise of 40.4%. It has an estimated long-term earnings growth rate of 47.2% compared with the industry’s 14.5% growth. Want the latest recommendations from Zacks Investment Research? Today, you can download 7 Best Stocks for the Next 30 Days. Click to get this free report Thermo Fisher Scientific Inc. (TMO) : Free Stock Analysis Report Globus Medical, Inc. (GMED) : Free Stock Analysis Report Envista Holdings Corporation (NVST) : Free Stock Analysis Report BrightSpring Health Services, Inc. (BTSG) : Free Stock Analysis Report This article originally published on Zacks Investment Research (zacks.com). Tip: Try a valid symbol or a specific company name for relevant results",https://finance.yahoo.com/sectors/healthcare/articles/tmo-stock-may-gain-rollout-120000114.html
