ticker,title,date,content,url
GS,The Motorcycle You Keep For Life - Not Just A Few Years - Top Speed,2026-04-03 12:31:18,"Motorcycles are either bought for leisure or practical purposes, or even both, depending on where you live. Now, in both cases, people might develop an emotional connection that makes these motorcycles a forever companion. Along with the emotional angle, a blend of overengineered components for elevated reliability and features that won't make these bikes irrelevant in the near future is what completes a 'forever motorcycle'. Another criterion that helps one choose a motorcycle to keep for life is its do-it-all appeal. A motorcycle that can commute, tour, go off‑road, and handle occasional track days is clearly the full package. There is a wholesome list of motorcycles that one can keep for life. However, a specific BMW adventure tourer, with a long legacy of durability and capabilities, is what takes the spotlight for us. We delve deeper and elaborate on what makes BMW's flagship do-it-all ADV the only motorcycle you will need for life. From touring models to cruisers, all of these Harley-Davidson bikes are built to last. Features that define a forever motorcycle include legendary reliability, low-maintenance features like shaft drive, comfortable yet engaging ergonomics, robust and long-lasting suspension, and versatile performance for almost all riding conditions. Overengineered engines are a key feature here. Prime examples include the Yamaha TW200, the Suzuki DR650, the Honda Gold Wing, and the Kawasaki Vulcan S, among others. Engines that have been refined over the years have a very low failure rate and are further blessed with relatively affordable and easily available spare parts, if and when needed. The ease of mind that comes with breezy maintenance is crucial in transforming any motorcycle into one that a rider would like to keep forever. Adding to this, simple yet robust underpinnings also play an important role. However, there are exceptions where bespoke or unique chassis and suspension combinations that are far more complex have made the cut. A notable example of this is the Honda Gold Wing's lightweight die-cast aluminum twin-spar frame, which uses a double-wishbone front suspension and a Pro-Arm rear swingarm setup. A timeless design and emotional connection also contribute strongly to a forever motorcycle. This is where the heart comes into play. One who never gets enough of their gorgeous motorcycle and keeps looking back at it after parking every single time is the type of motorcyclist who will keep a machine forever. Since love for design is subjective, there is no rational approach here. The emotional connection is further deepened when a motorcycle becomes part of the rider's life stories, enduring challenges, and serves as a source of joy and peace. There is no consideration for size, performance, price, or technology features here. The ""spark"" is what matters, be it the outdated Kawasaki KLR650 or the expensive and wicked-fast BMW S 1000 RR. This is BMW's flagship adventure bike, and it has a lot riding on it since it replaces the coveted R 1250 GS. The 1250 was already a near-perfect motorcycle, and so BMW has not fiddled much with the formula here. With the R 1300 GS, BMW has refined and expanded on the top-spec GS's do-it-all character. The R 1300 GS is lighter, more powerful, sleeker, and packed with more technology and capabilities. With a starting price of $20,395, it's a premium motorcycle, but the extensive list of features makes it worth every cent. The engine is a tried-and-tested mill, with versatility as its standout feature. Its ADV construction makes the R 1300 GS a very comfortable touring motorcycle, owing to its upright rider triangle and wind protection. Off-roading duties are better than before thanks to its redesigned chassis and suspension combo. Bundling all of its capabilities together is a strong suit of advanced technology features that emphasize comfort, safety, and convenience. While Japanese bikes dominate the list, we have two American adventure bike surprises for you here The BMW GS lineup is renowned and popular because it scores highly for reliability, fun factor, and sheer ability. BMW's GS nameplate has been around for 46 years. It started as BMW's premier off-roading series and slowly evolved into the go-anywhere motorcycle it is today. There are a few distinguishing features that have stayed consistent on the BMW GS—namely, the boxer-twin engine, a final shaft drive, and the iconic and rugged ""flyline"" design language. All of these features have evolved and remain as relevant on the 2026 R 1300 GS as they were on the iconic R80 G/S. The 1,300 cc mill on the new R 1300 GS is BMW's most powerful boxer-twin engine yet. This engine is an evolution of the outgoing 1250, which has been bumped up in displacement and made more versatile with variable valve timing on the intake valves. This engine has a short-stroke design and a high compression ratio of 13.3:1. It produces 145 horsepower at 7,750 RPM and 110 pound-feet of torque at 6,500 RPM. Contributing strongly to its do-it-all is a ""sublime spread of torque"" that makes it comfortable at low speeds, composed on the highways, and confident when pushed hard on all surfaces. Power is sent to the rear wheel via a claw-shifted six-speed manual gearbox (as standard) coupled to a Cardan shaft drive. An assist-and-slipper clutch is standard here. Given this engine's age, BMW has been refining it over the years. Hence, the R 1300 GS does promise a dependable experience. The engine character is also low-stress and low-revving. Furthermore, the boxer design gives it a natural balance, which helps reduce wear of moving internal components. BMW offers an optional automatic gearbox on the R 1300 GS that simplifies the riding experience. It is an automated manual unit that essentially transforms this mighty ADV into a twist-and-go motorcycle, just like a scooter. It can also be switched off, allowing the rider to get back to shifting gears. The undisputed Honda Africa Twin DCT finally has an equal rival. The BMW R 1300 GS employs a pressed-steel mainframe that uses the engine as a stressed member. It is coupled to a die-cast aluminum sub-frame. This suspension setup on the latest top-spec GS is unique and uses BMW's Paralever and Telelever, with a double-wishbone at the front and a single central coilover spring. The rear gets a link-type monoshock connected to a single-sided swingarm. This setup offers 7.5 inches and 7.8 inches of suspension travel at the front and rear, respectively. The braking setup is not as radical as the suspension. But it sure is top-spec with dual 310 mm discs coupled to four-piston fixed calipers up front and a 285 mm disc coupled to a two-piston floating caliper at the rear. Aiding in its do-it-all appeal is a 19/17-inch alloy wheel combo on the base model. Elevating its versatility are optional features such as forged enduro/cross-spoke laced rims, superior braking hardware, and even an electronic suspension system. The BMW R 1300 GS is loaded with cool technological features. Even the standard ""base"" model is well stacked. It gets a crisp 6.5-inch TFT screen, one of the largest in its segment. A slew of assistive features help tame the tall machine. Notable features include Dynamic Traction Control, Hill Start Control, Dynamic Brake Control, Dynamic Cruise Control, Engine Drag Torque Control, and Tire Pressure Monitor, among others. Although sports bikes have high-strung engines, these 10 sport bikes defy the odds and keep running like new with minimal maintenance. Comfort and convenience are taken care of with features like heated grips, keyless entry and ride, four ride modes (Eco, Rain, Road, and Enduro), LED matrix headlight, and a smartphone charging compartment with a USB charging socket. Apart from these standard features, BMW also offers an extensive list of optional features to elevate the R 1300 GS's desirability levels. These include: We want to hear from you! Share your opinions in the thread below and remember to keep it respectful. I own a 2012 R1200 GSA and a 2002 R1150 RT-P.  The GSA and the cop bike are all I'll ever need!",https://www.topspeed.com/motorcycle-for-life-not-few-years/
GS,"GS Caltex edges KEC in five sets, nears V League title - CHOSUNBIZ - Chosunbiz",2026-04-03 12:29:00,"GS Caltex also took the second game of the championship final. GS Caltex beat Jin Air in a full set against Korea Expressway Corporation (KEC) in the second game of the 2025-2026 V League championship final held at Gimcheon Gymnasium on the 3rd. With this, they have one win remaining to reach the top. Lee Young-taek, coach of GS Caltex, who secured the first win, said he would focus on maintaining the existing level of play rather than making special changes. Lee Young-taek said, ""Since we faced each other several times in the regular season, it is more important to do what we do well than to prepare something new."" He also emphasized, ""Silva is physically struggling but is holding up well. Now the mental strength of the players is important."" Before the game, Korea Expressway Corporation (KEC) acting coach Kim Young-rae, who met with reporters, said, ""In the first game I was in such a mental state that I could not give any instructions. That was the hardest part,"" and added, ""I was torn about whether to do it my way or maintain the head coach's style. I remember repeating only 'it's fine' during timeouts."" He continued, ""Senior players such as Bae Yu-na helped set the tone. A mood formed of 'we can't end it like this' and 'we must win no matter what,'"" and added, ""I told them to put aside feelings of apology, take responsibility, and start again."" GS Caltex took the first set. Led by Silva and Yoo Seo-yeon, who combined for 13 points, they won 25-15 by 10 points. Korea Expressway Corporation (KEC), which launched a counterattack, began to show strength in the second set and finished it 25-14. Riding the momentum, Korea Expressway Corporation (KEC) resisted GS Caltex's persistent chase in the third set and won 25-20. The team that secured the first win showed strong resilience. After a close fourth set, GS Caltex took it 25-22 and finished cleanly in the fifth set. We use cookies to enhance your experience and analyze traffic. By continuing to       browse this site, you agree to our use of cookies.       Learn More",https://biz.chosun.com/en/en-sports/2026/04/03/R7LURM3V4JB63GBUQE56ZKXWX4/
GS,"GS Caltex Wins Five-Set Match, Title Near - 조선일보",2026-04-03 12:27:53,"GS Caltex needs one more win; Korea Expressway coach addresses morale GS Caltex has also taken the 2nd match of the Championship Finals. GS Caltex defeated Korea Expressway Corporation in a full five sets at the 2nd match of the Jin Air 2025-2026 V-League Championship Finals held at Kimcheon Gymnasium on the 3rd. With this, they now need 1 more win to claim the title. GS Caltex's head coach Lee Young-taek, who secured the first win, stated that rather than making special changes, he would focus on maintaining the existing performance. Coach Lee Young-taek said, “Since we have faced each other many times in the regular league, it is important to focus on what we can do well rather than preparing something new.” He also emphasized, “Although Silva is in a physically tough situation, she is holding up well. Now, the players' mental strength is crucial.” Korea Expressway Corporation’s acting head coach Kim Young-rae, who met with reporters before the match, said, “In the first match, I was in such a mental state that I couldn’t give any instructions. That was the most difficult part.” He added, “I was torn between whether to follow my own style or maintain the coach’s style. During timeouts, I remember repeating only the words, ‘It’s okay.’” He continued, “Senior players like Bae Yuna helped set the atmosphere well. A mood formed that ‘we can’t end it like this’ and ‘we must win at all costs.’” He added, “I also put aside my apologetic feelings and talked about starting over with a sense of responsibility.” GS Caltex took the 1st set. Leading with Silva and Yoo Seo-yeon, who combined for 13 points, they pressed on with a 10-point difference, 25-15. Korea Expressway Corporation, launching a counterattack, began to gain momentum in the 2nd set and finished with 25-14. Riding the momentum, Korea Expressway Corporation shook off GS Caltex’s persistent chase in the 3rd set and won 25-20. The strength of the team that secured the first win was formidable. GS Caltex, who took the 4th set in a close battle 25-22, neatly concluded the 5th set. /what@osen.co.kr",https://www.chosun.com/english/sports-en/2026/04/03/JFWL4YWVSNDPXK7Y2OGNH2EOX4/
GS,T Bar Fastening Cufflinks GS Cufflinks Spirit Level Design Men's Cufflinks Set In Presentation Box Spirit Box - ruhrkanal.news,2026-04-03 11:46:52,"Es konnten keine passenden Inhalte gefunden werden. Vielleicht kann Ihnen die Suchfunktion weiterhelfen. Hattingen- Zu einer Laufdemo am heutigen Samstag (3. Februar 2024) hat die Gruppen „Für Vielfalt und Demokratie“ aufgerufen. Hunderte trafen sich am Rathaus um ein… Ennepe-Ruhr-Kreis- Im Ennepe-Ruhr-Kreis gibt es 732 bestätigte Corona-Fälle (Stand: Samstag, 29. August, 9 Uhr), von diesen gelten 668 als genesen. Die Zahl der Infektionen ist… Sei auf dem Laufenden und gib deine Email Adresse ein um RuhrkanalNEWS zu abonnieren Falls Sie Fragen oder Anregungen haben schicken Sie uns einfach eine Email an re*******@*******al.news Copyright RuhrkanalNEWS® © 2026 Hattingen/Sprockhövel",https://ruhrkanal.news/Level-Design-Men-039-s-Cufflinks-Set-In-Presentation-Box-556882
GS,A Look At Goldman Sachs (GS) Valuation After Basel III Revision And M&A Growth Expectations - simplywall.st,2026-04-03 11:36:02,"Goldman Sachs Group (GS) is back in focus after regulators revised the Basel III framework, easing capital requirements for major banks, while commentary points to a projected pickup in mergers and acquisitions activity in 2026. Goldman Sachs shares recently caught a bid on the Basel III revision and expectations for heavier M&A pipelines. While the 90 day share price return of 5.61% is weak, the 1 year total shareholder return of 72.31% and 5 year total shareholder return of 193.89% point to longer term momentum that remains firmly intact around the current US$863.04 share price. If this kind of deal activity has your attention, it is a good time to look beyond large banks and check out 20 top founder-led companies So with Basel tailwinds, a US$863.04 share price and a modest 6% intrinsic discount, plus analyst targets sitting higher, are you looking at an undervalued compounder, or a name where the market already prices in future growth? With Goldman Sachs last closing at $863.04 and the most followed fair value set at $959.75 using a 9.33% discount rate, the narrative points to upside that analysts link to specific earnings and margin assumptions rather than broad sentiment. Record growth and momentum in Asset & Wealth Management, including strong fee-based net inflows for 30 consecutive quarters and rising demand for alternative assets from high-net-worth and institutional clients, are shifting the revenue mix toward less volatile, high-margin streams, which is supporting higher and more durable net margins. Want to see how this fee heavy, higher margin mix feeds into the valuation gap? The narrative leans on measured revenue growth, improving profitability and a richer future earnings multiple to bridge today’s share price to that $959.75 figure. Have a read of the narrative in full and understand what's behind the forecasts. However, this depends on regulatory clarity and controlled costs, as tougher capital rules or rising compensation pressure could squeeze margins and narrow the current valuation gap. Find out about the key risks to this Goldman Sachs Group narrative. Feeling torn between the upside case and the risks around regulation and costs? Act while the detail is fresh in mind and weigh both sides with 4 key rewards and 2 important warning signs If Goldman Sachs has sharpened your interest, do not stop here. Use the Simply Wall Street Screener to spot other focused ideas that could round out your watchlist. This article by Simply Wall St is general in nature. We provide commentary based on historical data
    and analyst forecasts only using an unbiased methodology and our articles are not intended to be financial advice. It does not constitute a recommendation to buy or sell any stock, and does not take account of your objectives, or your
    financial situation. We aim to bring you long-term focused analysis driven by fundamental data.
    Note that our analysis may not factor in the latest price-sensitive company announcements or qualitative material.
    Simply Wall St has no position in any stocks mentioned. We've created the ultimate portfolio companion for stock investors, and it's free. • Connect an unlimited number of Portfolios and see your total in one currency• Be alerted to new Warning Signs or Risks via email or mobile• Track the Fair Value of your stocks Have feedback on this article? Concerned about the content? Get in touch with us directly. Alternatively, email editorial-team@simplywallst.com A financial institution, provides a range of financial services for corporations, financial institutions, governments, and individuals in the Americas, Europe, the Middle East, Africa, and Asia. Good value with proven track record and pays a dividend. Financial Data provided by S&P Global Market Intelligence LLC, analysis provided by Simply Wall Street Pty Ltd. Copyright © 2026, S&P Global Market Intelligence LLC. All rights reserved. Simply Wall Street Pty Ltd (ACN 600 056 611), is a Corporate Authorised Representative (Authorised Representative Number: 467183) of Sanlam Private Wealth Pty Ltd (AFSL No. 337927). Any advice contained in this website is general advice only and has been prepared without considering your objectives, financial situation or needs. You should not rely on any advice and/or information contained in this website and before making any investment decision we recommend that you consider whether it is appropriate for your situation and seek appropriate financial, taxation and legal advice. Please read our Financial Services Guide before deciding whether to obtain financial services from us. © 2026 Simply Wall Street Pty Ltd, US Design Patent #29/544/281, Community and European Design Registration #2845206",https://simplywall.st/stocks/us/diversified-financials/nyse-gs/goldman-sachs-group/news/a-look-at-goldman-sachs-gs-valuation-after-basel-iii-revisio
