ticker,title,date,content,url
JPM,"J. Safra Sarasin Holding AG Purchases 35,271 Shares of JPMorgan Chase & Co. $JPM - MarketBeat",2026-04-04 09:19:22,"J. Safra Sarasin Holding AG lifted its position in shares of  JPMorgan Chase & Co. (NYSE:JPM) by 43.1% during the 4th quarter, according to the company in its most recent 13F filing with the Securities & Exchange Commission. The institutional investor  owned 117,082 shares of the financial services provider's stock after acquiring an additional 35,271 shares during the quarter. J. Safra Sarasin Holding AG's holdings in JPMorgan Chase & Co. were worth $37,743,000 at the end of the most recent reporting period. Other hedge funds and other institutional investors have also bought and sold shares of the company. Triangle Securities Wealth Management raised its position in shares of  JPMorgan Chase & Co. by 14.1% during the third quarter. Triangle Securities Wealth Management now owns 25,822 shares of the financial services provider's stock worth $8,145,000 after acquiring an additional 3,191 shares during the last quarter.  Andra AP fonden boosted its holdings in  JPMorgan Chase & Co. by 3.2% in the third quarter. Andra AP fonden now owns 107,700 shares of the financial services provider's stock valued at $33,972,000 after acquiring an additional 3,300 shares during the last quarter.  Banco Santander S.A. boosted its holdings in  JPMorgan Chase & Co. by 9.0% in the third quarter. Banco Santander S.A. now owns 452,612 shares of the financial services provider's stock valued at $142,767,000 after acquiring an additional 37,550 shares during the last quarter.  Brighton Jones LLC increased its position in  JPMorgan Chase & Co. by 11.0% during the 4th quarter. Brighton Jones LLC now owns 48,732 shares of the financial services provider's stock valued at $11,682,000 after purchasing an additional 4,841 shares during the period.  Finally, Rakuten Investment Management Inc. acquired a new stake in  JPMorgan Chase & Co. during the 3rd quarter valued at approximately $11,350,000. Institutional investors own  71.55% of the company's stock. JPMorgan Chase & Co. stock opened at $294.66 on Friday. The stock has a market capitalization of $794.70 billion, a price-to-earnings ratio of 14.73, a PEG ratio of 1.41 and a beta of 1.05. JPMorgan Chase & Co. has a 52-week low of $202.16 and a 52-week high of $337.25. The company has a debt-to-equity ratio of 1.27, a quick ratio of 0.85 and a current ratio of 0.85. The stock's 50 day moving average price is $298.95 and its two-hundred day moving average price is $307.17. JPMorgan Chase & Co. (NYSE:JPM - Get Free Report) last released its quarterly earnings data on Tuesday, January 13th. The financial services provider reported $5.23 earnings per share for the quarter, beating the consensus estimate of $4.93 by $0.30. JPMorgan Chase & Co. had a net margin of 20.35% and a return on equity of 17.16%. The company had revenue of $45.80 billion during the quarter, compared to analyst estimates of $45.98 billion. During the same quarter in the previous year, the business posted $4.81 EPS. JPMorgan Chase & Co.'s revenue for the quarter was up 7.1% compared to the same quarter last year.  On average, equities analysts predict that  JPMorgan Chase & Co. will post 18.1 earnings per share for the current year. The business also recently declared a quarterly dividend, which will be paid on Thursday, April 30th. Shareholders of record on Monday, April 6th will be issued a $1.50 dividend. This represents a $6.00 dividend on an annualized basis and a yield of 2.0%. The ex-dividend date is Monday, April 6th. JPMorgan Chase & Co.'s dividend payout ratio (DPR) is presently 29.99%. Here are the key news stories impacting JPMorgan Chase & Co. this week: In other news, insider Robin Leopold sold 433 shares of the company's stock in a transaction dated Monday, March 23rd. The shares were sold at an average price of $295.06, for a total transaction of $127,760.98. Following the transaction, the insider owned 64,920 shares in the company, valued at approximately $19,155,295.20. This represents a 0.66% decrease in their ownership of the stock. The sale was disclosed in a document filed with the Securities & Exchange Commission, which is accessible through this link. Also, CEO Troy L. Rohrbaugh sold 50,000 shares of the stock in a transaction dated Thursday, February 19th. The stock was sold at an average price of $307.11, for a total transaction of $15,355,500.00. Following the transaction, the chief executive officer directly owned 111,279 shares in the company, valued at $34,174,893.69. This trade represents a 31.00% decrease in their position. The SEC filing for this sale provides additional information. In the last quarter, insiders sold 72,029 shares of company stock valued at $22,195,693. 0.47% of the stock is owned by insiders. A number of brokerages have recently issued reports on JPM. DZ Bank  restated a ""neutral"" rating on shares of JPMorgan Chase & Co. in a research report on Wednesday, January 14th. Keefe, Bruyette & Woods  reiterated an ""outperform"" rating on shares of JPMorgan Chase & Co. in a research report on Tuesday, February 24th. Royal Bank Of Canada  reissued an ""outperform"" rating and set a $330.00 target price on shares of JPMorgan Chase & Co. in a research note on Wednesday, January 14th. Daiwa Securities Group boosted their target price on shares of JPMorgan Chase & Co. from $345.00 to $353.00 and gave the company an ""outperform"" rating in a report on Tuesday, January 6th. Finally, Wall Street Zen raised shares of JPMorgan Chase & Co. from a ""sell"" rating to a ""hold"" rating in a research report on Sunday, January 18th. One investment analyst  has rated the stock with a Strong Buy rating, fourteen have assigned  a Buy rating and thirteen have issued  a Hold rating to the stock. According to MarketBeat, the stock  has a consensus rating of ""Moderate Buy"" and a consensus price target of $336.48. JPMorgan Chase & Co NYSE: JPM is a diversified global financial services firm headquartered in New York City. The company provides a wide range of banking and financial products and services to consumers, small businesses, corporations, governments and institutional investors worldwide. Its operations span retail banking, commercial lending, investment banking, asset management, payments and card services, and treasury and securities services. The firm's principal business activities are organized across several core lines: Consumer & Community Banking, which offers deposit accounts, mortgages, auto loans, credit cards and branch and digital banking under the Chase brand; Corporate & Investment Banking, which provides capital markets, advisory, underwriting, trading and risk management services; Commercial Banking, delivering lending, treasury and capital solutions to middle-market and corporate clients; and Asset & Wealth Management, which offers investment management, private banking and retirement services to institutions and high-net-worth individuals. Want to see what other hedge funds are holding JPM? Visit HoldingsChannel.com to get the latest 13F filings and insider trades for JPMorgan Chase & Co. (NYSE:JPM - Free Report). This instant news alert was generated by narrative science technology and financial data from MarketBeat in order to provide readers with the fastest reporting and unbiased coverage. Please send any questions or comments about this story to contact@marketbeat.com. Before you consider JPMorgan Chase & Co., you'll want to hear this. MarketBeat keeps track of Wall Street's top-rated and best performing research analysts and the stocks they recommend to their clients on a daily basis. MarketBeat has identified the five stocks that top analysts are quietly whispering to their clients to buy now before the broader market catches on... and JPMorgan Chase & Co. wasn't on the list. While JPMorgan Chase & Co. currently has a Moderate Buy rating among analysts, top-rated analysts believe these five stocks are better buys. Discover the next wave of investment opportunities with our report, 7 Stocks That Will Be Magnificent in 2026. Explore companies poised to replicate the growth, innovation, and value creation of the tech giants dominating today's markets. Sign up for MarketBeat All Access to gain access to MarketBeat's full suite of research tools. 345 N Reid Place, Suite 620, Sioux Falls, SD 57103
                                        
                                        contact@marketbeat.com
                                        
                                        (844) 978-6257 © MarketBeat Media, LLC 2010-2026. All rights reserved. © 2026   Fair market value prices are updated every minute and are provided by Massive. Other market data provided is at least 10-minutes delayed and hosted by Barchart Solutions.  Information is provided 'as-is' and solely for informational purposes, not for trading purposes or advice, and is delayed. To see all exchange delays and terms of use please see Barchart's disclaimer. We and our partners share information on your use of this website to help improve your experience. For more information, or to opt out click the Do Not Sell My Information button below.",https://www.marketbeat.com/instant-alerts/filing-j-safra-sarasin-holding-ag-purchases-35271-shares-of-jpmorgan-chase-co-jpm-2026-04-04/
JPM,"Financial Planning Hawaii Inc. Acquires Shares of 4,769 JPMorgan Chase & Co. $JPM - MarketBeat",2026-04-04 08:04:22,"Financial Planning Hawaii Inc. acquired a new stake in  JPMorgan Chase & Co. (NYSE:JPM - Free Report) during the 4th quarter, according to its most recent Form 13F filing with the Securities and Exchange Commission (SEC). The institutional investor  acquired 4,769 shares of the financial services provider's stock, valued at approximately $1,537,000. Other hedge funds also recently modified their holdings of the company. Danske Bank A S bought a new position in  JPMorgan Chase & Co. in the 3rd quarter valued at about $696,885,000.  Holocene Advisors LP boosted its holdings in shares of  JPMorgan Chase & Co. by 1,033.3% during the third quarter. Holocene Advisors LP now owns 2,155,120 shares of the financial services provider's stock worth $679,790,000 after acquiring an additional 1,964,958 shares during the period.  Viking Global Investors LP boosted its holdings in shares of  JPMorgan Chase & Co. by 86.1% during the second quarter. Viking Global Investors LP now owns 4,042,034 shares of the financial services provider's stock worth $1,171,826,000 after acquiring an additional 1,870,386 shares during the period.  California Public Employees Retirement System grew its position in shares of  JPMorgan Chase & Co. by 19.6% in the third quarter. California Public Employees Retirement System now owns 6,615,749 shares of the financial services provider's stock valued at $2,086,806,000 after purchasing an additional 1,082,913 shares during the last quarter.  Finally, Legal & General Group Plc increased its stake in shares of  JPMorgan Chase & Co. by 3.3% during the third quarter. Legal & General Group Plc now owns 18,908,978 shares of the financial services provider's stock worth $5,964,459,000 after purchasing an additional 607,025 shares during the period. Institutional investors and hedge funds own  71.55% of the company's stock. Shares of NYSE JPM opened at $294.66 on Friday. The company has a debt-to-equity ratio of 1.27, a quick ratio of 0.85 and a current ratio of 0.85. JPMorgan Chase & Co. has a 52 week low of $202.16 and a 52 week high of $337.25. The stock has a market capitalization of $794.70 billion, a P/E ratio of 14.73, a PEG ratio of 1.41 and a beta of 1.05. The stock's fifty day moving average is $298.95 and its 200 day moving average is $307.17. JPMorgan Chase & Co. (NYSE:JPM - Get Free Report) last posted its quarterly earnings data on Tuesday, January 13th. The financial services provider reported $5.23 earnings per share for the quarter, topping the consensus estimate of $4.93 by $0.30. The business had revenue of $45.80 billion during the quarter, compared to analysts' expectations of $45.98 billion. JPMorgan Chase & Co. had a net margin of 20.35% and a return on equity of 17.16%. JPMorgan Chase & Co.'s revenue was up 7.1% compared to the same quarter last year. During the same quarter in the prior year, the business posted $4.81 earnings per share.  Sell-side analysts forecast that  JPMorgan Chase & Co. will post 18.1 earnings per share for the current fiscal year. The company also recently announced a quarterly dividend, which will be paid on Thursday, April 30th. Stockholders of record on Monday, April 6th will be given a $1.50 dividend. The ex-dividend date is Monday, April 6th. This represents a $6.00 annualized dividend and a dividend yield of 2.0%. JPMorgan Chase & Co.'s payout ratio is presently 29.99%. In other JPMorgan Chase & Co. news, insider Robin Leopold sold 433 shares of the business's stock in a transaction that occurred on Monday, March 23rd. The shares were sold at an average price of $295.06, for a total transaction of $127,760.98. Following the completion of the transaction, the insider directly owned 64,920 shares in the company, valued at $19,155,295.20. The trade was a 0.66% decrease in their ownership of the stock. The sale was disclosed in a document filed with the Securities & Exchange Commission, which is available at this link. Also, General Counsel Stacey Friedman sold 3,404 shares of the company's stock in a transaction on Tuesday, February 17th. The stock was sold at an average price of $306.40, for a total value of $1,042,985.60. Following the sale, the general counsel owned 61,949 shares of the company's stock, valued at $18,981,173.60. The trade was a 5.21% decrease in their ownership of the stock. The disclosure for this sale is available in the SEC filing. Insiders have sold a total of 72,029 shares of company stock worth $22,195,693 in the last 90 days. Corporate insiders own  0.47% of the company's stock. Several research firms recently weighed in on JPM. Daiwa Securities Group lifted their price target on JPMorgan Chase & Co. from $345.00 to $353.00 and gave the stock an ""outperform"" rating in a report on Tuesday, January 6th. Barclays  reiterated a ""buy"" rating on shares of JPMorgan Chase & Co. in a research report on Wednesday. Keefe, Bruyette & Woods  reissued an ""outperform"" rating on shares of JPMorgan Chase & Co. in a report on Tuesday, February 24th. Wells Fargo & Company reduced their target price on shares of JPMorgan Chase & Co. from $360.00 to $350.00 and set an ""overweight"" rating for the company in a research report on Tuesday, February 17th. Finally, Wolfe Research lowered shares of JPMorgan Chase & Co. from an ""outperform"" rating to a ""peer perform"" rating in a research report on Wednesday, January 7th. One investment analyst  has rated the stock with a Strong Buy rating, fourteen have given a Buy rating and thirteen have given a Hold rating to the company. According to MarketBeat, the stock  has a consensus rating of ""Moderate Buy"" and a consensus target price of $336.48. Here are the key news stories impacting JPMorgan Chase & Co. this week: JPMorgan Chase & Co NYSE: JPM is a diversified global financial services firm headquartered in New York City. The company provides a wide range of banking and financial products and services to consumers, small businesses, corporations, governments and institutional investors worldwide. Its operations span retail banking, commercial lending, investment banking, asset management, payments and card services, and treasury and securities services. The firm's principal business activities are organized across several core lines: Consumer & Community Banking, which offers deposit accounts, mortgages, auto loans, credit cards and branch and digital banking under the Chase brand; Corporate & Investment Banking, which provides capital markets, advisory, underwriting, trading and risk management services; Commercial Banking, delivering lending, treasury and capital solutions to middle-market and corporate clients; and Asset & Wealth Management, which offers investment management, private banking and retirement services to institutions and high-net-worth individuals. This instant news alert was generated by narrative science technology and financial data from MarketBeat in order to provide readers with the fastest reporting and unbiased coverage. Please send any questions or comments about this story to contact@marketbeat.com. Before you consider JPMorgan Chase & Co., you'll want to hear this. MarketBeat keeps track of Wall Street's top-rated and best performing research analysts and the stocks they recommend to their clients on a daily basis. MarketBeat has identified the five stocks that top analysts are quietly whispering to their clients to buy now before the broader market catches on... and JPMorgan Chase & Co. wasn't on the list. While JPMorgan Chase & Co. currently has a Moderate Buy rating among analysts, top-rated analysts believe these five stocks are better buys. With the proliferation of data centers and electric vehicles, the electric grid will only get more strained. Download this report to learn how energy stocks can play a role in your portfolio as the global demand for energy continues to grow. Sign up for MarketBeat All Access to gain access to MarketBeat's full suite of research tools. 345 N Reid Place, Suite 620, Sioux Falls, SD 57103
                                        
                                        contact@marketbeat.com
                                        
                                        (844) 978-6257 © MarketBeat Media, LLC 2010-2026. All rights reserved. © 2026   Fair market value prices are updated every minute and are provided by Massive. Other market data provided is at least 10-minutes delayed and hosted by Barchart Solutions.  Information is provided 'as-is' and solely for informational purposes, not for trading purposes or advice, and is delayed. To see all exchange delays and terms of use please see Barchart's disclaimer. We and our partners share information on your use of this website to help improve your experience. For more information, or to opt out click the Do Not Sell My Information button below.",https://www.marketbeat.com/instant-alerts/filing-financial-planning-hawaii-inc-acquires-shares-of-4769-jpmorgan-chase-co-jpm-2026-04-04/
JPM,"Jamie Dimon calls Crypto Tokens ""decentralized Ponzi schemes."" - C-SPAN",2026-04-04 04:19:50,"Your gift supports C-SPAN’s mission to provide unedited, unfiltered coverage of government. Make your gift today Sign up for our inside Washington daily newsletter J.P. Morgan Chase CEO Jamie Dimon: ""I'm a major skeptic on crypto tokens which you call currency, like Bitcoin. They are decentralized Ponzi schemes."" *This text was compiled from uncorrected Closed Captioning. These cookies allow us to count visits and traffic sources so we can measure and improve the performance of our site. They help us to know which pages are the most and least popular and see how visitors move around the site. All information these cookies collect is aggregated and therefore anonymous. If you do not allow these cookies we will not know when you have visited our site, and will not be able to monitor its performance. These cookies may be set through our site by our advertising partners. They may be used by those companies to build a profile of your interests and show you relevant adverts on other sites. They do not store directly personal information, but are based on uniquely identifying your browser and internet device. If you do not allow these cookies, you will experience less targeted advertising. These cookies enable the website to provide enhanced functionality and personalisation. They may be set by us or by third party providers whose services we have added to our pages. If you do not allow these cookies then some or all of these services may not function properly. These cookies are necessary for the website to function and cannot be switched off in our systems. They are usually only set in response to actions made by you which amount to a request for services, such as setting your privacy preferences, logging in or filling in forms. You can set your browser to block or alert you about these cookies, but some parts of the site will not then work. These cookies do not store any personally identifiable information.",https://www.c-span.org/video/?c5032117/jamie-dimon-calls-crypto-tokens-decentralized-ponzi-schemes
