ticker,title,date,content,url
JPM,Clear Trail Advisors LLC Invests $17.62 Million in JPMorgan Chase & Co. $JPM - MarketBeat,2026-03-27 08:12:39,"Clear Trail Advisors LLC bought a new stake in shares of  JPMorgan Chase & Co. (NYSE:JPM - Free Report) during the 4th quarter, according to its most recent Form 13F filing with the SEC. The fund bought 54,671 shares of the financial services provider's stock, valued at approximately $17,616,000. JPMorgan Chase & Co. accounts for  4.1% of Clear Trail Advisors LLC's investment portfolio, making the stock its 6th biggest position. A number of other large investors also recently made changes to their positions in JPM. Roxbury Financial LLC increased its stake in  JPMorgan Chase & Co. by 0.4% in the 4th quarter. Roxbury Financial LLC now owns 8,011 shares of the financial services provider's stock valued at $2,581,000 after buying an additional 31 shares during the period.  Collective Family Office LLC lifted its holdings in shares of  JPMorgan Chase & Co. by 1.0% during the 4th quarter. Collective Family Office LLC now owns 3,339 shares of the financial services provider's stock valued at $1,076,000 after buying an additional 32 shares during the last quarter.  Peterson Wealth Advisors LLC lifted its holdings in shares of  JPMorgan Chase & Co. by 1.6% during the 3rd quarter. Peterson Wealth Advisors LLC now owns 2,063 shares of the financial services provider's stock valued at $635,000 after buying an additional 33 shares during the last quarter.  Rialto Wealth Management LLC grew its stake in shares of  JPMorgan Chase & Co. by 3.6% in the 3rd quarter. Rialto Wealth Management LLC now owns 962 shares of the financial services provider's stock valued at $304,000 after buying an additional 33 shares in the last quarter.  Finally, TradeWell Securities LLC. increased its holdings in  JPMorgan Chase & Co. by 0.3% in the third quarter. TradeWell Securities LLC. now owns 12,333 shares of the financial services provider's stock worth $3,832,000 after buying an additional 34 shares during the last quarter. Institutional investors and hedge funds own  71.55% of the company's stock. In other news, COO Jennifer Piepszak sold 8,571 shares of the firm's stock in a transaction dated Friday, January 16th. The stock was sold at an average price of $312.79, for a total value of $2,680,923.09. Following the sale, the chief operating officer directly owned 71,027 shares of the company's stock, valued at approximately $22,216,535.33. This trade represents a 10.77% decrease in their ownership of the stock. The sale was disclosed in a document filed with the SEC, which can be accessed through this hyperlink. Also, insider Robin Leopold sold 433 shares of JPMorgan Chase & Co. stock in a transaction dated Monday, March 23rd. The stock was sold at an average price of $295.06, for a total value of $127,760.98. Following the completion of the transaction, the insider owned 64,920 shares in the company, valued at $19,155,295.20. The trade was a 0.66% decrease in their ownership of the stock. Additional details regarding this sale are available in the official SEC disclosure. Over the last 90 days, insiders have sold 72,029 shares of company stock worth $22,195,693. Insiders own  0.47% of the company's stock. Several brokerages recently weighed in on JPM. Zacks Research raised shares of JPMorgan Chase & Co. from a ""hold"" rating to a ""strong-buy"" rating in a research report on Tuesday, March 10th. Keefe, Bruyette & Woods  reissued an ""outperform"" rating on shares of JPMorgan Chase & Co. in a research report on Tuesday, February 24th. Daiwa Securities Group increased their price target on shares of JPMorgan Chase & Co. from $345.00 to $353.00 and gave the stock an ""outperform"" rating in a research note on Tuesday, January 6th. Royal Bank Of Canada  restated an ""outperform"" rating and set a $330.00 price target on shares of JPMorgan Chase & Co. in a report on Wednesday, January 14th. Finally, Wall Street Zen upgraded shares of JPMorgan Chase & Co. from a ""sell"" rating to a ""hold"" rating in a report on Sunday, January 18th. One equities research analyst  has rated the stock with a Strong Buy rating, fourteen have given a Buy rating and thirteen have issued  a Hold rating to the stock. Based on data from MarketBeat.com, JPMorgan Chase & Co. presently has a consensus rating of ""Moderate Buy"" and an average price target of $338.70. Check Out Our Latest Research Report on JPMorgan Chase & Co. Here are the key news stories impacting JPMorgan Chase & Co. this week: Shares of JPM stock opened at $291.56 on Friday. JPMorgan Chase & Co. has a 12 month low of $202.16 and a 12 month high of $337.25. The company has a market cap of $786.34 billion, a PE ratio of 14.57, a price-to-earnings-growth ratio of 1.22 and a beta of 1.06. The company has a quick ratio of 0.85, a current ratio of 0.85 and a debt-to-equity ratio of 1.27. The business's 50 day moving average is $300.65 and its two-hundred day moving average is $307.64. JPMorgan Chase & Co. (NYSE:JPM - Get Free Report) last issued its quarterly earnings data on Tuesday, January 13th. The financial services provider reported $5.23 earnings per share for the quarter, topping analysts' consensus estimates of $4.93 by $0.30. The business had revenue of $45.80 billion during the quarter, compared to analysts' expectations of $45.98 billion. JPMorgan Chase & Co. had a net margin of 20.35% and a return on equity of 17.16%. JPMorgan Chase & Co.'s revenue for the quarter was up 7.1% on a year-over-year basis. During the same period in the previous year, the company earned $4.81 earnings per share.  Equities analysts predict that  JPMorgan Chase & Co. will post 18.1 EPS for the current year. The company also recently announced a quarterly dividend, which will be paid on Thursday, April 30th. Investors of record on Monday, April 6th will be issued a $1.50 dividend. This represents a $6.00 annualized dividend and a yield of 2.1%. The ex-dividend date is Monday, April 6th. JPMorgan Chase & Co.'s dividend payout ratio (DPR) is 29.99%. JPMorgan Chase & Co NYSE: JPM is a diversified global financial services firm headquartered in New York City. The company provides a wide range of banking and financial products and services to consumers, small businesses, corporations, governments and institutional investors worldwide. Its operations span retail banking, commercial lending, investment banking, asset management, payments and card services, and treasury and securities services. The firm's principal business activities are organized across several core lines: Consumer & Community Banking, which offers deposit accounts, mortgages, auto loans, credit cards and branch and digital banking under the Chase brand; Corporate & Investment Banking, which provides capital markets, advisory, underwriting, trading and risk management services; Commercial Banking, delivering lending, treasury and capital solutions to middle-market and corporate clients; and Asset & Wealth Management, which offers investment management, private banking and retirement services to institutions and high-net-worth individuals. This instant news alert was generated by narrative science technology and financial data from MarketBeat in order to provide readers with the fastest reporting and unbiased coverage. Please send any questions or comments about this story to contact@marketbeat.com. Before you consider JPMorgan Chase & Co., you'll want to hear this. MarketBeat keeps track of Wall Street's top-rated and best performing research analysts and the stocks they recommend to their clients on a daily basis. MarketBeat has identified the five stocks that top analysts are quietly whispering to their clients to buy now before the broader market catches on... and JPMorgan Chase & Co. wasn't on the list. While JPMorgan Chase & Co. currently has a Moderate Buy rating among analysts, top-rated analysts believe these five stocks are better buys. Discover the 10 Best High-Yield Dividend Stocks for 2026 and secure reliable income in uncertain markets. Download the report now to identify top dividend payers and avoid common yield traps. Sign up for MarketBeat All Access to gain access to MarketBeat's full suite of research tools. 345 N Reid Place, Suite 620, Sioux Falls, SD 57103
                                        
                                        contact@marketbeat.com
                                        
                                        (844) 978-6257 © MarketBeat Media, LLC 2010-2026. All rights reserved. © 2026   Fair market value prices are updated every minute and are provided by Massive. Other market data provided is at least 10-minutes delayed and hosted by Barchart Solutions.  Information is provided 'as-is' and solely for informational purposes, not for trading purposes or advice, and is delayed. To see all exchange delays and terms of use please see Barchart's disclaimer. We and our partners share information on your use of this website to help improve your experience. For more information, or to opt out click the Do Not Sell My Information button below.",https://www.marketbeat.com/instant-alerts/filing-clear-trail-advisors-llc-invests-1762-million-in-jpmorgan-chase-co-jpm-2026-03-27/
JPM,BDF Gestion Has $19.31 Million Stock Holdings in JPMorgan Chase & Co. $JPM - MarketBeat,2026-03-27 07:37:58,"BDF Gestion cut its position in shares of  JPMorgan Chase & Co. (NYSE:JPM - Free Report) by 6.2% in the fourth quarter, according to the company in its most recent filing with the Securities and Exchange Commission. The firm owned 59,928 shares of the financial services provider's stock after selling 3,993 shares during the period. JPMorgan Chase & Co. makes up   2.4% of BDF Gestion's portfolio, making the stock its 8th largest holding. BDF Gestion's holdings in JPMorgan Chase & Co. were worth $19,310,000 at the end of the most recent quarter. Several other hedge funds also recently added to or reduced their stakes in JPM. Brighton Jones LLC grew its stake in shares of  JPMorgan Chase & Co. by 11.0% during the fourth quarter. Brighton Jones LLC now owns 48,732 shares of the financial services provider's stock valued at $11,682,000 after buying an additional 4,841 shares during the last quarter.  Acorns Advisers LLC lifted its stake in shares of  JPMorgan Chase & Co. by 6.9% during the 1st quarter. Acorns Advisers LLC now owns 1,547 shares of the financial services provider's stock worth $379,000 after acquiring an additional 100 shares during the last quarter.  Ignite Planners LLC lifted its stake in shares of  JPMorgan Chase & Co. by 0.7% during the 2nd quarter. Ignite Planners LLC now owns 10,934 shares of the financial services provider's stock worth $3,185,000 after acquiring an additional 78 shares during the last quarter.  Pinnacle Wealth Planning Services Inc. boosted its holdings in  JPMorgan Chase & Co. by 0.3% during the 2nd quarter. Pinnacle Wealth Planning Services Inc. now owns 16,380 shares of the financial services provider's stock valued at $4,749,000 after acquiring an additional 52 shares during the period.  Finally, Invenio Wealth Partners LLC boosted its holdings in  JPMorgan Chase & Co. by 2.9% during the 2nd quarter. Invenio Wealth Partners LLC now owns 3,687 shares of the financial services provider's stock valued at $1,069,000 after acquiring an additional 105 shares during the period. 71.55% of the stock is currently owned by institutional investors. JPM opened at $291.56 on Friday. The stock's fifty day moving average is $300.65 and its two-hundred day moving average is $307.64. The company has a market capitalization of $786.34 billion, a P/E ratio of 14.57, a PEG ratio of 1.22 and a beta of 1.06. JPMorgan Chase & Co. has a 52 week low of $202.16 and a 52 week high of $337.25. The company has a quick ratio of 0.85, a current ratio of 0.85 and a debt-to-equity ratio of 1.27. JPMorgan Chase & Co. (NYSE:JPM - Get Free Report) last issued its earnings results on Tuesday, January 13th. The financial services provider reported $5.23 earnings per share for the quarter, topping the consensus estimate of $4.93 by $0.30. JPMorgan Chase & Co. had a return on equity of 17.16% and a net margin of 20.35%.The business had revenue of $45.80 billion during the quarter, compared to analysts' expectations of $45.98 billion. During the same period in the prior year, the business earned $4.81 EPS. The business's revenue for the quarter was up 7.1% compared to the same quarter last year.  Analysts forecast that  JPMorgan Chase & Co. will post 18.1 earnings per share for the current year. The company also recently disclosed a quarterly dividend, which will be paid on Thursday, April 30th. Investors of record on Monday, April 6th will be issued a $1.50 dividend. This represents a $6.00 annualized dividend and a dividend yield of 2.1%. The ex-dividend date is Monday, April 6th. JPMorgan Chase & Co.'s payout ratio is presently 29.99%. Here are the key news stories impacting JPMorgan Chase & Co. this week: In other JPMorgan Chase & Co. news, CEO Troy L. Rohrbaugh sold 50,000 shares of the firm's stock in a transaction dated Thursday, February 19th. The shares were sold at an average price of $307.11, for a total transaction of $15,355,500.00. Following the transaction, the chief executive officer owned 111,279 shares of the company's stock, valued at approximately $34,174,893.69. This trade represents a 31.00% decrease in their position. The transaction was disclosed in a document filed with the SEC, which is available at this hyperlink. Also, COO Jennifer Piepszak sold 8,571 shares of the firm's stock in a transaction dated Friday, January 16th. The shares were sold at an average price of $312.79, for a total transaction of $2,680,923.09. Following the transaction, the chief operating officer directly owned 71,027 shares in the company, valued at $22,216,535.33. This trade represents a 10.77% decrease in their position. The SEC filing for this sale provides additional information. Insiders sold a total of 72,029 shares of company stock valued at $22,195,693 over the last three months. 0.47% of the stock is currently owned by corporate insiders. JPM has been the topic of a number of recent analyst reports. Freedom Capital upgraded JPMorgan Chase & Co. to a ""hold"" rating in a research note on Wednesday, January 14th. Wall Street Zen raised shares of JPMorgan Chase & Co. from a ""sell"" rating to a ""hold"" rating in a research note on Sunday, January 18th. Keefe, Bruyette & Woods  restated an ""outperform"" rating on shares of JPMorgan Chase & Co. in a report on Tuesday, February 24th. Robert W. Baird raised their price target on shares of JPMorgan Chase & Co. from $280.00 to $290.00 and gave the stock a ""neutral"" rating in a research note on Wednesday, March 4th. Finally, DZ Bank  reaffirmed a ""neutral"" rating on shares of JPMorgan Chase & Co. in a research note on Wednesday, January 14th. One equities research analyst  has rated the stock with a Strong Buy rating, fourteen have issued  a Buy rating and thirteen have given a Hold rating to the company's stock. According to data from MarketBeat.com, the stock presently has a consensus rating of ""Moderate Buy"" and an average price target of $338.70. Get Our Latest Stock Report on JPMorgan Chase & Co. JPMorgan Chase & Co NYSE: JPM is a diversified global financial services firm headquartered in New York City. The company provides a wide range of banking and financial products and services to consumers, small businesses, corporations, governments and institutional investors worldwide. Its operations span retail banking, commercial lending, investment banking, asset management, payments and card services, and treasury and securities services. The firm's principal business activities are organized across several core lines: Consumer & Community Banking, which offers deposit accounts, mortgages, auto loans, credit cards and branch and digital banking under the Chase brand; Corporate & Investment Banking, which provides capital markets, advisory, underwriting, trading and risk management services; Commercial Banking, delivering lending, treasury and capital solutions to middle-market and corporate clients; and Asset & Wealth Management, which offers investment management, private banking and retirement services to institutions and high-net-worth individuals. This instant news alert was generated by narrative science technology and financial data from MarketBeat in order to provide readers with the fastest reporting and unbiased coverage. Please send any questions or comments about this story to contact@marketbeat.com. Before you consider JPMorgan Chase & Co., you'll want to hear this. MarketBeat keeps track of Wall Street's top-rated and best performing research analysts and the stocks they recommend to their clients on a daily basis. MarketBeat has identified the five stocks that top analysts are quietly whispering to their clients to buy now before the broader market catches on... and JPMorgan Chase & Co. wasn't on the list. While JPMorgan Chase & Co. currently has a Moderate Buy rating among analysts, top-rated analysts believe these five stocks are better buys. Click the link to see MarketBeat's list of ten stocks that are set to soar in 2026, despite the threat of tariffs and other economic uncertainty. These ten stocks are incredibly resilient and are likely to thrive in any economic environment. Sign up for MarketBeat All Access to gain access to MarketBeat's full suite of research tools. 345 N Reid Place, Suite 620, Sioux Falls, SD 57103
                                        
                                        contact@marketbeat.com
                                        
                                        (844) 978-6257 © MarketBeat Media, LLC 2010-2026. All rights reserved. © 2026   Fair market value prices are updated every minute and are provided by Massive. Other market data provided is at least 10-minutes delayed and hosted by Barchart Solutions.  Information is provided 'as-is' and solely for informational purposes, not for trading purposes or advice, and is delayed. To see all exchange delays and terms of use please see Barchart's disclaimer. Enter your email below to receive daily updates and analyst ratings for JPMorgan Chase & Co. and related companies from The Early Bird. We and our partners share information on your use of this website to help improve your experience. For more information, or to opt out click the Do Not Sell My Information button below.",https://www.marketbeat.com/instant-alerts/filing-bdf-gestion-has-1931-million-stock-holdings-in-jpmorgan-chase-co-jpm-2026-03-27/
