ticker,title,date,content,url
JPM,"J.P. Morgan Downgrades TIC Solutions(TIC.US) to Sell Rating, Cuts Target Price to $7 - 富途牛牛",2026-03-27 23:00:48,"J.P. Morgan analyst Tomohiko Sano downgrades $TIC Solutions (TIC.US)$ to a sell rating, and adjusts the target price from $14 to $7. According to TipRanks data, the analyst has a success rate of 31.1% and a total average return of -1.1% over the past year. TipRanks, an independent third party, provides analysis data from financial analysts and calculates the Average Returns and Success Rates of the analysts' recommendations. The information presented is not an investment recommendation and is intended for informational purposes only. Success rate is the number of the analyst's successful ratings, divided by his/her total number of ratings over the past year. A successful rating is one based on if TipRanks' virtual portfolio earned a positive return from the stock. Total average return is the average rate of return that the TipRanks' virtual portfolio has earned over the past year. These portfolios are established based on the analyst's preliminary rating and are adjusted according to the changes in the rating. TipRanks provides a ranking of each analyst up to 5 stars, which is representative of all recommendations from the analyst. An analyst's past performance is evaluated on a scale of 1 to 5 stars, with more stars indicating better performance. The star level is determined by his/her total success rate and average return. Use the share button in your browser  to share the page with your friends",https://news.futunn.com/en/post/70662023/jp-morgan-downgrades-tic-solutions-ticus-to-sell-rating-cuts?level=1&data_ticket=1774660500370147
JPM,JPMorgan Chase & Co. (NYSE:JPM) Shares Down 3% - Time to Sell? - MarketBeat,2026-03-27 21:37:33,"JPMorgan Chase & Co. (NYSE:JPM) shares fell 3% during mid-day trading on Friday . The company traded as low as $281.75 and last traded at $282.9780. 9,815,719 shares traded hands during mid-day trading, a decline of 13% from the average session volume of 11,285,746 shares. The stock had previously closed at $291.66. Here are the key news stories impacting JPMorgan Chase & Co. this week: A number of brokerages have commented on JPM. Wall Street Zen raised shares of JPMorgan Chase & Co. from a ""sell"" rating to a ""hold"" rating in a report on Sunday, January 18th. TD Cowen  reissued a ""buy"" rating on shares of JPMorgan Chase & Co. in a research report on Wednesday, January 7th. Barclays  restated a ""buy"" rating on shares of JPMorgan Chase & Co. in a research note on Friday, February 13th. Robert W. Baird raised their target price on JPMorgan Chase & Co. from $280.00 to $290.00 and gave the stock a ""neutral"" rating in a report on Wednesday, March 4th. Finally, Jefferies Financial Group initiated coverage on JPMorgan Chase & Co. in a research report on Thursday. They set a ""hold"" rating and a $310.00 target price on the stock. One analyst  has rated the stock with a Strong Buy rating, fourteen have assigned  a Buy rating and thirteen have given a Hold rating to the stock. According to data from MarketBeat.com, JPMorgan Chase & Co. presently has an average rating of ""Moderate Buy"" and a consensus price target of $338.70. Check Out Our Latest Analysis on JPMorgan Chase & Co. The firm has a market cap of $763.20 billion, a PE ratio of 14.14, a P/E/G ratio of 1.22 and a beta of 1.06. The firm's fifty day simple moving average is $300.65 and its two-hundred day simple moving average is $307.64. The company has a quick ratio of 0.85, a current ratio of 0.85 and a debt-to-equity ratio of 1.27. JPMorgan Chase & Co. (NYSE:JPM - Get Free Report) last announced its quarterly earnings data on Tuesday, January 13th. The financial services provider reported $5.23 earnings per share (EPS) for the quarter, topping analysts' consensus estimates of $4.93 by $0.30. The firm had revenue of $45.80 billion during the quarter, compared to analysts' expectations of $45.98 billion. JPMorgan Chase & Co. had a net margin of 20.35% and a return on equity of 17.16%. The company's revenue for the quarter was up 7.1% compared to the same quarter last year. During the same period in the prior year, the company posted $4.81 earnings per share.  As a group, research analysts expect that  JPMorgan Chase & Co. will post 18.1 EPS for the current year. The firm also recently declared a quarterly dividend, which will be paid on Thursday, April 30th. Shareholders of record on Monday, April 6th will be paid a $1.50 dividend. This represents a $6.00 dividend on an annualized basis and a yield of 2.1%. The ex-dividend date is Monday, April 6th. JPMorgan Chase & Co.'s dividend payout ratio  is presently 29.99%. In other JPMorgan Chase & Co. news, CEO Troy L. Rohrbaugh sold 50,000 shares of the firm's stock in a transaction dated Thursday, February 19th. The stock was sold at an average price of $307.11, for a total transaction of $15,355,500.00. Following the sale, the chief executive officer directly owned 111,279 shares of the company's stock, valued at $34,174,893.69. This trade represents a 31.00% decrease in their ownership of the stock. The transaction was disclosed in a legal filing with the Securities & Exchange Commission, which is available through the SEC website. Also, General Counsel Stacey Friedman sold 3,404 shares of the business's stock in a transaction dated Tuesday, February 17th. The shares were sold at an average price of $306.40, for a total value of $1,042,985.60. Following the completion of the transaction, the general counsel owned 61,949 shares in the company, valued at $18,981,173.60. The trade was a 5.21% decrease in their ownership of the stock. Additional details regarding this sale are available in the official SEC disclosure. Over the last quarter, insiders sold 72,029 shares of company stock valued at $22,195,693. 0.47% of the stock is currently owned by corporate insiders. Large investors have recently added to or reduced their stakes in the business. Timmons Wealth Management LLC bought a new position in shares of  JPMorgan Chase & Co. during the fourth quarter worth $27,000.  Mizuho Securities Co. Ltd. increased its holdings in  JPMorgan Chase & Co. by 450.0% in the 2nd quarter. Mizuho Securities Co. Ltd. now owns 110 shares of the financial services provider's stock valued at $32,000 after acquiring an additional 90 shares during the last quarter.  Mountain Hill Investment Partners Corp. bought a new stake in  JPMorgan Chase & Co. in the 3rd quarter valued at $32,000.  Caitong International Asset Management Co. Ltd purchased a new stake in  JPMorgan Chase & Co. in the 4th quarter worth $32,000.  Finally, Family Legacy Financial Solutions LLC boosted its holdings in shares of  JPMorgan Chase & Co. by 92.6% during the 3rd quarter. Family Legacy Financial Solutions LLC now owns 104 shares of the financial services provider's stock valued at $33,000 after purchasing an additional 50 shares during the last quarter. 71.55% of the stock is owned by hedge funds and other institutional investors. JPMorgan Chase & Co NYSE: JPM is a diversified global financial services firm headquartered in New York City. The company provides a wide range of banking and financial products and services to consumers, small businesses, corporations, governments and institutional investors worldwide. Its operations span retail banking, commercial lending, investment banking, asset management, payments and card services, and treasury and securities services. The firm's principal business activities are organized across several core lines: Consumer & Community Banking, which offers deposit accounts, mortgages, auto loans, credit cards and branch and digital banking under the Chase brand; Corporate & Investment Banking, which provides capital markets, advisory, underwriting, trading and risk management services; Commercial Banking, delivering lending, treasury and capital solutions to middle-market and corporate clients; and Asset & Wealth Management, which offers investment management, private banking and retirement services to institutions and high-net-worth individuals. This instant news alert was generated by narrative science technology and financial data from MarketBeat in order to provide readers with the fastest reporting and unbiased coverage. Please send any questions or comments about this story to contact@marketbeat.com. Before you consider JPMorgan Chase & Co., you'll want to hear this. MarketBeat keeps track of Wall Street's top-rated and best performing research analysts and the stocks they recommend to their clients on a daily basis. MarketBeat has identified the five stocks that top analysts are quietly whispering to their clients to buy now before the broader market catches on... and JPMorgan Chase & Co. wasn't on the list. While JPMorgan Chase & Co. currently has a Moderate Buy rating among analysts, top-rated analysts believe these five stocks are better buys. Wondering where to start (or end) with AI stocks? These 10 simple stocks can help investors build long-term wealth as artificial intelligence continues to grow into the future. Sign up for MarketBeat All Access to gain access to MarketBeat's full suite of research tools. 345 N Reid Place, Suite 620, Sioux Falls, SD 57103
                                        
                                        contact@marketbeat.com
                                        
                                        (844) 978-6257 © MarketBeat Media, LLC 2010-2026. All rights reserved. © 2026   Fair market value prices are updated every minute and are provided by Massive. Other market data provided is at least 10-minutes delayed and hosted by Barchart Solutions.  Information is provided 'as-is' and solely for informational purposes, not for trading purposes or advice, and is delayed. To see all exchange delays and terms of use please see Barchart's disclaimer. We and our partners share information on your use of this website to help improve your experience. For more information, or to opt out click the Do Not Sell My Information button below.",https://www.marketbeat.com/instant-alerts/jpmorgan-chase-co-nysejpm-shares-down-3-time-to-sell-2026-03-27/
JPM,J.P. Morgan To Transfer 14 Etfs From Current Exchanges - TradingView,2026-03-27 20:11:18,"Select market data provided by ICE Data Services. Select reference data provided by FactSet. Copyright © 2026 FactSet Research Systems Inc.Copyright © 2026, American Bankers Association. CUSIP Database provided by FactSet Research Systems Inc. All rights reserved. SEC fillings and other documents provided by Quartr.© 2026 TradingView, Inc.","https://www.tradingview.com/news/reuters.com,2026:newsml_TUA17PPB3:0-j-p-morgan-to-transfer-14-etfs-from-current-exchanges/"
JPM,J.P. Morgan to Transfer 14 ETFs From Current Exchanges - Yahoo Finance UK,2026-03-27 20:00:00,"Tip: Try a valid symbol or a specific company name for relevant results Gold and silver prices rise 📈 with eyes on central banks and Iran war 💷 UK currency dips amid weaker retail sales while Middle East war ramps up inflation fears 💷 Stocks muted as Trump delays strikes on Iran power plants 🌍 Pound 💷 dips against dollar as OECD warns Middle East conflict will drive up UK inflation ⛽🛍️ Oil prices 🛢️ higher as Trump claims Iran doesn't want to admit they spoke 🗣️ Bitcoin price struggles near $70K as peace talk hopes falter Pound 💷 steady as Bank of England 🏦 interest rate rise bets ease Gold 🪙 price jumps ⬆️ 3% as oil slump eases inflation fears amid Trump Iran plan Stocks rise 📈 on reports of Trump offering 15-point ceasefire plan to Iran 🗒️ Oil price ⛽ plunges 📉 as Trump announces plan to end Iran war 💷 Pound dips against dollar 💵 as speculation around UK interest rates grow ⚡️ ASML, Estée Lauder, Bellway, Kingfisher and Fevertree ⚡️ ⚡️ Gold and silver price moves muted amid inflation and interest rate hike risks ⚡️ ⚡️ Stocks lack direction as traders assess Middle East conflict ⚡️ 🛢️Tehran's denial of negotiations clouds prospect of reopening Strait of Hormuz and ending conflict 🛢️ Pound 💷 dips against dollar 💲 amid mounting expectations of Bank of England 🏦 rate increase Gold 🪙 and silver erase 2026 gains as Middle East inflation fears stoke bets on higher rates London plunges into correction territory as Trump gives Iran ultimatum Oil prices ⛽ gain as Trump and Starmer discuss need to reopen Hormuz ⚡️ UK inflation, BYD, Next, Kingfisher and Bellway ⚡️ Gold 👑 set for third weekly fall 📉 as strong dollar and Fed stance weigh Pound steady 🇬🇧 as investors digest UK borrowing data 📊 and interest rate decisions Stocks higher 📈 as Netanyahu 🇮🇱 says he will 'hold off' on gas field attacks Oil prices 🛢️ fall as Netanyahu signals pause in Iran strikes 🇮🇷 Government borrowing rose 📈 by more than expected to £14.3bn in February ECB follows Bank of England with interest rate hold as Iran war intensifies 🚨 Bank of England holds rates at 3.75% amid Iran conflict 🚨 End of the sub-4% mortgage rate 🏘️ as NatWest, Barclays, Nationwide and Halifax hike costs ⬆️ Bitcoin price falls ⬇️ as Fed dampens rate cut hopes for 2026 Gold 🪙 prices slump after Fed holds interest rates steady Oil ⛽ prices soar 📈 following strikes on key energy facilities in the Middle East Pound 💷 lower ahead of Bank of England interest rate decision Stocks tumble 📉 ahead of BoE and ECB rate decisions 🏦 UK pay growth slows 📊 to 3.8% as labour market 👷🏽‍♀️ cools Energy price surge 📈 derails expectations for Bank of England 🏦 interest rate cuts Gold prices 🪙 ebb lower ahead of Fed interest rate decision 🏦 ⚡ Micron, Lululemon, Swarmer, Unilever and Prudential ⚡ Pound 💷 eases as investors expect Fed and BoE to hold interest rates 🏦 Stocks rise ⬆️ as investors find signs of stability Oil prices 🛢️ ease as Iraq resumes exports via Turkey 🚢 ⚡️ Nvidia, Roche, Travis Perkins, Wickes and Close Brothers ⚡️ NEW YORK, March 27, 2026 /PRNewswire/ -- J.P. Morgan Asset Management today announced the upcoming exchange listing transfer of 14 ETFs from their current exchanges including the NASDAQ Stock Market LLC, NYSE Arca, Inc., and Cboe BZX Exchange, Inc. As of the exchange opening on April 16, 2026, the listing exchange for each fund will be changed per the following. At that time, all references to the listing exchange will be revised accordingly. JPMorgan ActiveBuilders Emerging Markets Equity ETF (JEMA) JPMorgan BetaBuilders U.S. Aggregate Bond ETF (BBAG) JPMorgan BetaBuilders U.S. Mid Cap Equity ETF (BBMC) JPMorgan BetaBuilders U.S. Small Cap Equity ETF (BBSC) JPMorgan BetaBuilders USD Investment Grade Corporate Bond ETF (BBCB) JPMorgan Equity and Options Total Return ETF (JOYT) JPMorgan Fundamental Data Science Large Value ETF (LVDS) JPMorgan International Bond Opportunities Fund (JPIB) J.P. Morgan Asset Management is the largest issuer of active ETFs globally,1 reflecting a commitment to delivering innovative investment solutions and strong results for clients. J.P. Morgan Asset Management, with assets under management of $4.2 trillion (as of 12/31/2025), is a global leader in investment management. J.P. Morgan Asset Management's clients include institutions, retail investors and high net worth individuals in every major market throughout the world. J.P. Morgan Asset Management offers global investment management in equities, fixed income, real estate, hedge funds, private equity and liquidity. For more information: www.jpmorganassetmanagement.com. JPMorgan Chase & Co. (NYSE: JPM) is a leading financial services firm based in the United States of America (""U.S.""), with operations worldwide. JPMorganChase had $4.4 trillion in assets and $362 billion in stockholders' equity as of December 31, 2025. The Firm is a leader in investment banking, financial services for consumers and small businesses, commercial banking, financial transaction processing and asset management. Under the J.P. Morgan and Chase brands, the Firm serves millions of customers in the U.S., and many of the world's most prominent corporate, institutional and government clients globally. Information about JPMorgan Chase & Co. is available at www.jpmorganchase.com. J.P. Morgan ETFs are distributed by JPMorgan Distribution Services, Inc., which is an affiliate of JPMorgan Chase & Co. Affiliates of JPMorgan Chase & Co. receive fees for providing various services to the funds. JPMorgan Distribution Services, Inc. is a member of FINRA. More information is available at https://am.jpmorgan.com/us/en/asset-management/gim/adv/products/etfs. There is no guarantee, obligation or assurance that any investors will maintain any specific level of investment in the Fund, and such investors have the ability to withdraw their investment at any point in time like any other shareholder of a mutual fund or ETF. _________________________________________1 Data according to Bloomberg as of March 17, 2026. View original content:https://www.prnewswire.com/news-releases/jp-morgan-to-transfer-14-etfs-from-current-exchanges-302725694.html Tip: Try a valid symbol or a specific company name for relevant results",https://uk.finance.yahoo.com/news/j-p-morgan-transfer-14-200000519.html
JPM,Halliburton hits two-year high as J.P. Morgan sees little Q1 earnings impact from Iran war - Seeking Alpha,2026-03-27 19:39:36,"Halliburton (HAL) up 3.7% to as high as $40.36, its best level in nearly two years, as J.P. Morgan reiterated its Overweight rating while raising its price target to $40 from $35 previously, anticipating the company's Q1 results will remain in line with estimates despite Middle East",https://seekingalpha.com/news/4569924-halliburton-hits-two-year-high-as-j-p-morgan-sees-little-q1-earnings-impact-from-iran-war
JPM,"J.P. Morgan Maintains POWSZECHNA KASA OSZCZED BK POLSKI(PSZKF.US) With Buy Rating, Raises Target Price to $25.95 - 富途牛牛",2026-03-27 18:49:06,"J.P. Morgan analyst Mehmet Sevim maintains $POWSZECHNA KASA OSZCZED BK POLSKI (PSZKF.US)$ with a buy rating, and adjusts the target price from $25.37 to $25.95. According to TipRanks data, the analyst has a success rate of 83.3% and a total average return of 39.1% over the past year. TipRanks, an independent third party, provides analysis data from financial analysts and calculates the Average Returns and Success Rates of the analysts' recommendations. The information presented is not an investment recommendation and is intended for informational purposes only. Success rate is the number of the analyst's successful ratings, divided by his/her total number of ratings over the past year. A successful rating is one based on if TipRanks' virtual portfolio earned a positive return from the stock. Total average return is the average rate of return that the TipRanks' virtual portfolio has earned over the past year. These portfolios are established based on the analyst's preliminary rating and are adjusted according to the changes in the rating. TipRanks provides a ranking of each analyst up to 5 stars, which is representative of all recommendations from the analyst. An analyst's past performance is evaluated on a scale of 1 to 5 stars, with more stars indicating better performance. The star level is determined by his/her total success rate and average return. Use the share button in your browser  to share the page with your friends",https://news.futunn.com/en/post/70669456/jp-morgan-maintains-powszechna-kasa-oszczed-bk-polski-pszkfus-with?level=1&data_ticket=1774660500370147
JPM,JP Morgan in line for business rates discount on Canary Wharf HQ - The Times,2026-03-27 18:00:00,"The government is lining up a tax break which could be worth hundreds of millions of pounds for America’s largest bank in order for it to build a new base at Canary Wharf. The Treasury is proposing a business rates discount of “up to 100 per cent” to attract JP Morgan Chase, one of the world’s largest financial institutions, to develop a European headquarters in Canary Wharf. That sits within the London borough of Tower Hamlets, one of the UK’s most deprived boroughs. The £3 billion project, which would be London’s largest office building, was first announced in November and was hailed by Rachel Reeves, the chancellor, as a “multi-billion pound vote of confidence in the UK economy”. It has emerged that JP Morgan has “requested a business rates incentive over a period of years” and the government has warned the local authority that the bank was “unlikely to progress” the project “without clarity and certainty” on its property tax bill, a council report said. The plan to provide a substantial tax incentive to one of the world’s biggest banking groups is highly contentious as it comes when many other businesses are facing a significant increase in their business rates bills. Kate Nicholls, chair of UK Hospitality, a trade group, said she had members in Tower Hamlets facing business rates increases of up to 200 per cent. She said: “This will be very hard for employers who are being asked to contribute more and more. “Hospitality pays nearly 75 per cent of profits to taxes while financial services institutions pay half that amount. To give tax breaks and incentives to companies who can afford to pay doesn’t feel fair or sustainable.” Sir Tim Martin, founder and chairman of JD Wetherspoon, which has pubs in the borough, also criticised the proposed subsidy. “The UK has gone from a competitively taxed to highly taxed economy in the last couple of decades,” he said. “This inevitably produces pork barrel politics whereby those who can negotiate discounts, while those who don’t have bargaining power are left to carry the can.” The development is due to be designed by Foster + Partners and is expected to accommodate up to 12,000 staff. At three million sq ft, the development, which could be completed by 2032, could have double the space of Britain’s tallest building, the Shard. It is claimed it could add £9.9 billion to the UK economy over six years and create about 7,800 construction-related jobs. Tower Hamlets has one of the highest rates of child poverty in the UK and the council says “huge wealth” in the borough exists alongside “deep poverty and inequality”. It had been expected that an agreement in principle on the subsidy proposals would be agreed by the end of March, but Tower Hamlets council has yet to receive details of the proposals in a memorandum of understanding (MoU) from the Treasury. A council report said a “risk” of the plan was the “significant long-term financial exposure” depending on the structure of the relief provided. The council said it was not willing to contribute to the cost of the subsidy. A spokeswoman for the council said: “The council has no intention of giving up any of its 30 per cent share of business rates. We are awaiting receipt of the high-level draft [of the MoU]. “We welcome JP Morgan Chase’s interest in Tower Hamlets, which would bring significant investment, thousands of jobs and development to our borough, which is already one of the most popular places to live, visit and work in the country, as well as being a huge coup for the UK economy, as the chancellor has made clear.” The council, which is being overseen by government officials as it deals with financial and governance issues, is expected to negotiate on details connected to the project including jobs and other social benefits. Those close to the discussions pointed out that construction projects on this scale often involve property tax incentives.The exact structure of any incentives has yet to be agreed. It is estimated that the site would generate tax of up to £1.6 billion over 25 years without any incentives. Locating the development in an “enterprise zone” could allow for a discount of “up to 100 per cent”, the council documents show. Enterprise zone rates discounts typically last five years. “JP Morgan’s board and stakeholders want certainty as they proceed with detailed design and contractor procurement,” the council’s report says. A spokesman for JP Morgan said the project “would represent a significant net benefit to both Tower Hamlets and the wider national economy as a whole”.The Greater London Authority, which is also being consulted, declined to comment. A Treasury spokesperson said: “We do not comment on tax speculation.” © Times Media Limited 2025.Registered in England No. 894646. Registered office: 1 London Bridge Street, SE1 9GF. Enjoy unlimited access to all articles.
			Ends soon.",https://www.thetimes.com/business/companies-markets/article/jp-morgan-tax-break-canary-wharf-wvn8klbk6?gaa_at=eafs&gaa_n=AWEtsqeNq4aDORwFaY4XynCGlfuiIkRpn-emzQsTcCqrYNI5ChV0dBU9aWV-&gaa_ts=69c72fe8&gaa_sig=38WTcwdDEhSJO9EU-6iIuyJXsq5SeJy0GSzP-FQbodRq69pN_TMwPXArlyXTH9P6NRW5DIVWb7GbB5PNVFNDPQ%3D%3D
JPM,NEW ENGLAND ASSET MANAGEMENT INC's JPMorgan Chase & Co(JPM) Holding History - GuruFocus,2026-03-27 16:27:34,"This website is using a security service to protect itself from online attacks. The action you just performed triggered the security solution. There are several actions that could trigger this block including submitting a certain word or phrase, a SQL command or malformed data. You can email the site owner to let them know you were blocked. Please include what you were doing when this page came up and the Cloudflare Ray ID found at the bottom of this page. Cloudflare Ray ID: 9e32cf35ca29e63d
•

        Your IP:
        Click to reveal
20.55.86.176
•

Performance & security by Cloudflare",https://www.gurufocus.com/guru-portfolio/NEW%20ENGLAND%20ASSET%20MANAGEMENT%20INC/JPM
