ticker,title,date,content,url
JPM,Bartlett & CO. Wealth Management LLC Cuts Stock Holdings in JPMorgan Chase & Co. $JPM - MarketBeat,2026-04-18 07:29:46,"Bartlett & CO. Wealth Management LLC lowered its position in  JPMorgan Chase & Co. (NYSE:JPM) by 1.1% during the 4th quarter, according to the company in its most recent Form 13F filing with the SEC. The institutional investor  owned 746,883 shares of the financial services provider's stock after selling 8,340 shares during the period. JPMorgan Chase & Co. accounts for about  3.1% of Bartlett & CO. Wealth Management LLC's holdings, making the stock its 5th biggest position. Bartlett & CO. Wealth Management LLC's holdings in JPMorgan Chase & Co. were worth $240,661,000 at the end of the most recent reporting period. Other institutional investors and hedge funds have also added to or reduced their stakes in the company. Danske Bank A S bought a new position in shares of  JPMorgan Chase & Co. in the third quarter valued at approximately $696,885,000.  Holocene Advisors LP lifted its holdings in shares of  JPMorgan Chase & Co. by 1,033.3% in the third quarter. Holocene Advisors LP now owns 2,155,120 shares of the financial services provider's stock valued at $679,790,000 after purchasing an additional 1,964,958 shares in the last quarter.  Viking Global Investors LP lifted its holdings in shares of  JPMorgan Chase & Co. by 86.1% in the second quarter. Viking Global Investors LP now owns 4,042,034 shares of the financial services provider's stock valued at $1,171,826,000 after purchasing an additional 1,870,386 shares in the last quarter.  California Public Employees Retirement System lifted its holdings in shares of  JPMorgan Chase & Co. by 19.6% in the third quarter. California Public Employees Retirement System now owns 6,615,749 shares of the financial services provider's stock valued at $2,086,806,000 after purchasing an additional 1,082,913 shares in the last quarter.  Finally, Legal & General Group Plc lifted its holdings in shares of  JPMorgan Chase & Co. by 3.3% in the third quarter. Legal & General Group Plc now owns 18,908,978 shares of the financial services provider's stock valued at $5,964,459,000 after purchasing an additional 607,025 shares in the last quarter. Institutional investors own  71.55% of the company's stock. In other news, COO Jennifer Piepszak sold 9,136 shares of the business's stock in a transaction dated Wednesday, April 15th. The stock was sold at an average price of $306.56, for a total value of $2,800,732.16. Following the completion of the sale, the chief operating officer owned 90,001 shares of the company's stock, valued at approximately $27,590,706.56. The trade was a 9.22% decrease in their position. The transaction was disclosed in a legal filing with the SEC, which is accessible through this link. The transaction was executed under a pre-arranged Rule 10b5-1 trading plan. Also, CFO Jeremy Barnum sold 5,611 shares of the business's stock in a transaction dated Wednesday, April 15th. The shares were sold at an average price of $306.55, for a total value of $1,720,052.05. Following the completion of the sale, the chief financial officer directly owned 35,460 shares of the company's stock, valued at approximately $10,870,263. This trade represents a 13.66% decrease in their position. The disclosure for this sale is available in the SEC filing. The transaction was executed under a pre-arranged Rule 10b5-1 trading plan. Insiders have sold a total of 71,908 shares of company stock worth $22,065,882 in the last 90 days. 0.47% of the stock is currently owned by company insiders. NYSE:JPM opened at $310.67 on Friday. The firm has a market capitalization of $833.29 billion, a price-to-earnings ratio of 14.88, a P/E/G ratio of 1.52 and a beta of 1.05. JPMorgan Chase & Co. has a 52-week low of $226.34 and a 52-week high of $337.25. The stock has a fifty day moving average of $298.65 and a 200 day moving average of $306.76. The company has a debt-to-equity ratio of 1.30, a quick ratio of 0.85 and a current ratio of 0.86. JPMorgan Chase & Co. (NYSE:JPM - Get Free Report) last issued its quarterly earnings results on Tuesday, April 14th. The financial services provider reported $5.94 earnings per share (EPS) for the quarter, topping the consensus estimate of $5.50 by $0.44. JPMorgan Chase & Co. had a return on equity of 17.54% and a net margin of 20.66%.The firm had revenue of $50.54 billion during the quarter, compared to analyst estimates of $48.30 billion. During the same quarter in the previous year, the company posted $5.07 earnings per share. The company's revenue was up 10.0% compared to the same quarter last year.  On average, research analysts expect that  JPMorgan Chase & Co. will post 18.1 EPS for the current fiscal year. The business also recently announced a quarterly dividend, which will be paid on Thursday, April 30th. Stockholders of record on Monday, April 6th will be paid a $1.50 dividend. This represents a $6.00 dividend on an annualized basis and a dividend yield of 1.9%. The ex-dividend date of this dividend is Monday, April 6th. JPMorgan Chase & Co.'s payout ratio is 28.74%. Here are the key news stories impacting JPMorgan Chase & Co. this week: A number of analysts recently commented on JPM shares. CICC Research started coverage on JPMorgan Chase & Co. in a report on Wednesday, January 14th. They set an ""outperform"" rating and a $355.00 price target on the stock. The Goldman Sachs Group  set a $361.00 price target on JPMorgan Chase & Co. in a report on Tuesday. Jefferies Financial Group lifted their price target on JPMorgan Chase & Co. from $310.00 to $320.00 and gave the stock a ""hold"" rating in a report on Wednesday. Piper Sandler lifted their price target on JPMorgan Chase & Co. from $325.00 to $345.00 and gave the stock an ""overweight"" rating in a report on Wednesday. Finally, HSBC dropped their price target on JPMorgan Chase & Co. from $319.00 to $288.00 and set a ""hold"" rating on the stock in a report on Wednesday, April 1st. Fifteen investment analysts have rated the stock with a Buy rating and fifteen have given a Hold rating to the company. According to MarketBeat.com, the stock currently has an average rating of ""Moderate Buy"" and a consensus target price of $336.16. JPMorgan Chase & Co NYSE: JPM is a diversified global financial services firm headquartered in New York City. The company provides a wide range of banking and financial products and services to consumers, small businesses, corporations, governments and institutional investors worldwide. Its operations span retail banking, commercial lending, investment banking, asset management, payments and card services, and treasury and securities services. The firm's principal business activities are organized across several core lines: Consumer & Community Banking, which offers deposit accounts, mortgages, auto loans, credit cards and branch and digital banking under the Chase brand; Corporate & Investment Banking, which provides capital markets, advisory, underwriting, trading and risk management services; Commercial Banking, delivering lending, treasury and capital solutions to middle-market and corporate clients; and Asset & Wealth Management, which offers investment management, private banking and retirement services to institutions and high-net-worth individuals. Want to see what other hedge funds are holding JPM? Visit HoldingsChannel.com to get the latest 13F filings and insider trades for JPMorgan Chase & Co. (NYSE:JPM - Free Report). This instant news alert was generated by narrative science technology and financial data from MarketBeat in order to provide readers with the fastest reporting and unbiased coverage. Please send any questions or comments about this story to contact@marketbeat.com. Before you consider JPMorgan Chase & Co., you'll want to hear this. MarketBeat keeps track of Wall Street's top-rated and best performing research analysts and the stocks they recommend to their clients on a daily basis. MarketBeat has identified the five stocks that top analysts are quietly whispering to their clients to buy now before the broader market catches on... and JPMorgan Chase & Co. wasn't on the list. While JPMorgan Chase & Co. currently has a Moderate Buy rating among analysts, top-rated analysts believe these five stocks are better buys. Click the link to see MarketBeat's list of seven stocks and why their long-term outlooks are very promising. Sign up for MarketBeat All Access to gain access to MarketBeat's full suite of research tools. 345 N Reid Place, Suite 620, Sioux Falls, SD 57103
                                        
                                        contact@marketbeat.com
                                        
                                        (844) 978-6257 © MarketBeat Media, LLC 2010-2026. All rights reserved. © 2026   Fair market value prices are updated every minute and are provided by Massive. Other market data provided is at least 10-minutes delayed and hosted by Barchart Solutions.  Information is provided 'as-is' and solely for informational purposes, not for trading purposes or advice, and is delayed. To see all exchange delays and terms of use please see Barchart's disclaimer. We and our partners share information on your use of this website to help improve your experience. For more information, or to opt out click the Do Not Sell My Information button below.",https://www.marketbeat.com/instant-alerts/filing-bartlett-co-wealth-management-llc-cuts-stock-holdings-in-jpmorgan-chase-co-jpm-2026-04-18/
JPM,Trading Systems Reacting to (JPM) Volatility - Stock Traders Daily,2026-04-18 07:26:02,"Our AI models have generated three distinct trading strategies tailored to different risk profiles and holding periods. Each strategy incorporates sophisticated risk management parameters designed to optimize position sizing and minimize drawdown risk. Blue = Current Price
Red = Resistance
Green = Support Instant access — no password needed Get institutional-grade analysis with API integration and custom risk models. You're about to add JPM to your personalized dashboard for ongoing analysis and alerts. To access your My Stocks dashboard and receive personalized analysis, you'll need to create a free account. © 2025 Stock Traders Daily - Quantitative Research Division. All rights reserved. | 📚 Full News Archive | 🍁 Canada Edition",https://news.stocktradersdaily.com/news_release/24/Trading_Systems_Reacting_to_JPM_Volatility_041826072602_1776511562.html
JPM,Apollon Wealth Management LLC Has $64.50 Million Position in JPMorgan Chase & Co. $JPM - MarketBeat,2026-04-18 07:12:34,"Apollon Wealth Management LLC increased its stake in shares of  JPMorgan Chase & Co. (NYSE:JPM - Free Report) by 2.0% in the fourth quarter, according to the company in its most recent filing with the Securities and Exchange Commission (SEC). The institutional investor  owned 200,179 shares of the financial services provider's stock after purchasing an additional 3,887 shares during the quarter. JPMorgan Chase & Co. makes up  about  1.1% of Apollon Wealth Management LLC's portfolio, making the stock its 12th largest holding. Apollon Wealth Management LLC's holdings in JPMorgan Chase & Co. were worth $64,502,000 as of its most recent filing with the Securities and Exchange Commission (SEC). Other institutional investors and hedge funds have also recently added to or reduced their stakes in the company. Danske Bank A S acquired a new position in  JPMorgan Chase & Co. in the third quarter valued at $696,885,000.  Holocene Advisors LP increased its stake in  JPMorgan Chase & Co. by 1,033.3% in the third quarter. Holocene Advisors LP now owns 2,155,120 shares of the financial services provider's stock valued at $679,790,000 after purchasing an additional 1,964,958 shares during the last quarter.  Viking Global Investors LP grew its position in  JPMorgan Chase & Co. by 86.1% during the second quarter. Viking Global Investors LP now owns 4,042,034 shares of the financial services provider's stock valued at $1,171,826,000 after acquiring an additional 1,870,386 shares during the period.  California Public Employees Retirement System grew its position in  JPMorgan Chase & Co. by 19.6% during the third quarter. California Public Employees Retirement System now owns 6,615,749 shares of the financial services provider's stock valued at $2,086,806,000 after acquiring an additional 1,082,913 shares during the period.  Finally, Legal & General Group Plc boosted its position in shares of  JPMorgan Chase & Co. by 3.3% in the third quarter. Legal & General Group Plc now owns 18,908,978 shares of the financial services provider's stock worth $5,964,459,000 after buying an additional 607,025 shares during the period. 71.55% of the stock is currently owned by institutional investors and hedge funds. In other news, COO Jennifer Piepszak sold 9,136 shares of JPMorgan Chase & Co. stock in a transaction that occurred on Wednesday, April 15th. The shares were sold at an average price of $306.56, for a total value of $2,800,732.16. Following the completion of the transaction, the chief operating officer owned 90,001 shares in the company, valued at approximately $27,590,706.56. The trade was a 9.22% decrease in their ownership of the stock. The transaction was disclosed in a legal filing with the SEC, which is accessible through this link. The transaction was executed under a pre-arranged Rule 10b5-1 trading plan. Also, CEO Troy L. Rohrbaugh sold 50,000 shares of JPMorgan Chase & Co. stock in a transaction that occurred on Thursday, February 19th. The shares were sold at an average price of $307.11, for a total transaction of $15,355,500.00. Following the completion of the transaction, the chief executive officer owned 111,279 shares of the company's stock, valued at $34,174,893.69. This trade represents a 31.00% decrease in their position. The disclosure for this sale is available in the SEC filing. Over the last ninety days, insiders sold 71,908 shares of company stock valued at $22,065,882. Corporate insiders own  0.47% of the company's stock. Here are the key news stories impacting JPMorgan Chase & Co. this week: JPMorgan Chase & Co. stock opened at $310.67 on Friday. The company has a debt-to-equity ratio of 1.30, a quick ratio of 0.85 and a current ratio of 0.86. The business's 50-day simple moving average is $298.65 and its 200-day simple moving average is $306.76. The firm has a market capitalization of $833.29 billion, a PE ratio of 14.88, a PEG ratio of 1.52 and a beta of 1.05. JPMorgan Chase & Co. has a 52 week low of $226.34 and a 52 week high of $337.25. JPMorgan Chase & Co. (NYSE:JPM - Get Free Report) last posted its quarterly earnings data on Tuesday, April 14th. The financial services provider reported $5.94 EPS for the quarter, topping analysts' consensus estimates of $5.50 by $0.44. The business had revenue of $50.54 billion for the quarter, compared to analyst estimates of $48.30 billion. JPMorgan Chase & Co. had a return on equity of 17.54% and a net margin of 20.66%.The firm's revenue for the quarter was up 10.0% on a year-over-year basis. During the same period in the previous year, the company posted $5.07 earnings per share.  Equities research analysts forecast that  JPMorgan Chase & Co. will post 18.1 earnings per share for the current year. The company also recently declared a quarterly dividend, which will be paid on Thursday, April 30th. Investors of record on Monday, April 6th will be paid a dividend of $1.50 per share. This represents a $6.00 annualized dividend and a yield of 1.9%. The ex-dividend date is Monday, April 6th. JPMorgan Chase & Co.'s payout ratio is currently 28.74%. A number of research analysts recently commented on the company. Truist Financial increased their price target on JPMorgan Chase & Co. from $323.00 to $332.00 and gave the company a ""hold"" rating in a report on Wednesday. Barclays  reiterated a ""buy"" rating on shares of JPMorgan Chase & Co. in a research report on Tuesday. The Goldman Sachs Group  set a $361.00 price target on JPMorgan Chase & Co. in a research report on Tuesday. Argus increased their price objective on JPMorgan Chase & Co. from $340.00 to $355.00 and gave the stock a ""buy"" rating in a report on Wednesday. Finally, Robert W. Baird  set a $295.00 price objective on JPMorgan Chase & Co. in a report on Wednesday. Fifteen investment analysts have rated the stock with a Buy rating and fifteen have assigned  a Hold rating to the company's stock. According to MarketBeat, the stock presently has an average rating of ""Moderate Buy"" and an average price target of $336.16. JPMorgan Chase & Co NYSE: JPM is a diversified global financial services firm headquartered in New York City. The company provides a wide range of banking and financial products and services to consumers, small businesses, corporations, governments and institutional investors worldwide. Its operations span retail banking, commercial lending, investment banking, asset management, payments and card services, and treasury and securities services. The firm's principal business activities are organized across several core lines: Consumer & Community Banking, which offers deposit accounts, mortgages, auto loans, credit cards and branch and digital banking under the Chase brand; Corporate & Investment Banking, which provides capital markets, advisory, underwriting, trading and risk management services; Commercial Banking, delivering lending, treasury and capital solutions to middle-market and corporate clients; and Asset & Wealth Management, which offers investment management, private banking and retirement services to institutions and high-net-worth individuals. This instant news alert was generated by narrative science technology and financial data from MarketBeat in order to provide readers with the fastest reporting and unbiased coverage. Please send any questions or comments about this story to contact@marketbeat.com. Before you consider JPMorgan Chase & Co., you'll want to hear this. MarketBeat keeps track of Wall Street's top-rated and best performing research analysts and the stocks they recommend to their clients on a daily basis. MarketBeat has identified the five stocks that top analysts are quietly whispering to their clients to buy now before the broader market catches on... and JPMorgan Chase & Co. wasn't on the list. While JPMorgan Chase & Co. currently has a Moderate Buy rating among analysts, top-rated analysts believe these five stocks are better buys. Learn the basics of options trading and how to use them to boost returns and manage risk with this free report from MarketBeat. Click the link below to get your free copy. Sign up for MarketBeat All Access to gain access to MarketBeat's full suite of research tools. 345 N Reid Place, Suite 620, Sioux Falls, SD 57103
                                        
                                        contact@marketbeat.com
                                        
                                        (844) 978-6257 © MarketBeat Media, LLC 2010-2026. All rights reserved. © 2026   Fair market value prices are updated every minute and are provided by Massive. Other market data provided is at least 10-minutes delayed and hosted by Barchart Solutions.  Information is provided 'as-is' and solely for informational purposes, not for trading purposes or advice, and is delayed. To see all exchange delays and terms of use please see Barchart's disclaimer. We and our partners share information on your use of this website to help improve your experience. For more information, or to opt out click the Do Not Sell My Information button below.",https://www.marketbeat.com/instant-alerts/filing-apollon-wealth-management-llc-has-6450-million-position-in-jpmorgan-chase-co-jpm-2026-04-18/
JPM,JPM Maintains Rating by Evercore ISI Group -- Price Target Raised to $340 - GuruFocus,2026-04-18 03:45:00,"This website is using a security service to protect itself from online attacks. The action you just performed triggered the security solution. There are several actions that could trigger this block including submitting a certain word or phrase, a SQL command or malformed data. You can email the site owner to let them know you were blocked. Please include what you were doing when this page came up and the Cloudflare Ray ID found at the bottom of this page. Cloudflare Ray ID: 9ee831100f28d6b1
•

        Your IP:
        Click to reveal
40.76.191.131
•

Performance & security by Cloudflare",https://www.gurufocus.com/news/8800703/jpm-maintains-rating-by-evercore-isi-group-price-target-raised-to-340?mobile=true%3Fmobile%3Dtrue&mobile=true%3Fmobile%3Dtrue%3Fmobile%3Dtrue&mobile=true&mobile=true
