ticker,title,date,content,url
JPM,"J.P. Morgan Maintains AMP LIMITED(AMLTF.US) With Buy Rating, Raises Target Price to $1.04 - 富途牛牛",2026-04-05 19:27:45,"J.P. Morgan analyst Siddharth Parameswaran maintains $AMP LIMITED (AMLTF.US)$ with a buy rating, and adjusts the target price from $1 to $1.04. According to TipRanks data, the analyst has a success rate of 63.1% and a total average return of 6.7% over the past year. TipRanks, an independent third party, provides analysis data from financial analysts and calculates the Average Returns and Success Rates of the analysts' recommendations. The information presented is not an investment recommendation and is intended for informational purposes only. Success rate is the number of the analyst's successful ratings, divided by his/her total number of ratings over the past year. A successful rating is one based on if TipRanks' virtual portfolio earned a positive return from the stock. Total average return is the average rate of return that the TipRanks' virtual portfolio has earned over the past year. These portfolios are established based on the analyst's preliminary rating and are adjusted according to the changes in the rating. TipRanks provides a ranking of each analyst up to 5 stars, which is representative of all recommendations from the analyst. An analyst's past performance is evaluated on a scale of 1 to 5 stars, with more stars indicating better performance. The star level is determined by his/her total success rate and average return. Use the share button in your browser  to share the page with your friends",https://news.futunn.com/en/post/71105848/jp-morgan-maintains-amp-limited-amltfus-with-buy-rating-raises?level=1&data_ticket=1775439146969789
JPM,"J.P. Morgan Upgrades AMP LIMITED(AMLTF.US) to Buy Rating, Cuts Target Price to $1 - 富途牛牛",2026-04-05 19:23:36,"J.P. Morgan analyst Siddharth Parameswaran upgrades $AMP LIMITED (AMLTF.US)$ to a buy rating, and adjusts the target price from $1.2 to $1. According to TipRanks data, the analyst has a success rate of 63.1% and a total average return of 6.7% over the past year. TipRanks, an independent third party, provides analysis data from financial analysts and calculates the Average Returns and Success Rates of the analysts' recommendations. The information presented is not an investment recommendation and is intended for informational purposes only. Success rate is the number of the analyst's successful ratings, divided by his/her total number of ratings over the past year. A successful rating is one based on if TipRanks' virtual portfolio earned a positive return from the stock. Total average return is the average rate of return that the TipRanks' virtual portfolio has earned over the past year. These portfolios are established based on the analyst's preliminary rating and are adjusted according to the changes in the rating. TipRanks provides a ranking of each analyst up to 5 stars, which is representative of all recommendations from the analyst. An analyst's past performance is evaluated on a scale of 1 to 5 stars, with more stars indicating better performance. The star level is determined by his/her total success rate and average return. Use the share button in your browser  to share the page with your friends",https://news.futunn.com/en/post/70775454/jp-morgan-upgrades-amp-limited-amltfus-to-buy-rating-cuts?level=1&data_ticket=1775439146969789
JPM,"JR6L ETF Analysis: Dividends, Returns SWB:JR6L - TradingView",2026-04-05 18:30:21,"Select market data provided by ICE Data Services. Select reference data provided by FactSet. Copyright © 2026 FactSet Research Systems Inc.Copyright © 2026, American Bankers Association. CUSIP Database provided by FactSet Research Systems Inc. All rights reserved. SEC fillings and other documents provided by Quartr.© 2026 TradingView, Inc.",https://www.tradingview.com/symbols/SWB-JR6L/analysis/
JPM,"J.P. Morgan Initiates Four Corners Property Trust Inc(FCPT.US) With Hold Rating, Announces Target Price $29 - 富途牛牛",2026-04-05 18:25:12,"J.P. Morgan analyst Anthony Paolone initiates coverage on $Four Corners Property Trust Inc (FCPT.US)$ with a hold rating, and sets the target price at $29. According to TipRanks data, the analyst has a success rate of 53.0% and a total average return of 2.3% over the past year. TipRanks, an independent third party, provides analysis data from financial analysts and calculates the Average Returns and Success Rates of the analysts' recommendations. The information presented is not an investment recommendation and is intended for informational purposes only. Success rate is the number of the analyst's successful ratings, divided by his/her total number of ratings over the past year. A successful rating is one based on if TipRanks' virtual portfolio earned a positive return from the stock. Total average return is the average rate of return that the TipRanks' virtual portfolio has earned over the past year. These portfolios are established based on the analyst's preliminary rating and are adjusted according to the changes in the rating. TipRanks provides a ranking of each analyst up to 5 stars, which is representative of all recommendations from the analyst. An analyst's past performance is evaluated on a scale of 1 to 5 stars, with more stars indicating better performance. The star level is determined by his/her total success rate and average return. Use the share button in your browser  to share the page with your friends",https://news.futunn.com/en/post/70669649/jp-morgan-initiates-four-corners-property-trust-inc-fcptus-with?level=1&data_ticket=1775439146969789
JPM,"JPM Apr 2026 297.500 call (JPM260410C00297500) stock price, news, quote and history - Yahoo Finance UK",2026-04-05 16:00:35,"Tip: Try a valid symbol or a specific company name for relevant results Stocks fall 📉 after Trump threatens to hit Iran ‘extremely hard’ 🇮🇷 💷 Pound jumps 📈 on hopes that Middle East war will end soon 📈 Stocks rally after Trump says US could leave Iran in a few weeks 📉 Gold prices 👑 set for worst month since 2008 as Iran war 🇮🇷 continues Oil prices 🛢️ pull lower following reports of Trump 🇺🇸 considering end to Middle East conflict Pound ticks higher as UK GDP growth 🇬🇧 confirmed as nearly stagnant in Q4 📊 Stocks set to rise 📈 as Trump willing to end Iran war 🇮🇷 without Hormuz deal Average UK house price 🏡 rises to £277,186 in March 📈 Mortgage approvals ✔️ jump by most since November, Bank of England 🏦 says Brent crude 🛢️ prices up to $115 a barrel 📈 as traders assess Trump peace deal claims Pound 💷 set for biggest monthly loss against dollar 💲 since October Stocks set to tumble as Middle East conflict intensifies Gold and silver prices rise 📈 with eyes on central banks and Iran war 💷 UK currency dips amid weaker retail sales while Middle East war ramps up inflation fears 💷 Stocks muted as Trump delays strikes on Iran power plants 🌍 Pound 💷 dips against dollar as OECD warns Middle East conflict will drive up UK inflation ⛽🛍️ Oil prices 🛢️ higher as Trump claims Iran doesn't want to admit they spoke 🗣️ Bitcoin price struggles near $70K as peace talk hopes falter Pound 💷 steady as Bank of England 🏦 interest rate rise bets ease Gold 🪙 price jumps ⬆️ 3% as oil slump eases inflation fears amid Trump Iran plan Stocks rise 📈 on reports of Trump offering 15-point ceasefire plan to Iran 🗒️ Oil price ⛽ plunges 📉 as Trump announces plan to end Iran war 💷 Pound dips against dollar 💵 as speculation around UK interest rates grow ⚡️ ASML, Estée Lauder, Bellway, Kingfisher and Fevertree ⚡️ ⚡️ Gold and silver price moves muted amid inflation and interest rate hike risks ⚡️ ⚡️ Stocks lack direction as traders assess Middle East conflict ⚡️ 🛢️Tehran's denial of negotiations clouds prospect of reopening Strait of Hormuz and ending conflict 🛢️ Pound 💷 dips against dollar 💲 amid mounting expectations of Bank of England 🏦 rate increase Gold 🪙 and silver erase 2026 gains as Middle East inflation fears stoke bets on higher rates London plunges into correction territory as Trump gives Iran ultimatum Oil prices ⛽ gain as Trump and Starmer discuss need to reopen Hormuz ⚡️ UK inflation, BYD, Next, Kingfisher and Bellway ⚡️ Gold 👑 set for third weekly fall 📉 as strong dollar and Fed stance weigh Pound steady 🇬🇧 as investors digest UK borrowing data 📊 and interest rate decisions Stocks higher 📈 as Netanyahu 🇮🇱 says he will 'hold off' on gas field attacks Oil prices 🛢️ fall as Netanyahu signals pause in Iran strikes 🇮🇷 Government borrowing rose 📈 by more than expected to £14.3bn in February ECB follows Bank of England with interest rate hold as Iran war intensifies 🚨 Bank of England holds rates at 3.75% amid Iran conflict 🚨 Tip: Try a valid symbol or a specific company name for relevant results",https://uk.finance.yahoo.com/quote/JPM260410C00297500/
JPM,"Iran threatens US-owned companies, including Meta and JP Morgan - AOL.com",2026-04-05 15:38:05,"Iran's Revolutionary Guard on Tuesday threatened US-owned companies with a presence in the Middle East. The companies include Tesla, JP Morgan, Microsoft, Apple, and others. The statement warned that the companies could be targeted as early as 8 p.m. in Iran on Wednesday. Iran's Islamic Revolutionary Guard Corps on Tuesday threatened US-owned companies with a presence in the Middle East, including Meta, Tesla, and Boeing. The statement, which was published by the IRGC-linked Tasnim News Agency, warned that the 18 companies listed could be targeted as early as 8 p.m. in Iran on Wednesday. The Pentagon, White House, and the majority of companies listed, including Dell, Cisco, Intel, and HP, did not respond to requests for comment. JPMorgan and Microsoft declined to comment. The IRGC statement advised workers to avoid their workplaces and the area within a one-kilometer radius of the locations. It's unclear how serious a threat it was. The IRGC made a similar threat regarding US-owned companies' infrastructure in Israel. The US has urged its citizens to reconsider travel to much of the Middle East, including the United Arab Emirates, ""due to the threat of armed conflict and terrorism."" The US and Israel began their joint operation against Iran on February 28. The strikes and retaliation from Iran have continued throughout the month, though there have been overtures to turn down the temperature and end the conflict.",https://www.aol.com/news/iran-threatens-us-owned-companies-074217036.html
JPM,"J.P. Morgan Predicts No Rate Cuts in 2026: Winners, Losers and the Dollar Impact - Yahoo Finance",2026-04-05 10:04:05,"Tip: Try a valid symbol or a specific company name for relevant results The direction of interest rates is notoriously hard to predict, but J.P. Morgan is on record as anticipating zero rate hikes in 2026. The bank sees a resilient economy and persistent inflation as likely to keep the Fed neutral for the duration of the year. Read More: I Asked ChatGPT What What Will Happen To the Economy If the Fed Keeps Cutting Interest Rates — Here’s What It Said Check Out: How Middle-Class Earners Are Quietly Becoming Millionaires — and How You Can, Too Here’s a look at who could be the winners and losers in the 2026 economy if that prediction holds true. Also see what a rate increase would mean for savings accounts. Interest rates have been slowly trickling down but remain elevated. For many savers, this translates to a boost in income without taking on additional risk. Here are the types of households that could benefit the most from high rates in 2026. Investors in high-yield savings accounts and certificates of deposit: Many of these types of FDIC-insured accounts still pay annual percentage yields (APYs) of up to 5%, according to Fortune. With a $100,000 balance, that translates to $5,000 in annual income, far above the near-zero rates during the pandemic. Retirees and near-retirees: Investors in their 50s and 60s tend to shift to a more conservative asset allocation, often involving a mix of U.S. Treasurys and FDIC-insured, short-term investments. Not only do these types of investments have low risk profiles, but they also pay 3.5% annually or more. Households with large cash reserves: Emergency funds are traditionally considered “dead money,” earning little to no return. But now, a $50,000 cash reserve earning a 4.5% APY generates about $2,250 per year. That can go a long way toward countering inflation. Dollar impact: Anyone earning interest instead of paying it can earn thousands of dollars more per year in interest income without having to change anything in their portfolios. Explore More: The New 2026 Wealth Thresholds — Where Your Income Places You in America’s Economic Ladder In the investing world, when there are winners, there are also losers. Here’s who might suffer the most from persistently high interest rates. New homebuyers and those with adjustable-rate mortgages: On a $400,000 loan, a 3% mortgage, which was easily obtainable during the COVID-19 pandemic, meant a monthly payment of about $1,700. But at 7%, that same mortgage jumps to roughly $2,500. Those with existing adjustable-rate mortgages may even see their monthly payments increase when their mortgages reset. Credit card borrowers with balances: At a 15% interest rate, a $10,000 balance will generate $1,500 in interest expense every year if the balance isn’t paid down. But at a 27% interest rate, that same $10,000 debt triggers $2,700 in interest annually, or about $100 more every single month. Auto and personal loan borrowers: Financing a $40,000 vehicle at 7% instead of 3% can add several thousand dollars in total interest over the life of the loan. Small-business owners: Loans and credit lines will remain expensive, squeezing profit margins and limiting expansion for many small-business owners. Dollar impact: Borrowers are at risk of paying hundreds to thousands of dollars more per month. Total interest costs will accrue more rapidly. 6 Costco Deals That Make Your Everyday Life Feel Slightly More Luxurious Jerry Seinfeld's Social Security Check vs. the Average American's 9 Low-Effort Ways To Make Passive Income (You Can Start This Week) 6 Safe Accounts Proven to Grow Your Money Up to 13x Faster This article originally appeared on GOBankingRates.com: J.P. Morgan Predicts No Rate Cuts in 2026: Winners, Losers and the Dollar Impact Tip: Try a valid symbol or a specific company name for relevant results",https://finance.yahoo.com/economy/policy/articles/j-p-morgan-predicts-no-100405524.html?guccounter=1&guce_referrer=aHR0cHM6Ly9uZXdzLmdvb2dsZS5jb20v&guce_referrer_sig=AQAAAJGhNCdlb4wUx1ow7KTU99LVKoB-oU71jMJ00Z8wjjNqMKkX4-Tk5An7KbPGT1d7y5xxQ7P5mkTE3PgjPstR-N3xw2JiT3m8BLrin9zjKqFoJBRw_P3PxI6X-euwaFFJyAkJi22kbdIpulXCpaYHfIwMZ6M9B4o59iTosk8RZiIl
JPM,Royal Fund Management LLC Raises Holdings in JPMorgan Chase & Co. $JPM - MarketBeat,2026-04-05 09:08:08,"Royal Fund Management LLC lifted its holdings in  JPMorgan Chase & Co. (NYSE:JPM) by 19.9% in the 4th quarter, according to its most recent Form 13F filing with the Securities and Exchange Commission (SEC). The fund owned 50,712 shares of the financial services provider's stock after purchasing an additional 8,405 shares during the quarter. JPMorgan Chase & Co. accounts for about  1.5% of Royal Fund Management LLC's investment portfolio, making the stock its 12th biggest holding. Royal Fund Management LLC's holdings in JPMorgan Chase & Co. were worth $16,163,000 as of its most recent SEC filing. Other hedge funds and other institutional investors have also recently modified their holdings of the company. Brighton Jones LLC lifted its stake in  JPMorgan Chase & Co. by 11.0% during the 4th quarter. Brighton Jones LLC now owns 48,732 shares of the financial services provider's stock valued at $11,682,000 after acquiring an additional 4,841 shares during the period.  Acorns Advisers LLC grew its stake in shares of  JPMorgan Chase & Co. by 6.9% in the first quarter. Acorns Advisers LLC now owns 1,547 shares of the financial services provider's stock worth $379,000 after acquiring an additional 100 shares during the period.  Ignite Planners LLC grew its stake in shares of  JPMorgan Chase & Co. by 0.7% in the second quarter. Ignite Planners LLC now owns 10,934 shares of the financial services provider's stock worth $3,185,000 after acquiring an additional 78 shares during the period.  Orleans Capital Management Corp LA raised its holdings in shares of  JPMorgan Chase & Co. by 12.4% during the second quarter. Orleans Capital Management Corp LA now owns 15,638 shares of the financial services provider's stock valued at $4,534,000 after purchasing an additional 1,720 shares during the last quarter.  Finally, Millington Financial Advisors LLC purchased a new position in shares of  JPMorgan Chase & Co. during the second quarter valued at approximately $240,000. 71.55% of the stock is owned by institutional investors. In related news, insider Robin Leopold sold 433 shares of JPMorgan Chase & Co. stock in a transaction on Monday, March 23rd. The stock was sold at an average price of $295.06, for a total transaction of $127,760.98. Following the transaction, the insider directly owned 64,920 shares in the company, valued at approximately $19,155,295.20. The trade was a 0.66% decrease in their ownership of the stock. The transaction was disclosed in a document filed with the Securities & Exchange Commission, which is accessible through the SEC website. Also, CEO Troy L. Rohrbaugh sold 50,000 shares of the business's stock in a transaction dated Thursday, February 19th. The shares were sold at an average price of $307.11, for a total value of $15,355,500.00. Following the sale, the chief executive officer directly owned 111,279 shares of the company's stock, valued at $34,174,893.69. This represents a 31.00% decrease in their position. The disclosure for this sale is available in the SEC filing. Insiders sold a total of 72,029 shares of company stock worth $22,195,693 over the last three months. 0.47% of the stock is currently owned by insiders. JPM opened at $294.66 on Friday. The company's 50 day moving average is $298.95 and its 200 day moving average is $307.16. The company has a current ratio of 0.85, a quick ratio of 0.85 and a debt-to-equity ratio of 1.27. The company has a market cap of $794.70 billion, a price-to-earnings ratio of 14.73, a PEG ratio of 1.41 and a beta of 1.05. JPMorgan Chase & Co. has a 12-month low of $202.16 and a 12-month high of $337.25. JPMorgan Chase & Co. (NYSE:JPM - Get Free Report) last announced its earnings results on Tuesday, January 13th. The financial services provider reported $5.23 EPS for the quarter, beating analysts' consensus estimates of $4.93 by $0.30. JPMorgan Chase & Co. had a net margin of 20.35% and a return on equity of 17.16%. The business had revenue of $45.80 billion during the quarter, compared to analysts' expectations of $45.98 billion. During the same period in the prior year, the company earned $4.81 earnings per share. The firm's revenue was up 7.1% on a year-over-year basis.  On average, equities research analysts predict that  JPMorgan Chase & Co. will post 18.1 EPS for the current year. The firm also recently disclosed a quarterly dividend, which will be paid on Thursday, April 30th. Stockholders of record on Monday, April 6th will be given a dividend of $1.50 per share. The ex-dividend date of this dividend is Monday, April 6th. This represents a $6.00 dividend on an annualized basis and a dividend yield of 2.0%. JPMorgan Chase & Co.'s payout ratio is presently 29.99%. A number of brokerages recently weighed in on JPM. Wolfe Research downgraded shares of JPMorgan Chase & Co. from an ""outperform"" rating to a ""peer perform"" rating in a research report on Wednesday, January 7th. Jefferies Financial Group assumed coverage on shares of JPMorgan Chase & Co. in a research note on Thursday, March 26th. They set a ""hold"" rating and a $310.00 target price for the company. Daiwa Securities Group increased their price target on JPMorgan Chase & Co. from $345.00 to $353.00 and gave the company an ""outperform"" rating in a report on Tuesday, January 6th. Wall Street Zen upgraded JPMorgan Chase & Co. from a ""sell"" rating to a ""hold"" rating in a research note on Sunday, January 18th. Finally, The Goldman Sachs Group lifted their price objective on JPMorgan Chase & Co. from $386.00 to $397.00 and gave the stock a ""buy"" rating in a report on Monday, January 26th. One equities research analyst  has rated the stock with a Strong Buy rating, fourteen have given a Buy rating and thirteen have given a Hold rating to the company's stock. According to data from MarketBeat, JPMorgan Chase & Co. presently has an average rating of ""Moderate Buy"" and a consensus target price of $336.48. Here are the key news stories impacting JPMorgan Chase & Co. this week: JPMorgan Chase & Co NYSE: JPM is a diversified global financial services firm headquartered in New York City. The company provides a wide range of banking and financial products and services to consumers, small businesses, corporations, governments and institutional investors worldwide. Its operations span retail banking, commercial lending, investment banking, asset management, payments and card services, and treasury and securities services. The firm's principal business activities are organized across several core lines: Consumer & Community Banking, which offers deposit accounts, mortgages, auto loans, credit cards and branch and digital banking under the Chase brand; Corporate & Investment Banking, which provides capital markets, advisory, underwriting, trading and risk management services; Commercial Banking, delivering lending, treasury and capital solutions to middle-market and corporate clients; and Asset & Wealth Management, which offers investment management, private banking and retirement services to institutions and high-net-worth individuals. Want to see what other hedge funds are holding JPM? Visit HoldingsChannel.com to get the latest 13F filings and insider trades for JPMorgan Chase & Co. (NYSE:JPM - Free Report). This instant news alert was generated by narrative science technology and financial data from MarketBeat in order to provide readers with the fastest reporting and unbiased coverage. Please send any questions or comments about this story to contact@marketbeat.com. Before you consider JPMorgan Chase & Co., you'll want to hear this. MarketBeat keeps track of Wall Street's top-rated and best performing research analysts and the stocks they recommend to their clients on a daily basis. MarketBeat has identified the five stocks that top analysts are quietly whispering to their clients to buy now before the broader market catches on... and JPMorgan Chase & Co. wasn't on the list. While JPMorgan Chase & Co. currently has a Moderate Buy rating among analysts, top-rated analysts believe these five stocks are better buys. With the proliferation of data centers and electric vehicles, the electric grid will only get more strained. Download this report to learn how energy stocks can play a role in your portfolio as the global demand for energy continues to grow. Sign up for MarketBeat All Access to gain access to MarketBeat's full suite of research tools. 345 N Reid Place, Suite 620, Sioux Falls, SD 57103
                                        
                                        contact@marketbeat.com
                                        
                                        (844) 978-6257 © MarketBeat Media, LLC 2010-2026. All rights reserved. © 2026   Fair market value prices are updated every minute and are provided by Massive. Other market data provided is at least 10-minutes delayed and hosted by Barchart Solutions.  Information is provided 'as-is' and solely for informational purposes, not for trading purposes or advice, and is delayed. To see all exchange delays and terms of use please see Barchart's disclaimer. We and our partners share information on your use of this website to help improve your experience. For more information, or to opt out click the Do Not Sell My Information button below.",https://www.marketbeat.com/instant-alerts/filing-royal-fund-management-llc-raises-holdings-in-jpmorgan-chase-co-jpm-2026-04-05/
