ticker,title,date,content,url
JPM,JPMorgan Chase & Co. $JPM Holdings Increased by Runnymede Capital Advisors Inc. - MarketBeat,2026-04-16 09:11:38,"Runnymede Capital Advisors Inc. grew its holdings in  JPMorgan Chase & Co. (NYSE:JPM - Free Report) by 2,333.5% during the fourth quarter, according to the company in its most recent disclosure with the Securities & Exchange Commission. The firm owned 15,672 shares of the financial services provider's stock after purchasing an additional 15,028 shares during the period. JPMorgan Chase & Co. comprises approximately  2.9% of Runnymede Capital Advisors Inc.'s holdings, making the stock its 9th largest holding. Runnymede Capital Advisors Inc.'s holdings in JPMorgan Chase & Co. were worth $5,050,000 as of its most recent SEC filing. Other hedge funds and other institutional investors have also bought and sold shares of the company. Mountain Hill Investment Partners Corp. purchased a new stake in  JPMorgan Chase & Co. in the third quarter worth $32,000.  Family Legacy Financial Solutions LLC boosted its position in  JPMorgan Chase & Co. by 92.6% in the 3rd quarter. Family Legacy Financial Solutions LLC now owns 104 shares of the financial services provider's stock valued at $33,000 after buying an additional 50 shares during the period.  Turning Point Benefit Group Inc. purchased a new stake in  JPMorgan Chase & Co. in the 3rd quarter valued at about $35,000.  Miller Global Investments LLC purchased a new stake in  JPMorgan Chase & Co. in the 4th quarter valued at about $52,000.  Finally, Collier Financial purchased a new stake in  JPMorgan Chase & Co. in the 3rd quarter valued at about $60,000. Hedge funds and other institutional investors own  71.55% of the company's stock. NYSE JPM opened at $305.99 on Thursday. The company has a quick ratio of 0.85, a current ratio of 0.86 and a debt-to-equity ratio of 1.30. The firm has a market cap of $820.72 billion, a PE ratio of 14.65, a price-to-earnings-growth ratio of 1.55 and a beta of 1.05. The company has a 50 day moving average price of $298.90 and a 200 day moving average price of $306.77. JPMorgan Chase & Co. has a 52 week low of $226.34 and a 52 week high of $337.25. JPMorgan Chase & Co. (NYSE:JPM - Get Free Report) last posted its quarterly earnings data on Tuesday, April 14th. The financial services provider reported $5.94 EPS for the quarter, topping the consensus estimate of $5.50 by $0.44. The firm had revenue of $50.54 billion during the quarter, compared to analyst estimates of $48.30 billion. JPMorgan Chase & Co. had a net margin of 20.66% and a return on equity of 17.54%. JPMorgan Chase & Co.'s revenue was up 10.0% on a year-over-year basis. During the same quarter in the previous year, the business posted $5.07 EPS.  As a group, sell-side analysts forecast that  JPMorgan Chase & Co. will post 18.1 EPS for the current fiscal year. The company also recently disclosed a quarterly dividend, which will be paid on Thursday, April 30th. Investors of record on Monday, April 6th will be paid a dividend of $1.50 per share. This represents a $6.00 annualized dividend and a dividend yield of 2.0%. The ex-dividend date is Monday, April 6th. JPMorgan Chase & Co.'s payout ratio is 29.99%. Several equities research analysts have issued reports on JPM shares. Daiwa Securities Group lowered their price objective on shares of JPMorgan Chase & Co. from $340.00 to $328.00 and set an ""outperform"" rating for the company in a research report on Tuesday, April 7th. Freedom Capital raised shares of JPMorgan Chase & Co. to a ""hold"" rating in a research report on Wednesday, January 14th. Wall Street Zen raised shares of JPMorgan Chase & Co. from a ""sell"" rating to a ""hold"" rating in a research report on Sunday, January 18th. Royal Bank Of Canada  reissued an ""outperform"" rating and issued a $330.00 price objective on shares of JPMorgan Chase & Co. in a research report on Wednesday, January 14th. Finally, Zacks Research cut shares of JPMorgan Chase & Co. from a ""strong-buy"" rating to a ""hold"" rating in a research report on Wednesday, April 8th. Fifteen analysts have rated the stock with a Buy rating and fifteen have given a Hold rating to the stock. According to data from MarketBeat.com, JPMorgan Chase & Co.  has an average rating of ""Moderate Buy"" and an average target price of $335.36. Here are the key news stories impacting JPMorgan Chase & Co. this week: In related news, COO Jennifer Piepszak sold 9,136 shares of the business's stock in a transaction that occurred on Wednesday, April 15th. The shares were sold at an average price of $306.56, for a total transaction of $2,800,732.16. Following the completion of the transaction, the chief operating officer owned 90,001 shares in the company, valued at $27,590,706.56. The trade was a 9.22% decrease in their position. The transaction was disclosed in a legal filing with the SEC, which is available through this link. The transaction was executed under a pre-arranged Rule 10b5-1 trading plan. Also, General Counsel Stacey Friedman sold 3,404 shares of the business's stock in a transaction that occurred on Friday, January 16th. The stock was sold at an average price of $312.80, for a total transaction of $1,064,771.20. Following the transaction, the general counsel owned 65,353 shares of the company's stock, valued at approximately $20,442,418.40. This trade represents a 4.95% decrease in their position. Additional details regarding this sale are available in the official SEC disclosure. Insiders have sold a total of 86,776 shares of company stock worth $26,716,478 over the last 90 days. 0.47% of the stock is currently owned by insiders. JPMorgan Chase & Co NYSE: JPM is a diversified global financial services firm headquartered in New York City. The company provides a wide range of banking and financial products and services to consumers, small businesses, corporations, governments and institutional investors worldwide. Its operations span retail banking, commercial lending, investment banking, asset management, payments and card services, and treasury and securities services. The firm's principal business activities are organized across several core lines: Consumer & Community Banking, which offers deposit accounts, mortgages, auto loans, credit cards and branch and digital banking under the Chase brand; Corporate & Investment Banking, which provides capital markets, advisory, underwriting, trading and risk management services; Commercial Banking, delivering lending, treasury and capital solutions to middle-market and corporate clients; and Asset & Wealth Management, which offers investment management, private banking and retirement services to institutions and high-net-worth individuals. This instant news alert was generated by narrative science technology and financial data from MarketBeat in order to provide readers with the fastest reporting and unbiased coverage. Please send any questions or comments about this story to contact@marketbeat.com. Before you consider JPMorgan Chase & Co., you'll want to hear this. MarketBeat keeps track of Wall Street's top-rated and best performing research analysts and the stocks they recommend to their clients on a daily basis. MarketBeat has identified the five stocks that top analysts are quietly whispering to their clients to buy now before the broader market catches on... and JPMorgan Chase & Co. wasn't on the list. While JPMorgan Chase & Co. currently has a Moderate Buy rating among analysts, top-rated analysts believe these five stocks are better buys. Market downturns give many investors pause, and for good reason. Wondering how to offset this risk? Click the link to learn more about using beta to protect your portfolio. Sign up for MarketBeat All Access to gain access to MarketBeat's full suite of research tools. 345 N Reid Place, Suite 620, Sioux Falls, SD 57103
                                        
                                        contact@marketbeat.com
                                        
                                        (844) 978-6257 © MarketBeat Media, LLC 2010-2026. All rights reserved. © 2026   Fair market value prices are updated every minute and are provided by Massive. Other market data provided is at least 10-minutes delayed and hosted by Barchart Solutions.  Information is provided 'as-is' and solely for informational purposes, not for trading purposes or advice, and is delayed. To see all exchange delays and terms of use please see Barchart's disclaimer. We and our partners share information on your use of this website to help improve your experience. For more information, or to opt out click the Do Not Sell My Information button below.",https://www.marketbeat.com/instant-alerts/filing-jpmorgan-chase-co-jpm-holdings-increased-by-runnymede-capital-advisors-inc-2026-04-16/
JPM,What philanthropists need to know about Trump accounts - J.P. Morgan Private Bank,2026-04-16 07:00:00,"The Private Bank’s mission is to build, preserve & transform our client’s wealth. We work with a variety of clients to help them achieve their unique ambitions. Our world-class economists, strategists, and investment specialists share their timely ideas and perspectives. We have worked with clients for more than 200 years to help them achieve their unique ambitions. The philanthropy landscape is changing in ways that greatly extend the reach of charitable giving. This is welcome news for donors large and small. While traditional approaches such as direct grants and institutional donations continue to prevail, today’s philanthropists can draw on a broader toolkit to pursue their goals. Credit the complementary powers of financial innovation and targeted public policy. The two forces come together in “Trump accounts,” (TAs), which were created as part of the One Big Beautiful Bill Act that was enacted last year.  As are tax-advantaged savings vehicles that encourage long-term investment starting in childhood. Think of a TA as an individual retirement account with a unique set of rules. These new accounts illustrate how public policy can establish the infrastructure that philanthropists can then use in their charitable endeavors. In this way, private capital and public systems can work together to expand economic opportunity. TAs can be established only for an “eligible individual,” who is both the account owner and beneficiary. The law defines an eligible individual as anyone who: To encourage families to open these accounts, the U.S. government will make $1,000 “pilot program” contributions to eligible TAs.1 Before the year the beneficiary turns 18 (years known as the account’s “growth period”), the account may invest only in “eligible investments.”2 After that period, the account beneficiary has unilateral access to the account, subject to early withdrawal penalties and ordinary income taxes. From a policy perspective, these accounts aim to expand asset ownership, encourage early participation in capital markets, and promote long-term financial accumulation. From a philanthropic perspective, the accounts allow donors to make contributions to TAs, targeting children with limited financial access or opportunity. TAs could complement traditional philanthropic strategies. For philanthropists who already support initiatives such as direct cash transfers, financial literacy programs, entrepreneurship initiatives and education access programs, TAs may serve as another useful approach. Some donors are using their philanthropic foundations to expand access to economic opportunities through TAs. Michael and Susan Dell have committed $6.25 billion through their charitable vehicles to give a financial head start to millions of children born before the federal newborn contribution dates. This gift is expected to seed 25 million accounts with $250 for eligible children born from 2016 to 2024 in ZIP codes with a median family income of $150,000 or less. It’s one of the largest single private commitments in history to America’s children, enabled through the direct giving mechanisms that are built into TAs. Dalio Philanthropies has committed to match the Dell donations for the same population of students in Connecticut, thus doubling the amount they will receive. The decision was “inspired by Ray’s personal start as a young investor and Barbara’s decades of experience working closely with at-risk and disconnected young people in Connecticut’s schools,” said a statement by the philanthropy, referring to Ray Dalio and his wife Barbara. “Ray Dalio feels he has lived the American Dream because of investing,” a Dalio spokesperson said. Ray and Barbara “are thrilled to provide this help along with the Dells and all the others who are behind the funding of Trump accounts.” The Dalio initiative includes tens of millions of dollars in deposits, contributions directed toward children in economically challenged communities and state-level participation to expand financial opportunity. The program aligns with the foundation’s focus on economic resilience and opportunity access. Initiatives such as TAs can supplement philanthropic options without replacing existing approaches such as foundations, direct grants and donor-advised funds. Policy-aligned contributions allow philanthropists to: As always, the most effective philanthropic strategies begin with clear objectives. When those are clearly defined, philanthropists can deploy the appropriate combination of tools (traditional grantmaking, direct cash transfers and savings vehicles) to build strategies with durable impact. Before adopting new structures, philanthropists should consider: Setting clear objectives, asking the right questions – these time-tested principles always apply across the philanthropy landscape, regardless of the new technique available to achieve charitable goals. Talk to your J.P. Morgan team to discuss how the TA initiative might align with your philanthropic goals. Any views, strategies or products discussed in this material may not be appropriate for all individuals and are subject to risks. Investors may get back less than they invested, and past performance is not a reliable indicator of future results. Asset allocation/diversification does not guarantee a profit or protect against loss. Nothing in this material should be relied upon in isolation for the purpose of making an investment decision. You are urged to consider carefully whether the services, products, asset classes (e.g. equities, fixed income, alternative investments, commodities, etc.) or strategies discussed are suitable to your needs. You must also consider the objectives, risks, charges, and expenses associated with an investment service, product or strategy prior to making an investment decision. For this and more complete information, including discussion of your goals/situation, contact your J.P. Morgan team. Certain information contained in this material is believed to be reliable; however, JPM does not represent or warrant its accuracy, reliability or completeness, or accept any liability for any loss or damage (whether direct or indirect) arising out of the use of all or any part of this material. No representation or warranty should be made with regard to any computations, graphs, tables, diagrams or commentary in this material, which are provided for illustration/reference purposes only. The views, opinions, estimates and strategies expressed in this material constitute our judgment based on current market conditions and are subject to change without notice. JPM assumes no duty to update any information in this material in the event that such information changes. Views, opinions, estimates and strategies expressed herein may differ from those expressed by other areas of JPM, views expressed for other purposes or in other contexts, and this material should not be regarded as a research report. Any projected results and risks are based solely on hypothetical examples cited, and actual results and risks will vary depending on specific circumstances. Forward-looking statements should not be considered as guarantees or predictions of future events. Nothing in this document shall be construed as giving rise to any duty of care owed to, or advisory relationship with, you or any third party. Nothing in this document shall be regarded as an offer, solicitation, recommendation or advice (whether financial, accounting, legal, tax or other) given by J.P. Morgan and/or its officers or employees, irrespective of whether or not such communication was given at your request. J.P. Morgan and its affiliates and employees do not provide tax, legal or accounting advice. You should consult your own tax, legal and accounting advisors before engaging in any financial transactions. We can help you navigate a complex financial landscape. Reach out today to learn how. 01 02 03 Would you like to be redirected? J.P. Morgan’s website and/or mobile terms, privacy and security policies don’t apply to the site or app you're about to visit. Please review its terms, privacy and security policies to see how they apply to you. J.P. Morgan isn’t responsible for (and doesn’t provide) any products, services or content at this third-party site or app, except for products and services that explicitly carry the J.P. Morgan name. Copyright © 2026 JPMorgan Chase & Co. All rights reserved. LEARN MORE About Our Firm and Investment Professionals Through FINRA BrokerCheck To learn more about J.P. Morgan’s investment business, including our accounts, products and services, as well as our relationship with you, please review our J.P. Morgan Securities LLC Form CRS and Guide to Investment Services and Brokerage Products. JPMorgan Chase Bank, N.A. and its affiliates (collectively ""JPMCB"") offer investment products, which may include bank-managed accounts and custody, as part of its trust and fiduciary services. Other investment products and services, such as brokerage and advisory accounts, are offered through J.P. Morgan Securities LLC (""JPMS""), a member of FINRA and SIPC. Insurance products are made available through Chase Insurance Agency, Inc. (CIA), a licensed insurance agency, doing business as Chase Insurance Agency Services, Inc. in Florida. JPMCB, JPMS and CIA are affiliated companies under the common control of JPMorgan Chase & Co. Products not available in all states. Please read the Legal Disclaimer for J.P. Morgan Private Bank regional affiliates and other important information in conjunction with these pages. Bank deposit products, such as checking, savings and bank lending and related services are offered by JPMorgan Chase Bank, N.A. Member FDIC. Not a commitment to lend. All extensions of credit are subject to credit approval. This policy explains how cookies are used on this website and other websites that are made available by J.P. Morgan Chase Bank, N.A. and its worldwide affiliates and subsidiaries (collectively, “J.P. Morgan,” “we,” or “us”). This policy may be amended or updated from time to time to reflect changes in our practices or changes in applicable law. We encourage you to read this policy carefully and regularly check this page to review any changes we may make. By using this site, you agree to J.P. Morgan’s use of cookies on your device in accordance with the terms of this policy. If you do not wish to accept cookies from this site, please either disable cookies or refrain from using this site.

            More information These cookies allow the technical operation of our websites or apps (e.g., cookies that enable you to navigate a website or app, and to use its features). Some may also increase the usability of our websites or apps by remembering your choices (e.g., language, region, login details, and so on).  You may be able to disable some or all necessary cookies by adjusting your browser settings.  If you choose to do so, however, you may experience reduced functionality or be prevented from using our websites or apps altogether. These cookies help us enhance the performance and usability of our websites or apps.  If you choose not to accept these cookies you may experience less than optimal performance. These cookies enable the website to provide enhanced functionality and personalization. They may be set by us or by third party providers whose services we have added to our pages. If you do not allow these cookies then some or all of these services may not function properly. These cookies help us evaluate the effectiveness of our marketing campaigns or to provide better targeting for marketing.  These cookies may collect personal data such as your name as well as information about how you interact with our websites, apps or marketing materials. These cookies help us evaluate the effectiveness of our marketing campaigns or to provide better targeting for marketing. These cookies may collect personal data such as your name as well as information about how you interact with our websites, apps or marketing materials. These cookies help us evaluate the effectiveness of our marketing campaigns or to provide better targeting for marketing. These cookies may collect personal data such as your name as well as information about how you interact with our websites, apps or marketing materials. These cookies help us ensure that we understand our audience as clearly as possible, and that any information that is provided to you is as relevant as possible to 
your interests and preferences.",https://privatebank.jpmorgan.com/nam/en/insights/markets-and-investing/ideas-and-insights/what-philanthropists-need-to-know-about-trump-accounts
