ticker,title,date,content,url
JPM,Mn Services Vermogensbeheer B.V. Has $203.68 Million Stock Position in JPMorgan Chase & Co. $JPM - MarketBeat,2026-04-04 09:19:25,"Mn Services Vermogensbeheer B.V. lifted its position in  JPMorgan Chase & Co. (NYSE:JPM - Free Report) by 15.2% in the fourth quarter, according to the company in its most recent 13F filing with the Securities & Exchange Commission. The institutional investor  owned 632,100 shares of the financial services provider's stock after buying an additional 83,400 shares during the period. JPMorgan Chase & Co. comprises  1.3% of Mn Services Vermogensbeheer B.V.'s holdings, making the stock its 11th largest position. Mn Services Vermogensbeheer B.V.'s holdings in JPMorgan Chase & Co. were worth $203,675,000 at the end of the most recent quarter. Several other hedge funds have also added to or reduced their stakes in JPM. Roxbury Financial LLC boosted its stake in  JPMorgan Chase & Co. by 0.4% in the 4th quarter. Roxbury Financial LLC now owns 8,011 shares of the financial services provider's stock valued at $2,581,000 after purchasing an additional 31 shares during the period.  Collective Family Office LLC increased its position in  JPMorgan Chase & Co. by 1.0% during the 4th quarter. Collective Family Office LLC now owns 3,339 shares of the financial services provider's stock worth $1,076,000 after buying an additional 32 shares during the period.  Peterson Wealth Advisors LLC increased its position in  JPMorgan Chase & Co. by 1.6% during the 3rd quarter. Peterson Wealth Advisors LLC now owns 2,063 shares of the financial services provider's stock worth $635,000 after buying an additional 33 shares during the period.  Rialto Wealth Management LLC lifted its holdings in shares of  JPMorgan Chase & Co. by 3.6% during the third quarter. Rialto Wealth Management LLC now owns 962 shares of the financial services provider's stock worth $304,000 after buying an additional 33 shares in the last quarter.  Finally, TradeWell Securities LLC. lifted its holdings in shares of  JPMorgan Chase & Co. by 0.3% during the third quarter. TradeWell Securities LLC. now owns 12,333 shares of the financial services provider's stock worth $3,832,000 after buying an additional 34 shares in the last quarter. Institutional investors and hedge funds own  71.55% of the company's stock. Several equities analysts recently commented on JPM shares. DZ Bank  restated a ""neutral"" rating on shares of JPMorgan Chase & Co. in a research note on Wednesday, January 14th. Freedom Capital upgraded shares of JPMorgan Chase & Co. to a ""hold"" rating in a research note on Wednesday, January 14th. HSBC cut their price objective on shares of JPMorgan Chase & Co. from $319.00 to $288.00 and set a ""hold"" rating for the company in a report on Wednesday. Wall Street Zen raised shares of JPMorgan Chase & Co. from a ""sell"" rating to a ""hold"" rating in a report on Sunday, January 18th. Finally, Truist Financial dropped their price target on shares of JPMorgan Chase & Co. from $334.00 to $330.00 in a research report on Wednesday, February 25th. One analyst  has rated the stock with a Strong Buy rating, fourteen have issued  a Buy rating and thirteen have assigned  a Hold rating to the company's stock. Based on data from MarketBeat.com, JPMorgan Chase & Co. presently has an average rating of ""Moderate Buy"" and a consensus target price of $336.48. Shares of JPMorgan Chase & Co. stock opened at $294.66 on Friday. The company has a quick ratio of 0.85, a current ratio of 0.85 and a debt-to-equity ratio of 1.27. JPMorgan Chase & Co. has a 12-month low of $202.16 and a 12-month high of $337.25. The company has a market capitalization of $794.70 billion, a price-to-earnings ratio of 14.73, a PEG ratio of 1.41 and a beta of 1.05. The firm's 50-day moving average price is $298.95 and its two-hundred day moving average price is $307.17. JPMorgan Chase & Co. (NYSE:JPM - Get Free Report) last issued its quarterly earnings results on Tuesday, January 13th. The financial services provider reported $5.23 earnings per share for the quarter, topping analysts' consensus estimates of $4.93 by $0.30. The company had revenue of $45.80 billion during the quarter, compared to the consensus estimate of $45.98 billion. JPMorgan Chase & Co. had a net margin of 20.35% and a return on equity of 17.16%. The firm's quarterly revenue was up 7.1% on a year-over-year basis. During the same quarter in the prior year, the firm posted $4.81 EPS.  On average, analysts forecast that  JPMorgan Chase & Co. will post 18.1 earnings per share for the current fiscal year. The company also recently disclosed a quarterly dividend, which will be paid on Thursday, April 30th. Shareholders of record on Monday, April 6th will be given a dividend of $1.50 per share. This represents a $6.00 annualized dividend and a yield of 2.0%. The ex-dividend date is Monday, April 6th. JPMorgan Chase & Co.'s payout ratio is currently 29.99%. In other news, CEO Troy L. Rohrbaugh sold 50,000 shares of the business's stock in a transaction on Thursday, February 19th. The stock was sold at an average price of $307.11, for a total transaction of $15,355,500.00. Following the completion of the transaction, the chief executive officer owned 111,279 shares of the company's stock, valued at approximately $34,174,893.69. The trade was a 31.00% decrease in their position. The transaction was disclosed in a filing with the Securities & Exchange Commission, which is accessible through this hyperlink. Also, General Counsel Stacey Friedman sold 3,404 shares of the company's stock in a transaction on Tuesday, February 17th. The stock was sold at an average price of $306.40, for a total value of $1,042,985.60. Following the sale, the general counsel owned 61,949 shares of the company's stock, valued at approximately $18,981,173.60. This represents a 5.21% decrease in their ownership of the stock. The SEC filing for this sale provides additional information. Over the last ninety days, insiders sold 72,029 shares of company stock valued at $22,195,693. Corporate insiders own  0.47% of the company's stock. Here are the key news stories impacting JPMorgan Chase & Co. this week: JPMorgan Chase & Co NYSE: JPM is a diversified global financial services firm headquartered in New York City. The company provides a wide range of banking and financial products and services to consumers, small businesses, corporations, governments and institutional investors worldwide. Its operations span retail banking, commercial lending, investment banking, asset management, payments and card services, and treasury and securities services. The firm's principal business activities are organized across several core lines: Consumer & Community Banking, which offers deposit accounts, mortgages, auto loans, credit cards and branch and digital banking under the Chase brand; Corporate & Investment Banking, which provides capital markets, advisory, underwriting, trading and risk management services; Commercial Banking, delivering lending, treasury and capital solutions to middle-market and corporate clients; and Asset & Wealth Management, which offers investment management, private banking and retirement services to institutions and high-net-worth individuals. This instant news alert was generated by narrative science technology and financial data from MarketBeat in order to provide readers with the fastest reporting and unbiased coverage. Please send any questions or comments about this story to contact@marketbeat.com. Before you consider JPMorgan Chase & Co., you'll want to hear this. MarketBeat keeps track of Wall Street's top-rated and best performing research analysts and the stocks they recommend to their clients on a daily basis. MarketBeat has identified the five stocks that top analysts are quietly whispering to their clients to buy now before the broader market catches on... and JPMorgan Chase & Co. wasn't on the list. While JPMorgan Chase & Co. currently has a Moderate Buy rating among analysts, top-rated analysts believe these five stocks are better buys. MarketBeat just released its list of the 7 hottest IPOs expected to hit Wall Street in 2026. See which companies are preparing to go public and why investors are watching closely. Sign up for MarketBeat All Access to gain access to MarketBeat's full suite of research tools. 345 N Reid Place, Suite 620, Sioux Falls, SD 57103
                                        
                                        contact@marketbeat.com
                                        
                                        (844) 978-6257 © MarketBeat Media, LLC 2010-2026. All rights reserved. © 2026   Fair market value prices are updated every minute and are provided by Massive. Other market data provided is at least 10-minutes delayed and hosted by Barchart Solutions.  Information is provided 'as-is' and solely for informational purposes, not for trading purposes or advice, and is delayed. To see all exchange delays and terms of use please see Barchart's disclaimer. We and our partners share information on your use of this website to help improve your experience. For more information, or to opt out click the Do Not Sell My Information button below.",https://www.marketbeat.com/instant-alerts/filing-mn-services-vermogensbeheer-bv-has-20368-million-stock-position-in-jpmorgan-chase-co-jpm-2026-04-04/
JPM,"Sjbenen Advisory LLC Buys Shares of 9,118 JPMorgan Chase & Co. $JPM - MarketBeat",2026-04-04 09:19:25,"Sjbenen Advisory LLC bought a new position in shares of  JPMorgan Chase & Co. (NYSE:JPM) during the fourth quarter, according to the company in its most recent 13F filing with the Securities & Exchange Commission. The firm bought 9,118 shares of the financial services provider's stock, valued at approximately $2,938,000. JPMorgan Chase & Co. comprises  1.6% of Sjbenen Advisory LLC's holdings, making the stock its 11th largest holding. Several other institutional investors also recently modified their holdings of JPM. Mountain Hill Investment Partners Corp. bought a new stake in  JPMorgan Chase & Co. in the third quarter valued at approximately $32,000.  Family Legacy Financial Solutions LLC raised its holdings in  JPMorgan Chase & Co. by 92.6% in the third quarter. Family Legacy Financial Solutions LLC now owns 104 shares of the financial services provider's stock worth $33,000 after purchasing an additional 50 shares during the period.  Turning Point Benefit Group Inc. bought a new position in shares of  JPMorgan Chase & Co. during the third quarter worth $35,000.  Miller Global Investments LLC bought a new position in shares of  JPMorgan Chase & Co. during the fourth quarter worth $52,000.  Finally, Collier Financial acquired a new position in shares of  JPMorgan Chase & Co. in the 3rd quarter valued at $60,000. 71.55% of the stock is currently owned by institutional investors and hedge funds. JPMorgan Chase & Co. stock opened at $294.66 on Friday. The company has a current ratio of 0.85, a quick ratio of 0.85 and a debt-to-equity ratio of 1.27. JPMorgan Chase & Co. has a 1-year low of $202.16 and a 1-year high of $337.25. The company has a fifty day simple moving average of $298.95 and a 200 day simple moving average of $307.17. The company has a market cap of $794.70 billion, a P/E ratio of 14.73, a price-to-earnings-growth ratio of 1.41 and a beta of 1.05. JPMorgan Chase & Co. (NYSE:JPM - Get Free Report) last issued its quarterly earnings results on Tuesday, January 13th. The financial services provider reported $5.23 EPS for the quarter, topping the consensus estimate of $4.93 by $0.30. The firm had revenue of $45.80 billion for the quarter, compared to analysts' expectations of $45.98 billion. JPMorgan Chase & Co. had a net margin of 20.35% and a return on equity of 17.16%. The company's revenue for the quarter was up 7.1% on a year-over-year basis. During the same period in the previous year, the firm posted $4.81 EPS.  Research analysts anticipate that  JPMorgan Chase & Co. will post 18.1 earnings per share for the current fiscal year. The business also recently announced a quarterly dividend, which will be paid on Thursday, April 30th. Investors of record on Monday, April 6th will be issued a dividend of $1.50 per share. This represents a $6.00 annualized dividend and a yield of 2.0%. The ex-dividend date is Monday, April 6th. JPMorgan Chase & Co.'s dividend payout ratio  is presently 29.99%. Here are the key news stories impacting JPMorgan Chase & Co. this week: In other JPMorgan Chase & Co. news, CEO Troy L. Rohrbaugh sold 50,000 shares of the business's stock in a transaction that occurred on Thursday, February 19th. The stock was sold at an average price of $307.11, for a total transaction of $15,355,500.00. Following the transaction, the chief executive officer owned 111,279 shares of the company's stock, valued at $34,174,893.69. The trade was a 31.00% decrease in their position. The transaction was disclosed in a document filed with the Securities & Exchange Commission, which is available through this link. Also, General Counsel Stacey Friedman sold 3,404 shares of the company's stock in a transaction that occurred on Friday, January 16th. The stock was sold at an average price of $312.80, for a total value of $1,064,771.20. Following the sale, the general counsel owned 65,353 shares in the company, valued at approximately $20,442,418.40. This represents a 4.95% decrease in their position. The disclosure for this sale is available in the SEC filing. In the last ninety days, insiders sold 72,029 shares of company stock valued at $22,195,693. Corporate insiders own  0.47% of the company's stock. Several analysts recently commented on JPM shares. TD Cowen  reaffirmed a ""buy"" rating on shares of JPMorgan Chase & Co. in a research note on Wednesday, January 7th. Wells Fargo & Company decreased their target price on JPMorgan Chase & Co. from $360.00 to $350.00 and set an ""overweight"" rating for the company in a research note on Tuesday, February 17th. Piper Sandler  reaffirmed an ""overweight"" rating and set a $325.00 price target (down from $345.00) on shares of JPMorgan Chase & Co. in a research report on Monday, March 30th. Barclays  reiterated a ""buy"" rating on shares of JPMorgan Chase & Co. in a report on Wednesday. Finally, HSBC decreased their price objective on JPMorgan Chase & Co. from $319.00 to $288.00 and set a ""hold"" rating for the company in a research report on Wednesday. One equities research analyst  has rated the stock with a Strong Buy rating, fourteen have given a Buy rating and thirteen have given a Hold rating to the stock. According to MarketBeat.com, the company  has a consensus rating of ""Moderate Buy"" and an average target price of $336.48. Get Our Latest Stock Analysis on JPMorgan Chase & Co. JPMorgan Chase & Co NYSE: JPM is a diversified global financial services firm headquartered in New York City. The company provides a wide range of banking and financial products and services to consumers, small businesses, corporations, governments and institutional investors worldwide. Its operations span retail banking, commercial lending, investment banking, asset management, payments and card services, and treasury and securities services. The firm's principal business activities are organized across several core lines: Consumer & Community Banking, which offers deposit accounts, mortgages, auto loans, credit cards and branch and digital banking under the Chase brand; Corporate & Investment Banking, which provides capital markets, advisory, underwriting, trading and risk management services; Commercial Banking, delivering lending, treasury and capital solutions to middle-market and corporate clients; and Asset & Wealth Management, which offers investment management, private banking and retirement services to institutions and high-net-worth individuals. Want to see what other hedge funds are holding JPM? Visit HoldingsChannel.com to get the latest 13F filings and insider trades for JPMorgan Chase & Co. (NYSE:JPM - Free Report). This instant news alert was generated by narrative science technology and financial data from MarketBeat in order to provide readers with the fastest reporting and unbiased coverage. Please send any questions or comments about this story to contact@marketbeat.com. Before you consider JPMorgan Chase & Co., you'll want to hear this. MarketBeat keeps track of Wall Street's top-rated and best performing research analysts and the stocks they recommend to their clients on a daily basis. MarketBeat has identified the five stocks that top analysts are quietly whispering to their clients to buy now before the broader market catches on... and JPMorgan Chase & Co. wasn't on the list. While JPMorgan Chase & Co. currently has a Moderate Buy rating among analysts, top-rated analysts believe these five stocks are better buys. Discover the next wave of investment opportunities with our report, 7 Stocks That Will Be Magnificent in 2026. Explore companies poised to replicate the growth, innovation, and value creation of the tech giants dominating today's markets. Sign up for MarketBeat All Access to gain access to MarketBeat's full suite of research tools. 345 N Reid Place, Suite 620, Sioux Falls, SD 57103
                                        
                                        contact@marketbeat.com
                                        
                                        (844) 978-6257 © MarketBeat Media, LLC 2010-2026. All rights reserved. © 2026   Fair market value prices are updated every minute and are provided by Massive. Other market data provided is at least 10-minutes delayed and hosted by Barchart Solutions.  Information is provided 'as-is' and solely for informational purposes, not for trading purposes or advice, and is delayed. To see all exchange delays and terms of use please see Barchart's disclaimer. We and our partners share information on your use of this website to help improve your experience. For more information, or to opt out click the Do Not Sell My Information button below.",https://www.marketbeat.com/instant-alerts/filing-sjbenen-advisory-llc-buys-shares-of-9118-jpmorgan-chase-co-jpm-2026-04-04/
