ticker,title,date,content,url
JPM,"Jamie Dimon calls Crypto Tokens ""decentralized Ponzi schemes."" - C-SPAN",2026-04-18 23:00:44,"Your gift supports C-SPAN’s mission to provide unedited, unfiltered coverage of government. Make your gift today Sign up for our inside Washington daily newsletter J.P. Morgan Chase CEO Jamie Dimon: ""I'm a major skeptic on crypto tokens which you call currency, like Bitcoin. They are decentralized Ponzi schemes."" *This text was compiled from uncorrected Closed Captioning. These cookies allow us to count visits and traffic sources so we can measure and improve the performance of our site. They help us to know which pages are the most and least popular and see how visitors move around the site. All information these cookies collect is aggregated and therefore anonymous. If you do not allow these cookies we will not know when you have visited our site, and will not be able to monitor its performance. These cookies may be set through our site by our advertising partners. They may be used by those companies to build a profile of your interests and show you relevant adverts on other sites. They do not store directly personal information, but are based on uniquely identifying your browser and internet device. If you do not allow these cookies, you will experience less targeted advertising. These cookies enable the website to provide enhanced functionality and personalisation. They may be set by us or by third party providers whose services we have added to our pages. If you do not allow these cookies then some or all of these services may not function properly. These cookies are necessary for the website to function and cannot be switched off in our systems. They are usually only set in response to actions made by you which amount to a request for services, such as setting your privacy preferences, logging in or filling in forms. You can set your browser to block or alert you about these cookies, but some parts of the site will not then work. These cookies do not store any personally identifiable information.",https://www.c-span.org/video/?c5032117/jamie-dimon-calls-crypto-tokens-decentralized-ponzi-schemes
JPM,"Big Tech, JP Morgan Chase demand vibecoding from students - The Pace Press",2026-04-18 18:29:36,"Five great New York movies to watch while sitting in traffic bored out of your mind University President Marvin Krislov’s decision to not seek third term The Week in the Life of the Opinions & Editorials  Editor ‘Life is Strange’ series adaptation is coming to Prime Video A comprehensive guide to Brooklyn's best thrift stores AI leaders from Apple, Google, and JP Morgan Chase spoke at the 2026 International Women’s Day: Break the Pattern with AI conference on Friday at the ninth floor Seidenberg Design Factory. The conference pushed students to vibecode (coding using LLMs), to create projects that will improve their hireability. Vibecoding, which has been a buzzword since 2025, allows even non-coders to write English prompts and get computer code back from their AI assistants. A s Geetu Aggarwal, a VP at JP Morgan Chase and a University Alum, stated, “We are all integrated from AI, coding, testing, everything is done by agents now. At Chase it’s not a requirement — the financial requirements — they have their own version of everything there. Even Jiras are integrated with our environment. So you say this is the Jira I’m working on and ask a LLM what are the steps to work on this code. You are no longer coding yourself.” AI is now embedded within their issue tracking and ticketing system — Jira — and aids in the analysis and solving of problems recorded in that system. Developers no longer need to fix the bugs that the AI has located, as they have traditionally done. Aggarwal continued, stating that “You should know basic code like computer science stuff. Even if it’s generated by AI you need to see ‘is this answer the most reasonable answer to my situation?’ It will go and update the code as well; everything is done by the agent. Chase has an initiative to train everybody in basic AI use. We are even using Claude right now and external APIs to some extent.” As vibecoding becomes integrated within software development jobs, it becomes less important for coders to know coding. When asked if a candidate who knows how to vibecode should be chosen over a candidate who knows how to code, Aggerwal gave a revelatory answer: “Which candidate should you pick? Realistically, if you are going to search for a job, you need to have social skills.” Aggarwal went on to clarify that speaking to AI is a new type of social skill, which is integral to vibecoding. She clearly stated, “This is the need of organizations right now. If you are not being taught AI, take the initiative, join a club. It is very hard for a university to start a class [on vibecoding] because of the resources required. So if the school isn’t there, you can still learn it by participating in clubs.” Kartik Derasari, a Solutions Engineering Lead at Persistent and Google Developer Expert, delivered a presentation emphasizing the use of Google Agent Development Kit (ADK) titled “Building a Multi-Agentic Ecosystem using Google AI stack.” He explained how AI agents must be able to operate autonomously, adapt to changes in their environments, learn and collaborate with other agents. He highlighted multimodality, reasoning, agentic workflows and AI changing how people access information as new ideas that break the pattern of how computing has been done for the previous 55 years. AI agents, which can rewrite entire codebases with one prompt, are the latest evolution in this story. Today, the emphasis for job-seekers is on orchestrating agents that specialize and take action rather than simple prompt engineering. Derasari thinks AI agents, enhanced with tools like Google Search, can solve problems LLMs without access to such tools cannot. When asked, only two people in the crowd raised their hand saying they had built an agentic tool. One clarified they used OpenClaw. Employers demand AI skills, but nearly all of the Seidenberg students in attendance had not solved problems using agents in their classes. “Managed context protocol connects agents to tools, A2A connects agents to each other. Agents will give each other agent cards to understand each others’ purpose and capabilities,” Derasari said. He imagines a rich ecosystem of agents whose skills are delineated in SKILL.md files. Most Google apps work with ADK, including Firebase, Flutter, Android, Workspace, Maps, Angular and Stitch. He suggested GeminiCLI, noting its large context window, ability to plan, code, test and correct itself based on terminal output autonomously and grounding with Search. Google Cloud’s free tier was praised. “Let’s say you create an agent. Until you get 2 million calls to your agent per month, it’s completely free.” Attendees created their own multi-agent systems. The speech got in line behind a decades-long history of computers making work more interactive and efficient. Bill Gates, for example, once demoed a mortgage approval tool whereby a loan amount exceeding a threshold can be sent to a manager for approval. Chanel Power asked students to share one thing standing between them and their dream job. According to her slides, 40 percent of job-seekers think they are ill-equipped for the AI skills required to get tech roles. Power stated that candidates need to “leverage” AI to spam keywords in job descriptions on their resume. The polite term she used for this phenomenon which is required of candidates by applicant tracking systems (ATS), often described as humiliating, is a “gap analysis.” She instructed attendees to ask NotebookLM what project they should build within a few months to increase their ATS score. No human ingenuity nor inspiration was involved in the making of this human professional development. “This is not cheating, this is about building projects faster. You should avoid going to an interview not knowing what is in your Github projects,” Power stated. In her speech, Power suggested that attendees automate networking using Sheets, Forms and Calendar scheduling links and Apps Script. The event, a barrage of sparkle and star emojis, was punctuated with a fashion show. As the stage transformed into a runway and a procession of models emerged, the crowd forgot about job loss caused by AI and appreciated the AI-generated designs. A student-operated monthly newspaper run out of Pace University's New York City campus. Your email address will not be published. Required fields are marked * Email * Email address verification requiredWe will send you an email with a verification link after you submit your comment. You must click that link or your comment will be discarded. Your email address will not be publicly displayed.",https://thepacepress.org/13590/news/big-tech-jp-morgan-chase-demand-vibecoding-from-students/
JPM,Triad Wealth Partners LLC Boosts Stake in JPMorgan Chase & Co. $JPM - MarketBeat,2026-04-18 09:19:55,"Triad Wealth Partners LLC lifted its holdings in  JPMorgan Chase & Co. (NYSE:JPM) by 54.4% during the fourth quarter, according to the company in its most recent Form 13F filing with the Securities and Exchange Commission (SEC). The institutional investor  owned 15,964 shares of the financial services provider's stock after buying an additional 5,626 shares during the quarter. Triad Wealth Partners LLC's holdings in JPMorgan Chase & Co. were worth $5,144,000 as of its most recent SEC filing. Several other hedge funds and other institutional investors have also recently bought and sold shares of JPM. Brighton Jones LLC raised its holdings in  JPMorgan Chase & Co. by 11.0% during the fourth quarter. Brighton Jones LLC now owns 48,732 shares of the financial services provider's stock worth $11,682,000 after purchasing an additional 4,841 shares during the last quarter.  Acorns Advisers LLC raised its holdings in  JPMorgan Chase & Co. by 6.9% during the first quarter. Acorns Advisers LLC now owns 1,547 shares of the financial services provider's stock worth $379,000 after purchasing an additional 100 shares during the last quarter.  Ignite Planners LLC raised its holdings in  JPMorgan Chase & Co. by 0.7% during the second quarter. Ignite Planners LLC now owns 10,934 shares of the financial services provider's stock worth $3,185,000 after purchasing an additional 78 shares during the last quarter.  Jump Financial LLC acquired a new position in  JPMorgan Chase & Co. during the second quarter worth $1,475,000.  Finally, Betterment LLC raised its holdings in  JPMorgan Chase & Co. by 27.5% during the second quarter. Betterment LLC now owns 1,970 shares of the financial services provider's stock worth $571,000 after purchasing an additional 425 shares during the last quarter. 71.55% of the stock is owned by institutional investors and hedge funds. Several equities analysts recently issued reports on JPM shares. Jefferies Financial Group lifted their price objective on JPMorgan Chase & Co. from $310.00 to $320.00 and gave the stock a ""hold"" rating in a report on Wednesday. DZ Bank  reaffirmed a ""neutral"" rating on shares of JPMorgan Chase & Co. in a report on Wednesday. Autonomous Res reduced their price objective on JPMorgan Chase & Co. from $360.00 to $324.00 and set a ""neutral"" rating for the company in a report on Monday, April 6th. The Goldman Sachs Group  set a $361.00 price target on JPMorgan Chase & Co. in a report on Tuesday. Finally, Wells Fargo & Company cut their price target on JPMorgan Chase & Co. from $360.00 to $350.00 and set an ""overweight"" rating for the company in a report on Tuesday, February 17th. Fifteen research analysts have rated the stock with a Buy rating and fifteen have issued  a Hold rating to the company's stock. According to MarketBeat, the stock currently has a consensus rating of ""Moderate Buy"" and a consensus price target of $336.16. Here are the key news stories impacting JPMorgan Chase & Co. this week: In related news, General Counsel Stacey Friedman sold 3,404 shares of the company's stock in a transaction on Tuesday, February 17th. The stock was sold at an average price of $306.40, for a total value of $1,042,985.60. Following the completion of the transaction, the general counsel directly owned 61,949 shares in the company, valued at approximately $18,981,173.60. This represents a 5.21% decrease in their ownership of the stock. The transaction was disclosed in a document filed with the SEC, which can be accessed through the SEC website. Also, insider Robin Leopold sold 433 shares of the company's stock in a transaction on Monday, March 23rd. The shares were sold at an average price of $295.06, for a total value of $127,760.98. Following the completion of the transaction, the insider owned 64,920 shares of the company's stock, valued at $19,155,295.20. The trade was a 0.66% decrease in their ownership of the stock. The SEC filing for this sale provides additional information. In the last three months, insiders sold 71,908 shares of company stock valued at $22,065,882. Corporate insiders own  0.47% of the company's stock. NYSE JPM opened at $310.67 on Friday. JPMorgan Chase & Co. has a fifty-two week low of $226.34 and a fifty-two week high of $337.25. The stock has a market cap of $833.29 billion, a price-to-earnings ratio of 14.88, a price-to-earnings-growth ratio of 1.52 and a beta of 1.05. The business has a fifty day moving average of $298.65 and a 200-day moving average of $306.76. The company has a quick ratio of 0.85, a current ratio of 0.86 and a debt-to-equity ratio of 1.30. JPMorgan Chase & Co. (NYSE:JPM - Get Free Report) last released its quarterly earnings results on Tuesday, April 14th. The financial services provider reported $5.94 earnings per share for the quarter, topping analysts' consensus estimates of $5.50 by $0.44. JPMorgan Chase & Co. had a return on equity of 17.54% and a net margin of 20.66%.The company had revenue of $50.54 billion during the quarter, compared to analysts' expectations of $48.30 billion. During the same period in the previous year, the firm posted $5.07 earnings per share. The business's revenue for the quarter was up 10.0% compared to the same quarter last year.  As a group, analysts predict that  JPMorgan Chase & Co. will post 18.1 earnings per share for the current fiscal year. The firm also recently announced a quarterly dividend, which will be paid on Thursday, April 30th. Investors of record on Monday, April 6th will be paid a $1.50 dividend. This represents a $6.00 annualized dividend and a yield of 1.9%. The ex-dividend date is Monday, April 6th. JPMorgan Chase & Co.'s dividend payout ratio  is presently 28.74%. JPMorgan Chase & Co NYSE: JPM is a diversified global financial services firm headquartered in New York City. The company provides a wide range of banking and financial products and services to consumers, small businesses, corporations, governments and institutional investors worldwide. Its operations span retail banking, commercial lending, investment banking, asset management, payments and card services, and treasury and securities services. The firm's principal business activities are organized across several core lines: Consumer & Community Banking, which offers deposit accounts, mortgages, auto loans, credit cards and branch and digital banking under the Chase brand; Corporate & Investment Banking, which provides capital markets, advisory, underwriting, trading and risk management services; Commercial Banking, delivering lending, treasury and capital solutions to middle-market and corporate clients; and Asset & Wealth Management, which offers investment management, private banking and retirement services to institutions and high-net-worth individuals. Want to see what other hedge funds are holding JPM? Visit HoldingsChannel.com to get the latest 13F filings and insider trades for JPMorgan Chase & Co. (NYSE:JPM - Free Report). This instant news alert was generated by narrative science technology and financial data from MarketBeat in order to provide readers with the fastest reporting and unbiased coverage. Please send any questions or comments about this story to contact@marketbeat.com. Before you consider JPMorgan Chase & Co., you'll want to hear this. MarketBeat keeps track of Wall Street's top-rated and best performing research analysts and the stocks they recommend to their clients on a daily basis. MarketBeat has identified the five stocks that top analysts are quietly whispering to their clients to buy now before the broader market catches on... and JPMorgan Chase & Co. wasn't on the list. While JPMorgan Chase & Co. currently has a Moderate Buy rating among analysts, top-rated analysts believe these five stocks are better buys. Looking to profit from the electric vehicle mega-trend? Click the link to see our list of which EV stocks show the most long-term potential. Sign up for MarketBeat All Access to gain access to MarketBeat's full suite of research tools. 345 N Reid Place, Suite 620, Sioux Falls, SD 57103
                                        
                                        contact@marketbeat.com
                                        
                                        (844) 978-6257 © MarketBeat Media, LLC 2010-2026. All rights reserved. © 2026   Fair market value prices are updated every minute and are provided by Massive. Other market data provided is at least 10-minutes delayed and hosted by Barchart Solutions.  Information is provided 'as-is' and solely for informational purposes, not for trading purposes or advice, and is delayed. To see all exchange delays and terms of use please see Barchart's disclaimer. We and our partners share information on your use of this website to help improve your experience. For more information, or to opt out click the Do Not Sell My Information button below.",https://www.marketbeat.com/instant-alerts/filing-triad-wealth-partners-llc-boosts-stake-in-jpmorgan-chase-co-jpm-2026-04-18/
