ticker,title,date,content,url
JPM,V Square Quantitative Management LLC Buys New Shares in JPMorgan Chase & Co. $JPM - MarketBeat,2026-04-17 09:18:43,"V Square Quantitative Management LLC purchased a new position in  JPMorgan Chase & Co. (NYSE:JPM) in the 4th quarter, according to the company in its most recent Form 13F filing with the Securities & Exchange Commission. The institutional investor  purchased 7,733 shares of the financial services provider's stock, valued at approximately $2,492,000. Several other hedge funds have also recently added to or reduced their stakes in JPM. Triangle Securities Wealth Management increased its holdings in shares of  JPMorgan Chase & Co. by 14.1% during the third quarter. Triangle Securities Wealth Management now owns 25,822 shares of the financial services provider's stock worth $8,145,000 after buying an additional 3,191 shares in the last quarter.  Newbridge Financial Services Group Inc. increased its holdings in shares of  JPMorgan Chase & Co. by 51.7% during the fourth quarter. Newbridge Financial Services Group Inc. now owns 8,883 shares of the financial services provider's stock worth $2,862,000 after buying an additional 3,027 shares in the last quarter.  Andra AP fonden increased its holdings in shares of  JPMorgan Chase & Co. by 3.2% during the third quarter. Andra AP fonden now owns 107,700 shares of the financial services provider's stock worth $33,972,000 after buying an additional 3,300 shares in the last quarter.  Banco Santander S.A. increased its holdings in shares of  JPMorgan Chase & Co. by 9.0% during the third quarter. Banco Santander S.A. now owns 452,612 shares of the financial services provider's stock worth $142,767,000 after buying an additional 37,550 shares in the last quarter.  Finally, Brighton Jones LLC increased its holdings in shares of  JPMorgan Chase & Co. by 11.0% during the fourth quarter. Brighton Jones LLC now owns 48,732 shares of the financial services provider's stock worth $11,682,000 after buying an additional 4,841 shares in the last quarter. Institutional investors and hedge funds own  71.55% of the company's stock. Here are the key news stories impacting JPMorgan Chase & Co. this week: Several analysts have recently weighed in on the stock. Wells Fargo & Company dropped their price objective on shares of JPMorgan Chase & Co. from $360.00 to $350.00 and set an ""overweight"" rating for the company in a report on Tuesday, February 17th. Barclays  reaffirmed a ""buy"" rating on shares of JPMorgan Chase & Co. in a report on Tuesday. CICC Research assumed coverage on shares of JPMorgan Chase & Co. in a report on Wednesday, January 14th. They set an ""outperform"" rating and a $355.00 price objective for the company. Zacks Research lowered shares of JPMorgan Chase & Co. from a ""strong-buy"" rating to a ""hold"" rating in a report on Wednesday, April 8th. Finally, Wolfe Research lowered shares of JPMorgan Chase & Co. from an ""outperform"" rating to a ""peer perform"" rating in a report on Wednesday, January 7th. Fifteen analysts have rated the stock with a Buy rating and fifteen have assigned  a Hold rating to the company. According to data from MarketBeat.com, JPMorgan Chase & Co. currently has an average rating of ""Moderate Buy"" and a consensus price target of $335.36. Check Out Our Latest Research Report on JPMorgan Chase & Co. In other JPMorgan Chase & Co. news, General Counsel Stacey Friedman sold 3,404 shares of the firm's stock in a transaction that occurred on Tuesday, February 17th. The shares were sold at an average price of $306.40, for a total value of $1,042,985.60. Following the transaction, the general counsel directly owned 61,949 shares of the company's stock, valued at approximately $18,981,173.60. This trade represents a 5.21% decrease in their ownership of the stock. The sale was disclosed in a legal filing with the Securities & Exchange Commission, which can be accessed through the SEC website. Also, CEO Troy L. Rohrbaugh sold 50,000 shares of the firm's stock in a transaction that occurred on Thursday, February 19th. The shares were sold at an average price of $307.11, for a total transaction of $15,355,500.00. Following the completion of the transaction, the chief executive officer directly owned 111,279 shares in the company, valued at approximately $34,174,893.69. The trade was a 31.00% decrease in their ownership of the stock. The SEC filing for this sale provides additional information. In the last quarter, insiders sold 71,908 shares of company stock valued at $22,065,882. 0.47% of the stock is currently owned by company insiders. Shares of JPM stock opened at $309.75 on Friday. JPMorgan Chase & Co. has a 52-week low of $226.34 and a 52-week high of $337.25. The stock has a market cap of $830.82 billion, a PE ratio of 14.83, a PEG ratio of 1.51 and a beta of 1.05. The company has a debt-to-equity ratio of 1.30, a quick ratio of 0.85 and a current ratio of 0.86. The firm's 50 day moving average price is $298.89 and its two-hundred day moving average price is $306.79. JPMorgan Chase & Co. (NYSE:JPM - Get Free Report) last announced its quarterly earnings data on Tuesday, April 14th. The financial services provider reported $5.94 earnings per share (EPS) for the quarter, beating analysts' consensus estimates of $5.50 by $0.44. JPMorgan Chase & Co. had a net margin of 20.66% and a return on equity of 17.54%. The firm had revenue of $50.54 billion for the quarter, compared to analysts' expectations of $48.30 billion. During the same period last year, the firm earned $5.07 earnings per share. The business's revenue for the quarter was up 10.0% on a year-over-year basis.  As a group, analysts forecast that  JPMorgan Chase & Co. will post 18.1 EPS for the current year. The firm also recently disclosed a quarterly dividend, which will be paid on Thursday, April 30th. Shareholders of record on Monday, April 6th will be paid a $1.50 dividend. The ex-dividend date of this dividend is Monday, April 6th. This represents a $6.00 dividend on an annualized basis and a yield of 1.9%. JPMorgan Chase & Co.'s dividend payout ratio (DPR) is presently 29.99%. JPMorgan Chase & Co NYSE: JPM is a diversified global financial services firm headquartered in New York City. The company provides a wide range of banking and financial products and services to consumers, small businesses, corporations, governments and institutional investors worldwide. Its operations span retail banking, commercial lending, investment banking, asset management, payments and card services, and treasury and securities services. The firm's principal business activities are organized across several core lines: Consumer & Community Banking, which offers deposit accounts, mortgages, auto loans, credit cards and branch and digital banking under the Chase brand; Corporate & Investment Banking, which provides capital markets, advisory, underwriting, trading and risk management services; Commercial Banking, delivering lending, treasury and capital solutions to middle-market and corporate clients; and Asset & Wealth Management, which offers investment management, private banking and retirement services to institutions and high-net-worth individuals. Want to see what other hedge funds are holding JPM? Visit HoldingsChannel.com to get the latest 13F filings and insider trades for JPMorgan Chase & Co. (NYSE:JPM - Free Report). This instant news alert was generated by narrative science technology and financial data from MarketBeat in order to provide readers with the fastest reporting and unbiased coverage. Please send any questions or comments about this story to contact@marketbeat.com. Before you consider JPMorgan Chase & Co., you'll want to hear this. MarketBeat keeps track of Wall Street's top-rated and best performing research analysts and the stocks they recommend to their clients on a daily basis. MarketBeat has identified the five stocks that top analysts are quietly whispering to their clients to buy now before the broader market catches on... and JPMorgan Chase & Co. wasn't on the list. While JPMorgan Chase & Co. currently has a Moderate Buy rating among analysts, top-rated analysts believe these five stocks are better buys. We are about to experience the greatest A.I. boom in stock market history...

Thanks to a pivotal economic catalyst, specific tech stocks will skyrocket just like they did during the ""dot com"" boom in the 1990s.

That’s why, we’ve hand-selected 7 tiny tech disruptor stocks positioned to surge. Sign up for MarketBeat All Access to gain access to MarketBeat's full suite of research tools. 345 N Reid Place, Suite 620, Sioux Falls, SD 57103
                                        
                                        contact@marketbeat.com
                                        
                                        (844) 978-6257 © MarketBeat Media, LLC 2010-2026. All rights reserved. © 2026   Fair market value prices are updated every minute and are provided by Massive. Other market data provided is at least 10-minutes delayed and hosted by Barchart Solutions.  Information is provided 'as-is' and solely for informational purposes, not for trading purposes or advice, and is delayed. To see all exchange delays and terms of use please see Barchart's disclaimer. We and our partners share information on your use of this website to help improve your experience. For more information, or to opt out click the Do Not Sell My Information button below.",https://www.marketbeat.com/instant-alerts/filing-v-square-quantitative-management-llc-buys-new-shares-in-jpmorgan-chase-co-jpm-2026-04-17/
JPM,Emerging markets may offer more than meets the eye. Selectivity matters. - J.P. Morgan Private Bank,2026-04-17 05:00:00,"The Private Bank’s mission is to build, preserve & transform our client’s wealth. We work with a variety of clients to help them achieve their unique ambitions. Our world-class economists, strategists, and investment specialists share their timely ideas and perspectives. We have worked with clients for more than 200 years to help them achieve their unique ambitions. A rise in global conflict and pickup in market volatility would normally argue for caution on emerging markets (EMs). This riskier backdrop can feed inflation, pressure currencies, tighten financial conditions and reinforce the kind of risk-off positioning that tends to weigh on countries outside of the developed world. Yet that familiar playbook has not fully matched market behavior. EMs have outperformed most developed market peers through the war in Iran and year-to-date. This is because many economies are less capital reliant than they were in past cycles, the oil shock from Iran is not hitting every country the same way, and some of the most important structural tailwinds for these markets remain in place. As a result, we’re constructive—though selective—within EMs, with our strongest conviction in South Korea, Taiwan and parts of China. Latin America is also becoming increasingly relevant as the EM opportunity set broadens. Many EMs entered this period with fewer vulnerabilities. Current-account balances have improved relative to previous shocks, reducing a reliance on external financing. Reserve accumulation has also risen over time, providing dry powder to prevent an unmanaged foreign exchange (FX) sell-off. The Bank for International Settlements notes that FX reserves climbed from about 5% of gross domestic product (GDP) in 1990 to nearly 30% by 2018. This cushion extends beyond reserves into policymaking: In some EMs, inflation has been brought under better control and central-bank credibility is stronger. This is reflected in positive real policy rates that are higher and more restrictive relative to history and relative to a number of more developed markets. The second reason broad EM caution can miss the mark is that energy vulnerability is not uniform — and is arguably a greater challenge for some developed economies. Sensitivity to a prolonged Gulf conflict depends on more than energy imports alone: it also reflects how reliant an economy is on imported oil and gas, how large those fuels are in the domestic energy mix, and how energy intensive the economy is. On that basis, parts of Asia screen as more exposed, while parts of Latin America look materially less vulnerable. The contrast also extends beyond EMs. The European Union (EU) still imports 57% of its energy needs, and its natural-gas import dependency rate remains above 85%, showing that external energy exposure remains significant in parts of Europe as well. EMs stand to benefit from two of the larger structural forces we see driving markets today: the buildout of artificial intelligence (AI) and the global fragmentation that is reshaping supply chains and intensifying the push for critical inputs and resources. In Asia, Taiwan sits near the center of the manufacturing stack: Taiwan Semiconductor Manufacturing Company (TSMC) represented 34% of the global “Foundry 2.0” industry in 2024, a category that includes chip manufacturing, advanced packaging, testing and mask-making. South Korea is similarly important, with Samsung and SK hynix together controlling about 68% of the global DRAM market in 4Q25. China is increasingly important as an AI end-market in its own right, with 515 million generative AI users as of June 2025, equal to 36.5% penetration, and rapid adoption of agentic AI likely to drive further growth. Chinese stocks have lagged the broader recovery as platform giants prioritize reinvestment over near-term profits, but with earnings now largely reset, profit growth is expected to accelerate through 2027. Latin America’s structural support looks different, but no less strategic. Chile and Peru together account for nearly 40% of global copper production, while Brazil is emerging in nickel and rare earths, both critical for batteries and high-tech manufacturing. Mexico strengthens the case further: U.S. Census Bureau data show it has overtaken China in exports of advanced technology products to the United States. In a world focused on supply security, those advantages are increasing the region’s strategic importance. Investments in commodities may have greater volatility than investments in traditional securities, particularly if the instruments involve leverage. The value of commodity-linked derivative instruments may be affected by changes in overall market movements, commodity index volatility, changes in interest rates, or factors affecting a particular industry or commodity, such as drought, floods, weather, livestock disease, embargoes, tariffs and international economic, political and regulatory developments. Investing in emerging markets involves a greater degree of risk and increased volatility compared to developed markets. Changes in currency exchange rates and differences in accounting and taxation policies outside the investor’s jurisdiction can raise or lower returns. Some markets may not be as politically and economically stable, in addition to differences in taxation policies, and legal systems outside the investor’s jurisdiction may create additional risks. Investors should carefully consider these risks and consult with financial and legal advisors before investing in emerging markets. This webpage content is for information/educational purposes only and may inform you of certain products and services offered by private banking businesses, part of JPMorgan Chase & Co. Products and services described, as well as associated fees, charges and interest rates, are subject to change in accordance with the applicable account agreements and may differ among geographic locations. Not all products and services are offered at all locations. Any views, strategies or products discussed in this content may not be appropriate for all individuals and are subject to risks. Investors may get back less than they invested, and past performance is not a reliable indicator of future results. Asset allocation/diversification does not guarantee a profit or protect against loss. Nothing in this content should be relied upon in isolation for the purpose of making an investment decision. You are urged to consider carefully whether the services, products, asset classes (e.g., equities, fixed income, alternative investments, commodities, etc.) or strategies discussed are suitable to your needs. You must also consider the objectives, risks, charges and expenses associated with an investment service, product or strategy prior to making an investment decision. For this and more complete information, including discussion of your goals/situation, contact your J.P. Morgan team. Certain information contained in this content is believed to be reliable; however, J.P. Morgan does not represent or warrant its accuracy, reliability or completeness, or accept any liability for any loss or damage (whether direct or indirect) arising out of the use of all or any part of this content. No representation or warranty should be made with regard to any computations, graphs, tables, diagrams or commentary in this content, which are provided for illustration/reference purposes only. The views, opinions, estimates and strategies expressed in this content constitute our judgment based on current market conditions and are subject to change without notice. J.P. Morgan assumes no duty to update any information on this website in the event that such information changes. Views, opinions, estimates and strategies expressed herein may differ from those expressed by other areas of J.P. Morgan , views expressed for other purposes or in other contexts, and this content should not be regarded as a research report. Any projected results and risks are based solely on hypothetical examples cited, and actual results and risks will vary depending on specific circumstances. Forward-looking statements should not be considered as guarantees or predictions of future events. Nothing in this website shall be construed as giving rise to any duty of care owed to, or advisory relationship with, you or any third party. Nothing in this website shall be regarded as an offer, solicitation, recommendation or advice (whether financial, accounting, legal, tax or other) given by J.P. Morgan and/or its officers or employees, irrespective of whether or not such communication was given at your request. J.P. Morgan and its affiliates and employees do not provide tax, legal or accounting advice. You should consult your own tax, legal and accounting advisors before engaging in any financial transactions. Please read the Legal Disclaimer for J.P. Morgan Private Bank regional affiliates and other important information in conjunction with these pages. We can help you navigate a complex financial landscape. Reach out today to learn how. 01 02 03 Would you like to be redirected? J.P. Morgan’s website and/or mobile terms, privacy and security policies don’t apply to the site or app you're about to visit. Please review its terms, privacy and security policies to see how they apply to you. J.P. Morgan isn’t responsible for (and doesn’t provide) any products, services or content at this third-party site or app, except for products and services that explicitly carry the J.P. Morgan name. Copyright © 2026 JPMorgan Chase & Co. All rights reserved. LEARN MORE About Our Firm and Investment Professionals Through FINRA BrokerCheck To learn more about J.P. Morgan’s investment business, including our accounts, products and services, as well as our relationship with you, please review our J.P. Morgan Securities LLC Form CRS and Guide to Investment Services and Brokerage Products. JPMorgan Chase Bank, N.A. and its affiliates (collectively ""JPMCB"") offer investment products, which may include bank-managed accounts and custody, as part of its trust and fiduciary services. Other investment products and services, such as brokerage and advisory accounts, are offered through J.P. Morgan Securities LLC (""JPMS""), a member of FINRA and SIPC. Insurance products are made available through Chase Insurance Agency, Inc. (CIA), a licensed insurance agency, doing business as Chase Insurance Agency Services, Inc. in Florida. JPMCB, JPMS and CIA are affiliated companies under the common control of JPMorgan Chase & Co. Products not available in all states. Please read the Legal Disclaimer for J.P. Morgan Private Bank regional affiliates and other important information in conjunction with these pages. Bank deposit products, such as checking, savings and bank lending and related services are offered by JPMorgan Chase Bank, N.A. Member FDIC. Not a commitment to lend. All extensions of credit are subject to credit approval. This policy explains how cookies are used on this website and other websites that are made available by J.P. Morgan Chase Bank, N.A. and its worldwide affiliates and subsidiaries (collectively, “J.P. Morgan,” “we,” or “us”). This policy may be amended or updated from time to time to reflect changes in our practices or changes in applicable law. We encourage you to read this policy carefully and regularly check this page to review any changes we may make. By using this site, you agree to J.P. Morgan’s use of cookies on your device in accordance with the terms of this policy. If you do not wish to accept cookies from this site, please either disable cookies or refrain from using this site.

            More information These cookies allow the technical operation of our websites or apps (e.g., cookies that enable you to navigate a website or app, and to use its features). Some may also increase the usability of our websites or apps by remembering your choices (e.g., language, region, login details, and so on).  You may be able to disable some or all necessary cookies by adjusting your browser settings.  If you choose to do so, however, you may experience reduced functionality or be prevented from using our websites or apps altogether. These cookies help us enhance the performance and usability of our websites or apps.  If you choose not to accept these cookies you may experience less than optimal performance. These cookies enable the website to provide enhanced functionality and personalization. They may be set by us or by third party providers whose services we have added to our pages. If you do not allow these cookies then some or all of these services may not function properly. These cookies help us evaluate the effectiveness of our marketing campaigns or to provide better targeting for marketing.  These cookies may collect personal data such as your name as well as information about how you interact with our websites, apps or marketing materials. These cookies help us evaluate the effectiveness of our marketing campaigns or to provide better targeting for marketing. These cookies may collect personal data such as your name as well as information about how you interact with our websites, apps or marketing materials. These cookies help us evaluate the effectiveness of our marketing campaigns or to provide better targeting for marketing. These cookies may collect personal data such as your name as well as information about how you interact with our websites, apps or marketing materials. These cookies help us ensure that we understand our audience as clearly as possible, and that any information that is provided to you is as relevant as possible to 
your interests and preferences.",https://privatebank.jpmorgan.com/nam/en/insights/markets-and-investing/tmt/emerging-markets-may-offer-more-than-meets-the-eye-selectivity-matters
JPM,"Net revenue after provisions of J P Morgan Chase & Co Depositary Shares, each representing a 1/400th interest in a share of 4.20% Non-Cumulative Preferred Stock, Series MM – BOATS:JPM/PM - TradingView — Track All Markets",2026-04-17 00:47:03,"Select market data provided by ICE Data Services. Select reference data provided by FactSet. Copyright © 2026 FactSet Research Systems Inc.Copyright © 2026, American Bankers Association. CUSIP Database provided by FactSet Research Systems Inc. All rights reserved. SEC fillings and other documents provided by Quartr.© 2026 TradingView, Inc.",https://www.tradingview.com/symbols/BOATS-JPM/PM/financials-income-statement/net-revenue-after-provision/
JPM,"JPMorgan Chase (JPM) Consent Order Lifted by OCC, Stock Rises - GuruFocus",2026-04-16 23:48:45,"This website is using a security service to protect itself from online attacks. The action you just performed triggered the security solution. There are several actions that could trigger this block including submitting a certain word or phrase, a SQL command or malformed data. You can email the site owner to let them know you were blocked. Please include what you were doing when this page came up and the Cloudflare Ray ID found at the bottom of this page. Cloudflare Ray ID: 9ee832bfe89487a2
•

        Your IP:
        Click to reveal
40.76.191.131
•

Performance & security by Cloudflare",https://www.gurufocus.com/news/8799008/jpmorgan-chase-jpm-consent-order-lifted-by-occ-stock-rises?mobile=true%3Fmobile%3Dtrue&mobile=true%3Fmobile%3Dtrue%3Fmobile%3Dtrue&mobile=true&mobile=true
JPM,"Net income from continuing operations of J P Morgan Chase & Co Depositary Shares, each representing a 1/400th interest in a share of 6.00% Non-Cumulative Preferred Stock, Series EE – NYSE:JPM/PC - TradingView — Track All Markets",2026-04-16 23:09:11,"Select market data provided by ICE Data Services. Select reference data provided by FactSet. Copyright © 2026 FactSet Research Systems Inc.Copyright © 2026, American Bankers Association. CUSIP Database provided by FactSet Research Systems Inc. All rights reserved. SEC fillings and other documents provided by Quartr.© 2026 TradingView, Inc.",https://www.tradingview.com/symbols/NYSE-JPM/PC/financials-income-statement/income-from-cont-ops/
