ticker,title,date,content,url
JPM,"Brookstone Capital Management Buys 5,226 Shares of JPMorgan Chase & Co. $JPM - MarketBeat",2026-04-05 07:49:48,"Brookstone Capital Management boosted its position in shares of  JPMorgan Chase & Co. (NYSE:JPM) by 5.1% during the fourth quarter, according to its most recent disclosure with the Securities & Exchange Commission. The institutional investor  owned 107,609 shares of the financial services provider's stock after buying an additional 5,226 shares during the period. Brookstone Capital Management's holdings in JPMorgan Chase & Co. were worth $34,674,000 at the end of the most recent quarter. Several other hedge funds and other institutional investors also recently modified their holdings of JPM. Gleason Group Inc. grew its holdings in shares of  JPMorgan Chase & Co. by 0.4% during the fourth quarter. Gleason Group Inc. now owns 12,198 shares of the financial services provider's stock worth $3,930,000 after purchasing an additional 47 shares during the last quarter.  Solitude Financial Services grew its holdings in  JPMorgan Chase & Co. by 8.1% during the 4th quarter. Solitude Financial Services now owns 11,939 shares of the financial services provider's stock worth $3,847,000 after acquiring an additional 898 shares during the period.  Financial Planning Hawaii Inc. acquired a new stake in  JPMorgan Chase & Co. during the fourth quarter worth approximately $1,537,000.  apricus wealth LLC increased its stake in shares of  JPMorgan Chase & Co. by 3.9% in the 4th quarter. apricus wealth LLC now owns 3,443 shares of the financial services provider's stock valued at $1,109,000 after acquiring an additional 130 shares in the last quarter.  Finally, Presidio Capital Management LLC increased its stake in  JPMorgan Chase & Co. by 3.2% in the fourth quarter. Presidio Capital Management LLC now owns 2,562 shares of the financial services provider's stock valued at $826,000 after purchasing an additional 79 shares in the last quarter. Institutional investors own  71.55% of the company's stock. In other news, insider Robin Leopold sold 433 shares of the business's stock in a transaction on Monday, March 23rd. The shares were sold at an average price of $295.06, for a total transaction of $127,760.98. Following the completion of the sale, the insider owned 64,920 shares of the company's stock, valued at $19,155,295.20. The trade was a 0.66% decrease in their position. The sale was disclosed in a legal filing with the SEC, which is available at this link. Also, COO Jennifer Piepszak sold 8,571 shares of the firm's stock in a transaction on Friday, January 16th. The shares were sold at an average price of $312.79, for a total transaction of $2,680,923.09. Following the sale, the chief operating officer owned 71,027 shares in the company, valued at $22,216,535.33. The trade was a 10.77% decrease in their ownership of the stock. The disclosure for this sale is available in the SEC filing. In the last three months, insiders sold 72,029 shares of company stock valued at $22,195,693. 0.47% of the stock is currently owned by company insiders. Here are the key news stories impacting JPMorgan Chase & Co. this week: A number of analysts have commented on JPM shares. Barclays  restated a ""buy"" rating on shares of JPMorgan Chase & Co. in a research note on Wednesday. Wall Street Zen upgraded JPMorgan Chase & Co. from a ""sell"" rating to a ""hold"" rating in a report on Sunday, January 18th. CICC Research assumed coverage on shares of JPMorgan Chase & Co. in a research report on Wednesday, January 14th. They issued an ""outperform"" rating and a $355.00 price objective on the stock. HSBC lowered their target price on JPMorgan Chase & Co. from $319.00 to $288.00 and set a ""hold"" rating on the stock in a research note on Wednesday. Finally, Truist Financial dropped their price target on shares of JPMorgan Chase & Co. from $334.00 to $330.00 in a research note on Wednesday, February 25th. One analyst  has rated the stock with a Strong Buy rating, fourteen have issued  a Buy rating and thirteen have issued  a Hold rating to the company. According to data from MarketBeat, JPMorgan Chase & Co. currently has an average rating of ""Moderate Buy"" and a consensus target price of $336.48. Shares of JPM stock opened at $294.66 on Friday. The stock has a fifty day moving average of $298.95 and a 200 day moving average of $307.16. The firm has a market capitalization of $794.70 billion, a price-to-earnings ratio of 14.73, a PEG ratio of 1.41 and a beta of 1.05. The company has a quick ratio of 0.85, a current ratio of 0.85 and a debt-to-equity ratio of 1.27. JPMorgan Chase & Co. has a 52 week low of $202.16 and a 52 week high of $337.25. JPMorgan Chase & Co. (NYSE:JPM - Get Free Report) last posted its quarterly earnings data on Tuesday, January 13th. The financial services provider reported $5.23 earnings per share (EPS) for the quarter, topping analysts' consensus estimates of $4.93 by $0.30. The business had revenue of $45.80 billion during the quarter, compared to the consensus estimate of $45.98 billion. JPMorgan Chase & Co. had a return on equity of 17.16% and a net margin of 20.35%.The firm's quarterly revenue was up 7.1% compared to the same quarter last year. During the same quarter in the prior year, the company earned $4.81 earnings per share.  As a group, research analysts expect that  JPMorgan Chase & Co. will post 18.1 earnings per share for the current year. The company also recently declared a quarterly dividend, which will be paid on Thursday, April 30th. Stockholders of record on Monday, April 6th will be issued a dividend of $1.50 per share. This represents a $6.00 annualized dividend and a dividend yield of 2.0%. The ex-dividend date of this dividend is Monday, April 6th. JPMorgan Chase & Co.'s dividend payout ratio  is presently 29.99%. JPMorgan Chase & Co NYSE: JPM is a diversified global financial services firm headquartered in New York City. The company provides a wide range of banking and financial products and services to consumers, small businesses, corporations, governments and institutional investors worldwide. Its operations span retail banking, commercial lending, investment banking, asset management, payments and card services, and treasury and securities services. The firm's principal business activities are organized across several core lines: Consumer & Community Banking, which offers deposit accounts, mortgages, auto loans, credit cards and branch and digital banking under the Chase brand; Corporate & Investment Banking, which provides capital markets, advisory, underwriting, trading and risk management services; Commercial Banking, delivering lending, treasury and capital solutions to middle-market and corporate clients; and Asset & Wealth Management, which offers investment management, private banking and retirement services to institutions and high-net-worth individuals. Want to see what other hedge funds are holding JPM? Visit HoldingsChannel.com to get the latest 13F filings and insider trades for JPMorgan Chase & Co. (NYSE:JPM - Free Report). This instant news alert was generated by narrative science technology and financial data from MarketBeat in order to provide readers with the fastest reporting and unbiased coverage. Please send any questions or comments about this story to contact@marketbeat.com. Before you consider JPMorgan Chase & Co., you'll want to hear this. MarketBeat keeps track of Wall Street's top-rated and best performing research analysts and the stocks they recommend to their clients on a daily basis. MarketBeat has identified the five stocks that top analysts are quietly whispering to their clients to buy now before the broader market catches on... and JPMorgan Chase & Co. wasn't on the list. While JPMorgan Chase & Co. currently has a Moderate Buy rating among analysts, top-rated analysts believe these five stocks are better buys. Wondering what the next stocks will be that hit it big, with solid fundamentals? Click the link to see which stocks MarketBeat analysts could become the next blockbuster growth stocks. Sign up for MarketBeat All Access to gain access to MarketBeat's full suite of research tools. 345 N Reid Place, Suite 620, Sioux Falls, SD 57103
                                        
                                        contact@marketbeat.com
                                        
                                        (844) 978-6257 © MarketBeat Media, LLC 2010-2026. All rights reserved. © 2026   Fair market value prices are updated every minute and are provided by Massive. Other market data provided is at least 10-minutes delayed and hosted by Barchart Solutions.  Information is provided 'as-is' and solely for informational purposes, not for trading purposes or advice, and is delayed. To see all exchange delays and terms of use please see Barchart's disclaimer. We and our partners share information on your use of this website to help improve your experience. For more information, or to opt out click the Do Not Sell My Information button below.",https://www.marketbeat.com/instant-alerts/filing-brookstone-capital-management-buys-5226-shares-of-jpmorgan-chase-co-jpm-2026-04-05/
JPM,JPMorgan Chase & Co. $JPM Shares Sold by Allspring Global Investments Holdings LLC - MarketBeat,2026-04-05 07:23:45,"Allspring Global Investments Holdings LLC reduced its position in shares of  JPMorgan Chase & Co. (NYSE:JPM) by 3.4% in the 4th quarter, according to the company in its most recent disclosure with the Securities & Exchange Commission. The firm owned 619,879 shares of the financial services provider's stock after selling 22,004 shares during the period. Allspring Global Investments Holdings LLC's holdings in JPMorgan Chase & Co. were worth $201,758,000 as of its most recent filing with the Securities & Exchange Commission. A number of other institutional investors have also modified their holdings of the company. Triangle Securities Wealth Management grew its position in shares of  JPMorgan Chase & Co. by 14.1% during the third quarter. Triangle Securities Wealth Management now owns 25,822 shares of the financial services provider's stock worth $8,145,000 after buying an additional 3,191 shares in the last quarter.  Andra AP fonden raised its holdings in  JPMorgan Chase & Co. by 3.2% in the third quarter. Andra AP fonden now owns 107,700 shares of the financial services provider's stock valued at $33,972,000 after acquiring an additional 3,300 shares in the last quarter.  Banco Santander S.A. raised its holdings in  JPMorgan Chase & Co. by 9.0% in the third quarter. Banco Santander S.A. now owns 452,612 shares of the financial services provider's stock valued at $142,767,000 after acquiring an additional 37,550 shares in the last quarter.  Brighton Jones LLC lifted its stake in  JPMorgan Chase & Co. by 11.0% in the fourth quarter. Brighton Jones LLC now owns 48,732 shares of the financial services provider's stock worth $11,682,000 after acquiring an additional 4,841 shares during the last quarter.  Finally, Rakuten Investment Management Inc. purchased a new position in  JPMorgan Chase & Co. in the third quarter worth approximately $11,350,000. 71.55% of the stock is owned by institutional investors and hedge funds. JPM opened at $294.66 on Friday. JPMorgan Chase & Co. has a one year low of $202.16 and a one year high of $337.25. The company has a debt-to-equity ratio of 1.27, a quick ratio of 0.85 and a current ratio of 0.85. The stock has a market capitalization of $794.70 billion, a P/E ratio of 14.73, a price-to-earnings-growth ratio of 1.41 and a beta of 1.05. The business's 50-day simple moving average is $298.95 and its 200-day simple moving average is $307.16. JPMorgan Chase & Co. (NYSE:JPM - Get Free Report) last released its quarterly earnings results on Tuesday, January 13th. The financial services provider reported $5.23 earnings per share (EPS) for the quarter, topping analysts' consensus estimates of $4.93 by $0.30. JPMorgan Chase & Co. had a return on equity of 17.16% and a net margin of 20.35%.The firm had revenue of $45.80 billion for the quarter, compared to the consensus estimate of $45.98 billion. During the same quarter last year, the business posted $4.81 EPS. The firm's quarterly revenue was up 7.1% compared to the same quarter last year.  Analysts anticipate that  JPMorgan Chase & Co. will post 18.1 EPS for the current year. The firm also recently announced a quarterly dividend, which will be paid on Thursday, April 30th. Stockholders of record on Monday, April 6th will be issued a $1.50 dividend. This represents a $6.00 dividend on an annualized basis and a dividend yield of 2.0%. The ex-dividend date of this dividend is Monday, April 6th. JPMorgan Chase & Co.'s payout ratio is presently 29.99%. In other JPMorgan Chase & Co. news, CEO Troy L. Rohrbaugh sold 50,000 shares of the firm's stock in a transaction on Thursday, February 19th. The shares were sold at an average price of $307.11, for a total transaction of $15,355,500.00. Following the transaction, the chief executive officer directly owned 111,279 shares of the company's stock, valued at approximately $34,174,893.69. This trade represents a 31.00% decrease in their position. The sale was disclosed in a document filed with the SEC, which is available at the SEC website. Also, General Counsel Stacey Friedman sold 3,404 shares of JPMorgan Chase & Co. stock in a transaction on Friday, January 16th. The shares were sold at an average price of $312.80, for a total transaction of $1,064,771.20. Following the completion of the transaction, the general counsel owned 65,353 shares in the company, valued at approximately $20,442,418.40. This represents a 4.95% decrease in their ownership of the stock. Additional details regarding this sale are available in the official SEC disclosure. Over the last ninety days, insiders sold 72,029 shares of company stock worth $22,195,693. Corporate insiders own  0.47% of the company's stock. Here are the key news stories impacting JPMorgan Chase & Co. this week: A number of brokerages have commented on JPM. Robert W. Baird increased their price objective on shares of JPMorgan Chase & Co. from $280.00 to $290.00 and gave the company a ""neutral"" rating in a research report on Wednesday, March 4th. TD Cowen  reaffirmed a ""buy"" rating on shares of JPMorgan Chase & Co. in a research report on Wednesday, January 7th. Keefe, Bruyette & Woods  reiterated an ""outperform"" rating on shares of JPMorgan Chase & Co. in a research note on Tuesday, February 24th. CICC Research initiated coverage on JPMorgan Chase & Co. in a report on Wednesday, January 14th. They set an ""outperform"" rating and a $355.00 price target for the company. Finally, Jefferies Financial Group started coverage on JPMorgan Chase & Co. in a research report on Thursday, March 26th. They set a ""hold"" rating and a $310.00 target price on the stock. One equities research analyst  has rated the stock with a Strong Buy rating, fourteen have assigned  a Buy rating and thirteen have given a Hold rating to the company. According to data from MarketBeat, JPMorgan Chase & Co. presently has a consensus rating of ""Moderate Buy"" and a consensus target price of $336.48. JPMorgan Chase & Co NYSE: JPM is a diversified global financial services firm headquartered in New York City. The company provides a wide range of banking and financial products and services to consumers, small businesses, corporations, governments and institutional investors worldwide. Its operations span retail banking, commercial lending, investment banking, asset management, payments and card services, and treasury and securities services. The firm's principal business activities are organized across several core lines: Consumer & Community Banking, which offers deposit accounts, mortgages, auto loans, credit cards and branch and digital banking under the Chase brand; Corporate & Investment Banking, which provides capital markets, advisory, underwriting, trading and risk management services; Commercial Banking, delivering lending, treasury and capital solutions to middle-market and corporate clients; and Asset & Wealth Management, which offers investment management, private banking and retirement services to institutions and high-net-worth individuals. Want to see what other hedge funds are holding JPM? Visit HoldingsChannel.com to get the latest 13F filings and insider trades for JPMorgan Chase & Co. (NYSE:JPM - Free Report). This instant news alert was generated by narrative science technology and financial data from MarketBeat in order to provide readers with the fastest reporting and unbiased coverage. Please send any questions or comments about this story to contact@marketbeat.com. Before you consider JPMorgan Chase & Co., you'll want to hear this. MarketBeat keeps track of Wall Street's top-rated and best performing research analysts and the stocks they recommend to their clients on a daily basis. MarketBeat has identified the five stocks that top analysts are quietly whispering to their clients to buy now before the broader market catches on... and JPMorgan Chase & Co. wasn't on the list. While JPMorgan Chase & Co. currently has a Moderate Buy rating among analysts, top-rated analysts believe these five stocks are better buys. MarketBeat just released its list of the 7 hottest IPOs expected to hit Wall Street in 2026. See which companies are preparing to go public and why investors are watching closely. Sign up for MarketBeat All Access to gain access to MarketBeat's full suite of research tools. 345 N Reid Place, Suite 620, Sioux Falls, SD 57103
                                        
                                        contact@marketbeat.com
                                        
                                        (844) 978-6257 © MarketBeat Media, LLC 2010-2026. All rights reserved. © 2026   Fair market value prices are updated every minute and are provided by Massive. Other market data provided is at least 10-minutes delayed and hosted by Barchart Solutions.  Information is provided 'as-is' and solely for informational purposes, not for trading purposes or advice, and is delayed. To see all exchange delays and terms of use please see Barchart's disclaimer. We and our partners share information on your use of this website to help improve your experience. For more information, or to opt out click the Do Not Sell My Information button below.",https://www.marketbeat.com/instant-alerts/filing-jpmorgan-chase-co-jpm-shares-sold-by-allspring-global-investments-holdings-llc-2026-04-05/
JPM,"JR6L.EUR ETF Analysis: Dividends, Returns SIX:JR6L.EUR - TradingView",2026-04-04 21:08:04,"Select market data provided by ICE Data Services. Select reference data provided by FactSet. Copyright © 2026 FactSet Research Systems Inc.Copyright © 2026, American Bankers Association. CUSIP Database provided by FactSet Research Systems Inc. All rights reserved. SEC fillings and other documents provided by Quartr.© 2026 TradingView, Inc.",https://www.tradingview.com/symbols/SIX-JR6L.EUR/analysis/
