ticker,title,date,content,url
MSFT,Microsoft (MSFT) closes week of Mar 30 at ___? Trading Odds & Predictions - Polymarket,2026-03-27 22:31:22,"Trader sentiment on Polymarket for Microsoft (MSFT) share price closing the week of March 30 remains tightly contested, with multiple outcome bins clustered around 49% implied probabilities from $320-$330 to >$410, reflecting fragmented consensus amid recent volatility. The stock plunged nearly 7% last week to close at $356.77 on March 27, pressured by reports of a hiring freeze in key Azure cloud and sales divisions amid ballooning AI capital expenditures exceeding $100 billion annually, raising margin concerns despite robust long-term analyst price targets averaging $590. Broader tech sector weakness, fueled by geopolitical tensions and elevated volatility, has amplified uncertainty, with traders pricing in swing potential from macroeconomic data releases and risk appetite shifts before quarter-end positioning. Polymarket operates globally through separate legal entities. Polymarket US is operated by QCX LLC d/b/a Polymarket US, a CFTC-regulated Designated Contract Market. This international platform is not regulated by the CFTC and operates independently. Trading involves substantial risk of loss. See our Terms of Service & Privacy Policy.",https://polymarket.com/event/msft-week-april-3-2026
MSFT,Microsoft (NASDAQ:MSFT) Trading Down 2.5% - What's Next? - MarketBeat,2026-03-27 21:51:31,"Microsoft Corporation (NASDAQ:MSFT - Get Free Report) shares traded down 2.5% on Friday . The stock traded as low as $356.51 and last traded at $356.77. 37,573,448 shares were traded  during mid-day trading, an increase of 4% from the average session volume of 36,256,055 shares. The stock had previously closed at $365.97. Here are the key news stories impacting Microsoft this week: A number of analysts recently weighed in on the stock. KeyCorp reduced their price objective on shares of Microsoft from $630.00 to $600.00 and set an ""overweight"" rating on the stock in a research report on Thursday, January 29th. Mizuho dropped their target price on Microsoft from $640.00 to $620.00 and set an ""outperform"" rating for the company in a research report on Wednesday, January 21st. Morgan Stanley  reaffirmed an ""overweight"" rating on shares of Microsoft in a research note on Thursday, January 29th. The Goldman Sachs Group  reiterated a ""buy"" rating on shares of Microsoft in a report on Thursday, February 12th. Finally, TD Cowen  restated a ""buy"" rating on shares of Microsoft in a report on Thursday, January 29th. Two equities research analysts have rated the stock with a Strong Buy rating, thirty-eight have assigned  a Buy rating and five have issued  a Hold rating to the company. According to MarketBeat, the stock presently has an average rating of ""Moderate Buy"" and an average price target of $588.97. The company has a debt-to-equity ratio of 0.09, a quick ratio of 1.38 and a current ratio of 1.39. The company has a fifty day simple moving average of $411.42 and a two-hundred day simple moving average of $468.63. The firm has a market capitalization of $2.65 trillion, a PE ratio of 22.31, a PEG ratio of 1.41 and a beta of 1.10. Microsoft (NASDAQ:MSFT - Get Free Report) last announced its quarterly earnings results on Wednesday, January 28th. The software giant reported $4.14 EPS for the quarter, beating the consensus estimate of $3.86 by $0.28. Microsoft had a return on equity of 32.34% and a net margin of 39.04%.The firm had revenue of $81.27 billion for the quarter, compared to analyst estimates of $80.28 billion. During the same quarter last year, the firm posted $3.23 earnings per share. The business's revenue for the quarter was up 16.7% on a year-over-year basis.  Analysts forecast that  Microsoft Corporation will post 13.08 EPS for the current fiscal year. The firm also recently announced a quarterly dividend, which will be paid on Thursday, June 11th. Shareholders of record on Thursday, May 21st will be given a dividend of $0.91 per share. The ex-dividend date of this dividend is Thursday, May 21st. This represents a $3.64 dividend on an annualized basis and a yield of 1.0%. Microsoft's dividend payout ratio (DPR) is 22.76%. In other Microsoft news, Director John W. Stanton acquired 5,000 shares of the business's stock in a transaction that occurred on Wednesday, February 18th. The shares were bought at an average cost of $397.35 per share, with a total value of $1,986,750.00. Following the completion of the acquisition, the director directly owned 83,905 shares in the company, valued at $33,339,651.75. This represents a 6.34% increase in their position. The transaction was disclosed in a filing with the Securities & Exchange Commission, which can be accessed through the SEC website. Also, EVP Kathleen T. Hogan sold 12,321 shares of the business's stock in a transaction that occurred on Friday, March 6th. The stock was sold at an average price of $409.52, for a total transaction of $5,045,695.92. Following the completion of the transaction, the executive vice president directly owned 137,933 shares of the company's stock, valued at $56,486,322.16. This trade represents a 8.20% decrease in their position. Additional details regarding this sale are available in the official SEC disclosure. Insiders own  0.03% of the company's stock. Several hedge funds and other institutional investors have recently bought and sold shares of the stock. Longfellow Investment Management Co. LLC grew its position in shares of  Microsoft by 51.3% in the 2nd quarter. Longfellow Investment Management Co. LLC now owns 59 shares of the software giant's stock worth $29,000 after buying an additional 20 shares during the last quarter.  Bernzott Capital Advisors purchased a new stake in  Microsoft during the fourth quarter valued at approximately $34,000.  Bayforest Capital Ltd purchased a new stake in  Microsoft during the third quarter valued at approximately $38,000.  Timmons Wealth Management LLC acquired a new stake in  Microsoft in the fourth quarter valued at approximately $36,000.  Finally, Fairway Wealth LLC boosted its stake in  Microsoft by 287.0% in the fourth quarter. Fairway Wealth LLC now owns 89 shares of the software giant's stock valued at $43,000 after acquiring an additional 66 shares in the last quarter. Institutional investors own  71.13% of the company's stock. Microsoft Corporation is a global technology company headquartered in Redmond, Washington. Founded in 1975 by Bill Gates and Paul Allen, Microsoft develops, licenses and supports a broad range of software products, services and devices for consumers, enterprises and governments worldwide. Its operations span personal computing, productivity software, cloud infrastructure, enterprise applications, developer tools and gaming. Microsoft's product portfolio includes the Windows operating system and the Microsoft 365 suite of productivity and collaboration tools (Office apps, Outlook, Teams). This instant news alert was generated by narrative science technology and financial data from MarketBeat in order to provide readers with the fastest reporting and unbiased coverage. Please send any questions or comments about this story to contact@marketbeat.com. Before you consider Microsoft, you'll want to hear this. MarketBeat keeps track of Wall Street's top-rated and best performing research analysts and the stocks they recommend to their clients on a daily basis. MarketBeat has identified the five stocks that top analysts are quietly whispering to their clients to buy now before the broader market catches on... and Microsoft wasn't on the list. While Microsoft currently has a Moderate Buy rating among analysts, top-rated analysts believe these five stocks are better buys. A forward-looking investment report spotlighting the seven space companies best positioned to benefit from accelerating commercialization in 2026. It explores key industry trends, major growth catalysts, and the stocks shaping the next phase of the space economy—from launch leaders and satellite networks to data, defense, and in-space infrastructure. Sign up for MarketBeat All Access to gain access to MarketBeat's full suite of research tools. 345 N Reid Place, Suite 620, Sioux Falls, SD 57103
                                        
                                        contact@marketbeat.com
                                        
                                        (844) 978-6257 © MarketBeat Media, LLC 2010-2026. All rights reserved. © 2026   Fair market value prices are updated every minute and are provided by Massive. Other market data provided is at least 10-minutes delayed and hosted by Barchart Solutions.  Information is provided 'as-is' and solely for informational purposes, not for trading purposes or advice, and is delayed. To see all exchange delays and terms of use please see Barchart's disclaimer. We and our partners share information on your use of this website to help improve your experience. For more information, or to opt out click the Do Not Sell My Information button below.",https://www.marketbeat.com/instant-alerts/microsoft-nasdaqmsft-trading-down-25-whats-next-2026-03-27/
MSFT,"Got $5,000? Here Are 3 Fantastic Stocks to Buy Now. - The Globe and Mail",2026-03-27 21:05:00,"Amazon's and Microsoft's cloud businesses are booming. Nvidia supplies the hardware to many of these companies. If you're looking for stocks to buy right now, I've got three stocks that look like strong investment options. All three are benefiting from the artificial intelligence (AI) tailwind, even if they are spending a ton to achieve the growth. Although each of these stocks is a bit off its all-time high, now looks like the perfect opportunity to buy. Will AI create the world's first trillionaire? Our team just released a report on the one little-known company, called an ""Indispensable Monopoly"" providing the critical technology Nvidia and Intel both need. Continue » Amazon(NASDAQ: AMZN) may be known for its e-commerce business, but that's not its most important segment. Amazon Web Services (AWS) is its cloud computing segment, and I would consider it the primary reason to invest in Amazon. During the fourth quarter, AWS's sales increased 24% year over year -- the fastest-growing segment in the business and AWS's best quarter in over three years. Additionally, it generated 50% of the company's operating income. Q4 is usually Amazon's most profitable due to increased holiday sales. In every other quarter outside of Q4, AWS generates the majority of Amazon's profits. This makes the division very important, and it's doing incredibly well. While some investors may not appreciate Amazon's $200 billion in capital expenditures expected in 2026, that's what it takes to stay competitive in the AI race. Amazon may be using some of this for internal capabilities, but the reality is that it's renting the majority of it to clients and reaping the benefits through AWS. The old saying is that you must spend money to make money, and Amazon is doing just that, albeit at a scale never seen before. Thanks to investor concern over AI spending, Amazon's stock is down nearly 20% from its all-time high. Now is the perfect time to scoop up shares, as AWS should start to boost the overall company's growth rate to higher levels as more AI workloads come online. You can just about copy and paste everything I said about AWS into the Microsoft(NASDAQ: MSFT) section regarding Azure. Azure is doing even better than AWS, as its revenue rose 39% year over year during its past quarter. Microsoft also has a $625 billion backlog, highlighting the massive demand for AI computing power. Overall, Microsoft is doing incredibly well as a company, and its revenue rose 17% year over year. However, investors have sold off Microsoft's stock, and it now sits about 30% down from its all-time high. That's a huge decline, and it has now reached valuation levels rarely seen except in times of crisis. MSFT PE Ratio data by YCharts. PE Ratio = price-to-earnings ratio. There has seldom been a better time to scoop up Microsoft shares, and investors shouldn't wait around for much longer, as the stock could be primed to rebound. Both Microsoft and Amazon are spending heavily on AI computing infrastructure. While there are a lot of components and suppliers in this industry, none is more prevalent than Nvidia(NASDAQ: NVDA). It makes a full-stack accelerated computing option, and it has widely been deployed as the hardware of choice in many data centers. Considering that Nvidia reported 73% revenue growth in Q4 and expects 77% in Q1, I think it's safe to say that demand isn't going anywhere but up. Despite these strong growth projections and soaring capital expenditures from AI hyperscalers like Microsoft and Amazon, Nvidia's stock doesn't have a very high stock price and is trading at just 21.1 times forward earnings. With how rapidly Nvidia is growing, that stock price is incredibly low, and investors shouldn't squander this opportunity to load up on one of the premier AI stocks at a discount. While the investing community may be a bit concerned regarding AI spending, the reality is that it's going to happen, and it will likely persist at a high rate over the next few years. As a result, investors are better off investing in it rather than trying to fight it. Ever feel like you missed the boat in buying the most successful stocks? Then you’ll want to hear this. On rare occasions, our expert team of analysts issues a “Double Down” stock recommendation for companies that they think are about to pop. If you’re worried you’ve already missed your chance to invest, now is the best time to buy before it’s too late. And the numbers speak for themselves: Right now, we’re issuing “Double Down” alerts for three incredible companies, available when you joinStock Advisor, and there may not be another chance like this anytime soon. Keithen Drury has positions in Amazon, Microsoft, and Nvidia. The Motley Fool has positions in and recommends Amazon, Microsoft, and Nvidia. The Motley Fool has a disclosure policy. All market data (will open in new tab) is provided by Barchart Solutions. Copyright © 2026. Information is provided 'as is' and solely for informational purposes, not for trading purposes or advice. For exchange delays and terms of use, please read disclaimer (will open in new tab).",https://www.theglobeandmail.com/investing/markets/stocks/MSFT/pressreleases/1016373/got-5000-here-are-3-fantastic-stocks-to-buy-now/
MSFT,Can MSFT Stock Decline Stop at $344 Support or Will It Head to $300 Next Week? - FXLeaders,2026-03-27 20:39:15,"Microsoft shares are under pressure as rising AI costs, intensifying competition, and margin concerns begin to challenge its long-standing growth narrative. Microsoft shares have come under sustained selling pressure, falling another 2.5% to around $356 and now down nearly 35% from their October 2025 peak near $557. The decline marks one of the company’s weakest six-month stretches in years. Technically, the stock has broken below key support levels, including its 100-week moving average, signaling a shift in momentum. After briefly stabilizing earlier in March, the renewed downside suggests investors are reassessing the risk-reward profile. This weakness stands out even as parts of the broader tech sector remain relatively resilient, highlighting a more selective market environment. Despite continued revenue growth and strong positioning in cloud and enterprise software, Microsoft is facing a new challenge: proving that growth can translate into sustainable profitability. The company has been a major beneficiary of the AI boom, investing heavily in infrastructure, expanding its Azure cloud platform, and integrating AI tools like Copilot across its ecosystem. However, investors are now demanding clearer returns on these investments rather than just expansion. The shift reflects a broader market trend where capital discipline is becoming just as important as innovation. Microsoft’s deep partnership with OpenAI has been central to its AI strategy, but it is also becoming a focal point for investor concern. Questions are emerging about whether the scale of investment will generate sufficient near-term returns. Recent reports suggest Microsoft has paused hiring in parts of its cloud and sales divisions, signaling a more cautious operational stance. At the same time, concerns have surfaced about OpenAI’s reliance on Microsoft, adding complexity to what has been a highly strategic relationship. Together, these developments are prompting investors to look more critically at execution risks. Microsoft shares slipped below the critical $400 level last week and it’s extending the decline this week too. This area represents both psychological and technical support, making it an important line in the sand. The low last month came at $381 but we saw a swift rebound above $400 again in the first week of March after MSFT found support at the 100 SMA (red). But it couldn’t hold the gains and slipped back down there again, after falling under $360 today. The 100 weekly SMA (red) which was acting as support has been broken, and the price slipped below 481. So, a decisive break below $380 has triggered additional downside, especially as momentum indicators remain fragile. The recent decline reflects more than short-term volatility. It signals a broader market reassessment of valuation, capital intensity, and risk across mega-cap technology stocks. Notably, the pullback occurred despite an earnings beat. That reaction underscores a shift in investor priorities: headline growth is no longer sufficient if future profitability appears uncertain. So, MFT is heading for the April lows of $344 now. Microsoft’s stock has undergone a notable repricing in recent months, signaling a broader reset in how investors are assessing mega-cap technology leaders. After peaking above $555 in October, shares retreated sharply, shedding around $175. The stock attempted a recovery ahead of the latest quarterly report. However, renewed concerns around surging AI costs reversed that move, sending MSFT lower again and placing the $380 level firmly back in focus, which was pierced as MSFT fell to $372 but it rebounded off the 200 weekly SMA (purple), however the bounce faded already. If the 50 monthly SMA breaks, then the next target would be the April 2025 low of $345. But for now the larger uptrend is still in play, and this pullback to the 200 SMA seems like another retrace before the upside momentum resumes again, but we might also see a breakdown below the 200 SMA. Competitive pressures are also rising. Amazon, through its cloud division AWS, remains a formidable rival, and reports of closer alignment between Amazon and OpenAI have raised concerns about potential shifts in the AI ecosystem. Microsoft’s integration of AI into products like Office and developer tools has been a key differentiator. However, if competitors gain ground in AI infrastructure or partnerships, Azure’s advantage could narrow over time. This evolving landscape is increasing uncertainty around long-term market share. Microsoft continues to roll out new products and partnerships, from expanding Copilot capabilities to collaborations like its work with SpaceX via the Starlink network. However, these innovations have not translated into sustained stock gains. The muted reaction suggests that markets are prioritizing financial outcomes over technological progress in the current environment. The most significant concern remains Microsoft’s aggressive spending. The company has committed roughly $50 billion to expanding AI-focused data center infrastructure. As capital expenditures rise faster than revenue, early signs of margin compression are beginning to emerge. While these investments aim to secure long-term leadership, they are weighing on near-term profitability. Conclusion: Microsoft’s recent decline reflects a broader shift in market expectations. Strong growth and innovation are no longer sufficient on their own—investors now want clear evidence of profitability and efficient capital allocation. While the company remains a dominant force in technology, rising costs, competitive pressures, and execution risks are creating a more cautious outlook. Until Microsoft can demonstrate tangible returns on its AI investments, the stock may continue to face pressure despite its long-term potential.",https://www.fxleaders.com/news/2026/03/27/can-msft-stock-decline-stop-at-344-support-or-will-it-head-to-300-next-week/
