ticker,title,date,content,url
MSFT,McClarren Financial Advisors Inc. Reduces Stock Position in Microsoft Corporation $MSFT - MarketBeat,2026-04-03 09:20:06,"McClarren Financial Advisors Inc. trimmed its stake in  Microsoft Corporation (NASDAQ:MSFT - Free Report) by 27.9% in the 4th quarter, according to the company in its most recent 13F filing with the Securities and Exchange Commission. The firm owned 3,483 shares of the software giant's stock after selling 1,345 shares during the period. Microsoft accounts for about  1.1% of McClarren Financial Advisors Inc.'s investment portfolio, making the stock its 12th biggest holding. McClarren Financial Advisors Inc.'s holdings in Microsoft were worth $1,572,000 as of its most recent filing with the Securities and Exchange Commission. A number of other large investors have also recently modified their holdings of MSFT. Regatta Capital Group LLC increased its position in shares of  Microsoft by 0.3% during the fourth quarter. Regatta Capital Group LLC now owns 24,614 shares of the software giant's stock valued at $11,904,000 after buying an additional 68 shares during the period.  Well Done LLC lifted its holdings in  Microsoft by 3.8% in the fourth quarter. Well Done LLC now owns 10,058 shares of the software giant's stock worth $4,864,000 after buying an additional 371 shares during the period.  Argentarii LLC boosted its position in  Microsoft by 12.3% during the 4th quarter. Argentarii LLC now owns 35,436 shares of the software giant's stock valued at $17,137,000 after acquiring an additional 3,891 shares in the last quarter.  Signal Advisors Wealth LLC grew its holdings in shares of  Microsoft by 6.3% during the 4th quarter. Signal Advisors Wealth LLC now owns 49,913 shares of the software giant's stock worth $24,139,000 after acquiring an additional 2,972 shares during the period.  Finally, Scratch Capital LLC grew its holdings in shares of  Microsoft by 18.4% during the 4th quarter. Scratch Capital LLC now owns 1,157 shares of the software giant's stock worth $560,000 after acquiring an additional 180 shares during the period. Institutional investors own  71.13% of the company's stock. Here are the key news stories impacting Microsoft this week: MSFT stock opened at $373.46 on Friday. Microsoft Corporation has a twelve month low of $344.79 and a twelve month high of $555.45. The company has a quick ratio of 1.38, a current ratio of 1.39 and a debt-to-equity ratio of 0.09. The firm has a market cap of $2.77 trillion, a PE ratio of 23.36, a price-to-earnings-growth ratio of 1.40 and a beta of 1.11. The business has a 50 day moving average of $402.61 and a 200 day moving average of $463.92. Microsoft (NASDAQ:MSFT - Get Free Report) last released its earnings results on Wednesday, January 28th. The software giant reported $4.14 EPS for the quarter, topping the consensus estimate of $3.86 by $0.28. Microsoft had a return on equity of 32.34% and a net margin of 39.04%.The business had revenue of $81.27 billion for the quarter, compared to the consensus estimate of $80.28 billion. During the same period in the previous year, the company posted $3.23 earnings per share. The company's revenue for the quarter was up 16.7% compared to the same quarter last year.  On average, research analysts forecast that  Microsoft Corporation will post 13.08 EPS for the current fiscal year. The company also recently declared a quarterly dividend, which will be paid on Thursday, June 11th. Investors of record on Thursday, May 21st will be paid a $0.91 dividend. The ex-dividend date is Thursday, May 21st. This represents a $3.64 dividend on an annualized basis and a yield of 1.0%. Microsoft's payout ratio is presently 22.76%. In other news, Director John W. Stanton bought 5,000 shares of the firm's stock in a transaction on Wednesday, February 18th. The stock was acquired at an average cost of $397.35 per share, with a total value of $1,986,750.00. Following the completion of the acquisition, the director owned 83,905 shares of the company's stock, valued at approximately $33,339,651.75. This represents a 6.34% increase in their ownership of the stock. The transaction was disclosed in a legal filing with the Securities & Exchange Commission, which can be accessed through the SEC website. Also, EVP Kathleen T. Hogan sold 12,321 shares of the stock in a transaction that occurred on Friday, March 6th. The shares were sold at an average price of $409.52, for a total transaction of $5,045,695.92. Following the sale, the executive vice president owned 137,933 shares in the company, valued at approximately $56,486,322.16. The trade was a 8.20% decrease in their position. The SEC filing for this sale provides additional information. Insiders own  0.03% of the company's stock. A number of research analysts have recently commented on the company. Citigroup lowered their target price on Microsoft from $660.00 to $635.00 and set a ""buy"" rating for the company in a research note on Thursday, January 29th. BNP Paribas Exane upped their price target on Microsoft from $632.00 to $659.00 and gave the stock an ""outperform"" rating in a research note on Tuesday, January 27th. Melius Research  set a $430.00 price objective on Microsoft in a research report on Monday, February 9th. Wells Fargo & Company dropped their target price on shares of Microsoft from $630.00 to $615.00 and set an ""overweight"" rating on the stock in a report on Thursday, January 29th. Finally, Wolfe Research reduced their target price on shares of Microsoft from $625.00 to $530.00 and set an ""outperform"" rating on the stock in a research report on Thursday, January 29th. Two analysts have rated the stock with a Strong Buy rating, thirty-eight have issued  a Buy rating and five have assigned  a Hold rating to the company's stock. According to data from MarketBeat, Microsoft  has an average rating of ""Moderate Buy"" and a consensus price target of $588.97. Microsoft Corporation is a global technology company headquartered in Redmond, Washington. Founded in 1975 by Bill Gates and Paul Allen, Microsoft develops, licenses and supports a broad range of software products, services and devices for consumers, enterprises and governments worldwide. Its operations span personal computing, productivity software, cloud infrastructure, enterprise applications, developer tools and gaming. Microsoft's product portfolio includes the Windows operating system and the Microsoft 365 suite of productivity and collaboration tools (Office apps, Outlook, Teams). Want to see what other hedge funds are holding MSFT? Visit HoldingsChannel.com to get the latest 13F filings and insider trades for Microsoft Corporation (NASDAQ:MSFT - Free Report). This instant news alert was generated by narrative science technology and financial data from MarketBeat in order to provide readers with the fastest reporting and unbiased coverage. Please send any questions or comments about this story to contact@marketbeat.com. Before you consider Microsoft, you'll want to hear this. MarketBeat keeps track of Wall Street's top-rated and best performing research analysts and the stocks they recommend to their clients on a daily basis. MarketBeat has identified the five stocks that top analysts are quietly whispering to their clients to buy now before the broader market catches on... and Microsoft wasn't on the list. While Microsoft currently has a Moderate Buy rating among analysts, top-rated analysts believe these five stocks are better buys. Wondering what the next stocks will be that hit it big, with solid fundamentals? Click the link to see which stocks MarketBeat analysts could become the next blockbuster growth stocks. Sign up for MarketBeat All Access to gain access to MarketBeat's full suite of research tools. 345 N Reid Place, Suite 620, Sioux Falls, SD 57103
                                        
                                        contact@marketbeat.com
                                        
                                        (844) 978-6257 © MarketBeat Media, LLC 2010-2026. All rights reserved. © 2026   Fair market value prices are updated every minute and are provided by Massive. Other market data provided is at least 10-minutes delayed and hosted by Barchart Solutions.  Information is provided 'as-is' and solely for informational purposes, not for trading purposes or advice, and is delayed. To see all exchange delays and terms of use please see Barchart's disclaimer. We and our partners share information on your use of this website to help improve your experience. For more information, or to opt out click the Do Not Sell My Information button below.",https://www.marketbeat.com/instant-alerts/filing-mcclarren-financial-advisors-inc-reduces-stock-position-in-microsoft-corporation-msft-2026-04-03/
MSFT,Perkins Coie Trust Co Has $31.66 Million Stock Position in Microsoft Corporation $MSFT - MarketBeat,2026-04-03 09:18:08,"Perkins Coie Trust Co reduced its stake in shares of  Microsoft Corporation (NASDAQ:MSFT - Free Report) by 4.2% during the 4th quarter, according to its most recent disclosure with the Securities and Exchange Commission (SEC). The fund owned 65,458 shares of the software giant's stock after selling 2,851 shares during the quarter. Microsoft comprises about  5.9% of Perkins Coie Trust Co's investment portfolio, making the stock its 3rd biggest position. Perkins Coie Trust Co's holdings in Microsoft were worth $31,656,000 as of its most recent filing with the Securities and Exchange Commission (SEC). Several other institutional investors have also modified their holdings of MSFT. IRON Financial LLC raised its holdings in shares of  Microsoft by 23.2% in the third quarter. IRON Financial LLC now owns 6,510 shares of the software giant's stock worth $3,372,000 after buying an additional 1,225 shares during the period.  Wellington Capital Management Inc. bought a new stake in shares of  Microsoft during the 2nd quarter worth approximately $9,941,000.  PMG Family Office LLC purchased a new position in  Microsoft during the 3rd quarter valued at $828,000.  Sound View Wealth Advisors Group LLC grew its position in  Microsoft by 2.6% in the 2nd quarter. Sound View Wealth Advisors Group LLC now owns 94,120 shares of the software giant's stock valued at $46,816,000 after acquiring an additional 2,373 shares during the last quarter.  Finally, Trifecta Capital Advisors LLC grew its position in  Microsoft by 2.3% in the 3rd quarter. Trifecta Capital Advisors LLC now owns 70,175 shares of the software giant's stock valued at $36,347,000 after acquiring an additional 1,572 shares during the last quarter. 71.13% of the stock is owned by institutional investors. Here are the key news stories impacting Microsoft this week: Shares of MSFT stock opened at $373.46 on Friday. The firm has a market cap of $2.77 trillion, a price-to-earnings ratio of 23.36, a PEG ratio of 1.40 and a beta of 1.11. Microsoft Corporation has a 52-week low of $344.79 and a 52-week high of $555.45. The company has a quick ratio of 1.38, a current ratio of 1.39 and a debt-to-equity ratio of 0.09. The company's 50 day moving average is $402.61 and its 200 day moving average is $463.92. Microsoft (NASDAQ:MSFT - Get Free Report) last posted its earnings results on Wednesday, January 28th. The software giant reported $4.14 earnings per share for the quarter, topping analysts' consensus estimates of $3.86 by $0.28. Microsoft had a return on equity of 32.34% and a net margin of 39.04%.The company had revenue of $81.27 billion during the quarter, compared to analyst estimates of $80.28 billion. During the same quarter in the prior year, the business earned $3.23 earnings per share. Microsoft's revenue was up 16.7% on a year-over-year basis.  On average, sell-side analysts anticipate that  Microsoft Corporation will post 13.08 EPS for the current fiscal year. The business also recently disclosed a quarterly dividend, which will be paid on Thursday, June 11th. Investors of record on Thursday, May 21st will be given a dividend of $0.91 per share. The ex-dividend date of this dividend is Thursday, May 21st. This represents a $3.64 dividend on an annualized basis and a yield of 1.0%. Microsoft's dividend payout ratio (DPR) is presently 22.76%. In other news, Director John W. Stanton purchased 5,000 shares of the firm's stock in a transaction on Wednesday, February 18th. The stock was acquired at an average cost of $397.35 per share, with a total value of $1,986,750.00. Following the completion of the transaction, the director owned 83,905 shares in the company, valued at $33,339,651.75. This represents a 6.34% increase in their position. The purchase was disclosed in a legal filing with the SEC, which can be accessed through the SEC website. Also, EVP Kathleen T. Hogan sold 12,321 shares of the firm's stock in a transaction dated Friday, March 6th. The shares were sold at an average price of $409.52, for a total transaction of $5,045,695.92. Following the completion of the sale, the executive vice president owned 137,933 shares in the company, valued at $56,486,322.16. This represents a 8.20% decrease in their ownership of the stock. The disclosure for this sale is available in the SEC filing. 0.03% of the stock is owned by company insiders. Several research firms have recently weighed in on MSFT. BNP Paribas Exane lifted their target price on Microsoft from $632.00 to $659.00 and gave the stock an ""outperform"" rating in a research report on Tuesday, January 27th. HSBC cut their price target on shares of Microsoft from $667.00 to $588.00 and set a ""buy"" rating on the stock in a report on Thursday, January 29th. DA Davidson  reaffirmed a ""buy"" rating and issued a $650.00 price target on shares of Microsoft in a research note on Thursday, January 29th. The Goldman Sachs Group  reiterated a ""buy"" rating on shares of Microsoft in a report on Thursday, February 12th. Finally, Guggenheim  restated a ""buy"" rating and issued a $586.00 target price on shares of Microsoft in a research note on Thursday, January 22nd. Two investment analysts have rated the stock with a Strong Buy rating, thirty-eight have given a Buy rating and five have given a Hold rating to the stock. According to data from MarketBeat.com, Microsoft presently has an average rating of ""Moderate Buy"" and a consensus price target of $588.97. Microsoft Corporation is a global technology company headquartered in Redmond, Washington. Founded in 1975 by Bill Gates and Paul Allen, Microsoft develops, licenses and supports a broad range of software products, services and devices for consumers, enterprises and governments worldwide. Its operations span personal computing, productivity software, cloud infrastructure, enterprise applications, developer tools and gaming. Microsoft's product portfolio includes the Windows operating system and the Microsoft 365 suite of productivity and collaboration tools (Office apps, Outlook, Teams). Want to see what other hedge funds are holding MSFT? Visit HoldingsChannel.com to get the latest 13F filings and insider trades for Microsoft Corporation (NASDAQ:MSFT - Free Report). This instant news alert was generated by narrative science technology and financial data from MarketBeat in order to provide readers with the fastest reporting and unbiased coverage. Please send any questions or comments about this story to contact@marketbeat.com. Before you consider Microsoft, you'll want to hear this. MarketBeat keeps track of Wall Street's top-rated and best performing research analysts and the stocks they recommend to their clients on a daily basis. MarketBeat has identified the five stocks that top analysts are quietly whispering to their clients to buy now before the broader market catches on... and Microsoft wasn't on the list. While Microsoft currently has a Moderate Buy rating among analysts, top-rated analysts believe these five stocks are better buys. Unlock the timeless value of gold with our exclusive 2026 Gold Forecasting Report. Explore why gold remains the ultimate investment for safeguarding wealth against inflation, economic shifts, and global uncertainties. Whether you're planning for future generations or seeking a reliable asset in turbulent times, this report is your essential guide to making informed decisions. Sign up for MarketBeat All Access to gain access to MarketBeat's full suite of research tools. 345 N Reid Place, Suite 620, Sioux Falls, SD 57103
                                        
                                        contact@marketbeat.com
                                        
                                        (844) 978-6257 © MarketBeat Media, LLC 2010-2026. All rights reserved. © 2026   Fair market value prices are updated every minute and are provided by Massive. Other market data provided is at least 10-minutes delayed and hosted by Barchart Solutions.  Information is provided 'as-is' and solely for informational purposes, not for trading purposes or advice, and is delayed. To see all exchange delays and terms of use please see Barchart's disclaimer. We and our partners share information on your use of this website to help improve your experience. For more information, or to opt out click the Do Not Sell My Information button below.",https://www.marketbeat.com/instant-alerts/filing-perkins-coie-trust-co-has-3166-million-stock-position-in-microsoft-corporation-msft-2026-04-03/
MSFT,"Kopp Family Office LLC Buys 1,746 Shares of Microsoft Corporation $MSFT - MarketBeat",2026-04-03 09:18:07,"Kopp Family Office LLC lifted its stake in shares of  Microsoft Corporation (NASDAQ:MSFT - Free Report) by 26.0% during the 4th quarter, according to its most recent 13F filing with the Securities and Exchange Commission. The fund owned 8,470 shares of the software giant's stock after purchasing an additional 1,746 shares during the quarter. Microsoft accounts for about  2.6% of Kopp Family Office LLC's portfolio, making the stock its 12th largest position. Kopp Family Office LLC's holdings in Microsoft were worth $4,096,000 as of its most recent filing with the Securities and Exchange Commission. Other institutional investors have also added to or reduced their stakes in the company. Norges Bank acquired a new position in shares of  Microsoft during the second quarter worth $50,493,678,000.  Nuveen LLC bought a new position in shares of  Microsoft in the 1st quarter valued at $18,733,827,000.  UBS AM A Distinct Business Unit of UBS Asset Management Americas LLC boosted its holdings in shares of  Microsoft by 500.0% during the 3rd quarter. UBS AM A Distinct Business Unit of UBS Asset Management Americas LLC now owns 59,543,261 shares of the software giant's stock valued at $30,840,432,000 after acquiring an additional 49,618,571 shares in the last quarter.  Laurel Wealth Advisors LLC boosted its holdings in shares of  Microsoft by 49,640.3% during the 2nd quarter. Laurel Wealth Advisors LLC now owns 29,967,038 shares of the software giant's stock valued at $14,905,904,000 after acquiring an additional 29,906,791 shares in the last quarter.  Finally, Vanguard Group Inc. grew its position in  Microsoft by 2.0% during the 2nd quarter. Vanguard Group Inc. now owns 705,077,786 shares of the software giant's stock worth $350,712,742,000 after acquiring an additional 13,691,572 shares during the last quarter. 71.13% of the stock is currently owned by institutional investors and hedge funds. MSFT has been the subject of several research reports. Robert W. Baird  set a $540.00 target price on Microsoft and gave the company an ""outperform"" rating in a research report on Thursday, January 29th. Sanford C. Bernstein  restated an ""outperform"" rating and set a $641.00 price target (down from $645.00) on shares of Microsoft in a report on Thursday, January 29th. Melius Research  set a $430.00 price objective on Microsoft in a research note on Monday, February 9th. TD Cowen  reiterated a ""buy"" rating on shares of Microsoft in a report on Thursday, January 29th. Finally, Deutsche Bank Aktiengesellschaft cut their target price on shares of Microsoft from $630.00 to $575.00 and set a ""buy"" rating on the stock in a research report on Thursday, January 29th. Two analysts have rated the stock with a Strong Buy rating, thirty-eight have given a Buy rating and five have issued  a Hold rating to the company. Based on data from MarketBeat, the company presently has an average rating of ""Moderate Buy"" and an average target price of $588.97. Shares of MSFT stock opened at $373.46 on Friday. Microsoft Corporation has a 1-year low of $344.79 and a 1-year high of $555.45. The company has a current ratio of 1.39, a quick ratio of 1.38 and a debt-to-equity ratio of 0.09. The stock has a market cap of $2.77 trillion, a price-to-earnings ratio of 23.36, a PEG ratio of 1.40 and a beta of 1.11. The stock has a 50-day moving average of $402.61 and a 200-day moving average of $463.92. Microsoft (NASDAQ:MSFT - Get Free Report) last posted its quarterly earnings data on Wednesday, January 28th. The software giant reported $4.14 EPS for the quarter, topping analysts' consensus estimates of $3.86 by $0.28. Microsoft had a return on equity of 32.34% and a net margin of 39.04%.The company had revenue of $81.27 billion for the quarter, compared to analyst estimates of $80.28 billion. During the same period in the previous year, the firm earned $3.23 earnings per share. The firm's quarterly revenue was up 16.7% on a year-over-year basis.  On average, equities research analysts forecast that  Microsoft Corporation will post 13.08 earnings per share for the current year. The company also recently declared a quarterly dividend, which will be paid on Thursday, June 11th. Stockholders of record on Thursday, May 21st will be given a $0.91 dividend. The ex-dividend date is Thursday, May 21st. This represents a $3.64 dividend on an annualized basis and a dividend yield of 1.0%. Microsoft's payout ratio is 22.76%. Here are the key news stories impacting Microsoft this week: In related news, EVP Kathleen T. Hogan sold 12,321 shares of Microsoft stock in a transaction on Friday, March 6th. The shares were sold at an average price of $409.52, for a total transaction of $5,045,695.92. Following the completion of the transaction, the executive vice president owned 137,933 shares of the company's stock, valued at $56,486,322.16. This trade represents a 8.20% decrease in their ownership of the stock. The sale was disclosed in a filing with the Securities & Exchange Commission, which is available at the SEC website. Also, Director John W. Stanton bought 5,000 shares of the company's stock in a transaction that occurred on Wednesday, February 18th. The stock was purchased at an average price of $397.35 per share, for a total transaction of $1,986,750.00. Following the acquisition, the director owned 83,905 shares of the company's stock, valued at $33,339,651.75. This trade represents a 6.34% increase in their ownership of the stock. The SEC filing for this purchase provides additional information. Corporate insiders own  0.03% of the company's stock. Microsoft Corporation is a global technology company headquartered in Redmond, Washington. Founded in 1975 by Bill Gates and Paul Allen, Microsoft develops, licenses and supports a broad range of software products, services and devices for consumers, enterprises and governments worldwide. Its operations span personal computing, productivity software, cloud infrastructure, enterprise applications, developer tools and gaming. Microsoft's product portfolio includes the Windows operating system and the Microsoft 365 suite of productivity and collaboration tools (Office apps, Outlook, Teams). This instant news alert was generated by narrative science technology and financial data from MarketBeat in order to provide readers with the fastest reporting and unbiased coverage. Please send any questions or comments about this story to contact@marketbeat.com. Before you consider Microsoft, you'll want to hear this. MarketBeat keeps track of Wall Street's top-rated and best performing research analysts and the stocks they recommend to their clients on a daily basis. MarketBeat has identified the five stocks that top analysts are quietly whispering to their clients to buy now before the broader market catches on... and Microsoft wasn't on the list. While Microsoft currently has a Moderate Buy rating among analysts, top-rated analysts believe these five stocks are better buys. Just getting into the stock market? These 10 simple stocks can help beginning investors build long-term wealth without knowing options, technicals, or other advanced strategies. Sign up for MarketBeat All Access to gain access to MarketBeat's full suite of research tools. 345 N Reid Place, Suite 620, Sioux Falls, SD 57103
                                        
                                        contact@marketbeat.com
                                        
                                        (844) 978-6257 © MarketBeat Media, LLC 2010-2026. All rights reserved. © 2026   Fair market value prices are updated every minute and are provided by Massive. Other market data provided is at least 10-minutes delayed and hosted by Barchart Solutions.  Information is provided 'as-is' and solely for informational purposes, not for trading purposes or advice, and is delayed. To see all exchange delays and terms of use please see Barchart's disclaimer. We and our partners share information on your use of this website to help improve your experience. For more information, or to opt out click the Do Not Sell My Information button below.",https://www.marketbeat.com/instant-alerts/filing-kopp-family-office-llc-buys-1746-shares-of-microsoft-corporation-msft-2026-04-03/
