ticker,title,date,content,url
MSFT,"""Code Red"": Microsoft CEO Satya Nadella Is Reportedly Leading an Overhaul of Copilot. Should Investors Buy the Stock? - The Motley Fool",2026-04-18 22:30:00,"Microsoft's generative artificial intelligence assistant has so far disappointed investors. One of the big disappointments in the stock market lately has been Microsoft (MSFT +0.60%), which recently closed out its worst quarter since 2008. The stock is down over 17% in the past six months, a big move for one of the world's largest companies. Part of the sell-off can be attributed to the 2026 software rout, with investors concerned that artificial intelligence (AI) will easily replicate similar products and solutions, eroding margins and, in turn, pricing power. Despite the negative sentiment of late, Microsoft could be one of the largest beneficiaries of AI. Unfortunately, Microsoft's generative AI assistant Copilot has so far disappointed. Recently, reports have circulated that Microsoft CEO Satya Nadella has launched an overhaul of Copilot dubbed ""Code Red."" Should investors buy the stock? Copilot is many things. It's an AI conversational chatbot. It can help automate workflows. It can create a range of content. It can be integrated into Microsoft's various 365 applications, such as Word, Excel, PowerPoint, and Teams. It can be used for coding and to help developers build AI applications. Yet, despite its capabilities, Copilot has struggled to gain the traction investors would like, especially given its positioning as a competitor to ChatGPT and Anthropic's Claude. On Microsoft's most recent earnings call, Nadella told analysts that the company now has ""15 million paid Microsoft Corporation 365 Copilot seats and multiples more enterprise chat users."" Furthermore, the company had 4.7 million paid GitHub Copilot Pro Plus subscribers, up 75% year over year. GitHub Copilot is Microsoft's AI-powered coding assistant. Still, investors seem disappointed, given that Microsoft 365 has 450 million paying subscribers. One would think cross-selling would be more effective. As a result of the struggles, BNP Paribas analyst Stefan Slowinski said in a research note that Nadella is leading an overhaul dubbed ""Microsoft's Copilot code red,"" to boost performance and improve the user experience. This will include the rollout of Microsoft 365 E7, with a fully integrated AI stack so AI can be used across the entire business. Other products will follow, including Agent Mode, Copilot Cowork, Critique, Council, and Agent 365. Slowinski sounded optimistic about the new AI products, noting that he and his team have received more positive feedback and sentiment on these Copilot tools and features. Slowinski also said that the software sell-off has not spared Microsoft; investors have been frustrated by Copilot, concerned that Microsoft could end up in a contest with OpenAI and Anthropic, and are still looking for Microsoft to strike the right balance between capital expenditures, free-cash-flow growth, and AI monetization. ""This combined with continued attractive FCF (free cash flow) margins (~20%) vs hyperscaler peers (0%), along with renewed confidence in Copilot, and Azure beats could create a formula for Microsoft's stock to get back on track,"" Slowinski wrote. Copilot remains a pain point for the stock, and investors will likely need to see proof of further traction before they believe it can succeed in the competitive landscape. On the consumer side, Copilot doesn't seem to have nearly the same recognition as ChatGPT and Claude. However, the company runs many great software businesses and is well-positioned to benefit from AI, whether through Copilot or its Azure cloud services business, which helps clients build and run AI applications. While AI remains a significant threat to the software moat, Microsoft 365 is one of the, if not the, stickiest enterprise suites of tools. I strongly suspect that if its moat is threatened, Microsoft has the resources and AI capabilities to help bolster and maintain that moat. Long-term investors can certainly buy Microsoft stock. Bram Berkowitz has no position in any of the stocks mentioned. The Motley Fool has positions in and recommends Microsoft. The Motley Fool has a disclosure policy. *Average returns of all recommendations since inception. Cost basis and return based on previous market day close. Invest better with The Motley Fool. Get stock recommendations, portfolio guidance, and more from The Motley Fool's premium services. © 1995 - 2026 The Motley Fool. All rights reserved.",https://www.fool.com/investing/2026/04/18/code-red-microsoft-ceo-satya-nadella-copilot-buy/
MSFT,"MSFT Price Today: Microsoft Corp. Stock Price, Quote & Chart | MEXC - MEXC",2026-04-18 19:07:09,"Microsoft Corp. (MSFT) is currently trading at $422.72 as of 2026-04-18 00:01:00, reflecting a +0.59% move ($+2.49) from the previous close. In the short term, the stock has returned +10.70% over the past four weeks. Over the last 12 months, Microsoft Corp. has recorded a +17.71% price change, indicating a Stable performance relative to the broader market. Over the past seven days, Microsoft Corp. has traded within a short-term range shaped by market sentiment in the SERVICES-PREPACKAGED SOFTWARE sector. During this period, the stock moved from its previous closing price of $373.61 to the latest recorded price of $422.72, reflecting an intraday change of +0.59%. Daily movements highlight shifts in trading volume (40,592,256), investor positioning, and reactions to macroeconomic updates. From a momentum standpoint, MSFT has delivered a +10.70% return over the past month and a +17.71% change in the last 12 months, indicating a Stable trend relative to its broader sector peers. You can buy and trade MSFT on MEXC in three simple steps: Microsoft develops and licenses consumer and enterprise software. It is known for its Windows operating systems and Office productivity suite. The company is organized into three equally sized broad segments: productivity and business processes (legacy Microsoft Office, cloud-based Office 365, Exchange, SharePoint, Skype, LinkedIn, Dynamics), intelligence cloud (infrastructure- and platform-as-a-service offerings Azure, Windows Server OS, SQL Server), and more personal computing (Windows Client, Xbox, Bing search, display advertising, and Surface laptops, tablets, and desktops). See US stocks with the highest market capitalization Browse today's leading gainers in the US stock market Explore the cryptocurrencies with the highest market capitalization Content is for informational purposes only and does not constitute investment advice. The stock price information displayed on this page is provided for reference purposes only and may be delayed or differ from real-time market data. Prices, charts, and related metrics do not constitute investment advice and should not be relied upon for trading or investment decisions. MEXC is not responsible for any losses incurred based on the stock price information provided on this page. Please refer to official market sources or consult licensed financial professionals before making any investment decisions.",https://www.mexc.com/stocks/msft
MSFT,Is Microsoft (MSFT) One of the Best Unrivaled Stocks of the Next 5 Years? - Yahoo Finance,2026-04-18 18:41:44,"Tip: Try a valid symbol or a specific company name for relevant results In the rarefied world of luxury automobiles, Rolls-Royce just upped the altitude. Gas prices ""rise like a rocket and fall like a feather.""  Here's what to know. The million dollar retirement planning question: How long will you live? The software rebound is real, but not every big name is back Allbirds' AI pivot shows signs of froth in markets, but experts say the underlying fundamentals in AI remain strong. Dow leaps 850 points, S&P 500 and Nasdaq notch new records in stunning rally amid US-Iran diplomacy hopes Stocks climbed at the open and oil fell as Iran said the Strait of Hormuz is 'completely open' The stock market has notched one of its fastest turnarounds in years Europe is facing a severe jet fuel shortage, with 'maybe six weeks of jet fuel left' Stocks rebound after Trump says Israel, Lebanon agreed to ceasefire S&P 500, Dow, Nasdaq rise, with fresh records in view amid hopes for truce Tax refunds shoot up as Americans take advantage of new deductions S&P 500 closes above 7,000 for the first time, Nasdaq hits record as stocks erase Iran war losses The former sneaker company's stock rose over 600% after announcing its rebrand as an AI company S&P 500, Nasdaq rise as Dow falls amid hopes for US-Iran talks The S&P 500 and Nasdaq rallied toward record highs on hopes of an Iran deal while oil tumbled Bitcoin bounced above $74,000, but Wall Street warns it could go lower before it goes higher US stocks rise amid Iran deal hopes, earnings rush, cooler-than-expected PPI JPMorgan profits rise 13%, Dimon warns of 'increasingly complex set of risks' US stocks sink after Trump orders Hormuz blockade against Iran Goldman Sachs Q1 profits climb thanks to jumps in M&A dealmaking and record equity trading The stock market's latest rally is reviving a familiar trade — but not all of the Magnificent Seven are coming along for the ride. Gen Z is driving IRA contributions to record highs. Here's how to get started. Wall Street strategists say it's time to 'jump in' with tech stocks Trump says US will blockade Strait of Hormuz after Iran talks fail (Bloomberg) Bank earnings, US-Iran talks, and signs of stability for stocks: What to watch this week Shaq, in NYC discussing his new investment with retailer tm:rw, said the NBA dunk contest isn't what it used to be. Used car prices hit highest levels since 2023 and could push higher What to know about X Money, Elon Musk's fintech app that claims to pay 6% on savings The housing market is shifting toward buyers. Just not in New Jersey. Wall Street's biggest banks are riding into the first quarter earnings season on far less certain ground than where they began 2026. Watch: OpenAI CEO Sam Altman's house was reportedly the target of a Molotov cocktail attack on Friday. Yahoo Finance's Dan Howley explains. Stocks post second straight winning week amid fragile US-Iran ceasefire US tariff revenue dropped by over $4 billion in March. It's down almost 30% since October. US stocks open higher after March CPI inflation data shows energy surge Inflation soars by most since 2022 as gas prices bite Americans close to retirement are saving for later, but they're worried about getting by right now Government data out Friday will show how much consumer prices rose in March — and forecasts point to soaring inflation. Palantir plunges after 'Big Short' investor Michael Burry says Anthropic is eating its lunch Stocks rebounded to extend their winning streak, while oil rose ahead of US-Iran talks Stocks turned positive after Israel agreed to talks with Lebanon, reviving optimism for the US-Iran ceasefire US stocks pull back, oil surges as US-Iran ceasefire looks increasingly shaky Sticky reading on inflation pre-war will keep Fed on hold The New York Times may have found bitcoin founder Satoshi Nakamoto. Here's what you need to know. Fed officials saw risks of the Iran war increasing inflation and delaying rate cuts in a March meeting The Strait of Hormuz has immediately become the first major flash point of Trump's 'fragile' ceasefire US stocks surged while oil prices plunged as relief from a fragile US-Iran ceasefire rippled through markets US stocks soar, with Dow surging nearly 1,400 points as Iran truce restarts Hormuz traffic Delta beats on Q1 earnings, maintains guidance despite fuel spike, TSA headwinds The above button links to Coinbase. Yahoo Finance is not a broker-dealer or investment adviser and does not offer securities or cryptocurrencies for sale or facilitate trading. Coinbase pays us for certain activity generated through this link. Prices displayed are informational. Microsoft Corporation (NASDAQ:MSFT) is one of the 10 Unrivaled Stocks of the Next 5 Years. On April 14, Microsoft Corporation (NASDAQ:MSFT) announced plans to buy about 3,200 acres of land to develop a new data center in Cheyenne, Wyoming. This move will expand the company’s existing data center presence in Cheyenne and further support Southeast Wyoming’s growth as a center for technology, innovation, and economic activity. According to the report by Microsoft Corporation (NASDAQ:MSFT), this planned expansion includes two pieces of land located southeast of downtown Cheyenne. One is around 200 acres in the Bison Business Park on Wapiti Trail, east of South Greeley Highway. The other, much larger parcel is about 3,000 acres located southeast of Cheyenne, adjacent to the smaller site and also accessible from Wapiti Trail. The company has been operating data centers in Cheyenne since 2012. Microsoft Corporation (NASDAQ:MSFT) has committed more than $68 million in complete and future off-site infrastructure improvements in the region. Microsoft Corporation (NASDAQ:MSFT) is an American technology company that specializes in AI-powered cloud, productivity, and business solutions. The company develops and markets software, services, and hardware. While we acknowledge the potential of MSFT as an investment, we believe certain AI stocks offer greater upside potential and carry less downside risk. If you're looking for an extremely undervalued AI stock that also stands to benefit significantly from Trump-era tariffs and the onshoring trend, see our free report on the best short-term AI stock. READ NEXT: 10 Best Performing AI Stocks to Buy and 10 Best Performing Blue Chip Stocks to Buy. Disclosure: None.  Follow Insider Monkey on Google News. Tip: Try a valid symbol or a specific company name for relevant results",https://finance.yahoo.com/markets/stocks/articles/microsoft-msft-one-best-unrivaled-184144197.html
MSFT,$MSFT stock rose 13% this week. Here's what we see in our data. - Quiver Quantitative,2026-04-18 16:51:00,"Enter your email to receive free breaking news alerts and insights related to MSFT. Backtested trading strategies built on Quiver's datasets Be the first to see our newest insights and key updates across all datasets Track the top-performing stock portfolios held by U.S. politicians in Congress Find stocks with ease across diverse datasets and filters Build and test your own strategies, using Quiver's Congressional trading datasets Build and test your own strategies, using Quiver's Institutional holdings datasets Our video reports and analysis, with early access to exclusive, subscriber-only videos By: Quiver PriceTracker $MSFT stock rose 13% this week, according to our price data from Polygon. It has been the 3rd most-searched ticker on Quiver Quantitative over the last week, out of 50 total tickers searched. Here is what we see in our data on $MSFT (you can track the company live on Quiver's $MSFT stock page): $MSFT insiders have traded $MSFT stock on the open market 6 times in the past 6 months. Of those trades, 1 have been purchases and 5 have been sales. Here’s a breakdown of recent trading of $MSFT stock by insiders over the last 6 months: To track insider transactions, check out Quiver Quantitative's insider trading dashboard. We have seen 2,834 institutional investors add shares of $MSFT stock to their portfolio, and 2,640 decrease their positions in their most recent quarter. To track hedge funds' stock portfolios, check out Quiver Quantitative's institutional holdings dashboard. We have seen $365,673,484 of award payments to $MSFT over the last year. Here are some of the awards which we have have seen pay out the most over the last year: To track government contracts to publicy traded companies, check out Quiver Quantitative's government contracts dashboard. Members of Congress have traded $MSFT stock 42 times in the past 6 months. Of those trades, 26 have been purchases and 16 have been sales. Here’s a breakdown of recent trading of $MSFT stock by members of Congress over the last 6 months: To track congressional stock trading, check out Quiver Quantitative's congressional trading dashboard. Wall Street analysts have issued reports on $MSFT in the last several months. We have seen 12 firms issue buy ratings on the stock, and 0 firms issue sell ratings. To track analyst ratings and price targets for $MSFT, check out Quiver Quantitative's $MSFT forecast page. Multiple analysts have issued price targets for $MSFT recently. We have seen 28 analysts offer price targets for $MSFT in the last 6 months, with a median target of $583.0. You can track data on $MSFT on Quiver Quantitative. This article is not financial advice. See Quiver Quantitative's disclaimers for more information. Note that there may be inaccuracies due to mistakes in ticker-mapping, and other anomalies. Add Quiver Quantitative to your preferred sources on Google",https://www.quiverquant.com/news/%24MSFT+stock+rose+13%25+this+week.+Here%27s+what+we+see+in+our+data.
MSFT,Microsoft Stellantis AI Alliance Tests Long Term Automotive Cloud Returns - simplywall.st,2026-04-18 16:14:24,"For you as an investor, this move reinforces Microsoft’s role as a core technology supplier to large industrial groups, not just a software and consumer cloud company. Stellantis is one of the world’s largest automakers, so committing its core digital systems to Azure and Microsoft’s AI stack indicates how deeply NasdaqGS:MSFT is integrating into connected vehicle and manufacturing workflows. It also broadens Microsoft’s exposure to long term trends in software defined cars and factory automation. Looking ahead, this kind of multi year, sector wide digital program can influence how other manufacturers approach large scale AI and cloud commitments. Investors watching NasdaqGS:MSFT may want to track how quickly these 100 plus projects move from pilots into live production, how widely Copilot tools are adopted inside Stellantis, and whether similar agreements are signed with other global industrial groups. Stay updated on the most important news stories for Microsoft by adding it to your watchlist or portfolio. Alternatively, explore our Community to discover new perspectives on Microsoft. 5 things going right for Microsoft that this headline doesn't cover. For Microsoft, the Stellantis deal sits squarely in its push to be the default AI and cloud supplier for large, complex enterprises. Stellantis is not just buying hosting capacity, it is tying more than 100 AI projects, a global cyber defense center, and a sizeable infrastructure migration to Azure, Copilot and Microsoft’s security stack. That plays directly to Microsoft’s strength in large scale platforms where productivity tools, data, and security run together, and it gives the company a high profile reference in connected vehicles and factory automation where Amazon Web Services and Google Cloud are also competing. Knowing what a company is worth starts with understanding its story.
 Check out one of the top narratives in the Simply Wall St Community for Microsoft to help decide what it's worth to you. From here, it is worth watching whether Microsoft begins to feature Stellantis in earnings commentary or customer events with specific metrics, such as Azure consumption tied to vehicle programs, uptake of Microsoft 365 Copilot seats, or reductions in Stellantis’ on premises datacenter footprint. Also keep an eye on whether similar multi year AI and cloud collaborations appear with other global manufacturers, and how often Microsoft positions these wins against offerings from Amazon Web Services or Google Cloud. Any future disclosures that link automotive and industrial deals to AI related spending, margins or long term commitments will help you judge how this partnership contributes to the broader Microsoft AI story. To ensure you're always in the loop on how the latest news impacts the investment narrative for Microsoft, head to the
 community page for Microsoft to never miss an update on the top community narratives. This article by Simply Wall St is general in nature. We provide commentary based on historical data
    and analyst forecasts only using an unbiased methodology and our articles are not intended to be financial advice. It does not constitute a recommendation to buy or sell any stock, and does not take account of your objectives, or your
    financial situation. We aim to bring you long-term focused analysis driven by fundamental data.
    Note that our analysis may not factor in the latest price-sensitive company announcements or qualitative material.
    Simply Wall St has no position in any stocks mentioned. We've created the ultimate portfolio companion for stock investors, and it's free. • Connect an unlimited number of Portfolios and see your total in one currency• Be alerted to new Warning Signs or Risks via email or mobile• Track the Fair Value of your stocks Have feedback on this article? Concerned about the content? Get in touch with us directly. Alternatively, email editorial-team@simplywallst.com Develops and supports software, services, devices, and solutions worldwide. Outstanding track record with flawless balance sheet and pays a dividend. Financial Data provided by S&P Global Market Intelligence LLC, analysis provided by Simply Wall Street Pty Ltd. Copyright © 2026, S&P Global Market Intelligence LLC. All rights reserved. Simply Wall Street Pty Ltd (ACN 600 056 611), is a Corporate Authorised Representative (Authorised Representative Number: 467183) of Sanlam Private Wealth Pty Ltd (AFSL No. 337927). Any advice contained in this website is general advice only and has been prepared without considering your objectives, financial situation or needs. You should not rely on any advice and/or information contained in this website and before making any investment decision we recommend that you consider whether it is appropriate for your situation and seek appropriate financial, taxation and legal advice. Please read our Financial Services Guide before deciding whether to obtain financial services from us. © 2026 Simply Wall Street Pty Ltd, US Design Patent #29/544/281, Community and European Design Registration #2845206",https://simplywall.st/stocks/us/software/nasdaq-msft/microsoft/news/microsoft-stellantis-ai-alliance-tests-long-term-automotive
