ticker,title,date,content,url
MSFT,Microsoft Corporation $MSFT Shares Sold by SOA Wealth Advisors LLC. - MarketBeat,2026-04-18 09:19:54,"SOA Wealth Advisors LLC. cut its stake in shares of  Microsoft Corporation (NASDAQ:MSFT - Free Report) by 37.0% in the fourth quarter, according to its most recent disclosure with the SEC. The firm owned 78,260 shares of the software giant's stock after selling 45,967 shares during the period. Microsoft comprises about  3.8% of SOA Wealth Advisors LLC.'s holdings, making the stock its 4th biggest holding. SOA Wealth Advisors LLC.'s holdings in Microsoft were worth $37,848,000 as of its most recent filing with the SEC. A number of other large investors also recently added to or reduced their stakes in the stock. FLP Wealth Management LLC raised its position in  Microsoft by 1,328.5% during the fourth quarter. FLP Wealth Management LLC now owns 6,771 shares of the software giant's stock worth $3,275,000 after acquiring an additional 6,297 shares during the period.  Prospera Capital Management LLC raised its position in shares of  Microsoft by 10.9% in the fourth quarter. Prospera Capital Management LLC now owns 2,045 shares of the software giant's stock valued at $989,000 after buying an additional 201 shares during the last quarter.  Sheets Smith Wealth Management raised its position in shares of  Microsoft by 2.9% in the fourth quarter. Sheets Smith Wealth Management now owns 15,916 shares of the software giant's stock valued at $7,697,000 after buying an additional 447 shares during the last quarter.  Thurston Springer Miller Herd & Titak Inc. raised its position in shares of  Microsoft by 594.1% in the fourth quarter. Thurston Springer Miller Herd & Titak Inc. now owns 24,885 shares of the software giant's stock valued at $12,037,000 after buying an additional 21,300 shares during the last quarter.  Finally, Philip James Wealth Mangement LLC raised its position in shares of  Microsoft by 3.6% in the fourth quarter. Philip James Wealth Mangement LLC now owns 2,760 shares of the software giant's stock valued at $1,335,000 after buying an additional 97 shares during the last quarter. 71.13% of the stock is currently owned by institutional investors and hedge funds. Shares of MSFT opened at $422.79 on Friday. The company has a current ratio of 1.39, a quick ratio of 1.38 and a debt-to-equity ratio of 0.09. Microsoft Corporation has a 12-month low of $355.67 and a 12-month high of $555.45. The firm has a 50-day moving average price of $391.87 and a 200 day moving average price of $454.48. The firm has a market capitalization of $3.14 trillion, a P/E ratio of 26.44, a P/E/G ratio of 1.59 and a beta of 1.11. Microsoft (NASDAQ:MSFT - Get Free Report) last announced its quarterly earnings data on Wednesday, January 28th. The software giant reported $4.14 earnings per share (EPS) for the quarter, beating analysts' consensus estimates of $3.86 by $0.28. Microsoft had a net margin of 39.04% and a return on equity of 32.34%. The firm had revenue of $81.27 billion during the quarter, compared to analyst estimates of $80.28 billion. During the same quarter in the prior year, the firm posted $3.23 earnings per share. Microsoft's quarterly revenue was up 16.7% on a year-over-year basis.  Sell-side analysts forecast that  Microsoft Corporation will post 13.08 EPS for the current year. The business also recently announced a quarterly dividend, which will be paid on Thursday, June 11th. Shareholders of record on Thursday, May 21st will be paid a dividend of $0.91 per share. This represents a $3.64 annualized dividend and a yield of 0.9%. The ex-dividend date of this dividend is Thursday, May 21st. Microsoft's dividend payout ratio (DPR) is 22.76%. MSFT has been the subject of a number of recent research reports. Piper Sandler reduced their target price on shares of Microsoft from $600.00 to $500.00 and set an ""overweight"" rating for the company in a research report on Tuesday. Wall Street Zen cut shares of Microsoft from a ""buy"" rating to a ""hold"" rating in a research report on Sunday, January 18th. Melius Research  set a $430.00 target price on shares of Microsoft in a research report on Monday, February 9th. JPMorgan Chase & Co. reduced their target price on shares of Microsoft from $575.00 to $550.00 and set an ""overweight"" rating for the company in a research report on Thursday, January 29th. Finally, Wells Fargo & Company reduced their target price on shares of Microsoft from $630.00 to $615.00 and set an ""overweight"" rating for the company in a research report on Thursday, January 29th. Two analysts have rated the stock with a Strong Buy rating, thirty-eight have assigned  a Buy rating and five have given a Hold rating to the company. Based on data from MarketBeat, the stock currently has a consensus rating of ""Moderate Buy"" and an average target price of $577.58. Here are the key news stories impacting Microsoft this week: In other Microsoft news, EVP Kathleen T. Hogan sold 12,321 shares of the stock in a transaction dated Friday, March 6th. The shares were sold at an average price of $409.52, for a total transaction of $5,045,695.92. Following the completion of the transaction, the executive vice president owned 137,933 shares of the company's stock, valued at $56,486,322.16. This trade represents a 8.20% decrease in their ownership of the stock. The sale was disclosed in a filing with the SEC, which is available through the SEC website. Also, Director John W. Stanton bought 5,000 shares of the stock in a transaction on Wednesday, February 18th. The shares were bought at an average cost of $397.35 per share, with a total value of $1,986,750.00. Following the purchase, the director owned 83,905 shares of the company's stock, valued at $33,339,651.75. This trade represents a 6.34% increase in their ownership of the stock. The SEC filing for this purchase provides additional information. Company insiders own  0.03% of the company's stock. Microsoft Corporation is a global technology company headquartered in Redmond, Washington. Founded in 1975 by Bill Gates and Paul Allen, Microsoft develops, licenses and supports a broad range of software products, services and devices for consumers, enterprises and governments worldwide. Its operations span personal computing, productivity software, cloud infrastructure, enterprise applications, developer tools and gaming. Microsoft's product portfolio includes the Windows operating system and the Microsoft 365 suite of productivity and collaboration tools (Office apps, Outlook, Teams). This instant news alert was generated by narrative science technology and financial data from MarketBeat in order to provide readers with the fastest reporting and unbiased coverage. Please send any questions or comments about this story to contact@marketbeat.com. Before you consider Microsoft, you'll want to hear this. MarketBeat keeps track of Wall Street's top-rated and best performing research analysts and the stocks they recommend to their clients on a daily basis. MarketBeat has identified the five stocks that top analysts are quietly whispering to their clients to buy now before the broader market catches on... and Microsoft wasn't on the list. While Microsoft currently has a Moderate Buy rating among analysts, top-rated analysts believe these five stocks are better buys. Market downturns give many investors pause, and for good reason. Wondering how to offset this risk? Click the link to learn more about using beta to protect your portfolio. Sign up for MarketBeat All Access to gain access to MarketBeat's full suite of research tools. 345 N Reid Place, Suite 620, Sioux Falls, SD 57103
                                        
                                        contact@marketbeat.com
                                        
                                        (844) 978-6257 © MarketBeat Media, LLC 2010-2026. All rights reserved. © 2026   Fair market value prices are updated every minute and are provided by Massive. Other market data provided is at least 10-minutes delayed and hosted by Barchart Solutions.  Information is provided 'as-is' and solely for informational purposes, not for trading purposes or advice, and is delayed. To see all exchange delays and terms of use please see Barchart's disclaimer. Enter your email below to receive daily updates and analyst ratings for Microsoft and related companies from The Early Bird. We and our partners share information on your use of this website to help improve your experience. For more information, or to opt out click the Do Not Sell My Information button below.",https://www.marketbeat.com/instant-alerts/filing-microsoft-corporation-msft-shares-sold-by-soa-wealth-advisors-llc-2026-04-18/
MSFT,Trust Co. of Toledo NA OH Has $72.31 Million Stock Position in Microsoft Corporation $MSFT - MarketBeat,2026-04-18 09:19:52,"Trust Co. of Toledo NA OH cut its holdings in  Microsoft Corporation (NASDAQ:MSFT - Free Report) by 1.0% in the 4th quarter, according to the company in its most recent Form 13F filing with the Securities & Exchange Commission. The institutional investor  owned 149,520 shares of the software giant's stock after selling 1,466 shares during the period. Microsoft comprises approximately  7.1% of Trust Co. of Toledo NA OH's portfolio, making the stock its biggest holding. Trust Co. of Toledo NA OH's holdings in Microsoft were worth $72,311,000 at the end of the most recent quarter. Other institutional investors also recently modified their holdings of the company. BLVD Private Wealth LLC lifted its stake in  Microsoft by 0.6% in the third quarter. BLVD Private Wealth LLC now owns 3,169 shares of the software giant's stock valued at $1,641,000 after purchasing an additional 19 shares during the last quarter.  Magnolia Capital Management Ltd. lifted its stake in  Microsoft by 0.3% in the third quarter. Magnolia Capital Management Ltd. now owns 6,509 shares of the software giant's stock valued at $3,371,000 after purchasing an additional 20 shares during the last quarter.  ARK & TLK Investments LLC lifted its stake in  Microsoft by 1.0% in the third quarter. ARK & TLK Investments LLC now owns 1,935 shares of the software giant's stock valued at $1,002,000 after purchasing an additional 20 shares during the last quarter.  Rochester Wealth Strategies LLC lifted its stake in  Microsoft by 2.9% in the third quarter. Rochester Wealth Strategies LLC now owns 700 shares of the software giant's stock valued at $363,000 after purchasing an additional 20 shares during the last quarter.  Finally, Longfellow Investment Management Co. LLC lifted its stake in  Microsoft by 51.3% in the second quarter. Longfellow Investment Management Co. LLC now owns 59 shares of the software giant's stock valued at $29,000 after purchasing an additional 20 shares during the last quarter. 71.13% of the stock is owned by institutional investors. NASDAQ:MSFT opened at $422.79 on Friday. The company has a market cap of $3.14 trillion, a P/E ratio of 26.44, a P/E/G ratio of 1.59 and a beta of 1.11. The stock's fifty day moving average price is $391.87 and its two-hundred day moving average price is $454.48. Microsoft Corporation has a 1 year low of $355.67 and a 1 year high of $555.45. The company has a debt-to-equity ratio of 0.09, a current ratio of 1.39 and a quick ratio of 1.38. Microsoft (NASDAQ:MSFT - Get Free Report) last posted its earnings results on Wednesday, January 28th. The software giant reported $4.14 earnings per share (EPS) for the quarter, topping the consensus estimate of $3.86 by $0.28. The firm had revenue of $81.27 billion for the quarter, compared to the consensus estimate of $80.28 billion. Microsoft had a return on equity of 32.34% and a net margin of 39.04%.The business's quarterly revenue was up 16.7% on a year-over-year basis. During the same quarter in the prior year, the business posted $3.23 earnings per share.  As a group, analysts expect that  Microsoft Corporation will post 13.08 EPS for the current year. The business also recently announced a quarterly dividend, which will be paid on Thursday, June 11th. Shareholders of record on Thursday, May 21st will be given a dividend of $0.91 per share. The ex-dividend date is Thursday, May 21st. This represents a $3.64 annualized dividend and a dividend yield of 0.9%. Microsoft's dividend payout ratio  is currently 22.76%. In other Microsoft news, EVP Kathleen T. Hogan sold 12,321 shares of the stock in a transaction on Friday, March 6th. The stock was sold at an average price of $409.52, for a total transaction of $5,045,695.92. Following the sale, the executive vice president owned 137,933 shares in the company, valued at $56,486,322.16. This represents a 8.20% decrease in their ownership of the stock. The transaction was disclosed in a legal filing with the SEC, which is available at this link. Also, Director John W. Stanton bought 5,000 shares of the company's stock in a transaction on Wednesday, February 18th. The shares were bought at an average price of $397.35 per share, for a total transaction of $1,986,750.00. Following the transaction, the director owned 83,905 shares of the company's stock, valued at approximately $33,339,651.75. This represents a 6.34% increase in their ownership of the stock. The disclosure for this purchase is available in the SEC filing. Corporate insiders own  0.03% of the company's stock. MSFT has been the topic of several research analyst reports. Royal Bank Of Canada  reiterated an ""outperform"" rating on shares of Microsoft in a research note on Monday, March 2nd. Mizuho dropped their price objective on Microsoft from $620.00 to $515.00 and set an ""outperform"" rating on the stock in a research note on Tuesday. JPMorgan Chase & Co. dropped their price objective on Microsoft from $575.00 to $550.00 and set an ""overweight"" rating on the stock in a research note on Thursday, January 29th. Wells Fargo & Company dropped their price objective on Microsoft from $630.00 to $615.00 and set an ""overweight"" rating on the stock in a research note on Thursday, January 29th. Finally, Citigroup dropped their price objective on Microsoft from $660.00 to $635.00 and set a ""buy"" rating on the stock in a research note on Thursday, January 29th. Two research analysts have rated the stock with a Strong Buy rating, thirty-eight have given a Buy rating and five have assigned  a Hold rating to the company. According to MarketBeat.com, the stock presently has a consensus rating of ""Moderate Buy"" and a consensus price target of $577.58. Here are the key news stories impacting Microsoft this week: Microsoft Corporation is a global technology company headquartered in Redmond, Washington. Founded in 1975 by Bill Gates and Paul Allen, Microsoft develops, licenses and supports a broad range of software products, services and devices for consumers, enterprises and governments worldwide. Its operations span personal computing, productivity software, cloud infrastructure, enterprise applications, developer tools and gaming. Microsoft's product portfolio includes the Windows operating system and the Microsoft 365 suite of productivity and collaboration tools (Office apps, Outlook, Teams). Want to see what other hedge funds are holding MSFT? Visit HoldingsChannel.com to get the latest 13F filings and insider trades for Microsoft Corporation (NASDAQ:MSFT - Free Report). This instant news alert was generated by narrative science technology and financial data from MarketBeat in order to provide readers with the fastest reporting and unbiased coverage. Please send any questions or comments about this story to contact@marketbeat.com. Before you consider Microsoft, you'll want to hear this. MarketBeat keeps track of Wall Street's top-rated and best performing research analysts and the stocks they recommend to their clients on a daily basis. MarketBeat has identified the five stocks that top analysts are quietly whispering to their clients to buy now before the broader market catches on... and Microsoft wasn't on the list. While Microsoft currently has a Moderate Buy rating among analysts, top-rated analysts believe these five stocks are better buys. Thinking about investing in Meta, Roblox, or Unity? Click the link to learn what streetwise investors need to know about the metaverse and public markets before making an investment. Sign up for MarketBeat All Access to gain access to MarketBeat's full suite of research tools. 345 N Reid Place, Suite 620, Sioux Falls, SD 57103
                                        
                                        contact@marketbeat.com
                                        
                                        (844) 978-6257 © MarketBeat Media, LLC 2010-2026. All rights reserved. © 2026   Fair market value prices are updated every minute and are provided by Massive. Other market data provided is at least 10-minutes delayed and hosted by Barchart Solutions.  Information is provided 'as-is' and solely for informational purposes, not for trading purposes or advice, and is delayed. To see all exchange delays and terms of use please see Barchart's disclaimer. We and our partners share information on your use of this website to help improve your experience. For more information, or to opt out click the Do Not Sell My Information button below.",https://www.marketbeat.com/instant-alerts/filing-trust-co-of-toledo-na-oh-has-7231-million-stock-position-in-microsoft-corporation-msft-2026-04-18/
MSFT,$Microsoft (MSFT.US)$ AI is just too convenient. just sharing - Moomoo,2026-04-18 08:40:56,"To create a seamless experience and for website quality and improvement purposes, we use cookie technologies for verification and quality purposes, to personalize the content presented, and to provide advertising that may be of specific interest to you. Learn our Privacy Policy here.",https://www.moomoo.com/community/feed/microsoft-msft-us-ai-is-just-too-convenient-just-sharing-116424812527622
MSFT,$Microsoft (MSFT.US)$ THE STRAIGHT HAS CLOSED!!!!!!! - Moomoo,2026-04-18 08:35:40,"To create a seamless experience and for website quality and improvement purposes, we use cookie technologies for verification and quality purposes, to personalize the content presented, and to provide advertising that may be of specific interest to you. Learn our Privacy Policy here.",https://www.moomoo.com/community/feed/microsoft-msft-us-the-straight-has-closed-116424791818245?chain_id=Name1K9-3FXPhg.1ku6eg0&global_content=%7B%22promote_id%22%3A13764%2C%22sub_promote_id%22%3A109%2C%22f%22%3A%22www.moomoo.com%2Fsectors%2FAI-Chip-BK2548%22%7D
MSFT,How (MSFT) Movements Inform Risk Allocation Models - Stock Traders Daily,2026-04-18 08:04:01,"Our AI models have generated three distinct trading strategies tailored to different risk profiles and holding periods. Each strategy incorporates sophisticated risk management parameters designed to optimize position sizing and minimize drawdown risk. Blue = Current Price
Red = Resistance
Green = Support Instant access — no password needed Get institutional-grade analysis with API integration and custom risk models. You're about to add MSFT to your personalized dashboard for ongoing analysis and alerts. To access your My Stocks dashboard and receive personalized analysis, you'll need to create a free account. © 2025 Stock Traders Daily - Quantitative Research Division. All rights reserved. | 📚 Full News Archive | 🍁 Canada Edition",https://news.stocktradersdaily.com/news_release/149/How_MSFT_Movements_Inform_Risk_Allocation_Models_041826080401_1776513841.html
