ticker,title,date,content,url
MSFT,Microsoft Corporation (MSFT): Billionaire Steve Cohen Trims Position - insidermonkey.com,2026-04-03 21:12:40,"Our #1 AI Stock Pick — 33% OFF: $9.99 (was $14.99)  Monthly picks · Ad-free browsing · 30-day money back guarantee Our #1 AI Stock Pick — 33% OFF: $9.99 (was $14.99)  Monthly picks · Ad-free browsing Microsoft Corporation (NASDAQ:MSFT) is one of the 10 Best Stocks to Invest In According to Billionaire Steve Cohen. Steve Cohen has held a long-term bullish view on Microsoft Corporation (NASDAQ:MSFT). This is reflected in the 13F filings as well. The tech giant has featured in the 13F portfolio of the fund since the second quarter of 2015. Back then, this position comprised just 4,000 shares. In the next quarter, the holding jumped to 2.1 million shares. The share ownership then stayed under the 2 million mark till early 2024, barring one exception. In the third quarter of 2025, the fund owned 2.6 million shares in the company. However, filings for the fourth quarter of 2025 reveal that this holding has been trimmed by 20% and the fund now owns 2 million shares of Microsoft. READ NEXT: 10 Best Stocks to Buy According to Billionaire Paul Tudor Jones. Microsoft Corporation (NASDAQ:MSFT) is one of the favorite stocks among elite hedge funds. One catalyst for this interest is the Microsoft 365 Copilot transition into Agentic AI, where software does not just answer questions but performs complex, multi-step tasks, like automated procurement or project management. In late 2025/early 2026, Microsoft inked landmark deals with Cognizant, Infosys, and Wipro to deploy 50,000+ Copilot licenses. Hedge funds view these massive enterprise rollouts as the blueprint for global adoption. Another long-term driver for the shares is the move by the tech giant to control its own hardware costs. Microsoft is rolling out its custom Maia AI chips within Azure. Hedge funds believe this will significantly improve inference economics, reducing Microsoft’s reliance on expensive NVIDIA hardware and protecting cloud margins even as capital expenditure surges. While we acknowledge the risk and potential of MSFT as an investment, our conviction lies in the belief that some AI stocks hold greater promise for delivering higher returns and doing so within a shorter time frame. If you are looking for an AI stock that is more promising than MSFT and that has 10,000% upside potential, check out our report about this cheapest AI stock. READ NEXT: 12 Best Stocks to Buy According to Billionaire David Abrams and 15 Best Stocks to Buy According to Billionaire Seth Klarman. Disclosure: None. Follow Insider Monkey on Google News. Returns since its inception in May 2014 (through February 18th, 2026) Get our editor’s daily picks straight in your inbox!",https://www.insidermonkey.com/blog/microsoft-corporation-msft-billionaire-steve-cohen-trims-position-1731878/
MSFT,"If Microsoft Get This One Thing Right, the Stock Could Explode - The Motley Fool",2026-04-03 19:20:00,"Microsoft is planning to build its own frontier model. Microsoft (MSFT +1.01%) was an early winner in the AI boom. Its partnership with OpenAI put it in the pole position after ChatGPT launched in late 2022. However, more than three years later, Microsoft is looking like a laggard in AI. Copilot, its AI assistant, has received broad criticism for its high price tag, relatively poor performance, and low adoption rate, evidence that Microsoft squandered the advantage it had with its partnership with OpenAI. This year, Microsoft stock has tumbled on fears that its enterprise software empire could be disrupted by AI-native products, using new tools like Anthropic's Claude Code. Year-to-date, the stock is down 23%, and it's off by more than a third from its peak. With a market cap below $3 trillion, Microsoft's share price has not been this low since 2023, with the exception of a brief drop following the Liberation Day tariffs announcement a year ago. Our experts' top-rated cash back card just got even better. For a limited time, earn a $250 bonus after spending just $500 in the first 3 months. Plus, earn unlimited cash back and pay 0% intro APR until well into 2027. Microsoft's slide has come even as the business has continued to deliver strong results. In its most recent quarter, revenue rose 17% to $81.3 billion, and adjusted earnings per share were up 24%. Revenue from Azure, its cloud infrastructure service, jumped 39%. In other words, Microsoft's business remains strong, but investor perception of the company's prospects has dramatically declined. One little-known company, called an ""Indispensable Monopoly"" owns the technology Nvidia, AMD, and Intel cannot function without. And it is still just a fraction of Nvidia’s size. We just released a brand-new report with the full story and the company’s name. After mixed results in its partnership with OpenAI and the Copilot flop, Microsoft is now preparing to develop its own frontier models, bringing it into competition with leaders like OpenAI, Anthropic, and Alphabet (NASDAQ: GOOG) (NASDAQ: GOOGL), according to a Bloomberg interview with Microsoft's AI chief, Mustafa Suleyman. Microsoft plans to create state-of-the-art AI models by 2027,  to generate text, audio, and images. If Microsoft is able to find success with those models, it could solve virtually all of the stock's problems, including the weakness with Copilot and its vulnerability to AI disruption. A better AI assistant or chatbot would almost make products like Microsoft 365 stickier and allow the company to charge more for those products. As an example, Alphabet's surge last year came in large part due to the recognition for Gemini, its new AI model, which some consider to be better than ChatGPT. For Microsoft, just recovering to its previous peak would represent a gain of roughly 50%. Whether Microsoft will challenge companies like OpenAI and Anthropic depends on its execution, but the tech giant should have the expertise and the funds to get there. We'll learn more as Microsoft makes progress toward that goal, but shares of the Windows-maker could prove to be a bargain if it can execute on that goal. The Motley Fool Stock Advisor analyst team just identified what they believe are the 10 best stocks for investors to buy now… and Microsoft wasn’t one of them. The 10 stocks that made the cut could produce monster returns in the coming years. Consider when Netflix made this list on December 17, 2004... if you invested $1,000 at the time of our recommendation, you’d have $532,066!* Or when Nvidia made this list on April 15, 2005... if you invested $1,000 at the time of our recommendation, you’d have $1,087,496!* Now, it’s worth noting Stock Advisor’s total average return is 926% — a market-crushing outperformance compared to 185% for the S&P 500. Don't miss the latest top 10 list, available with Stock Advisor, and join an investing community built by individual investors for individual investors. Jeremy Bowman has no position in any of the stocks mentioned. The Motley Fool has positions in and recommends Alphabet and Microsoft. The Motley Fool has a disclosure policy. This tech could reach $80 trillion. Imagine a technology worth over 18 Nvidias. What in the world could be worth 18 Nvidias? The answer is a radical tech breakthrough that our experts think is transforming every walk of life. And this giant leap forward has many on Wall Street very excited. *Average returns of all recommendations since inception. Cost basis and return based on previous market day close. Our experts' top-rated cash back card just got even better. For a limited time, earn a $250 bonus after spending just $500 in the first 3 months. Plus, earn unlimited cash back and pay 0% intro APR until well into 2027. Invest better with The Motley Fool. Get stock recommendations, portfolio guidance, and more from The Motley Fool's premium services. © 1995 - 2026 The Motley Fool. All rights reserved. *Returns as of April 3, 2026. **$149 for 2 years is a promotional price for new members only. Renews at current list price of $199 after 2nd year.",https://www.fool.com/investing/2026/04/03/if-microsoft-get-this-one-thing-right-the-stock-co/
MSFT,How The AI Debate Is Rewriting The Story For Microsoft (MSFT) - Yahoo Finance,2026-04-03 18:12:01,"Tip: Try a valid symbol or a specific company name for relevant results Never miss an important update on your stock portfolio and cut through the noise. Over 7 million investors trust Simply Wall St to stay informed where it matters for FREE. Microsoft’s fair value estimate has been trimmed slightly, with the price target moving from US$594.62 to US$587.31, a modest reset in the modelled upside. That adjustment lines up with a broader analyst split, where many firms are cutting targets but still flagging long term potential, while a smaller group grows more cautious on AI execution risks, valuation, and competitive threats. As you read on, you will see how these shifting signals can help you track and interpret the evolving Microsoft story. Analyst Price Targets don't always capture the full story. Head over to our Company Report to find new ways to value Microsoft. Goldman Sachs, HSBC and Barclays highlight Microsoft as a key beneficiary of AI being built into enterprise software, with Goldman assuming coverage and citing AI adoption as a positive driver for the broader software sector that includes Microsoft. BofA, Piper Sandler and Phillip Securities have taken supportive stances on Microsoft, with BofA reinstating coverage, Piper Sandler naming the stock a top pick and other firms keeping positive ratings while adjusting targets. Several brokers, including Wells Fargo and Barclays, continue to reference AI as a central theme for 2026 in software and still include Microsoft in their preferred names even after resetting some assumptions. Target cuts have been broad based, with firms such as UBS, Scotiabank, Wells Fargo, BMO Capital, Barclays, JPMorgan, Goldman Sachs, Citi and others lowering Microsoft price targets, which points to more conservative expectations on valuation. Melius Research and Stifel have downgraded Microsoft, flagging AI related risks, execution questions and richer pricing as reasons to be more cautious compared with earlier, more optimistic views. Do your thoughts align with the Bull or Bear Analysts? Perhaps you think there's more to the story. Head to the Simply Wall St Community to discover more perspectives! We've flagged 1 risk for Microsoft. See which could impact your investment. Microsoft is reported to be exploring a large data center lease in Abilene, Texas, tying the company more closely to a high profile AI campus and long term infrastructure buildout in that region. Reports indicate Microsoft achieved what were described as ""audacious"" Copilot sales goals, keeping attention on how AI driven productivity tools are being monetised in its software business. Microsoft has temporarily suspended new hiring in parts of its Azure cloud and sales groups, signaling tighter resource allocation while cloud and AI spending remain key themes around the company. Japan's antitrust regulator raided Microsoft's local offices in a probe into whether Azure customers were discouraged from using rival cloud services, adding another regulatory angle around its cloud operations. Fair value trimmed from US$594.62 to US$587.31, reflecting a modest reduction in the modelled upside. Revenue growth assumption adjusted from 15.90% to 15.70% for future periods. Net profit margin revised from 38.27% to 38.45% in the updated model. Discount rate moved slightly from 8.60% to 8.57% for valuing projected cash flows. Narratives link a company's business story, including its AI, cloud and subscription shifts, to a financial forecast and fair value. They update automatically as new forecasts, risks and news are added. Head over to the Simply Wall St Community and follow the Narrative on Microsoft to stay up to date on: How AI is being built across Azure, Copilot, Dynamics 365, GitHub and Fabric, and what that could mean for usage and revenue streams. The role of Azure, cybersecurity and subscription products in shaping recurring, high margin revenue and earnings visibility. Key risks around heavy AI and data center CapEx, reliance on large cloud and AI customers, and the pressure that mix shifts and execution challenges could put on margins and cash flows. This article by Simply Wall St is general in nature. We provide commentary based on historical data and analyst forecasts only using an unbiased methodology and our articles are not intended to be financial advice. It does not constitute a recommendation to buy or sell any stock, and does not take account of your objectives, or your financial situation. We aim to bring you long-term focused analysis driven by fundamental data. Note that our analysis may not factor in the latest price-sensitive company announcements or qualitative material. Simply Wall St has no position in any stocks mentioned. Have feedback on this article? Concerned about the content? Get in touch with us directly. Alternatively, email editorial-team@simplywallst.com Tip: Try a valid symbol or a specific company name for relevant results",https://finance.yahoo.com/markets/stocks/articles/ai-debate-rewriting-story-microsoft-181201853.html
MSFT,Microsoft (MSFT) Stock: Edges Higher as $10B Japan Plan Targets AI and Cybersecurity - MEXC,2026-04-03 17:40:16,"Microsoft gains 1.11% after announcing $10B Japan AI expansion plan New AI data centers aim to meet Japan’s growing cloud demand Partnerships with SoftBank and Sakura boost local AI infrastructure Cybersecurity ties deepen with Japan’s national agencies Microsoft targets training one million AI workers by 2030 Microsoft Corporation (MSFT) closed at $373.46, rising 1.11% after recovering from early losses and sustaining steady gains. The move followed a major investment announcement focused on Japan’s AI and cloud infrastructure. The update reinforced Microsoft’s long-term expansion strategy across global digital markets. Microsoft outlined a $10 billion investment plan in Japan spanning from 2026 through 2029. The initiative focuses on expanding AI data centers and strengthening domestic cloud infrastructure. As a result, the company aims to meet rising demand for localized computing and secure data operations. The plan includes collaboration with SoftBank Corp. and Sakura Internet Inc. to build GPU-based infrastructure. These systems will operate within Japan while integrating with Microsoft Azure services. The approach supports strict data residency and governance requirements. Microsoft also expanded Azure Local capabilities to support disconnected and edge environments. This allows organizations to manage workloads with limited or no cloud connectivity. The move strengthens resilience for mission-critical operations across industries. Microsoft deepened its collaboration with Japan’s national cybersecurity institutions to enhance threat detection capabilities. The company will share intelligence with public agencies to improve response coordination. The partnership supports Japan’s broader economic security priorities. The company also expanded cooperation with Japan’s National Police Agency through its Digital Crime Unit. This effort focuses on identifying and disrupting cybercrime infrastructure across international networks. The collaboration enhances operational coordination against evolving digital threats. Microsoft introduced research grants and fellowship programs to support AI-driven scientific work. These initiatives aim to improve access to computing resources for large-scale simulations. The programs help convert national research investments into measurable outcomes. Microsoft committed to training one million engineers and developers in Japan by 2030. The initiative will run in partnership with major firms including Fujitsu, Hitachi, NEC, and NTT Data. These companies represent a large share of Japan’s enterprise technology workforce. The program covers training across Azure, GitHub, and Microsoft 365 Copilot platforms. It combines online modules with hands-on learning to build practical AI skills. As a result, the effort supports workforce readiness as automation expands across sectors. Microsoft also extended AI education programs to unionized workers and regional institutions. These initiatives target industries facing rapid technological change and skills gaps. The strategy aligns talent development with Japan’s long-term industrial competitiveness. Microsoft’s latest move builds on a $2.9 billion investment announced in 2024. The expanded commitment reflects rising AI adoption across Japan’s economy. The company continues to position itself at the center of global AI infrastructure growth. The post Microsoft (MSFT) Stock: Edges Higher as $10B Japan Plan Targets AI and Cybersecurity appeared first on CoinCentral. Ripple classified by Russian intelligence as IMF-dependent; IMF acknowledges tokenization's financial impact, signaling institutional shifts. Author: Ripple Bull Winkle | Crypto Researcher 🚀🚨01:02 Daily optimism shared, highlighting $BTC and other tokens, reflecting market anticipation. Japan and South Korea adopt XRP Ledger for cross-border remittance, highlighting global development outside US regulatory focus. Author: Ripple Bull Winkle | Crypto Researcher 🚀🚨2026/04/03 23:02 Trump's crypto advisor hints at new U.S. payment system; XRP mentioned as central component. Ripple's assets grew significantly, driven by institutional infrastructure, indicating strong market interest and development potential. Author: Ripple Bull Winkle | Crypto Researcher 🚀🚨2026/04/03 22:02",https://www.mexc.com/news/1003215
MSFT,Microsoft shifts to paid Copilot push after 3% adoption disappoints investors - TradingView,2026-04-03 17:06:37,"Microsoft MSFT is recalibrating its AI monetization strategy after investor feedback raised concerns about weak early conversion, shifting its focus toward selling Copilot as a paid product rather than emphasizing free adoption within its software ecosystem. According to remarks shared internally by Judson Althoff, who leads Microsoft's commercial business, the company set what he described as pretty big audacious goals for Copilot sales in the March quarter and appears to have largely achieved them, suggesting some early progress as the company leans into a more revenue-driven approach for its flagship workplace AI tool. That pivot follows a softer-than-expected starting point, as Microsoft disclosed in January that only about 3% of its office software customers were paying for Copilot, a figure that did not meet investor expectations for early monetization. With a base of roughly 450 million office users, the company is now concentrating on converting enterprise customers into paying subscribers rather than prioritizing broad free usage, a shift that reflects both analyst feedback and rising competitive pressure across the AI landscape. Althoff described the environment as a dog fight at the customer level, with Microsoft positioning itself around secure deployment and access to multiple leading AI models as it competes with OpenAI and other players. Pricing remains a key lever in this transition. Copilot is offered at about $30 per user per month, while a newly introduced bundled offering that integrates AI into workplace software is priced around $99 per user per month, potentially creating a clearer monetization pathway. Management indicated that paid subscription targets for the current quarter could come in materially above prior levels, which may be closely watched as a signal of improving traction. Shares rose modestly following the report, even as the stock remains down significantly year-to-date, suggesting that investors are looking for clearer evidence that Microsoft's AI investments can translate into sustained revenue growth. Select market data provided by ICE Data Services. Select reference data provided by FactSet. Copyright © 2026 FactSet Research Systems Inc.Copyright © 2026, American Bankers Association. CUSIP Database provided by FactSet Research Systems Inc. All rights reserved. SEC fillings and other documents provided by Quartr.© 2026 TradingView, Inc.",https://www.tradingview.com/news/gurufocus:451a972c8094b:0-microsoft-shifts-to-paid-copilot-push-after-3-adoption-disappoints-investors/
