ticker,title,date,content,url
MSFT,Microsoft Corporation $MSFT Stock Holdings Lifted by Tounjian Advisory Partners LLC - MarketBeat,2026-03-27 09:27:34,"Tounjian Advisory Partners LLC boosted its holdings in shares of  Microsoft Corporation (NASDAQ:MSFT - Free Report) by 11.4% during the 4th quarter, according to its most recent filing with the Securities and Exchange Commission (SEC). The institutional investor  owned 29,700 shares of the software giant's stock after buying an additional 3,036 shares during the period. Microsoft makes up   4.9% of Tounjian Advisory Partners LLC's holdings, making the stock its 3rd largest position. Tounjian Advisory Partners LLC's holdings in Microsoft were worth $14,364,000 as of its most recent SEC filing. Other hedge funds and other institutional investors also recently added to or reduced their stakes in the company. Vanguard Group Inc. raised its position in shares of  Microsoft by 2.0% in the 2nd quarter. Vanguard Group Inc. now owns 705,077,786 shares of the software giant's stock valued at $350,712,742,000 after purchasing an additional 13,691,572 shares during the last quarter.  State Street Corp grew its position in  Microsoft by 1.1% during the 2nd quarter. State Street Corp now owns 299,196,519 shares of the software giant's stock worth $148,823,341,000 after purchasing an additional 3,166,275 shares during the last quarter.  Geode Capital Management LLC grew its position in  Microsoft by 2.0% during the 2nd quarter. Geode Capital Management LLC now owns 179,001,751 shares of the software giant's stock worth $88,714,256,000 after purchasing an additional 3,532,054 shares during the last quarter.  Norges Bank acquired a new position in  Microsoft during the 2nd quarter valued at approximately $50,493,678,000.  Finally, Northern Trust Corp raised its holdings in shares of  Microsoft by 16.1% in the fourth quarter. Northern Trust Corp now owns 83,787,746 shares of the software giant's stock worth $35,316,535,000 after buying an additional 11,600,470 shares during the last quarter. 71.13% of the stock is currently owned by hedge funds and other institutional investors. Here are the key news stories impacting Microsoft this week: Several equities research analysts have recently commented on the stock. Daiwa Securities Group lowered their price objective on shares of Microsoft from $630.00 to $600.00 and set a ""buy"" rating for the company in a research note on Wednesday, February 4th. Royal Bank Of Canada  reissued an ""outperform"" rating on shares of Microsoft in a research report on Monday, March 2nd. Robert W. Baird  set a $540.00 target price on Microsoft and gave the stock an ""outperform"" rating in a research note on Thursday, January 29th. HSBC lowered their price target on Microsoft from $667.00 to $588.00 and set a ""buy"" rating for the company in a research report on Thursday, January 29th. Finally, Bank of America initiated coverage on Microsoft in a report on Tuesday. They issued a ""buy"" rating and a $500.00 price objective on the stock. Two research analysts have rated the stock with a Strong Buy rating, thirty-eight have assigned  a Buy rating and five have assigned  a Hold rating to the company. Based on data from MarketBeat, the company  has a consensus rating of ""Moderate Buy"" and a consensus price target of $588.97. In other news, Director John W. Stanton acquired 5,000 shares of the company's stock in a transaction dated Wednesday, February 18th. The shares were acquired at an average price of $397.35 per share, with a total value of $1,986,750.00. Following the purchase, the director directly owned 83,905 shares of the company's stock, valued at $33,339,651.75. This trade represents a 6.34% increase in their ownership of the stock. The purchase was disclosed in a filing with the SEC, which is accessible through this hyperlink. Also, EVP Kathleen T. Hogan sold 12,321 shares of Microsoft stock in a transaction that occurred on Friday, March 6th. The shares were sold at an average price of $409.52, for a total transaction of $5,045,695.92. Following the transaction, the executive vice president directly owned 137,933 shares of the company's stock, valued at approximately $56,486,322.16. This trade represents a 8.20% decrease in their ownership of the stock. Additional details regarding this sale are available in the official SEC disclosure. Corporate insiders own  0.03% of the company's stock. NASDAQ MSFT opened at $365.97 on Friday. Microsoft Corporation has a 1 year low of $344.79 and a 1 year high of $555.45. The company has a debt-to-equity ratio of 0.09, a current ratio of 1.39 and a quick ratio of 1.38. The company has a market capitalization of $2.72 trillion, a PE ratio of 22.89, a P/E/G ratio of 1.41 and a beta of 1.10. The company has a fifty day moving average of $411.42 and a 200 day moving average of $468.63. Microsoft (NASDAQ:MSFT - Get Free Report) last issued its earnings results on Wednesday, January 28th. The software giant reported $4.14 EPS for the quarter, topping analysts' consensus estimates of $3.86 by $0.28. The firm had revenue of $81.27 billion for the quarter, compared to the consensus estimate of $80.28 billion. Microsoft had a return on equity of 32.34% and a net margin of 39.04%.The company's revenue was up 16.7% compared to the same quarter last year. During the same quarter in the prior year, the business earned $3.23 earnings per share.  Research analysts forecast that  Microsoft Corporation will post 13.08 earnings per share for the current year. The business also recently disclosed a quarterly dividend, which will be paid on Thursday, June 11th. Shareholders of record on Thursday, May 21st will be given a $0.91 dividend. This represents a $3.64 annualized dividend and a yield of 1.0%. The ex-dividend date is Thursday, May 21st. Microsoft's dividend payout ratio  is currently 22.76%. Microsoft Corporation is a global technology company headquartered in Redmond, Washington. Founded in 1975 by Bill Gates and Paul Allen, Microsoft develops, licenses and supports a broad range of software products, services and devices for consumers, enterprises and governments worldwide. Its operations span personal computing, productivity software, cloud infrastructure, enterprise applications, developer tools and gaming. Microsoft's product portfolio includes the Windows operating system and the Microsoft 365 suite of productivity and collaboration tools (Office apps, Outlook, Teams). This instant news alert was generated by narrative science technology and financial data from MarketBeat in order to provide readers with the fastest reporting and unbiased coverage. Please send any questions or comments about this story to contact@marketbeat.com. Before you consider Microsoft, you'll want to hear this. MarketBeat keeps track of Wall Street's top-rated and best performing research analysts and the stocks they recommend to their clients on a daily basis. MarketBeat has identified the five stocks that top analysts are quietly whispering to their clients to buy now before the broader market catches on... and Microsoft wasn't on the list. While Microsoft currently has a Moderate Buy rating among analysts, top-rated analysts believe these five stocks are better buys. Looking for the next FAANG stock before everyone has heard about it? Click the link to see which stocks MarketBeat analysts think might become the next trillion dollar tech company. Sign up for MarketBeat All Access to gain access to MarketBeat's full suite of research tools. 345 N Reid Place, Suite 620, Sioux Falls, SD 57103
                                        
                                        contact@marketbeat.com
                                        
                                        (844) 978-6257 © MarketBeat Media, LLC 2010-2026. All rights reserved. © 2026   Fair market value prices are updated every minute and are provided by Massive. Other market data provided is at least 10-minutes delayed and hosted by Barchart Solutions.  Information is provided 'as-is' and solely for informational purposes, not for trading purposes or advice, and is delayed. To see all exchange delays and terms of use please see Barchart's disclaimer. Enter your email address below to receive InsiderTrades.com’s daily insider buying and selling report for Microsoft and related companies. We and our partners share information on your use of this website to help improve your experience. For more information, or to opt out click the Do Not Sell My Information button below.",https://www.marketbeat.com/instant-alerts/filing-microsoft-corporation-msft-stock-holdings-lifted-by-tounjian-advisory-partners-llc-2026-03-27/
MSFT,2 Cash-Heavy Stocks with Solid Fundamentals and 1 Facing Headwinds - StockStory,2026-03-27 09:26:13,"Companies with more cash than debt can be financially resilient, but that doesn’t mean they’re all strong investments. Some lack leverage because they struggle to grow or generate consistent profits, making them unattractive borrowers. Not all businesses with cash are winners, and that’s why we built StockStory - to help you separate the good from the bad. That said, here are two companies with net cash positions that can leverage their balance sheets to grow and one that may struggle. Net Cash Position: $162.8 million (4.2% of Market Cap) Known for its frozen garlic bread and Parkerhouse rolls, The Marzetti Company (NASDAQ:MZTI) sells bread, dressing, and dips to the retail and food service channels. The Marzetti Company is trading at $140.38 per share, or 19.5x forward P/E. Dive into our free research report to see why there are better opportunities than MZTI. Net Cash Position: $31.86 billion (1.2% of Market Cap) Originally named ""Micro-soft"" for microcomputer software when founded in 1975, Microsoft (NASDAQ:MSFT) is a global technology company that develops software, cloud services, devices, and AI solutions for consumers, businesses, and organizations worldwide. Microsoft’s stock price of $366.82 implies a valuation ratio of 21.1x forward price-to-earnings. Is now the time to initiate a position? See for yourself in our in-depth research report, it’s free. Net Cash Position: $5.90 billion (3.5% of Market Cap) Pioneering minimally invasive surgery since its first da Vinci system was FDA-cleared in 2000, Intuitive Surgical (NASDAQ:ISRG) develops and manufactures robotic-assisted surgical systems that enable minimally invasive procedures across various medical specialties. At $471.01 per share, Intuitive Surgical trades at 46.9x forward P/E. Is now a good time to buy? Find out in our full research report, it’s free. WHILE YOU’RE HERE: Top 9 Market-Beating Stocks. The best stocks don't just beat the market once. They do it again. And again. Robust revenue growth, rising free cash flow, returns on capital that leave their competition in the dust. The market has already rewarded these businesses. But our AI platform says the party isn't over. Find out which 9 stocks made the cut this week — FREE.  Get Our Top 9 Market-Beating Stocks for Free HERE. Stocks that made our list in 2020 include now familiar names such as Nvidia (+1,326% between June 2020 and June 2025) as well as under-the-radar businesses like the once-small-cap company Comfort Systems (+782% five-year return). Find your next big winner with StockStory today. Data sources: actuals and consensus estimates from StockStory, S&P Global Market Intelligence, and Visible Alpha. Market data from Massive. Provided for general information purposes only and does not constitute investment advice or a recommendation that any particular security, portfolio of securities, transaction or investment strategy is suitable for any specific individual. Information on our investment framework and performance methodology is available here. Copyright 2026, S&P Global Market Intelligence (and its affiliates as applicable). All rights reserved.",https://stockstory.org/us/stocks/nasdaq/msft/news/buy-or-sell/2-cash-heavy-stocks-with-solid-fundamentals-and-1-facing-headwinds
MSFT,Microsoft Corporation $MSFT Shares Acquired by Northside Capital Management LLC - MarketBeat,2026-03-27 09:23:23,"Northside Capital Management LLC lifted its stake in  Microsoft Corporation (NASDAQ:MSFT - Free Report) by 16.9% during the fourth quarter, according to its most recent disclosure with the Securities & Exchange Commission. The fund owned 76,897 shares of the software giant's stock after buying an additional 11,110 shares during the quarter. Microsoft makes up   3.2% of Northside Capital Management LLC's holdings, making the stock its 6th largest position. Northside Capital Management LLC's holdings in Microsoft were worth $37,189,000 as of its most recent filing with the Securities & Exchange Commission. Other hedge funds and other institutional investors have also recently bought and sold shares of the company. Procyon Advisors LLC increased its holdings in  Microsoft by 11.2% in the fourth quarter. Procyon Advisors LLC now owns 77,603 shares of the software giant's stock valued at $37,530,000 after buying an additional 7,840 shares in the last quarter.  Cyndeo Wealth Partners LLC boosted its stake in shares of  Microsoft by 3.2% during the 4th quarter. Cyndeo Wealth Partners LLC now owns 170,553 shares of the software giant's stock worth $82,483,000 after acquiring an additional 5,355 shares in the last quarter.  Panoramic Capital Partners LLC grew its position in shares of  Microsoft by 0.4% during the 4th quarter. Panoramic Capital Partners LLC now owns 17,425 shares of the software giant's stock valued at $8,427,000 after acquiring an additional 70 shares during the period.  New England Research & Management Inc. grew its position in shares of  Microsoft by 18.4% during the 4th quarter. New England Research & Management Inc. now owns 14,955 shares of the software giant's stock valued at $7,233,000 after acquiring an additional 2,325 shares during the period.  Finally, Magnus Financial Group LLC increased its stake in shares of  Microsoft by 4.9% in the 4th quarter. Magnus Financial Group LLC now owns 33,223 shares of the software giant's stock valued at $16,067,000 after purchasing an additional 1,561 shares in the last quarter. 71.13% of the stock is owned by institutional investors and hedge funds. A number of equities analysts recently weighed in on the company. TD Cowen  reaffirmed a ""buy"" rating on shares of Microsoft in a report on Thursday, January 29th. Melius Research  set a $430.00 price objective on Microsoft in a research report on Monday, February 9th. Rothschild & Co Redburn  set a $450.00 target price on Microsoft in a research note on Wednesday, January 21st. UBS Group decreased their target price on Microsoft from $600.00 to $510.00 and set a ""buy"" rating on the stock in a research report on Wednesday. Finally, Wolfe Research dropped their price target on shares of Microsoft from $625.00 to $530.00 and set an ""outperform"" rating on the stock in a research note on Thursday, January 29th. Two investment analysts have rated the stock with a Strong Buy rating, thirty-eight have issued  a Buy rating and five have given a Hold rating to the stock. According to data from MarketBeat, the company currently has a consensus rating of ""Moderate Buy"" and an average price target of $588.97. Here are the key news stories impacting Microsoft this week: In other news, EVP Kathleen T. Hogan sold 12,321 shares of the company's stock in a transaction on Friday, March 6th. The shares were sold at an average price of $409.52, for a total transaction of $5,045,695.92. Following the completion of the sale, the executive vice president owned 137,933 shares of the company's stock, valued at $56,486,322.16. This represents a 8.20% decrease in their ownership of the stock. The transaction was disclosed in a filing with the Securities & Exchange Commission, which is available through this hyperlink. Also, Director John W. Stanton bought 5,000 shares of Microsoft stock in a transaction dated Wednesday, February 18th. The stock was acquired at an average price of $397.35 per share, with a total value of $1,986,750.00. Following the completion of the transaction, the director directly owned 83,905 shares of the company's stock, valued at approximately $33,339,651.75. The trade was a 6.34% increase in their ownership of the stock. The disclosure for this purchase is available in the SEC filing. 0.03% of the stock is owned by corporate insiders. Shares of Microsoft stock opened at $365.97 on Friday. The business has a 50 day simple moving average of $411.42 and a two-hundred day simple moving average of $468.63. Microsoft Corporation has a 12 month low of $344.79 and a 12 month high of $555.45. The stock has a market capitalization of $2.72 trillion, a P/E ratio of 22.89, a PEG ratio of 1.41 and a beta of 1.10. The company has a debt-to-equity ratio of 0.09, a current ratio of 1.39 and a quick ratio of 1.38. Microsoft (NASDAQ:MSFT - Get Free Report) last released its earnings results on Wednesday, January 28th. The software giant reported $4.14 earnings per share for the quarter, beating the consensus estimate of $3.86 by $0.28. Microsoft had a return on equity of 32.34% and a net margin of 39.04%.The business had revenue of $81.27 billion for the quarter, compared to the consensus estimate of $80.28 billion. During the same quarter last year, the business posted $3.23 earnings per share. The business's quarterly revenue was up 16.7% compared to the same quarter last year.  As a group, analysts predict that  Microsoft Corporation will post 13.08 EPS for the current fiscal year. The firm also recently announced a quarterly dividend, which will be paid on Thursday, June 11th. Shareholders of record on Thursday, May 21st will be paid a dividend of $0.91 per share. This represents a $3.64 annualized dividend and a yield of 1.0%. The ex-dividend date of this dividend is Thursday, May 21st. Microsoft's payout ratio is 22.76%. Microsoft Corporation is a global technology company headquartered in Redmond, Washington. Founded in 1975 by Bill Gates and Paul Allen, Microsoft develops, licenses and supports a broad range of software products, services and devices for consumers, enterprises and governments worldwide. Its operations span personal computing, productivity software, cloud infrastructure, enterprise applications, developer tools and gaming. Microsoft's product portfolio includes the Windows operating system and the Microsoft 365 suite of productivity and collaboration tools (Office apps, Outlook, Teams). Want to see what other hedge funds are holding MSFT? Visit HoldingsChannel.com to get the latest 13F filings and insider trades for Microsoft Corporation (NASDAQ:MSFT - Free Report). This instant news alert was generated by narrative science technology and financial data from MarketBeat in order to provide readers with the fastest reporting and unbiased coverage. Please send any questions or comments about this story to contact@marketbeat.com. Before you consider Microsoft, you'll want to hear this. MarketBeat keeps track of Wall Street's top-rated and best performing research analysts and the stocks they recommend to their clients on a daily basis. MarketBeat has identified the five stocks that top analysts are quietly whispering to their clients to buy now before the broader market catches on... and Microsoft wasn't on the list. While Microsoft currently has a Moderate Buy rating among analysts, top-rated analysts believe these five stocks are better buys. Unlock the timeless value of gold with our exclusive 2026 Gold Forecasting Report. Explore why gold remains the ultimate investment for safeguarding wealth against inflation, economic shifts, and global uncertainties. Whether you're planning for future generations or seeking a reliable asset in turbulent times, this report is your essential guide to making informed decisions. Sign up for MarketBeat All Access to gain access to MarketBeat's full suite of research tools. 345 N Reid Place, Suite 620, Sioux Falls, SD 57103
                                        
                                        contact@marketbeat.com
                                        
                                        (844) 978-6257 © MarketBeat Media, LLC 2010-2026. All rights reserved. © 2026   Fair market value prices are updated every minute and are provided by Massive. Other market data provided is at least 10-minutes delayed and hosted by Barchart Solutions.  Information is provided 'as-is' and solely for informational purposes, not for trading purposes or advice, and is delayed. To see all exchange delays and terms of use please see Barchart's disclaimer. We and our partners share information on your use of this website to help improve your experience. For more information, or to opt out click the Do Not Sell My Information button below.",https://www.marketbeat.com/instant-alerts/filing-microsoft-corporation-msft-shares-acquired-by-northside-capital-management-llc-2026-03-27/
