id,ticker,date,title,content,url
1,MSFT,2026-03-29 23:53:11,지금 마이크로소프트 주식을 매수하기 좋은 시기인가? - The Globe and Mail,"마이크로소프트의 매출은 17% 증가했고, 조정 주당순이익은 회계연도 2분기에 24% 급증했다. 알파벳의 Google Cloud 매출은 최근 분기에 48% 증가해, 마이크로소프트의 클라우드 컴퓨팅 매출 성장률을 크게 웃돌았다. AI가 전통적인 소프트웨어 비즈니스에 새로운 위험을 도입하면서, 마이크로소프트 주식은 과거에 누렸던 프리미엄 밸류에이션을 받을 자격이 없을 수도 있다. 마이크로소프트(NASDAQ: MSFT) 주주로 지내는 것은 썩 즐거운 시간이 아니었다. 소프트웨어 및 클라우드 컴퓨팅 거대 기업의 주가는 광범위한 시장 매도세 속에서 지난주 거의 7% 급락하며 큰 타격을 입었다. 작성 시점 기준 연초 대비 이 기술주는 26% 넘게 하락했다. 회사의 최근 재무 결과를 보고 있는 투자자라면, 이 급락이 절호의 매수 기회처럼 보일 수 있다. 결국 마이크로소프트는 뛰어난 클라우드 사업에 힘입어 매출과 이익 모두에서 또 한 번 예외적인 분기를 발표했기 때문이다. AI가 세계 최초의 조(兆)달러 부자를 탄생시킬까? 우리 팀은 Nvidia와 Intel이 모두 필요로 하는 핵심 기술을 제공하는, '필수불가결한 독점기업'이라 불리는 잘 알려지지 않은 한 회사에 대한 보고서를 방금 공개했다. 계속 » 그러나 앞으로의 위험도 커지고 있다. 현재 마이크로소프트의 사업은 좋은 성과를 내고 있지만, 경쟁 구도를 더 자세히 살펴보면 경쟁사 알파벳(NASDAQ: GOOG)(NASDAQ: GOOGL)이 클라우드에서 상당한 격차를 좁히고 있음을 알 수 있다. 더 나아가 인공지능(AI)의 급속한 발전은 마이크로소프트가 크게 의존하는 소프트웨어 서비스형(SaaS) 모델에 새로운 장기적 위험을 가져오고 있다. 그렇다면 지금 이 주식을 매수하기 좋은 시기일까? 아니면 오히려 피하는 것이 맞을까? 마이크로소프트의 회계연도 2분기 실적만 놓고 본다면, 주가 하락은 전혀 정당화되지 않는 것처럼 보일 것이다. 12월 31일에 끝난 해당 기간 동안 마이크로소프트의 매출은 전년 동기 대비 17% 증가한 813억 달러를 기록했다. 수익성은 더 인상적이었다. 회사의 비GAAP(조정) 주당순이익은 24% 증가한 4.14달러였다. 주요 성장 엔진은 늘 그렇듯 클라우드 사업이었다. Microsoft Cloud 매출은 전년 동기 대비 26% 증가한 515억 달러였다. 그중 회사의 클라우드 컴퓨팅 사업을 나타내는 'Azure 및 기타 클라우드 서비스' 매출은 인상적인 39% 증가했다. 강세 논리를 더 뒷받침하는 것은 마이크로소프트의 상업 부문 잔여 이행 의무(RPO) — 아직 인식되지 않았지만 계약된 매출을 보여주는 지표 — 가 전년 동기 대비 110% 급증해 6,250억 달러에 달했다는 점이다. 그러나 더 넓은 클라우드 컴퓨팅 시장을 보면 이야기는 달라진다. 마이크로소프트는 AI 워크로드를 확보하기 위해 대규모 투자를 하고 있으며, 회계연도 2분기 설비투자(CapEx)는 전년 동기 대비 66% 급증한 375억 달러에 달했다. 하지만 이 막대한 지출에도 불구하고 경쟁은 더욱 치열해지고 있다. 알파벳의 최근 실적을 보자. 회사의 가장 최근 분기에서 알파벳의 Google Cloud 매출 성장률은 무려 전년 동기 대비 48%로 가속화되며 177억 달러에 도달했다. 이는 Azure의 39% 성장률을 크게 앞서는 수치다. 더욱이 Google Cloud의 성장률은 직전 분기의 34%에서 상승한 반면, 마이크로소프트의 'Azure 및 기타 클라우드 서비스' 매출은 실제로 둔화됐다. 이 클라우드 컴퓨팅 매출 성장률은 직전 분기에는 40%였다. AI 인프라 투자라는 매우 중요한 시기에 Google Cloud가 마이크로소프트의 클라우드 사업보다 훨씬 빠르게 성장하고 있다는 사실은, 이 새롭고 중요한 전장에서는 경쟁이 심화되고 있음을 보여준다. 마이크로소프트의 클라우드 사업 규모는 알파벳보다 더 크지만, 자금력이 풍부한 경쟁사에 비해 상대적 모멘텀을 일부 잃고 있는 것으로 보인다. 클라우드 인프라 경쟁을 넘어, 또 다른 구조적 위험이 마이크로소프트를 덮고 있다. 바로 AI가 전통 소프트웨어를 교란할 가능성이다. Office 제품군을 보유한 마이크로소프트의 생산성 및 비즈니스 프로세스 부문은 회사 전체 재무 건전성에 매우 중요하다. 회계연도 2분기에 이 부문은 341억 달러의 매출을 창출했다. 또한 마이크로소프트는 Microsoft 365 상업용 시트 수가 4억 5,000만 개 이상에 달한다고 자랑하며, 소프트웨어 구독에 매우 크게 의존하고 있다. 그러나 AI가 더 유능해질수록 소프트웨어의 성격은 변화하고 있다. 복잡한 워크플로를 자율적으로 계획하고 실행할 수 있는 소프트웨어인 에이전틱 AI 시스템의 부상은 결국 특정 업무에 필요한 인력 수를 줄일 수 있다. 기업들이 기본적인 지식 노동을 수행하는 데 필요한 인간 근로자를 결국 덜 필요로 하게 된다면, 본질적으로 Microsoft 365의 상업용 시트 수도 줄어들 것이다. 마이크로소프트의 Copilot 같은 AI 도구가 단기적인 수익화 기회를 제공하긴 하지만, 장기적으로는 AI가 시트당 소프트웨어 구독 모델에 디플레이션 압력을 가할 위험이 있다. 더욱 우려되는 점은 AI가 전반적으로 경쟁을 더 격화시켜 소프트웨어의 가격 결정력을 약화시키고, 결국 마진과 — 궁극적으로는 — 소프트웨어 이익을 줄일 수 있다는 것이다. 작성 시점 기준 마이크로소프트 주가가 주당 약 357달러에 거래되고 있는 가운데, 주가수익비율(PER)은 약 22배 수준이다. 회사의 역사적 밸류에이션 배수와 비교하면 좋은 진입점처럼 보일 수 있다. 그러나 나는 이 주식이 현재의 밸류에이션 수준, 혹은 그보다 더 낮은 수준에서 거래되는 것이 타당하다고 본다. 회사는 치솟는 설비투자, 클라우드에서 알파벳과의 경쟁 심화, 그리고 핵심 소프트웨어 구독 사업에 AI가 가져오는 미지의 장기적 위험이라는 가혹한 조합에 직면해 있다. 더구나 AI가 만들어낸 이러한 미지의 위험은 앞으로 수년간 지속될 가능성이 크다. 전반적으로 나는 투자자들이 관망하면서, 주식을 매수하기 전에 더 깊은 할인 폭을 기다리는 것이 좋다고 생각한다. 알파벳의 Google Cloud 사업이 얼마나 빠르게 시장 점유율을 늘리고 있는지, 그리고 AI가 가져오는 불확실성을 고려하면, 공정가치에 더 가까워 보이는 가격을 지불하기보다 의미 있는 할인 가격을 기다리는 편이 더 합리적이다. 더 넓은 안전마진은 주식의 높아진 위험을 가격에 반영하는 데 도움이 될 수 있다. Motley Fool Stock Advisor 분석팀은 최근 지금 투자자들이 매수해야 할 최고의 10개 종목을 선정했는데… 마이크로소프트는 포함되지 않았다. 선정된 10개 종목은 향후 수년간 폭발적인 수익을 낼 수 있다. 2004년 12월 17일 넷플릭스가 이 목록에 올랐을 때를 생각해 보자... 당시 추천 시점에 1,000달러를 투자했다면 현재 503,861달러가 되었을 것이다!* 또는 2005년 4월 15일 엔비디아가 이 목록에 올랐을 때를 생각해 보자... 당시 추천 시점에 1,000달러를 투자했다면 현재 1,026,987달러가 되었을 것이다!* 이제 Stock Advisor의 총 평균 수익률이 884%라는 점을 기억할 만하다 — S&P 500의 179%와 비교하면 시장을 압도하는 초과수익이다. Stock Advisor에서 제공하는 최신 상위 10개 목록을 놓치지 말고, 개인 투자자들이 개인 투자자들을 위해 만든 투자 커뮤니티에 참여해 보라. Daniel Sparks와 그의 고객들은 언급된 어떤 주식에도 포지션을 보유하지 않는다. Motley Fool은 알파벳과 마이크로소프트에 포지션을 보유하고 있으며 매수를 권고한다. Motley Fool은 공시 정책을 보유하고 있다. 모든 시장 데이터(새 탭에서 열림)는 Barchart Solutions에서 제공된다. Copyright © 2026. 정보는 '있는 그대로' 제공되며 거래 목적이나 조언이 아니라 오직 정보 제공용이다. 거래 지연 및 이용 약관에 대해서는 면책 조항(새 탭에서 열림)을 읽어 달라.",https://www.theglobeandmail.com/investing/markets/stocks/MSFT-Q/pressreleases/1032169/is-now-a-good-time-to-buy-microsoft-stock/
2,MSFT,2026-03-29 20:24:53,"UBS, Microsoft(MSFT) 목표주가 하향 조정, 매수 의견 유지 - Insider Monkey","Microsoft Corporation(NASDAQ:MSFT)는 현재 매수하기 좋은 종목 중 하나다. 3월 25일 UBS는 Microsoft Corporation(NASDAQ:MSFT)의 목표주가를 600달러에서 510달러로 낮추면서도 주식에 대해서는 매수(Buy) 의견을 유지했다. 이 회사는 리서치 노트에서 목표주가 하향은 애널리스트 Karl Kierstead가 아시아와 호주에서 마이크로소프트의 투자자 관계(IR) 팀을 만난 뒤 나온 것이라고 밝혔다. 이 논의들을 통해 애널리스트는 주가가 재평가되기 위해서는 회사의 Microsoft 365와 Copilot에 대한 서사가 개선되어야 한다는 점을 확인했다. 회사는 2026년 캘린더 기준 비GAAP EPS 추정치의 19배로 주식을 평가한다고 언급했다. 또한 애널리스트는 목표주가를 90달러 낮추기 전에 투자자들의 논쟁, 경영진의 대응, 그리고 회사의 리서치를 검토했다고 덧붙였다. 앞서 3월 24일 Bank of America Securities는 Microsoft Corporation(NASDAQ:MSFT)에 대해 목표주가 500달러와 함께 매수 의견을 재확인했다. 이 회사는 마이크로소프트가 인프라와 애플리케이션 전반에 걸친 AI 분야에서 상당한 전략적 우위를 보유하고 있다고 밝혔다. BofA는 Microsoft Azure를 기업용 AI 워크로드를 위한 컴퓨팅 및 데이터 백본으로 강조하며, 확장 가능한 AI 배포를 가능하게 한다고 평가했다. 또한 Office 365, Dynamics, GitHub, Windows를 포함한 소프트웨어 제품군이 일상적인 워크플로에 AI를 통합해 도입과 사용을 늘리고 있다고 덧붙였다. Microsoft Corporation(NASDAQ:MSFT)는 워싱턴주에 본사를 둔 기업으로, Productivity and Business Processes, Intelligent Cloud, Personal Computing 부문을 통해 사업을 운영한다. 1975년에 설립된 이 회사는 전 세계에 소프트웨어, 서비스, 디바이스 및 솔루션을 제공한다. MSFT가 투자 대상으로서 가진 잠재력과 위험을 인정하지만, 우리는 일부 AI 주식이 더 큰 수익을 더 짧은 기간 안에 제공할 가능성이 더 높다고 믿는다. MSFT보다 더 유망하고 10,000% 상승 여력이 있는 AI 주식을 찾고 있다면, 가장 저렴한 AI 주식에 대한 우리의 보고서를 확인해 보라. 다음 읽을거리: 2026년에 높은 수익을 노릴 수 있는 10개의 급등 페니주와 매수해야 할 10개의 저가주. 공시: 없음. Insider Monkey의 Google News를 팔로우하라. Jeff Bezos가 하나의 획기적 기술이 Amazon의 운명을 좌우할 것이라고 말했을 때, 월가의 거대 애널리스트들조차 허를 찔렸다. 1년이 지난 지금, Amazon의 새 CEO Andy Jassy는 생성형 AI를 이미 Amazon 전반에서 고객 경험을 재창조하는 데 사용되고 있는 '일생에 한 번 올까 말까 한' 기술이라고 표현했다. 제8회 Future Investment Initiative 회의에서 Elon Musk는 2040년까지 최소 100억 개의 휴머노이드 로봇이 존재할 것이며, 각 로봇의 가격은 2만~2만5,000달러가 될 것이라고 예측했다. 계산해 보라. Musk에 따르면 이 기술은 2040년까지 250조 달러의 가치가 있을 수 있다. 그리고 놀라운 점은 이 250조 달러 규모의 물결이 단일 기업에 연결된 것이 아니라, 글로벌 경제를 재편할 AI 혁신가들의 전체 생태계에 연결되어 있다는 것이다. 그 규모는 너무도 커서 기업, 정부, 소비자가 전 세계적으로 운영되는 방식을 바꿀 수 있다. 250조 달러라는 수치가 다소 야심차게 들리더라도, PwC와 McKinsey 같은 주요 기관들은 여전히 AI가 수조 달러 규모의 잠재력을 열어줄 것으로 보고 있다. 해답은 인류가 일하고, 배우고, 창조하는 방식을 재정의하고 있는 매우 강력한 획기적 기술에 있다. 그리고 이 돌파구는 이미 헤지펀드와 월가의 최고 투자자들 사이에서 열풍을 일으키고 있다. 대부분의 투자자들이 깨닫지 못하는 것은, 이 250조 달러 혁명의 열쇠를 쥔 저평가된 한 기업이 있다는 점이다. 실제로 Verge는 이 회사의 초저가 AI 기술이 경쟁사들에게 경고가 되어야 한다고 주장한다. 세부 내용을 공개하기 전에, 전 세계에서 가장 부유한 사람들이 어떻게 포지셔닝하고 있는지 이야기해 보자. 실리콘밸리에서 월가에 이르기까지 억만장자들이 같은 아이디어에 줄을 서고 있다면, 주목할 가치가 있다는 뜻이다. Tesla, Nvidia, Alphabet, 그리고 Microsoft가 이룬 성과를 존중하더라도, 우리는 더 큰 기회가 다른 곳에 있다고 믿는다… 하지만 진짜 이야기는 Nvidia가 아니다. 이 전체 혁명을 가능하게 하는 핵심 기술을 조용히 개선하고 있는 훨씬 더 작은 기업이다. 그리고 실리콘밸리 내부자들과 월가 베테랑들로부터 듣고 있는 바를 보면… 몇 년 후에는 이 주식을 보유하지 않았다는 점을 후회하게 될 것이다. 가장 좋은 점은? 지금 바로 이 회사와 획기적인 기술에 관한 모든 것을 알아볼 수 있다는 것이다. 나는 이 획기적인 회사에 대해 알아야 할 모든 것을 담은 상세한 회원 전용 보고서를 작성했다. 믿어 달라 — 또 다른 기술주에 1달러를 더 넣기 전에 이 보고서를 읽고 싶을 것이다. 한 달에 단 9.99달러라는 터무니없이 낮은 가격으로, 1년치 심층 투자 리서치와 독점 인사이트를 이용할 수 있다 — 패스트푸드 한 끼보다도 싸다! 이 제안을 그냥 넘길 수 없는 이유는 다음과 같다: • 이 판도를 바꾸는 AI 주식에 대한 상세 보고서 접근: 심층 보고서에서는 우리의 1위 AI 종목의 획기적인 기술과 막대한 성장 잠재력을 깊이 있게 다룬다. • 프리미엄 독자 뉴스레터 11개의 신규 발행분: 향후 12개월 동안 매월 최소 한 종목의 새로운 추천을 포함한 11개의 신규 발행분을 받을 수 있다. 이 종목들은 연구 책임자 Dr. Inan Dogan이 직접 선별한다. • 향후 발행될 70페이지 이상 분량의 분기 뉴스레터 1회 무료 제공: 가치 149달러 • 보너스 보고서: 회원 전용 펀드 매니저 ვიდეო 인터뷰에 대한 프리미엄 접근 • 광고 없는 브라우징: 방해되는 배너 및 팝업 광고 없이 1년 동안 투자 리서치를 즐기며 다음 대형 기회를 찾아볼 수 있다. • 30일 환불 보장: 서비스에 전혀 만족하지 못하면 질문 없이 30일 이내에 전액 환불해 드린다. 지금 참여를 고려하고 있다면 기다리지 말라 — 월가가 이 이야기를 알아차리는 순간 손쉬운 수익은 사라질 것이다. 좌석 수 제한! 이 특별 제안은 1,000명만 이용할 수 있다. 이 기회를 놓치지 말고 오늘 프리미엄 독자 뉴스레터를 구독해 삶을 바꿀 수 있는 투자 기회를 열어 보라. 1. 웹사이트에 들어가 월 9.99달러에 프리미엄 독자 뉴스레터를 구독하라. 2. 1년간 광고 없는 브라우징, 혁신적 AI 기업에 대한 심층 보고서의 독점 접근, 그리고 향후 12개월 동안 제공될 프리미엄 독자 뉴스레터의 발행분을 즐기라. 3. 편안히 앉아, 철저한 30일 환불 보장으로 보호받고 있다는 점을 기억하라. 이 놀라운 기회를 놓치지 말라! 지금 구독하고 AI 투자 미래를 주도하라! 자동 갱신 걱정은 없다! 최초 가입이든 한 달 뒤 재구독이든 관계없이 30일 환불 보장이 적용된다! 2014년 5월 설립 이후 수익률(2026년 2월 18일까지)",https://www.insidermonkey.com/blog/ubs-lowers-pt-on-microsoft-msft-maintains-a-buy-rating-1727191/?amp=1
3,MSFT,2026-03-29 20:20:54,"나는 Nvidia, Microsoft, Meta를 보유하고 있다. 지금 이 세 종목에 대해 내가 하고 있는 일은 다음과 같다. - The Globe and Mail","월가는 더 이상 1년 전처럼 AI가 대단한 호재라고 확신하지 않는다. AI에 대한 투자심리 악화는 2026년에 Microsoft, Meta, Nvidia 주가 하락으로 이어졌다. Microsoft, Meta, Nvidia가 여전히 AI의 혜택을 받을 수 있음을 보여주는 요인들은 강한 매출 성장 등 여러 가지가 있다. 인공지능(AI)은 최근 수년간 Microsoft(NASDAQ: MSFT), Meta Platforms(NASDAQ: META), 그리고 물론 Nvidia(NASDAQ: NVDA)를 포함한 많은 기술주를 하늘 높이 끌어올린 쓰나미였다. 그러나 2026년에는 상황이 달라졌다. AI는 더 이상 모든 배를 띄우는 조수로 여겨지지 않는다. 인공지능 시대에는 패자도 나올 것이며, 이로 인해 사이버보안과 서비스형 소프트웨어(SaaS) 같은 여러 산업의 주가가 하락하고 있다. 여기에 더해 월가는 기술기업들의 막대한 설비투자(CapEx)를 정당화할 수 있는지 의문을 제기하고 있다. AI가 세계 최초의 조(兆)달러 부자를 탄생시킬까? 우리 팀은 Nvidia와 Intel이 모두 필요로 하는 핵심 기술을 제공하는, '필수불가결한 독점기업'이라 불리는 잘 알려지지 않은 한 회사에 대한 보고서를 방금 공개했다. 계속 » 그 결과 Nvidia 주가는 3월 20일로 끝나는 주간까지 2026년에 약 7% 하락했고, Meta는 10% 떨어졌으며, Microsoft는 같은 기간 무려 21% 급락했다. 변하는 AI 흐름 속에서 투자자들은 어떤 전략을 고려해야 할까? Microsoft, Meta, Nvidia의 주주로서, 이 보유 종목들을 어떻게 운용할지에 대한 내 계획은 다음과 같다. 나는 이 회사들이 장기적으로 뛰어난 수익을 가져다줄 것이라는 믿음으로 Microsoft, Meta, Nvidia에 투자했다. 월가가 2026년 초 이들 주식에 대해 부정적으로 돌아섰음에도 여전히 그렇게 믿고 있다. 주가 하락에 직면한 지금, 나의 전략은 보유를 유지하고, 하락 폭이 큰 Microsoft는 추가 매수하는 것이다. 이 접근법에는 여러 이유가 있다. 먼저 Microsoft 주식을 왜 매수해야 하는지부터 보자. 월가는 설비투자(CapEx) 같은 요인들 때문에 이 기술 대기업에 실망했다. Microsoft는 12월 31일로 끝난 회계연도 2분기에 375억 달러의 설비투자를 발표했는데, 이는 전년 대비 무려 66% 증가한 수치다. 비용의 약 3분의 2는 Nvidia와 같은 업체가 판매하는 그래픽 처리 장치(GPU)처럼 AI를 지원하는 하드웨어에 사용됐다. 나는 이 설비투자 비용을 Microsoft의 미래 성장에 대한 핵심 투자로 본다. 이 지출은 고객의 AI 수요를 충족하기 위해 필요한 클라우드 컴퓨팅 용량을 확장하는 것을 목표로 한다. 이러한 수요는 상업 고객 부문의 회계연도 2분기 잔여 이행 의무가 110% 증가해 6,250억 달러에 달했다는 점에서 드러난다. 이 기술 대기업은 주가수익비율(P/E)이 23배에 불과해 지난 1년 기준으로 밸류에이션이 낮은 수준에 있기 때문에 매수 종목이다. YCharts 데이터. PE Ratio = 주가수익비율. Microsoft는 회계연도 2026년 2분기에 813억 달러의 매출을 기록하며 전년 동기 대비 17% 증가했고, 그중 클라우드 컴퓨팅 매출은 515억 달러를 기여했다. 이는 AI 사업이 잘 진행되고 있음을 시사하며, 밸류에이션이 하락한 지금이 주식을 담을 좋은 시점이라는 뜻이다. Microsoft의 설비투자 비용에 대한 월가의 우려는 Meta에서도 소비자 측에서 그대로 드러난다. 이 소셜미디어 거대 기업은 2026년 설비투자가 1,150억~1,350억 달러에 달할 것으로 전망했는데, 이는 2025년의 722억 달러에서 증가한 것이다. Microsoft와 마찬가지로 Meta도 AI 수요를 확보하기 위해 투자하고 있으며, CEO Mark Zuckerberg는 ""우리는 지금 AI의 큰 가속을 보고 있다. 2026년은 이 흐름이 여러 측면에서 더욱 가속화되는 해가 될 것이라고 예상한다""고 말했다. Meta의 4분기 실적은 그 지배력을 입증한다. 4분기 매출은 일일 활성 사용자 수와 광고당 평균 가격의 성장에 힘입어 전년 동기 대비 24% 증가한 599억 달러를 기록했다. 회사는 AI를 각 사용자에게 맞춤화된 콘텐츠를 자동으로 생성해 시청자를 더 끌어들이는 수단으로 보고 있다. 사람들이 Meta 앱에서 더 많은 시간을 보낼수록 회사의 광고 매출은 증가한다. 사용자가 광고와 상호작용하거나 공유할 때마다 Meta는 돈을 번다. 사업이 잘 돌아가고 있고 AI가 추가 성장을 이끌 것으로 보이는 만큼, Meta는 보유해야 할 주식이다. 아마도 나를 가장 설레게 하는 종목은 Nvidia일 것이다. 비전 있는 창업자 겸 CEO Jensen Huang은 컴퓨팅 산업의 진화를 정확히 예측하고, AI를 구동하는 컴퓨터 칩인 GPU부터 시작해 미래 수요에 맞는 제품을 만들어 왔다. Huang은 GPU가 인공지능에 이상적이라고 믿었고, 세계 최초의 AI 슈퍼컴퓨터를 OpenAI에 직접 전달했다. 그는 새로운 산업혁명의 일부로서 AI 팩토리의 부상을 내다봤다. Microsoft와 Meta의 CapEx 지출은 이 예측이 현실이 되었음을 보여준다. 이제 Huang은 소프트웨어가 결정을 내리는 과정인 AI 추론(inference)이 다음 기술적 대격변이 될 것이라고 전망한다. 자율주행차나 로봇 외과의사 같은 기술이 존재하려면, 이 기계를 작동시키는 AI는 실시간으로 추론을 수행해야 한다. 이를 가능하게 하기 위해 Nvidia의 최신 GPU인 Vera Rubin은 추론용으로 특별히 설계됐다. 이는 스스로 진화하는 AI 에이전트가 독립적으로 작동할 수 있게 한다. 고객들은 이미 구매하고 있다. Huang은 Nvidia GPU 주문이 2027년 말까지 1조 달러에 이를 것으로 추정했다. 이는 AI 추론 시대가 이미 Nvidia가 현재 창출하고 있는 매출보다 더 클 수 있음을 시사한다. 1월 25일에 끝난 2026 회계연도 매출은 사상 최고인 2,159억 달러로 집계되어, 전년도 기록인 1,305억 달러에서 크게 뛰어올랐다. 그러나 월가는 Nvidia 주식에 대해 비관적이었다. AI 기술이 너무 빠르게 진화하고 있어 향후 AI 승자와 패자를 예측하기가 어렵고, 그 때문에 사이버보안 같은 업종에서 매도세가 나타났다. 그럼에도 나는 Huang의 컴퓨팅 산업 통찰에 반대로 베팅하는 것은 현명하지 않다는 것을 배웠다. 그래서 Nvidia는 AI 쓰나미가 계속 커지는 동안 장기적으로 매수 후 보유해야 할 주식이다. Motley Fool Stock Advisor 분석팀은 최근 지금 투자자들이 매수해야 할 최고의 10개 종목을 선정했는데… Nvidia는 포함되지 않았다. 선정된 10개 종목은 향후 수년간 폭발적인 수익을 낼 수 있다. 2004년 12월 17일 넷플릭스가 이 목록에 올랐을 때를 생각해 보자... 당시 추천 시점에 1,000달러를 투자했다면 현재 503,861달러가 되었을 것이다!* 또는 2005년 4월 15일 엔비디아가 이 목록에 올랐을 때를 생각해 보자... 당시 추천 시점에 1,000달러를 투자했다면 현재 1,026,987달러가 되었을 것이다!* 이제 Stock Advisor의 총 평균 수익률이 884%라는 점을 기억할 만하다 — S&P 500의 179%와 비교하면 시장을 압도하는 초과수익이다. Stock Advisor에서 제공하는 최신 상위 10개 목록을 놓치지 말고, 개인 투자자들이 개인 투자자들을 위해 만든 투자 커뮤니티에 참여해 보라. Robert Izquierdo는 Meta Platforms, Microsoft, Nvidia에 포지션을 보유하고 있다. Motley Fool은 Meta Platforms, Microsoft, Nvidia에 포지션을 보유하고 있으며 매수를 권고한다. Motley Fool은 공시 정책을 보유하고 있다. 모든 시장 데이터(새 탭에서 열림)는 Barchart Solutions에서 제공된다. Copyright © 2026. 정보는 '있는 그대로' 제공되며 거래 목적이나 조언이 아니라 오직 정보 제공용이다. 거래 지연 및 이용 약관에 대해서는 면책 조항(새 탭에서 열림)을 읽어 달라.",https://www.theglobeandmail.com/investing/markets/stocks/MSFT/pressreleases/1031535/i-own-nvidia-microsoft-and-meta-heres-what-im-doing-with-all-3-right-now/
