ticker,title,date,content,url
MSFT,"2 ""Magnificent Seven"" Stocks Down Between 10% and 23% to Buy Right Now - Yahoo Finance",2026-03-26 20:25:00,"Tip: Try a valid symbol or a specific company name for relevant results The S&P 500 extended its losing streak and the Dow joined the Nasdaq in correction as tech wiped billions in value Senate votes to end US shutdown that has snarled airports and left TSA workers unpaid US stocks sink, with Nasdaq falling deeper into correction as Iran war rages on How Trump went from saying the Strait of Hormuz 'will open itself' to acknowledging Iran's power to control the waterway SpaceX tells prospective investors to anticipate briefings in April in preparation for IPO (Bloomberg) Every Big Tech darling is down double-digit percentages from its 52-week high The Nasdaq led indexes lower as Big Tech and chip stocks sold off and oil spiked above $100 Mortgage rates surged to a 7-month high as buyer confidence is 'shaken' Stocks slid at the open as Trump warned Iran to make a deal before it is 'too late' Worker productivity is on the rise. How much is because of AI is hard to say. Workers everywhere are feeling horrible about their job security. Here's why. Wall Street analysts say recession odds are rising as oil prices remain volatile and the Middle East war drags on The TSA chief says travel problems will likely outlive any shutdown deal, warning of a 'perfect storm' this summer Stocks rose and oil stayed below the $100 level, as Wall Street weighed hopes for deescalation in Iran Meta, YouTube reportedly found liable in landmark social media addiction lawsuit 2 charts explain why OpenAI just pulled the plug on Sora US stocks jump amid hopes for US-Iran talks, as oil falls below $100 Three factors have driven double-digit stock market losses in the last 100 years. They're all in play. The economist known as 'Dr. Doom' says the Iran war could have serious implications for inflation and interest rates The CEO claims the era of the $1 billion AI-run companies is already here. Shares tanked the most on record, thanks to unfavorable developments in legislation moving through Congress. Stocks resumed a slide, with the Nasdaq leading the decline. Oil jumped as the Iran war dragged on. Stocks retreated at the open, pulling back after Monday's sharp rally as the Iran war dragged on How the Fed has — and hasn't — responded to previous oil price shocks Musk's 'Terafab' is finally here. It might be his grandest overarching vision yet for where he sees his companies headed. Larry Fink's annual letter featured a stark warning about AI and inequality Trump started talks with Iran after US allies warned him about the dangers of his planned strikes (Bloomberg) The Dow jumped over 600 points, while the S&P 500 and Nasdaq both rose over 1% as Wall Street cheered Trump's signal to resume talks with Iran. US stocks soar after Trump puts Iran strikes on hold to pursue 'very good' talks Dow futures soared nearly 1,000 points and oil sank after Trump postponed threatened strikes on Iran's power plants The Saudi oil pipeline the world didn't know it needed (Bloomberg) Here's how HELOCs have changed — and why some homeowners may not like the new rules Home health aides epitomize a key problem in the current job market: High demand but low pay Analysts are looking at how surging gas prices may affect consumers, inflation, and the broader economy Border czar Homan says ICE will do ‘non-significant’ tasks at airports (Bloomberg) Powell doesn't plan to step down from the Fed Board of Governors until the DOJ investigations of him and the Fed are resolved Iran war rages on, possible rate hikes, and AI's 'show me' phase Why Nascar star Joey Logano just invested in a Ford dealership A growing number of Americans are looking to retire overseas. Here's what you need to know. Your flight is about to get more expensive. These tips could save you. Trump threatens to deploy ICE agents to airports in shutdown (Bloomberg) Why used EVs may be the answer for Americans looking for affordable cars Property taxes are skyrocketing. But states are learning that cutting them has major consequences. OpenAI to double workforce as business push intensifies (Financial Times) Wall Street priced a swift bombing campaign. What it got was an energy war. Shutdown-induced travel problems may get even worse next week. And Congress has a recess looming. Jury finds Elon Musk misled investors during Twitter purchase, absolves him of some fraud claims (Associated Press) Gas prices are just the start: Consumers will feel more pain from Iran war The Dow, S&P 500, and Nasdaq sold off to end another brutal week as the Iran war rages Wall Street resumed its sell-off, with the Nasdaq down over 1% as stocks looked headed for another brutal week. Nvidia, Alphabet, Apple, Microsoft (NASDAQ: MSFT), Amazon (NASDAQ: AMZN), Meta Platforms, and Tesla -- collectively known as the ""Magnificent Seven"" -- have captured the stock market's spotlight in recent years. And for good reasons, as these megacap growth stocks have been major contributors to major index gains. As recent research by The Motley Fool shows, the Magnificent Seven's combined market cap of roughly $21.8 trillion accounts for roughly a third of the S&P 500 (SNPINDEX: ^GSPC). Meaning that just a handful of stocks are now so large they can move the market. But concentration is a double-edged sword. Will AI create the world's first trillionaire? Our team just released a report on the one little-known company, called an ""Indispensable Monopoly"" providing the critical technology Nvidia and Intel both need. Continue » In 2026, index investors have been getting the unfavorable side, as all of the Magnificent Seven stocks are trading down year to date and underperforming the S&P 500. Here's why two longtime Motley Fool contributors see Microsoft and Amazon as standout buys right now. Daniel Foelber (Microsoft): Microsoft is the worst-performing Magnificent Seven stock in 2026 so far -- down 23.4% year to date and 31.7% from its all-time high from last summer. The stock is under pressure for some valid and some arguably overblown reasons. Microsoft is the world's largest software stock by market cap. And software stocks are under immense pressure as investors question the impact of artificial intelligence (AI) on established application software tools. But Microsoft isn't an ordinary software company. The Microsoft 365 suite is deeply embedded in the enterprise, household, and educational markets. Microsoft is also so much more than just software. It is the No. 2 cloud infrastructure player behind Amazon Web Services. And it has a massive consumer electronics division -- from personal computers to gaming, and more. It also owns LinkedIn. And Microsoft-owned GitHub is rapidly growing its paid Copilot subscribers -- proving that Microsoft is monetizing AI across its business segments. Microsoft is generating solid revenue growth, impeccable earnings, and decade-high operating margins. But some investors are concerned that hyperscalers like Microsoft are overspending on AI. Microsoft hasn't shied away from the impact of this spending. During its second-quarter fiscal 2026 earnings call in January, Microsoft said roughly two-thirds of its $37.5 billion in quarterly capital expenditures is spent on short-lived assets such as graphics processing units and central processing units. The higher spending weighed heavily on Microsoft's free cash flow, which was just $5.9 billion in its latest quarter, which ended Dec. 31, 2025, and has been steadily trending down as Microsoft builds out its AI data center infrastructure. The software and AI spending narratives are dragging down the stock, but the bigger concern may be OpenAI. Microsoft has invested heavily in OpenAI, whose model powers its Copilot AI tools. But Anthropic's Claude has proved to be a formidable alternative to OpenAI's ChatGPT. And in many ways, Claude has overtaken ChatGPT in key areas like coding -- with reports indicating that Claude is now the No. 1 downloaded app in the U.S. as of early March. Claude taking market share from OpenAI, or at least slowing its growth rate, is a risk to Microsoft, considering that 45% of its $625 billion backlog is tied to OpenAI. Those are the risks to Microsoft's investment thesis. The good news is that they could be entirely overblown if Microsoft's software suite remains relevant and its long-term investments pay off. And best of all, Microsoft is so cheap that these risks are already baked into its valuation. Microsoft sports a price-to-earnings (P/E) ratio of just 23.3 and a forward P/E of 22.3 compared to a 10-year median P/E of 33.2. Microsoft also has the highest dividend yield of the Magnificent Seven at 1% and the best dividend track record -- with 16 consecutive years of boosting its payout. Add it all up, and investors are getting what could turn out to be a great buying opportunity in Microsoft. Anders Bylund (Amazon): As I write this on March 24, Amazon shares are down 10.3% since the New Year's fireworks. To be clear, I mean the usual holiday celebrations, as Amazon shares slumped at the end of 2025 -- no fireworks there. By the end of the year, Amazon's stock was already down 9% from November's all-time high. Altogether, Amazon investors have taken an 18.5% hit over the last five months. But there's nothing wrong with Amazon's business. The market is punishing this habitual innovator for investing in future growth drivers. You know, just like it did when Amazon evolved from an online bookstore to a wide-ranging retailer. Or when it invested billions in a two-day shipping system (which moved on to next-day and same-day deliveries). Or the early years of Amazon Web Services (AWS), when cloud computing really wasn't a thing yet, and the new idea looked like a distraction from Amazon's core e-commerce business. The skeptics turned out to be wrong most of the time. As a result, Amazon has crushed the market in the long run. If you invested a measly $1,000 in the stock 20 years ago, your position would be worth $118,000 today. Putting the same cash to work in an S&P 500 index fund instead would only have given you $7,293 over the same period. It's not a close race. This time, people worry about a massive investment in AI infrastructure. The company will pour $200 billion into capital expenses this year, largely to build more AI data centers. That may sound reckless. Amazon's capital expenses averaged $44 billion over the last decade, so it's a big step up. But it's also a natural progression from investing $52.7 billion in 2023, $83 billion in 2024, and $131.8 billion last year. Furthermore, Amazon is pursuing this market for good reasons. Here's what Amazon CEO Andy Jassy said in the Q4 2025 earnings call: Customers really want AWS for core and AI workloads. And we are monetizing capacity as fast as we can install it. We have deep experience understanding demand signals in the AWS business and then turning that capacity into strong return on invested capital. We are confident this will be the case here as well. So the stock is down because people think Amazon's AI ramp-up is too expensive. In my experience, this company has a tendency to back up its big, costly plans with serious business results. I see this price drop as a buying window and a rare setup. If Amazon's track record of turning skepticism into market-beating returns doesn't make this dip look like an opportunity, I'm not sure what would. The Motley Fool Stock Advisor analyst team just identified what they believe are the 10 best stocks for investors to buy now… and Microsoft wasn’t one of them. The 10 stocks that made the cut could produce monster returns in the coming years. Consider when Netflix made this list on December 17, 2004... if you invested $1,000 at the time of our recommendation, you’d have $497,659!* Or when Nvidia made this list on April 15, 2005... if you invested $1,000 at the time of our recommendation, you’d have $1,095,404!* Now, it’s worth noting Stock Advisor’s total average return is 912% — a market-crushing outperformance compared to 185% for the S&P 500. Don't miss the latest top 10 list, available with Stock Advisor, and join an investing community built by individual investors for individual investors. Anders Bylund has positions in Alphabet, Amazon, and Nvidia. Daniel Foelber has positions in Nvidia. The Motley Fool has positions in and recommends Alphabet, Amazon, Apple, Meta Platforms, Microsoft, Nvidia, and Tesla and is short shares of Apple. The Motley Fool has a disclosure policy. 2 ""Magnificent Seven"" Stocks Down Between 10% and 23% to Buy Right Now was originally published by The Motley Fool Tip: Try a valid symbol or a specific company name for relevant results",https://finance.yahoo.com/markets/stocks/articles/2-magnificent-seven-stocks-down-202500037.html
MSFT,Did New AI Partnerships and OpenAI Reliance Just Shift Microsoft's (MSFT) Investment Narrative? - simplywall.st,2026-03-26 13:14:23,"Uncover the next big thing with 29 elite penny stocks that balance risk and reward. To own Microsoft, you need to believe its AI heavy cloud and software ecosystem can keep converting long-term commitments into profitable, recurring revenue, even as elevated CapEx and OpenAI dependency weigh on sentiment. The latest wave of partner integrations and new data center leases reinforces the AI infrastructure and security story, but does not materially change the near term focus on whether rising AI related spending and OpenAI concentration risk translate into sustainable earnings quality. The expanded support for the Microsoft 365 E7 Frontier Suite by RSA is especially relevant here, because it illustrates how Microsoft is deepening high value security and identity use cases around Copilot and its core productivity stack. For investors watching the balance between heavy AI infrastructure spend and monetization progress, this kind of security centric partner traction offers a concrete proof point on how Microsoft is trying to turn its broader AI and cloud commitments into higher ARPU and stickier enterprise demand over time. Yet beneath this growth story, investors should also be aware of how much of Microsoft’s massive cloud backlog is now tied to a single AI partner and what happens if that relationship... Microsoft's narrative projects $425.0 billion revenue and $158.4 billion earnings by 2028. This requires 14.7% yearly revenue growth and a $56.6 billion earnings increase from $101.8 billion today. Uncover how Microsoft's forecasts yield a $594.62 fair value, a 60% upside to its current price. Members of the Simply Wall St Community have published 103 fair value estimates for Microsoft, ranging from US$362 to US$613 per share, highlighting how far apart individual views can be. Many of these community models sit alongside concerns about sustained high AI CapEx and OpenAI concentration risk, so it makes sense to compare several of these perspectives before forming your own view on Microsoft’s longer term performance. Explore 103 other fair value estimates on Microsoft - why the stock might be worth just $362.08! Don't just follow the ticker - dig into the data and build a conviction that's truly your own. Opportunities like this don't last. These are today's most promising picks. Check them out now: This article by Simply Wall St is general in nature. We provide commentary based on historical data
    and analyst forecasts only using an unbiased methodology and our articles are not intended to be financial advice. It does not constitute a recommendation to buy or sell any stock, and does not take account of your objectives, or your
    financial situation. We aim to bring you long-term focused analysis driven by fundamental data.
    Note that our analysis may not factor in the latest price-sensitive company announcements or qualitative material.
    Simply Wall St has no position in any stocks mentioned. We've created the ultimate portfolio companion for stock investors, and it's free. • Connect an unlimited number of Portfolios and see your total in one currency• Be alerted to new Warning Signs or Risks via email or mobile• Track the Fair Value of your stocks Have feedback on this article? Concerned about the content? Get in touch with us directly. Alternatively, email editorial-team@simplywallst.com Develops and supports software, services, devices, and solutions worldwide. Outstanding track record with flawless balance sheet and pays a dividend. Financial Data provided by S&P Global Market Intelligence LLC, analysis provided by Simply Wall Street Pty Ltd. Copyright © 2026, S&P Global Market Intelligence LLC. All rights reserved. Simply Wall Street Pty Ltd (ACN 600 056 611), is a Corporate Authorised Representative (Authorised Representative Number: 467183) of Sanlam Private Wealth Pty Ltd (AFSL No. 337927). Any advice contained in this website is general advice only and has been prepared without considering your objectives, financial situation or needs. You should not rely on any advice and/or information contained in this website and before making any investment decision we recommend that you consider whether it is appropriate for your situation and seek appropriate financial, taxation and legal advice. Please read our Financial Services Guide before deciding whether to obtain financial services from us. © 2026 Simply Wall Street Pty Ltd, US Design Patent #29/544/281, Community and European Design Registration #2845206",https://simplywall.st/stocks/us/software/nasdaq-msft/microsoft/news/did-new-ai-partnerships-and-openai-reliance-just-shift-micro
MSFT,Microsoft Is Having Its Worst Start to a Year Since 2008. Is That a Red Flag or a Once-in-a-Decade Buying Opportunity? - The Motley Fool,2026-03-26 11:55:00,"Microsoft stock has plummeted 21% so far in 2026, its worst start to the year since the 2008 financial crisis. Following a brutal reaction to the earnings report for its fiscal second quarter (ended Dec. 31), Microsoft (MSFT 2.44%) has seen its shares plummet into their sharpest correction since 2008. This drawdown has sparked a debate about the ""Magnificent Seven"" member: Is Microsoft stock a falling knife, or has the market overreacted, presenting a rare opportunity to buy a preeminent artificial intelligence (AI) stock at a discount? The volatility swirling around Microsoft stock stems from AI infrastructure spending, shifting competitive dynamics, and macroeconomic uncertainties. Let's look at the nuanced picture plaguing big tech investors to assess whether Microsoft is merely suffering from short-term panic selling and has the strength to deliver more explosive growth in the future. The main reason investors are ditching Microsoft stock stems from concerns around the company's capital expenditure budget. Accelerating investment in AI infrastructure -- from custom silicon designs, GPU procurement, capacity agreements, and data center buildouts -- puts pressure on free cash flow. Faster growth from other cloud providers such as Amazon Web Services (AWS) and Alphabet's Google Cloud Platform (GCP) could put a dent in Microsoft's pursuit of making Azure the go-to suite for enterprise AI adoption. Compounding these vulnerabilities are cloudy macroeconomic conditions. Should an economic slowdown come to fruition, businesses are likely to taper their software and cloud infrastructure spending. In addition, the generative AI partnership ecosystem is changing rapidly, introducing more variables to the equation as legacy tech developers such as Microsoft scramble to remain relevant. Taken together, it's easy to see why bears are beginning to think the growth narrative around Microsoft begins to look fragile. Given the degree to which Microsoft stock has plunged, it could be argued that investors are discounting the company's structural advantages. The company's ecosystem -- which spans Office, Windows, cybersecurity tools, social networking, and gaming -- creates immense switching costs. At the heart of Microsoft's growth is high-margin recurring revenue driven by subscriptions to Azure and other products, all of which are becoming enhanced through the power of AI. This makes the company's business model relatively predictable and quite durable during periods of uncertainty. Moreover, Microsoft has a rich history of reinventing itself. From navigating the rise of personal computing, cloud infrastructure, and now AI, the company has proved it has the innovation prowess and financial flexibility to adapt. On top of that, Microsoft boasts a rock-solid balance sheet. With nearly $90 billion of cash and equivalents and a low debt profile relative to the company's size, Microsoft is well equipped to double down on its AI vision, fund potential acquisitions, or pursue shareholder return programs with relative ease. I think Microsoft has a number of compelling forward-looking catalysts that support buying the dip right now. As AI transitions from training to the inference era, the phase at which models can make decisions, tools such as Copilot have the potential to be deployed in new formats across the enterprise. As such, Microsoft could be on the cusp of unlocking higher subscription tiers as AI-driven growth fuels further productivity gains and expanded adoption. Moreover, despite competitive headwinds from AWS and GCP, Azure is poised for acceleration as AI workloads scale and demand greater computing capacity. Longer-term tailwinds include the rise of AI agents as the integration of digital services becomes a cornerstone of digital transformation for businesses around the globe. While patience is always required for outsize value creation, the dynamics explored here suggest that the current pullback in Microsoft stock offers asymmetric upside for investors focused on the next decade, as opposed to the company's next quarterly performance. While drawdowns can certainly test nerves, Microsoft's unique blend of risk mitigants and secular tailwinds underscore the idea that concerns around the company are likely to be overblown, positioning shares for a compelling comeback in the long run. For these reasons, I see Microsoft stock as a great opportunity to buy and hold rather than one to run away from. Adam Spatacco has positions in Alphabet, Amazon, and Microsoft. The Motley Fool has positions in and recommends Alphabet, Amazon, and Microsoft. The Motley Fool has a disclosure policy. *Average returns of all recommendations since inception. Cost basis and return based on previous market day close. Invest better with The Motley Fool. Get stock recommendations, portfolio guidance, and more from The Motley Fool's premium services. © 1995 - 2026 The Motley Fool. All rights reserved.",https://www.fool.com/investing/2026/03/26/microsoft-is-having-its-worst-start-to-year-since/
MSFT,$Microsoft (MSFT.US)$[Grin] - Moomoo,2026-03-26 11:34:00,"To create a seamless experience and for website quality and improvement purposes, we use cookie technologies for verification and quality purposes, to personalize the content presented, and to provide advertising that may be of specific interest to you. Learn our Privacy Policy here.",https://www.moomoo.com/community/feed/microsoft-msft-us-116297326526470?chain_id=Name1K9-3FXPhg.1ksbb30&global_content=%7B%22promote_id%22%3A13764%2C%22sub_promote_id%22%3A109%2C%22f%22%3A%22www.moomoo.com%2Fsectors%2FQuantum-Computing-BK2594%22%7D
