id,ticker,date,title,content,url
30,NVDA,2026-03-26 07:48:53,"Fermata Advisors LLC, NVIDIA Corporation $NVDA 주식 14,812주 매입 - MarketBeat","Fermata Advisors LLC는 미국 증권거래위원회(SEC)에 최근 제출한 Form 13F 공시에 따르면, 4분기 동안 NVIDIA Corporation(NASDAQ:NVDA - Free Report) 주식 보유를 81.4% 늘렸습니다. 이 회사는 해당 분기 동안 14,812주를 추가로 매수한 뒤 컴퓨터 하드웨어 제조업체의 주식 33,017주를 보유하게 되었습니다. NVIDIA는 Fermata Advisors LLC 보유 자산의 약 1.5%를 차지하며, 해당 주식은 이 회사의 18번째로 큰 보유 종목입니다. Fermata Advisors LLC의 NVIDIA 보유 가치는 가장 최근 보고 시점 기준 6,158,000달러였습니다. 다른 여러 헤지펀드와 기관투자자들도 최근 이 회사에 대한 지분을 늘리거나 줄였습니다. Joule Financial LLC는 3분기에 NVIDIA 주식 보유를 2.2% 늘렸습니다. Joule Financial LLC는 현재 추가로 50주를 취득한 뒤 컴퓨터 하드웨어 제조업체 주식 2,308주를 보유하고 있으며, 가치는 431,000달러입니다. Vision Financial Markets LLC는 3분기에 NVIDIA 보유 지분을 1.2% 늘렸습니다. Vision Financial Markets LLC는 최근 분기에 추가로 53주를 매수한 뒤 컴퓨터 하드웨어 제조업체 주식 4,640주를 보유하고 있으며, 가치는 866,000달러입니다. Websterrogers Financial Advisors LLC는 3분기에 NVIDIA 보유 지분을 2.6% 늘렸습니다. Websterrogers Financial Advisors LLC는 기간 중 추가로 54주를 매수한 뒤 컴퓨터 하드웨어 제조업체 주식 2,118주를 보유하고 있으며, 가치는 395,000달러입니다. IMG Wealth Management Inc.는 3분기에 NVIDIA 지분을 1.4% 늘렸습니다. IMG Wealth Management Inc.는 최근 분기에 추가로 54주를 매수한 뒤 컴퓨터 하드웨어 제조업체 주식 3,820주를 보유하고 있으며, 가치는 713,000달러입니다. 마지막으로 Cyr Financial Inc.는 3분기에 NVIDIA 보유 지분을 0.7% 늘렸습니다. Cyr Financial Inc.는 최근 분기에 추가로 54주를 매수한 뒤 컴퓨터 하드웨어 제조업체 주식 7,737주를 보유하고 있으며, 가치는 1,444,000달러입니다. 현재 주식의 65.27%는 기관투자자들이 보유하고 있습니다. 이번 주 NVIDIA에 영향을 미치는 주요 뉴스는 다음과 같습니다. 다른 뉴스로, EVP Ajay K. Puri는 3월 18일 수요일 거래에서 회사 주식 300,000주를 매도했습니다. 주식은 주당 평균 182.25달러에 매도되었으며, 총 거래금액은 54,675,000.00달러였습니다. 매도 후 수석 부사장은 회사 주식 3,018,547주를 보유했으며, 가치는 약 550,130,190.75달러였습니다. 이는 보유 지분이 9.04% 감소한 것입니다. 해당 매도는 SEC 웹사이트에서 확인 가능한 SEC 제출 문서에 공개되었습니다. 또한 CFO Colette Kress는 3월 20일 금요일 거래에서 회사 주식 42,650주를 매도했습니다. 주식은 주당 평균 174.89달러에 매도되었으며, 총 거래금액은 7,459,058.50달러였습니다. 매도 완료 후 최고재무책임자(CFO)는 회사 주식 881,387주를 직접 보유하고 있으며, 가치는 154,145,772.43달러입니다. 이는 주식 보유가 4.62% 감소한 것입니다. 이 매도에 대한 SEC 공시는 추가 정보를 제공합니다. 지난 분기 동안 내부자들은 회사 주식 총 1,401,616주를 253,555,407달러어치 매도했습니다. 기업 내부자는 현재 회사 주식의 4.17%를 보유하고 있습니다. NVIDIA 주식에 대해 여러 리서치 애널리스트가 의견을 내놓았습니다. HSBC는 2월 24일 화요일 리서치 보고서에서 NVIDIA의 목표주가를 310.00달러로 제시했습니다. Rosenblatt Securities는 월요일 보고서에서 ‘매수’ 의견을 재확인하고 NVIDIA 주식에 대해 325.00달러의 목표주가를 제시했습니다. Truist Financial은 3월 18일 수요일 리서치 노트에서 NVIDIA의 목표주가를 283.00달러에서 287.00달러로 상향하고 ‘매수’ 의견을 제시했습니다. Wolfe Research는 1월 30일 금요일 보고서에서 NVIDIA의 목표주가를 250.00달러에서 275.00달러로 상향하고 ‘시장수익률 상회(outperform)’ 의견을 제시했습니다. 마지막으로 Piper Sandler는 2월 26일 목요일 리서치 노트에서 NVIDIA에 대해 ‘비중확대(overweight)’ 의견을 재확인했습니다. 애널리스트 4명은 이 종목에 ‘강력 매수(Strong Buy)’ 등급을, 47명은 ‘매수(Buy)’ 등급을, 2명은 ‘보유(Hold)’ 등급을 부여했습니다. MarketBeat 데이터에 따르면 해당 종목의 현재 컨센서스 등급은 ‘매수’이며, 컨센서스 목표주가는 275.95달러입니다. NVDA 주식은 목요일 178.68달러에 개장했습니다. NVIDIA Corporation의 52주 최저가는 86.62달러, 52주 최고가는 212.19달러입니다. 회사의 시가총액은 4조 3,400억 달러, 주가수익비율(P/E)은 36.47, 주가수익성장비율(PEG)은 0.59, 베타는 2.33입니다. 50일 이동평균 주가는 184.11달러이고 200일 이동평균 주가는 184.34달러입니다. 회사의 부채비율은 0.05, 당좌비율은 3.24, 유동비율은 3.91입니다. NVIDIA(NASDAQ:NVDA - Get Free Report)는 마지막으로 2월 25일 수요일에 분기 실적을 발표했습니다. 이 컴퓨터 하드웨어 제조업체는 분기 주당순이익(EPS) 1.62달러를 기록해 애널리스트 컨센서스 추정치 1.54달러를 0.08달러 상회했습니다. 회사의 해당 분기 매출은 681.3억 달러였으며, 애널리스트 예상치 655.6억 달러를 웃돌았습니다. NVIDIA의 자기자본이익률(ROE)은 97.37%, 순이익률은 55.60%였습니다. 해당 분기 매출은 전년 동기 대비 73.2% 증가했습니다. 전년 동기 같은 분기에는 회사가 주당 0.89달러의 EPS를 기록했습니다. 전체적으로 애널리스트들은 NVIDIA Corporation이 현 회계연도에 주당 2.77달러의 이익을 기록할 것으로 전망합니다. 회사는 또한 최근 분기 배당을 발표했으며, 이는 4월 1일 수요일에 지급될 예정입니다. 3월 11일 수요일 기준 주주명부에 등록된 주주는 주당 0.01달러의 배당을 받게 됩니다. 이 배당의 배당락일은 3월 11일 수요일입니다. 이는 연간 환산 배당금 0.04달러와 배당수익률 0.0%를 의미합니다. NVIDIA의 배당성향(DPR)은 현재 0.82%입니다. NVIDIA Corporation은 1993년에 설립되어 캘리포니아주 산타클라라에 본사를 둔 글로벌 기술 기업으로, 그래픽 처리 장치(GPU)와 시스템온칩(SoC) 기술을 설계 및 개발합니다. 젠슨 황(Jensen Huang)이 크리스 말라코스키(Chris Malachowsky), 커티스 프리엠(Curtis Priem)과 공동 설립했으며, 현재 그는 사장 겸 최고경영자(CEO)를 맡고 있습니다. NVIDIA는 그래픽 중심 칩 제조업체에서 다양한 산업을 위한 가속 컴퓨팅 하드웨어와 소프트웨어를 폭넓게 제공하는 기업으로 성장했습니다. 제품 포트폴리오는 게임 및 전문 시각화용 개별형 GPU(GeForce 및 NVIDIA RTX 라인으로 판매), AI 학습 및 추론에 사용되는 고성능 데이터센터 가속기(A100 및 H100 시리즈와 같이 널리 채택된 플랫폼 포함), 그리고 자동차 및 엣지 애플리케이션용 Tegra SoC를 아우릅니다. 다른 헤지펀드들이 NVDA를 얼마나 보유하고 있는지 보고 싶으신가요? HoldingsChannel.com을 방문하면 NVIDIA Corporation(NASDAQ:NVDA - Free Report)의 최신 13F 공시와 내부자 거래를 확인할 수 있습니다. 이 즉시 뉴스 알림은 독자들에게 가장 빠른 보도와 편향 없는 커버리지를 제공하기 위해 MarketBeat의 내러티브 과학 기술과 금융 데이터를 바탕으로 생성되었습니다. 이 기사에 대한 질문이나 의견은 contact@marketbeat.com으로 보내주시기 바랍니다. NVIDIA를 고려하기 전에, 이 내용을 먼저 들어보시기 바랍니다. MarketBeat는 월가의 최고 평가 및 최고 성과를 내는 리서치 애널리스트와 그들이 고객에게 추천하는 종목을 매일 추적합니다. MarketBeat는 상위 애널리스트들이 넓은 시장이 알아차리기 전에 지금 조용히 고객에게 매수하라고 속삭이는 5개 종목을 확인했으며, NVIDIA는 그 목록에 없었습니다. 현재 NVIDIA는 애널리스트들 사이에서 ‘매수’ 등급을 받고 있지만, 최고 평가 애널리스트들은 이 5개 종목이 더 나은 매수 대상이라고 보고 있습니다. 옵션 거래의 기초와 이를 활용해 수익을 높이고 리스크를 관리하는 방법을 MarketBeat의 이 무료 리포트로 배워보세요. 아래 링크를 클릭해 무료 사본을 받아보실 수 있습니다. MarketBeat All Access에 가입하면 MarketBeat의 전체 리서치 도구를 이용할 수 있습니다. 345 N Reid Place, Suite 620, Sioux Falls, SD 57103 contact@marketbeat.com (844) 978-6257 © MarketBeat Media, LLC 2010-2026. All rights reserved. © 2026 공정가치 가격은 매분 업데이트되며 Massive에서 제공합니다. 기타 시장 데이터는 최소 10분 지연되며 Barchart Solutions가 호스팅합니다. 정보는 '있는 그대로' 제공되며, 거래 목적이나 조언이 아닌 정보 제공 목적으로만 사용되며 지연됩니다. 모든 거래소 지연 시간 및 이용약관은 Barchart의 면책조항을 참조하십시오. 당사와 파트너는 귀하의 웹사이트 이용 정보를 공유하여 귀하의 경험을 개선합니다. 자세한 내용은 아래의 'Do Not Sell My Information' 버튼을 클릭하여 옵트아웃할 수 있습니다.",https://www.marketbeat.com/instant-alerts/filing-fermata-advisors-llc-purchases-14812-shares-of-nvidia-corporation-nvda-2026-03-26/
31,NVDA,2026-03-26 07:00:00,$NVDA 260327 175.00C$ 나는 바닥을 잡지는 못했지만 내일을 위해 싼 콜옵션은 샀다 🤙 - Moomoo,"원활한 사용 경험을 제공하고 웹사이트 품질 개선을 위해, 당사는 인증 및 품질 목적, 제공되는 콘텐츠의 개인화, 그리고 회원님에게 특히 관심이 있을 수 있는 광고 제공을 위해 쿠키 기술을 사용합니다. 여기에서 개인정보 처리방침을 확인하세요.",https://www.moomoo.com/community/feed/nvda-260327-175-00c-nvda260327c175000-us-i-didn-t-get-116297689072021?chain_id=Name1K9-3FXPhg.1ksb7ig&global_content=%7B%22promote_id%22%3A13764%2C%22sub_promote_id%22%3A62%2C%22f%22%3A%22www.moomoo.com%2Fcommunity%2Fnnq%22%7D
32,NVDA,2026-03-26 06:21:34,NVIDIA와 Advanced Micro Devices: 오늘 더 강한 매수 종목은 무엇인가? - Trefis,"Advanced Micro Devices는 지난 하루 동안 7.3% 급등했습니다. 더 매수하고 싶어질 수도 있고, 노출을 줄이고 싶을 수도 있습니다. 하지만 놓치고 있을 수 있는 전혀 다른 관점이 있습니다. 더 나은 대안이 있을까요? 결국, 같은 업종의 NVIDIA가 더 많은 것을 제공합니다. NVIDIA(NVDA) 주식은 핵심 기간 전반에 걸쳐 더 뛰어난 매출 성장, 더 나은 수익성, 그리고 Advanced Micro Devices(AMD) 주식에 비해 상대적으로 낮은 밸류에이션을 제공하므로, NVDA에 투자하는 것이 더 나을 수 있음을 시사합니다. 이러한 차이는 재무제표를 나란히 놓고 보면 더욱 분명해집니다. 아래 표는 성장, 마진, 모멘텀, 밸류에이션 배수 측면에서 AMD의 펀더멘털이 NVDA와 어떻게 비교되는지를 보여줍니다. 참고: “최근 3년 수익률” 지표의 경우, 수익률이 너무 높아(>300%) 매도 위험을 초래하는 경우가 아니라면 수익률이 더 높은 종목을 선호합니다. 더 많은 매출 세부사항 보기: AMD 매출 비교 | NVDA 매출 비교 더 많은 마진 세부사항 보기: AMD 영업이익 비교 | NVDA 영업이익 비교 NVDA 주식 매수 또는 매도, AMD 주식 매수 또는 매도에서 상세한 펀더멘털을 확인하세요. 아래에서는 연도별 시장 수익률과 관련 지표를 비교합니다. [1] 2021년 초 이후 누적 총수익률 [2] 2026년 데이터는 2026/3/25까지의 연초 대비(YTD) 수치 [3] 승률 = 월간 수익률이 플러스였던 달력상의 월 비율 [4] 최대 낙폭은 1년 내 최고점 대비 최저점까지의 최대 하락률을 의미합니다 아무리 숫자가 좋아도 주식 투자가 언제나 순탄한 것은 아닙니다. 반드시 고려해야 할 위험이 있습니다. 이 주식들이 과거에 어떻게 하락하고 회복했는지 보려면 NVDA 급락 매수자 분석과 AMD 급락 매수자 분석을 읽어보세요. AMD나 NVDA 중 아직 확신이 서지 않으신가요? 포트폴리오 접근법을 고려해보세요. 개별 종목은 크게 흔들리지만, 투자 상태를 유지하는 것이 중요합니다. 잘 구성된 포트폴리오는 투자를 지속하도록 돕고, 상승 여력을 포착하며, 개별 종목의 충격을 완화합니다. 30개 종목으로 구성된 Trefis High Quality(HQ) 포트폴리오는 S&P 500, S&P 중형주, 러셀 2000 지수를 모두 포함한 벤치마크를 안정적으로 상회해 온 실적을 보유하고 있습니다. 그 이유는 무엇일까요? HQ 포트폴리오는 출시 이후 누적 수익률 105% 이상을 기록했으며, HQ 포트폴리오 성과 지표에서 확인할 수 있듯 벤치마크 지수 대비 더 낮은 위험을 보였습니다. Ciena 주식 5일 연속 상승세: 주가 22% 상승 Lumentum 주식, 5일 연속 상승으로 25% 급등 주식, 채권, 금, 암호화폐: 2026/3/19 시장 업데이트 Advanced Micro Devices 주식을 흔들 수 있는 3가지 요인 Advanced Micro Devices 주식이 143달러까지? Advanced Micro Devices 주식이 140달러까지? Advanced Micro Devices 주식이 하락하는 가운데, 위험을 평가해보셨나요? Advanced Micro Devices 주식이 90% 급등한 이유는? Advanced Micro Devices 주식을 새로운 고점으로 끌어올릴 수 있는 요인은 무엇인가 Advanced Micro Devices 주식을 달나라로 보낼 촉매들 Advanced Micro Devices 주식이 151달러까지? Advanced Micro Devices 주식이 132달러까지? AMD 주식 폭락은 황금 같은 수익 기회 AMD 주식이 추가로 30% 더 하락해도 여전히 보유하시겠습니까? Advanced Micro Devices 주식에 무슨 일이 일어나고 있나? ©Copyright 2026 Insight Guru Inc. All Rights Reserved. 본 사이트를 이용함으로써 귀하는 이용약관의 구속을 받는 데 동의하는 것입니다. 금융시장 데이터는 Quotemedia.com에서 제공합니다. 컨센서스 EPS 추정치는 QuoteMedia에서 제공되며 매 영업일마다 업데이트됩니다. 모든 권리 보유. NYSE/AMEX 데이터는 20분 지연됩니다. NASDAQ 및 기타 데이터는 별도 표기가 없는 한 15분 지연됩니다.",https://www.trefis.com/stock/amd/articles/594851/nvidia-vs-advanced-micro-devices-which-is-the-stronger-buy-today/2026-03-26
33,NVDA,2026-03-26 05:47:52,보상의 10년: NVIDIA 주식으로 얻은 960억 달러 - Trefis,©Copyright 2026 Insight Guru Inc. All Rights Reserved. 본 사이트를 이용함으로써 귀하는 이용약관의 구속을 받는 데 동의하는 것입니다. 금융시장 데이터는 Quotemedia.com에서 제공합니다. 컨센서스 EPS 추정치는 QuoteMedia에서 제공되며 매 영업일마다 업데이트됩니다. 모든 권리 보유. NYSE/AMEX 데이터는 20분 지연됩니다. NASDAQ 및 기타 데이터는 별도 표기가 없는 한 15분 지연됩니다. 이 인터랙티브 모델은 단일 시나리오에서 수정할 수 있는 드라이버 수에 제한이 있습니다. 제한에 도달하면 아직 수정되지 않은 드라이버는 수정할 수 없도록 비활성화됩니다. 선택 가능한 옵션은 다음과 같습니다: 이 인터랙티브 모델은 현재 보고 있는 드라이버 값에 최소 및/또는 최대 제한이 있습니다. 이 드라이버는 이 시나리오에서 수정할 수 없습니다. 이 시나리오는 이미 이 드라이버를 수정한 상위 시나리오와 연결되어 있습니다.,https://www.trefis.com/data/companies/NVDA/no-login-required/YT3uf5IK/A-Decade-of-Rewards-96-Bil-From-NVIDIA-Stock
34,NVDA,2026-03-26 04:57:59,NVIDIA(NVDA)는 3월 23일 주를 ___에서 마감할까? 거래 확률 & 예측 - Polymarket,"Polymarket 트레이더들은 NVIDIA(NVDA) 주가가 3월 23일 주를 170~175달러 범위에서 마감할 암시적 확률을 51.5%로 제시하고 있으며, 165~180달러 구간에 대한 확률은 73.5%로 집계됩니다. 이는 10월 10일 종가 134.81달러에서 완만한 상승 여력이 있다는 확신 있는 합의가 반영된 것입니다. 이러한 포지셔닝은 예상치를 상회한 2025 회계연도 2분기 매출 300억 달러와 Blackwell AI 칩의 확대 국면을 강조한 325억 달러의 3분기 가이던스에서 비롯되며, 최근 중국에 대한 미국의 수출 규제 압박과 높은 미 국채 수익률 속에서 진행된 전반적인 기술주 섹터 로테이션이 이를 상쇄하고 있습니다. 평균 175달러인 애널리스트 목표주가는 이러한 시장 내포 확률과 일치하며, 11월 20일 3분기 실적 발표가 향후 방향에 영향을 줄 수 있는 핵심 단기 촉매로 꼽힙니다. Polymarket는 전 세계적으로 별도의 법인들을 통해 운영됩니다. Polymarket US는 CFTC 규제를 받는 지정계약시장(Designated Contract Market)인 QCX LLC d/b/a Polymarket US가 운영합니다. 이 국제 플랫폼은 CFTC의 규제를 받지 않으며 독립적으로 운영됩니다. 거래에는 상당한 손실 위험이 수반됩니다. 이용약관 및 개인정보 처리방침을 확인하세요.",https://polymarket.com/event/nvda-week-march-27-2026
35,NVDA,2026-03-26 04:18:35,Nvidia(NVDA) 주식: 아무도 이야기하지 않았던 820억 달러의 깜짝 매출 - mexc.co,"Nvidia 주가는 수요일 장 초반 거래에서 상승하며, Arm Holdings가 처음으로 AI 칩 시장에 진입했다는 소식을 가볍게 넘겼습니다. 이번 움직임은 거의 주목받지 못했던 또 다른 두 가지 주요 매출 관련 진전과 함께 나타났습니다. Arm은 화요일 첫 데이터센터 CPU인 Arm AGI CPU를 발표했으며, 초기 고객으로 Meta Platforms와 OpenAI를 언급했습니다. Arm은 장 마감 후 발표에서 야심 찬 목표를 제시하며, 더 넓은 250억 달러 매출 목표의 일환으로 CPU 사업이 2031년까지 연간 약 150억 달러의 매출을 올릴 것으로 전망했습니다. 발표 이후 Arm 주가는 시간외 거래에서 12% 급등했습니다. 그러나 애널리스트들은 새 칩이 Nvidia의 핵심 GPU 사업과 정면으로 경쟁하는 것은 아니라고 빠르게 지적했습니다. Nvidia CEO 젠슨 황은 Arm의 출시 자료에서 두 회사의 거의 20년에 걸친 파트너십이 “클라우드에서 엣지, AI 팩토리까지 하나의 매끄러운 플랫폼”의 기반이라고 언급한 것으로도 인용됐습니다. 더 흥미로운 부분은 지난주 개발자 컨퍼런스에서 막 출시된 Nvidia의 독립형 Vera CPU입니다. J.P. Morgan 애널리스트 Harlan Sur는 Arm의 칩이 해당 제품군과 겹칠 수 있다고 지적했습니다. 그는 또한 Meta가 이미 Arm 기반 CPU에 대해 Nvidia와 계약을 체결했다고 덧붙여 경쟁 구도가 다소 모호해졌다고 설명했습니다. 한편 Amazon Web Services는 AI 추론 운영을 지원하기 위해 Nvidia GPU 100만 개를 구매하겠다고 발표했습니다. 이는 다소 놀라운 일이었습니다. AWS는 이전에 2025년 10월 인디애나 데이터센터가 가동된 이후 “세계 최대의 비(非)Nvidia 칩 클러스터가 있는 곳”으로 자리매김해 왔기 때문입니다. 이번 계약에는 새 Groq 3 추론 칩을 포함한 6종의 추가 Nvidia 칩과 Nvidia 네트워킹 하드웨어의 “광범위한 조합”도 포함됩니다. 전체 패키지 비용은 500억 달러를 훨씬 웃돌 것으로 예상되며, 2027년 말까지 완료될 예정입니다. 이 단일 거래는 Nvidia의 2025년 연간 매출 전체의 약 25%에 해당합니다. 젠슨 황 CEO는 지난주 Nvidia가 미국 수출 제한을 준수하도록 설계된 H200 칩의 생산을 중국 시장을 위해 재개하고 있다고 확인했습니다. 보도에 따르면 중국 호환 버전의 Groq 3 칩도 개발 중입니다. Nvidia는 1분기 가이던스에 중국 데이터센터 매출을 0으로 반영했었습니다. 2025년 이 매출은 분기당 약 80억 달러 수준으로 진행되고 있었으며, 연간 약 320억 달러, 즉 2025년 총매출의 약 15%에 달했습니다. AWS 계약과 중국 생산 재개를 합치면 Nvidia의 기존 전망에 반영되지 않았던 매출이 820억 달러를 넘습니다. Nvidia 주가는 수요일 장전 거래에서 1.6% 오른 177.97달러를 기록하며, 직전 거래일의 0.3% 하락에서 회복했습니다. 이 게시물 Nvidia(NVDA) 주식: 아무도 이야기하지 않았던 820억 달러의 깜짝 매출은 CoinCentral에 처음 게재되었습니다. SEC의 명확한 입장 발표가 곧 예상되며, Western Union은 XRP를 통합하고, 기술적 패턴이 부합하면서 여러 요인이 잠재적 시장 변화를 시사합니다. 작성자: Ripple Bull Winkle | 암호화폐 연구원 🚀🚨01:02 Ripple 인프라는 아프리카 시장을 지원하며, Absa Bank, Chipper Cash, RedotPay와 함께 스케일링 및 송금 솔루션을 위한 파트너십을 맺고 있습니다. 작성자: Ripple Bull Winkle | 암호화폐 연구원 🚀🚨00:30 Fidelity가 8,300만 달러어치의 비트코인을 매수해 암호화폐 시장에 대한 기관투자자 관심을 시사했습니다. XRP는 펀더멘털 속에서 횡보하고 있으며, 기관은 매집하고 개인투자자는 약세로 인식합니다. 역사적으로 이는 큰 움직임에 앞선 경우가 많습니다. 작성자: Ripple Bull Winkle | 암호화폐 연구원 🚀🚨00:02 튀르키예의 Garanti BBVA와 사우디아라비아의 Riyad Bank는 암호화폐 및 토큰화 이니셔티브를 위해 XRP 인프라를 활용합니다. 작성자: Ripple Bull Winkle | 암호화폐 연구원 🚀🚨2026/03/26 23:47",https://www.mexc.co/news/980931
