ticker,title,date,content,url
NVDA,NVIDIA Corporation (NVDA): Billionaire Steve Cohen Has a Long-Term Bet on This Stock - Yahoo Finance Singapore,2026-04-03 21:00:29,"Tip: Try a valid symbol or a specific company name for relevant results NVIDIA Corporation (NASDAQ:NVDA) is one of the 10 Best Stocks to Invest In According to Billionaire Steve Cohen. NVIDIA Corporation (NASDAQ:NVDA) first appeared in the 13F portfolio of Point72 Asset Management back in the second quarter of 2015. This position comprised 2 million shares. By the fourth quarter of 2015, this stake had jumped to ownership of 66 million shares. Thereafter, Cohen reduced exposure to the stock, even selling it off completely but opening a new position within a few months. The present holding was purchased back in the first quarter of 2023 and consisted of 9.8 million shares then. Latest filings, submitted at the end of the fourth quarter of 2025, show that the fund owned nearly 10 million shares in the company, up 38% compared to filings for the previous quarter. READ NEXT: 10 Best Stocks to Buy According to Billionaire Paul Tudor Jones. NVIDIA Corporation (NASDAQ:NVDA) remains the single most important barometer for hedge fund confidence in the AI supercycle. The company recently raised its lifetime sales projection for its major chip systems, Blackwell and the upcoming Vera Rubin, to $1 trillion through 2027, up from a previous estimate of $500 billion. Hedge funds are front-running the 2026–2027 rollout of the Vera Rubin architecture, which promises a 35x increase in throughput per megawatt. This efficiency is critical as data centers hit physical power constraints. Hedge funds are also shifting their focus from AI training to AI inference, where NVIDIA is extending its moat. NVIDIA’s partnership with Groq to deliver 1,500+ tokens per second is a major draw. While we acknowledge the potential of NVDA as an investment, we believe certain AI stocks offer greater upside potential and carry less downside risk. If you're looking for an extremely undervalued AI stock that also stands to benefit significantly from Trump-era tariffs and the onshoring trend, see our free report on the best short-term AI stock. READ NEXT: 12 Best Stocks to Buy According to Billionaire David Abrams and 15 Best Stocks to Buy According to Billionaire Seth Klarman. Disclosure: None. Follow Insider Monkey on Google News. Tip: Try a valid symbol or a specific company name for relevant results",https://sg.finance.yahoo.com/news/nvidia-corporation-nvda-billionaire-steve-210029651.html
NVDA,Nvidia Is Down 20% From Its Peak. History Says This Is What Happens Next. - The Motley Fool,2026-04-03 18:03:24,"Nvidia is no stranger to being down from all-time highs. Nvidia (NVDA +0.87%) has been a top-performing stock every year since 2023. But 2026 looks to be a bit different. Nvidia hasn't done well in 2026 and is continuing its slide that started in October 2025. At the time of this writing, it's now down around 20% from its all-time high, and some investors may be starting to panic. Nvidia is no stranger to being down a significant amount from all-time highs, and history has a pretty clear indication of what's likely to happen next. I think this can give investors confidence in Nvidia's stock, as now is not the time to lose hope. Since 2023 (when the artificial intelligence (AI) arms race kicked off), Nvidia has been down 20% from its all-time high four times. Two of those were in back-to-back moments in 2024, the deepest sell-off was the tariff-induced panic of 2025, and the fourth is happening right now. The reasons behind each sell-off were different, but the result was the same: Nvidia achieved a new, all-time high six months later. Our experts' top-rated cash back card just got even better. For a limited time, earn a $250 bonus after spending just $500 in the first 3 months. Plus, earn unlimited cash back and pay 0% intro APR until well into 2027. Two factors are causing Nvidia's current sell-off. First, geopolitical instability caused by the war in Iran is negatively affecting the market's confidence. Investors are less likely to take on risk when they're unsure of the market's future. When our analyst team has a stock tip, it can pay to listen. After all, Stock Advisor’s total average return is 926%* — a market-crushing outperformance compared to 185% for the S&P 500. They just revealed what they believe are the 10 best stocks for investors to buy right now, available when you join Stock Advisor. Second, there are growing concerns surrounding the state of AI spending. 2026 is slated to be another year of record capital expenditures, even if the market would rather see some of that spending banked as cash rather than spent on AI. However, we've barely even scratched the surface of what's possible with AI, and we need a lot more compute. There are several projections indicating that elevated AI spending is needed through 2030 to achieve the goals of the AI hyperscalers, which indicates there could be huge growth beyond 2026. However, the market isn't pricing any of that optimism in. Nvidia trades at 19.9 times forward earnings -- its cheapest valuation over the past two years. For reference, the S&P 500 trades for 20.4 times forward earnings. Wall Street expects Nvidia to deliver 71% revenue growth this year and 30% next year, so clearly there is plenty of market-beating growth ahead for Nvidia. I think all this adds up to support the case that Nvidia can rebound to new all-time highs as long as AI spending stays elevated, which it likely will. Now is the perfect time to buy Nvidia's stock, as the bottom normally occurs when the outlook is most grim. The Motley Fool Stock Advisor analyst team just identified what they believe are the 10 best stocks for investors to buy now… and Nvidia wasn’t one of them. The 10 stocks that made the cut could produce monster returns in the coming years. Consider when Netflix made this list on December 17, 2004... if you invested $1,000 at the time of our recommendation, you’d have $532,066!* Or when Nvidia made this list on April 15, 2005... if you invested $1,000 at the time of our recommendation, you’d have $1,087,496!* Now, it’s worth noting Stock Advisor’s total average return is 926% — a market-crushing outperformance compared to 185% for the S&P 500. Don't miss the latest top 10 list, available with Stock Advisor, and join an investing community built by individual investors for individual investors. Keithen Drury has positions in Nvidia. The Motley Fool has positions in and recommends Nvidia. The Motley Fool has a disclosure policy. This tech could reach $80 trillion. Imagine a technology worth over 55 Metas. What in the world could be worth 55 Metas? The answer is a radical tech breakthrough that our experts think is transforming every walk of life. And this giant leap forward has many on Wall Street very excited. *Average returns of all recommendations since inception. Cost basis and return based on previous market day close. Our experts' top-rated cash back card just got even better. For a limited time, earn a $250 bonus after spending just $500 in the first 3 months. Plus, earn unlimited cash back and pay 0% intro APR until well into 2027. Invest better with The Motley Fool. Get stock recommendations, portfolio guidance, and more from The Motley Fool's premium services. © 1995 - 2026 The Motley Fool. All rights reserved. *Returns as of April 3, 2026. **$149 for 2 years is a promotional price for new members only. Renews at current list price of $199 after 2nd year.",https://www.fool.com/investing/2026/04/03/nvidia-is-down-20-from-its-peak-history-says-this/
NVDA,Why This Stock Could Outperform Nvidia Over the Next 5 Years - The Motley Fool,2026-04-03 16:14:27,"AI infrastructure is likely to have multiple winners, and the risk/reward profile for one could lead to Nvidia-beating returns. In this video, Motley Fool contributor Jason Hall makes the case for why Oracle (ORCL +0.74%) could outperform Nvidia (NVDA +0.87%) over the next five years, in part because companies like Broadcom (AVGO +0.29%), AMD (AMD +3.36%), and others could start taking up more share of the market for chips to power artificial intelligence. *Stock prices used were from the Morning of April 1, 2026. The video was published on April 3 2026. Jason Hall has positions in Nvidia. The Motley Fool has positions in and recommends Advanced Micro Devices, Nvidia, and Oracle. The Motley Fool recommends Broadcom. The Motley Fool has a disclosure policy. Jason Hall is an affiliate of The Motley Fool and may be compensated for promoting its services. If you choose to subscribe through their link they will earn some extra money that supports their channel. Their opinions remain their own and are unaffected by The Motley Fool. *Average returns of all recommendations since inception. Cost basis and return based on previous market day close. Invest better with The Motley Fool. Get stock recommendations, portfolio guidance, and more from The Motley Fool's premium services. © 1995 - 2026 The Motley Fool. All rights reserved.",https://www.fool.com/investing/2026/04/03/why-this-stock-could-outperform-nvidia-over-the-ne/
NVDA,Nvidia Corporation (NVDA) Sets Sights on Every Layer of AI Factory With NVIDIA Physical AI Data Factory Blueprint - Yahoo Finance,2026-04-03 15:45:37,"Tip: Try a valid symbol or a specific company name for relevant results NVIDIA Corporation (NASDAQ:NVDA) is one of the best blue-chip AI stocks to buy now. On March 16 at the GTC conference, NVIDIA Corporation (NASDAQ:NVDA) unveiled the NVIDIA Physical AI Data Factory Blueprint. The blueprint is part of the company’s push for state-of-the-art in world modeling, humanoid skills, and autonomous driving. The Omniverse DSX Blueprint unifies simulation across every layer of the AI factory using a single digital twin. It helps operators optimize performance and efficiency before real-world installation. NVIDIA aims to lower the cost and complexity of building modern AI factories through this simulation solution. The Physical AI Data Factory Blueprint also converts compute into high-quality, large-scale training data. The platform streamlines data curation, augmentation, and evaluation in a single pipeline. Microsoft Azure and Nebius are the first cloud providers to offer this turnkey data production engine. NVIDIA Corporation (NASDAQ:NVDA) leads in accelerated computing, designing GPUs and software for AI, data centers, gaming, and professional visualization. It dominates AI chip supply, powering generative AI, autonomous vehicles, and robotics. While we acknowledge the potential of NVDA as an investment, we believe certain AI stocks offer greater upside potential and carry less downside risk. If you're looking for an extremely undervalued AI stock that also stands to benefit significantly from Trump-era tariffs and the onshoring trend, see our free report on the best short-term AI stock. READ NEXT: Motley Fool’s 10 High-Growth Stock Picks and 7 Single-Digit Stocks With Double-Digit Growth Potential. Disclosure: None. Follow Insider Monkey on Google News. Tip: Try a valid symbol or a specific company name for relevant results",https://finance.yahoo.com/sectors/technology/articles/nvidia-corporation-nvda-sets-sights-154537483.html
NVDA,"NVDA, TSLA and INTC Forecasts – Tech Stocks Look Ready to Move? - FXEmpire",2026-04-03 13:43:00,"Major tech stocks closed on Friday, as they look close to making bigger moves. Keep in mind that it is Good Friday, so it’s not so much about the trading today, but when I look at these 3 major stocks, I do see potential for big moves. The 1st 1 is Nvidia, and this is a situation where it’s been a valuation versus growth tug of war scenario that we’re in. The Q4 revenue of $68.1 billion showed just how dominant Nvidia is in artificial intelligence and being dominant in that field, far outpacing all of its competitors. But trade tensions and new tariff policies are creating a situation where you may have to think beyond just China, which was a major driver, and that’s part of what’s punishing this stock. Strategic partnerships with Nokia and Marvell aim to diversify revenue towards 6G cellular and agentic AI. This is a market that has seen a significant recovery recently, and it looks like we are perhaps trying to reenter consolidation, which means we could get as high as $195, but we need some help from the geopolitical front. Maybe things calming down in the Middle East might put more risk appetite in the market to begin with. Tesla looks a bit tough at the moment. It is decoupling from its pure EV metrics as it evolves into an ecosystem holding company of sorts. The market is trying to price in the formalization of Tesla’s stake in SpaceX ahead of a massive June IPO. However, broader risk-off sentiment has been the major driver for Tesla at the moment. While I do think it bounces, I think you need to watch this stock. I’d be a bit cautious about getting too aggressive. The $350 level for me is another potential floor. I want to see a drop and then a bounce so I’ll buy the right-hand side of the V if you will. Intel is absolutely flying at the moment. It’s in the middle of a credibility turnaround. The $6.5 billion manufacturing deal with Apollo Global Management and a strategic lifeline investment from Nvidia have shifted sentiment from skepticism to optimism. The market is eyeing the Intel 18A process as a make-or-break milestone for the 2nd half of the year. It certainly looks as if it remains a buy-on-the-dip market and I think we will probably make a fresh new high here fairly soon. If it drops, I’m willing to buy it at the 1st sign of a bounce. If you’d like to know more about technical analysis and how traders use it, please visit our educational area. Chris is a proprietary trader with more than 20 years of experience across various markets, including currencies, indices and commodities. As a senior analyst at FXEmpire since the website’s early days, he offers readers advanced market perspectives to navigate today’s financial landscape with confidence. ZN, USD/JPY, USD/CHF and USD/HUF Forecasts – Dollar Trying to Drive Markets Gold Price Analysis – Gold Continues to See Headline Risks Silver Price Analysis – Silver Continues to Move Based on Rates Natural Gas Price Analysis – Natural Gas Continues to Drag Along Bottom Gold Weekly Price Analysis – Gold Continues to Fight Back Chris is a proprietary trader with more than 20 years of experience across various markets, including currencies, indices and commodities. As a senior analyst at FXEmpire since the website’s early days, he offers readers advanced market perspectives to navigate today’s financial landscape with confidence.",https://www.fxempire.com/forecasts/article/nvda-tsla-and-intc-forecasts-tech-stocks-look-ready-to-move-1589620
NVDA,Nvidia (NVDA) Stock Gains Momentum as H100 Rental Costs Jump 40% Amid Supply Crunch - MEXC,2026-04-03 12:40:00,"The cost of accessing Nvidia’s H100 GPU infrastructure continues its upward trajectory rather than declining. Hourly rental rates have surged approximately 40% since the fall, escalating from $1.70 to roughly $2.35 per hour, based on SemiAnalysis research encompassing feedback from over 100 market participants. Available GPU inventory has reached practical depletion. Organizations that locked in capacity during earlier periods are maintaining their positions despite escalating costs. Certain purchasers have turned to premium-tier spot availability through services like AWS to secure necessary resources. Supply limitations extend beyond legacy hardware. Nvidia’s latest Blackwell GPU architecture faces identical constraints, with procurement timelines now extending into mid-2026. This contradicts previous market assumptions that enhanced efficiency in next-generation chips would diminish both demand and pricing for existing products like the H100. The demand surge stems from diverse AI deployment scenarios, spanning media generation platforms at organizations including ByteDance and Google to expanding adoption of large language models such as Anthropic’s Claude. Underlying the capacity shortage is substantial committed capital investment. Alphabet, Microsoft, Meta, and Amazon collectively plan approximately $700 billion in AI infrastructure expenditure during 2026 alone. These figures represent publicly disclosed capital allocation strategies, not speculative forecasts. Microsoft has disclosed that roughly two-thirds of its capital deployment targets GPUs and CPUs. Given Nvidia’s dominant 85-90% share of the GPU sector, the majority of this investment flows directly to Nvidia. Even assuming chips represent only 20% of comprehensive AI infrastructure expenses, this suggests over $140 billion in annual chip procurement from merely four major customers. Nvidia reported Q4 revenues of $68.13 billion, reflecting 73% year-over-year expansion, while its Q1 forecast of $78 billion exceeded analyst expectations by more than $5 billion. Fiscal 2027 revenue growth currently projects 71%. Despite strong fundamentals, NVDA has declined roughly 6.5% year-to-date, impacted by broader macroeconomic headwinds including energy inflation concerns and market risk aversion. Current valuation stands at 15.7x forward earnings — below both its 3-year historical mean of 19.4x and AMD’s forward multiple of 18.9x, despite Nvidia’s superior market position, margins, and growth trajectory. A significant catalyst not yet reflected in financial projections: Chinese regulatory authorities have greenlit Nvidia for H100 chip distribution, with authorization granted to several customers. Wells Fargo analysts estimate this opportunity could generate $25 billion or more annually. This revenue potential remains excluded from Nvidia’s latest guidance. Regarding product development, the forthcoming Vera Rubin platform achieves ten-fold performance-per-watt improvement over Blackwell and approximately 50-fold tokens-per-watt enhancement compared to the earlier Hopper architecture. Distribution is scheduled to commence during the second half of 2026. Nvidia completed a $2 billion equity position in Marvell Technology (MRVL) on March 31, extending its NVLink ecosystem access to Marvell’s customized AI processors — currently deployed by Amazon, Alphabet, and Microsoft. NVDA appreciated over 5% following that announcement, while Marvell surged 13%. Wall Street maintains a Strong Buy consensus on NVDA, featuring 41 Buy recommendations, one Hold, and one Sell rating across the past three months. The average analyst price target registers at $273.57. The post Nvidia (NVDA) Stock Gains Momentum as H100 Rental Costs Jump 40% Amid Supply Crunch appeared first on Blockonomi. Ripple classified by Russian intelligence as IMF-dependent; IMF acknowledges tokenization's financial impact, signaling institutional shifts. Author: Ripple Bull Winkle | Crypto Researcher 🚀🚨01:02 Daily optimism shared, highlighting $BTC and other tokens, reflecting market anticipation. Japan and South Korea adopt XRP Ledger for cross-border remittance, highlighting global development outside US regulatory focus. Author: Ripple Bull Winkle | Crypto Researcher 🚀🚨2026/04/03 23:02 Trump's crypto advisor hints at new U.S. payment system; XRP mentioned as central component. Ripple's assets grew significantly, driven by institutional infrastructure, indicating strong market interest and development potential. Author: Ripple Bull Winkle | Crypto Researcher 🚀🚨2026/04/03 22:02",https://www.mexc.com/news/1002560
NVDA,Nvidia's AI Chip Demand Drives Higher Rental Prices - TradingView,2026-04-03 12:34:38,"Nvidia (NVDA, Financials) is seeing something unusual even as newer, more advanced chips arrive, prices for its older ones are still going up. Rental costs for its H100 GPUs have climbed nearly 40% since last October, rising to about $2.35 per hour. That is happening because demand is simply overwhelming supply. In many cases, companies that already secured access are holding onto it, leaving little available for others. What makes this interesting is that the usual pattern is not playing out. Typically, when newer chips launch, older models become cheaper. But here, demand for AI computing is so strong that even older hardware is staying in high demand. And it is not just the H100. Nvidia's newer Blackwell chips are also facing long wait times, stretching into mid-2026. That suggests the issue is not about one product it is about a broader shortage of AI computing power. A big part of this is how AI is being used. As tools like chatbots and media generation grow, companies are using more computing, not less. Efficiency gains are not reducing demand they are accelerating it. For investors, the takeaway is pretty clear: AI demand is still running ahead of supply, and that imbalance is keeping pressure on prices. Select market data provided by ICE Data Services. Select reference data provided by FactSet. Copyright © 2026 FactSet Research Systems Inc.Copyright © 2026, American Bankers Association. CUSIP Database provided by FactSet Research Systems Inc. All rights reserved. SEC fillings and other documents provided by Quartr.© 2026 TradingView, Inc.",https://www.tradingview.com/news/gurufocus:0e57d8fbf094b:0-nvidia-s-ai-chip-demand-drives-higher-rental-prices/
