ticker,title,date,content,url
NVDA,$NVIDIA (NVDA.US)$ What you think of it? - Moomoo,2026-04-19 16:58:41,"To create a seamless experience and for website quality and improvement purposes, we use cookie technologies for verification and quality purposes, to personalize the content presented, and to provide advertising that may be of specific interest to you. Learn our Privacy Policy here.",https://www.moomoo.com/community/feed/nvidia-nvda-us-what-you-think-of-it-116432432070662
NVDA,Will Nvidia Be Worth $6 Trillion a Year From Now? Wall Street Has a Clear Answer. - The Globe and Mail,2026-04-19 16:52:36,"Nvidia stock has been under pressure in recent months. An acceleration in earnings growth could send it soaring once again. There is a good chance Nvidia will exceed Wall Street's price targets and achieve a significantly larger market cap. Shares of artificial intelligence (AI) chip pioneer Nvidia(NASDAQ: NVDA) have hit a plateau in the past six months. The semiconductor giant's stock price has retreated nearly 4% from the 52-week high it reached in late October, which is quite surprising given that the business continues to deliver phenomenal growth each quarter. Nvidia became the world's first $5 trillion company in October. However, its tepid stock market performance since then has brought its market cap down to $4.8 trillion. But it won't be surprising to see Nvidia stock step on the gas once again and jump significantly in the coming year. That's what the consensus among Wall Street analysts seems to be. Will AI create the world's first trillionaire? Our team just released a report on the one little-known company, called an ""Indispensable Monopoly"" providing the critical technology Nvidia and Intel both need. Continue » In fact, Nvidia's market cap could exceed $6 trillion in the coming year. Among the 70 analysts covering the stock, Nvidia has a 12-month median price target of $267.50. That's 33% higher than Friday's closing price. If Nvidia indeed meets its median price target over the next year, its market cap could increase to $6.5 trillion. What's more, Nvidia stock is rated a buy by 93% of the analysts covering it. So Wall Street seems bullish about Nvidia's prospects in the coming year. That's not surprising, as the stock's pullback in recent months wasn't justifiable considering the company's outstanding growth. Indeed, Nvidia's valuation clearly suggests that it hasn't been rewarded enough for its growth. It trades at a forward price-to-earnings ratio of 24, a tad higher than the S&P 500 index's forward earnings multiple of 21. But then, the 74% earnings growth that Nvidia is expected to clock this year is well above the 17% average earnings growth expected from S&P 500 companies. Its earnings growth estimate of 34% for fiscal 2028 is also double the index's estimated earnings growth. As a result, Nvidia deserves a premium valuation, especially given the strong demand for its AI data center processors. Nvidia reported $216 billion in revenue in its fiscal 2026 (which ended on Jan. 25). The data center business contributed $193.7 billion of that sum. The company now anticipates that it will bring in a whopping $1 trillion in revenue from sales of its Blackwell and Vera Rubin data center lines in calendar 2026 and 2027. That points toward a significant bump in Nvidia's top line. In fact, the $1 trillion pipeline exceeds the revenue analysts expect from Nvidia over the next two years. NVDA Revenue Estimates for Current Fiscal Year data by YCharts. So, it won't be surprising to see Nvidia's growth exceeding Wall Street's expectations. The company is anticipated to deliver $11.12 in earnings per share in its fiscal 2028 (which will cover the majority of calendar 2027). If it trades at 30 times earnings at that time, a well-deserved premium to the S&P 500's average multiple, its stock price could hit $333. That would be a 67% jump from current levels, which would take Nvidia's market cap just past the $8 trillion mark. That's why investors should consider buying this AI stock, as it could soon emerge from its rut and become much more valuable than it is now. The Motley Fool Stock Advisor analyst team just identified what they believe are the 10 best stocks for investors to buy now… and Nvidia wasn’t one of them. The 10 stocks that made the cut could produce monster returns in the coming years. Consider when Netflix made this list on December 17, 2004... if you invested $1,000 at the time of our recommendation, you’d have $524,786!* Or when Nvidia made this list on April 15, 2005... if you invested $1,000 at the time of our recommendation, you’d have $1,236,406!* Now, it’s worth noting Stock Advisor’s total average return is 994% — a market-crushing outperformance compared to 199% for the S&P 500. Don't miss the latest top 10 list, available with Stock Advisor, and join an investing community built by individual investors for individual investors. Harsh Chauhan has no position in any of the stocks mentioned. The Motley Fool has positions in and recommends Nvidia. The Motley Fool has a disclosure policy. All market data (will open in new tab) is provided by Barchart Solutions. Copyright © 2026. Information is provided 'as is' and solely for informational purposes, not for trading purposes or advice. For exchange delays and terms of use, please read disclaimer (will open in new tab).",https://www.theglobeandmail.com/investing/markets/stocks/NVDA/pressreleases/1390663/will-nvidia-be-worth-6-trillion-a-year-from-now-wall-street-has-a-clear-answer/
NVDA,The Best AI Stock to Buy Now: Micron vs. Nvidia - The Motley Fool,2026-04-19 13:15:00,"Nvidia and Micron have delivered monster returns in recent years. Nvidia (NVDA +1.67%) has been the star of the show since the artificial intelligence (AI) build-out began in 2023. Its stock has risen 1,240% (and counting) since then, but it has been fairly stagnant over the past few months. The stock is only up 9% in the past six months, although it has rallied a significant amount over the past few weeks. In its place, Micron (MU 0.61%) has provided much better performance. Over the past six months, its stock has risen 150%. Since 2023, it has risen 830%. While not quite as impressive as Nvidia's rise, it's still a pretty eye-popping return in just a few years. The question is, which one of these two is the best AI stock moving forward? After all, each is integral to the continuous success of AI. Nvidia and Micron are not competitors. In fact, Nvidia is a client of Micron's. Nvidia makes GPUs (graphics processing units), the most widely used computing units for training and running AI models. GPUs are special because they can process multiple calculations in parallel, but to do this, they need memory chips. Micron makes memory chips, ranging from those used in a cellphone to high-bandwidth memory (HBM) chips used in AI. Unlike Nvidia's GPUs, which can differentiate themselves from the competition with performance increases, memory chips are fairly commoditized. There isn't a lot that separates Micron's products from its peers, so it operates in more of a commoditized market. Commodities see their price rise when demand is great and supply is short, and that's exactly where memory chips find themselves. During its latest conference call, Micron noted that it can only fulfill about half to two-thirds of demand in the medium term. That's a major limitation and showcases how in demand memory is. So, memory chip prices will stay elevated in the meantime, which will lead to booming growth for Micron. You'll find few investors who have a gripe with Nvidia's growth rates. In Q4, it delivered 73% year-over-year growth, and Wall Street analysts expect 79% growth in Q1 and 85% in Q2. That underscores the need for Nvidia's GPUs, but Micron's growth rate is far faster. Two quarters ago, Micron's revenue totaled $13.6 billion. In its last quarter, it was up to $23.9 billion. Next quarter, they estimate $33.5 billion in revenue. Essentially, Micron's revenue grew 150% in nine months. This is simply an incredible growth rate and outpaces Nvidia's by far. But revenue growth isn't everything; investors must also consider valuation. Because both companies are growing at such a rapid pace, using a forward-looking metric makes the most sense. From this standpoint, Micron's stock looks far cheaper than Nvidia's. While Micron's stock looks like it trades for a third of the price of Nvidia's, the reason for this gap is the cyclical nature of Micron's business. Micron and its peers are racing to bring online new production capacity, which will decrease the price of memory by flooding the market with supply. That may not happen for a few years, so Micron could still be growing rapidly for years to come. So, which one is the better investment? All signs point to Micron, and I think that Micron will likely have a better one-year performance than Nvidia. However, Nvidia looks like a far better investment over the long term, as its GPUs will still be in demand long after the memory supply crunch is sorted out. Together, I think they make up important components of a well-diversified AI investing portfolio, and both can make sense for all investors. Still, you must keep a close eye on memory prices if you're going to invest in Micron. Keithen Drury has positions in Nvidia. The Motley Fool has positions in and recommends Micron Technology and Nvidia. The Motley Fool has a disclosure policy. *Average returns of all recommendations since inception. Cost basis and return based on previous market day close. Invest better with The Motley Fool. Get stock recommendations, portfolio guidance, and more from The Motley Fool's premium services. © 1995 - 2026 The Motley Fool. All rights reserved.",https://www.fool.com/investing/2026/04/19/the-best-ai-stock-to-buy-now-micron-vs-nvidia/
NVDA,Nvidia Is Nearly The Same Price as the S&P 500. It's Time to Load Up on Shares. - AOL.com,2026-04-19 13:13:32,"The stock is barely priced at a premium to the broader market despite much faster growth rates. Most of the time, high-growth, high-quality companies trade at a premium to the market. That's because the market thinks that it can depend on the stock to outperform. When companies that used to have this premium lose it, investors need to pay attention. It could be a sign of shifting sentiment, or it could be a massive buying opportunity. One company that's finding itself in this situation is Nvidia (NASDAQ: NVDA). Are there cracks in its business? Or is something else going on here? Will AI create the world's first trillionaire? Our team just released a report on the one little-known company, called an ""Indispensable Monopoly"" providing the critical technology Nvidia and Intel both need. Continue » Nvidia makes GPUs, which are the primary computing unit deployed in accelerated computing situations, like AI training and inference. Nvidia holds the largest market share by far, and with all of the elevated spending amounts from the AI hyperscalers, business is good for Nvidia. It's so good that it's posting the fastest growth rates any trillion-dollar company has ever seen. During its last quarter, revenue was up 73%, and management projects another 77% gain in the current quarter. With growth like that, it's hard to say that Nvidia's business is struggling. So, why does it trade at about the same price tag as the S&P 500 (SNPINDEX: ^GSPC)? I think it has to do with investors' AI fatigue. Investors aren't as bullish on AI as they once were. While they can see the innovations and breakthroughs, they haven't seen the cash flows they'd like for all of the money being spent. As a result, they're turning a bit bearish on all of the AI spending. This might be an effort to convince management teams that spending as much as they can on AI isn't the preferred strategy, but that's not necessarily what will happen. Overspending on AI computing capacity is far less risky than underspending. AI could wipe out companies if they do not evolve, which is why there is so much spending going on. Nvidia and others have noted that massive AI build-outs are likely to occur through at least 2030, so there is still plenty of time for Nvidia to be a fantastic stock to own. But just how much of a deal is it right now? With all of the massive growth Nvidia is seeing, valuing the stock using the forward price-to-earnings method is the best idea. From this standpoint, Nvidia trades for about 21.5 times earnings estimates versus the S&P 500's 20.3. That essentially tells investors that after 2026 is over, Nvidia will be about a market-average stock. However, with all of the massive growth plans the AI hyperscalers have, I don't think this will be the case. As a result, it's time to scoop up shares of Nvidia as the stock seldom gets this cheap. The Motley Fool Stock Advisor analyst team just identified what they believe are the 10 best stocks for investors to buy now… and Nvidia wasn’t one of them. The 10 stocks that made the cut could produce monster returns in the coming years. Consider when Netflix made this list on December 17, 2004... if you invested $1,000 at the time of our recommendation, you’d have $550,348!* Or when Nvidia made this list on April 15, 2005... if you invested $1,000 at the time of our recommendation, you’d have $1,127,467!* Now, it’s worth noting Stock Advisor’s total average return is 959% — a market-crushing outperformance compared to 191% for the S&P 500. Don't miss the latest top 10 list, available with Stock Advisor, and join an investing community built by individual investors for individual investors. Keithen Drury has positions in Nvidia. The Motley Fool has positions in and recommends Nvidia. The Motley Fool has a disclosure policy.",https://www.aol.com/articles/nvidia-nearly-same-price-p-013400470.html?utm_source=rswebsols.com
NVDA,"Stock Price Roundup: NVDA, AAPL, MSFT, AMZN and META Head Into Big Earnings Week - foreignpolicyjournal.com",2026-04-19 08:35:22,"By Ewan Scott | Apr 19, 2026 | Featured, News & Analysis, US The Nasdaq Composite closed at 24,468 on Friday April 17, up 1.52 percent on the session and sitting comfortably at record territory, with the index extending a winning run that has become one of the more striking market stories of 2026 as geopolitical optimism around the Iran conflict converges with a strong corporate earnings backdrop to push technology stocks back toward their all-time highs. The five largest Nasdaq components by market capitalisation all closed higher on Friday, with four of them set to report first-quarter results within the next two weeks in what promises to be the most consequential earnings period of the year for investors with exposure to the AI infrastructure theme. Nvidia closed Friday at $201.68, extending its winning streak to eleven consecutive sessions, a run that represents the stock’s longest consecutive daily gain sequence on record and reflects a broad reassessment by institutional investors of the valuation case for the world’s dominant AI chip maker. The stock has essentially doubled from its April lows as the combination of peace hopes in the Middle East, strong TSMC quarterly data and continued hyperscaler capital expenditure commitments has restored confidence in the AI infrastructure cycle. Nvidia’s own quarterly report is scheduled for May 20, with analysts expecting the company to guide for approximately $78 billion in first-quarter fiscal 2027 revenue based on its prior commitments, a figure that would represent further acceleration from the $215.9 billion full-year fiscal 2026 revenue the company has already booked. At current levels the stock trades at roughly 22 times forward earnings, which analysts at several firms have described as the cheapest forward multiple since the AI rally began in earnest in 2023. Apple shares gained 2.59 percent on Friday to close at $270.23, participating in the broad technology rally as the Iran conflict’s apparent de-escalation lifted sentiment across the sector. The stock is navigating a somewhat unusual earnings setup, with the iPhone 17 launch in September having received strongly positive reviews and driving expectations of an above-average cycle, while broader macro uncertainty around energy costs and consumer spending has kept analysts cautious about the rate at which services revenue growth can absorb any softness in hardware volumes. Apple’s quarterly report is due April 29 alongside Microsoft, Alphabet and Amazon, with the consensus position projecting continued strength in the high-margin Services segment, which analysts expect to approach $26.7 billion for the quarter. The stock’s year-to-date performance has been somewhat muted relative to its large-cap technology peers, reflecting in part the company’s relatively conservative disclosed capital expenditure commitments on AI compared to the hyperscaler group, a posture that has led some analysts to question whether Apple is moving fast enough to integrate AI capabilities into its core product lines. Microsoft added 0.60 percent on Friday to settle at $422.79, a level that leaves the stock more than 30 percent below its all-time high and trading at a forward earnings multiple analysts at the Motley Fool have described as the cheapest since 2017, a valuation gap that has attracted significant institutional attention ahead of the April 29 earnings report. The company’s fiscal third-quarter results will be dissected primarily for Azure cloud revenue growth, which management has guided in the 37 to 38 percent range in constant-currency terms, and for any update on the adoption trajectory of Microsoft 365 Copilot, the AI-powered productivity suite priced at $30 per user per month that represents the company’s primary near-term AI monetisation vehicle. Forty-one of the 49 analysts covering the stock carry a Strong Buy recommendation, with a consensus price target of $589.95 implying more than 58 percent upside from current levels, one of the wider disconnects between institutional consensus and market price among any large-cap technology name globally. The stock’s underperformance relative to the broader Nasdaq has puzzled some investors given the operational consistency of the business, with Azure growing 39 percent year on year in the most recent quarter and the company beating earnings estimates in each of the last four reporting periods. Amazon gained a more modest 0.34 percent on Friday to close at $250.56, with the stock continuing to trade in a relatively tight range as investors position cautiously ahead of the April 29 earnings report, which will be scrutinised primarily for the trajectory of AWS cloud revenue growth and for any indication of whether the company’s aggressive capital expenditure commitments — guided at $125 billion for 2026 — are beginning to generate the operating leverage that analysts have been waiting for. AWS grew 24 percent in the fourth quarter of 2025, its fastest pace in 13 quarters, and the AI revenue run rate from cloud services has now crossed $15 billion annually, a figure that underpins the bullish case for a stock that trades at approximately 22 times forward earnings when stripped of the retail and advertising segments. Management commentary on the Amazon Bedrock platform and the company’s competitive positioning relative to Microsoft Azure and Google Cloud will be closely watched, with any acceleration above the consensus expectation of 20 percent or better AWS growth likely to provide a meaningful catalyst for the stock in the sessions following the report. Meta was the one exception to Friday’s broad rally among the mega-cap Nasdaq names, slipping 0.82 percent to close at $676.87, though the move was modest rather than alarming and the stock remains well positioned ahead of its own April 29 earnings report with a consensus of zero sell ratings across 42 covering analysts and a mean price target of $847.70 implying more than 25 percent upside. The company heads into the quarter with the AI-powered Advantage+ advertising suite at a reported $60 billion annual run rate, daily active people across the family of apps sitting at 3.58 billion and growing at 7 percent year on year, and the March 31 launch of Instagram Plus adding a new subscription revenue dimension that will not move the needle in Q1 but represents a strategic direction investors will want to hear more about. The April 14 announcement of a commitment to deploy one gigawatt of custom MTIA chips built with Broadcom on a 2-nanometer process was broadly interpreted as a positive signal about Meta’s ability to reduce its long-term silicon cost structure, though the full financial benefit of that shift remains a 2027 and beyond story rather than an immediate earnings catalyst. The Nasdaq’s broader technical position heading into the week ahead is one of the stronger setups the index has presented in 2026, with the 13-day winning streak prior to this week’s record close having already been described as historically unusual, and with the VIX volatility index sitting at 17.48, comfortably below the levels that have historically coincided with sustained market stress. Whether the earnings prints from Microsoft, Amazon, Meta, Alphabet and Tesla over the next ten days can validate the record prices the market is pricing in remains the central question for technology investors as April draws to a close. Ewan is a reporter at the Foreign Policy Journal, primarily covering US current affairs and news related to NYSE-listed stocks.",https://www.foreignpolicyjournal.com/2026/04/19/stock-price-roundup-nvda-aapl-msft-amzn-and-meta-head-into-big-earnings-week/
