ticker,title,date,content,url
NVDA,Jim Cramer Notes That NVIDIA’s PE “Makes No Sense at All” - insidermonkey.com,2026-04-03 09:12:40,"Our #1 AI Stock Pick — 33% OFF: $9.99 (was $14.99)  Monthly picks · Ad-free browsing · 30-day money back guarantee Our #1 AI Stock Pick — 33% OFF: $9.99 (was $14.99)  Monthly picks · Ad-free browsing NVIDIA Corporation (NASDAQ:NVDA) is among the stocks in focus as Jim Cramer highlighted a market yearning for the status quo ante. Cramer highlighted the company’s recent deal with Marvell. The Mad Money host commented: Today, the action in the growth stocks say, well, this is what things were going to look like. I want to start with two companies I just talked to on Squawk on the Street this morning, NVIDIA and Marvell Tech. Today, NVIDIA decided to give Marvell $2 billion… as the two agreed to work together on an AI infrastructure plan. Remember, there’s much more to NVIDIA than just chips. There’s a whole software ecosystem, and companies that use Marvell for a portion of their networking can use NVIDIA, too. It’s a smart move for NVIDIA to get companies that don’t use NVIDIA to migrate to their platform. Of course, Marvell benefits, too. NVIDIA rallied 5.6%. Marvell shot up 13%. Talk about multiple compression. At the bottom today, I think NVIDIA stock was trading at 14 times earnings. That’s the PE of a boring old bank stock with bad credits. How could NVIDIA be confused with a boring old bank stock with bad credit? It makes no sense at all. NVIDIA Corporation (NASDAQ:NVDA) develops accelerated computing and AI platforms, GPUs for gaming and professional use, cloud services, robotics and embedded systems, and automotive technologies. While we acknowledge the risk and potential of NVDA as an investment, our conviction lies in the belief that some AI stocks hold greater promise for delivering higher returns and doing so within a shorter time frame. If you are looking for an AI stock that is more promising than NVDA and that has 10,000% upside potential, check out our report about this cheapest AI stock. READ NEXT: 33 Stocks That Should Double in 3 Years and 15 Stocks That Will Make You Rich in 10 Years Disclosure: None. Follow Insider Monkey on Google News. Returns since its inception in May 2014 (through February 18th, 2026) Get our editor’s daily picks straight in your inbox!",https://www.insidermonkey.com/blog/jim-cramer-notes-that-nvidias-pe-makes-no-sense-at-all-1731444/
NVDA,Kathmere Capital Management LLC Has $13.35 Million Stake in NVIDIA Corporation $NVDA - MarketBeat,2026-04-03 09:12:11,"Kathmere Capital Management LLC grew its stake in  NVIDIA Corporation (NASDAQ:NVDA - Free Report) by 14.9% in the fourth quarter, according to its most recent disclosure with the Securities and Exchange Commission (SEC). The fund owned 71,589 shares of the computer hardware maker's stock after buying an additional 9,308 shares during the period. NVIDIA makes up  approximately  0.9% of Kathmere Capital Management LLC's holdings, making the stock its 27th biggest position. Kathmere Capital Management LLC's holdings in NVIDIA were worth $13,351,000 as of its most recent SEC filing. Several other large investors also recently made changes to their positions in the stock. Joule Financial LLC boosted its position in  NVIDIA by 2.2% during the third quarter. Joule Financial LLC now owns 2,308 shares of the computer hardware maker's stock worth $431,000 after purchasing an additional 50 shares during the period.  Vision Financial Markets LLC raised its position in shares of  NVIDIA by 1.2% in the third quarter. Vision Financial Markets LLC now owns 4,640 shares of the computer hardware maker's stock valued at $866,000 after purchasing an additional 53 shares during the period.  Websterrogers Financial Advisors LLC raised its position in shares of  NVIDIA by 2.6% in the third quarter. Websterrogers Financial Advisors LLC now owns 2,118 shares of the computer hardware maker's stock valued at $395,000 after purchasing an additional 54 shares during the period.  IMG Wealth Management Inc. lifted its stake in shares of  NVIDIA by 1.4% in the third quarter. IMG Wealth Management Inc. now owns 3,820 shares of the computer hardware maker's stock worth $713,000 after buying an additional 54 shares during the last quarter.  Finally, Cyr Financial Inc. boosted its holdings in shares of  NVIDIA by 0.7% during the 3rd quarter. Cyr Financial Inc. now owns 7,737 shares of the computer hardware maker's stock worth $1,444,000 after buying an additional 54 shares during the period. Institutional investors own  65.27% of the company's stock. In other NVIDIA news, Director Mark A. Stevens sold 221,682 shares of NVIDIA stock in a transaction on Friday, March 20th. The shares were sold at an average price of $173.68, for a total transaction of $38,501,729.76. Following the sale, the director owned 7,399,771 shares in the company, valued at $1,285,192,227.28. The trade was a 2.91% decrease in their ownership of the stock. The transaction was disclosed in a filing with the Securities & Exchange Commission, which is available at this link. Also, Director John Dabiri sold 3,004 shares of the stock in a transaction on Friday, March 13th. The shares were sold at an average price of $184.90, for a total transaction of $555,439.60. Following the completion of the transaction, the director owned 14,788 shares of the company's stock, valued at approximately $2,734,301.20. This represents a 16.88% decrease in their position. The SEC filing for this sale provides additional information. Insiders sold a total of 1,401,616 shares of company stock valued at $253,555,407 in the last quarter. 4.17% of the stock is currently owned by corporate insiders. Shares of NVDA opened at $177.39 on Friday. The company has a debt-to-equity ratio of 0.05, a quick ratio of 3.24 and a current ratio of 3.91. The company has a 50-day simple moving average of $182.62 and a 200-day simple moving average of $184.17. NVIDIA Corporation has a 52 week low of $86.62 and a 52 week high of $212.19. The firm has a market capitalization of $4.31 trillion, a P/E ratio of 36.20, a P/E/G ratio of 0.59 and a beta of 2.34. NVIDIA (NASDAQ:NVDA - Get Free Report) last released its earnings results on Wednesday, February 25th. The computer hardware maker reported $1.62 earnings per share for the quarter, topping analysts' consensus estimates of $1.54 by $0.08. NVIDIA had a return on equity of 97.37% and a net margin of 55.60%.The business had revenue of $68.13 billion for the quarter, compared to the consensus estimate of $65.56 billion. During the same period last year, the business earned $0.89 earnings per share. The firm's revenue for the quarter was up 73.2% compared to the same quarter last year.  On average, equities research analysts expect that  NVIDIA Corporation will post 2.77 earnings per share for the current year. The company also recently disclosed a quarterly dividend, which was paid on Wednesday, April 1st. Stockholders of record on Wednesday, March 11th were given a dividend of $0.01 per share. The ex-dividend date was Wednesday, March 11th. This represents a $0.04 dividend on an annualized basis and a dividend yield of 0.0%. NVIDIA's payout ratio is currently 0.82%. A number of research firms recently issued reports on NVDA. Piper Sandler  reiterated an ""overweight"" rating on shares of NVIDIA in a research note on Thursday, February 26th. Jefferies Financial Group  restated a ""buy"" rating and set a $275.00 price target (up from $250.00) on shares of NVIDIA in a report on Friday, January 16th. Wedbush raised their price target on NVIDIA from $230.00 to $300.00 and gave the company an ""outperform"" rating in a research report on Tuesday, March 3rd. TD Cowen  reiterated a ""buy"" rating and issued a $235.00 price objective on shares of NVIDIA in a research note on Tuesday, March 17th. Finally, Itau BBA Securities  reissued a ""market perform"" rating on shares of NVIDIA in a research report on Thursday, February 26th. Four equities research analysts have rated the stock with a Strong Buy rating, forty-seven have given a Buy rating and two have assigned  a Hold rating to the company. According to data from MarketBeat.com, the stock presently has a consensus rating of ""Buy"" and an average price target of $275.25. Here are the key news stories impacting NVIDIA this week: NVIDIA Corporation, founded in 1993 and headquartered in Santa Clara, California, is a global technology company that designs and develops graphics processing units (GPUs) and system-on-chip (SoC) technologies. Co-founded by Jensen Huang, who serves as president and chief executive officer, along with Chris Malachowsky and Curtis Priem, NVIDIA has grown from a graphics-focused chipmaker into a broad provider of accelerated computing hardware and software for multiple industries. The company's product portfolio spans discrete GPUs for gaming and professional visualization (marketed under the GeForce and NVIDIA RTX lines), high-performance data center accelerators used for AI training and inference (including widely adopted platforms such as the A100 and H100 series), and Tegra SoCs for automotive and edge applications. Want to see what other hedge funds are holding NVDA? Visit HoldingsChannel.com to get the latest 13F filings and insider trades for NVIDIA Corporation (NASDAQ:NVDA - Free Report). This instant news alert was generated by narrative science technology and financial data from MarketBeat in order to provide readers with the fastest reporting and unbiased coverage. Please send any questions or comments about this story to contact@marketbeat.com. Before you consider NVIDIA, you'll want to hear this. MarketBeat keeps track of Wall Street's top-rated and best performing research analysts and the stocks they recommend to their clients on a daily basis. MarketBeat has identified the five stocks that top analysts are quietly whispering to their clients to buy now before the broader market catches on... and NVIDIA wasn't on the list. While NVIDIA currently has a Buy rating among analysts, top-rated analysts believe these five stocks are better buys. Looking for the next FAANG stock before everyone has heard about it? Click the link to see which stocks MarketBeat analysts think might become the next trillion dollar tech company. Sign up for MarketBeat All Access to gain access to MarketBeat's full suite of research tools. 345 N Reid Place, Suite 620, Sioux Falls, SD 57103
                                        
                                        contact@marketbeat.com
                                        
                                        (844) 978-6257 © MarketBeat Media, LLC 2010-2026. All rights reserved. © 2026   Fair market value prices are updated every minute and are provided by Massive. Other market data provided is at least 10-minutes delayed and hosted by Barchart Solutions.  Information is provided 'as-is' and solely for informational purposes, not for trading purposes or advice, and is delayed. To see all exchange delays and terms of use please see Barchart's disclaimer. We and our partners share information on your use of this website to help improve your experience. For more information, or to opt out click the Do Not Sell My Information button below.",https://www.marketbeat.com/instant-alerts/filing-kathmere-capital-management-llc-has-1335-million-stake-in-nvidia-corporation-nvda-2026-04-03/
NVDA,NVIDIA Corporation $NVDA is Norden Group LLC's 3rd Largest Position - MarketBeat,2026-04-03 09:12:07,"Norden Group LLC lifted its position in  NVIDIA Corporation (NASDAQ:NVDA - Free Report) by 8.5% during the 4th quarter, according to the company in its most recent Form 13F filing with the SEC. The institutional investor  owned 241,884 shares of the computer hardware maker's stock after buying an additional 18,898 shares during the period. NVIDIA comprises  4.4% of Norden Group LLC's portfolio, making the stock its 3rd largest holding. Norden Group LLC's holdings in NVIDIA were worth $45,112,000 at the end of the most recent reporting period. Other institutional investors have also recently made changes to their positions in the company. Joule Financial LLC boosted its stake in  NVIDIA by 2.2% during the 3rd quarter. Joule Financial LLC now owns 2,308 shares of the computer hardware maker's stock valued at $431,000 after purchasing an additional 50 shares during the last quarter.  Vision Financial Markets LLC raised its stake in shares of  NVIDIA by 1.2% in the third quarter. Vision Financial Markets LLC now owns 4,640 shares of the computer hardware maker's stock worth $866,000 after purchasing an additional 53 shares during the last quarter.  Websterrogers Financial Advisors LLC lifted its holdings in shares of  NVIDIA by 2.6% during the third quarter. Websterrogers Financial Advisors LLC now owns 2,118 shares of the computer hardware maker's stock valued at $395,000 after purchasing an additional 54 shares in the last quarter.  IMG Wealth Management Inc. boosted its position in shares of  NVIDIA by 1.4% during the third quarter. IMG Wealth Management Inc. now owns 3,820 shares of the computer hardware maker's stock valued at $713,000 after buying an additional 54 shares during the last quarter.  Finally, Cyr Financial Inc. increased its holdings in  NVIDIA by 0.7% in the 3rd quarter. Cyr Financial Inc. now owns 7,737 shares of the computer hardware maker's stock worth $1,444,000 after buying an additional 54 shares in the last quarter. Hedge funds and other institutional investors own  65.27% of the company's stock. Here are the key news stories impacting NVIDIA this week: NVDA has been the subject of a number of recent analyst reports. Macquarie Infrastructure raised NVIDIA to an ""outperform"" rating in a research report on Monday, December 29th. Sanford C. Bernstein lifted their price target on shares of NVIDIA from $275.00 to $300.00 and gave the stock an ""outperform"" rating in a research note on Thursday, February 26th. Itau BBA Securities  reiterated a ""market perform"" rating on shares of NVIDIA in a research note on Thursday, February 26th. Truist Financial boosted their price objective on shares of NVIDIA from $283.00 to $287.00 and gave the company a ""buy"" rating in a report on Wednesday, March 18th. Finally, Benchmark  restated a ""buy"" rating and issued a $250.00 target price on shares of NVIDIA in a report on Tuesday. Four equities research analysts have rated the stock with a Strong Buy rating, forty-seven have given a Buy rating and two have given a Hold rating to the company. According to MarketBeat, NVIDIA currently has a consensus rating of ""Buy"" and an average price target of $275.25. NASDAQ NVDA opened at $177.39 on Friday. NVIDIA Corporation has a 52 week low of $86.62 and a 52 week high of $212.19. The firm has a market capitalization of $4.31 trillion, a P/E ratio of 36.20, a PEG ratio of 0.59 and a beta of 2.34. The company has a quick ratio of 3.24, a current ratio of 3.91 and a debt-to-equity ratio of 0.05. The company has a 50-day moving average price of $182.62 and a 200-day moving average price of $184.17. NVIDIA (NASDAQ:NVDA - Get Free Report) last posted its quarterly earnings data on Wednesday, February 25th. The computer hardware maker reported $1.62 earnings per share (EPS) for the quarter, topping analysts' consensus estimates of $1.54 by $0.08. The company had revenue of $68.13 billion for the quarter, compared to the consensus estimate of $65.56 billion. NVIDIA had a net margin of 55.60% and a return on equity of 97.37%. The firm's revenue was up 73.2% compared to the same quarter last year. During the same quarter last year, the firm posted $0.89 earnings per share.  Equities research analysts anticipate that  NVIDIA Corporation will post 2.77 earnings per share for the current year. The firm also recently declared a quarterly dividend, which was paid on Wednesday, April 1st. Stockholders of record on Wednesday, March 11th were paid a dividend of $0.01 per share. This represents a $0.04 annualized dividend and a dividend yield of 0.0%. The ex-dividend date was Wednesday, March 11th. NVIDIA's dividend payout ratio (DPR) is currently 0.82%. In related news, EVP Ajay K. Puri sold 300,000 shares of NVIDIA stock in a transaction on Wednesday, March 18th. The stock was sold at an average price of $182.25, for a total transaction of $54,675,000.00. Following the transaction, the executive vice president directly owned 3,018,547 shares in the company, valued at approximately $550,130,190.75. The trade was a 9.04% decrease in their ownership of the stock. The transaction was disclosed in a document filed with the Securities & Exchange Commission, which is accessible through the SEC website. Also, CFO Colette Kress sold 42,650 shares of the business's stock in a transaction dated Friday, March 20th. The shares were sold at an average price of $174.89, for a total value of $7,459,058.50. Following the sale, the chief financial officer directly owned 881,387 shares of the company's stock, valued at $154,145,772.43. This represents a 4.62% decrease in their position. The disclosure for this sale is available in the SEC filing. Insiders have sold 1,401,616 shares of company stock worth $253,555,407 in the last 90 days. 4.17% of the stock is currently owned by insiders. NVIDIA Corporation, founded in 1993 and headquartered in Santa Clara, California, is a global technology company that designs and develops graphics processing units (GPUs) and system-on-chip (SoC) technologies. Co-founded by Jensen Huang, who serves as president and chief executive officer, along with Chris Malachowsky and Curtis Priem, NVIDIA has grown from a graphics-focused chipmaker into a broad provider of accelerated computing hardware and software for multiple industries. The company's product portfolio spans discrete GPUs for gaming and professional visualization (marketed under the GeForce and NVIDIA RTX lines), high-performance data center accelerators used for AI training and inference (including widely adopted platforms such as the A100 and H100 series), and Tegra SoCs for automotive and edge applications. This instant news alert was generated by narrative science technology and financial data from MarketBeat in order to provide readers with the fastest reporting and unbiased coverage. Please send any questions or comments about this story to contact@marketbeat.com. Before you consider NVIDIA, you'll want to hear this. MarketBeat keeps track of Wall Street's top-rated and best performing research analysts and the stocks they recommend to their clients on a daily basis. MarketBeat has identified the five stocks that top analysts are quietly whispering to their clients to buy now before the broader market catches on... and NVIDIA wasn't on the list. While NVIDIA currently has a Buy rating among analysts, top-rated analysts believe these five stocks are better buys. Click the link to see MarketBeat's guide to investing in 5G and which 5G stocks show the most promise. Sign up for MarketBeat All Access to gain access to MarketBeat's full suite of research tools. 345 N Reid Place, Suite 620, Sioux Falls, SD 57103
                                        
                                        contact@marketbeat.com
                                        
                                        (844) 978-6257 © MarketBeat Media, LLC 2010-2026. All rights reserved. © 2026   Fair market value prices are updated every minute and are provided by Massive. Other market data provided is at least 10-minutes delayed and hosted by Barchart Solutions.  Information is provided 'as-is' and solely for informational purposes, not for trading purposes or advice, and is delayed. To see all exchange delays and terms of use please see Barchart's disclaimer. We and our partners share information on your use of this website to help improve your experience. For more information, or to opt out click the Do Not Sell My Information button below.",https://www.marketbeat.com/instant-alerts/filing-nvidia-corporation-nvda-is-norden-group-llcs-3rd-largest-position-2026-04-03/
