ticker,title,date,content,url
NVDA,NVIDIA Corporation $NVDA is Kozak & Associates Inc.'s 9th Largest Position - MarketBeat,2026-04-02 09:06:51,"Kozak & Associates Inc. lessened its holdings in  NVIDIA Corporation (NASDAQ:NVDA - Free Report) by 4.4% during the 4th quarter, according to its most recent disclosure with the Securities and Exchange Commission (SEC). The institutional investor  owned 134,836 shares of the computer hardware maker's stock after selling 6,233 shares during the period. NVIDIA accounts for approximately  4.8% of Kozak & Associates Inc.'s portfolio, making the stock its 9th largest holding. Kozak & Associates Inc.'s holdings in NVIDIA were worth $24,926,000 as of its most recent SEC filing. Several other large investors have also modified their holdings of the business. Winnow Wealth LLC purchased a new stake in  NVIDIA in the 2nd quarter valued at approximately $32,000.  Longfellow Investment Management Co. LLC increased its position in  NVIDIA by 47.9% during the second quarter. Longfellow Investment Management Co. LLC now owns 207 shares of the computer hardware maker's stock worth $33,000 after buying an additional 67 shares in the last quarter.  Spurstone Advisory Services LLC acquired a new position in shares of  NVIDIA in the second quarter worth $40,000.  Sellwood Investment Partners LLC purchased a new stake in shares of  NVIDIA in the third quarter valued at $50,000.  Finally, EDENTREE ASSET MANAGEMENT Ltd purchased a new stake in shares of  NVIDIA in the second quarter valued at $54,000. 65.27% of the stock is currently owned by institutional investors and hedge funds. Here are the key news stories impacting NVIDIA this week: In related news, Director Mark A. Stevens sold 221,682 shares of the stock in a transaction that occurred on Friday, March 20th. The shares were sold at an average price of $173.68, for a total transaction of $38,501,729.76. Following the completion of the sale, the director owned 7,399,771 shares of the company's stock, valued at approximately $1,285,192,227.28. This represents a 2.91% decrease in their position. The transaction was disclosed in a document filed with the Securities & Exchange Commission, which can be accessed through the SEC website. Also, CFO Colette Kress sold 42,650 shares of the firm's stock in a transaction that occurred on Friday, March 20th. The shares were sold at an average price of $174.89, for a total transaction of $7,459,058.50. Following the completion of the transaction, the chief financial officer owned 881,387 shares in the company, valued at $154,145,772.43. The trade was a 4.62% decrease in their position. The disclosure for this sale is available in the SEC filing. Insiders have sold a total of 1,401,616 shares of company stock worth $253,555,407 in the last three months. 4.17% of the stock is currently owned by company insiders. Shares of NVDA stock opened at $175.75 on Thursday. The company has a debt-to-equity ratio of 0.05, a quick ratio of 3.24 and a current ratio of 3.91. The firm has a market capitalization of $4.27 trillion, a price-to-earnings ratio of 35.87, a price-to-earnings-growth ratio of 0.58 and a beta of 2.34. NVIDIA Corporation has a one year low of $86.62 and a one year high of $212.19. The company has a 50 day moving average price of $182.77 and a 200 day moving average price of $184.22. NVIDIA (NASDAQ:NVDA - Get Free Report) last announced its quarterly earnings data on Wednesday, February 25th. The computer hardware maker reported $1.62 earnings per share (EPS) for the quarter, beating the consensus estimate of $1.54 by $0.08. The company had revenue of $68.13 billion during the quarter, compared to analysts' expectations of $65.56 billion. NVIDIA had a net margin of 55.60% and a return on equity of 97.37%. The business's quarterly revenue was up 73.2% compared to the same quarter last year. During the same period in the previous year, the company earned $0.89 EPS.  Sell-side analysts anticipate that  NVIDIA Corporation will post 2.77 EPS for the current year. The company also recently declared a quarterly dividend, which was paid on Wednesday, April 1st. Shareholders of record on Wednesday, March 11th were paid a dividend of $0.01 per share. The ex-dividend date was Wednesday, March 11th. This represents a $0.04 annualized dividend and a yield of 0.0%. NVIDIA's dividend payout ratio  is currently 0.82%. NVDA has been the subject of a number of recent research reports. Wedbush lifted their price objective on NVIDIA from $230.00 to $300.00 and gave the stock an ""outperform"" rating in a research report on Tuesday, March 3rd. Raymond James Financial lifted their price target on shares of NVIDIA from $291.00 to $323.00 and gave the stock a ""strong-buy"" rating in a report on Thursday, March 19th. Mizuho  set a $275.00 price objective on shares of NVIDIA and gave the company an ""outperform"" rating in a research report on Friday, January 9th. HSBC  set a $310.00 price objective on shares of NVIDIA in a research note on Tuesday, February 24th. Finally, Robert W. Baird lifted their target price on shares of NVIDIA from $275.00 to $300.00 and gave the stock an ""outperform"" rating in a research note on Thursday, February 26th. Four investment analysts have rated the stock with a Strong Buy rating, forty-seven have issued  a Buy rating and two have given a Hold rating to the company's stock. Based on data from MarketBeat, the stock currently has a consensus rating of ""Buy"" and an average target price of $275.25. NVIDIA Corporation, founded in 1993 and headquartered in Santa Clara, California, is a global technology company that designs and develops graphics processing units (GPUs) and system-on-chip (SoC) technologies. Co-founded by Jensen Huang, who serves as president and chief executive officer, along with Chris Malachowsky and Curtis Priem, NVIDIA has grown from a graphics-focused chipmaker into a broad provider of accelerated computing hardware and software for multiple industries. The company's product portfolio spans discrete GPUs for gaming and professional visualization (marketed under the GeForce and NVIDIA RTX lines), high-performance data center accelerators used for AI training and inference (including widely adopted platforms such as the A100 and H100 series), and Tegra SoCs for automotive and edge applications. Want to see what other hedge funds are holding NVDA? Visit HoldingsChannel.com to get the latest 13F filings and insider trades for NVIDIA Corporation (NASDAQ:NVDA - Free Report). This instant news alert was generated by narrative science technology and financial data from MarketBeat in order to provide readers with the fastest reporting and unbiased coverage. Please send any questions or comments about this story to contact@marketbeat.com. Before you consider NVIDIA, you'll want to hear this. MarketBeat keeps track of Wall Street's top-rated and best performing research analysts and the stocks they recommend to their clients on a daily basis. MarketBeat has identified the five stocks that top analysts are quietly whispering to their clients to buy now before the broader market catches on... and NVIDIA wasn't on the list. While NVIDIA currently has a Buy rating among analysts, top-rated analysts believe these five stocks are better buys. MarketBeat's analysts have just released their top five short plays for April 2026. Learn which stocks have the most short interest and how to trade them. Click the link to see which companies made the list. Sign up for MarketBeat All Access to gain access to MarketBeat's full suite of research tools. 345 N Reid Place, Suite 620, Sioux Falls, SD 57103
                                        
                                        contact@marketbeat.com
                                        
                                        (844) 978-6257 © MarketBeat Media, LLC 2010-2026. All rights reserved. © 2026   Fair market value prices are updated every minute and are provided by Massive. Other market data provided is at least 10-minutes delayed and hosted by Barchart Solutions.  Information is provided 'as-is' and solely for informational purposes, not for trading purposes or advice, and is delayed. To see all exchange delays and terms of use please see Barchart's disclaimer. Enter your email address below to receive InsiderTrades.com’s daily insider buying and selling report for NVIDIA and related companies. We and our partners share information on your use of this website to help improve your experience. For more information, or to opt out click the Do Not Sell My Information button below.",https://www.marketbeat.com/instant-alerts/filing-nvidia-corporation-nvda-is-kozak-associates-incs-9th-largest-position-2026-04-02/
NVDA,Will NVIDIA (NVDA) close above ___ end of April? Trading Odds & Predictions - Polymarket,2026-04-02 02:23:00,"NVIDIA's share price, trading near $176 in early April 2026, reflects trader consensus on sustained AI data center demand following Q4 fiscal 2026 revenue of $68.1 billion—a 20% year-over-year increase that exceeded estimates—despite a late-March pullback from $179 highs amid profit-taking and sector volatility. Analyst estimates have trended higher post-GTC, with targets raised to $220–$325 on robust Hopper and Blackwell GPU orders outpacing supply, implying forward P/E around 22x. Valuation remains sensitive to macroeconomic factors like Treasury yields and Fed policy signals ahead of April CPI data, with no NVDA-specific catalysts until Q1 FY2027 earnings on May 20. Competition from AMD and inference cost pressures represent key swing risks for end-month pricing. Polymarket operates globally through separate legal entities. Polymarket US is operated by QCX LLC d/b/a Polymarket US, a CFTC-regulated Designated Contract Market. This international platform is not regulated by the CFTC and operates independently. Trading involves substantial risk of loss. See our Terms of Service & Privacy Policy.",https://polymarket.com/event/nvda-above-in-april-2026
NVDA,Prediction: This Will Be Nvidia's Stock Price in One Year - The Motley Fool,2026-04-02 02:22:00,"When it comes to Nvidia stock, everyone agrees that its revenue and profits will soar this year. But there's far less clarity about where the stock is headed. Projecting where a stock will trade a year from now is notoriously difficult, if not impossible. That said, attempting to do so can sometimes be a telling exercise.After all, evaluating a rapidly growing business often requires investors to push current fundamentals forward to see whether today's valuation makes sense, and forecasting a stock's one-year potential helps with this. In other words, thinking through how a company's evolving fundamentals can change the picture for a fast-growing business like Nvidia (NVDA +0.87%) provides insight into why the stock is valued like it is. For the AI chipmaker, the current financial reality is expanding so quickly that valuation multiples that are based on trailing-12-month financials barely capture the company's momentum. So, we'll instead want to spend time thinking of the trajectory of the underlying business -- and it's an incredible pace. The company's latest financial update highlights why the market continues to reward the stock. Nvidia's revenue in its fourth quarter of fiscal 2026 (a period that ended on Jan. 25, 2026) jumped 73% year over year to $68.1 billion. This growth was driven primarily by its data center segment, which caters to clients building artificial intelligence (AI)-capable data centers. The segment generated a record $62.3 billion in revenue -- up 75% year over year. Our experts' top-rated cash back card just got even better. For a limited time, earn a $250 bonus after spending just $500 in the first 3 months. Plus, earn unlimited cash back and pay 0% intro APR until well into 2027. The sequential trend is just as telling. Total revenue rose 20% from the $57.0 billion Nvidia reported in fiscal Q3. And profitability is moving higher right alongside sales. The company reported non-GAAP (adjusted) earnings per share of $1.62 in fiscal Q4, up 82% year over year. Nvidia also maintained an impressive adjusted gross margin of 75.2% during the quarter. When our analyst team has a stock tip, it can pay to listen. After all, Stock Advisor’s total average return is 926%* — a market-crushing outperformance compared to 185% for the S&P 500. They just revealed what they believe are the 10 best stocks for investors to buy right now, available when you join Stock Advisor. This ability to defend pricing power while scaling production of its new Blackwell architecture underscores the strength of its dominant hardware ecosystem. Further, management anticipates the company's momentum will persist. Nvidia guided for fiscal first-quarter revenue of approximately $78.0 billion, signaling that we're still in the early innings of this AI boom. Putting the company's extraordinary momentum into perspective, Nvidia chief financial officer Colette Kress noted in the company's earnings call that Nvidia has expanded its data center business by nearly 13 times since fiscal 2023, attributing the ongoing momentum to a transition toward ""agentic and physical AI applications [...]"" This brings us to the stock's valuation. Nvidia currently trades at a price-to-earnings ratio of about 36. But when looking at expected profits over the next four quarters, the stock's forward price-to-earnings ratio drops to about 21. This gap between the trailing and forward metrics sets up an interesting scenario. If the company simply meets Wall Street's forward earnings estimates, the stock price could appreciate by 12% over the next year -- pushing shares to about $197 -- while simultaneously leaving the stock with a significantly lower trailing price-to-earnings ratio 12 months from now than it has today. In short, the underlying business possesses so much earnings momentum that the stock price can climb steadily even as the valuation multiple contracts. And a lower valuation multiple is exactly what investors should expect. By April 2027, the market will likely be looking ahead to fiscal 2028 and beyond. And it is highly likely that investors will demand a more conservative multiple as the current infrastructure build-out matures. Historically, semiconductor companies operate in cyclical environments -- and Nvidia is no exception. While the current artificial intelligence boom has defied traditional hardware cycles for several years, the market will naturally assign a lower price-to-earnings ratio to the stock as revenue growth rates inevitably decelerate at some point. Additionally, hyperscalers cannot increase their capital expenditures at these extraordinary rates indefinitely. Further, major cloud providers are actively developing their own custom silicon, and semiconductor competitors are launching alternative hardware solutions to capture a piece of the lucrative accelerated computing market. In short, a contracting price-to-earnings ratio will likely eventually be necessary to price in these mounting competitive risks and cyclicality concerns. But a shrinking multiple does not automatically mean a shrinking share price. Nvidia's operating margins are robust, and its near-term pipeline is extremely robust. I think the sheer volume of cash flowing to the bottom line provides plenty of structural support for the stock. So, with all of this in mind, I believe a 12% gain over the next year is a plausible outcome for investors, putting my one-year forecast for the stock at about $197. Ultimately, however, investors should keep in mind that Nvidia is a very high-risk stock. So my forecast should be taken with a grain of salt. The Motley Fool Stock Advisor analyst team just identified what they believe are the 10 best stocks for investors to buy now… and Nvidia wasn’t one of them. The 10 stocks that made the cut could produce monster returns in the coming years. Consider when Netflix made this list on December 17, 2004... if you invested $1,000 at the time of our recommendation, you’d have $532,066!* Or when Nvidia made this list on April 15, 2005... if you invested $1,000 at the time of our recommendation, you’d have $1,087,496!* Now, it’s worth noting Stock Advisor’s total average return is 926% — a market-crushing outperformance compared to 185% for the S&P 500. Don't miss the latest top 10 list, available with Stock Advisor, and join an investing community built by individual investors for individual investors. Daniel Sparks and his clients have no position in any of the stocks mentioned. The Motley Fool has positions in and recommends Nvidia. The Motley Fool has a disclosure policy. This tech could reach $80 trillion. Imagine a technology worth over 18 Nvidias. What in the world could be worth 18 Nvidias? The answer is a radical tech breakthrough that our experts think is transforming every walk of life. And this giant leap forward has many on Wall Street very excited. *Average returns of all recommendations since inception. Cost basis and return based on previous market day close. Our experts' top-rated cash back card just got even better. For a limited time, earn a $250 bonus after spending just $500 in the first 3 months. Plus, earn unlimited cash back and pay 0% intro APR until well into 2027. Invest better with The Motley Fool. Get stock recommendations, portfolio guidance, and more from The Motley Fool's premium services. © 1995 - 2026 The Motley Fool. All rights reserved. *Returns as of April 3, 2026. **$149 for 2 years is a promotional price for new members only. Renews at current list price of $199 after 2nd year.",https://www.fool.com/investing/2026/04/01/prediction-this-will-be-nvidias-stock-price-in-one/
NVDA,"Nvidia At A Discount? Tech Valuations Look Attractive And Mark Gibbens Says It's 'A Great Time to Get In' On PLTR, NVDA And GOOGL - Yahoo Finance",2026-04-02 00:31:00,"Tip: Try a valid symbol or a specific company name for relevant results Following a five-week market selloff that pushed major averages into correction territory, Gibbens Capital Management CIO Mark Gibbens says the pullback has created a prime buying opportunity for long-term investors eyeing the tech sector. Despite recent geopolitical headwinds and inflation concerns weighing heavily on the broader markets, Gibbens remains decidedly bullish on technology. Pointing to the roughly 10% drop across major indices, he noted that fundamentally strong companies are now trading at attractive multiples. “If you’re a long-term investor, I think it’s a great time to get in,” Gibbens said in a Schwab Network interview. “You’re getting these great companies at great prices.” This 2-Minute Tool Matches Investors With Financial Advisors Based on Their Goals Some of the biggest financial mistakes come from going it alone—this short quiz connects you with a vetted advisor who can offer a second opinion on your strategy Among his top broad tech picks are industry giants Nvidia Corp. and Alphabet Inc.. Gibbens highlighted the significant shift in Nvidia’s valuation, noting that the chipmaker is trading at a much more palatable 20 times forward earnings—a steep drop from the 40 times multiple seen in the recent past. According to Benzinga Pro, the stock was trading at a forward price-to-earnings of 20.284x, as compared to its industry average of 37.030x. He dismissed concerns about a broader slowdown in the artificial intelligence (AI) trade, emphasizing the ongoing hardware infrastructure boom. “We can’t get enough compute power out there,” Gibbens explained. “The demand is just insatiable.” Beyond hardware, Gibbens pointed to Palantir Technologies Inc. as a standout in the software space. While acknowledging the stock’s recent pullback alongside other software names, he argued that Palantir’s enterprise and government businesses are uniquely positioned to survive what he calls the “AI scare”—the fear that AI will eat all software. Trending: You Saved for Retirement — But Do You Know What You'll Keep After Taxes? Unlike some enterprise software peers like Salesforce Inc. or Adobe Inc., which Gibbens views as slightly more at risk of being disrupted by AI, Palantir is actively integrating with large language models. He noted that the company is “working with the LLMs and working with AI as opposed to possibly being overtaken by it.” While monitoring high-frequency economic data, Gibbens remains largely unconcerned about the labor market. Instead, his focus stays fixed on geopolitical tensions and inflation. Assuming these broader macro issues resolve over the next six to nine months, he maintains that tech and financials remain his favorite sectors to deploy capital. This drop in valuation comes as NVDA has declined by 11.44% year-to-date, as compared to the 8.94% loss in the Nasdaq 100 index. The stock was, however, higher by 50.61% over the year and down 6.78% over the last month. It was up 1.00% in premarket on Tuesday. See Also: This Startup Thinks It Can Reinvent the Wheel — Literally It maintains a weaker price trend over the short and medium terms but a strong trend in the long term, with a solid quality score, as per Benzinga’s Edge Stock Rankings. Read Next: See What AI Could Build for Your Portfolio — Try a Custom Index Now UNLOCKED: 5 NEW TRADES EVERY WEEK. Click now to get top trade ideas daily, plus unlimited access to cutting-edge tools and strategies to gain an edge in the markets. This article Nvidia At A Discount? Tech Valuations Look Attractive And Mark Gibbens Says It&#39;s &#39;A Great Time to Get In&#39; On PLTR, NVDA And GOOGL originally appeared on Benzinga.com Tip: Try a valid symbol or a specific company name for relevant results",https://finance.yahoo.com/markets/stocks/articles/nvidia-discount-tech-valuations-look-003132274.html
NVDA,NVIDIA Corp (NQ: NVDA - FinancialContent,2026-04-01 20:00:01,We won't sell or share your personal information to inform the ads you see. You may still see interest-based ads if your information is sold or shared by other companies or was sold or shared previously.,https://markets.financialcontent.com/stocks/quote?Symbol=NQ%3ANVDA
NVDA,NVIDIA Corporation (NVDA) Staring at 50% Revenue Boost on Rubin Ultra New AI Capabilities - Yahoo Finance Singapore,2026-04-01 19:41:49,"Tip: Try a valid symbol or a specific company name for relevant results NVIDIA Corporation (NASDAQ:NVDA) is one of the Motley Fool’s high-growth stock picks. On March 27, Wolfe Research reiterated an Outperform rating on NVIDIA Corporation (NASDAQ:NVDA) and a $275 price target. The bullish stance affirms the research firm’s confidence in the company’s prospects, driven by the introduction of Rubin Ultra for agentic AI capabilities. During GTC 2026, CEO Jensen Huang introduced the Vera Rubin Platform, Vera CPU, and DLSSS 5 amid a heightened push to meet escalating AI inference demand. The company has also indicated that the new products could drive a 50% increase in revenue compared to VR compute racks alone. For starters, the Groq 3LPX rack represents a 25% incremental opportunity to the VR200 racks. Wolfe Research has already hinted at potential $150 million in Nvidia content per pod, including CPU storage and Ethernet racks. In addition, the research firm expects the company to generate up to $120 billion in monthly revenue by producing 200 pods per week. NVIDIA Corporation (NASDAQ:NVDA) is a technology giant that pioneered the graphics processing unit (GPU) and is now the leading provider of computing hardware and software for artificial intelligence (AI). It is a full-stack computing company that powers AI data centers, autonomous vehicles, robotics, and industrial digital twins. While we acknowledge the potential of NVDA as an investment, we believe certain AI stocks offer greater upside potential and carry less downside risk. If you're looking for an extremely undervalued AI stock that also stands to benefit significantly from Trump-era tariffs and the onshoring trend, see our free report on the best short-term AI stock. READ NEXT: 8 Best Potash Stocks to Invest in Right Now and 9 Most Undervalued Growth Stocks to Buy According to Analysts. Disclosure: None. Follow Insider Monkey on Google News. Tip: Try a valid symbol or a specific company name for relevant results",https://sg.finance.yahoo.com/news/nvidia-corporation-nvda-staring-50-194149460.html
