ticker,title,date,content,url
NVDA,"9,275 Shares in NVIDIA Corporation $NVDA Purchased by Split Rock Private Trading & Wealth Management LLC - MarketBeat",2026-05-02 09:33:48,"Split Rock Private Trading & Wealth Management LLC bought a new position in  NVIDIA Corporation (NASDAQ:NVDA - Free Report) during the 4th quarter, according to its most recent Form 13F filing with the Securities and Exchange Commission (SEC). The firm bought 9,275 shares of the computer hardware maker's stock, valued at approximately $1,730,000. NVIDIA comprises about  1.4% of Split Rock Private Trading & Wealth Management LLC's investment portfolio, making the stock its 11th biggest position. Several other large investors also recently modified their holdings of the business. PMG Family Office LLC purchased a new position in shares of  NVIDIA during the third quarter valued at approximately $2,150,000.  Oak Ridge Investments LLC increased its stake in shares of  NVIDIA by 2.2% during the third quarter. Oak Ridge Investments LLC now owns 970,860 shares of the computer hardware maker's stock valued at $181,143,000 after buying an additional 20,559 shares during the period.  Weaver Capital Management LLC increased its stake in shares of  NVIDIA by 5.5% during the fourth quarter. Weaver Capital Management LLC now owns 85,216 shares of the computer hardware maker's stock valued at $15,893,000 after buying an additional 4,439 shares during the period.  Circle Wealth Management LLC increased its stake in shares of  NVIDIA by 16.1% during the third quarter. Circle Wealth Management LLC now owns 107,787 shares of the computer hardware maker's stock valued at $20,111,000 after buying an additional 14,936 shares during the period.  Finally, Sunburst Financial Group LLC increased its stake in shares of  NVIDIA by 11.3% during the fourth quarter. Sunburst Financial Group LLC now owns 42,515 shares of the computer hardware maker's stock valued at $7,929,000 after buying an additional 4,300 shares during the period. 65.27% of the stock is owned by institutional investors. Shares of NVDA stock opened at $198.45 on Friday. The stock has a market cap of $4.82 trillion, a price-to-earnings ratio of 40.50, a PEG ratio of 0.66 and a beta of 2.25. The business's fifty day moving average is $186.75 and its 200 day moving average is $186.15. NVIDIA Corporation has a twelve month low of $110.82 and a twelve month high of $216.82. The company has a quick ratio of 3.24, a current ratio of 3.91 and a debt-to-equity ratio of 0.05. NVIDIA (NASDAQ:NVDA - Get Free Report) last issued its quarterly earnings results on Wednesday, February 25th. The computer hardware maker reported $1.62 earnings per share for the quarter, topping the consensus estimate of $1.54 by $0.08. The company had revenue of $68.13 billion for the quarter, compared to analysts' expectations of $65.56 billion. NVIDIA had a return on equity of 97.37% and a net margin of 55.60%.The firm's revenue for the quarter was up 73.2% on a year-over-year basis. During the same period in the prior year, the firm earned $0.89 earnings per share.  Research analysts expect that  NVIDIA Corporation will post 7.78 EPS for the current fiscal year. The company also recently declared a quarterly dividend, which was paid on Wednesday, April 1st. Investors of record on Wednesday, March 11th were paid a $0.01 dividend. This represents a $0.04 annualized dividend and a yield of 0.0%. The ex-dividend date of this dividend was Wednesday, March 11th. NVIDIA's dividend payout ratio  is presently 0.82%. Here are the key news stories impacting NVIDIA this week: In related news, Director Aarti S. Shah sold 19,000 shares of the company's stock in a transaction on Thursday, March 19th. The stock was sold at an average price of $176.71, for a total value of $3,357,490.00. Following the sale, the director directly owned 36,007 shares of the company's stock, valued at $6,362,796.97. This represents a 34.54% decrease in their ownership of the stock. The sale was disclosed in a document filed with the Securities & Exchange Commission, which is available at this link. Also, Director John Dabiri sold 3,004 shares of the company's stock in a transaction on Friday, March 13th. The stock was sold at an average price of $184.90, for a total value of $555,439.60. Following the completion of the sale, the director directly owned 14,788 shares in the company, valued at approximately $2,734,301.20. The trade was a 16.88% decrease in their ownership of the stock. The disclosure for this sale is available in the SEC filing. Insiders sold 953,976 shares of company stock valued at $171,173,819 over the last 90 days. 4.17% of the stock is currently owned by company insiders. Several equities analysts have recently issued reports on the company. Sanford C. Bernstein  reissued a ""buy"" rating on shares of NVIDIA in a research note on Friday, April 17th. Fundamental Research  set a $218.00 target price on NVIDIA in a research note on Thursday, February 26th. New Street Research reduced their target price on NVIDIA from $307.00 to $275.00 and set a ""buy"" rating on the stock in a research note on Tuesday, March 31st. Bank of America boosted their target price on NVIDIA from $275.00 to $300.00 and gave the company a ""buy"" rating in a research note on Thursday, February 26th. Finally, Oppenheimer  reissued an ""outperform"" rating and set a $265.00 target price on shares of NVIDIA in a research note on Thursday, February 26th. Four research analysts have rated the stock with a Strong Buy rating, forty-eight have given a Buy rating and two have issued  a Hold rating to the stock. According to data from MarketBeat.com, NVIDIA presently has an average rating of ""Buy"" and an average price target of $275.25. NVIDIA Corporation, founded in 1993 and headquartered in Santa Clara, California, is a global technology company that designs and develops graphics processing units (GPUs) and system-on-chip (SoC) technologies. Co-founded by Jensen Huang, who serves as president and chief executive officer, along with Chris Malachowsky and Curtis Priem, NVIDIA has grown from a graphics-focused chipmaker into a broad provider of accelerated computing hardware and software for multiple industries. The company's product portfolio spans discrete GPUs for gaming and professional visualization (marketed under the GeForce and NVIDIA RTX lines), high-performance data center accelerators used for AI training and inference (including widely adopted platforms such as the A100 and H100 series), and Tegra SoCs for automotive and edge applications. Want to see what other hedge funds are holding NVDA? Visit HoldingsChannel.com to get the latest 13F filings and insider trades for NVIDIA Corporation (NASDAQ:NVDA - Free Report). This instant news alert was generated by narrative science technology and financial data from MarketBeat in order to provide readers with the fastest reporting and unbiased coverage. Please send any questions or comments about this story to contact@marketbeat.com. Before you consider NVIDIA, you'll want to hear this. MarketBeat keeps track of Wall Street's top-rated and best performing research analysts and the stocks they recommend to their clients on a daily basis. MarketBeat has identified the five stocks that top analysts are quietly whispering to their clients to buy now before the broader market catches on... and NVIDIA wasn't on the list. While NVIDIA currently has a Buy rating among analysts, top-rated analysts believe these five stocks are better buys. Thinking about investing in Meta, Roblox, or Unity? Click the link to learn what streetwise investors need to know about the metaverse and public markets before making an investment. Sign up for MarketBeat All Access to gain access to MarketBeat's full suite of research tools. 345 N Reid Place, Suite 620, Sioux Falls, SD 57103
                                        
                                        contact@marketbeat.com
                                        
                                        (844) 978-6257 © MarketBeat Media, LLC 2010-2026. All rights reserved. © 2026   Fair market value prices are updated every minute and are provided by Massive. Other market data provided is at least 10-minutes delayed and hosted by Barchart Solutions.  Information is provided 'as-is' and solely for informational purposes, not for trading purposes or advice, and is delayed. To see all exchange delays and terms of use please see Barchart's disclaimer. We and our partners share information on your use of this website to help improve your experience. For more information, or to opt out click the Do Not Sell My Information button below.",https://www.marketbeat.com/instant-alerts/filing-9275-shares-in-nvidia-corporation-nvda-purchased-by-split-rock-private-trading-wealth-management-llc-2026-05-02/
NVDA,$SKYECHIP (5357.MY)$$NVIDIA (NVDA.US)$ This is Malaysia Nvidia! I believe the drop of Yesterday is Malaysian cash out to invest in this Ipo. Boss don't want to cash out at Ipo price unlike $EMPIRE (5351.MY)$ boss just want to cash out at high Ipo price. I - Moomoo,2026-05-02 07:58:16,"To create a seamless experience and for website quality and improvement purposes, we use cookie technologies for verification and quality purposes, to personalize the content presented, and to provide advertising that may be of specific interest to you. Learn our Privacy Policy here.",https://www.moomoo.com/community/feed/skyechip-5357-my-nvidia-nvda-us-this-is-malaysia-nvidia-116503917101062?chain_id=Name1K9-3FXPhg.1kvbbo0&global_content=%7B%22promote_id%22%3A13764%2C%22sub_promote_id%22%3A57%2C%22f%22%3A%22www.moomoo.com%2Fstock%2FNVDA-US%22%7D
NVDA,NVIDIA Corporation $NVDA Stock Holdings Cut by Cove Private Wealth LLC - MarketBeat,2026-05-02 07:57:21,"Cove Private Wealth LLC decreased its holdings in shares of  NVIDIA Corporation (NASDAQ:NVDA - Free Report) by 6.2% during the fourth quarter, according to the company in its most recent disclosure with the Securities & Exchange Commission. The institutional investor  owned 149,020 shares of the computer hardware maker's stock after selling 9,834 shares during the quarter. NVIDIA comprises about  8.3% of Cove Private Wealth LLC's investment portfolio, making the stock its 2nd largest position. Cove Private Wealth LLC's holdings in NVIDIA were worth $27,792,000 at the end of the most recent quarter. Several other hedge funds and other institutional investors have also made changes to their positions in the company. State Street Corp raised its stake in shares of  NVIDIA by 1.0% in the second quarter. State Street Corp now owns 978,208,862 shares of the computer hardware maker's stock valued at $154,556,803,000 after acquiring an additional 9,554,857 shares during the period.  Geode Capital Management LLC raised its stake in shares of  NVIDIA by 1.5% in the second quarter. Geode Capital Management LLC now owns 579,213,497 shares of the computer hardware maker's stock valued at $91,150,170,000 after acquiring an additional 8,521,936 shares during the period.  Norges Bank purchased a new stake in shares of  NVIDIA in the second quarter valued at $51,386,863,000.  Legal & General Group Plc raised its stake in shares of  NVIDIA by 1.5% in the third quarter. Legal & General Group Plc now owns 181,203,035 shares of the computer hardware maker's stock valued at $33,808,862,000 after acquiring an additional 2,609,560 shares during the period.  Finally, Capital Research Global Investors raised its stake in shares of  NVIDIA by 16.1% in the third quarter. Capital Research Global Investors now owns 165,377,852 shares of the computer hardware maker's stock valued at $30,855,564,000 after acquiring an additional 22,896,705 shares during the period. Hedge funds and other institutional investors own  65.27% of the company's stock. NASDAQ NVDA opened at $198.45 on Friday. The company's 50-day moving average price is $186.75 and its 200-day moving average price is $186.15. The company has a current ratio of 3.91, a quick ratio of 3.24 and a debt-to-equity ratio of 0.05. The stock has a market cap of $4.82 trillion, a PE ratio of 40.50, a PEG ratio of 0.66 and a beta of 2.25. NVIDIA Corporation has a 12 month low of $110.82 and a 12 month high of $216.82. NVIDIA (NASDAQ:NVDA - Get Free Report) last posted its quarterly earnings results on Wednesday, February 25th. The computer hardware maker reported $1.62 EPS for the quarter, topping analysts' consensus estimates of $1.54 by $0.08. The firm had revenue of $68.13 billion for the quarter, compared to analysts' expectations of $65.56 billion. NVIDIA had a net margin of 55.60% and a return on equity of 97.37%. The business's revenue for the quarter was up 73.2% on a year-over-year basis. During the same period in the prior year, the business posted $0.89 earnings per share.  Equities research analysts forecast that  NVIDIA Corporation will post 7.78 earnings per share for the current year. The firm also recently announced a quarterly dividend, which was paid on Wednesday, April 1st. Shareholders of record on Wednesday, March 11th were issued a dividend of $0.01 per share. This represents a $0.04 annualized dividend and a yield of 0.0%. The ex-dividend date was Wednesday, March 11th. NVIDIA's dividend payout ratio  is presently 0.82%. In other NVIDIA news, Director Mark A. Stevens sold 221,682 shares of the stock in a transaction dated Friday, March 20th. The shares were sold at an average price of $173.68, for a total transaction of $38,501,729.76. Following the transaction, the director directly owned 7,399,771 shares in the company, valued at $1,285,192,227.28. This represents a 2.91% decrease in their position. The sale was disclosed in a legal filing with the Securities & Exchange Commission, which is available at the SEC website. Also, Director Aarti S. Shah sold 19,000 shares of the stock in a transaction dated Thursday, March 19th. The stock was sold at an average price of $176.71, for a total transaction of $3,357,490.00. Following the transaction, the director owned 36,007 shares in the company, valued at approximately $6,362,796.97. The trade was a 34.54% decrease in their ownership of the stock. The disclosure for this sale is available in the SEC filing. Insiders sold 953,976 shares of company stock worth $171,173,819 over the last quarter. Corporate insiders own  4.17% of the company's stock. Here are the key news stories impacting NVIDIA this week: Several equities research analysts have recently weighed in on NVDA shares. Citigroup started coverage on shares of NVIDIA in a research note on Wednesday, April 15th. They issued a ""buy"" rating on the stock. The Goldman Sachs Group  set a $250.00 target price on shares of NVIDIA and gave the company a ""buy"" rating in a research note on Wednesday, February 25th. Wedbush increased their target price on shares of NVIDIA from $230.00 to $300.00 and gave the company an ""outperform"" rating in a research note on Tuesday, March 3rd. Rothschild & Co Redburn upped their price target on shares of NVIDIA from $245.00 to $268.00 and gave the stock a ""buy"" rating in a report on Thursday, January 15th. Finally, Wolfe Research upped their price target on shares of NVIDIA from $250.00 to $275.00 and gave the stock an ""outperform"" rating in a report on Friday, January 30th. Four analysts have rated the stock with a Strong Buy rating, forty-eight have given a Buy rating and two have issued  a Hold rating to the stock. According to data from MarketBeat, NVIDIA currently has an average rating of ""Buy"" and an average target price of $275.25. NVIDIA Corporation, founded in 1993 and headquartered in Santa Clara, California, is a global technology company that designs and develops graphics processing units (GPUs) and system-on-chip (SoC) technologies. Co-founded by Jensen Huang, who serves as president and chief executive officer, along with Chris Malachowsky and Curtis Priem, NVIDIA has grown from a graphics-focused chipmaker into a broad provider of accelerated computing hardware and software for multiple industries. The company's product portfolio spans discrete GPUs for gaming and professional visualization (marketed under the GeForce and NVIDIA RTX lines), high-performance data center accelerators used for AI training and inference (including widely adopted platforms such as the A100 and H100 series), and Tegra SoCs for automotive and edge applications. Want to see what other hedge funds are holding NVDA? Visit HoldingsChannel.com to get the latest 13F filings and insider trades for NVIDIA Corporation (NASDAQ:NVDA - Free Report). This instant news alert was generated by narrative science technology and financial data from MarketBeat in order to provide readers with the fastest reporting and unbiased coverage. Please send any questions or comments about this story to contact@marketbeat.com. Before you consider NVIDIA, you'll want to hear this. MarketBeat keeps track of Wall Street's top-rated and best performing research analysts and the stocks they recommend to their clients on a daily basis. MarketBeat has identified the five stocks that top analysts are quietly whispering to their clients to buy now before the broader market catches on... and NVIDIA wasn't on the list. While NVIDIA currently has a Buy rating among analysts, top-rated analysts believe these five stocks are better buys. Looking for the next FAANG stock before everyone has heard about it? Click the link to see which stocks MarketBeat analysts think might become the next trillion dollar tech company. Sign up for MarketBeat All Access to gain access to MarketBeat's full suite of research tools. 345 N Reid Place, Suite 620, Sioux Falls, SD 57103
                                        
                                        contact@marketbeat.com
                                        
                                        (844) 978-6257 © MarketBeat Media, LLC 2010-2026. All rights reserved. © 2026   Fair market value prices are updated every minute and are provided by Massive. Other market data provided is at least 10-minutes delayed and hosted by Barchart Solutions.  Information is provided 'as-is' and solely for informational purposes, not for trading purposes or advice, and is delayed. To see all exchange delays and terms of use please see Barchart's disclaimer. We and our partners share information on your use of this website to help improve your experience. For more information, or to opt out click the Do Not Sell My Information button below.",https://www.marketbeat.com/instant-alerts/filing-nvidia-corporation-nvda-stock-holdings-cut-by-cove-private-wealth-llc-2026-05-02/
