ticker,title,date,content,url
NVDA,NVIDIA (NVDA): Among the Best American Stocks to Buy in the Technology Sector - Yahoo Finance,2026-05-02 22:39:37,"Tip: Try a valid symbol or a specific company name for relevant results The above button links to Coinbase. Yahoo Finance is not a broker-dealer or investment adviser and does not offer securities or cryptocurrencies for sale or facilitate trading. Coinbase pays us for certain activity generated through this link. Prices displayed are informational. NVIDIA Corporation (NASDAQ:NVDA) is one of the 10 Best American Tech Stocks to Buy. On April 30, Reuters reported that strong demand for AI computing equipment in China has pushed the price of NVIDIA Corporation’s (NASDAQ:NVDA) B300 ​servers to around 7 million yuan, or about $1 million each. Industry sources said this sharp increase comes as a crackdown on chip smuggling has reduced supply in the black market. The prices for B300 servers, which are the company’s most advanced and powerful servers, critical for AI tasks, have increased since early this year. However, prices jumped after the grey market, which is an important supply channel, came under pressure. According to the sources, strong computing demand from Chinese tech companies is driving the price surge, even when many companies are careful about holding NVIDIA Corporation (NASDAQ:NVDA) hardware directly on their books to avoid possible exposure to US sanctions. At the same time, uncertainty around NVIDIA Corporation’s (NASDAQ:NVDA) H200 chips has added further pressure to prices. Although both governments have approved exports of the H200, the chips have still not been shipped to China due to disagreements over the conditions governing its sale. NVIDIA Corporation (NASDAQ:NVDA) is an American multinational technology company known for producing graphics processing units (GPUs), AI hardware and software, and high-performance computing (HPC) solutions. While we acknowledge the potential of NVDA as an investment, we believe certain AI stocks offer greater upside potential and carry less downside risk. If you're looking for an extremely undervalued AI stock that also stands to benefit significantly from Trump-era tariffs and the onshoring trend, see our free report on the best short-term AI stock. READ NEXT: 10 Best Fintech Stocks to Invest In According to Billionaires and 10 Best Medical Stocks to Buy Under $30. Disclosure: None.  Follow Insider Monkey on Google News. Tip: Try a valid symbol or a specific company name for relevant results",https://finance.yahoo.com/sectors/technology/articles/nvidia-nvda-among-best-american-223937360.html
NVDA,NVIDIA's New Quantum‑AI Models Are Impressive — and the Market Doesn’t Seem Ready to Price the Step‑Change - 24/7 Wall St.,2026-05-02 17:08:13,"Stocks: Nvidia (NVDA) launched NVQLink hardware, CUDA-Q software, and an open-sourced Ising AI model designed to accelerate quantum computing development and integrate GPUs with quantum processing units. Nvidia is building a quantum computing ecosystem ahead of mainstream adoption to establish dominance in this emerging technology. The analyst who called NVIDIA in 2010 just named his top 10 AI stocks. Get them here FREE. © BING-JHEN HONG / iStock Editorial via Getty Images As shares of Nvidia (NASDAQ:NVDA | NVDA Price Prediction) start drifting lower again, interested investors might be able to pick up shares at a reasonable price despite the new innovations that the firm pulled the curtain on in the past several months. Indeed, a lot has happened for Nvidia and Jensen Huang since the new year began. Still, the stock doesn’t appear to be ready to sustain a rally to much higher levels. Either way, investors should focus on the narrative, which, I think, has improved markedly this year. Even if investors no longer reward good quarters for the top AI innovators, it’s hard to argue against the increasing growth ceiling of the GPU titan as it explores the potential of new technologies beyond traditional silicon. Undoubtedly, I speak of Nvidia’s foray into the nascent market of quantum computing and how it could reshape the company as the still-uncertain technology looks to become more useful. Until quantum computing has its very own ChatGPT moment, it might be hard for most investors to recognize when the right time for the tech is. Regardless, Nvidia is already getting skin in the game. And, if it proves way too early, the firm really doesn’t have much to lose for its efforts as it looks to help bridge the gap before that major quantum leap is possible. Whether it’s in decades from now or a few short years, quantum computing is an emerging trend that’s hard to ignore. The mega-cap tech titans, like Alphabet (NASDAQ:GOOG) and International Business Machines (NYSE:IBM), clearly think that the investments in the nascent market are worth it. And with a slew of quantum pure-plays also exploding onto the scene in recent years, questions linger about where exactly we stand on the quantum computing timeline and how it could transform the AI revolution. In any case, back to Nvidia. The company looks serious about preparing for quantum. The company already has a nice ecosystem of models, software, and hardware interconnects. Most notably, NVQLink is the piece of hardware that could bring together the GPUs and the QPUs (quantum processing units) of the future. The analyst who called NVIDIA in 2010 just named his top 10 stocks. Get them here FREE. Add CUDA-Q and the all-new Ising AI model built for quantum hardware management, and I think it’s time to think of quantum computing as more than just a fun hobby project; it’s serious business. The timeline might still be uncertain, but it’s hard not to stay bullish on Nvidia as it looks past the boom it’s already got a front-row seat to. Whenever you have a company that’s already looking to the next big innovative leap, you might have a firm that’s not yet ready to peak out. In any case, the new Ising model could be what really makes Nvidia a top enabler of quantum technologies. Nvidia’s Ising model is described by the firm as an open model to “accelerate the path to useful quantum computers.” Undoubtedly, that prospect is quite exciting, and since it’s open-sourced, it might be bringing aboard the quantum pure-plays into its stack earlier on. Even if it’s early, it’s a move that makes sense to widen its moat around the nascent field in the long haul. Any way you look at it, Ising brings a lot to the table, and my guess is that firms are going to find ways to put it to work. As Ising gets and the rest of the quantum stack get better, it’s exciting to think about where Nvidia could go in the next 15 years and beyond. Joey is a 24/7 Wall St. contributor and seasoned investment writer whose work can also be found in publications such as The Motley Fool and TipRanks. Holding a B.A.Sc in Computer Engineering from the University of British Columbia (UBC), Joey has leveraged his technical background to provide insightful stock analyses to readers. Joey's investment philosophy is heavily influenced by Warren Buffett's value investing principles. As a dedicated Buffett disciple, Joey is committed to unearthing value in the tech sector and beyond. Our top personal finance-related articles today. Your wallet will thank you later. Nvidia (NASDAQ:NVDA | NVDA Price Prediction) may not be a quantum computing innovator, but CEO Jensen Huang, a man some… A lot of smart people in tech seem to think that a potential “inflection point” in quantum computing is the… Nvidia (NASDAQ:NVDA | NVDA Price Prediction) stock might be grounded, but its GPUs are heading to space as the concept… Nvidia (NASDAQ:NVDA | NVDA Price Prediction) CEO Jensen Huang had some thoughts to share about the state of quantum computing,… Investors probably aren’t thinking all too much about the former high-flying quantum computing stocks or the nascent technological trend as… Palantir (NASDAQ:PLTR | PLTR Price Prediction) just clocked in an incredibly strong quarterly earnings result. And to top it off,… Nvidia (NASDAQ:NVDA | NVDA Price Prediction) stock keeps passing milestone after milestone. After surging past the $4 trillion market cap… Artificial intelligence (AI) promises to be a game-changing technology. And while only time will tell where the race to artificial… There’s still plenty of room for growth as the AI race continues to unfold. Still, some growth investors are already…",https://247wallst.com/investing/2026/05/02/nvidias-new-quantum%E2%80%91ai-models-are-impressive-and-the-market-doesnt-seem-ready-to-price-the-step%E2%80%91change/
NVDA,Tyche Wealth Partners LLC Cuts Holdings in NVIDIA Corporation $NVDA - MarketBeat,2026-05-02 12:53:55,"Tyche Wealth Partners LLC reduced its position in shares of  NVIDIA Corporation (NASDAQ:NVDA - Free Report) by 4.1% during the fourth quarter, according to the company in its most recent Form 13F filing with the Securities & Exchange Commission. The firm owned 82,127 shares of the computer hardware maker's stock after selling 3,487 shares during the period. NVIDIA makes up  about  2.4% of Tyche Wealth Partners LLC's investment portfolio, making the stock its 7th largest position. Tyche Wealth Partners LLC's holdings in NVIDIA were worth $15,317,000 at the end of the most recent quarter. A number of other hedge funds have also recently bought and sold shares of the company. Oak Ridge Investments LLC grew its holdings in  NVIDIA by 7.5% during the fourth quarter. Oak Ridge Investments LLC now owns 1,043,317 shares of the computer hardware maker's stock worth $194,579,000 after acquiring an additional 72,457 shares during the period.  Shore Point Advisors LLC acquired a new position in  NVIDIA during the fourth quarter worth about $208,000.  Keener Financial Planning LLC grew its holdings in  NVIDIA by 27.2% during the fourth quarter. Keener Financial Planning LLC now owns 9,147 shares of the computer hardware maker's stock worth $1,705,000 after acquiring an additional 1,957 shares during the period.  Timber Creek Capital Management LLC acquired a new position in  NVIDIA during the fourth quarter worth about $8,204,000.  Finally, BCR Wealth Strategies LLC grew its holdings in  NVIDIA by 6.0% during the fourth quarter. BCR Wealth Strategies LLC now owns 3,538 shares of the computer hardware maker's stock worth $659,000 after acquiring an additional 200 shares during the period. 65.27% of the stock is owned by institutional investors and hedge funds. Shares of NVDA opened at $198.45 on Friday. The stock has a market capitalization of $4.82 trillion, a P/E ratio of 40.50, a P/E/G ratio of 0.66 and a beta of 2.25. NVIDIA Corporation has a 1-year low of $110.82 and a 1-year high of $216.82. The company has a current ratio of 3.91, a quick ratio of 3.24 and a debt-to-equity ratio of 0.05. The business's 50-day moving average price is $186.75 and its 200 day moving average price is $186.15. NVIDIA (NASDAQ:NVDA - Get Free Report) last announced its quarterly earnings data on Wednesday, February 25th. The computer hardware maker reported $1.62 earnings per share (EPS) for the quarter, topping the consensus estimate of $1.54 by $0.08. NVIDIA had a return on equity of 97.37% and a net margin of 55.60%.The firm had revenue of $68.13 billion during the quarter, compared to the consensus estimate of $65.56 billion. During the same period in the prior year, the business earned $0.89 EPS. The business's revenue for the quarter was up 73.2% on a year-over-year basis.  Analysts expect that  NVIDIA Corporation will post 7.78 earnings per share for the current year. The firm also recently announced a quarterly dividend, which was paid on Wednesday, April 1st. Shareholders of record on Wednesday, March 11th were paid a dividend of $0.01 per share. This represents a $0.04 annualized dividend and a yield of 0.0%. The ex-dividend date of this dividend was Wednesday, March 11th. NVIDIA's payout ratio is 0.82%. In other NVIDIA news, Director John Dabiri sold 3,004 shares of NVIDIA stock in a transaction dated Friday, March 13th. The stock was sold at an average price of $184.90, for a total transaction of $555,439.60. Following the transaction, the director owned 14,788 shares of the company's stock, valued at $2,734,301.20. The trade was a 16.88% decrease in their position. The transaction was disclosed in a legal filing with the SEC, which is available through this hyperlink. Also, Director Mark A. Stevens sold 221,682 shares of NVIDIA stock in a transaction dated Friday, March 20th. The shares were sold at an average price of $173.68, for a total value of $38,501,729.76. Following the transaction, the director directly owned 7,399,771 shares in the company, valued at approximately $1,285,192,227.28. This trade represents a 2.91% decrease in their position. The SEC filing for this sale provides additional information. Over the last quarter, insiders have sold 953,976 shares of company stock worth $171,173,819. Company insiders own  4.17% of the company's stock. Here are the key news stories impacting NVIDIA this week: A number of research firms recently issued reports on NVDA. Benchmark  reaffirmed a ""buy"" rating and set a $250.00 target price on shares of NVIDIA in a report on Tuesday, March 31st. Sanford C. Bernstein  reaffirmed a ""buy"" rating on shares of NVIDIA in a report on Friday, April 17th. Needham & Company LLC  reissued a ""buy"" rating and issued a $240.00 price target on shares of NVIDIA in a research note on Wednesday, March 18th. Mizuho  set a $275.00 price target on NVIDIA and gave the stock an ""outperform"" rating in a research note on Friday, January 9th. Finally, Cantor Fitzgerald  reissued an ""overweight"" rating and issued a $300.00 price target on shares of NVIDIA in a research note on Monday, March 23rd. Four equities research analysts have rated the stock with a Strong Buy rating, forty-eight have issued  a Buy rating and two have assigned  a Hold rating to the stock. According to data from MarketBeat.com, NVIDIA presently has a consensus rating of ""Buy"" and a consensus target price of $275.25. NVIDIA Corporation, founded in 1993 and headquartered in Santa Clara, California, is a global technology company that designs and develops graphics processing units (GPUs) and system-on-chip (SoC) technologies. Co-founded by Jensen Huang, who serves as president and chief executive officer, along with Chris Malachowsky and Curtis Priem, NVIDIA has grown from a graphics-focused chipmaker into a broad provider of accelerated computing hardware and software for multiple industries. The company's product portfolio spans discrete GPUs for gaming and professional visualization (marketed under the GeForce and NVIDIA RTX lines), high-performance data center accelerators used for AI training and inference (including widely adopted platforms such as the A100 and H100 series), and Tegra SoCs for automotive and edge applications. Want to see what other hedge funds are holding NVDA? Visit HoldingsChannel.com to get the latest 13F filings and insider trades for NVIDIA Corporation (NASDAQ:NVDA - Free Report). This instant news alert was generated by narrative science technology and financial data from MarketBeat in order to provide readers with the fastest reporting and unbiased coverage. Please send any questions or comments about this story to contact@marketbeat.com. Before you consider NVIDIA, you'll want to hear this. MarketBeat keeps track of Wall Street's top-rated and best performing research analysts and the stocks they recommend to their clients on a daily basis. MarketBeat has identified the five stocks that top analysts are quietly whispering to their clients to buy now before the broader market catches on... and NVIDIA wasn't on the list. While NVIDIA currently has a Buy rating among analysts, top-rated analysts believe these five stocks are better buys. Click the link to see MarketBeat's list of seven best retirement stocks and why they should be in your portfolio. Sign up for MarketBeat All Access to gain access to MarketBeat's full suite of research tools. 345 N Reid Place, Suite 620, Sioux Falls, SD 57103
                                        
                                        contact@marketbeat.com
                                        
                                        (844) 978-6257 © MarketBeat Media, LLC 2010-2026. All rights reserved. © 2026   Fair market value prices are updated every minute and are provided by Massive. Other market data provided is at least 10-minutes delayed and hosted by Barchart Solutions.  Information is provided 'as-is' and solely for informational purposes, not for trading purposes or advice, and is delayed. To see all exchange delays and terms of use please see Barchart's disclaimer. We and our partners share information on your use of this website to help improve your experience. For more information, or to opt out click the Do Not Sell My Information button below.",https://www.marketbeat.com/instant-alerts/filing-tyche-wealth-partners-llc-cuts-holdings-in-nvidia-corporation-nvda-2026-05-02/
NVDA,"NVIDIA’s Defense Deals Recast AI Growth, Risk And China Exposure - simplywall.st",2026-05-02 12:49:13,"For investors, this adds a new dimension to the NVIDIA story beyond commercial cloud and enterprise customers. The company is already central to many AI data center builds, and classified U.S. government deployments point to use cases in secure, high sensitivity environments. Together with export controls and local content rules in China, the business now sits at the intersection of AI infrastructure and geopolitics. Readers may want to watch how much of NVIDIA's data center revenue base ties back to sovereign and defense infrastructure versus more traditional cloud and internet platforms. The balance between constrained access to some overseas markets and expanded opportunities with U.S. agencies could influence the risk profile of NVIDIA's AI hardware business over time. Stay updated on the most important news stories for NVIDIA by adding it to your watchlist or portfolio. Alternatively, explore our Community to discover new perspectives on NVIDIA. 📰 Beyond the headline: 2 risks and 4 things going right for NVIDIA that every investor should see. There is only one way to know the right time to buy, sell or hold NVIDIA. Head to Simply Wall St's
company report for the latest analysis of NVIDIA's fair value. For the full picture, including more risks and rewards, check out the
complete NVIDIA analysis. Alternatively, you can visit the
community page for NVIDIA to see how other investors believe this latest news will impact the company's narrative. This article by Simply Wall St is general in nature. We provide commentary based on historical data
    and analyst forecasts only using an unbiased methodology and our articles are not intended to be financial advice. It does not constitute a recommendation to buy or sell any stock, and does not take account of your objectives, or your
    financial situation. We aim to bring you long-term focused analysis driven by fundamental data.
    Note that our analysis may not factor in the latest price-sensitive company announcements or qualitative material.
    Simply Wall St has no position in any stocks mentioned. Discover if NVIDIA might be undervalued or overvalued with our detailed analysis, featuring fair value estimates, potential risks, dividends, insider trades, and its financial condition. Have feedback on this article? Concerned about the content? Get in touch with us directly. Alternatively, email editorial-team@simplywallst.com Operates as a data center scale AI infrastructure company. Exceptional growth potential with flawless balance sheet. Financial Data provided by S&P Global Market Intelligence LLC, analysis provided by Simply Wall Street Pty Ltd. Copyright © 2026, S&P Global Market Intelligence LLC. All rights reserved. Simply Wall Street Pty Ltd (ACN 600 056 611), is a Corporate Authorised Representative (Authorised Representative Number: 467183) of Sanlam Private Wealth Pty Ltd (AFSL No. 337927). Any advice contained in this website is general advice only and has been prepared without considering your objectives, financial situation or needs. You should not rely on any advice and/or information contained in this website and before making any investment decision we recommend that you consider whether it is appropriate for your situation and seek appropriate financial, taxation and legal advice. Please read our Financial Services Guide before deciding whether to obtain financial services from us. © 2026 Simply Wall Street Pty Ltd, US Design Patent #29/544/281, Community and European Design Registration #2845206",https://simplywall.st/stocks/us/semiconductors/nasdaq-nvda/nvidia/news/nvidias-defense-deals-recast-ai-growth-risk-and-china-exposu
