ticker,title,date,content,url
NVDA,Nvidia Backs Firmus To Shape Asia Pacific AI Data Center Future - simplywall.st,2026-04-07 12:24:15,"NVIDIA (NasdaqGS:NVDA), which last closed at $177.64, has been a major reference point for AI exposed equities, with a 1 year return of 82.0%. Over 3 years, the stock's gain has been very large, and over 5 years it has risen by more than 10x. This underscores how closely investors have tied the company to the build out of AI. In the shorter term, the shares are up 7.5% over the past week, broadly flat over 30 days, and show a 5.9% decline year to date. This provides context for this new capital commitment in Asia Pacific data centers. This funding round in Firmus highlights how Nvidia is operating as both a supplier and a capital partner in AI infrastructure projects, particularly in regions where data center capacity is still being built out. For investors, moves like this can be useful to track as they speak to how Nvidia is positioning its ecosystem, from chips and systems to the physical facilities that will run Nvidia powered workloads across new geographies. Stay updated on the most important news stories for NVIDIA by adding it to your watchlist or portfolio. Alternatively, explore our Community to discover new perspectives on NVIDIA. We've flagged 2 risks for NVIDIA. See which could impact your investment. Nvidia’s decision to co lead the US$505m round in Firmus looks less like a one off cheque and more like another step in turning its AI hardware into a regional infrastructure standard. By backing a data center builder that is committed to rolling out next generation Nvidia powered systems across Asia Pacific, the company is effectively helping seed long term demand for its GPUs, networking and software in markets where AI capacity is still being built. This sits alongside other partnerships in energy, telecoms and cloud where Nvidia is trying to make its AI factory designs the default choice for new builds, even as competitors like AMD, Intel and Broadcom push their own accelerators and fabrics. For you, the key angle is how much value comes from Nvidia acting as both supplier and capital partner. That can deepen customer ties but also raises questions about returns on these equity stakes and how much AI infrastructure spending is linked to Nvidia supported projects rather than purely independent demand. Knowing what a company is worth starts with understanding its story.
 Check out one of the top narratives in the Simply Wall St Community for NVIDIA to help decide what it's worth to you. From here, focus on how quickly Firmus announces concrete data center projects, which Nvidia platforms those sites are built around, and whether similar co investment deals appear in other regions. It is also worth tracking disclosures around the total size of Nvidia’s equity book in AI customers, plus any commentary on returns or write downs, because that will show how this supplier plus capital partner model is playing out in practice. Finally, keep an eye on how rivals such as AMD, Intel and Broadcom win or lose share in new Asia Pacific AI data centers, as that will help indicate whether Nvidia backed projects meaningfully shift the competitive balance. To ensure you're always in the loop on how the latest news impacts the investment narrative for NVIDIA, head to the
 community page for NVIDIA to never miss an update on the top community narratives. This article by Simply Wall St is general in nature. We provide commentary based on historical data
    and analyst forecasts only using an unbiased methodology and our articles are not intended to be financial advice. It does not constitute a recommendation to buy or sell any stock, and does not take account of your objectives, or your
    financial situation. We aim to bring you long-term focused analysis driven by fundamental data.
    Note that our analysis may not factor in the latest price-sensitive company announcements or qualitative material.
    Simply Wall St has no position in any stocks mentioned. Discover if NVIDIA might be undervalued or overvalued with our detailed analysis, featuring fair value estimates, potential risks, dividends, insider trades, and its financial condition. Have feedback on this article? Concerned about the content? Get in touch with us directly. Alternatively, email editorial-team@simplywallst.com Operates as a data center scale AI infrastructure company. Exceptional growth potential with flawless balance sheet. Financial Data provided by S&P Global Market Intelligence LLC, analysis provided by Simply Wall Street Pty Ltd. Copyright © 2026, S&P Global Market Intelligence LLC. All rights reserved. Simply Wall Street Pty Ltd (ACN 600 056 611), is a Corporate Authorised Representative (Authorised Representative Number: 467183) of Sanlam Private Wealth Pty Ltd (AFSL No. 337927). Any advice contained in this website is general advice only and has been prepared without considering your objectives, financial situation or needs. You should not rely on any advice and/or information contained in this website and before making any investment decision we recommend that you consider whether it is appropriate for your situation and seek appropriate financial, taxation and legal advice. Please read our Financial Services Guide before deciding whether to obtain financial services from us. © 2026 Simply Wall Street Pty Ltd, US Design Patent #29/544/281, Community and European Design Registration #2845206",https://simplywall.st/stocks/us/semiconductors/nasdaq-nvda/nvidia/news/nvidia-backs-firmus-to-shape-asia-pacific-ai-data-center-fut
NVDA,NVIDIA (NVDA) closes above ___ on April 8? Trading Odds & Predictions - Polymarket,2026-04-07 12:19:42,"NVIDIA (NVDA) shares closed April 7, 2026, at $178.10, up slightly from $177.64 the prior day amid intraday volatility (low $173.66, high $178.21) on elevated volume exceeding 100 million shares, reflecting trader consolidation after February's blockbuster fiscal Q4 revenue of $68.1 billion that beat estimates and underscored sustained AI GPU demand from Blackwell platforms. Polymarket's skin-in-the-game consensus prices above-$175 at 79% implied probability and above-$170 at 85%, signaling confidence in holding current levels barring downside surprises, while above-$180 odds languish at 10% due to stretched valuations (forward P/E ~45x) and broader semiconductor sector caution. No major catalysts loom before May 20 earnings, leaving macro risk appetite and technical support near $175 as key swing factors for April 8's close. Polymarket operates globally through separate legal entities. Polymarket US is operated by QCX LLC d/b/a Polymarket US, a CFTC-regulated Designated Contract Market. This international platform is not regulated by the CFTC and operates independently. Trading involves substantial risk of loss. See our Terms of Service & Privacy Policy.",https://polymarket.com/event/nvda-close-above-on-april-8-2026
NVDA,"Surience Private Wealth LLC Sells 6,795 Shares of NVIDIA Corporation $NVDA - MarketBeat",2026-04-07 09:31:45,"Surience Private Wealth LLC lessened its position in shares of  NVIDIA Corporation (NASDAQ:NVDA - Free Report) by 29.5% during the fourth quarter, according to its most recent filing with the Securities and Exchange Commission (SEC). The fund owned 16,264 shares of the computer hardware maker's stock after selling 6,795 shares during the period. NVIDIA accounts for  3.3% of Surience Private Wealth LLC's investment portfolio, making the stock its 13th largest position. Surience Private Wealth LLC's holdings in NVIDIA were worth $3,033,000 at the end of the most recent reporting period. Several other institutional investors and hedge funds also recently made changes to their positions in the company. Norges Bank bought a new position in  NVIDIA during the second quarter worth about $51,386,863,000.  Capital Research Global Investors increased its stake in shares of  NVIDIA by 16.1% in the third quarter. Capital Research Global Investors now owns 165,377,852 shares of the computer hardware maker's stock worth $30,855,564,000 after purchasing an additional 22,896,705 shares in the last quarter.  Laurel Wealth Advisors LLC raised its position in shares of  NVIDIA by 15,496.1% in the second quarter. Laurel Wealth Advisors LLC now owns 21,865,525 shares of the computer hardware maker's stock valued at $3,454,534,000 after purchasing an additional 21,725,326 shares during the period.  Danske Bank A S purchased a new stake in shares of  NVIDIA during the 3rd quarter valued at approximately $3,180,313,000.  Finally, Massachusetts Financial Services Co. MA lifted its stake in shares of  NVIDIA by 25.0% during the 3rd quarter. Massachusetts Financial Services Co. MA now owns 71,720,593 shares of the computer hardware maker's stock valued at $13,381,628,000 after buying an additional 14,358,048 shares in the last quarter. Institutional investors own  65.27% of the company's stock. Here are the key news stories impacting NVIDIA this week: In related news, Director Mark A. Stevens sold 221,682 shares of the firm's stock in a transaction that occurred on Friday, March 20th. The shares were sold at an average price of $173.68, for a total value of $38,501,729.76. Following the sale, the director directly owned 7,399,771 shares of the company's stock, valued at $1,285,192,227.28. This trade represents a 2.91% decrease in their ownership of the stock. The sale was disclosed in a document filed with the SEC, which is available through the SEC website. Also, CFO Colette Kress sold 42,650 shares of NVIDIA stock in a transaction that occurred on Friday, March 20th. The shares were sold at an average price of $174.89, for a total transaction of $7,459,058.50. Following the sale, the chief financial officer owned 881,387 shares of the company's stock, valued at approximately $154,145,772.43. The trade was a 4.62% decrease in their ownership of the stock. The SEC filing for this sale provides additional information. Over the last three months, insiders have sold 1,401,616 shares of company stock worth $253,555,407. Insiders own  4.17% of the company's stock. Shares of NVDA stock opened at $177.64 on Tuesday. The company has a market capitalization of $4.32 trillion, a PE ratio of 36.25, a price-to-earnings-growth ratio of 0.59 and a beta of 2.34. NVIDIA Corporation has a 52-week low of $86.62 and a 52-week high of $212.19. The business's fifty day moving average is $182.24 and its 200 day moving average is $184.34. The company has a debt-to-equity ratio of 0.05, a quick ratio of 3.24 and a current ratio of 3.91. NVIDIA (NASDAQ:NVDA - Get Free Report) last posted its earnings results on Wednesday, February 25th. The computer hardware maker reported $1.62 EPS for the quarter, topping the consensus estimate of $1.54 by $0.08. NVIDIA had a return on equity of 97.37% and a net margin of 55.60%.The business had revenue of $68.13 billion during the quarter, compared to analysts' expectations of $65.56 billion. During the same period in the previous year, the business earned $0.89 earnings per share. The firm's revenue was up 73.2% on a year-over-year basis.  On average, equities research analysts anticipate that  NVIDIA Corporation will post 2.77 EPS for the current fiscal year. The business also recently disclosed a quarterly dividend, which was paid on Wednesday, April 1st. Investors of record on Wednesday, March 11th were given a $0.01 dividend. This represents a $0.04 annualized dividend and a dividend yield of 0.0%. The ex-dividend date was Wednesday, March 11th. NVIDIA's dividend payout ratio  is 0.82%. A number of research analysts recently weighed in on NVDA shares. Fundamental Research  set a $218.00 price objective on shares of NVIDIA in a research note on Thursday, February 26th. Wolfe Research increased their target price on NVIDIA from $250.00 to $275.00 and gave the stock an ""outperform"" rating in a research report on Friday, January 30th. Needham & Company LLC  reaffirmed a ""buy"" rating and issued a $240.00 price target on shares of NVIDIA in a report on Wednesday, March 18th. Raymond James Financial lifted their price target on NVIDIA from $291.00 to $323.00 and gave the company a ""strong-buy"" rating in a research report on Thursday, March 19th. Finally, William Blair  set a $300.00 price objective on NVIDIA in a research note on Thursday, March 12th. Four analysts have rated the stock with a Strong Buy rating, forty-seven have given a Buy rating and two have issued  a Hold rating to the company's stock. According to MarketBeat, the company currently has a consensus rating of ""Buy"" and an average target price of $275.25. NVIDIA Corporation, founded in 1993 and headquartered in Santa Clara, California, is a global technology company that designs and develops graphics processing units (GPUs) and system-on-chip (SoC) technologies. Co-founded by Jensen Huang, who serves as president and chief executive officer, along with Chris Malachowsky and Curtis Priem, NVIDIA has grown from a graphics-focused chipmaker into a broad provider of accelerated computing hardware and software for multiple industries. The company's product portfolio spans discrete GPUs for gaming and professional visualization (marketed under the GeForce and NVIDIA RTX lines), high-performance data center accelerators used for AI training and inference (including widely adopted platforms such as the A100 and H100 series), and Tegra SoCs for automotive and edge applications. This instant news alert was generated by narrative science technology and financial data from MarketBeat in order to provide readers with the fastest reporting and unbiased coverage. Please send any questions or comments about this story to contact@marketbeat.com. Before you consider NVIDIA, you'll want to hear this. MarketBeat keeps track of Wall Street's top-rated and best performing research analysts and the stocks they recommend to their clients on a daily basis. MarketBeat has identified the five stocks that top analysts are quietly whispering to their clients to buy now before the broader market catches on... and NVIDIA wasn't on the list. While NVIDIA currently has a Buy rating among analysts, top-rated analysts believe these five stocks are better buys. Looking for the next FAANG stock before everyone has heard about it? Click the link to see which stocks MarketBeat analysts think might become the next trillion dollar tech company. Sign up for MarketBeat All Access to gain access to MarketBeat's full suite of research tools. 345 N Reid Place, Suite 620, Sioux Falls, SD 57103
                                        
                                        contact@marketbeat.com
                                        
                                        (844) 978-6257 © MarketBeat Media, LLC 2010-2026. All rights reserved. © 2026   Fair market value prices are updated every minute and are provided by Massive. Other market data provided is at least 10-minutes delayed and hosted by Barchart Solutions.  Information is provided 'as-is' and solely for informational purposes, not for trading purposes or advice, and is delayed. To see all exchange delays and terms of use please see Barchart's disclaimer. We and our partners share information on your use of this website to help improve your experience. For more information, or to opt out click the Do Not Sell My Information button below.",https://www.marketbeat.com/instant-alerts/filing-surience-private-wealth-llc-sells-6795-shares-of-nvidia-corporation-nvda-2026-04-07/
NVDA,"Praetorian Wealth Management Inc. Acquires 3,110 Shares of NVIDIA Corporation $NVDA - MarketBeat",2026-04-07 09:17:55,"Praetorian Wealth Management Inc. raised its holdings in shares of  NVIDIA Corporation (NASDAQ:NVDA - Free Report) by 109.7% in the fourth quarter, according to its most recent 13F filing with the Securities and Exchange Commission (SEC). The fund owned 5,944 shares of the computer hardware maker's stock after purchasing an additional 3,110 shares during the period. Praetorian Wealth Management Inc.'s holdings in NVIDIA were worth $1,109,000 at the end of the most recent reporting period. A number of other hedge funds and other institutional investors have also bought and sold shares of NVDA. Winnow Wealth LLC bought a new position in  NVIDIA during the 2nd quarter valued at approximately $32,000.  Longfellow Investment Management Co. LLC raised its position in  NVIDIA by 47.9% during the 2nd quarter. Longfellow Investment Management Co. LLC now owns 207 shares of the computer hardware maker's stock valued at $33,000 after purchasing an additional 67 shares during the last quarter.  Spurstone Advisory Services LLC bought a new position in  NVIDIA during the 2nd quarter valued at approximately $40,000.  Sellwood Investment Partners LLC bought a new position in  NVIDIA during the 3rd quarter valued at approximately $50,000.  Finally, EDENTREE ASSET MANAGEMENT Ltd bought a new position in shares of  NVIDIA in the 2nd quarter worth approximately $54,000. Institutional investors own  65.27% of the company's stock. Several brokerages have recently issued reports on NVDA. Needham & Company LLC  reissued a ""buy"" rating and issued a $240.00 target price on shares of NVIDIA in a research report on Wednesday, March 18th. CICC Research increased their target price on NVIDIA from $228.00 to $240.60 and gave the stock an ""outperform"" rating in a research report on Friday, February 27th. TD Cowen  reissued a ""buy"" rating and issued a $235.00 target price on shares of NVIDIA in a research report on Tuesday, March 17th. Rothschild & Co Redburn increased their target price on NVIDIA from $245.00 to $268.00 and gave the stock a ""buy"" rating in a research report on Thursday, January 15th. Finally, Cantor Fitzgerald  reissued an ""overweight"" rating and issued a $300.00 target price on shares of NVIDIA in a research report on Monday, March 23rd. Four research analysts have rated the stock with a Strong Buy rating, forty-seven have given a Buy rating and two have given a Hold rating to the company. According to data from MarketBeat, the company  has a consensus rating of ""Buy"" and a consensus price target of $275.25. In other NVIDIA news, Director Mark A. Stevens sold 221,682 shares of the stock in a transaction on Friday, March 20th. The stock was sold at an average price of $173.68, for a total transaction of $38,501,729.76. Following the sale, the director directly owned 7,399,771 shares in the company, valued at approximately $1,285,192,227.28. This trade represents a 2.91% decrease in their position. The sale was disclosed in a document filed with the SEC, which is accessible through this hyperlink. Also, Director Aarti S. Shah sold 19,000 shares of the stock in a transaction on Thursday, March 19th. The shares were sold at an average price of $176.71, for a total value of $3,357,490.00. Following the sale, the director owned 36,007 shares in the company, valued at approximately $6,362,796.97. This represents a 34.54% decrease in their ownership of the stock. Additional details regarding this sale are available in the official SEC disclosure. In the last quarter, insiders sold 1,401,616 shares of company stock worth $253,555,407. Insiders own  4.17% of the company's stock. NVIDIA stock opened at $177.64 on Tuesday. The company has a quick ratio of 3.24, a current ratio of 3.91 and a debt-to-equity ratio of 0.05. The company has a market capitalization of $4.32 trillion, a P/E ratio of 36.25, a PEG ratio of 0.59 and a beta of 2.34. The stock's 50 day moving average is $182.24 and its 200 day moving average is $184.34. NVIDIA Corporation has a twelve month low of $86.62 and a twelve month high of $212.19. NVIDIA (NASDAQ:NVDA - Get Free Report) last issued its earnings results on Wednesday, February 25th. The computer hardware maker reported $1.62 EPS for the quarter, beating the consensus estimate of $1.54 by $0.08. NVIDIA had a return on equity of 97.37% and a net margin of 55.60%.The business had revenue of $68.13 billion for the quarter, compared to the consensus estimate of $65.56 billion. During the same period last year, the business posted $0.89 EPS. The company's revenue was up 73.2% compared to the same quarter last year.  On average, equities research analysts predict that  NVIDIA Corporation will post 2.77 earnings per share for the current fiscal year. The firm also recently announced a quarterly dividend, which was paid on Wednesday, April 1st. Shareholders of record on Wednesday, March 11th were paid a dividend of $0.01 per share. This represents a $0.04 annualized dividend and a yield of 0.0%. The ex-dividend date was Wednesday, March 11th. NVIDIA's dividend payout ratio (DPR) is currently 0.82%. Here are the key news stories impacting NVIDIA this week: NVIDIA Corporation, founded in 1993 and headquartered in Santa Clara, California, is a global technology company that designs and develops graphics processing units (GPUs) and system-on-chip (SoC) technologies. Co-founded by Jensen Huang, who serves as president and chief executive officer, along with Chris Malachowsky and Curtis Priem, NVIDIA has grown from a graphics-focused chipmaker into a broad provider of accelerated computing hardware and software for multiple industries. The company's product portfolio spans discrete GPUs for gaming and professional visualization (marketed under the GeForce and NVIDIA RTX lines), high-performance data center accelerators used for AI training and inference (including widely adopted platforms such as the A100 and H100 series), and Tegra SoCs for automotive and edge applications. Want to see what other hedge funds are holding NVDA? Visit HoldingsChannel.com to get the latest 13F filings and insider trades for NVIDIA Corporation (NASDAQ:NVDA - Free Report). This instant news alert was generated by narrative science technology and financial data from MarketBeat in order to provide readers with the fastest reporting and unbiased coverage. Please send any questions or comments about this story to contact@marketbeat.com. Before you consider NVIDIA, you'll want to hear this. MarketBeat keeps track of Wall Street's top-rated and best performing research analysts and the stocks they recommend to their clients on a daily basis. MarketBeat has identified the five stocks that top analysts are quietly whispering to their clients to buy now before the broader market catches on... and NVIDIA wasn't on the list. While NVIDIA currently has a Buy rating among analysts, top-rated analysts believe these five stocks are better buys. Thinking about investing in Meta, Roblox, or Unity? Click the link to learn what streetwise investors need to know about the metaverse and public markets before making an investment. Sign up for MarketBeat All Access to gain access to MarketBeat's full suite of research tools. 345 N Reid Place, Suite 620, Sioux Falls, SD 57103
                                        
                                        contact@marketbeat.com
                                        
                                        (844) 978-6257 © MarketBeat Media, LLC 2010-2026. All rights reserved. © 2026   Fair market value prices are updated every minute and are provided by Massive. Other market data provided is at least 10-minutes delayed and hosted by Barchart Solutions.  Information is provided 'as-is' and solely for informational purposes, not for trading purposes or advice, and is delayed. To see all exchange delays and terms of use please see Barchart's disclaimer. We and our partners share information on your use of this website to help improve your experience. For more information, or to opt out click the Do Not Sell My Information button below.",https://www.marketbeat.com/instant-alerts/filing-praetorian-wealth-management-inc-acquires-3110-shares-of-nvidia-corporation-nvda-2026-04-07/
