ticker,title,date,content,url
NVDA,NVIDIA Corporation $NVDA Stake Lifted by Galvin Gaustad & Stein LLC - MarketBeat,2026-05-01 08:06:00,"Galvin Gaustad & Stein LLC increased its stake in shares of  NVIDIA Corporation (NASDAQ:NVDA - Free Report) by 223.6% in the fourth quarter, according to the company in its most recent 13F filing with the Securities and Exchange Commission (SEC). The fund owned 89,273 shares of the computer hardware maker's stock after buying an additional 61,683 shares during the quarter. NVIDIA comprises approximately  1.3% of Galvin Gaustad & Stein LLC's holdings, making the stock its 28th largest position. Galvin Gaustad & Stein LLC's holdings in NVIDIA were worth $16,649,000 at the end of the most recent reporting period. A number of other institutional investors have also recently added to or reduced their stakes in NVDA. Norges Bank bought a new position in  NVIDIA during the 2nd quarter worth $51,386,863,000.  Capital Research Global Investors grew its stake in  NVIDIA by 16.1% during the 3rd quarter. Capital Research Global Investors now owns 165,377,852 shares of the computer hardware maker's stock worth $30,855,564,000 after buying an additional 22,896,705 shares during the last quarter.  Laurel Wealth Advisors LLC grew its stake in  NVIDIA by 15,496.1% during the 2nd quarter. Laurel Wealth Advisors LLC now owns 21,865,525 shares of the computer hardware maker's stock worth $3,454,534,000 after buying an additional 21,725,326 shares during the last quarter.  Danske Bank A S bought a new position in  NVIDIA during the 3rd quarter worth $3,180,313,000.  Finally, Massachusetts Financial Services Co. MA grew its stake in shares of  NVIDIA by 25.0% in the third quarter. Massachusetts Financial Services Co. MA now owns 71,720,593 shares of the computer hardware maker's stock worth $13,381,628,000 after purchasing an additional 14,358,048 shares in the last quarter. 65.27% of the stock is currently owned by institutional investors. A number of brokerages recently weighed in on NVDA. DA Davidson  restated a ""buy"" rating and set a $250.00 price objective on shares of NVIDIA in a research note on Monday, February 23rd. Citigroup started coverage on shares of NVIDIA in a research report on Wednesday, April 15th. They issued a ""buy"" rating for the company. New Street Research decreased their target price on shares of NVIDIA from $307.00 to $275.00 and set a ""buy"" rating for the company in a research report on Tuesday, March 31st. Weiss Ratings  reiterated a ""buy (b)"" rating on shares of NVIDIA in a research report on Friday, April 10th. Finally, Wall Street Zen lowered shares of NVIDIA from a ""strong-buy"" rating to a ""buy"" rating in a research report on Sunday, April 26th. Four analysts have rated the stock with a Strong Buy rating, forty-eight have assigned  a Buy rating and two have assigned  a Hold rating to the company. According to MarketBeat, the company presently has a consensus rating of ""Buy"" and an average target price of $275.25. In other news, Director John Dabiri sold 3,004 shares of the company's stock in a transaction on Friday, March 13th. The stock was sold at an average price of $184.90, for a total transaction of $555,439.60. Following the completion of the sale, the director directly owned 14,788 shares of the company's stock, valued at $2,734,301.20. This represents a 16.88% decrease in their ownership of the stock. The sale was disclosed in a document filed with the SEC, which is available at the SEC website. Also, Director Mark A. Stevens sold 221,682 shares of the company's stock in a transaction on Friday, March 20th. The shares were sold at an average price of $173.68, for a total value of $38,501,729.76. Following the transaction, the director directly owned 7,399,771 shares in the company, valued at $1,285,192,227.28. The trade was a 2.91% decrease in their ownership of the stock. Additional details regarding this sale are available in the official SEC disclosure. Insiders sold a total of 953,976 shares of company stock valued at $171,173,819 over the last 90 days. 4.17% of the stock is owned by insiders. Shares of NASDAQ NVDA opened at $199.57 on Friday. NVIDIA Corporation has a 12 month low of $110.82 and a 12 month high of $216.82. The company has a market cap of $4.85 trillion, a price-to-earnings ratio of 40.73, a P/E/G ratio of 0.69 and a beta of 2.34. The company has a quick ratio of 3.24, a current ratio of 3.91 and a debt-to-equity ratio of 0.05. The business has a fifty day simple moving average of $186.75 and a 200-day simple moving average of $186.15. NVIDIA (NASDAQ:NVDA - Get Free Report) last announced its earnings results on Wednesday, February 25th. The computer hardware maker reported $1.62 EPS for the quarter, beating the consensus estimate of $1.54 by $0.08. NVIDIA had a return on equity of 97.37% and a net margin of 55.60%.The business had revenue of $68.13 billion during the quarter, compared to the consensus estimate of $65.56 billion. During the same period in the prior year, the business posted $0.89 earnings per share. NVIDIA's revenue was up 73.2% compared to the same quarter last year.  Sell-side analysts predict that  NVIDIA Corporation will post 7.78 EPS for the current year. The business also recently announced a quarterly dividend, which was paid on Wednesday, April 1st. Stockholders of record on Wednesday, March 11th were issued a dividend of $0.01 per share. This represents a $0.04 annualized dividend and a dividend yield of 0.0%. The ex-dividend date of this dividend was Wednesday, March 11th. NVIDIA's dividend payout ratio  is currently 0.82%. Here are the key news stories impacting NVIDIA this week: NVIDIA Corporation, founded in 1993 and headquartered in Santa Clara, California, is a global technology company that designs and develops graphics processing units (GPUs) and system-on-chip (SoC) technologies. Co-founded by Jensen Huang, who serves as president and chief executive officer, along with Chris Malachowsky and Curtis Priem, NVIDIA has grown from a graphics-focused chipmaker into a broad provider of accelerated computing hardware and software for multiple industries. The company's product portfolio spans discrete GPUs for gaming and professional visualization (marketed under the GeForce and NVIDIA RTX lines), high-performance data center accelerators used for AI training and inference (including widely adopted platforms such as the A100 and H100 series), and Tegra SoCs for automotive and edge applications. Want to see what other hedge funds are holding NVDA? Visit HoldingsChannel.com to get the latest 13F filings and insider trades for NVIDIA Corporation (NASDAQ:NVDA - Free Report). This instant news alert was generated by narrative science technology and financial data from MarketBeat in order to provide readers with the fastest reporting and unbiased coverage. Please send any questions or comments about this story to contact@marketbeat.com. Before you consider NVIDIA, you'll want to hear this. MarketBeat keeps track of Wall Street's top-rated and best performing research analysts and the stocks they recommend to their clients on a daily basis. MarketBeat has identified the five stocks that top analysts are quietly whispering to their clients to buy now before the broader market catches on... and NVIDIA wasn't on the list. While NVIDIA currently has a Buy rating among analysts, top-rated analysts believe these five stocks are better buys. Just getting into the stock market? These 10 simple stocks can help beginning investors build long-term wealth without knowing options, technicals, or other advanced strategies. Sign up for MarketBeat All Access to gain access to MarketBeat's full suite of research tools. 345 N Reid Place, Suite 620, Sioux Falls, SD 57103
                                        
                                        contact@marketbeat.com
                                        
                                        (844) 978-6257 © MarketBeat Media, LLC 2010-2026. All rights reserved. © 2026   Fair market value prices are updated every minute and are provided by Massive. Other market data provided is at least 10-minutes delayed and hosted by Barchart Solutions.  Information is provided 'as-is' and solely for informational purposes, not for trading purposes or advice, and is delayed. To see all exchange delays and terms of use please see Barchart's disclaimer. We and our partners share information on your use of this website to help improve your experience. For more information, or to opt out click the Do Not Sell My Information button below.",https://www.marketbeat.com/instant-alerts/filing-nvidia-corporation-nvda-stake-lifted-by-galvin-gaustad-stein-llc-2026-05-01/
NVDA,Earn 10% Today or Buy NVDA 30% Cheaper - It's a Win-Win - Trefis,2026-05-01 07:48:24,"Earn 10% Today or Buy NVDA 30% Cheaper - It's a Win-Win At about $199.57 a share, NVIDIA (NVDA) is trading  about 7.9% below its 52W high. Do you think NVDA stock is a good long-term bet at current levels? What about at a 30% discount at about $140 per share? If you think that's a steal, and have some cash ready to go, here's a trade. 10% annualized yield at 30% margin of safety, by selling Put Options. ©Copyright 2026 Insight Guru Inc. All Rights Reserved. By using the Site, you agree to be bound by our Terms of
		Use.  Financial market data powered by Quotemedia.com.
		Consensus EPS estimates are from QuoteMedia and are updated every weekday.
		All rights reserved. NYSE/AMEX data delayed 20 minutes.  NASDAQ and other
		data delayed 15 minutes unless indicated. This interactive model has a limit on the number of drivers that can be modified in a single scenario.  When the limit is reached those drivers not yet modified become disabled for modification.
	
Your options are: This interactive model has a minimum and/or maximum limit on the value for the current driver you are viewing. This driver cannot be modified within this scenario. This scenario is linked to a parent scenario that has already modified this driver.",https://www.trefis.com/data/companies/NVDA/no-login-required/jBaRr5OW/Earn-10-Today-or-Buy-NVDA-30-Cheaper-It-s-a-Win-Win
NVDA,Assetmark Inc. Boosts Stock Holdings in NVIDIA Corporation $NVDA - MarketBeat,2026-05-01 07:41:37,"Assetmark Inc. increased its stake in shares of  NVIDIA Corporation (NASDAQ:NVDA - Free Report) by 0.7% during the 4th quarter, according to the company in its most recent filing with the SEC. The fund owned 5,782,913 shares of the computer hardware maker's stock after purchasing an additional 38,031 shares during the quarter. NVIDIA accounts for  2.2% of Assetmark Inc.'s holdings, making the stock its 4th biggest holding. Assetmark Inc.'s holdings in NVIDIA were worth $1,078,513,000 as of its most recent filing with the SEC. Several other large investors have also recently modified their holdings of the stock. Rede Wealth LLC increased its position in shares of  NVIDIA by 46.3% during the 4th quarter. Rede Wealth LLC now owns 14,219 shares of the computer hardware maker's stock valued at $2,652,000 after purchasing an additional 4,498 shares during the last quarter.  Norris Perne & French LLP MI increased its position in shares of  NVIDIA by 290.5% during the 4th quarter. Norris Perne & French LLP MI now owns 65,228 shares of the computer hardware maker's stock valued at $12,165,000 after purchasing an additional 48,523 shares during the last quarter.  Meridian Financial Advisors LLC increased its position in shares of  NVIDIA by 8.5% during the 4th quarter. Meridian Financial Advisors LLC now owns 1,301 shares of the computer hardware maker's stock valued at $243,000 after purchasing an additional 102 shares during the last quarter.  Steph & Co. increased its position in shares of  NVIDIA by 54.2% during the 4th quarter. Steph & Co. now owns 4,033 shares of the computer hardware maker's stock valued at $752,000 after purchasing an additional 1,418 shares during the last quarter.  Finally, JM2 Capital Inc. bought a new position in shares of  NVIDIA during the 4th quarter valued at approximately $9,132,000. Institutional investors own  65.27% of the company's stock. In other news, Director John Dabiri sold 3,004 shares of the stock in a transaction on Friday, March 13th. The stock was sold at an average price of $184.90, for a total transaction of $555,439.60. Following the transaction, the director owned 14,788 shares of the company's stock, valued at approximately $2,734,301.20. This represents a 16.88% decrease in their position. The transaction was disclosed in a filing with the Securities & Exchange Commission, which can be accessed through this link. Also, EVP Ajay K. Puri sold 300,000 shares of the stock in a transaction on Wednesday, March 18th. The stock was sold at an average price of $182.25, for a total value of $54,675,000.00. Following the transaction, the executive vice president directly owned 3,018,547 shares in the company, valued at $550,130,190.75. The trade was a 9.04% decrease in their position. Additional details regarding this sale are available in the official SEC disclosure. In the last ninety days, insiders have sold 953,976 shares of company stock worth $171,173,819. Insiders own  4.17% of the company's stock. Shares of NVDA stock opened at $199.57 on Friday. The company has a debt-to-equity ratio of 0.05, a current ratio of 3.91 and a quick ratio of 3.24. The company has a market capitalization of $4.85 trillion, a P/E ratio of 40.73, a P/E/G ratio of 0.69 and a beta of 2.34. The company's 50-day simple moving average is $186.75 and its two-hundred day simple moving average is $186.15. NVIDIA Corporation has a one year low of $110.82 and a one year high of $216.82. NVIDIA (NASDAQ:NVDA - Get Free Report) last issued its earnings results on Wednesday, February 25th. The computer hardware maker reported $1.62 EPS for the quarter, topping analysts' consensus estimates of $1.54 by $0.08. The business had revenue of $68.13 billion for the quarter, compared to the consensus estimate of $65.56 billion. NVIDIA had a net margin of 55.60% and a return on equity of 97.37%. The company's revenue for the quarter was up 73.2% compared to the same quarter last year. During the same period in the prior year, the firm earned $0.89 EPS.  As a group, equities analysts anticipate that  NVIDIA Corporation will post 7.78 EPS for the current year. The business also recently announced a quarterly dividend, which was paid on Wednesday, April 1st. Shareholders of record on Wednesday, March 11th were paid a $0.01 dividend. This represents a $0.04 dividend on an annualized basis and a yield of 0.0%. The ex-dividend date was Wednesday, March 11th. NVIDIA's dividend payout ratio  is currently 0.82%. Here are the key news stories impacting NVIDIA this week: NVDA has been the topic of several analyst reports. Morgan Stanley  set a $260.00 price target on shares of NVIDIA in a report on Monday, March 2nd. Oppenheimer  reiterated an ""outperform"" rating and set a $265.00 price target on shares of NVIDIA in a report on Thursday, February 26th. Stifel Nicolaus  set a $250.00 price target on shares of NVIDIA in a report on Thursday, January 8th. UBS Group  reiterated a ""buy"" rating on shares of NVIDIA in a report on Tuesday, March 17th. Finally, TD Cowen  reiterated a ""buy"" rating and set a $235.00 price target on shares of NVIDIA in a report on Tuesday, March 17th. Four investment analysts have rated the stock with a Strong Buy rating, forty-eight have issued  a Buy rating and two have assigned  a Hold rating to the company's stock. According to MarketBeat.com, the company  has an average rating of ""Buy"" and a consensus target price of $275.25. NVIDIA Corporation, founded in 1993 and headquartered in Santa Clara, California, is a global technology company that designs and develops graphics processing units (GPUs) and system-on-chip (SoC) technologies. Co-founded by Jensen Huang, who serves as president and chief executive officer, along with Chris Malachowsky and Curtis Priem, NVIDIA has grown from a graphics-focused chipmaker into a broad provider of accelerated computing hardware and software for multiple industries. The company's product portfolio spans discrete GPUs for gaming and professional visualization (marketed under the GeForce and NVIDIA RTX lines), high-performance data center accelerators used for AI training and inference (including widely adopted platforms such as the A100 and H100 series), and Tegra SoCs for automotive and edge applications. Want to see what other hedge funds are holding NVDA? Visit HoldingsChannel.com to get the latest 13F filings and insider trades for NVIDIA Corporation (NASDAQ:NVDA - Free Report). This instant news alert was generated by narrative science technology and financial data from MarketBeat in order to provide readers with the fastest reporting and unbiased coverage. Please send any questions or comments about this story to contact@marketbeat.com. Before you consider NVIDIA, you'll want to hear this. MarketBeat keeps track of Wall Street's top-rated and best performing research analysts and the stocks they recommend to their clients on a daily basis. MarketBeat has identified the five stocks that top analysts are quietly whispering to their clients to buy now before the broader market catches on... and NVIDIA wasn't on the list. While NVIDIA currently has a Buy rating among analysts, top-rated analysts believe these five stocks are better buys. Discover the next wave of investment opportunities with our report, 7 Stocks That Will Be Magnificent in 2026. Explore companies poised to replicate the growth, innovation, and value creation of the tech giants dominating today's markets. Sign up for MarketBeat All Access to gain access to MarketBeat's full suite of research tools. 345 N Reid Place, Suite 620, Sioux Falls, SD 57103
                                        
                                        contact@marketbeat.com
                                        
                                        (844) 978-6257 © MarketBeat Media, LLC 2010-2026. All rights reserved. © 2026   Fair market value prices are updated every minute and are provided by Massive. Other market data provided is at least 10-minutes delayed and hosted by Barchart Solutions.  Information is provided 'as-is' and solely for informational purposes, not for trading purposes or advice, and is delayed. To see all exchange delays and terms of use please see Barchart's disclaimer. Enter your email address below to receive a concise daily summary of dividend news for NVIDIA, new dividend declarations and stocks going ex-dividend with DividendStocks.com’s free newsletter. We and our partners share information on your use of this website to help improve your experience. For more information, or to opt out click the Do Not Sell My Information button below.",https://www.marketbeat.com/instant-alerts/filing-assetmark-inc-boosts-stock-holdings-in-nvidia-corporation-nvda-2026-05-01/
