id,ticker,date,title,content,url
1,NVDA,2026-03-26 22:26:37,지금이 엔비디아를 살 때일까? 크레이머가 답을 얻기 위해 물어보라고 한 질문들 - CNBC,"이란 전쟁은 투자자들이 주식 종목을 고르는 사람이라기보다 군사 전략가처럼 행동하도록 강요했다고 CNBC의 짐 크레이머가 목요일 말했다. 다만 그는 투자자들이 분쟁의 결말이 여전히 불확실한 만큼, 자신의 판단을 이끌 일련의 질문들을 스스로에게 던져보라고 권했다.

크레이머는 도널드 트럼프 대통령이 이란 에너지 시설 폭격 중단을 4월 6일까지 연장한다고 발표한 직후 CNBC의 '매드 머니'에서 “나는 전체 과정을 완전히 거꾸로 돌려, 전쟁이 단순히 포트폴리오를 구축하려는 사람에게 실제로 무엇을 의미하는지 생각해보겠다”고 말했다. 그는 “우리는 전쟁의 결과를 예측할 수 없다는 걸 안다. 오늘 밤의 폭격 중단 연장이 보여주듯 시점도 예측할 수 없다. 하지만 우리가 가늠할 수 있는 것은 우리가 좋아하는 주식들이 전쟁과 얼마나 연결되어 있는지 여부”라고 말했다.

크레이머는 엔비디아가 지금 이 순간 사는 게 가치 있는지 판단하는 데 체크리스트 활용이 도움이 되는 “명백한” 사례라고 말했다. 선도적인 인공지능 칩 제조업체인 엔비디아 주가는 전쟁 발발 전 마지막 거래일이었던 2월 27일 이후 3% 조금 넘게 하락했다.

크레이머는 “첫째로, 우리는 엔비디아 주가가 전쟁 때문에 하락한 것인지 물어봐야 한다”고 말했다. 그는 엔비디아의 경우 분쟁과의 직접적 연관성을 정량화하기 어렵다고 말했다. “엔비디아는 주식시장 자체에서 큰 부분을 차지하고 있어서 세상에서 가장 쉽게 거래되는 주식이다. 나는 주가가 더 낮은 수준에서 다시 진입하기가 너무 쉽기 때문에 하락하고 있다고 생각한다.”

크레이머는 더 높은 금리가 차입 비용을 끌어올려 결국 데이터센터 구축 속도를 늦출 수 있으므로 또 다른 고려 요소라고 말했다. 그는 “그렇다 해도 전쟁이 곧 끝나고 새 연준 의장이 나오면, 엔비디아를 피한 자신이 바보 같다고 느끼게 될 것”이라고 주장했다.

셋째로, 크레이머는 투자자들이 엔비디아의 실적에 내재적인 이유가 있는지도 따져봐야 한다고 말했다. “지금 기술 산업은 우리가 컴퓨트라고 부르는 것, 그리고 메모리가 부족하다. 즉 엔비디아가 들어간 컴퓨터가 부족하다는 뜻”이라고 그는 말했다.

크레이머는 메모리 가격이 사상 최고 수준으로 치솟아 서버의 총비용이 높아지고 고객 예산을 더 많이 잠식하게 되므로, 엔비디아 칩 수요에 간접적으로 부담을 줄 수 있다는 점은 인정했다. 그러나 근본적인 수요 전망은 여전히 강하다고 그는 지적했다.

유가도 하나의 변수지만, 크레이머는 그다지 우려하지 않는다고 말했다. 그는 “엔비디아의 데이터센터는 대부분 미국산 천연가스로 가동되며, 천연가스 가격은 거의 움직이지 않았다”고 말했다. “고객들은 분명 영향을 받을 수 있지만, 엔비디아를 쓰는 모든 것은 핵심 임무(mission critical)로 간주되므로 나는 걱정하지 않는다.”

마지막으로 크레이머는 투자자들이 전쟁과 무관하게 엔비디아 제품에 대한 수요 약화가 있는지 확인해야 한다고 말했다. 그는 “걸프 지역의 국부 자본이 고갈되고 있고, 그 자금이 많은 데이터센터를 금융 지원해 왔다는 것은 충분히 상상할 수 있다. 하지만 지난주 나는 엔비디아 GTC 컨퍼런스에 참석했고 수요가 믿을 수 없을 정도로 강하다는 사실을 알게 됐다”고 말했다.

크레이머는 전쟁이 길어질 경우 단기적으로 엔비디아 주가의 추가 하락이 있을 수 있어 이 주식을 강하게 추천하긴 주저한다고 말했다. 그러나 꼭 하나를 고르라면, 그는 랠리를 놓치는 것보다 조금 일찍 사는 편을 택하겠다고 말했다.

그는 “결국 당신은 평소보다 더 낮은 가격에 고품질 주식을 살 기회를 얻는 셈”이라고 덧붙였다. “타이밍을 맞출 수는 없다. 그걸 잊지 말아라.”

공시: CNBC 인베스팅 클럽이 사용하는 포트폴리오인 크레이머의 Charitable Trust는 NVDA 주식을 보유하고 있다. 장기적 부를 쌓고 더 현명하게 투자하는 데 도움이 되도록 짐 크레이머의 투자 가이드를 무료로 다운로드하려면 여기를 클릭하세요. CNBC 인베스팅 클럽에 지금 가입해 짐 크레이머의 시장 내 모든 움직임을 따라가세요. 크레이머의 세계를 깊이 파고들고 싶으신가요? 그에게 연락하세요! Mad Money Twitter - Jim Cramer Twitter - Facebook - Instagram 'Mad Money' 웹사이트에 대한 질문, 의견, 제안이 있나요? madcap@cnbc.com으로 보내주세요. 기밀 뉴스 제보가 있나요? 여러분의 소식을 기다립니다. 무료 뉴스레터에 가입하고 더 많은 CNBC 소식을 받은편지함으로 받아보세요. 이것과 더 많은 정보가 받은편지함으로 전달됩니다. 제품 및 서비스에 대한 자세한 정보도 함께 제공합니다. © 2026 Versant Media, LLC. All Rights Reserved. A Versant Media Company. 데이터는 실시간 스냅샷입니다 *데이터는 최소 15분 지연됩니다. 글로벌 비즈니스 및 금융 뉴스, 주가, 시장 데이터 및 분석.",https://www.cnbc.com/2026/03/26/cramer-when-to-buy-nvidia.html
2,NVDA,2026-03-26 21:40:55,"엔비디아(NVDA) 주가, 미-이란 협상 진전 속 랠리 가능성 - MEXC","이란과 이스라엘 간의 격화된 갈등은 2월 28일 적대 행위가 심화된 이후 엔비디아에 역풍을 만들어냈다. 전 세계 석유 운송량의 약 5분의 1을 차지하는 핵심 병목 지점인 호르무즈 해협에서 이란이 전략적 조치를 취한 이후 에너지 가격은 크게 상승했다. 이로 인한 차질은 글로벌 물류 네트워크 전반에 파급효과를 일으켜 육상 운송, 해상 운송, 항공 화물 비용을 모두 끌어올렸다.

이 영향은 엔비디아에 특히 중요하다. 엔비디아의 비즈니스 모델은 고객에게 그래픽 처리장치(GPU)를 공급하기 위해 대만에서의 신속한 항공 운송에 크게 의존하기 때문이다. 회사는 주로 대만의 TSMC 제조 시설에서 GPU 하드웨어를 조달한 뒤 항공 운송을 통해 미국 시장에 전달한다. 항공유 가격 상승은 곧바로 유입 물류 비용 증가로 이어져 매출총이익률을 압박한다. 동시에 최종 고객에게의 출하 비용도 오르고 있어 운영 수익성에 추가 부담을 주고 있다.

이러한 어려움은 분명한 우려 사항이지만, 시장 분석가들은 여전히 관리 가능한 범위라고 강조한다. 1월 말 마감된 2026 회계연도에 엔비디아는 조정 매출총이익률 71.3%와 조정 순이익률 54.2%를 보고했다. 이에 비해 GPU 분야의 주요 경쟁사인 AMD는 조정 매출총이익률 52.4%, 조정 순이익률 19.7%를 기록했다. 이처럼 상당한 마진 우위는 중요한 방어막이 된다. 공급망 비용이 소폭 상승하더라도 이런 강력한 수익성 지표를 가진 기업에 실질적인 충격을 주기는 어려울 것으로 보인다.

또한 엔비디아는 대량 고객이라는 점에서 운송사와의 협상에서 지렛대를 확보하고 있어, 상승한 비용이 최종 이익에 미치는 영향을 제한할 수 있다. 추가적인 방어 요소도 있다. 엔비디아의 반도체 제품은 압도적인 시장 수요에 비해 지속적인 공급 제약에 직면해 있다. 이러한 상황은 특히 고정 가격 계약이 아닌 유연한 구매 조건을 가진 고객을 상대로 강한 가격 결정력을 만들어낸다. 증가한 비용의 일부를 고객에게 전가할 수 있다는 점은 실행 가능한 전략적 선택지다.

젠슨 황 최고경영자(CEO)는 이달 초 인공지능 혁신을 위한 세계 최대 행사인 GTC 2026에서 회사 전망에 대해 낙관적인 발언을 내놨다. 시장 관측자들은 5월 말 발표 예정인 엔비디아의 1분기 실적이 애널리스트 전망치를 웃돌 것으로 예상하고 있으며, 이는 전 분기의 강한 실적 흐름을 이어가는 것이다.

군사 작전이 시작된 이후 엔비디아 주가 평가는 좁은 범위 안에서 움직여 왔으며, 이는 광범위한 시장 불안감에 제약받은 결과다. 그러나 지정학적 환경은 변화하고 있는 것으로 보인다. 최근 트럼프의 발언은 이란과의 적극적인 외교적 관여가 진행 중임을 시사하며, 잠재적 해결 틀의 존재를 암시했다. 행정부가 이란 에너지 시설에 대한 잠재적 군사 행동 입장을 완화하자 유가가 하락하고 주식시장이 반등했는데, 이는 긴장 완화 신호에 대한 시장의 놀라운 민감도를 보여준다.

Wolfe Research의 애널리스트 크리스 세니엑은 외교적 돌파구가 성사될 경우 미국의 초대형 기술 기업들과 인공지능 선도업체들을 주요 수혜주로 삼아 위험자산으로의 자금 유입이 크게 되살아날 수 있다고 지적했다. 전형적인 AI 투자 테마를 대표하는 엔비디아는 이러한 자금 회전의 최전선에 서 있다. 세니엑은 시장 신뢰가 회복될 경우 엔비디아의 데이터센터 인프라와 반도체 혁신에서의 압도적 지위가 상당한 투자 자본을 끌어들일 핵심 요인이라고 강조했다.

현재 주가는 175.88달러로, 시가총액 4조3,000억 달러를 유지한 채 52주 최고가인 212.19달러보다 상당한 할인된 수준에서 거래되고 있다. 52주 최저가는 86.62달러다.

엔비디아(NVDA) 주가, 미-이란 협상 진전 속 랠리 가능성 기사는 Blockonomi에 처음 게재됐다.

SEC 명확화가 곧 기대됨, 웨스턴 유니온이 XRP 통합, 기술적 패턴 부합, 여러 요인이 잠재적 시장 변화를 시사. 작성자: Ripple Bull Winkle | Crypto Researcher 🚀🚨01:02 리플 인프라는 아프리카 시장을 지원하며, Absa Bank, Chipper Cash, RedotPay와 파트너십을 맺고 확장 및 송금 솔루션을 제공. 작성자: Ripple Bull Winkle | Crypto Researcher 🚀🚨00:30 Fidelity가 8,300만 달러 상당의 비트코인을 매수해 암호화폐 시장에 대한 기관의 관심을 시사. 펀더멘털 속에서 XRP는 횡보 중이며, 기관은 매집하고 개인투자자는 약세로 인식; 역사적으로 큰 움직임의 전조. 작성자: Ripple Bull Winkle | Crypto Researcher 🚀🚨00:02 터키의 Garanti BBVA와 사우디의 Riyad Bank가 암호화폐 및 토큰화 이니셔티브에 XRP 인프라를 활용. 작성자: Ripple Bull Winkle | Crypto Researcher 🚀🚨2026/03/26 23:47",https://www.mexc.com/news/984215
3,NVDA,2026-03-26 21:04:13,"엔비디아(NVDA) 주가: 후원 스타트업, AI 데이터센터 확장을 위해 25억 달러 조달 추진에 보합 - MEXC","엔비디아(NVDA) 주가는 최근 거래에서 보합세를 보였는데, 이는 투자자들이 이 회사가 가장 주목하는 포트폴리오 기업 중 하나의 새로운 동향을 소화했기 때문이다. 엔비디아가 지원하는 스타트업 Reflection AI가 약 25억 달러를 조달하는 새로운 자금 조달 라운드를 논의 중인 것으로 알려졌으며, 이를 통해 회사 가치는 약 250억 달러로 평가될 수 있다. 제안된 기업가치는 앞서 예상됐던 200억 달러를 조금 넘는 수준에서 크게 상승한 것으로, 소프트웨어 모델을 넘어 물리적 컴퓨트 자산으로까지 확대되는 AI 인프라 투자에 대한 투자자들의 수요가 커지고 있음을 시사한다.

금융 매체를 통해 처음 보도된 이 자금 조달 논의는, 컴퓨팅 파워 접근성이 모델 개발만큼이나 중요해지고 있는 인공지능 산업의 더 넓은 변화 흐름을 보여준다. Reflection AI의 자금 조달 협상은 현 AI 사이클에서 보다 공격적인 밸류에이션 움직임 중 하나다. 250억 달러라는 수치는 프리머니(pre-money) 밸류에이션을 기준으로 한 것으로, AI 생태계 내에서의 장기적 포지셔닝에 대한 투자자들의 신뢰를 반영한다.

주로 알고리즘 개발에 집중하는 전통적 AI 스타트업과 달리, Reflection AI는 소프트웨어의 야심과 대규모 인프라 구축을 결합하고 있다. 이러한 하이브리드 접근법은 JPMorgan Chase를 비롯한 주요 금융기관의 관심을 끌었으며, JPMorgan Chase는 Security and Resiliency Initiative를 통해 이번 라운드에 참여하는 것을 검토하고 있는 것으로 알려졌다. 밸류에이션의 상향 조정은 투자자들이 순수한 모델 기반 역량보다 AI 컴퓨트 인프라에 대한 수요를 더 반영해 가격을 매기고 있음을 시사한다.

Reflection AI의 확장 전략에서 핵심 요소는 한국에 계획된 AI 데이터센터 프로젝트다. 이 이니셔티브는 한국의 대형 유통 대기업인 신세계그룹과의 협력으로 추진되며, 더 넓은 프로젝트에 대한 총투자액은 약 67억 달러로 추산된다. 이 시설은 지역 AI 컴퓨트 허브 역할을 하도록 설계되어, 고도화된 AI 시스템의 학습과 배포를 위한 대규모 처리 능력을 제공할 예정이다. 글로벌 컴퓨트 자원 수요가 많은 지역에서 공급을 앞지르고 있는 상황에서, 이러한 입지는 특히 중요하다. 전통적인 서구 및 중국 기술 중심지 밖에 인프라를 구축함으로써, 이 프로젝트는 글로벌 AI 개발의 더 넓은 분산화 추세도 반영한다.

Reflection AI에 대한 엔비디아의 관여는 칩 제조를 넘어 더 넓은 AI 생태계로 영향력이 확장되고 있음을 보여준다. 엔비디아의 그래픽 처리장치(GPU)는 대부분의 현대 AI 작업의 근간이며, 스타트업 지원은 자사 하드웨어에 대한 장기 수요를 강화하는 데 도움을 준다. Reflection AI는 자사 인프라 구동을 위해 엔비디아의 고성능 GPU를 확보할 계획이며, 컴퓨트 자산을 소유할지 용량을 임차할지는 아직 불분명하다. 그러나 어느 쪽이든 결국 엔비디아가 AI 공급망의 중심 공급업체로서의 지위를 강화한다.

동시에 엔비디아의 투자 전략은 여러 AI 개발사를 지원해 결과적으로 GPU 수요를 늘리고 업계의 자사 기술 스택 의존도를 심화시키는 더 넓은 생태계 접근과도 부합한다. 시장 역학을 넘어, Reflection AI의 확장은 인공지능 분야에서 커지는 지정학적 경쟁을 반영한다. 이 회사는 개방형 또는 오픈웨이트 AI 모델을 개발하고 있으며, 중국과의 경쟁이 심화되는 가운데 AI 시스템에서의 리더십을 유지하려는 미국의 더 넓은 전략 내에 자리하고 있다. 아시아에서 대규모 컴퓨트 허브를 구축하는 것은 각국이 집중된 인프라 제공업체에 대한 의존도를 줄이려 한다는 점에서 경쟁에 또 다른 층위를 더한다. 성공할 경우 이러한 노력은 조직들이 더 독립적으로 배포하고, 감사하고, 조정할 수 있는 AI 시스템에 대한 접근성을 넓힐 수 있다.

엔비디아(NVDA) 주가: 후원 스타트업, AI 데이터센터 확장을 위해 25억 달러 조달 추진에 보합 기사는 CoinCentral에 처음 게재됐다.

SEC 명확화가 곧 기대됨, 웨스턴 유니온이 XRP 통합, 기술적 패턴 부합, 여러 요인이 잠재적 시장 변화를 시사. 작성자: Ripple Bull Winkle | Crypto Researcher 🚀🚨01:02 리플 인프라는 아프리카 시장을 지원하며, Absa Bank, Chipper Cash, RedotPay와 파트너십을 맺고 확장 및 송금 솔루션을 제공. 작성자: Ripple Bull Winkle | Crypto Researcher 🚀🚨00:30 Fidelity가 8,300만 달러 상당의 비트코인을 매수해 암호화폐 시장에 대한 기관의 관심을 시사. 펀더멘털 속에서 XRP는 횡보 중이며, 기관은 매집하고 개인투자자는 약세로 인식; 역사적으로 큰 움직임의 전조. 작성자: Ripple Bull Winkle | Crypto Researcher 🚀🚨00:02 터키의 Garanti BBVA와 사우디의 Riyad Bank가 암호화폐 및 토큰화 이니셔티브에 XRP 인프라를 활용. 작성자: Ripple Bull Winkle | Crypto Researcher 🚀🚨2026/03/26 23:47",https://www.mexc.com/news/983338
4,NVDA,2026-03-26 20:59:54,내부자 매도 이후 NVIDIA(NASDAQ:NVDA) 주가 4.2% 하락 - MarketBeat,"NVIDIA Corporation(NASDAQ:NVDA - 무료 보고서 받기)의 주가는 내부자가 회사 주식을 매도한 뒤 목요일 장중 거래에서 4.2% 하락했다. 주가는 장중 한때 171.14달러까지 내렸고, 마지막 거래가는 171.24달러였다. 거래량은 183,263,744주로, 평균 세션 거래량 180,212,766주보다 2% 증가했다. 해당 종목은 이전에 178.68달러로 마감했다.

구체적으로, 이사 마크 A. 스티븐스(Mark A. Stevens)는 3월 20일 금요일 발생한 거래에서 회사 주식 221,682주를 매도했다. 주식은 주당 평균 173.68달러에 매도됐으며, 총 가치는 38,501,729.76달러였다. 거래 완료 후 이사는 회사 지분 7,399,771주를 직접 보유했으며, 가치는 1,285,192,227.28달러였다. 이번 거래는 보유 지분이 2.91% 감소한 것이다. 해당 매도는 SEC 웹사이트에서 확인할 수 있는 증권거래위원회(SEC) 공시를 통해 공개됐다.

또한 CFO 코लेट 크레스(Colette Kress)는 3월 20일 금요일 NVIDIA 주식 20,000주를 매도했다. 주식은 주당 평균 174.89달러에 매도돼 총 3,497,800.00달러어치였다. 매도 완료 후 최고재무책임자는 회사 주식 83,060주를 직접 보유했으며, 가치는 약 14,526,363.40달러였다. 이번 거래는 보유 지분이 19.41% 감소한 것이다. 이 매도의 공시는 SEC 공시에 포함돼 있다.

다른 소식으로, 코लेट 크레스 CFO는 3월 20일 금요일 회사 주식 42,650주를 또 매도했다. 주식은 주당 평균 174.89달러에 매도됐고, 총 거래액은 7,459,058.50달러였다. 거래 후 최고재무책임자는 회사 주식 881,387주를 직접 보유했으며, 가치는 154,145,772.43달러였다. 이는 주식 보유가 4.62% 감소한 것을 의미한다. 이 매도 역시 SEC에 제출된 문서에서 공개됐다.

최근 여러 증권사들이 NVDA에 대해 의견을 냈다. Piper Sandler는 2월 26일 목요일 리서치 노트에서 NVIDIA 주식에 대한 '비중확대' 의견을 재확인했다. 뱅크오브아메리카는 2월 26일 목요일 리서치 노트에서 NVIDIA의 목표주가를 275.00달러에서 300.00달러로 상향하고 '매수' 의견을 제시했다. 미즈호는 1월 9일 금요일 리서치 보고서에서 NVIDIA에 275.00달러 목표주가와 '아웃퍼폼' 의견을 제시했다. Evercore는 1월 6일 화요일 리서치 보고서에서 NVIDIA 주식에 대한 '아웃퍼폼' 의견을 재확인했다. 마지막으로 UBS Group은 3월 17일 화요일 리서치 노트에서 NVIDIA 주식에 대한 '매수' 의견을 재확인했다.

애널리스트 4명은 이 종목에 강력매수(Strong Buy) 등급을, 47명은 매수(Buy) 등급을, 2명은 보유(Hold) 등급을 부여했다. MarketBeat 데이터에 따르면 이 회사의 평균 투자의견은 '매수'이며 평균 목표주가는 275.95달러다.

이번 주 NVIDIA에 영향을 준 주요 뉴스는 다음과 같다. 회사의 부채비율은 0.05, 당좌비율은 3.24, 유동비율은 3.91이다. 시가총액은 4조1,600억 달러, 주가수익비율(P/E)은 34.95, 주가수익성장비율(P/E/G)은 0.59, 베타는 2.33이다. 50일 이동평균은 184.11달러, 200일 이동평균은 184.34달러다.

NVIDIA Corporation(NASDAQ:NVDA - 무료 보고서 받기)은 최근 분기 실적을 2월 25일 수요일에 발표했다. 이 컴퓨터 하드웨어 제조사는 분기 주당순이익(EPS) 1.62달러를 보고했으며, 이는 애널리스트 예상치 1.54달러를 0.08달러 상회한 것이다. 분기 매출은 681억3,000만 달러로, 애널리스트 기대치 655억6,000만 달러를 웃돌았다. NVIDIA의 자기자본이익률(ROE)은 97.37%, 순이익률은 55.60%였다. 분기 매출은 전년 동기 대비 73.2% 증가했다. 전년 같은 기간에는 주당순이익이 0.89달러였다. 전체적으로 애널리스트들은 NVIDIA Corporation이 현재 회계연도에 주당순이익 2.77달러를 기록할 것으로 예상한다.

이 회사는 또한 최근 분기 배당을 선언했으며, 배당금은 4월 1일 수요일 지급될 예정이다. 3월 11일 수요일 기준 주주들에게 주당 0.01달러의 배당금이 지급된다. 이는 연간 환산 배당금 0.04달러, 배당수익률 0.0%에 해당한다. 배당락일은 3월 11일 수요일이다. NVIDIA의 배당성향은 현재 0.82%다.

최근 여러 기관투자자들이 이 종목 지분을 추가하거나 줄였다. Center for Financial Planning Inc.는 2분기에 NVIDIA 주식 보유량을 4.6% 늘렸다. Center for Financial Planning Inc.는 같은 기간 중 367주를 추가 매수한 뒤 현재 컴퓨터 하드웨어 제조업체의 주식 8,429주를 보유하고 있으며, 가치는 1,332,000달러다. PMG Family Office LLC는 3분기에 약 2,150,000달러어치에 해당하는 NVIDIA 주식 신규 포지션을 취득했다. Atria Investments Inc는 2분기에 NVIDIA 주식 보유 비중을 3.2% 늘렸다. Atria Investments Inc는 같은 기간 중 29,479주를 추가로 취득한 뒤 현재 942,208주를 보유하고 있으며, 가치는 148,859,000달러다. Svenska Handelsbanken AB publ는 3분기에 약 37,316,000달러어치의 NVIDIA 주식 신규 포지션을 취득했다. 마지막으로 Oak Ridge Investments LLC는 3분기에 NVIDIA 지분을 2.2% 늘렸다. Oak Ridge Investments LLC는 같은 기간 중 20,559주를 추가 취득한 뒤 현재 970,860주를 보유하고 있으며, 가치는 181,143,000달러다. 헤지펀드와 기타 기관투자자가 전체 주식의 65.27%를 보유하고 있다.

1993년에 설립되어 캘리포니아주 산타클라라에 본사를 둔 NVIDIA Corporation은 그래픽 처리장치(GPU)와 시스템온칩(SoC) 기술을 설계하고 개발하는 글로벌 기술 기업이다. 젠슨 황이 크리스 말라코스키(Chris Malachowsky), 커티스 프리엠(Curtis Priem)과 공동 창업했으며, NVIDIA는 그래픽 중심 칩 제조사에서 여러 산업을 위한 가속 컴퓨팅 하드웨어 및 소프트웨어의 폭넓은 공급업체로 성장했다. 회사의 제품 포트폴리오는 게임 및 전문 시각화용 개별 GPU(GeForce 및 NVIDIA RTX 라인으로 판매), AI 학습 및 추론에 사용되는 고성능 데이터센터 가속기(A100 및 H100 시리즈 같은 널리 채택된 플랫폼 포함), 그리고 자동차 및 엣지 애플리케이션용 Tegra SoC를 포괄한다.

이 속보는 독자가 가장 빠른 보도와 편향 없는 정보를 접할 수 있도록 narrative science 기술과 MarketBeat의 금융 데이터로 생성됐다. 이 기사에 대한 질문이나 의견은 contact@marketbeat.com으로 보내주시기 바란다.

NVIDIA를 고려하기 전에, 이것을 들어보시기 바란다. MarketBeat는 월가의 최고 평가를 받는 우수 애널리스트들과 그들이 고객에게 추천하는 종목을 매일 추적한다. MarketBeat는 더 넓은 시장이 알아차리기 전에 지금 고객에게 매수를 조용히 권하는 상위 애널리스트들의 추천 종목 5개를 찾아냈는데, NVIDIA는 그 목록에 없었다. 현재 애널리스트들 사이에서 NVIDIA는 매수 의견을 받고 있지만, 최고 평가를 받는 애널리스트들은 이 5개 종목이 더 나은 매수처라고 믿는다. 주식시장에 이제 막 입문하셨나요? 이 10개의 간단한 종목은 옵션, 기술적 분석 또는 기타 고급 전략을 몰라도 장기적인 부를 쌓는 데 도움이 될 수 있다. MarketBeat All Access에 가입해 MarketBeat의 전체 리서치 도구 모음을 이용해 보세요. 345 N Reid Place, Suite 620, Sioux Falls, SD 57103 contact@marketbeat.com (844) 978-6257 © MarketBeat Media, LLC 2010-2026. All rights reserved. © 2026 공정가치 가격은 매분 업데이트되며 Massive가 제공합니다. 기타 시장 데이터는 최소 10분 지연되며 Barchart Solutions에서 제공됩니다. 정보는 '있는 그대로' 제공되며 정보 제공 목적일 뿐 거래 목적이나 조언이 아니고 지연될 수 있습니다. 모든 거래소 지연 및 이용 약관은 Barchart의 면책조항을 참조하십시오. 당사와 파트너는 귀하의 사용 정보를 공유하여 경험을 개선합니다. 자세한 정보 또는 거부를 원하시면 아래의 내 정보 판매 금지 버튼을 클릭하십시오.",https://www.marketbeat.com/instant-alerts/nvidia-nasdaqnvda-stock-price-down-42-after-insider-selling-2026-03-26/
