ticker,title,date,content,url
NVDA,NVIDIA (NASDAQ:NVDA) Stock Unloaded Rep. Daniel Meuser - MarketBeat,2026-04-07 06:13:23,"Representative Daniel Meuser (Republican-Pennsylvania) recently sold shares of NVIDIA Corporation NASDAQ: NVDA. In a filing disclosed on April 03rd, the Representative disclosed that they had sold between $1,001 and $15,000 in NVIDIA stock on February 25th. The trade occurred in the Representative's ""SCHWAB BROKERAGE ACCOUNT"" account. Representative Daniel Meuser also recently made the following trade(s): NVDA stock opened at $177.64 on Tuesday. The company has a market cap of $4.32 trillion, a P/E ratio of 36.25, a PEG ratio of 0.59 and a beta of 2.34. NVIDIA Corporation has a twelve month low of $86.62 and a twelve month high of $212.19. The company has a quick ratio of 3.24, a current ratio of 3.91 and a debt-to-equity ratio of 0.05. The business has a fifty day moving average of $182.24 and a 200-day moving average of $184.34. NVIDIA (NASDAQ:NVDA - Get Free Report) last released its earnings results on Wednesday, February 25th. The computer hardware maker reported $1.62 earnings per share for the quarter, topping analysts' consensus estimates of $1.54 by $0.08. The company had revenue of $68.13 billion during the quarter, compared to the consensus estimate of $65.56 billion. NVIDIA had a return on equity of 97.37% and a net margin of 55.60%.The firm's quarterly revenue was up 73.2% on a year-over-year basis. During the same quarter in the previous year, the company posted $0.89 earnings per share.  As a group, equities research analysts expect that  NVIDIA Corporation will post 2.77 EPS for the current year. The company also recently announced a quarterly dividend, which was paid on Wednesday, April 1st. Stockholders of record on Wednesday, March 11th were given a dividend of $0.01 per share. The ex-dividend date was Wednesday, March 11th. This represents a $0.04 dividend on an annualized basis and a dividend yield of 0.0%. NVIDIA's payout ratio is presently 0.82%. A number of institutional investors and hedge funds have recently added to or reduced their stakes in the stock. Old North State Trust LLC increased its holdings in  NVIDIA by 4.6% in the fourth quarter. Old North State Trust LLC now owns 49,301 shares of the computer hardware maker's stock valued at $9,195,000 after purchasing an additional 2,155 shares during the last quarter.  J. Derek Lewis & Associates Inc. acquired a new position in  NVIDIA in the fourth quarter valued at about $5,213,000.  Up Capital Management Inc. acquired a new position in  NVIDIA in the fourth quarter valued at about $27,738,000.  Purpose Unlimited Inc. acquired a new position in  NVIDIA in the fourth quarter valued at about $193,047,000.  Finally, Painted Porch Advisors LLC grew its stake in  NVIDIA by 2.9% in the fourth quarter. Painted Porch Advisors LLC now owns 2,192 shares of the computer hardware maker's stock valued at $409,000 after acquiring an additional 61 shares during the period. Institutional investors own  65.27% of the company's stock. In other NVIDIA news, EVP Ajay K. Puri sold 300,000 shares of the business's stock in a transaction dated Wednesday, March 18th. The stock was sold at an average price of $182.25, for a total value of $54,675,000.00. Following the completion of the transaction, the executive vice president directly owned 3,018,547 shares of the company's stock, valued at approximately $550,130,190.75. The trade was a 9.04% decrease in their ownership of the stock. The transaction was disclosed in a legal filing with the Securities & Exchange Commission, which is accessible through the SEC website. Also, Director Mark A. Stevens sold 221,682 shares of the business's stock in a transaction dated Friday, March 20th. The shares were sold at an average price of $173.68, for a total value of $38,501,729.76. Following the completion of the transaction, the director directly owned 7,399,771 shares of the company's stock, valued at approximately $1,285,192,227.28. The trade was a 2.91% decrease in their ownership of the stock. The disclosure for this sale is available in the SEC filing. Over the last ninety days, insiders sold 1,401,616 shares of company stock valued at $253,555,407. Company insiders own  4.17% of the company's stock. NVDA has been the subject of a number of recent research reports. Weiss Ratings  restated a ""buy (b-)"" rating on shares of NVIDIA in a research report on Monday, December 29th. Royal Bank Of Canada  restated an ""outperform"" rating and set a $250.00 target price on shares of NVIDIA in a research report on Tuesday, March 17th. HSBC  set a $310.00 target price on NVIDIA in a research report on Tuesday, February 24th. CICC Research boosted their target price on NVIDIA from $228.00 to $240.60 and gave the stock an ""outperform"" rating in a research report on Friday, February 27th. Finally, Oppenheimer  reiterated an ""outperform"" rating and issued a $265.00 price objective on shares of NVIDIA in a report on Thursday, February 26th. Four analysts have rated the stock with a Strong Buy rating, forty-seven have issued  a Buy rating and two have given a Hold rating to the company's stock. Based on data from MarketBeat.com, the company presently has a consensus rating of ""Buy"" and a consensus price target of $275.25. Here are the key news stories impacting NVIDIA this week: Dan Meuser (Republican Party) is a member of the U.S. House, representing Pennsylvania's 9th Congressional District. He assumed office on January 3, 2019. His current term ends on January 3, 2027.

Meuser (Republican Party) is running for re-election to the U.S. House to represent Pennsylvania's 9th Congressional District. He declared candidacy for the 2026 election.

On October 22, 2023, Meuser announced he was running to replace Kevin McCarthy (R) as speaker of the U.S. House in the 118th Congress. On October 23, Meuser withdrew from the race.

Prior to joining Congress, Meuser served as the head of the Pennsylvania Department of Revenue from 2011 to 2015 under Gov. Tom Corbett (R). He also worked as the President of Pride Mobility Corporation, a motorized wheelchair manufacturer. NVIDIA Corporation, founded in 1993 and headquartered in Santa Clara, California, is a global technology company that designs and develops graphics processing units (GPUs) and system-on-chip (SoC) technologies. Co-founded by Jensen Huang, who serves as president and chief executive officer, along with Chris Malachowsky and Curtis Priem, NVIDIA has grown from a graphics-focused chipmaker into a broad provider of accelerated computing hardware and software for multiple industries. The company's product portfolio spans discrete GPUs for gaming and professional visualization (marketed under the GeForce and NVIDIA RTX lines), high-performance data center accelerators used for AI training and inference (including widely adopted platforms such as the A100 and H100 series), and Tegra SoCs for automotive and edge applications. This instant news alert was generated by narrative science technology and financial data from MarketBeat in order to provide readers with the fastest reporting and unbiased coverage. Please send any questions or comments about this story to contact@marketbeat.com. Before you consider NVIDIA, you'll want to hear this. MarketBeat keeps track of Wall Street's top-rated and best performing research analysts and the stocks they recommend to their clients on a daily basis. MarketBeat has identified the five stocks that top analysts are quietly whispering to their clients to buy now before the broader market catches on... and NVIDIA wasn't on the list. While NVIDIA currently has a Buy rating among analysts, top-rated analysts believe these five stocks are better buys. Click the link to see MarketBeat's guide to investing in 5G and which 5G stocks show the most promise. Sign up for MarketBeat All Access to gain access to MarketBeat's full suite of research tools. 345 N Reid Place, Suite 620, Sioux Falls, SD 57103
                                        
                                        contact@marketbeat.com
                                        
                                        (844) 978-6257 © MarketBeat Media, LLC 2010-2026. All rights reserved. © 2026   Fair market value prices are updated every minute and are provided by Massive. Other market data provided is at least 10-minutes delayed and hosted by Barchart Solutions.  Information is provided 'as-is' and solely for informational purposes, not for trading purposes or advice, and is delayed. To see all exchange delays and terms of use please see Barchart's disclaimer. We and our partners share information on your use of this website to help improve your experience. For more information, or to opt out click the Do Not Sell My Information button below.",https://www.marketbeat.com/instant-alerts/nvidia-nasdaqnvda-stock-unloaded-rep-daniel-meuser-2026-04-07/
NVDA,"Coastal Bridge Advisors, LLC's NVIDIA Corp(NVDA) Holding History - GuruFocus",2026-04-07 06:10:59,"This website is using a security service to protect itself from online attacks. The action you just performed triggered the security solution. There are several actions that could trigger this block including submitting a certain word or phrase, a SQL command or malformed data. You can email the site owner to let them know you were blocked. Please include what you were doing when this page came up and the Cloudflare Ray ID found at the bottom of this page. Cloudflare Ray ID: 9e8d6e02885f7ff4
•

        Your IP:
        Click to reveal
20.55.15.102
•

Performance & security by Cloudflare","https://www.gurufocus.com/guru-portfolio/Coastal%20Bridge%20Advisors,%20LLC/NVDA"
NVDA,Diluted shares outstanding of Depositary Receipt on NVDA Issued by INVX – SET:NVDA23 - TradingView,2026-04-07 05:21:50,"Select market data provided by ICE Data Services. Select reference data provided by FactSet. Copyright © 2026 FactSet Research Systems Inc.Copyright © 2026, American Bankers Association. CUSIP Database provided by FactSet Research Systems Inc. All rights reserved. SEC fillings and other documents provided by Quartr.© 2026 TradingView, Inc.",https://www.tradingview.com/symbols/SET-NVDA23/financials-income-statement/diluted-shares-outstanding/
NVDA,Non-controlling/minority interest of Depositary Receipt on NVDA Issued by INVX – SET:NVDA23 - TradingView,2026-04-07 05:19:10,"Select market data provided by ICE Data Services. Select reference data provided by FactSet. Copyright © 2026 FactSet Research Systems Inc.Copyright © 2026, American Bankers Association. CUSIP Database provided by FactSet Research Systems Inc. All rights reserved. SEC fillings and other documents provided by Quartr.© 2026 TradingView, Inc.",https://www.tradingview.com/symbols/SET-NVDA23/financials-income-statement/minority-interest-exp/
NVDA,Equity in earnings of Depositary Receipt on NVDA Issued by INVX – SET:NVDA23 - TradingView,2026-04-07 05:15:37,"Select market data provided by ICE Data Services. Select reference data provided by FactSet. Copyright © 2026 FactSet Research Systems Inc.Copyright © 2026, American Bankers Association. CUSIP Database provided by FactSet Research Systems Inc. All rights reserved. SEC fillings and other documents provided by Quartr.© 2026 TradingView, Inc.",https://www.tradingview.com/symbols/SET-NVDA23/financials-income-statement/equity-in-earnings/
NVDA,Diluted earnings per share (diluted EPS) of Depositary Receipt on NVDA Issued by INVX – SET:NVDA23 - TradingView,2026-04-07 05:14:34,"Select market data provided by ICE Data Services. Select reference data provided by FactSet. Copyright © 2026 FactSet Research Systems Inc.Copyright © 2026, American Bankers Association. CUSIP Database provided by FactSet Research Systems Inc. All rights reserved. SEC fillings and other documents provided by Quartr.© 2026 TradingView, Inc.",https://www.tradingview.com/symbols/SET-NVDA23/financials-income-statement/earnings-per-share-diluted/
NVDA,Discontinued operations of Depositary Receipt on NVDA Issued by INVX – SET:NVDA23 - TradingView,2026-04-07 05:10:27,"Select market data provided by ICE Data Services. Select reference data provided by FactSet. Copyright © 2026 FactSet Research Systems Inc.Copyright © 2026, American Bankers Association. CUSIP Database provided by FactSet Research Systems Inc. All rights reserved. SEC fillings and other documents provided by Quartr.© 2026 TradingView, Inc.",https://www.tradingview.com/symbols/SET-NVDA23/financials-income-statement/discontinued-operations/
NVDA,Average basic shares outstanding of Depositary Receipt on NVDA Issued by INVX – SET:NVDA23 - TradingView,2026-04-07 05:09:15,"Select market data provided by ICE Data Services. Select reference data provided by FactSet. Copyright © 2026 FactSet Research Systems Inc.Copyright © 2026, American Bankers Association. CUSIP Database provided by FactSet Research Systems Inc. All rights reserved. SEC fillings and other documents provided by Quartr.© 2026 TradingView, Inc.",https://www.tradingview.com/symbols/SET-NVDA23/financials-income-statement/basic-shares-outstanding/
NVDA,Depositary Receipt on NVDA Issued by INVX Income Statement – SET:NVDA23 - TradingView,2026-04-07 05:04:18,"The total revenue for the last quarter is ‪2.15 T‬ THB, and it's 16.49% higher compared to the previous quarter. The net income of Q4 25 is ‪1.36 T‬ THB. Select market data provided by ICE Data Services. Select reference data provided by FactSet. Copyright © 2026 FactSet Research Systems Inc.Copyright © 2026, American Bankers Association. CUSIP Database provided by FactSet Research Systems Inc. All rights reserved. SEC fillings and other documents provided by Quartr.© 2026 TradingView, Inc.",https://www.tradingview.com/symbols/SET-NVDA23/financials-income-statement/
NVDA,Revenue per share of Depositary Receipt on NVDA Issued by INVX – SET:NVDA23 - TradingView,2026-04-07 04:49:28,"Select market data provided by ICE Data Services. Select reference data provided by FactSet. Copyright © 2026 FactSet Research Systems Inc.Copyright © 2026, American Bankers Association. CUSIP Database provided by FactSet Research Systems Inc. All rights reserved. SEC fillings and other documents provided by Quartr.© 2026 TradingView, Inc.",https://www.tradingview.com/symbols/SET-NVDA23/financials-statistics-and-ratios/revenue-per-share/
NVDA,Operating cash flow per share of Depositary Receipt on NVDA Issued by INVX – SET:NVDA23 - TradingView,2026-04-07 04:36:34,"Select market data provided by ICE Data Services. Select reference data provided by FactSet. Copyright © 2026 FactSet Research Systems Inc.Copyright © 2026, American Bankers Association. CUSIP Database provided by FactSet Research Systems Inc. All rights reserved. SEC fillings and other documents provided by Quartr.© 2026 TradingView, Inc.",https://www.tradingview.com/symbols/SET-NVDA23/financials-statistics-and-ratios/operating-cash-flow-per-share/
NVDA,Price to earnings ratio of Depositary Receipt on NVDA Issued by INVX – SET:NVDA23 - TradingView,2026-04-07 04:13:01,"Select market data provided by ICE Data Services. Select reference data provided by FactSet. Copyright © 2026 FactSet Research Systems Inc.Copyright © 2026, American Bankers Association. CUSIP Database provided by FactSet Research Systems Inc. All rights reserved. SEC fillings and other documents provided by Quartr.© 2026 TradingView, Inc.",https://www.tradingview.com/symbols/SET-NVDA23/financials-statistics-and-ratios/price-earnings/
NVDA,Depositary Receipt on NVDA Issued by INVX Earnings and Revenue – SET:NVDA23 - TradingView,2026-04-07 04:12:56,"In the last quarter, the company reported 51.12 THB per share, beating the 48.44 THB estimate by 5.54%. Revenue for the same period reached ‪2.15 T‬ THB, despite the estimate of ‪2.09 T‬ THB. For the next quarter, analysts expect 57.47 THB in earnings per share and ‪2.55 T‬ THB in revenue. Select market data provided by ICE Data Services. Select reference data provided by FactSet. Copyright © 2026 FactSet Research Systems Inc.Copyright © 2026, American Bankers Association. CUSIP Database provided by FactSet Research Systems Inc. All rights reserved. SEC fillings and other documents provided by Quartr.© 2026 TradingView, Inc.",https://www.tradingview.com/symbols/SET-NVDA23/financials-earnings/?earnings-period=FQ&revenues-period=FQ
NVDA,Basic earnings per share (basic EPS) of Depositary Receipt on NVDA Issued by INVX – SET:NVDA23 - TradingView,2026-04-07 04:09:05,"Select market data provided by ICE Data Services. Select reference data provided by FactSet. Copyright © 2026 FactSet Research Systems Inc.Copyright © 2026, American Bankers Association. CUSIP Database provided by FactSet Research Systems Inc. All rights reserved. SEC fillings and other documents provided by Quartr.© 2026 TradingView, Inc.",https://www.tradingview.com/symbols/SET-NVDA23/financials-income-statement/earnings-per-share-basic/
NVDA,Depositary Receipt on NVDA Issued by INVX Revenue Breakdown – SET:NVDA23 - TradingView,2026-04-07 04:08:56,"Last year, the company generated ‪6.81 T‬ THB, the most of which — ‪6.11 T‬ THB — came from its top-performing segment, Compute & Networking, compared to ‪3.93 T‬ THB the previous year. The greatest contribution came from United States, which accounted for ‪4.72 T‬ THB last year, with ‪2.07 T‬ THB the year before. Select market data provided by ICE Data Services. Select reference data provided by FactSet. Copyright © 2026 FactSet Research Systems Inc.Copyright © 2026, American Bankers Association. CUSIP Database provided by FactSet Research Systems Inc. All rights reserved. SEC fillings and other documents provided by Quartr.© 2026 TradingView, Inc.",https://www.tradingview.com/symbols/SET-NVDA23/financials-revenue/
NVDA,Depositary Receipt on NVDA Issued by INVX Balance Sheet – SET:NVDA23 - TradingView,2026-04-07 04:07:32,"Total assets for Q4 25 are ‪6.53 T‬ THB, 25.09% more than in Q3 25. And total liabilities increased by 14.22% in Q4 25 to ‪1.56 T‬ THB. Select market data provided by ICE Data Services. Select reference data provided by FactSet. Copyright © 2026 FactSet Research Systems Inc.Copyright © 2026, American Bankers Association. CUSIP Database provided by FactSet Research Systems Inc. All rights reserved. SEC fillings and other documents provided by Quartr.© 2026 TradingView, Inc.",https://www.tradingview.com/symbols/SET-NVDA23/financials-balance-sheet/
NVDA,Depositary Receipt on NVDA Issued by INVX Financial Statements – SET:NVDA23 - TradingView,2026-04-07 04:04:00,"NVIDIA Corp. engages in the design and manufacture of computer graphics processors, chipsets, and related multimedia software. It operates through the following segments: Graphics Processing Unit (GPU) and Compute & Networking. The Graphics segment includes GeForce GPUs for gaming and PCs, the GeForce NOW game streaming service and related infrastructure, Quadro and NVIDIA RTX GPUs for enterprise workstation graphics, virtual GPU, or vGPU, software for cloud-based visual and virtual computing, automotive platforms for infotainment systems, and Omniverse Enterprise software for building and operating metaverse and 3D internet applications. The Compute & Networking segment consists of Data Center accelerated computing platforms and end-to-end networking platforms including Quantum for InfiniBand and Spectrum for Ethernet, NVIDIA DRIVE automated-driving platform and automotive development agreements, Jetson robotics and other embedded platforms, NVIDIA AI Enterprise and other software, and DGX Cloud software and services. The company was founded by Jen Hsun Huang, Chris A. Malachowsky, and Curtis R. Priem in April 1993 and is headquartered in Santa Clara, CA. Fundamental metrics to determine fair value of the stock Select market data provided by ICE Data Services. Select reference data provided by FactSet. Copyright © 2026 FactSet Research Systems Inc.Copyright © 2026, American Bankers Association. CUSIP Database provided by FactSet Research Systems Inc. All rights reserved. SEC fillings and other documents provided by Quartr.© 2026 TradingView, Inc.",https://www.tradingview.com/symbols/SET-NVDA23/financials-overview/
NVDA,3 Reasons Growth Investors Will Love Nvidia (NVDA) - qz.com,2026-04-07 01:21:15,"This website is using a security service to protect itself from online attacks. The action you just performed triggered the security solution. There are several actions that could trigger this block including submitting a certain word or phrase, a SQL command or malformed data. You can email the site owner to let them know you were blocked. Please include what you were doing when this page came up and the Cloudflare Ray ID found at the bottom of this page. Cloudflare Ray ID: 9e8d6b9c7ec205ac
•

        Your IP:
        Click to reveal
20.55.15.102
•

Performance & security by Cloudflare",https://qz.com/3-reasons-growth-investors-will-love-nvidia-nvda
NVDA,NVIDIA Stock (NVDA) Opinions on GTC $1T Orders Announcement - Quiver Quantitative,2026-04-06 17:33:00,"Enter your email to receive free breaking news alerts and insights related to NVDA. Backtested trading strategies built on Quiver's datasets Be the first to see our newest insights and key updates across all datasets Track the top-performing stock portfolios held by U.S. politicians in Congress Find stocks with ease across diverse datasets and filters Build and test your own strategies, using Quiver's Congressional trading datasets Build and test your own strategies, using Quiver's Institutional holdings datasets Our video reports and analysis, with early access to exclusive, subscriber-only videos By: Quiver DiscussionTracker Fiscal Q4 Revenue Surge: Social media discussions highlight NVIDIA's fiscal fourth-quarter revenue jumping 73% to $68.1 billion, alongside projections for $1 trillion in AI revenue by 2027. Investors note the forward P/E ratio hitting a two-year low near 20, questioning if macro pressures are eclipsing these strong fundamentals. GTC Keynote Fuels Bullish Views: Jensen Huang's recent GTC announcements of $1 trillion in Blackwell and Rubin orders through 2027 have sparked optimism on social platforms. Firms raising price targets to $300-$360 cite the explosive $3-4 trillion AI infrastructure spend expected by 2030 as a key driver. Geopolitical Tensions Spark Caution: Chatter reflects concerns over war risks and inflation derating AI stocks, with NVDA down about 20% from October highs near $165-172. Traders debate a potential squeeze between moving averages, weighing breakout potential against further pullbacks. Note: This discussion summary was generated from an AI condensation of post data. NVIDIA insiders have traded $NVDA stock on the open market 263 times in the past 6 months. Of those trades, 0 have been purchases and 263 have been sales. Here’s a breakdown of recent trading of $NVDA stock by insiders over the last 6 months: To track insider transactions, check out Quiver Quantitative's insider trading dashboard. NVIDIA had revenues of $57B in Q3 2026. This is an increase of 62.49% from the same period in the prior year. You can track NVDA financials on Quiver Quantitative's NVDA stock page. Members of Congress have traded $NVDA stock 22 times in the past 6 months. Of those trades, 10 have been purchases and 12 have been sales. Here’s a breakdown of recent trading of $NVDA stock by members of Congress over the last 6 months: To track congressional stock trading, check out Quiver Quantitative's congressional trading dashboard. We have seen 2,498 institutional investors add shares of NVIDIA stock to their portfolio, and 2,470 decrease their positions in their most recent quarter. To track hedge funds' stock portfolios, check out Quiver Quantitative's institutional holdings dashboard. Wall Street analysts have issued reports on $NVDA in the last several months. We have seen 26 firms issue buy ratings on the stock, and 0 firms issue sell ratings. To track analyst ratings and price targets for NVIDIA, check out Quiver Quantitative's $NVDA forecast page. Multiple analysts have issued price targets for $NVDA recently. We have seen 33 analysts offer price targets for $NVDA in the last 6 months, with a median target of $275.0. This article is not financial advice. See Quiver Quantitative's disclaimers for more information. Note that there may be inaccuracies due to mistakes in ticker-mapping, and other anomalies. Add Quiver Quantitative to your preferred sources on Google",https://www.quiverquant.com/news/NVIDIA+Stock+%28NVDA%29+Opinions+on+GTC+%241T+Orders+Announcement
