ticker,title,date,content,url
NVDA,Cadent Capital Advisors LLC Cuts Stock Holdings in NVIDIA Corporation $NVDA - MarketBeat,2026-04-03 07:43:35,"Cadent Capital Advisors LLC lowered its holdings in  NVIDIA Corporation (NASDAQ:NVDA - Free Report) by 85.7% in the 4th quarter, according to the company in its most recent 13F filing with the SEC. The institutional investor  owned 1,795 shares of the computer hardware maker's stock after selling 10,788 shares during the quarter. Cadent Capital Advisors LLC's holdings in NVIDIA were worth $335,000 at the end of the most recent reporting period. Several other hedge funds have also recently modified their holdings of NVDA. Norges Bank purchased a new stake in  NVIDIA during the second quarter worth $51,386,863,000.  Capital Research Global Investors boosted its position in  NVIDIA by 16.1% during the 3rd quarter. Capital Research Global Investors now owns 165,377,852 shares of the computer hardware maker's stock valued at $30,855,564,000 after acquiring an additional 22,896,705 shares in the last quarter.  Laurel Wealth Advisors LLC increased its holdings in shares of  NVIDIA by 15,496.1% in the 2nd quarter. Laurel Wealth Advisors LLC now owns 21,865,525 shares of the computer hardware maker's stock valued at $3,454,534,000 after acquiring an additional 21,725,326 shares during the period.  Danske Bank A S purchased a new position in shares of  NVIDIA in the 3rd quarter valued at $3,180,313,000.  Finally, Massachusetts Financial Services Co. MA raised its position in shares of  NVIDIA by 25.0% in the 3rd quarter. Massachusetts Financial Services Co. MA now owns 71,720,593 shares of the computer hardware maker's stock worth $13,381,628,000 after acquiring an additional 14,358,048 shares in the last quarter. Hedge funds and other institutional investors own  65.27% of the company's stock. Here are the key news stories impacting NVIDIA this week: In other NVIDIA news, Director Mark A. Stevens sold 221,682 shares of the firm's stock in a transaction on Friday, March 20th. The shares were sold at an average price of $173.68, for a total value of $38,501,729.76. Following the completion of the transaction, the director owned 7,399,771 shares of the company's stock, valued at approximately $1,285,192,227.28. This trade represents a 2.91% decrease in their ownership of the stock. The transaction was disclosed in a filing with the SEC, which is accessible through the SEC website. Also, EVP Ajay K. Puri sold 300,000 shares of NVIDIA stock in a transaction on Wednesday, March 18th. The stock was sold at an average price of $182.25, for a total transaction of $54,675,000.00. Following the sale, the executive vice president owned 3,018,547 shares of the company's stock, valued at $550,130,190.75. The trade was a 9.04% decrease in their ownership of the stock. The disclosure for this sale is available in the SEC filing. In the last quarter, insiders have sold 1,401,616 shares of company stock worth $253,555,407. 4.17% of the stock is owned by corporate insiders. NVIDIA stock opened at $177.39 on Friday. The company has a debt-to-equity ratio of 0.05, a quick ratio of 3.24 and a current ratio of 3.91. The stock has a market cap of $4.31 trillion, a PE ratio of 36.20, a price-to-earnings-growth ratio of 0.59 and a beta of 2.34. The stock has a 50-day moving average of $182.62 and a two-hundred day moving average of $184.17. NVIDIA Corporation has a one year low of $86.62 and a one year high of $212.19. NVIDIA (NASDAQ:NVDA - Get Free Report) last issued its quarterly earnings results on Wednesday, February 25th. The computer hardware maker reported $1.62 earnings per share for the quarter, topping analysts' consensus estimates of $1.54 by $0.08. The business had revenue of $68.13 billion for the quarter, compared to analyst estimates of $65.56 billion. NVIDIA had a return on equity of 97.37% and a net margin of 55.60%.The company's revenue was up 73.2% on a year-over-year basis. During the same quarter in the previous year, the firm earned $0.89 earnings per share.  On average, research analysts anticipate that  NVIDIA Corporation will post 2.77 EPS for the current fiscal year. The business also recently announced a quarterly dividend, which was paid on Wednesday, April 1st. Shareholders of record on Wednesday, March 11th were given a dividend of $0.01 per share. This represents a $0.04 annualized dividend and a yield of 0.0%. The ex-dividend date of this dividend was Wednesday, March 11th. NVIDIA's payout ratio is currently 0.82%. A number of equities research analysts recently weighed in on NVDA shares. Wolfe Research upped their price objective on NVIDIA from $250.00 to $275.00 and gave the stock an ""outperform"" rating in a research note on Friday, January 30th. DA Davidson  reiterated a ""buy"" rating and issued a $250.00 target price on shares of NVIDIA in a report on Monday, February 23rd. Raymond James Financial increased their price target on shares of NVIDIA from $291.00 to $323.00 and gave the company a ""strong-buy"" rating in a research report on Thursday, March 19th. TD Cowen  restated a ""buy"" rating and issued a $235.00 price target on shares of NVIDIA in a report on Tuesday, March 17th. Finally, Bank of America lifted their price objective on shares of NVIDIA from $275.00 to $300.00 and gave the stock a ""buy"" rating in a research report on Thursday, February 26th. Four research analysts have rated the stock with a Strong Buy rating, forty-seven have issued  a Buy rating and two have assigned  a Hold rating to the stock. Based on data from MarketBeat, NVIDIA presently has a consensus rating of ""Buy"" and an average price target of $275.25. NVIDIA Corporation, founded in 1993 and headquartered in Santa Clara, California, is a global technology company that designs and develops graphics processing units (GPUs) and system-on-chip (SoC) technologies. Co-founded by Jensen Huang, who serves as president and chief executive officer, along with Chris Malachowsky and Curtis Priem, NVIDIA has grown from a graphics-focused chipmaker into a broad provider of accelerated computing hardware and software for multiple industries. The company's product portfolio spans discrete GPUs for gaming and professional visualization (marketed under the GeForce and NVIDIA RTX lines), high-performance data center accelerators used for AI training and inference (including widely adopted platforms such as the A100 and H100 series), and Tegra SoCs for automotive and edge applications. This instant news alert was generated by narrative science technology and financial data from MarketBeat in order to provide readers with the fastest reporting and unbiased coverage. Please send any questions or comments about this story to contact@marketbeat.com. Before you consider NVIDIA, you'll want to hear this. MarketBeat keeps track of Wall Street's top-rated and best performing research analysts and the stocks they recommend to their clients on a daily basis. MarketBeat has identified the five stocks that top analysts are quietly whispering to their clients to buy now before the broader market catches on... and NVIDIA wasn't on the list. While NVIDIA currently has a Buy rating among analysts, top-rated analysts believe these five stocks are better buys. Discover the next wave of investment opportunities with our report, 7 Stocks That Will Be Magnificent in 2026. Explore companies poised to replicate the growth, innovation, and value creation of the tech giants dominating today's markets. Sign up for MarketBeat All Access to gain access to MarketBeat's full suite of research tools. 345 N Reid Place, Suite 620, Sioux Falls, SD 57103
                                        
                                        contact@marketbeat.com
                                        
                                        (844) 978-6257 © MarketBeat Media, LLC 2010-2026. All rights reserved. © 2026   Fair market value prices are updated every minute and are provided by Massive. Other market data provided is at least 10-minutes delayed and hosted by Barchart Solutions.  Information is provided 'as-is' and solely for informational purposes, not for trading purposes or advice, and is delayed. To see all exchange delays and terms of use please see Barchart's disclaimer. We and our partners share information on your use of this website to help improve your experience. For more information, or to opt out click the Do Not Sell My Information button below.",https://www.marketbeat.com/instant-alerts/filing-cadent-capital-advisors-llc-cuts-stock-holdings-in-nvidia-corporation-nvda-2026-04-03/
NVDA,Jensen Huang Just Said Something Astounding About Nvidia's Revenue Potential - The Motley Fool,2026-04-02 23:10:00,"How high can Nvidia's revenue climb over the next few years? Nvidia (NVDA +0.93%) has wowed investors quarter after quarter with its revenue growth during this artificial intelligence (AI) boom. The company, as the dominant AI chip player worldwide, has seen demand soar as customers expand cloud infrastructure and put AI models to work. How has Nvidia remained ahead of rivals? The tech giant was first to market with its powerful graphics processing units (GPUs) designed specifically for AI, and that set it a step ahead from the start. But, importantly, Nvidia has been updating its systems annually, making it very difficult for competitors to catch up. As a result of Nvidia's AI work so far, revenue soared 65% in the recent full year to reach $215 billion. Now, at this stage of the AI boom, it's reasonable to wonder what's next for revenue growth. Nvidia chief Jensen Huang has suggested it's on the way to $1 trillion in the near future, and just last week, he said something particularly astounding about the company's revenue potential... So, first, let's consider the revenue path so far. As mentioned, Nvidia has significantly increased revenue as companies put the focus on AI. A striking example is the chip giant's progress from three years ago to today. Back then, annual revenue was $27 billion, less than today's quarterly figure -- in the latest quarter, Nvidia reported $68 billion in revenue. This is because companies have turned to Nvidia for its top-performing GPUs, critical tools needed for the training of AI models. And then, as Nvidia expanded its offerings into networking, enterprise software, and more, customers' orders expanded too. Today, Nvidia offers complete systems, and as it upgrades its chips, customers may build out their current Nvidia platforms -- and this creates a growing Nvidia presence within data centers. Nvidia aims to launch its next system, Vera Rubin, later this year and is already in full production. During Nvidia's recent GTC conference, Huang lifted his earlier revenue estimate for Blackwell and Rubin system sales from last year through 2027 from $500 million to $1 trillion. Now, let's consider what the Nvidia CEO said during a podcast last week with Lex Fridman, about Nvidia's revenue path from here: ""Is it possible for Nvidia to be a, you know, $3 trillion revenue company in the near future?"" Huang said. ""The answer is, of course, yes. And the reason for that is because it's not limited by any physical limits."" Huang said that Nvidia isn't in the business of taking market share from other companies in an existing space -- instead, Nvidia's revenue level will be determined by the opportunity the chip leader creates. For example, Nvidia is bringing AI platforms into various industries, such as healthcare and telecom, and establishing its presence there, so that these players will use Nvidia's AI systems to gain efficiency and boost innovation. And Nvidia should play a key role in the actual application of AI to real-world problems, as these problem-solving machines need compute not just for training -- but also as they ""think through"" questions and do their jobs. All of this expands Nvidia's revenue opportunity. Of course, Nvidia faces competition from other chip designers and even certain customers, as they have designed some of their own chips. The keyword here, though, is ""some"" -- these companies, such as Amazon and Meta Platforms, haven't suggested that their chips are aiming to replace those of Nvidia. And Nvidia's complete ecosystem and well-established presence in data centers worldwide, as well as the company's pledge to update chips annually, should keep it in the leading position. All of this suggests that, with AI just starting to roll out in the real world, Nvidia's revenue growth is far from over -- and as Jensen Huang suggests, the company may even be on the path to $3 trillion. Adria Cimino has positions in Amazon. The Motley Fool has positions in and recommends Amazon, Meta Platforms, and Nvidia. The Motley Fool has a disclosure policy. *Average returns of all recommendations since inception. Cost basis and return based on previous market day close. Invest better with The Motley Fool. Get stock recommendations, portfolio guidance, and more from The Motley Fool's premium services. © 1995 - 2026 The Motley Fool. All rights reserved.",https://www.fool.com/investing/2026/04/02/jensen-huang-said-something-astounding-revenue/
NVDA,"3 Must-Buy Profitable Stocks for April 2026 (MU, AVGO, NVDA) - Yahoo Finance",2026-04-02 19:00:00,"Tip: Try a valid symbol or a specific company name for relevant results As April gets underway, investors should focus on companies that generate strong returns after factoring in all operating and non-operating expenses. As a result, consistently profitable businesses tend to be more appealing than those posting losses. To assess profitability, investors often rely on accounting ratios that offer clear insights into a company’s bottom-line performance. On that note, Micron Technology, Inc. MU, Broadcom Inc. AVGO and NVIDIA Corporation NVDA stand out as the leading profitable picks, backed by strong net income ratios and substantial upside potential. The net income ratio is not the only indicator of future winners. So, we have added a few more criteria to arrive at a winning strategy. Zacks Rank Equal to #1: Whether the market is good or bad, stocks with a Zacks Rank #1 (Strong Buy) have a proven history of outperformance. You can see the complete list of today’s Zacks #1 Rank stocks here. Trailing 12-Month Sales and Net Income Growth Higher than X Industry: Stocks that have witnessed higher-than-industry sales and net income growth in the past 12 months are positioned to perform well. Trailing 12-Month Net Income Ratio Higher than X Industry: A high net income ratio indicates a company’s solid profitability. Percentage Rating Strong Buy greater than 70: This indicates that 70% of the current broker recommendations for the stock are Strong Buy. These few parameters have narrowed the universe of more than 7,685 stocks to only 25. Here are three of the 25 stocks that qualified the screening: Micron Technology is a provider of memory and storage products globally. The 12-month net profit margin of MU is 41.5% (read more: Up 15%+ in Q1: 2 AI Stocks Still Flashing “Strong Buy” for Q2). Broadcom develops and delivers semiconductor devices and infrastructure software solutions worldwide. The 12-month net profit margin of AVGO is 36.6%. NVIDIA is a global computing infrastructure company offering graphics, compute and networking solutions. The 12-month net profit margin of NVDA is 55.6%. Want the latest recommendations from Zacks Investment Research? Today, you can download 7 Best Stocks for the Next 30 Days. Click to get this free report Micron Technology, Inc. (MU) : Free Stock Analysis Report NVIDIA Corporation (NVDA) : Free Stock Analysis Report This article originally published on Zacks Investment Research (zacks.com). Tip: Try a valid symbol or a specific company name for relevant results",https://finance.yahoo.com/markets/stocks/articles/3-must-buy-profitable-stocks-190000310.html
NVDA,Nvidia Stock Is Climbing Today: What's Going On? - NVIDIA (NASDAQ:NVDA) - Benzinga,2026-04-02 18:19:21,"© 2026 Benzinga.com. Benzinga does not provide investment advice. All rights reserved. To add Benzinga News as your preferred source on Google, click here. A newsletter built for market enthusiasts by market enthusiasts. Top stories, top movers, and trade ideas delivered to your inbox every weekday before and after the market closes.",https://www.benzinga.com/trading-ideas/movers/26/04/51634868/nvidia-stock-is-climbing-today-whats-going-on
NVDA,"Bye Bye, NVDA! Cathie Wood Dumps Nearly $30 Million in Nvidia - TradingView",2026-04-02 17:24:10,"Cathie Wood's ARK Invest sold about $27.8 million worth of Nvidia NVDA shares on March 26, as the fund manager rotated capital out of large-cap AI hardware stocks and into healthcare AI and cloud computing upstarts. ARK disposed of 155,441 shares of Nvidia on March 26, its largest single-day reduction in the chipmaker this year, according trade disclosures. Wood's pivot reflects growing concerns about stretched valuations for AI infrastructure names as the Nasdaq Composite entered correction territory. Wood's logic is not that she is bearish on AI, said a market strategist who tracks ARK's trades. She is rebalancing capital into areas she sees as earlier-stage opportunities, like AI-powered biotech and compute-as-a-service. ARK also began adding OpenAI to three of its ETFs this week, giving retail investors exposure to the closely-watched AI startup. Most analysts remain bullish on Nvidia, with consensus price targets still implying significant upside. But Wood, known for early bets on Tesla and Bitcoin, is signaling that the next phase of AI value creation may lie not in chipmaking, but in application-layer intelligence and infrastructure leasing. Select market data provided by ICE Data Services. Select reference data provided by FactSet. Copyright © 2026 FactSet Research Systems Inc.Copyright © 2026, American Bankers Association. CUSIP Database provided by FactSet Research Systems Inc. All rights reserved. SEC fillings and other documents provided by Quartr.© 2026 TradingView, Inc.",https://www.tradingview.com/news/gurufocus:8f74f43bd094b:0-bye-bye-nvda-cathie-wood-dumps-nearly-30-million-in-nvidia/
NVDA,NVIDIA (NVDA) closes week of Mar 30 at ___? Trading Odds & Predictions - Polymarket,2026-04-02 16:43:19,"Trader consensus on Polymarket has coalesced at 100% implied probability for NVIDIA (NVDA) shares closing the week of March 30 in the $175-$180 range, reflecting Thursday's April 2 close at $177.39 and Friday's intraday trading between $171.37 and $177.49 amid elevated volume exceeding 142 million shares. This strong positioning stems from a sharp 8% rebound from Monday's $165.17 low, fueled by news of an AI startup securing funding for a massive Nvidia-powered data center, countering prior pressures from geopolitical tensions and inflation concerns that had compressed NVDA's forward P/E to a seven-year low. While sovereign AI demand and robust data center revenue trends underpin the rally, a late-session selloff triggered by broader market volatility or renewed macro risks could realistically push the close below $175, though current levels suggest minimal risk. Next quarter's earnings on May 20 loom as a key catalyst. Polymarket operates globally through separate legal entities. Polymarket US is operated by QCX LLC d/b/a Polymarket US, a CFTC-regulated Designated Contract Market. This international platform is not regulated by the CFTC and operates independently. Trading involves substantial risk of loss. See our Terms of Service & Privacy Policy.",https://polymarket.com/event/nvda-week-april-3-2026
NVDA,Micron Technology (MU) Ramping Up Production For NVDA’s Next-Gen Vera Rubin Systems - Yahoo Finance,2026-04-02 13:43:35,"Tip: Try a valid symbol or a specific company name for relevant results Micron Technology, Inc. (NASDAQ:MU) is one of the Stocks That Can Make You Richer in 2026. On March 16, Micron Technology, Inc. (NASDAQ:MU) at the GTC 2026 announced ramping up production of advanced products for NVIDIA’s next-gen Vera Rubin systems. ​The company noted that they began volume shipments of HBM4 36GB 12H in Q1 2026, highlighting that the HBM4 hits over 11 Gb/s per pin, delivering more than 2.8 TB/s bandwidth per stack, which is 2.3 times higher than their prior HBM3E, with more than 20% better power efficiency. Moreover, the HBM4 is designed specifically for NVIDIA Vera Rubin GPUs. ​The company also highlighted shipping samples of HBM4 48GB 16H to customers after demonstrating stacking 16 dies for 33% more capacity per HBM cube. Management said that their collaboration with Nvidia ensures that compute and memory are together from day one. The company said that the industry-first SOCAMM2 and Gen6 SSDs are now in high-volume production. SOCAMM2 is a first-of-its-kind module for Vera Rubin NVL72 racks and standalone Vera CPUs. The technology packs up to 2TB of memory per CPU with 1.2 TB/s bandwidth. ​​Micron Technology, Inc. (NASDAQ:MU) designs and manufactures memory and storage solutions used across data centers, AI systems, and consumer devices. While we acknowledge the potential of MU as an investment, we believe certain AI stocks offer greater upside potential and carry less downside risk. If you're looking for an extremely undervalued AI stock that also stands to benefit significantly from Trump-era tariffs and the onshoring trend, see our free report on the best short-term AI stock. READ NEXT: 33 Stocks That Should Double in 3 Years and 15 Stocks That Will Make You Rich in 10 Years. Disclosure: None. Follow Insider Monkey on Google News. Tip: Try a valid symbol or a specific company name for relevant results",https://finance.yahoo.com/markets/stocks/articles/micron-technology-mu-ramping-production-134335194.html
NVDA,Wolfe Research Maintains a Buy Rating on Nvidia (NVDA) - Yahoo! Finance Canada,2026-04-02 13:43:21,"Tip: Try a valid symbol or a specific company name for relevant results NVIDIA Corporation (NASDAQ:NVDA) is one of the Stocks That Can Make You Richer in 2026. On March 27, Wolfe Research reiterated an Outperform rating and $275.00 price target on NVIDIA Corporation (NASDAQ:NVDA). ​The rating comes after the company’s GTC announcement of Rubin Ultra Pods for agentic AI datacenters. According to the company, the pods act as a reference design for optimal agentic AI architecture. NVIDIA noted that with new components like CPU, storage, and Groq, the Pods have the potential to add 50% incremental revenue over VR compute racks alone. The firm noted that the Groq 3 LPX rack offers about 25% incremental opportunity to VR200 racks by enabling low-latency inference for premium service tiers. Wolfe estimates $150 million in Nvidia content per pod, with two-thirds from VR200 racks and Groq as the biggest incremental driver. Moreover, pods also incorporate CPU, storage, and Ethernet racks. Moreover, the firm noted that Nvidia CEO Jensen Huang stated on the Lex Fridman podcast that the company might produce 200 pods weekly. ​​NVIDIA Corporation (NASDAQ:NVDA) is a fabless semiconductor company. It designs and develops graphics processing units and related technologies used in gaming, data centers, artificial intelligence, and autonomous systems. While we acknowledge the potential of NVDA as an investment, we believe certain AI stocks offer greater upside potential and carry less downside risk. If you're looking for an extremely undervalued AI stock that also stands to benefit significantly from Trump-era tariffs and the onshoring trend, see our free report on the best short-term AI stock. READ NEXT: 33 Stocks That Should Double in 3 Years and 15 Stocks That Will Make You Rich in 10 Years. Disclosure: None. Follow Insider Monkey on Google News. Tip: Try a valid symbol or a specific company name for relevant results",https://ca.finance.yahoo.com/news/wolfe-research-maintains-buy-rating-134321044.html
