ticker,title,date,content,url
NVDA,NVIDIA (NVDA) Up or Down on April 8? Prediction Market Prices - Yahoo Finance,2026-04-07 23:21:31,"Tip: Try a valid symbol or a specific company name for relevant results Investors are turning to social media and following 'finfluencers' to inform their investment decisions High new car prices, rising gas costs, and rising interest rates brought buyers to used car lots Dow, S&P 500, Nasdaq futures soar after Trump calls for two-week ceasefire Markets weigh the chances of economic fallout from an attack on Iran against previous threats from Trump The S&P 500 and Nasdaq ended the day slightly higher on hopes of an Iran deadline extension Anthropic launches cybersecurity partnership with Amazon, Apple, Google, Microsoft, Nvidia, and others Tech is doing everything right and getting left behind. Here's what could turn that around. US stocks drift lower as Trump's deadline for Iran ultimatum looms US gas prices risk topping $5 per gallon if the Strait of Hormuz stays closed, JPMorgan says Netflix stands to get richer after losing Warner Bros. bidding war. Here's why. Goldman Sachs delivered a warning to laid-off tech workers that it will take more time to find a new job than expected The Dow, S&P 500, and Nasdaq gained ahead of Trump's deadline for an Iran deal US stocks open muted, oil dips as Wall Street eyes push for Iran truce talks JPMorgan CEO flags Iran war-fueled inflation, private credit, and AI-linked job losses as risks to the economy 'Wouldn't be shocked' if bull market continues: Wall Street aims to look past Iran conflict What if I can’t pay my taxes? 5 ways to tackle your bill. The US labor market right now can be defined by one word: Whiplash The Trump administration has signaled it will offer broad tariff refunds. That could mean millions for companies. Inflation readings, oil volatility, and airline earnings: What to watch this week Britain's billion-dollar bet on a hypercar is ""a genuinely incredible machine to drive,"" writes senior reporter Pras Subramanian. Cocoa prices are falling — but not in time for Easter (CNN Business) 7 things to know about Schwab's new brokerage account for teenagers The war in Iran shows no signs of slowing down, and its damage may be felt for years to come The best markets for first-time homebuyers are increasingly in these two regions of the US The company's gravitational pull has the potential to elevate Elon Musk as a government partner, Wall Street fixture, and tech entrepreneur. US judge upholds block of subpoenas in criminal investigation of Jay Powell (Financial Times) Hyundai's Boulder concept previews the automaker's truck future, built in America What we've learned in a year since 'Liberation Day' Americans nearing retirement plan to take Social Security 'as soon as eligible' March jobs report: US economy adds 178,000 jobs, unemployment rate falls to 4.3% in surprise turnaround The March jobs report will show a fuller picture of the state of the job market, just as the Iran war began to weigh on the global economy. Jet fuel prices are up 100%, oil prices keep surging, and airlines are paying the price Microsoft is building its own high-powered AI models, a sign that it is looking to wean itself from OpenAI Stocks shook off early losses, oil held on to gains as markets assessed a potential easing in the Strait of Hormuz Mortgage rates rose above 6% for the 5th straight week Stocks spiked after Iran announced it's working with Oman on a Strait of Hormuz traffic protocol US stocks fall at the open while oil surges after Trump says the war in Iran is not yet over What's changed (and what hasn't) in the year since Trump's 'Liberation Day' Watch live: President Trump addresses nation as Iran war rattles markets Nike set the stage for a turnaround, but global events keep getting in its way Bank of America rips up its economic forecasts as it braces for $100 oil all year on Iran war disruptions Trump says the Strait of Hormuz must be 'open, free and clear' before having ceasefire talks with Iran The Dow, S&P 500, and Nasdaq extended their rally for a second day ahead of Trump’s speech on Iran The Nasdaq led the Dow and S&P 500 higher on growing optimism the war in Iran may end soon SpaceX has confidentially filed for an initial public offering. SpaceX was most recently valued at $1.25 trillion. US stocks rise at the open as deescalation talk in Iran extends rally The bond market is helping resolve the Fed's interest rate dilemma Whoop CEO has eyes on IPO after company raises $575 million in funding at a $10.1 billion valuation Gold prices rallied on hopes of a swift end to the Iran war, but it still posted its worst month in over a decade Here are the highlights, lowlights, and everything else from the first quarter of 2026 This market will resolve to ""Up"" if the Close price for NVIDIA (NVDA) on April 8, 2026 is higher than the Close price for NVIDIA (NVDA) on the most recent prior trading day.

This market will resolve to ""Down"" if the Close price for NVIDIA (NVDA) on April 8, 2026 is lower than the Close price for NVIDIA (NVDA) on the most recent prior trading day.

E.g., ordinarily, a market on Monday would refer to the previous Friday for its most recent closing price, unless that Friday were a market holiday, in which case it would refer to Thursday, or the next most recent trading day.

If the two specified closing prices are exactly equal, this market will resolve 50-50. Closing prices will be used exactly as published by Pyth, without rounding.

If NVIDIA (NVDA) does not trade at all during the regular session, the market will resolve 50-50.

For a standard full trading session, the closing price refers to the Pyth ""Close"" value of the 1-minute candle corresponding to the final minute of regular trading hours on the primary exchange.

If either of the relevant days has no valid Pyth Close value for the 1-minute candle corresponding to the end of regular trading hours on the primary exchange, the market will use the last valid Pyth price achieved during the regular trading hours of the primary exchange as the effective closing price. If no valid Pyth price exists for that trading day due to a system outage, data failure, or other technical disruption, the official closing price published by the primary exchange on which the listed security trades will be used to determine the closing price for that day.

Only prices achieved during the regular trading hours of the primary exchange on which the listed security trades (typically 9:30 AM – 4:00 PM ET) will be considered.

In the event of a stock split, reverse stock split, or similar corporate action affecting the listed security during the listed time frame, this market will resolve based on split-adjusted prices as displayed on Pyth.

The resolution source for this market will be Pyth, specifically the ""Close"" values for the relevant 1-minute candle available at https://pythdata.app/explore/Equity.US.NVDA%2FUSD. Historical 1-minute candles may be accessed by appending a Unix timestamp (seconds) to the Pyth chart URL using the ""t="" parameter. Any timestamp within the listed market time frame may be used to view the relevant candle data (e.g., https://pythdata.app/explore/Equity.US.NVDA%2FUSD?t=1773432000). Tip: Try a valid symbol or a specific company name for relevant results",https://finance.yahoo.com/markets/prediction/event/nvda-up-or-down-on-april-8-2026/
NVDA,Best Stock to Buy: Nvidia Stock or AMD Stock? - The Globe and Mail,2026-04-07 20:46:00,"Nvidia(NASDAQ: NVDA) and AMD(NASDAQ: AMD) are two of the best semiconductor companies in the world, but only one can be the better stock to buy in this comparison. Will AI create the world's first trillionaire? Our team just released a report on the one little-known company, called an ""Indispensable Monopoly"" providing the critical technology Nvidia and Intel both need. Continue » *Stock prices used were the afternoon prices of April 4, 2026. The video was published on April 6, 2026. The Motley Fool Stock Advisor analyst team just identified what they believe are the 10 best stocks for investors to buy now… and Nvidia wasn’t one of them. The 10 stocks that made the cut could produce monster returns in the coming years. Consider when Netflix made this list on December 17, 2004... if you invested $1,000 at the time of our recommendation, you’d have $533,522!* Or when Nvidia made this list on April 15, 2005... if you invested $1,000 at the time of our recommendation, you’d have $1,089,028!* Now, it’s worth noting Stock Advisor’s total average return is 930% — a market-crushing outperformance compared to 185% for the S&P 500. Don't miss the latest top 10 list, available with Stock Advisor, and join an investing community built by individual investors for individual investors. Parkev Tatevosian, CFA has positions in Nvidia. The Motley Fool has positions in and recommends Advanced Micro Devices and Nvidia. The Motley Fool has a disclosure policy. Parkev Tatevosian is an affiliate of The Motley Fool and may be compensated for promoting its services. If you choose to subscribe through his link, he will earn some extra money that supports his channel. His opinions remain his own and are unaffected by The Motley Fool. All market data (will open in new tab) is provided by Barchart Solutions. Copyright © 2026. Information is provided 'as is' and solely for informational purposes, not for trading purposes or advice. For exchange delays and terms of use, please read disclaimer (will open in new tab).",https://www.theglobeandmail.com/investing/markets/stocks/NVDA/pressreleases/1188347/best-stock-to-buy-nvidia-stock-or-amd-stock/
NVDA,Nvidia Stock Just Presented Investors With a Once-in-a-Decade Buying Opportunity - The Motley Fool,2026-04-07 19:53:00,"Nvidia stock just fell to a bargain-basement valuation. The S&P 500 index has plunged almost 9% from its January all-time high amid ongoing geopolitical tensions in the Middle East. With oil prices soaring, Wall Street is worried about a slowdown in the U.S. economy and in corporate earnings. Some individual tech stocks have declined even more sharply than the S&P 500, including Nvidia (NVDA +0.07%) which is currently down 20% from its record high. While the company could be impacted by economic uncertainty in the short term, demand for its data center chips is likely to remain rock-solid in the medium and long term, given their critical role in artificial intelligence (AI) development. Nvidia stock is currently cheaper than the S&P 500 on a forward price-to-earnings (P/E) basis for the first time in 13 years, presenting investors with a potential once-in-a-decade buying opportunity. Here's why they might want to grab it with both hands. Nvidia's primary data center chips are called graphics processing units (GPUs). They are designed for parallel processing, which means they are great at handling multiple tasks simultaneously, making them ideal for data-intensive workloads like AI training and AI inference. Our experts' top-rated cash back card just got even better. For a limited time, earn a $250 bonus after spending just $500 in the first 3 months. Plus, earn unlimited cash back and pay 0% intro APR until well into 2027. Its current flagship GPU is the GB300, which is based on the company's Blackwell architecture. The GB300 offers up to 50 times more performance (in certain configurations) than Nvidia's original AI data center GPU, the H100, which was launched in 2022. This highlights how fast the company is innovating. But Nvidia is taking another step forward this year with its new Vera Rubin platform. It includes the Rubin GPU and the Vera CPU, combined with upgraded networking equipment for even faster processing speeds. Nvidia says the platform will be so powerful that developers will be able to train AI models using 75% fewer GPUs, leading to an incredible 90% reduction in inference token costs. One little-known company, called an ""Indispensable Monopoly"" owns the technology Nvidia, AMD, and Intel cannot function without. And it is still just a fraction of Nvidia’s size. We just released a brand-new report with the full story and the company’s name. Tokens are slivers of data generated by an AI model in response to a prompt. They can be words, symbols, or images, and they require computing power to generate, which costs money. That is why most AI providers charge their users based on their token consumption. Bringing down inference token costs will encourage more usage while increasing profit margins for AI companies. As a result, Nvidia CFO Colette Kress expects every cloud provider and AI developer to deploy Vera Rubin chips. Samples recently started shipping to customers, with mass production scheduled for the second half of this year. Nvidia's 2026 fiscal year ended on Jan. 25. The company generated a record $215.9 billion in revenue, which was up 65% from the previous year. Its data center business alone accounted for $193.7 billion of that revenue, and it grew by 68%. But in the current 2027 fiscal year, Wall Street believes Nvidia's overall revenue growth will accelerate to 71%, with almost $370 billion expected to flow through the door (according to Yahoo! Finance). That estimate suggests there could be incredible demand for Vera Rubin chips. At the bottom line, Nvidia generated adjusted non-GAAP (generally accepted accounting principles) earnings of $4.77 per share during fiscal 2026, and Wall Street expects that figure to soar by 74% to $8.29 per share in fiscal 2027. These figures are central to the company's valuation story, which we will explore below. Based on Nvidia's fiscal 2026 earnings, its stock is trading at a P/E ratio of 34.7, a steep discount to its 10-year average of 61.6. But based on the company's expected fiscal 2027 earnings, its stock is trading at a forward P/E ratio of just 20.5. For some perspective, the S&P 500 is currently trading at a forward P/E ratio of 20.7, so Nvidia is currently cheaper than the benchmark index -- for the first time in more than a decade. Therefore, this appears to be a rare buying opportunity for investors. In terms of potential upside from here, Nvidia stock would have to soar by 200% by the end of fiscal 2027 (which concludes on Jan. 31, 2027) just to trade in line with its 10-year average P/E ratio of 61.6. Of course, that assumes Wall Street's fiscal 2027 earnings estimate is accurate. I think Nvidia will meet or even exceed expectations. CEO Jensen Huang recently said the world was spending around $400 billion per year on classical computing infrastructure in the past, and to highlight the opportunity at hand, he asserted that AI workloads require a thousand times more computing capacity. As a result, Huang believes data center operators could be spending up to $4 trillion per year on AI infrastructure by 2030, creating an enormous addressable market. The Motley Fool Stock Advisor analyst team just identified what they believe are the 10 best stocks for investors to buy now… and Nvidia wasn’t one of them. The 10 stocks that made the cut could produce monster returns in the coming years. Consider when Netflix made this list on December 17, 2004... if you invested $1,000 at the time of our recommendation, you’d have $533,522!* Or when Nvidia made this list on April 15, 2005... if you invested $1,000 at the time of our recommendation, you’d have $1,089,028!* Now, it’s worth noting Stock Advisor’s total average return is 930% — a market-crushing outperformance compared to 185% for the S&P 500. Don't miss the latest top 10 list, available with Stock Advisor, and join an investing community built by individual investors for individual investors. Anthony Di Pizio has no position in any of the stocks mentioned. The Motley Fool has positions in and recommends Nvidia. The Motley Fool has a disclosure policy. This tech could reach $80 trillion. Imagine a technology worth over 18 Nvidias. What in the world could be worth 18 Nvidias? The answer is a radical tech breakthrough that our experts think is transforming every walk of life. And this giant leap forward has many on Wall Street very excited. *Average returns of all recommendations since inception. Cost basis and return based on previous market day close. Our experts' top-rated cash back card just got even better. For a limited time, earn a $250 bonus after spending just $500 in the first 3 months. Plus, earn unlimited cash back and pay 0% intro APR until well into 2027. Invest better with The Motley Fool. Get stock recommendations, portfolio guidance, and more from The Motley Fool's premium services. © 1995 - 2026 The Motley Fool. All rights reserved.",https://www.fool.com/investing/2026/04/07/nvidia-stock-once-in-a-decade-buying-opportunity/
NVDA,Nvidia Redefines The AI Economics (NASDAQ:NVDA) - Seeking Alpha,2026-04-07 19:42:28,"My perspective on Nvidia Corporation (NVDA) has evolved over the past few months. I believe that it has remained one of the most potent financial engines in the markets, but it feels like an understatement to Analyst’s Disclosure: I/we have a beneficial long position in the shares of NVDA either through stock ownership, options, or other derivatives. I wrote this article myself, and it expresses my own opinions. I am not receiving compensation for it (other than from Seeking Alpha). I have no business relationship with any company whose stock is mentioned in this article. Seeking Alpha's Disclosure: Past performance is no guarantee of future results. No recommendation or advice is being given as to whether any investment is suitable for a particular investor. Any views or opinions expressed above may not reflect those of Seeking Alpha as a whole. Seeking Alpha is not a licensed securities dealer, broker or US investment adviser or investment bank. Our analysts are third party authors that include both professional investors and individual investors who may not be licensed or certified by any institute or regulatory body.",https://seekingalpha.com/article/4889021-nvidia-redefines-the-ai-economics?source=generic_rss
NVDA,Don't Abandon Faith in Nvidia - Streetwise Reports,2026-04-07 17:40:28,"Get the Latest Investment Ideas Delivered Straight to Your Inbox.
		
			
			Subscribe Stephen McBride of RiskHedge explains why you shouldn't lose all faith in Nvidia Corp. (NVDA:NASDAQ) just yet. Nvidia Corp. (NVDA:NASDAQ) has proven to be an unparalleled engine of prosperity for investors. Following the emergence of ChatGPT in the waning months of 2022, NVDA has delivered a staggering 1,000% return to shareholders. Our team championed Nvidia in Disruption Investor back in September 2020, when its market capitalization stood at $320 billion. On the heels of such a meteoric ascent, the pressing question in every investor's mind is: Does Nvidia possess the stamina to sustain this trajectory? When a stock catapults to such heights with such alacrity, the instinctive presumption is that the window of opportunity for effortless gains has closed. Illustrating this point, NVDA's upward march has stalled over the preceding eight months, prompting numerous investors to cut ties with the stock. However, as I intend to illustrate, this reaction is sorely misguided. NVIDIA is poised to embark on yet another momentous surge. The catalyst lies in its most recent, transformative offering... Allow me to elucidate the salient details, but first, let us rewind the clock a couple of years... Artificial intelligence (AI) once resembled a middling intern... Intermittently constructive, yet prone to unreliability and elementary blunders. In the present day, AI's capabilities have expanded tremendously. It can generate functional code, tackle more intricate challenges, and distill vast troves of data in mere moments. Recently, I harnessed AI to construct an interactive database monitoring America's foremost innovators. From commencement to completion, assembling The Innovators League website consumed a mere 37 minutes. The experience verged on the magical. Even a solitary year prior, such a feat would have been inconceivable. It eludes the awareness of most investors that enhanced chips played a surprisingly minor part in AI's latest strides. AI enterprises devised more astute methodologies for training their models. They honed their skills in fine-tuning post-training. They unearthed techniques to prolong the models' deliberation before responding. And they discovered means to extract greater performance from identical hardware. Across the preceding 18 months, the vehicle's velocity continually increased... not due to significant alterations to the engine, but because the crew persisted in calibrating every other component. Superior tires. Streamlined aerodynamics. You grasp the concept. But fine-tuning has its limitations. Eventually, the subsequent leap must originate from a more potent engine. This is precisely what Nvidia is now furnishing to the market. A fortnight ago at the GTC conference, Nvidia thrust Blackwell Ultra into the limelight. My colleague Chris Wood dubs it ""the most significant product launch in Nvidia's history."" It heralds the transition from 8-GPU ""server-scale"" systems to 72-GPU ""rack-scale"" systems. Without delving too deeply into the minutiae, it redefines the boundaries of performance when it comes to operating gargantuan AI models. It supplies roughly 4X swifter training... 30X faster inference... and 50X greater AI factory output per megawatt. For behemoth tech clientele such as Microsoft Corp. (MSFT:NASDAQ), Alphabet Inc. Class A (GOOGL:NASDAQ), and OpenAI, it represents a monumental triumph of speed and efficiency. They can process more queries. Furnish swifter responses. Accommodate more intricate reasoning. And, most crucially, construct more expansive, capable AI models. If AI persisted in advancing solely through software enhancements, envision the leaps we'll witness now that we're finally privy to a major hardware upgrade... And how ferociously tech corporations will clamber to procure the novel Nvidia chips. In 2024, titans of tech lavished $250 billion on AI infrastructure. In 2025, that sum ballooned to approximately $400 billion. This year, they aspire to splurge $700 billion on AI infrastructure. Tech giants simply cannot risk falling behind in the AI arms race. They're erecting data centers the size of football fields to train and operate increasingly formidable AI models. If the ultimate reward is a ""digital-god-scale"" platform valued in the trillions over decades, the motivation to keep investing at maximum velocity is paramount. That entails acquiring Nvidia's newest and most potent AI chips. The enduring AI boom is ensnaring big tech in a spending cycle that should keep billions cascading into Nvidia's coffers for years to come. Nvidia CEO Jensen Huang has proclaimed that Blackwell—and the impending Rubin platform—embody over $1 trillion in revenue potential for Nvidia by the close of 2027. As long as the AI race continues to accelerate, Nvidia remains one of the most lucid pathways to profit from it. Nvidia is a linchpin in our Disruption Investor portfolio. We've realized a 550% gain on it (upgrade to Disruption Investor here). And we've already reaped profits twice. Courtesy of the recent pullback, the stock is now hovering near its lowest valuation in the past five years. For anyone who has yet to acquire NVDA, this presents an opportune moment to buy in. Australian AI Tech Company Launches High-Growth Drone Breakthrough Source: Streetwise Reports (04/06/2026) Sparc AI Inc. (SPAI:CSE; SPAIF:OTCQB; 5OVO:Frankfurt) rolls out its Overwatch app with GPS-denied targeting, gaining early traction with Indian defense partners. Crypto Company Launches Bitcoin Yield Strategy Breakthrough Source: Streetwise Reports (04/06/2026) Matador Technologies Inc. (MATA:TSX.V; MATAF:OTCQB; IU3:FSE) initiates a new Bitcoin yield generation strategy. Read why one expert says the stock has momentum. US-Ukraine Defense Alliance Expands Into Multi-Domain Drone Systems as Global Demand Surges Source: Streetwise Reports (04/02/2026) Red Cat Holdings Inc. (RCAT:NASDAQ) entered into a strategic partnership with Ukraine's Spetstechnoexport to collaborate on next-generation unmanned and robotic systems across air, land, and maritime domains. Investors: Avoid These 5 Red Flags Source: Stephen McBride (04/01/2026) Stephen McBride shares the five red flags that typically lead to trouble. Find Out What Fintech Mortgage Co. Is Having Increased Revenue, Sales in Tough Market (03/31/2026) Digital mortgage company Beeline Holdings Inc. (BLNE:NASDAQ) announces its financial results. Find out how much revenue grew despite a difficult market. Australian AI Tech Company Launches High-Growth Drone Breakthrough Crypto Company Launches Bitcoin Yield Strategy Breakthrough US-Ukraine Defense Alliance Expands Into Multi-Domain Drone Systems as Global Demand Surges Find Out What Fintech Mortgage Co. Is Having Increased Revenue, Sales in Tough Market Streetwise Reports is registered with the U.S. Patent and Trademark Office.",https://www.streetwisereports.com/article/2026/04/07/dont-abandon-faith-in-nvidia.html
NVDA,Microsoft Is Now The Biggest Deadweight On S&P 500 — And Exxon Is What Nvidia Used To Be - benzinga.com,2026-04-07 16:17:50,"Oops! Something went wrong. Please try again soon or contact support@benzinga.com. A newsletter built for market enthusiasts by market enthusiasts. Top stories, top movers, and trade ideas delivered to your inbox every weekday before and after the market closes.",https://www.benzinga.com/trading-ideas/movers/26/04/51685501/microsoft-is-now-the-biggest-deadweight-on-sp-500-and-exxon-is-what-nvidia-used-to-be
