ticker,title,date,content,url
NVDA,"NVIDIA Corporation (NASDAQ:NVDA) Given Average Recommendation of ""Buy"" by Analysts - MarketBeat",2026-04-18 06:19:37,"Shares of NVIDIA Corporation (NASDAQ:NVDA - Get Free Report) have been given an average rating of ""Buy"" by the fifty-four analysts that are presently  covering the company, Marketbeat Ratings reports. Two investment analysts have rated the stock with a hold recommendation, forty-eight have given a buy recommendation and four have issued  a strong buy recommendation on  the company. The average 1 year price target among brokers that have issued ratings on the stock in the last year is $275.2522. NVDA has been the subject of several research analyst reports. Weiss Ratings  restated a ""buy (b)"" rating on shares of NVIDIA in a research report on Friday, April 10th. Barclays  restated a ""buy"" rating on shares of NVIDIA in a research report on Thursday, February 26th. Cantor Fitzgerald  restated an ""overweight"" rating and issued a $300.00 price target on shares of NVIDIA in a research report on Monday, March 23rd. BNP Paribas Exane upped their price target on shares of NVIDIA from $260.00 to $270.00 and gave the company an ""outperform"" rating in a research report on Thursday, February 26th. Finally, Stifel Nicolaus  set a $250.00 price target on shares of NVIDIA in a research report on Thursday, January 8th. NVDA stock opened at $201.68 on Friday. NVIDIA has a 12 month low of $95.04 and a 12 month high of $212.19. The firm has a market cap of $4.90 trillion, a PE ratio of 41.16, a P/E/G ratio of 0.66 and a beta of 2.34. The firm has a 50 day simple moving average of $183.36 and a 200 day simple moving average of $185.00. The company has a debt-to-equity ratio of 0.05, a current ratio of 3.91 and a quick ratio of 3.24. NVIDIA (NASDAQ:NVDA - Get Free Report) last released its earnings results on Wednesday, February 25th. The computer hardware maker reported $1.62 EPS for the quarter, beating the consensus estimate of $1.54 by $0.08. NVIDIA had a net margin of 55.60% and a return on equity of 97.37%. The business had revenue of $68.13 billion during the quarter, compared to analyst estimates of $65.56 billion. During the same period in the prior year, the business earned $0.89 earnings per share. The business's quarterly revenue was up 73.2% on a year-over-year basis.  Equities research analysts forecast that  NVIDIA will post 2.77 earnings per share for the current fiscal year. The company also recently declared a quarterly dividend, which was paid on Wednesday, April 1st. Investors of record on Wednesday, March 11th were given a $0.01 dividend. This represents a $0.04 annualized dividend and a dividend yield of 0.0%. The ex-dividend date was Wednesday, March 11th. NVIDIA's dividend payout ratio  is 0.82%. Here are the key news stories impacting NVIDIA this week: In related news, CFO Colette Kress sold 20,000 shares of the company's stock in a transaction that occurred on Friday, March 20th. The shares were sold at an average price of $174.89, for a total value of $3,497,800.00. Following the completion of the sale, the chief financial officer owned 83,060 shares in the company, valued at approximately $14,526,363.40. This represents a 19.41% decrease in their position. The sale was disclosed in a legal filing with the Securities & Exchange Commission, which can be accessed through the SEC website. Also, EVP Ajay K. Puri sold 300,000 shares of the company's stock in a transaction that occurred on Wednesday, March 18th. The shares were sold at an average price of $182.25, for a total transaction of $54,675,000.00. Following the completion of the sale, the executive vice president owned 3,018,547 shares of the company's stock, valued at approximately $550,130,190.75. This trade represents a 9.04% decrease in their position. The SEC filing for this sale provides additional information. Insiders have sold 1,153,976 shares of company stock worth $207,181,819 in the last quarter. Corporate insiders own  4.17% of the company's stock. A number of hedge funds and other institutional investors have recently added to or reduced their stakes in the stock. Kennebec Savings Bank lifted its position in  NVIDIA by 1.0% in the 1st quarter. Kennebec Savings Bank now owns 21,177 shares of the computer hardware maker's stock worth $3,693,000 after buying an additional 212 shares in the last quarter.  Investment Advisory Services Inc. TX ADV lifted its position in  NVIDIA by 7.9% in the 1st quarter. Investment Advisory Services Inc. TX ADV now owns 9,795 shares of the computer hardware maker's stock worth $1,708,000 after buying an additional 715 shares in the last quarter.  Provident Wealth Management LLC lifted its position in  NVIDIA by 6.4% in the 1st quarter. Provident Wealth Management LLC now owns 1,912 shares of the computer hardware maker's stock worth $333,000 after buying an additional 115 shares in the last quarter.  Buffalo Business & Estate Services Ltd. lifted its position in  NVIDIA by 0.5% in the 1st quarter. Buffalo Business & Estate Services Ltd. now owns 518,114 shares of the computer hardware maker's stock worth $90,359,000 after buying an additional 2,486 shares in the last quarter.  Finally, Blankinship & Foster LLC lifted its position in  NVIDIA by 29.2% in the 1st quarter. Blankinship & Foster LLC now owns 3,807 shares of the computer hardware maker's stock worth $664,000 after buying an additional 860 shares in the last quarter. Hedge funds and other institutional investors own  65.27% of the company's stock. NVIDIA Corporation, founded in 1993 and headquartered in Santa Clara, California, is a global technology company that designs and develops graphics processing units (GPUs) and system-on-chip (SoC) technologies. Co-founded by Jensen Huang, who serves as president and chief executive officer, along with Chris Malachowsky and Curtis Priem, NVIDIA has grown from a graphics-focused chipmaker into a broad provider of accelerated computing hardware and software for multiple industries. The company's product portfolio spans discrete GPUs for gaming and professional visualization (marketed under the GeForce and NVIDIA RTX lines), high-performance data center accelerators used for AI training and inference (including widely adopted platforms such as the A100 and H100 series), and Tegra SoCs for automotive and edge applications. This instant news alert was generated by narrative science technology and financial data from MarketBeat in order to provide readers with the fastest reporting and unbiased coverage. Please send any questions or comments about this story to contact@marketbeat.com. Before you consider NVIDIA, you'll want to hear this. MarketBeat keeps track of Wall Street's top-rated and best performing research analysts and the stocks they recommend to their clients on a daily basis. MarketBeat has identified the five stocks that top analysts are quietly whispering to their clients to buy now before the broader market catches on... and NVIDIA wasn't on the list. While NVIDIA currently has a Buy rating among analysts, top-rated analysts believe these five stocks are better buys. MarketBeat's analysts have just released their top five short plays for April 2026. Learn which stocks have the most short interest and how to trade them. Click the link to see which companies made the list. Sign up for MarketBeat All Access to gain access to MarketBeat's full suite of research tools. 345 N Reid Place, Suite 620, Sioux Falls, SD 57103
                                        
                                        contact@marketbeat.com
                                        
                                        (844) 978-6257 © MarketBeat Media, LLC 2010-2026. All rights reserved. © 2026   Fair market value prices are updated every minute and are provided by Massive. Other market data provided is at least 10-minutes delayed and hosted by Barchart Solutions.  Information is provided 'as-is' and solely for informational purposes, not for trading purposes or advice, and is delayed. To see all exchange delays and terms of use please see Barchart's disclaimer.",https://www.marketbeat.com/instant-alerts/nvidia-corporation-nasdaqnvda-given-average-recommendation-of-buy-by-analysts-2026-04-18/
NVDA,"NVIDIA Stock Surged 100%, Here’s Why - Trefis",2026-04-18 06:02:41,"Over the past year, NVIDIA (NVDA) nearly doubled as surging demand catapulted revenues 65%, fueled by record data center sales and cutting-edge AI platforms. Despite a brief pullback, steady margins and bullish guidance kept investor confidence sky-high from April 2025 to April 2026. Below is an analytical breakdown of stock movement into key contributing metrics. So what is happening here? The stock nearly doubled as revenues surged 65%, driven by strong demand, while steady net margins and a rising P/E multiple reflected growing investor confidence amidst stable share counts. The core investment debate is centered around the following: Can NVIDIA’s hyper-growth be sustained by the ‘AI factory’ build-out, or will its largest customers in-source custom silicon, creating a growth ceiling? Navigating the competing bull and bear cases of any single stock carries inherent volatility. Managing that idiosyncratic risk requires a broader portfolio framework. Stocks soar and sink – the key is staying invested. A balanced portfolio helps you ride market volatility, boosts gains, and reduces single stock risk. Why settle for average market returns? The Trefis High Quality (HQ) Portfolio invests in a diverse group of 30 stocks that have collectively delivered stronger upside with reduced volatility compared to the broader indices. Discover the methodology behind these smoother, higher returns by checking the HQ Portfolio performance data. Data Center Dominance
[1] NVIDIA Announces Financial Results for Fourth Quarter and Fiscal 2026 S&P 500 Movers | Winners: ORCL, SNDK, FICO | Losers: FAST, CAG, EIX How To Position For A 40% Discount On Palantir Stock? Structural Risks to Watch For NVDA Stock Over the Next 6 Months AVGO, NVDA Top Microchip Technology Stock on Price & Potential Why NVDA, MU Could Outperform Rambus Stock Why NVDA, MU Could Outperform ON Semiconductor Stock Triggers That Could Ignite the Next Rally In NVIDIA Stock NVDA, MU Top Monolithic Power Systems Stock on Price & Potential NVDA, MU Top Broadcom Stock on Price & Potential NVIDIA Stock Hands $97 Bil Back – Worth a Look? ©Copyright 2026 Insight Guru Inc. All Rights Reserved. By using the Site, you agree to be bound by our Terms of
		Use.  Financial market data powered by Quotemedia.com.
		Consensus EPS estimates are from QuoteMedia and are updated every weekday.
		All rights reserved. NYSE/AMEX data delayed 20 minutes.  NASDAQ and other
		data delayed 15 minutes unless indicated.",https://www.trefis.com/stock/nvda/articles2/596905/nvidia-stock-surged-100-heres-why/2026-04-18
NVDA,NVIDIA (NASDAQ:NVDA) Stock Rating Upgraded by Wall Street Zen - MarketBeat,2026-04-18 05:42:39,"NVIDIA (NASDAQ:NVDA - Get Free Report) was upgraded by Wall Street Zen from a ""buy"" rating to a ""strong-buy"" rating in a report issued on Saturday. NVDA has been the subject of a number of other research reports. Itau BBA Securities  reiterated a ""market perform"" rating on shares of NVIDIA in a research note on Thursday, February 26th. Jefferies Financial Group  reiterated a ""buy"" rating and set a $275.00 price objective (up from $250.00) on shares of NVIDIA in a research note on Friday, January 16th. Mizuho  set a $275.00 price objective on NVIDIA and gave the company an ""outperform"" rating in a research note on Friday, January 9th. BTIG Research began coverage on NVIDIA in a research note on Wednesday. They set a ""buy"" rating for the company. Finally, Truist Financial lifted their price objective on NVIDIA from $283.00 to $287.00 and gave the company a ""buy"" rating in a research note on Wednesday, March 18th. Four research analysts have rated the stock with a Strong Buy rating, forty-eight have assigned  a Buy rating and two have assigned  a Hold rating to the company. Based on data from MarketBeat, the stock currently has an average rating of ""Buy"" and an average target price of $275.25. Shares of NVDA opened at $201.68 on Friday. The stock has a 50-day moving average of $183.36 and a two-hundred day moving average of $185.00. NVIDIA has a one year low of $95.04 and a one year high of $212.19. The company has a debt-to-equity ratio of 0.05, a quick ratio of 3.24 and a current ratio of 3.91. The stock has a market cap of $4.90 trillion, a P/E ratio of 41.16, a P/E/G ratio of 0.66 and a beta of 2.34. NVIDIA (NASDAQ:NVDA - Get Free Report) last released its quarterly earnings data on Wednesday, February 25th. The computer hardware maker reported $1.62 earnings per share for the quarter, beating analysts' consensus estimates of $1.54 by $0.08. The business had revenue of $68.13 billion during the quarter, compared to analyst estimates of $65.56 billion. NVIDIA had a return on equity of 97.37% and a net margin of 55.60%.The company's revenue was up 73.2% on a year-over-year basis. During the same quarter last year, the business posted $0.89 EPS.  As a group, research analysts predict that  NVIDIA will post 2.77 EPS for the current year. In other NVIDIA news, Director Aarti S. Shah sold 19,000 shares of the stock in a transaction on Thursday, March 19th. The shares were sold at an average price of $176.71, for a total transaction of $3,357,490.00. Following the transaction, the director directly owned 36,007 shares of the company's stock, valued at $6,362,796.97. This trade represents a 34.54% decrease in their ownership of the stock. The transaction was disclosed in a document filed with the SEC, which is accessible through this hyperlink. Also, Director Mark A. Stevens sold 221,682 shares of the stock in a transaction on Friday, March 20th. The shares were sold at an average price of $173.68, for a total transaction of $38,501,729.76. Following the transaction, the director directly owned 7,399,771 shares in the company, valued at approximately $1,285,192,227.28. The trade was a 2.91% decrease in their ownership of the stock. The SEC filing for this sale provides additional information. Insiders have sold 1,153,976 shares of company stock worth $207,181,819 over the last quarter. Company insiders own  4.17% of the company's stock. Several large investors have recently bought and sold shares of NVDA. Joule Financial LLC increased its stake in  NVIDIA by 2.2% during the 3rd quarter. Joule Financial LLC now owns 2,308 shares of the computer hardware maker's stock valued at $431,000 after purchasing an additional 50 shares in the last quarter.  Vision Financial Markets LLC boosted its holdings in  NVIDIA by 1.2% during the 3rd quarter. Vision Financial Markets LLC now owns 4,640 shares of the computer hardware maker's stock worth $866,000 after acquiring an additional 53 shares during the last quarter.  Presidio Capital Management LLC boosted its holdings in shares of  NVIDIA by 0.4% in the 4th quarter. Presidio Capital Management LLC now owns 15,137 shares of the computer hardware maker's stock worth $2,823,000 after buying an additional 53 shares during the last quarter.  LMG Wealth Partners LLC boosted its holdings in shares of  NVIDIA by 0.7% in the 4th quarter. LMG Wealth Partners LLC now owns 7,649 shares of the computer hardware maker's stock worth $1,427,000 after buying an additional 53 shares during the last quarter.  Finally, Websterrogers Financial Advisors LLC boosted its holdings in shares of  NVIDIA by 2.6% in the 3rd quarter. Websterrogers Financial Advisors LLC now owns 2,118 shares of the computer hardware maker's stock worth $395,000 after buying an additional 54 shares during the last quarter. 65.27% of the stock is currently owned by hedge funds and other institutional investors. Here are the key news stories impacting NVIDIA this week: NVIDIA Corporation, founded in 1993 and headquartered in Santa Clara, California, is a global technology company that designs and develops graphics processing units (GPUs) and system-on-chip (SoC) technologies. Co-founded by Jensen Huang, who serves as president and chief executive officer, along with Chris Malachowsky and Curtis Priem, NVIDIA has grown from a graphics-focused chipmaker into a broad provider of accelerated computing hardware and software for multiple industries. The company's product portfolio spans discrete GPUs for gaming and professional visualization (marketed under the GeForce and NVIDIA RTX lines), high-performance data center accelerators used for AI training and inference (including widely adopted platforms such as the A100 and H100 series), and Tegra SoCs for automotive and edge applications. This instant news alert was generated by narrative science technology and financial data from MarketBeat in order to provide readers with the fastest reporting and unbiased coverage. Please send any questions or comments about this story to contact@marketbeat.com. Before you consider NVIDIA, you'll want to hear this. MarketBeat keeps track of Wall Street's top-rated and best performing research analysts and the stocks they recommend to their clients on a daily basis. MarketBeat has identified the five stocks that top analysts are quietly whispering to their clients to buy now before the broader market catches on... and NVIDIA wasn't on the list. While NVIDIA currently has a Buy rating among analysts, top-rated analysts believe these five stocks are better buys. Click the link to see MarketBeat's list of seven best retirement stocks and why they should be in your portfolio. Sign up for MarketBeat All Access to gain access to MarketBeat's full suite of research tools. 345 N Reid Place, Suite 620, Sioux Falls, SD 57103
                                        
                                        contact@marketbeat.com
                                        
                                        (844) 978-6257 © MarketBeat Media, LLC 2010-2026. All rights reserved. © 2026   Fair market value prices are updated every minute and are provided by Massive. Other market data provided is at least 10-minutes delayed and hosted by Barchart Solutions.  Information is provided 'as-is' and solely for informational purposes, not for trading purposes or advice, and is delayed. To see all exchange delays and terms of use please see Barchart's disclaimer.",https://www.marketbeat.com/instant-alerts/nvidia-nasdaqnvda-stock-rating-upgraded-by-wall-street-zen-2026-04-18/
NVDA,Direxion Daily NVDA Bull 2X Shares (NASDAQ:NVDU) Short Interest Update - MarketBeat,2026-04-18 03:42:41,"Shares of NASDAQ NVDU traded up $3.96 during mid-day trading on Friday, reaching $127.97. The company's stock had a trading volume of 422,155 shares, compared to its average volume of 472,243. The firm has a market capitalization of $675.68 million, a PE ratio of 42.98 and a beta of 4.13. The stock has a fifty day moving average of $108.70 and a two-hundred day moving average of $117.72. Direxion Daily NVDA Bull 2X Shares has a 52 week low of $37.68 and a 52 week high of $165.77. The firm also recently disclosed a quarterly dividend, which was paid on Tuesday, March 31st. Stockholders of record on Tuesday, March 24th were paid a $0.5254 dividend. The ex-dividend date of this dividend was Tuesday, March 24th. This represents a $2.10 dividend on an annualized basis and a dividend yield of 1.6%. A number of hedge funds have recently made changes to their positions in the business. Virtu Financial LLC boosted its stake in shares of  Direxion Daily NVDA Bull 2X Shares by 600.0% in the fourth quarter. Virtu Financial LLC now owns 19,859 shares of the company's stock worth $2,338,000 after acquiring an additional 17,022 shares during the period.  Beacon Capital Management LLC purchased a new stake in shares of  Direxion Daily NVDA Bull 2X Shares in the fourth quarter worth about $404,000.  Ausdal Financial Partners Inc. lifted its position in shares of  Direxion Daily NVDA Bull 2X Shares by 20.3% in the fourth quarter. Ausdal Financial Partners Inc. now owns 4,328 shares of the company's stock worth $509,000 after buying an additional 729 shares in the last quarter.  StoneX Group Inc. purchased a new stake in shares of  Direxion Daily NVDA Bull 2X Shares in the fourth quarter worth about $264,000.  Finally, Simplex Trading LLC purchased a new stake in shares of  Direxion Daily NVDA Bull 2X Shares in the fourth quarter worth about $555,000. The Direxion Daily NVDA Bull 2X Shares (NVDU) is an exchange-traded fund that mostly invests in information technology equity. The fund provides 2x leveraged exposure, less fees and expenses, to the daily price movement for shares of NVIDIA stock. NVDU was launched on Sep 13, 2023 and is issued by Direxion. This instant news alert was generated by narrative science technology and financial data from MarketBeat in order to provide readers with the fastest reporting and unbiased coverage. Please send any questions or comments about this story to contact@marketbeat.com. Before you consider Direxion Daily NVDA Bull 2X Shares, you'll want to hear this. MarketBeat keeps track of Wall Street's top-rated and best performing research analysts and the stocks they recommend to their clients on a daily basis. MarketBeat has identified the five stocks that top analysts are quietly whispering to their clients to buy now before the broader market catches on... and Direxion Daily NVDA Bull 2X Shares wasn't on the list. While Direxion Daily NVDA Bull 2X Shares currently has a Hold rating among analysts, top-rated analysts believe these five stocks are better buys. Click the link to see MarketBeat's list of seven stocks and why their long-term outlooks are very promising. Sign up for MarketBeat All Access to gain access to MarketBeat's full suite of research tools. 345 N Reid Place, Suite 620, Sioux Falls, SD 57103
                                        
                                        contact@marketbeat.com
                                        
                                        (844) 978-6257 © MarketBeat Media, LLC 2010-2026. All rights reserved. © 2026   Fair market value prices are updated every minute and are provided by Massive. Other market data provided is at least 10-minutes delayed and hosted by Barchart Solutions.  Information is provided 'as-is' and solely for informational purposes, not for trading purposes or advice, and is delayed. To see all exchange delays and terms of use please see Barchart's disclaimer. Enter your email below to receive daily updates and analyst ratings for Direxion Daily NVDA Bull 2X Shares and related companies from Earnings360.com.",https://www.marketbeat.com/instant-alerts/direxion-daily-nvda-bull-2x-shares-nasdaqnvdu-short-interest-update-2026-04-17/
NVDA,NVIDIA vs. TSMC: One AI Stock Is a Clear Buy Right Now - Zacks Investment Research,2026-04-18 03:23:55,"As you were browsing something about your browser made us think you were a bot. There are a few reasons this might happen: To regain access, please make sure that cookies and JavaScript are enabled before reloading the page. We're getting everything ready for you. The page is loading, and you'll be on your way in just a few moments.",https://www.zacks.com/stock/news/2902701/nvidia-vs-tsmc-one-ai-stock-is-a-clear-buy-right-now
NVDA,NVIDIA Analyst Ratings and Price Targets | NASDAQ:NVDA - Benzinga,2026-04-18 00:59:00,"Oops! Something went wrong. Please try again soon or contact support@benzinga.com. A newsletter built for market enthusiasts by market enthusiasts. Top stories, top movers, and trade ideas delivered to your inbox every weekday before and after the market closes.",https://www.benzinga.com/quote/NVDA/analyst-ratings
