ticker,title,date,content,url
NVDA,NVIDIA Corporation (NVDA) is Attracting Investor Attention: Here is What You Should Know - Yahoo Finance,2026-04-17 13:00:04,"Tip: Try a valid symbol or a specific company name for relevant results A longer-term car loan can lower the barrier to entry for buyers — but these loan terms are not without drawbacks. The AI trade has been able to insulate itself from disruptions caused by the Middle East war. Gas prices may remain at $3 per gallon or more until next year, US Energy Secretary Chris Wright said Sunday. (Bloomberg) As big banks kick off earnings season, strategists say the ""dominant theme"" for investors is shifting back to Big Tech and energy. Ceasefire talks, record highs for the US stock market, and Tesla earnings will be in focus for investors. In the rarefied world of luxury automobiles, Rolls-Royce just upped the altitude. Gas prices ""rise like a rocket and fall like a feather.""  Here's what to know. The million dollar retirement planning question: How long will you live? The software rebound is real, but not every big name is back Allbirds' AI pivot shows signs of froth in markets, but experts say the underlying fundamentals in AI remain strong. Dow leaps 850 points, S&P 500 and Nasdaq notch new records in stunning rally amid US-Iran diplomacy hopes Stocks climbed at the open and oil fell as Iran said the Strait of Hormuz is 'completely open' The stock market has notched one of its fastest turnarounds in years Europe is facing a severe jet fuel shortage, with 'maybe six weeks of jet fuel left' Stocks rebound after Trump says Israel, Lebanon agreed to ceasefire S&P 500, Dow, Nasdaq rise, with fresh records in view amid hopes for truce Tax refunds shoot up as Americans take advantage of new deductions S&P 500 closes above 7,000 for the first time, Nasdaq hits record as stocks erase Iran war losses The former sneaker company's stock rose over 600% after announcing its rebrand as an AI company S&P 500, Nasdaq rise as Dow falls amid hopes for US-Iran talks The S&P 500 and Nasdaq rallied toward record highs on hopes of an Iran deal while oil tumbled Bitcoin bounced above $74,000, but Wall Street warns it could go lower before it goes higher US stocks rise amid Iran deal hopes, earnings rush, cooler-than-expected PPI JPMorgan profits rise 13%, Dimon warns of 'increasingly complex set of risks' US stocks sink after Trump orders Hormuz blockade against Iran Goldman Sachs Q1 profits climb thanks to jumps in M&A dealmaking and record equity trading The stock market's latest rally is reviving a familiar trade — but not all of the Magnificent Seven are coming along for the ride. Gen Z is driving IRA contributions to record highs. Here's how to get started. Wall Street strategists say it's time to 'jump in' with tech stocks Trump says US will blockade Strait of Hormuz after Iran talks fail (Bloomberg) Bank earnings, US-Iran talks, and signs of stability for stocks: What to watch this week Shaq, in NYC discussing his new investment with retailer tm:rw, said the NBA dunk contest isn't what it used to be. Used car prices hit highest levels since 2023 and could push higher What to know about X Money, Elon Musk's fintech app that claims to pay 6% on savings The housing market is shifting toward buyers. Just not in New Jersey. Wall Street's biggest banks are riding into the first quarter earnings season on far less certain ground than where they began 2026. Watch: OpenAI CEO Sam Altman's house was reportedly the target of a Molotov cocktail attack on Friday. Yahoo Finance's Dan Howley explains. Stocks post second straight winning week amid fragile US-Iran ceasefire US tariff revenue dropped by over $4 billion in March. It's down almost 30% since October. US stocks open higher after March CPI inflation data shows energy surge Inflation soars by most since 2022 as gas prices bite Americans close to retirement are saving for later, but they're worried about getting by right now Government data out Friday will show how much consumer prices rose in March — and forecasts point to soaring inflation. Palantir plunges after 'Big Short' investor Michael Burry says Anthropic is eating its lunch Stocks rebounded to extend their winning streak, while oil rose ahead of US-Iran talks Stocks turned positive after Israel agreed to talks with Lebanon, reviving optimism for the US-Iran ceasefire US stocks pull back, oil surges as US-Iran ceasefire looks increasingly shaky Sticky reading on inflation pre-war will keep Fed on hold The New York Times may have found bitcoin founder Satoshi Nakamoto. Here's what you need to know. The above button links to Coinbase. Yahoo Finance is not a broker-dealer or investment adviser and does not offer securities or cryptocurrencies for sale or facilitate trading. Coinbase pays us for certain activity generated through this link. Prices displayed are informational. Nvidia (NVDA) has recently been on Zacks.com's list of the most searched stocks. Therefore, you might want to consider some of the key factors that could influence the stock's performance in the near future. Shares of this maker of graphics chips for gaming and artificial intelligence have returned +11.1% over the past month versus the Zacks S&P 500 composite's +5.2% change. The Zacks Semiconductor - General industry, to which Nvidia belongs, has gained 10.5% over this period. Now the key question is: Where could the stock be headed in the near term? Although media reports or rumors about a significant change in a company's business prospects usually cause its stock to trend and lead to an immediate price change, there are always certain fundamental factors that ultimately drive the buy-and-hold decision. Rather than focusing on anything else, we at Zacks prioritize evaluating the change in a company's earnings projection. This is because we believe the fair value for its stock is determined by the present value of its future stream of earnings. Our analysis is essentially based on how sell-side analysts covering the stock are revising their earnings estimates to take the latest business trends into account. When earnings estimates for a company go up, the fair value for its stock goes up as well. And when a stock's fair value is higher than its current market price, investors tend to buy the stock, resulting in its price moving upward. Because of this, empirical studies indicate a strong correlation between trends in earnings estimate revisions and short-term stock price movements. For the current quarter, Nvidia is expected to post earnings of $1.76 per share, indicating a change of +117.3% from the year-ago quarter. The Zacks Consensus Estimate has changed +1.9% over the last 30 days. The consensus earnings estimate of $8.03 for the current fiscal year indicates a year-over-year change of +68.3%. This estimate has changed +2.6% over the last 30 days. For the next fiscal year, the consensus earnings estimate of $10.56 indicates a change of +31.4% from what Nvidia is expected to report a year ago. Over the past month, the estimate has changed +5.2%. With an impressive externally audited track record, our proprietary stock rating tool -- the Zacks Rank -- is a more conclusive indicator of a stock's near-term price performance, as it effectively harnesses the power of earnings estimate revisions. The size of the recent change in the consensus estimate, along with three other factors related to earnings estimates, has resulted in a Zacks Rank #1 (Strong Buy) for Nvidia. The chart below shows the evolution of the company's forward 12-month consensus EPS estimate: While earnings growth is arguably the most superior indicator of a company's financial health, nothing happens as such if a business isn't able to grow its revenues. After all, it's nearly impossible for a company to increase its earnings for an extended period without increasing its revenues. So, it's important to know a company's potential revenue growth. For Nvidia, the consensus sales estimate for the current quarter of $78.66 billion indicates a year-over-year change of +78.5%. For the current and next fiscal years, $352.22 billion and $457.58 billion estimates indicate +63.1% and +29.9% changes, respectively. Nvidia reported revenues of $68.13 billion in the last reported quarter, representing a year-over-year change of +73.2%. EPS of $1.62 for the same period compares with $0.89 a year ago. Compared to the Zacks Consensus Estimate of $65.42 billion, the reported revenues represent a surprise of +4.14%. The EPS surprise was +6.58%. Over the last four quarters, Nvidia surpassed consensus EPS estimates three times. The company topped consensus revenue estimates each time over this period. Without considering a stock's valuation, no investment decision can be efficient. In predicting a stock's future price performance, it's crucial to determine whether its current price correctly reflects the intrinsic value of the underlying business and the company's growth prospects. Comparing the current value of a company's valuation multiples, such as its price-to-earnings (P/E), price-to-sales (P/S), and price-to-cash flow (P/CF), to its own historical values helps ascertain whether its stock is fairly valued, overvalued, or undervalued, whereas comparing the company relative to its peers on these parameters gives a good sense of how reasonable its stock price is. The Zacks Value Style Score (part of the Zacks Style Scores system), which pays close attention to both traditional and unconventional valuation metrics to grade stocks from A to F (an A is better than a B; a B is better than a C; and so on), is pretty helpful in identifying whether a stock is overvalued, rightly valued, or temporarily undervalued. Nvidia is graded D on this front, indicating that it is trading at a premium to its peers. Click here to see the values of some of the valuation metrics that have driven this grade. The facts discussed here and much other information on Zacks.com might help determine whether or not it's worthwhile paying attention to the market buzz about Nvidia. However, its Zacks Rank #1 does suggest that it may outperform the broader market in the near term. Want the latest recommendations from Zacks Investment Research? Today, you can download 7 Best Stocks for the Next 30 Days. Click to get this free report NVIDIA Corporation (NVDA) : Free Stock Analysis Report This article originally published on Zacks Investment Research (zacks.com). Tip: Try a valid symbol or a specific company name for relevant results",https://finance.yahoo.com/markets/stocks/articles/nvidia-corporation-nvda-attracting-investor-130004382.html
NVDA,Structural Risks to Watch For NVDA Stock Over the Next 6 Months - Trefis,2026-04-17 12:28:13,"A serious investment in NVIDIA (NVDA) requires more than just accepting the bull narrative of the Blackwell/Rubin architecture adoption driving AI factory build-out. The primary bear argument currently is this: The most significant friction is the long-term risk that NVIDIA’s largest customers (hyperscalers, >50% of data center revenue) successfully develop and deploy their own custom AI silicon at scale, which would reduce NVIDIA’s addressable market and erode its pricing power. This is compounded by the volatility of U.S. export controls, which could abruptly remove key geographic markets like China. To protect capital and avoid being blindsided, you need a concrete framework to monitor this risk. Watch these four specific events unfolding over the next six months. 1. Geopolitical Risk: Further US Export Controls on AI Chips to China Anytime (Decision on further tightening expected by Summer 2026) If the Commerce Department announces new performance density caps or country-wide restrictions under the MATCH Act, expect an immediate negative impact on NVDA’s forward revenue guidance for its China-specific chips. Policy experts are actively urging the US Congress to pass stricter AI export controls against China to close loopholes. A bill introduced on April 2, 2026, the ‘MATCH Act’, aims to create country-wide prohibitions on semiconductor manufacturing equipment. Additionally, the ‘Remote Access Security Act,’ which passed the House in January 2026, aims to close the ‘cloud loophole’ where foreign companies access controlled chips remotely. This follows a period of rapid policy changes in 2025 and early 2026 regarding sales of chips like the H200 to China. 2. Key Customer CapEx ‘Digestion’ or ‘Optimization’ Narrative If a hyperscaler CFO uses the keywords ‘capital efficiency,’ ‘optimizing our fleet,’ or ‘sweating our assets’ in relation to AI infrastructure, the market will interpret it as a signal that the peak growth rate of GPU purchasing is over. While top hyperscaler customers (Amazon, Microsoft, Google, and Meta) have announced record-breaking CapEx for 2026 as much as $700 billion), this level of spending is described as ‘untenable,’ consuming nearly 100% of their operating cash flows. Microsoft already has an $80 billion Azure order backlog due to power constraints, indicating physical limits to growth, not just financial ones. Any mention of ‘digestion’ or ‘optimization’ in their upcoming earnings calls could signal a slowdown in the pace of GPU orders. 3. Competitor Architectural/Pricing Threat at Computex 2026 If AMD or Intel announces a new AI accelerator with a compelling price-to-performance ratio for inference workloads and names a major cloud provider as a launch partner, it will validate the ‘second source’ thesis. Computex 2026 is confirmed for June 2-5, with keynotes from competitors Intel, Qualcomm, and Marvell. This event is a prime venue for competitors like AMD and Intel to announce new products or significant pricing updates for their AI accelerators (e.g., AMD MI300 series, Intel Gaudi). The market is shifting from a monopoly to ‘managed competition,’ with hyperscalers actively seeking supply diversification to gain pricing leverage. 4. Supply Chain Bottleneck: Advanced Packaging & HBM Memory If industry reports from sources like Digitimes or analysts covering TSMC indicate delays or yield issues with 16-layer HBM4 or 2nm process ramp-up, it would directly threaten the timeline and volume of the Rubin platform launch. The AI supply chain’s primary constraint has shifted from wafer fabrication to advanced packaging (CoWoS) and high bandwidth memory (HBM). Memory suppliers have stated that HBM capacity is fully sold out through 2026. NVIDIA’s next-generation ‘Rubin’ platform, expected in H2 2026, requires even more advanced HBM4 and substrate (ABF) materials, increasing supply chain complexity and risk of yield issues or delays. 5. Valuation Compression from Macro Factors & Antitrust Scrutiny If the 10-Year Treasury yield sustains above 4.5% OR if the EU formally opens an investigation (moving beyond preliminary questions), it would create a sentiment headwind and force a re-rating of the stock’s multiple. As of April 2026, NVDA trades at a high P/E ratio of ~45x. Semiconductor stocks are highly sensitive to interest rates; a rise in Treasury yields could trigger a sector-wide multiple compression. Concurrently, antitrust scrutiny is increasing, with the European Commission questioning industry players about Nvidia’s dominance in data center components as of Feb 2026 and looking at the entire ‘AI stack.’ Mitigating Idiosyncratic Risk Through Structural Quality Navigating complex downside scenarios requires precision, but structural quality provides the best long-term buffer against thesis-breaking catalysts. The Trefis High Quality Portfolio (HQ) takes the guesswork out of idiosyncratic risk management, holding 30 high-quality names through volatility to deliver over 105% in cumulative gains. S&P 500 Movers | Winners: ORCL, SNDK, FICO | Losers: FAST, CAG, EIX How To Position For A 40% Discount On Palantir Stock? NVIDIA Stock Surged 100%, Here’s Why AVGO, NVDA Top Microchip Technology Stock on Price & Potential Why NVDA, MU Could Outperform Rambus Stock Why NVDA, MU Could Outperform ON Semiconductor Stock Triggers That Could Ignite the Next Rally In NVIDIA Stock NVDA, MU Top Monolithic Power Systems Stock on Price & Potential NVDA, MU Top Broadcom Stock on Price & Potential NVIDIA Stock Hands $97 Bil Back – Worth a Look? ©Copyright 2026 Insight Guru Inc. All Rights Reserved. By using the Site, you agree to be bound by our Terms of
		Use.  Financial market data powered by Quotemedia.com.
		Consensus EPS estimates are from QuoteMedia and are updated every weekday.
		All rights reserved. NYSE/AMEX data delayed 20 minutes.  NASDAQ and other
		data delayed 15 minutes unless indicated.",https://www.trefis.com/stock/nvda/articles2/596813/structural-risks-to-watch-for-nvda-stock-over-the-next-6-months/2026-04-17
NVDA,Whalen Wealth Management Inc. Grows Stock Position in NVIDIA Corporation $NVDA - MarketBeat,2026-04-17 12:11:46,"Whalen Wealth Management Inc. increased its holdings in shares of  NVIDIA Corporation (NASDAQ:NVDA - Free Report) by 8.1% during the 4th quarter, according to its most recent filing with the Securities and Exchange Commission (SEC). The institutional investor  owned 39,430 shares of the computer hardware maker's stock after purchasing an additional 2,940 shares during the period. NVIDIA makes up   3.9% of Whalen Wealth Management Inc.'s portfolio, making the stock its 2nd biggest position. Whalen Wealth Management Inc.'s holdings in NVIDIA were worth $7,354,000 as of its most recent SEC filing. Other institutional investors have also modified their holdings of the company. Norges Bank bought a new stake in  NVIDIA in the second quarter worth approximately $51,386,863,000.  Capital Research Global Investors boosted its holdings in  NVIDIA by 16.1% during the 3rd quarter. Capital Research Global Investors now owns 165,377,852 shares of the computer hardware maker's stock valued at $30,855,564,000 after acquiring an additional 22,896,705 shares during the period.  Laurel Wealth Advisors LLC lifted its stake in shares of  NVIDIA by 15,496.1% in the 2nd quarter. Laurel Wealth Advisors LLC now owns 21,865,525 shares of the computer hardware maker's stock valued at $3,454,534,000 after purchasing an additional 21,725,326 shares during the period.  Danske Bank A S bought a new stake in shares of  NVIDIA in the 3rd quarter worth $3,180,313,000.  Finally, Massachusetts Financial Services Co. MA grew its holdings in shares of  NVIDIA by 25.0% in the third quarter. Massachusetts Financial Services Co. MA now owns 71,720,593 shares of the computer hardware maker's stock worth $13,381,628,000 after acquiring an additional 14,358,048 shares during the period. Institutional investors own  65.27% of the company's stock. Here are the key news stories impacting NVIDIA this week: NVDA has been the topic of several research analyst reports. Royal Bank Of Canada  reissued an ""outperform"" rating and issued a $250.00 price objective on shares of NVIDIA in a research note on Tuesday, March 17th. Zacks Research raised NVIDIA from a ""hold"" rating to a ""strong-buy"" rating in a report on Wednesday, February 25th. Raymond James Financial raised their price objective on NVIDIA from $291.00 to $323.00 and gave the stock a ""strong-buy"" rating in a report on Thursday, March 19th. Macquarie Infrastructure upgraded shares of NVIDIA to an ""outperform"" rating in a research report on Monday, December 29th. Finally, Rosenblatt Securities  restated a ""buy"" rating and set a $325.00 price objective on shares of NVIDIA in a research report on Monday, March 23rd. Four equities research analysts have rated the stock with a Strong Buy rating, forty-eight have issued  a Buy rating and two have assigned  a Hold rating to the company's stock. According to MarketBeat, NVIDIA presently has a consensus rating of ""Buy"" and an average target price of $275.25. In other NVIDIA news, EVP Ajay K. Puri sold 300,000 shares of NVIDIA stock in a transaction on Tuesday, March 10th. The stock was sold at an average price of $182.52, for a total transaction of $54,756,000.00. Following the completion of the transaction, the executive vice president directly owned 3,318,547 shares of the company's stock, valued at approximately $605,701,198.44. This trade represents a 8.29% decrease in their ownership of the stock. The sale was disclosed in a legal filing with the Securities & Exchange Commission, which can be accessed through this link. Also, Director Aarti S. Shah sold 19,000 shares of NVIDIA stock in a transaction on Thursday, March 19th. The shares were sold at an average price of $176.71, for a total value of $3,357,490.00. Following the transaction, the director directly owned 36,007 shares of the company's stock, valued at approximately $6,362,796.97. The trade was a 34.54% decrease in their ownership of the stock. The SEC filing for this sale provides additional information. Over the last quarter, insiders sold 1,153,976 shares of company stock valued at $207,181,819. 4.17% of the stock is owned by corporate insiders. Shares of NVDA opened at $198.35 on Friday. The stock has a market capitalization of $4.82 trillion, a P/E ratio of 40.48, a P/E/G ratio of 0.66 and a beta of 2.34. NVIDIA Corporation has a 12-month low of $95.04 and a 12-month high of $212.19. The firm's 50 day moving average is $183.04 and its 200-day moving average is $184.87. The company has a debt-to-equity ratio of 0.05, a current ratio of 3.91 and a quick ratio of 3.24. NVIDIA (NASDAQ:NVDA - Get Free Report) last posted its quarterly earnings data on Wednesday, February 25th. The computer hardware maker reported $1.62 earnings per share for the quarter, topping the consensus estimate of $1.54 by $0.08. NVIDIA had a net margin of 55.60% and a return on equity of 97.37%. The firm had revenue of $68.13 billion for the quarter, compared to analysts' expectations of $65.56 billion. During the same period in the previous year, the company posted $0.89 EPS. The company's quarterly revenue was up 73.2% compared to the same quarter last year.  Equities research analysts anticipate that  NVIDIA Corporation will post 2.77 EPS for the current fiscal year. The business also recently announced a quarterly dividend, which was paid on Wednesday, April 1st. Investors of record on Wednesday, March 11th were issued a $0.01 dividend. This represents a $0.04 annualized dividend and a yield of 0.0%. The ex-dividend date was Wednesday, March 11th. NVIDIA's payout ratio is 0.82%. NVIDIA Corporation, founded in 1993 and headquartered in Santa Clara, California, is a global technology company that designs and develops graphics processing units (GPUs) and system-on-chip (SoC) technologies. Co-founded by Jensen Huang, who serves as president and chief executive officer, along with Chris Malachowsky and Curtis Priem, NVIDIA has grown from a graphics-focused chipmaker into a broad provider of accelerated computing hardware and software for multiple industries. The company's product portfolio spans discrete GPUs for gaming and professional visualization (marketed under the GeForce and NVIDIA RTX lines), high-performance data center accelerators used for AI training and inference (including widely adopted platforms such as the A100 and H100 series), and Tegra SoCs for automotive and edge applications. This instant news alert was generated by narrative science technology and financial data from MarketBeat in order to provide readers with the fastest reporting and unbiased coverage. Please send any questions or comments about this story to contact@marketbeat.com. Before you consider NVIDIA, you'll want to hear this. MarketBeat keeps track of Wall Street's top-rated and best performing research analysts and the stocks they recommend to their clients on a daily basis. MarketBeat has identified the five stocks that top analysts are quietly whispering to their clients to buy now before the broader market catches on... and NVIDIA wasn't on the list. While NVIDIA currently has a Buy rating among analysts, top-rated analysts believe these five stocks are better buys. Click the link to see MarketBeat's guide to investing in 5G and which 5G stocks show the most promise. Sign up for MarketBeat All Access to gain access to MarketBeat's full suite of research tools. 345 N Reid Place, Suite 620, Sioux Falls, SD 57103
                                        
                                        contact@marketbeat.com
                                        
                                        (844) 978-6257 © MarketBeat Media, LLC 2010-2026. All rights reserved. © 2026   Fair market value prices are updated every minute and are provided by Massive. Other market data provided is at least 10-minutes delayed and hosted by Barchart Solutions.  Information is provided 'as-is' and solely for informational purposes, not for trading purposes or advice, and is delayed. To see all exchange delays and terms of use please see Barchart's disclaimer.",https://www.marketbeat.com/instant-alerts/filing-whalen-wealth-management-inc-grows-stock-position-in-nvidia-corporation-nvda-2026-04-17/
