ticker,title,date,content,url
NVDA,NVIDIA Corporation $NVDA Stake Cut by Worth Asset Management LLC - MarketBeat,2026-04-06 11:49:52,"Worth Asset Management LLC lessened its holdings in  NVIDIA Corporation (NASDAQ:NVDA - Free Report) by 22.7% in the fourth quarter, according to the company in its most recent Form 13F filing with the Securities and Exchange Commission (SEC). The firm owned 13,905 shares of the computer hardware maker's stock after selling 4,090 shares during the quarter. NVIDIA makes up  about  1.1% of Worth Asset Management LLC's investment portfolio, making the stock its 23rd largest holding. Worth Asset Management LLC's holdings in NVIDIA were worth $2,593,000 as of its most recent SEC filing. Several other institutional investors have also recently added to or reduced their stakes in the business. Brighton Jones LLC lifted its stake in  NVIDIA by 12.4% in the fourth quarter. Brighton Jones LLC now owns 324,901 shares of the computer hardware maker's stock valued at $43,631,000 after buying an additional 35,815 shares during the last quarter.  Bank Pictet & Cie Europe AG increased its holdings in shares of  NVIDIA by 1.0% in the 4th quarter. Bank Pictet & Cie Europe AG now owns 2,346,417 shares of the computer hardware maker's stock worth $315,100,000 after acquiring an additional 22,929 shares during the period.  Highview Capital Management LLC DE lifted its position in  NVIDIA by 6.7% in the 4th quarter. Highview Capital Management LLC DE now owns 58,396 shares of the computer hardware maker's stock valued at $7,842,000 after purchasing an additional 3,653 shares during the last quarter.  Hudson Value Partners LLC grew its position in  NVIDIA by 30.7% in the 4th quarter. Hudson Value Partners LLC now owns 50,658 shares of the computer hardware maker's stock worth $6,805,000 after purchasing an additional 11,900 shares during the last quarter.  Finally, Wealth Group Ltd. grew its position in  NVIDIA by 15.7% in the 1st quarter. Wealth Group Ltd. now owns 6,598 shares of the computer hardware maker's stock worth $715,000 after purchasing an additional 896 shares during the last quarter. Institutional investors own  65.27% of the company's stock. Here are the key news stories impacting NVIDIA this week: NVDA has been the subject of several analyst reports. Needham & Company LLC  reiterated a ""buy"" rating and set a $240.00 price objective on shares of NVIDIA in a research report on Wednesday, March 18th. William Blair  set a $300.00 target price on NVIDIA in a research report on Thursday, March 12th. Sanford C. Bernstein boosted their price target on NVIDIA from $275.00 to $300.00 and gave the stock an ""outperform"" rating in a research report on Thursday, February 26th. Royal Bank Of Canada  reissued an ""outperform"" rating and set a $250.00 price target on shares of NVIDIA in a report on Tuesday, March 17th. Finally, Rothschild & Co Redburn upped their price objective on shares of NVIDIA from $245.00 to $268.00 and gave the stock a ""buy"" rating in a report on Thursday, January 15th. Four equities research analysts have rated the stock with a Strong Buy rating, forty-seven have assigned  a Buy rating and two have issued  a Hold rating to the company. Based on data from MarketBeat.com, NVIDIA currently has a consensus rating of ""Buy"" and an average target price of $275.25. Shares of NVIDIA stock opened at $177.39 on Monday. The business has a fifty day simple moving average of $182.41 and a 200-day simple moving average of $184.33. NVIDIA Corporation has a fifty-two week low of $86.62 and a fifty-two week high of $212.19. The firm has a market cap of $4.31 trillion, a price-to-earnings ratio of 36.20, a price-to-earnings-growth ratio of 0.59 and a beta of 2.34. The company has a quick ratio of 3.24, a current ratio of 3.91 and a debt-to-equity ratio of 0.05. NVIDIA (NASDAQ:NVDA - Get Free Report) last issued its quarterly earnings results on Wednesday, February 25th. The computer hardware maker reported $1.62 earnings per share for the quarter, beating analysts' consensus estimates of $1.54 by $0.08. The company had revenue of $68.13 billion during the quarter, compared to the consensus estimate of $65.56 billion. NVIDIA had a net margin of 55.60% and a return on equity of 97.37%. NVIDIA's revenue was up 73.2% on a year-over-year basis. During the same period in the prior year, the company earned $0.89 EPS.  On average, equities analysts forecast that  NVIDIA Corporation will post 2.77 EPS for the current fiscal year. The firm also recently announced a quarterly dividend, which was paid on Wednesday, April 1st. Investors of record on Wednesday, March 11th were issued a dividend of $0.01 per share. This represents a $0.04 dividend on an annualized basis and a yield of 0.0%. The ex-dividend date was Wednesday, March 11th. NVIDIA's dividend payout ratio (DPR) is presently 0.82%. In related news, EVP Ajay K. Puri sold 300,000 shares of NVIDIA stock in a transaction on Wednesday, March 18th. The stock was sold at an average price of $182.25, for a total value of $54,675,000.00. Following the transaction, the executive vice president directly owned 3,018,547 shares in the company, valued at $550,130,190.75. The trade was a 9.04% decrease in their position. The sale was disclosed in a legal filing with the SEC, which is available through this link. Also, Director Mark A. Stevens sold 221,682 shares of the company's stock in a transaction on Friday, March 20th. The shares were sold at an average price of $173.68, for a total value of $38,501,729.76. Following the sale, the director directly owned 7,399,771 shares of the company's stock, valued at approximately $1,285,192,227.28. This represents a 2.91% decrease in their ownership of the stock. The disclosure for this sale is available in the SEC filing. Over the last 90 days, insiders have sold 1,401,616 shares of company stock worth $253,555,407. 4.17% of the stock is owned by insiders. NVIDIA Corporation, founded in 1993 and headquartered in Santa Clara, California, is a global technology company that designs and develops graphics processing units (GPUs) and system-on-chip (SoC) technologies. Co-founded by Jensen Huang, who serves as president and chief executive officer, along with Chris Malachowsky and Curtis Priem, NVIDIA has grown from a graphics-focused chipmaker into a broad provider of accelerated computing hardware and software for multiple industries. The company's product portfolio spans discrete GPUs for gaming and professional visualization (marketed under the GeForce and NVIDIA RTX lines), high-performance data center accelerators used for AI training and inference (including widely adopted platforms such as the A100 and H100 series), and Tegra SoCs for automotive and edge applications. This instant news alert was generated by narrative science technology and financial data from MarketBeat in order to provide readers with the fastest reporting and unbiased coverage. Please send any questions or comments about this story to contact@marketbeat.com. Before you consider NVIDIA, you'll want to hear this. MarketBeat keeps track of Wall Street's top-rated and best performing research analysts and the stocks they recommend to their clients on a daily basis. MarketBeat has identified the five stocks that top analysts are quietly whispering to their clients to buy now before the broader market catches on... and NVIDIA wasn't on the list. While NVIDIA currently has a Buy rating among analysts, top-rated analysts believe these five stocks are better buys. Just getting into the stock market? These 10 simple stocks can help beginning investors build long-term wealth without knowing options, technicals, or other advanced strategies. Sign up for MarketBeat All Access to gain access to MarketBeat's full suite of research tools. 345 N Reid Place, Suite 620, Sioux Falls, SD 57103
                                        
                                        contact@marketbeat.com
                                        
                                        (844) 978-6257 © MarketBeat Media, LLC 2010-2026. All rights reserved. © 2026   Fair market value prices are updated every minute and are provided by Massive. Other market data provided is at least 10-minutes delayed and hosted by Barchart Solutions.  Information is provided 'as-is' and solely for informational purposes, not for trading purposes or advice, and is delayed. To see all exchange delays and terms of use please see Barchart's disclaimer. We and our partners share information on your use of this website to help improve your experience. For more information, or to opt out click the Do Not Sell My Information button below.",https://www.marketbeat.com/instant-alerts/filing-nvidia-corporation-nvda-stake-cut-by-worth-asset-management-llc-2026-04-06/
NVDA,Waldron Private Wealth LLC Has $11.05 Million Position in NVIDIA Corporation $NVDA - MarketBeat,2026-04-06 11:49:51,"Waldron Private Wealth LLC grew its position in shares of  NVIDIA Corporation (NASDAQ:NVDA - Free Report) by 41.7% during the fourth quarter, according to its most recent disclosure with the Securities and Exchange Commission. The institutional investor  owned 59,254 shares of the computer hardware maker's stock after purchasing an additional 17,446 shares during the quarter. Waldron Private Wealth LLC's holdings in NVIDIA were worth $11,051,000 as of its most recent SEC filing. Several other institutional investors and hedge funds also recently made changes to their positions in the company. Joule Financial LLC grew its holdings in  NVIDIA by 2.2% during the 3rd quarter. Joule Financial LLC now owns 2,308 shares of the computer hardware maker's stock worth $431,000 after acquiring an additional 50 shares during the last quarter.  Vision Financial Markets LLC lifted its holdings in shares of  NVIDIA by 1.2% during the third quarter. Vision Financial Markets LLC now owns 4,640 shares of the computer hardware maker's stock worth $866,000 after purchasing an additional 53 shares during the period.  Websterrogers Financial Advisors LLC grew its stake in shares of  NVIDIA by 2.6% in the third quarter. Websterrogers Financial Advisors LLC now owns 2,118 shares of the computer hardware maker's stock worth $395,000 after purchasing an additional 54 shares during the last quarter.  IMG Wealth Management Inc. grew its stake in shares of  NVIDIA by 1.4% in the third quarter. IMG Wealth Management Inc. now owns 3,820 shares of the computer hardware maker's stock worth $713,000 after purchasing an additional 54 shares during the last quarter.  Finally, Cyr Financial Inc. increased its holdings in  NVIDIA by 0.7% in the third quarter. Cyr Financial Inc. now owns 7,737 shares of the computer hardware maker's stock valued at $1,444,000 after purchasing an additional 54 shares during the period. Institutional investors and hedge funds own  65.27% of the company's stock. Shares of NASDAQ:NVDA opened at $177.39 on Monday. The company has a debt-to-equity ratio of 0.05, a quick ratio of 3.24 and a current ratio of 3.91. NVIDIA Corporation has a 52-week low of $86.62 and a 52-week high of $212.19. The business's 50 day simple moving average is $182.41 and its two-hundred day simple moving average is $184.33. The firm has a market cap of $4.31 trillion, a P/E ratio of 36.20, a PEG ratio of 0.59 and a beta of 2.34. NVIDIA (NASDAQ:NVDA - Get Free Report) last released its quarterly earnings data on Wednesday, February 25th. The computer hardware maker reported $1.62 EPS for the quarter, beating the consensus estimate of $1.54 by $0.08. NVIDIA had a return on equity of 97.37% and a net margin of 55.60%.The firm had revenue of $68.13 billion during the quarter, compared to the consensus estimate of $65.56 billion. During the same quarter in the previous year, the company posted $0.89 earnings per share. The company's quarterly revenue was up 73.2% on a year-over-year basis.  As a group, research analysts forecast that  NVIDIA Corporation will post 2.77 EPS for the current fiscal year. The firm also recently announced a quarterly dividend, which was paid on Wednesday, April 1st. Stockholders of record on Wednesday, March 11th were given a dividend of $0.01 per share. The ex-dividend date of this dividend was Wednesday, March 11th. This represents a $0.04 annualized dividend and a dividend yield of 0.0%. NVIDIA's payout ratio is presently 0.82%. Here are the key news stories impacting NVIDIA this week: In other NVIDIA news, Director Mark A. Stevens sold 221,682 shares of the business's stock in a transaction that occurred on Friday, March 20th. The stock was sold at an average price of $173.68, for a total transaction of $38,501,729.76. Following the completion of the sale, the director directly owned 7,399,771 shares of the company's stock, valued at approximately $1,285,192,227.28. The trade was a 2.91% decrease in their position. The sale was disclosed in a document filed with the SEC, which is accessible through this hyperlink. Also, Director John Dabiri sold 3,004 shares of NVIDIA stock in a transaction that occurred on Friday, March 13th. The shares were sold at an average price of $184.90, for a total value of $555,439.60. Following the transaction, the director directly owned 14,788 shares in the company, valued at approximately $2,734,301.20. The trade was a 16.88% decrease in their position. The disclosure for this sale is available in the SEC filing. Insiders sold a total of 1,401,616 shares of company stock valued at $253,555,407 over the last quarter. 4.17% of the stock is currently owned by company insiders. NVDA has been the topic of several analyst reports. Wells Fargo & Company  reiterated an ""overweight"" rating on shares of NVIDIA in a report on Monday, December 29th. Mizuho  set a $275.00 price target on shares of NVIDIA and gave the company an ""outperform"" rating in a research report on Friday, January 9th. Fundamental Research  set a $218.00 price objective on NVIDIA in a research report on Thursday, February 26th. Wedbush upped their target price on NVIDIA from $230.00 to $300.00 and gave the company an ""outperform"" rating in a research report on Tuesday, March 3rd. Finally, Raymond James Financial raised their target price on NVIDIA from $291.00 to $323.00 and gave the stock a ""strong-buy"" rating in a research note on Thursday, March 19th. Four research analysts have rated the stock with a Strong Buy rating, forty-seven have given a Buy rating and two have assigned  a Hold rating to the stock. According to data from MarketBeat.com, the stock  has an average rating of ""Buy"" and a consensus price target of $275.25. NVIDIA Corporation, founded in 1993 and headquartered in Santa Clara, California, is a global technology company that designs and develops graphics processing units (GPUs) and system-on-chip (SoC) technologies. Co-founded by Jensen Huang, who serves as president and chief executive officer, along with Chris Malachowsky and Curtis Priem, NVIDIA has grown from a graphics-focused chipmaker into a broad provider of accelerated computing hardware and software for multiple industries. The company's product portfolio spans discrete GPUs for gaming and professional visualization (marketed under the GeForce and NVIDIA RTX lines), high-performance data center accelerators used for AI training and inference (including widely adopted platforms such as the A100 and H100 series), and Tegra SoCs for automotive and edge applications. Want to see what other hedge funds are holding NVDA? Visit HoldingsChannel.com to get the latest 13F filings and insider trades for NVIDIA Corporation (NASDAQ:NVDA - Free Report). This instant news alert was generated by narrative science technology and financial data from MarketBeat in order to provide readers with the fastest reporting and unbiased coverage. Please send any questions or comments about this story to contact@marketbeat.com. Before you consider NVIDIA, you'll want to hear this. MarketBeat keeps track of Wall Street's top-rated and best performing research analysts and the stocks they recommend to their clients on a daily basis. MarketBeat has identified the five stocks that top analysts are quietly whispering to their clients to buy now before the broader market catches on... and NVIDIA wasn't on the list. While NVIDIA currently has a Buy rating among analysts, top-rated analysts believe these five stocks are better buys. Learn the basics of options trading and how to use them to boost returns and manage risk with this free report from MarketBeat. Click the link below to get your free copy. Sign up for MarketBeat All Access to gain access to MarketBeat's full suite of research tools. 345 N Reid Place, Suite 620, Sioux Falls, SD 57103
                                        
                                        contact@marketbeat.com
                                        
                                        (844) 978-6257 © MarketBeat Media, LLC 2010-2026. All rights reserved. © 2026   Fair market value prices are updated every minute and are provided by Massive. Other market data provided is at least 10-minutes delayed and hosted by Barchart Solutions.  Information is provided 'as-is' and solely for informational purposes, not for trading purposes or advice, and is delayed. To see all exchange delays and terms of use please see Barchart's disclaimer. We and our partners share information on your use of this website to help improve your experience. For more information, or to opt out click the Do Not Sell My Information button below.",https://www.marketbeat.com/instant-alerts/filing-waldron-private-wealth-llc-has-1105-million-position-in-nvidia-corporation-nvda-2026-04-06/
NVDA,1 Cash-Heavy Stock with Impressive Fundamentals and 2 We Brush Off - stockstory.org,2026-04-06 10:41:49,"A surplus of cash can mean financial stability, but it can also indicate a reluctance (or inability) to invest in growth. Some of these companies also face challenges like stagnating revenue, declining market share, or limited scalability. Just because a business has cash doesn’t mean it’s a good investment. Luckily, StockStory is here to help you separate the winners from the losers. That said, here is one company with a net cash position that balances growth with stability and two with hidden risks. Net Cash Position: $33.67 million (32.6% of Market Cap) Initially a financial services business, Clarus (NASDAQ:CLAR) designs, manufactures, and distributes outdoor equipment and lifestyle products. At $2.69 per share, Clarus trades at 16.1x forward P/E. If you’re considering CLAR for your portfolio, see our FREE research report to learn more. Net Cash Position: $877.4 million (6.7% of Market Cap) Founded in 2000 with a focus on delivering big-bank capabilities with community bank personalization, Pinnacle Financial Partners (NASDAQ:PNFP) is a Tennessee-based financial holding company that provides banking, investment, trust, mortgage, and insurance services to businesses and individuals. Pinnacle Financial Partners is trading at $87.47 per share, or 0.9x forward P/B. To fully understand why you should be careful with PNFP, check out our full research report (it’s free). Net Cash Position: $51.52 billion (1.2% of Market Cap) Founded in 1993 by Jensen Huang and two former Sun Microsystems engineers, Nvidia (NASDAQ:NVDA) is a leading fabless designer of chips used in gaming, PCs, data centers, automotive, and a variety of end markets. Nvidia’s stock price of $176.70 implies a valuation ratio of 21.3x forward P/E. Is now a good time to buy? See for yourself in our in-depth research report, it’s free. ONE MORE THING: Top 5 Growth Stocks. The biggest stock winners almost always had one thing in common before they ran. Revenue growing like crazy. Meta. CrowdStrike. Broadcom. Our AI flagged all three. They returned 315%, 314%, and 455%, respectively. Find out which 5 stocks it's flagging for this month — FREE.  Get Our Top 5 Growth Stocks for Free HERE. Stocks that made our list in 2020 include now familiar names such as ServiceNow (+163% between June 2020 and June 2025) as well as under-the-radar businesses like the once-micro-cap company Kadant (+351% five-year return). Find your next big winner with StockStory today. Data sources: actuals and consensus estimates from StockStory, S&P Global Market Intelligence, and Visible Alpha. Market data from Massive. Provided for general information purposes only and does not constitute investment advice or a recommendation that any particular security, portfolio of securities, transaction or investment strategy is suitable for any specific individual. Information on our investment framework and performance methodology is available here. Copyright 2026, S&P Global Market Intelligence (and its affiliates as applicable). All rights reserved.",https://stockstory.org/us/stocks/nasdaq/nvda/news/buy-or-sell/1-cash-heavy-stock-with-impressive-fundamentals-and-2-we-brush-off
NVDA,What's Going On With Nvidia Stock Monday? - NVIDIA (NASDAQ:NVDA) - benzinga.com,2026-04-06 10:06:19,"The owner of this website (www.benzinga.com) has banned you temporarily from accessing this website. Please see
                            https://developers.cloudflare.com/support/troubleshooting/http-status-codes/cloudflare-1xxx-errors/error-1015/
                            for more details. Cloudflare Ray ID: 9e8d6f71aa4bd673
•

        Your IP:
        Click to reveal
20.55.15.102
•

Performance & security by Cloudflare",https://www.benzinga.com/markets/tech/26/04/51653219/whats-going-on-with-nvidia-stock-monday-4
NVDA,"NVDA Apr 2026 200.000 put (NVDA260406P00200000) stock price, news, quote and history - Yahoo Finance UK",2026-04-06 07:00:00,"Tip: Try a valid symbol or a specific company name for relevant results ⚡️ Stocks waver as Trump's Iran 🇮🇷 deadline looms ⚡️ Stocks fall 📉 after Trump threatens to hit Iran ‘extremely hard’ 🇮🇷 💷 Pound jumps 📈 on hopes that Middle East war will end soon 📈 Stocks rally after Trump says US could leave Iran in a few weeks 📉 Gold prices 👑 set for worst month since 2008 as Iran war 🇮🇷 continues Oil prices 🛢️ pull lower following reports of Trump 🇺🇸 considering end to Middle East conflict Pound ticks higher as UK GDP growth 🇬🇧 confirmed as nearly stagnant in Q4 📊 Stocks set to rise 📈 as Trump willing to end Iran war 🇮🇷 without Hormuz deal Average UK house price 🏡 rises to £277,186 in March 📈 Mortgage approvals ✔️ jump by most since November, Bank of England 🏦 says Brent crude 🛢️ prices up to $115 a barrel 📈 as traders assess Trump peace deal claims Pound 💷 set for biggest monthly loss against dollar 💲 since October Stocks set to tumble as Middle East conflict intensifies Gold and silver prices rise 📈 with eyes on central banks and Iran war 💷 UK currency dips amid weaker retail sales while Middle East war ramps up inflation fears 💷 Stocks muted as Trump delays strikes on Iran power plants 🌍 Pound 💷 dips against dollar as OECD warns Middle East conflict will drive up UK inflation ⛽🛍️ Oil prices 🛢️ higher as Trump claims Iran doesn't want to admit they spoke 🗣️ Bitcoin price struggles near $70K as peace talk hopes falter Pound 💷 steady as Bank of England 🏦 interest rate rise bets ease Gold 🪙 price jumps ⬆️ 3% as oil slump eases inflation fears amid Trump Iran plan Stocks rise 📈 on reports of Trump offering 15-point ceasefire plan to Iran 🗒️ Oil price ⛽ plunges 📉 as Trump announces plan to end Iran war 💷 Pound dips against dollar 💵 as speculation around UK interest rates grow ⚡️ ASML, Estée Lauder, Bellway, Kingfisher and Fevertree ⚡️ ⚡️ Gold and silver price moves muted amid inflation and interest rate hike risks ⚡️ ⚡️ Stocks lack direction as traders assess Middle East conflict ⚡️ 🛢️Tehran's denial of negotiations clouds prospect of reopening Strait of Hormuz and ending conflict 🛢️ Pound 💷 dips against dollar 💲 amid mounting expectations of Bank of England 🏦 rate increase Gold 🪙 and silver erase 2026 gains as Middle East inflation fears stoke bets on higher rates London plunges into correction territory as Trump gives Iran ultimatum Oil prices ⛽ gain as Trump and Starmer discuss need to reopen Hormuz ⚡️ UK inflation, BYD, Next, Kingfisher and Bellway ⚡️ Gold 👑 set for third weekly fall 📉 as strong dollar and Fed stance weigh Pound steady 🇬🇧 as investors digest UK borrowing data 📊 and interest rate decisions Stocks higher 📈 as Netanyahu 🇮🇱 says he will 'hold off' on gas field attacks Oil prices 🛢️ fall as Netanyahu signals pause in Iran strikes 🇮🇷 Government borrowing rose 📈 by more than expected to £14.3bn in February ECB follows Bank of England with interest rate hold as Iran war intensifies Tip: Try a valid symbol or a specific company name for relevant results",https://uk.finance.yahoo.com/quote/NVDA260406P00200000/
