ticker,title,date,content,url
TSM,Direxion Daily TSM Bull 2X Shares Announces Quarterly Dividend of $0.24 (NASDAQ:TSMX) - MarketBeat,2026-03-24 22:17:20,"Direxion Daily TSM Bull 2X Shares (NASDAQ:TSMX - Get Free Report) declared a quarterly dividend on Monday, March 23rd, NASDAQ Dividends reports. Investors of record on Tuesday, March 24th will be paid a dividend of 0.2398 per share on Tuesday, March 31st. This represents a c) annualized dividend and a dividend yield of 1.6%. The ex-dividend date of this dividend is Tuesday, March 24th. Direxion Daily TSM Bull 2X Shares stock traded up $1.41 during trading on Tuesday, hitting $59.46. 711,372 shares of the company were exchanged, compared to its average volume of 771,833. The business's 50 day moving average is $63.20 and its 200 day moving average is $53.79. Direxion Daily TSM Bull 2X Shares has a 52 week low of $12.15 and a 52 week high of $78.56. The company has a market capitalization of $303.25 million, a P/E ratio of -2.76 and a beta of 7.50. The Direxion Daily TSM Bull 2X Shares (TSMX) is an exchange-traded fund that mostly invests in information technology equity. The fund provides 2x leveraged exposure, less fees and expenses, to the daily price movement for shares of Taiwan Semiconductor Manufacturing (TSM) stock. TSMX was launched on Oct 3, 2024 and is issued by Direxion. This instant news alert was generated by narrative science technology and financial data from MarketBeat in order to provide readers with the fastest reporting and unbiased coverage. Please send any questions or comments about this story to contact@marketbeat.com. Before you consider Direxion Daily TSM Bull 2X Shares, you'll want to hear this. MarketBeat keeps track of Wall Street's top-rated and best performing research analysts and the stocks they recommend to their clients on a daily basis. MarketBeat has identified the five stocks that top analysts are quietly whispering to their clients to buy now before the broader market catches on... and Direxion Daily TSM Bull 2X Shares wasn't on the list. While Direxion Daily TSM Bull 2X Shares currently has a Hold rating among analysts, top-rated analysts believe these five stocks are better buys. Market downturns give many investors pause, and for good reason. Wondering how to offset this risk? Click the link to learn more about using beta to protect your portfolio. Sign up for MarketBeat All Access to gain access to MarketBeat's full suite of research tools. 345 N Reid Place, Suite 620, Sioux Falls, SD 57103
                                        
                                        contact@marketbeat.com
                                        
                                        (844) 978-6257 © MarketBeat Media, LLC 2010-2026. All rights reserved. © 2026   Fair market value prices are updated every minute and are provided by Massive. Other market data provided is at least 10-minutes delayed and hosted by Barchart Solutions.  Information is provided 'as-is' and solely for informational purposes, not for trading purposes or advice, and is delayed. To see all exchange delays and terms of use please see Barchart's disclaimer. We and our partners share information on your use of this website to help improve your experience. For more information, or to opt out click the Do Not Sell My Information button below.",https://www.marketbeat.com/instant-alerts/direxion-daily-tsm-bull-2x-shares-announces-quarterly-dividend-of-024-nasdaqtsmx-2026-03-24/
TSM,TSMC (TSM) Ascends While Market Falls: Some Facts to Note - Yahoo Finance,2026-03-24 21:45:03,"Tip: Try a valid symbol or a specific company name for relevant results The economist known as 'Dr. Doom' says the Iran war could have serious implications for inflation and interest rates The CEO claims the era of the $1 billion AI-run companies is already here. Shares tanked the most on record, thanks to unfavorable developments in legislation moving through Congress. Stocks resumed a slide, with the Nasdaq leading the decline. Oil jumped as the Iran war dragged on. Stocks retreated at the open, pulling back after Monday's sharp rally as the Iran war dragged on How the Fed has — and hasn't — responded to previous oil price shocks Musk's 'Terafab' is finally here. It might be his grandest overarching vision yet for where he sees his companies headed. Larry Fink's annual letter featured a stark warning about AI and inequality Trump started talks with Iran after US allies warned him about the dangers of his planned strikes (Bloomberg) The Dow jumped over 600 points, while the S&P 500 and Nasdaq both rose over 1% as Wall Street cheered Trump's signal to resume talks with Iran. US stocks soar after Trump puts Iran strikes on hold to pursue 'very good' talks Dow futures soared nearly 1,000 points and oil sank after Trump postponed threatened strikes on Iran's power plants The Saudi oil pipeline the world didn't know it needed (Bloomberg) Here's how HELOCs have changed — and why some homeowners may not like the new rules Home health aides epitomize a key problem in the current job market: High demand but low pay Analysts are looking at how surging gas prices may affect consumers, inflation, and the broader economy Border czar Homan says ICE will do ‘non-significant’ tasks at airports (Bloomberg) Powell doesn't plan to step down from the Fed Board of Governors until the DOJ investigations of him and the Fed are resolved Iran war rages on, possible rate hikes, and AI's 'show me' phase Why Nascar star Joey Logano just invested in a Ford dealership A growing number of Americans are looking to retire overseas. Here's what you need to know. Your flight is about to get more expensive. These tips could save you. Trump threatens to deploy ICE agents to airports in shutdown (Bloomberg) Why used EVs may be the answer for Americans looking for affordable cars Property taxes are skyrocketing. But states are learning that cutting them has major consequences. OpenAI to double workforce as business push intensifies (Financial Times) Wall Street priced a swift bombing campaign. What it got was an energy war. Shutdown-induced travel problems may get even worse next week. And Congress has a recess looming. Jury finds Elon Musk misled investors during Twitter purchase, absolves him of some fraud claims (Associated Press) Gas prices are just the start: Consumers will feel more pain from Iran war The Dow, S&P 500, and Nasdaq sold off to end another brutal week as the Iran war rages Wall Street resumed its sell-off, with the Nasdaq down over 1% as stocks looked headed for another brutal week. US stocks retreat as oil swings around amid Iran war jitters The robotaxi companies have wildly different problems, but the same goal The financial sector is on pace for its worst first quarter since 2020 $200 billion for the war in Iran? Trump calls it a 'small price to pay.' Gold, silver, and bitcoin crashed as the prospect of higher inflation reduced the likelihood of Fed rate cuts. Stocks ended the day lower, but Wall Street recovered from steeper losses as oil's surge eased. Prices breached $110 a barrel as the war in Iran entered a new phase with countries targeting energy infrastructure Federal Reserve proposes lowering capital requirements for banks Stocks resumed a sell-off at the open, as new escalation in the Middle East sent oil prices surging Jerome Powell is worried about plenty of things. Stagflation isn't one of them. Ship traffic in the critical Strait of Hormuz has plunged. The White House is scrambling for a response. Tesla's Model 3 has a new competitor: BMW's new i3 EV, with 440 miles of range. Circle CEO explains what's behind the stock's explosive gains The Dow sank over 750 points, as stocks gave up gains for the week after Fed Chair Powell expressed concern about progress in fighting inflation. Stock losses accelerated after the Fed's interest rate decision, as Chair Powell raised concerns about inflation progress. The Fed chair is holding a press conference after the central bank's decision. Watch it here. Most Fed officials are still holding out the prospect of a rate cut this year. The central bank also sees faster growth and hotter inflation. The Fed held interest rates steady as new shocks play out in the US economy TSMC (TSM) ended the recent trading session at $343.25, demonstrating a +1.42% change from the preceding day's closing price. The stock outperformed the S&P 500, which registered a daily loss of 0.37%. Elsewhere, the Dow saw a downswing of 0.18%, while the tech-heavy Nasdaq depreciated by 0.84%. Shares of the chip company have depreciated by 8.54% over the course of the past month, underperforming the Computer and Technology sector's loss of 2.83%, and the S&P 500's loss of 3.7%. Market participants will be closely following the financial results of TSMC in its upcoming release. On that day, TSMC is projected to report earnings of $3.27 per share, which would represent year-over-year growth of 54.25%. Meanwhile, the latest consensus estimate predicts the revenue to be $35.4 billion, indicating a 38.67% increase compared to the same quarter of the previous year. Looking at the full year, the Zacks Consensus Estimates suggest analysts are expecting earnings of $14.37 per share and revenue of $160 billion. These totals would mark changes of +34.93% and +30.69%, respectively, from last year. Additionally, investors should keep an eye on any recent revisions to analyst forecasts for TSMC. Such recent modifications usually signify the changing landscape of near-term business trends. Consequently, upward revisions in estimates express analysts' positivity towards the business operations and its ability to generate profits. Our research suggests that these changes in estimates have a direct relationship with upcoming stock price performance. To capitalize on this, we've crafted the Zacks Rank, a unique model that incorporates these estimate changes and offers a practical rating system. Ranging from #1 (Strong Buy) to #5 (Strong Sell), the Zacks Rank system has a proven, outside-audited track record of outperformance, with #1 stocks returning an average of +25% annually since 1988. Over the past month, the Zacks Consensus EPS estimate has shifted 1.63% upward. As of now, TSMC holds a Zacks Rank of #3 (Hold). Digging into valuation, TSMC currently has a Forward P/E ratio of 23.56. Its industry sports an average Forward P/E of 23.56, so one might conclude that TSMC is trading at no noticeable deviation comparatively. Meanwhile, TSM's PEG ratio is currently 0.93. Comparable to the widely accepted P/E ratio, the PEG ratio also accounts for the company's projected earnings growth. The Semiconductor - Circuit Foundry was holding an average PEG ratio of 0.93 at yesterday's closing price. The Semiconductor - Circuit Foundry industry is part of the Computer and Technology sector. Currently, this industry holds a Zacks Industry Rank of 94, positioning it in the top 39% of all 250+ industries. The strength of our individual industry groups is measured by the Zacks Industry Rank, which is calculated based on the average Zacks Rank of the individual stocks within these groups. Our research shows that the top 50% rated industries outperform the bottom half by a factor of 2 to 1. Make sure to utilize Zacks.com to follow all of these stock-moving metrics, and more, in the coming trading sessions. Want the latest recommendations from Zacks Investment Research? Today, you can download 7 Best Stocks for the Next 30 Days. Click to get this free report Taiwan Semiconductor Manufacturing Company Ltd. (TSM) : Free Stock Analysis Report This article originally published on Zacks Investment Research (zacks.com). Tip: Try a valid symbol or a specific company name for relevant results",https://finance.yahoo.com/markets/stocks/articles/tsmc-tsm-ascends-while-market-214503225.html
TSM,Taiwan Semiconductor Manufacturing (NYSE:TSM) Shares Up 1.4% Following Insider Buying Activity - MarketBeat,2026-03-24 21:21:13,"Taiwan Semiconductor Manufacturing Company Ltd. (NYSE:TSM - Get Free Report)'s stock price shot up 1.4% during trading on Tuesday after an insider bought additional shares in the company. The company traded as high as $344.88 and last traded at $343.3390. 9,469,211 shares traded hands during mid-day trading, a decline of 33% from the average session volume of 14,095,684 shares. The stock had previously closed at $338.45. Specifically,  VP Bor-Zen Tien acquired 1,000 shares of the company's stock in a transaction that occurred on Sunday, March 22nd. The stock was bought at an average price of $55.93 per share, with a total value of $55,930.00. Following the purchase, the vice president owned 9,051 shares in the company, valued at approximately $506,222.43. The trade was a 12.42% increase in their ownership of the stock. The transaction was disclosed in a filing with the Securities & Exchange Commission, which is available through the SEC website. Several brokerages have recently weighed in on TSM. Wall Street Zen upgraded Taiwan Semiconductor Manufacturing from a ""hold"" rating to a ""buy"" rating in a report on Sunday. Needham & Company LLC lifted their price objective on Taiwan Semiconductor Manufacturing from $360.00 to $410.00 and gave the stock a ""buy"" rating in a research report on Thursday, January 15th. Sanford C. Bernstein  reissued an ""outperform"" rating on shares of Taiwan Semiconductor Manufacturing in a research note on Friday, January 2nd. TD Cowen upped their target price on Taiwan Semiconductor Manufacturing from $325.00 to $370.00 and gave the company a ""hold"" rating in a report on Friday, January 16th. Finally, The Goldman Sachs Group  reaffirmed a ""buy"" rating on shares of Taiwan Semiconductor Manufacturing in a research note on Monday, January 5th. Three investment analysts have rated the stock with a Strong Buy rating, ten have given a Buy rating and two have assigned  a Hold rating to the company's stock. According to MarketBeat, the company presently has an average rating of ""Buy"" and a consensus target price of $391.43. Here are the key news stories impacting Taiwan Semiconductor Manufacturing this week: The company has a market capitalization of $1.78 trillion, a PE ratio of 32.24, a price-to-earnings-growth ratio of 0.90 and a beta of 1.29. The company has a quick ratio of 2.42, a current ratio of 2.62 and a debt-to-equity ratio of 0.17. The firm has a 50-day moving average of $348.80 and a two-hundred day moving average of $310.94. Taiwan Semiconductor Manufacturing (NYSE:TSM - Get Free Report) last posted its earnings results on Thursday, February 26th. The semiconductor company reported $3.11 EPS for the quarter. The company had revenue of $30.65 billion for the quarter. Taiwan Semiconductor Manufacturing had a return on equity of 34.89% and a net margin of 45.13%. Equities research analysts predict that  Taiwan Semiconductor Manufacturing Company Ltd. will post 9.2 earnings per share for the current fiscal year. The business also recently announced a quarterly dividend, which will be paid on Thursday, July 9th. Shareholders of record on Thursday, June 11th will be given a $0.9503 dividend. The ex-dividend date of this dividend is Thursday, June 11th. This represents a $3.80 dividend on an annualized basis and a yield of 1.1%. Taiwan Semiconductor Manufacturing's dividend payout ratio  is presently 28.36%. Hedge funds have recently bought and sold shares of the stock. Childress Capital Advisors LLC increased its stake in shares of  Taiwan Semiconductor Manufacturing by 145.3% during the 3rd quarter. Childress Capital Advisors LLC now owns 3,192 shares of the semiconductor company's stock worth $891,000 after purchasing an additional 1,891 shares during the last quarter.  Shannon River Fund Management LLC acquired a new stake in shares of  Taiwan Semiconductor Manufacturing in the 3rd quarter valued at $2,430,000.  Vanguard Personalized Indexing Management LLC boosted its holdings in  Taiwan Semiconductor Manufacturing by 9.4% in the third quarter. Vanguard Personalized Indexing Management LLC now owns 101,876 shares of the semiconductor company's stock worth $28,470,000 after purchasing an additional 8,738 shares in the last quarter.  Hantz Financial Services Inc. boosted its holdings in  Taiwan Semiconductor Manufacturing by 28.6% in the third quarter. Hantz Financial Services Inc. now owns 37,216 shares of the semiconductor company's stock worth $10,394,000 after purchasing an additional 8,284 shares in the last quarter.  Finally, Hollencrest Capital Management increased its position in  Taiwan Semiconductor Manufacturing by 125.3% during the third quarter. Hollencrest Capital Management now owns 5,216 shares of the semiconductor company's stock worth $1,457,000 after buying an additional 2,901 shares during the last quarter. Hedge funds and other institutional investors own  16.51% of the company's stock. Taiwan Semiconductor Manufacturing Company (TSMC) is a leading pure-play semiconductor foundry that provides wafer fabrication and related services to the global semiconductor industry. Founded in 1987 by Morris Chang and headquartered in Hsinchu, Taiwan, TSMC manufactures integrated circuits on behalf of fabless and integrated device manufacturers, offering contract chip production across a broad set of technologies and products. TSMC's service offering covers logic and mixed-signal process technologies, specialty processes for radio-frequency, power management and embedded memory, and advanced nodes used in mobile, high-performance computing and AI applications. This instant news alert was generated by narrative science technology and financial data from MarketBeat in order to provide readers with the fastest reporting and unbiased coverage. Please send any questions or comments about this story to contact@marketbeat.com. Before you consider Taiwan Semiconductor Manufacturing, you'll want to hear this. MarketBeat keeps track of Wall Street's top-rated and best performing research analysts and the stocks they recommend to their clients on a daily basis. MarketBeat has identified the five stocks that top analysts are quietly whispering to their clients to buy now before the broader market catches on... and Taiwan Semiconductor Manufacturing wasn't on the list. While Taiwan Semiconductor Manufacturing currently has a Buy rating among analysts, top-rated analysts believe these five stocks are better buys. MarketBeat's analysts have just released their top five short plays for April 2026. Learn which stocks have the most short interest and how to trade them. Click the link to see which companies made the list. Sign up for MarketBeat All Access to gain access to MarketBeat's full suite of research tools. 345 N Reid Place, Suite 620, Sioux Falls, SD 57103
                                        
                                        contact@marketbeat.com
                                        
                                        (844) 978-6257 © MarketBeat Media, LLC 2010-2026. All rights reserved. © 2026   Fair market value prices are updated every minute and are provided by Massive. Other market data provided is at least 10-minutes delayed and hosted by Barchart Solutions.  Information is provided 'as-is' and solely for informational purposes, not for trading purposes or advice, and is delayed. To see all exchange delays and terms of use please see Barchart's disclaimer. We and our partners share information on your use of this website to help improve your experience. For more information, or to opt out click the Do Not Sell My Information button below.",https://www.marketbeat.com/instant-alerts/taiwan-semiconductor-manufacturing-nysetsm-shares-up-14-following-insider-buying-activity-2026-03-24/
TSM,"TSMC Hitting Production Capacity Limits, Says Broadcom - Investor's Business Daily",2026-03-24 21:16:00,"Access to this page has been denied because we believe you are using automation tools to browse the
                website. This may happen as a result of the following: Please make sure that Javascript and cookies are enabled on your browser and that you are not blocking
                them from loading. Reference ID: #2caad51e-2813-11f1-920a-76d145c17e8f Powered by
                PerimeterX
                , Inc.",https://www.investors.com/news/technology/tsm-stock-broadcom-avgo-production-constraints/
