ticker,title,date,content,url
TSM,Taiwan Semiconductor Manufacturing Company Ltd. $TSM Shares Sold by PICTET BANK & TRUST Ltd - MarketBeat,2026-04-02 10:35:07,"PICTET BANK & TRUST Ltd lessened its holdings in shares of  Taiwan Semiconductor Manufacturing Company Ltd. (NYSE:TSM - Free Report) by 32.6% in the 4th quarter, according to the company in its most recent 13F filing with the Securities and Exchange Commission. The institutional investor  owned 5,502 shares of the semiconductor company's stock after selling 2,658 shares during the period. Taiwan Semiconductor Manufacturing accounts for approximately  2.0% of PICTET BANK & TRUST Ltd's investment portfolio, making the stock its 21st biggest position. PICTET BANK & TRUST Ltd's holdings in Taiwan Semiconductor Manufacturing were worth $1,672,000 as of its most recent SEC filing. A number of other hedge funds also recently bought and sold shares of TSM. Westfuller Advisors LLC boosted its holdings in shares of  Taiwan Semiconductor Manufacturing by 2.2% during the 3rd quarter. Westfuller Advisors LLC now owns 1,551 shares of the semiconductor company's stock worth $434,000 after purchasing an additional 34 shares during the last quarter.  Sovereign Financial Group Inc. grew its position in shares of  Taiwan Semiconductor Manufacturing by 4.5% in the fourth quarter. Sovereign Financial Group Inc. now owns 793 shares of the semiconductor company's stock valued at $241,000 after purchasing an additional 34 shares in the last quarter.  BankPlus Wealth Management LLC increased its holdings in shares of  Taiwan Semiconductor Manufacturing by 1.6% in the third quarter. BankPlus Wealth Management LLC now owns 2,291 shares of the semiconductor company's stock valued at $640,000 after purchasing an additional 35 shares during the last quarter.  Bank of Jackson Hole Trust lifted its position in  Taiwan Semiconductor Manufacturing by 7.5% during the third quarter. Bank of Jackson Hole Trust now owns 500 shares of the semiconductor company's stock worth $140,000 after buying an additional 35 shares in the last quarter.  Finally, New Millennium Group LLC lifted its position in  Taiwan Semiconductor Manufacturing by 2.9% during the third quarter. New Millennium Group LLC now owns 1,248 shares of the semiconductor company's stock worth $349,000 after buying an additional 35 shares in the last quarter. Institutional investors and hedge funds own  16.51% of the company's stock. Here are the key news stories impacting Taiwan Semiconductor Manufacturing this week: TSM has been the subject of several analyst reports. Wall Street Zen upgraded Taiwan Semiconductor Manufacturing from a ""hold"" rating to a ""buy"" rating in a report on Sunday, March 22nd. The Goldman Sachs Group  reiterated a ""buy"" rating on shares of Taiwan Semiconductor Manufacturing in a report on Monday, January 5th. Citigroup  reissued a ""buy"" rating on shares of Taiwan Semiconductor Manufacturing in a report on Friday, January 9th. UBS Group  set a $330.00 price objective on shares of Taiwan Semiconductor Manufacturing in a research report on Sunday, December 7th. Finally, DA Davidson raised shares of Taiwan Semiconductor Manufacturing to a ""strong-buy"" rating in a research note on Friday, February 13th. Three analysts have rated the stock with a Strong Buy rating, ten have assigned  a Buy rating and two have issued  a Hold rating to the company. Based on data from MarketBeat.com, the company currently has a consensus rating of ""Buy"" and an average price target of $391.43. Get Our Latest Stock Analysis on Taiwan Semiconductor Manufacturing In related news, VP Bor-Zen Tien bought 1,000 shares of the firm's stock in a transaction on Sunday, March 22nd. The shares were bought at an average price of $55.93 per share, with a total value of $55,930.00. Following the completion of the transaction, the vice president directly owned 9,051 shares of the company's stock, valued at $506,222.43. This represents a 12.42% increase in their position. The purchase was disclosed in a legal filing with the Securities & Exchange Commission, which is available at this hyperlink. 1.11% of the stock is owned by insiders. Shares of Taiwan Semiconductor Manufacturing stock opened at $341.84 on Thursday. The stock has a 50 day moving average of $348.86 and a 200 day moving average of $314.51. The company has a debt-to-equity ratio of 0.17, a quick ratio of 2.42 and a current ratio of 2.62. The firm has a market capitalization of $1.77 trillion, a price-to-earnings ratio of 32.10, a PEG ratio of 0.93 and a beta of 1.34. Taiwan Semiconductor Manufacturing Company Ltd. has a fifty-two week low of $134.25 and a fifty-two week high of $390.20. Taiwan Semiconductor Manufacturing (NYSE:TSM - Get Free Report) last posted its earnings results on Thursday, February 26th. The semiconductor company reported $3.11 EPS for the quarter. Taiwan Semiconductor Manufacturing had a return on equity of 34.89% and a net margin of 45.13%.The company had revenue of $30.65 billion for the quarter.  As a group, research analysts predict that  Taiwan Semiconductor Manufacturing Company Ltd. will post 9.2 earnings per share for the current year. The business also recently disclosed a quarterly dividend, which will be paid on Thursday, July 9th. Investors of record on Thursday, June 11th will be issued a $0.9503 dividend. This represents a $3.80 annualized dividend and a yield of 1.1%. The ex-dividend date is Thursday, June 11th. Taiwan Semiconductor Manufacturing's payout ratio is 28.36%. Taiwan Semiconductor Manufacturing Company (TSMC) is a leading pure-play semiconductor foundry that provides wafer fabrication and related services to the global semiconductor industry. Founded in 1987 by Morris Chang and headquartered in Hsinchu, Taiwan, TSMC manufactures integrated circuits on behalf of fabless and integrated device manufacturers, offering contract chip production across a broad set of technologies and products. TSMC's service offering covers logic and mixed-signal process technologies, specialty processes for radio-frequency, power management and embedded memory, and advanced nodes used in mobile, high-performance computing and AI applications. This instant news alert was generated by narrative science technology and financial data from MarketBeat in order to provide readers with the fastest reporting and unbiased coverage. Please send any questions or comments about this story to contact@marketbeat.com. Before you consider Taiwan Semiconductor Manufacturing, you'll want to hear this. MarketBeat keeps track of Wall Street's top-rated and best performing research analysts and the stocks they recommend to their clients on a daily basis. MarketBeat has identified the five stocks that top analysts are quietly whispering to their clients to buy now before the broader market catches on... and Taiwan Semiconductor Manufacturing wasn't on the list. While Taiwan Semiconductor Manufacturing currently has a Buy rating among analysts, top-rated analysts believe these five stocks are better buys. Discover the next wave of investment opportunities with our report, 7 Stocks That Will Be Magnificent in 2026. Explore companies poised to replicate the growth, innovation, and value creation of the tech giants dominating today's markets. Sign up for MarketBeat All Access to gain access to MarketBeat's full suite of research tools. 345 N Reid Place, Suite 620, Sioux Falls, SD 57103
                                        
                                        contact@marketbeat.com
                                        
                                        (844) 978-6257 © MarketBeat Media, LLC 2010-2026. All rights reserved. © 2026   Fair market value prices are updated every minute and are provided by Massive. Other market data provided is at least 10-minutes delayed and hosted by Barchart Solutions.  Information is provided 'as-is' and solely for informational purposes, not for trading purposes or advice, and is delayed. To see all exchange delays and terms of use please see Barchart's disclaimer. Enter your email below to receive daily updates and analyst ratings for Taiwan Semiconductor Manufacturing and related companies from The Early Bird. We and our partners share information on your use of this website to help improve your experience. For more information, or to opt out click the Do Not Sell My Information button below.",https://www.marketbeat.com/instant-alerts/filing-taiwan-semiconductor-manufacturing-company-ltd-tsm-shares-sold-by-pictet-bank-trust-ltd-2026-04-02/
TSM,"Brookstone Capital Management Purchases 4,155 Shares of Taiwan Semiconductor Manufacturing Company Ltd. $TSM - Defense World",2026-04-02 10:09:31,"Posted by Defense World Staff on Apr 2nd, 2026
Armament technology updates Brookstone Capital Management increased its position in shares of  Taiwan Semiconductor Manufacturing Company Ltd. (NYSE:TSM – Free Report) by 35.4% during the fourth quarter, according to the company in its most recent disclosure with the Securities and Exchange Commission. The firm owned 15,877 shares of the semiconductor company’s stock after purchasing an additional 4,155 shares during the period. Brookstone Capital Management’s holdings in Taiwan Semiconductor Manufacturing were worth $4,825,000 at the end of the most recent reporting period. Investing A number of other large investors have also modified their holdings of TSM. Brighton Jones LLC raised its stake in shares of  Taiwan Semiconductor Manufacturing by 20.9% in the 4th quarter. Brighton Jones LLC now owns 10,930 shares of the semiconductor company’s stock valued at $2,159,000 after buying an additional 1,892 shares in the last quarter.  Wellspring Financial Advisors LLC bought a new position in shares of  Taiwan Semiconductor Manufacturing during the 2nd quarter worth about $218,000.  Beacon Pointe Advisors LLC boosted its position in shares of  Taiwan Semiconductor Manufacturing by 1.4% during the 2nd quarter. Beacon Pointe Advisors LLC now owns 17,726 shares of the semiconductor company’s stock valued at $4,015,000 after acquiring an additional 251 shares in the last quarter.  Berbice Capital Management LLC boosted its position in shares of  Taiwan Semiconductor Manufacturing by 11.3% during the 2nd quarter. Berbice Capital Management LLC now owns 6,650 shares of the semiconductor company’s stock valued at $1,506,000 after acquiring an additional 673 shares in the last quarter.  Finally, Twin Peaks Wealth Advisors LLC bought a new stake in  Taiwan Semiconductor Manufacturing in the second quarter valued at about $278,000. 16.51% of the stock is currently owned by institutional investors and hedge funds. In other Taiwan Semiconductor Manufacturing news, VP Bor-Zen Tien acquired 1,000 shares of the business’s stock in a transaction on Sunday, March 22nd. The stock was purchased at an average price of $55.93 per share, for a total transaction of $55,930.00. Following the transaction, the vice president owned 9,051 shares in the company, valued at $506,222.43. This trade represents a 12.42% increase in their position. The transaction was disclosed in a legal filing with the Securities & Exchange Commission, which is available through the SEC website. 1.11% of the stock is owned by corporate insiders. Stock market news Check Out Our Latest Stock Report on Taiwan Semiconductor Manufacturing Shares of TSM stock opened at $341.84 on Thursday. The company has a market capitalization of $1.77 trillion, a P/E ratio of 32.10, a P/E/G ratio of 0.93 and a beta of 1.34. Taiwan Semiconductor Manufacturing Company Ltd. has a 12-month low of $134.25 and a 12-month high of $390.20. The company has a quick ratio of 2.42, a current ratio of 2.62 and a debt-to-equity ratio of 0.17. The firm has a 50-day moving average price of $348.86 and a 200 day moving average price of $314.51. Taiwan Semiconductor Manufacturing (NYSE:TSM – Get Free Report) last issued its quarterly earnings data on Thursday, February 26th. The semiconductor company reported $3.11 earnings per share for the quarter. The firm had revenue of $30.65 billion for the quarter. Taiwan Semiconductor Manufacturing had a net margin of 45.13% and a return on equity of 34.89%.  Research analysts forecast that  Taiwan Semiconductor Manufacturing Company Ltd. will post 9.2 earnings per share for the current fiscal year. The firm also recently declared a quarterly dividend, which will be paid on Thursday, July 9th. Investors of record on Thursday, June 11th will be given a dividend of $0.9503 per share. The ex-dividend date is Thursday, June 11th. This represents a $3.80 dividend on an annualized basis and a yield of 1.1%. Taiwan Semiconductor Manufacturing’s dividend payout ratio  is 28.36%. Here are the key news stories impacting Taiwan Semiconductor Manufacturing this week: Taiwan Semiconductor Manufacturing Company (TSMC) is a leading pure-play semiconductor foundry that provides wafer fabrication and related services to the global semiconductor industry. Founded in 1987 by Morris Chang and headquartered in Hsinchu, Taiwan, TSMC manufactures  integrated circuits on behalf of fabless and integrated device manufacturers, offering contract  chip production across a broad set of technologies and products. TSMC’s service offering covers logic and mixed-signal process technologies, specialty processes for radio-frequency, power management and embedded memory, and advanced nodes used in mobile, high-performance computing and AI applications. Receive News & Ratings for Taiwan Semiconductor Manufacturing Daily - Enter your email address below to receive a concise daily summary of the latest news and analysts' ratings for Taiwan Semiconductor Manufacturing and related companies with MarketBeat.com's FREE daily email newsletter. Empirical Financial Services LLC d.b.a. Empirical Wealth Management Increases Stock Holdings in Taiwan Semiconductor Manufacturing Company Ltd. $TSM Compagnie Lombard Odier SCmA Decreases Stock Position in Waste Management, Inc. $WM",https://www.defenseworld.net/2026/04/02/brookstone-capital-management-purchases-4155-shares-of-taiwan-semiconductor-manufacturing-company-ltd-tsm.html
TSM,Capital Advisors Inc. OK Has $1.79 Million Position in Taiwan Semiconductor Manufacturing Company Ltd. $TSM - Defense World,2026-04-02 09:34:25,"Posted by Defense World Staff on Apr 2nd, 2026 Capital Advisors Inc. OK lifted its holdings in  Taiwan Semiconductor Manufacturing Company Ltd. (NYSE:TSM – Free Report) by 67.8% during the fourth quarter, according to its most recent Form 13F filing with the SEC. The firm owned 5,904 shares of the semiconductor company’s stock after purchasing an additional 2,386 shares during the period. Capital Advisors Inc. OK’s holdings in Taiwan Semiconductor Manufacturing were worth $1,794,000 as of its most recent filing with the SEC. Several other large investors have also made changes to their positions in TSM. Stephens Consulting LLC grew its holdings in  Taiwan Semiconductor Manufacturing by 82.0% in the 4th quarter. Stephens Consulting LLC now owns 91 shares of the semiconductor company’s stock valued at $28,000 after buying an additional 41 shares during the last quarter.  Heartwood Wealth Advisors LLC acquired a new position in shares of  Taiwan Semiconductor Manufacturing during the third quarter worth approximately $32,000.  Resources Management Corp CT ADV bought a new stake in shares of  Taiwan Semiconductor Manufacturing in the second quarter valued at approximately $32,000.  Cedar Wealth Management LLC boosted its position in shares of  Taiwan Semiconductor Manufacturing by 91.4% in the third quarter. Cedar Wealth Management LLC now owns 134 shares of the semiconductor company’s stock valued at $37,000 after acquiring an additional 64 shares during the period.  Finally, Westend Capital Management LLC grew its stake in shares of  Taiwan Semiconductor Manufacturing by 476.2% in the fourth quarter. Westend Capital Management LLC now owns 121 shares of the semiconductor company’s stock worth $37,000 after acquiring an additional 100 shares during the last quarter. Institutional investors and hedge funds own  16.51% of the company’s stock. In other Taiwan Semiconductor Manufacturing news, VP Bor-Zen Tien acquired 1,000 shares of Taiwan Semiconductor Manufacturing stock in a transaction dated Sunday, March 22nd. The stock was bought at an average cost of $55.93 per share, with a total value of $55,930.00. Following the acquisition, the vice president owned 9,051 shares of the company’s stock, valued at approximately $506,222.43. The trade was a 12.42% increase in their ownership of the stock. The purchase was disclosed in a legal filing with the Securities & Exchange Commission, which is available through the SEC website. Insiders own  1.11% of the company’s stock. Taiwan Semiconductor Manufacturing (NYSE:TSM – Get Free Report) last issued its earnings results on Thursday, February 26th. The semiconductor company reported $3.11 EPS for the quarter. The business had revenue of $30.65 billion during the quarter. Taiwan Semiconductor Manufacturing had a return on equity of 34.89% and a net margin of 45.13%. Sell-side analysts predict that  Taiwan Semiconductor Manufacturing Company Ltd. will post 9.2 earnings per share for the current year. The firm also recently disclosed a quarterly dividend, which will be paid on Thursday, July 9th. Stockholders of record on Thursday, June 11th will be paid a $0.9503 dividend. The ex-dividend date is Thursday, June 11th. This represents a $3.80 dividend on an annualized basis and a dividend yield of 1.1%. Taiwan Semiconductor Manufacturing’s dividend payout ratio  is currently 28.36%. A number of brokerages recently issued reports on TSM. Dbs Bank raised shares of Taiwan Semiconductor Manufacturing to a “moderate buy” rating in a research report on Friday, January 23rd. Argus upgraded shares of Taiwan Semiconductor Manufacturing to a “strong-buy” rating in a research report on Thursday, January 15th. Zacks Research downgraded shares of Taiwan Semiconductor Manufacturing from a “strong-buy” rating to a “hold” rating in a report on Monday, March 16th. Sanford C. Bernstein  reaffirmed an “outperform” rating on shares of Taiwan Semiconductor Manufacturing in a research report on Friday, January 2nd. Finally, Citigroup  reiterated a “buy” rating on shares of Taiwan Semiconductor Manufacturing in a research note on Friday, January 9th. Three research analysts have rated the stock with a Strong Buy rating, ten have given a Buy rating and two have issued  a Hold rating to the stock. According to data from MarketBeat, Taiwan Semiconductor Manufacturing  has a consensus rating of “Buy” and an average price target of $391.43. Here are the key news stories impacting Taiwan Semiconductor Manufacturing this week: Taiwan Semiconductor Manufacturing Company (TSMC) is a leading pure-play semiconductor foundry that provides wafer fabrication and related services to the global semiconductor industry. Founded in 1987 by Morris Chang and headquartered in Hsinchu, Taiwan, TSMC manufactures integrated circuits on behalf of fabless and integrated device manufacturers, offering contract chip production across a broad set of technologies and products. TSMC’s service offering covers logic and mixed-signal process technologies, specialty processes for radio-frequency, power management and embedded memory, and advanced nodes used in mobile, high-performance computing and AI applications. Receive News & Ratings for Taiwan Semiconductor Manufacturing Daily - Enter your email address below to receive a concise daily summary of the latest news and analysts' ratings for Taiwan Semiconductor Manufacturing and related companies with MarketBeat.com's FREE daily email newsletter. Enzi Wealth Lowers Stake in iShares Core S&P 500 ETF $IVV Capital Advisors Inc. OK Sells 1,889 Shares of UnitedHealth Group Incorporated $UNH",https://www.defenseworld.net/2026/04/02/capital-advisors-inc-ok-has-1-79-million-position-in-taiwan-semiconductor-manufacturing-company-ltd-tsm.html
TSM,"Analysts Are Bullish on Top Technology Stocks: nCino (NCNO), Oracle (ORCL) - The Globe and Mail",2026-04-02 09:34:16,"There’s a lot to be optimistic about in the Technology sector as 3 analysts just weighed in on nCino (NCNO), Oracle (ORCL) and TSMC (TSM) with bullish sentiments. William Blair analyst Christopher Kennedy reiterated a Buy rating on nCino today. The company’s shares closed last Tuesday at $14.98. According to TipRanks.com, Kennedy has currently 0 stars on a ranking scale of 0-5 stars, with an average return of  -9.6% and a 33.3% success rate. Kennedy covers the Technology sector, focusing on stocks such as Jack Henry & Associates, Fidelity National Info, and Euronet Worldwide. ;'> The word on The Street in general, suggests a Moderate Buy analyst consensus rating for nCino with a $25.67 average price target, implying a 75.7% upside from current levels. In a report released today, Barclays also maintained a Buy rating on the stock with a $22.00 price target. Barclays analyst Raimo Lenschow maintained a Buy rating on Oracle today and set a price target of $240.00. The company’s shares closed last Tuesday at $147.11. According to TipRanks.com, Lenschow ‘s ranking currently consits of 0 on a 0-5 ranking scale, with an average return of  -2.5% and a 45.0% success rate. Lenschow covers the Technology sector, focusing on stocks such as The Descartes Systems Group, DoubleVerify Holdings, and DigitalOcean Holdings. ;'> Oracle has an analyst consensus of Strong Buy, with a price target consensus of $245.11, implying a 74.7% upside from current levels. In a report issued on March 28, TipRanks – Google also upgraded the stock to Buy with a $157.00 price target. In a report released today, Simon Coles from Barclays maintained a Buy rating on TSMC, with a price target of $450.00. The company’s shares closed last Tuesday at $337.95. Coles has an average return of  58.1% when recommending TSMC. ;'> According to TipRanks.com, Coles is ranked #3130 out of 12128 analysts. The word on The Street in general, suggests a Strong Buy analyst consensus rating for TSMC with a $423.50 average price target, representing a 31.4% upside. In a report issued on March 23, Bank of America Securities also reiterated a Buy rating on the stock with a $470.00 price target. All market data (will open in new tab) is provided by Barchart Solutions. Copyright © 2026. Information is provided 'as is' and solely for informational purposes, not for trading purposes or advice. For exchange delays and terms of use, please read disclaimer (will open in new tab).",https://www.theglobeandmail.com/investing/markets/stocks/TSM/pressreleases/1109085/analysts-are-bullish-on-top-technology-stocks-ncino-ncno-oracle-orcl/
