ticker,title,date,content,url
TSM,Top Manufacturing Stocks To Watch Now - May 1st - MarketBeat,2026-05-01 19:03:21,"Taiwan Semiconductor Manufacturing, Applied Materials, MKS, Jabil, Astrazeneca, Phillips 66,  and Fabrinet are the seven Manufacturing stocks to watch today, according to MarketBeat's stock screener tool. Manufacturing stocks are shares of publicly traded companies whose core business is producing physical goods—such as autos, machinery, electronics, chemicals, and consumer durables—often involving factories, supply chains, and significant capital equipment. For investors, these stocks tend to be cyclical and sensitive to economic growth, commodity and labor costs, and capital expenditure cycles, so analysis focuses on order backlogs, margins, inventory levels, and exposure to trade or input‑price risks. These companies had the highest dollar trading volume of any Manufacturing stocks within the last several days. Taiwan Semiconductor Manufacturing Company Limited, together with its subsidiaries, manufactures, packages, tests, and sells integrated circuits and other semiconductor devices in Taiwan, China, Europe, the Middle East, Africa, Japan, the United States, and internationally. It provides a range of wafer fabrication processes, including processes to manufacture complementary metal- oxide-semiconductor (CMOS) logic, mixed-signal, radio frequency, embedded memory, bipolar CMOS mixed-signal, and others. Applied Materials, Inc. engages in the provision of manufacturing equipment, services, and software to the semiconductor, display, and related industries. The company operates through three segments: Semiconductor Systems, Applied Global Services, and Display and Adjacent Markets. The Semiconductor Systems segment develops, manufactures, and sells various manufacturing equipment that is used to fabricate semiconductor chips or integrated circuits. MKS Instruments, Inc. provides foundational technology solutions to semiconductor manufacturing, electronics and packaging, and specialty industrial applications in the United States, Germany, China, South Korea, and internationally. It operates through Vacuum Solutions Division (VSD), Photonics Solutions Division (PSD), and Material Solutions Division (MSD) segments. Jabil Inc. provides manufacturing services and solutions worldwide. It operates in two segments, Electronics Manufacturing Services and Diversified Manufacturing Services. The company offers electronics design, production, and product management services; electronic circuit design services, such as application-specific integrated circuit design, firmware development, and rapid prototyping services; and designs plastic and metal enclosures that include the electro-mechanics, such as the printed circuit board assemblies (PCBA). AstraZeneca PLC, a biopharmaceutical company, focuses on the discovery, development, manufacturing, and commercialization of prescription medicines. Its marketed products include Calquence, Enhertu, Faslodex, Imfinzi, Iressa, Koselugo, Lumoxiti, Lynparza, Orpathys, Tagrisso, and Zoladex for oncology; Brilinta/Brilique, Bydureon/Byetta, BCise, Byetta, Crestor, Evrenzo, Farxiga/Forxiga, Komboglyze/Kombiglyze XR, Lokelma, Onglyza, Qtern, and Xigduo/Xigduo XR for cardiovascular, renal, and metabolism diseases; Bevespi Aerosphere, Breztri Aerosphere, Daliresp/Daxas, Duaklir Genuair, Fasenra, Pulmicort, Saphnelo, Symbicort, and Tudorza/Eklira/Bretaris for respiratory and immunology; and Andexxa/Ondexxya, Kanuma, Soliris, Strensiq, and Ultomiris for rare diseases. Phillips 66 operates as an energy manufacturing and logistics company in the United States, the United Kingdom, Germany, and internationally. It operates through four segments: Midstream, Chemicals, Refining, and Marketing and Specialties (M&S). The Midstream segment transports crude oil and other feedstocks; delivers refined petroleum products to market; provides terminaling and storage services for crude oil and refined petroleum products; transports, stores, fractionates, exports, and markets natural gas liquids; provides other fee-based processing services; and gathers, processes, transports, and markets natural gas. Fabrinet provides optical packaging and precision optical, electro-mechanical, and electronic manufacturing services in North America, the Asia-Pacific, and Europe. The company offers a range of advanced optical and electro-mechanical capabilities in the manufacturing process, including process design and engineering, supply chain management, manufacturing, printed circuit board assembly, advanced packaging, integration, final assembly, and testing. This instant news alert was generated by narrative science technology and financial data from MarketBeat in order to provide readers with the fastest reporting and unbiased coverage. Please send any questions or comments about this story to contact@marketbeat.com. Before you consider Taiwan Semiconductor Manufacturing, you'll want to hear this. MarketBeat keeps track of Wall Street's top-rated and best performing research analysts and the stocks they recommend to their clients on a daily basis. MarketBeat has identified the five stocks that top analysts are quietly whispering to their clients to buy now before the broader market catches on... and Taiwan Semiconductor Manufacturing wasn't on the list. While Taiwan Semiconductor Manufacturing currently has a Buy rating among analysts, top-rated analysts believe these five stocks are better buys. Unlock the timeless value of gold with our exclusive 2026 Gold Forecasting Report. Explore why gold remains the ultimate investment for safeguarding wealth against inflation, economic shifts, and global uncertainties. Whether you're planning for future generations or seeking a reliable asset in turbulent times, this report is your essential guide to making informed decisions. Sign up for MarketBeat All Access to gain access to MarketBeat's full suite of research tools. 345 N Reid Place, Suite 620, Sioux Falls, SD 57103
                                        
                                        contact@marketbeat.com
                                        
                                        (844) 978-6257 © MarketBeat Media, LLC 2010-2026. All rights reserved. © 2026   Fair market value prices are updated every minute and are provided by Massive. Other market data provided is at least 10-minutes delayed and hosted by Barchart Solutions.  Information is provided 'as-is' and solely for informational purposes, not for trading purposes or advice, and is delayed. To see all exchange delays and terms of use please see Barchart's disclaimer. Enter your email below to receive daily updates and analyst ratings for Taiwan Semiconductor Manufacturing and related companies from Earnings360.com. We and our partners share information on your use of this website to help improve your experience. For more information, or to opt out click the Do Not Sell My Information button below.",https://www.marketbeat.com/instant-alerts/top-manufacturing-stocks-to-watch-now-may-1st-2026-05-01/
TSM,This Billionaire is Loading Up On Taiwan Semiconductor (TSM) Despite Geopolitical Risks - Yahoo Finance,2026-05-01 13:33:44,"Tip: Try a valid symbol or a specific company name for relevant results The above button links to Coinbase. Yahoo Finance is not a broker-dealer or investment adviser and does not offer securities or cryptocurrencies for sale or facilitate trading. Coinbase pays us for certain activity generated through this link. Prices displayed are informational. We just covered Here is How Billionaire Philippe Laffont’s Top 10 Picks Crushed The Market. Taiwan Semiconductor (NYSE:TSM) ranks #1 (see the Here is How Billionaire Philippe Laffont’s Top 5 Picks Crushed The Market). Taiwan Semiconductor (NYSE:TSM) shares recently jumped after regulators in Taiwan eased limitations that would reportedly allow fund managers to increase their exposure to the stock. The stock is up 123% over the past year as investors look past Taiwan-related geopolitical risks and focus on the company's AI moat. Taiwan Semiconductor (NYSE:TSM) is among the top beneficiaries of the rising AI CapEx that is likely to touch $700 billion. Why? TSM has about 62% of the total foundry market and over 90% of the market for advanced nodes (7nm and below). Taiwan Semiconductor’s (NYSE:TSM) customers don’t switch because finding other chip foundries is extremely hard, if not impossible. Apple relies on Taiwan Semiconductor (NYSE:TSM) for chips, including for A-series and M-series. Taiwan Semiconductor makes AI GPUs for Nvidia used in data centers. AMD, Qualcomm, Broadcom, MediaTek and Marvell also rely on it for production. Read what a Broadcom executive recently said about the demand Taiwan Semiconductor (NYSE:TSM) is facing here. Taiwan Semiconductor Manufacturing (NYSE:TSM) has raised its capital expenditure forecast to $56 billion for 2026 and plans $165 billion in US investments over the next few years. Its moat and high-capacity production make it an attractive buy for the long term despite its gains. Montaka Global Investments stated the following regarding Taiwan Semiconductor Manufacturing Company Limited (NYSE:TSM) in its Q1 2026 investor letter: “We also acquired Taiwan Semiconductor Manufacturing Company Limited (NYSE:TSM) – more commonly known as TSMC – the world’s effective monopolist in AI semiconductor fabrication. Given Montaka’s deep work in AI over many years, we’ve been following this company for some time. We had previously opted against investing in TSMC because of (Click Here to Read the Letter in Detail).” While we acknowledge the potential of TSM as an investment, we believe certain AI stocks offer greater upside potential and carry less downside risk. If you're looking for an extremely undervalued AI stock that also stands to benefit significantly from Trump-era tariffs and the onshoring trend, see our free report on the best short-term AI stock. READ NEXT: 33 Stocks That Should Double in 3 Years and Cathie Wood 2026 Portfolio: 10 Best Stocks to Buy. Disclosure: None. Follow Insider Monkey on Google News. Tip: Try a valid symbol or a specific company name for relevant results",https://finance.yahoo.com/markets/stocks/articles/billionaire-loading-taiwan-semiconductor-tsm-133344342.html
TSM,Verity Asset Management Inc. Trims Stock Holdings in Taiwan Semiconductor Manufacturing Company Ltd. $TSM - MarketBeat,2026-05-01 13:13:16,"Verity Asset Management Inc. lessened its holdings in shares of  Taiwan Semiconductor Manufacturing Company Ltd. (NYSE:TSM - Free Report) by 73.9% in the fourth quarter, according to the company in its most recent filing with the Securities & Exchange Commission. The institutional investor  owned 781 shares of the semiconductor company's stock after selling 2,207 shares during the quarter. Verity Asset Management Inc.'s holdings in Taiwan Semiconductor Manufacturing were worth $237,000 at the end of the most recent quarter. Several other hedge funds and other institutional investors also recently bought and sold shares of TSM. Jennison Associates LLC raised its position in shares of  Taiwan Semiconductor Manufacturing by 6.4% in the 4th quarter. Jennison Associates LLC now owns 13,394,299 shares of the semiconductor company's stock valued at $4,070,393,000 after purchasing an additional 802,757 shares in the last quarter.  Cannon Capital Management Inc. acquired a new stake in shares of  Taiwan Semiconductor Manufacturing during the fourth quarter worth approximately $887,000.  Heritage Investment Group Inc. bought a new stake in shares of  Taiwan Semiconductor Manufacturing in the fourth quarter worth $222,000.  Wagner Wealth Management LLC raised its holdings in  Taiwan Semiconductor Manufacturing by 28.6% in the fourth quarter. Wagner Wealth Management LLC now owns 2,250 shares of the semiconductor company's stock valued at $684,000 after acquiring an additional 501 shares in the last quarter.  Finally, W.G. Shaheen & Associates DBA Whitney & Co raised its holdings in  Taiwan Semiconductor Manufacturing by 0.7% in the fourth quarter. W.G. Shaheen & Associates DBA Whitney & Co now owns 38,560 shares of the semiconductor company's stock valued at $11,718,000 after acquiring an additional 277 shares in the last quarter. 16.51% of the stock is currently owned by hedge funds and other institutional investors. Several brokerages have weighed in on TSM. Sanford C. Bernstein  reissued an ""outperform"" rating on shares of Taiwan Semiconductor Manufacturing in a report on Friday, January 2nd. Dbs Bank upgraded shares of Taiwan Semiconductor Manufacturing to a ""moderate buy"" rating in a research note on Friday, January 23rd. The Goldman Sachs Group  reaffirmed a ""buy"" rating on shares of Taiwan Semiconductor Manufacturing in a research report on Monday, January 5th. Needham & Company LLC lifted their price target on Taiwan Semiconductor Manufacturing from $410.00 to $480.00 and gave the stock a ""buy"" rating in a research note on Thursday, April 16th. Finally, Argus raised Taiwan Semiconductor Manufacturing to a ""strong-buy"" rating in a report on Thursday, January 15th. Two investment analysts have rated the stock with a Strong Buy rating, eleven have given a Buy rating and two have given a Hold rating to the company's stock. According to MarketBeat.com, Taiwan Semiconductor Manufacturing  has a consensus rating of ""Buy"" and a consensus price target of $404.29. Read Our Latest Stock Report on Taiwan Semiconductor Manufacturing Here are the key news stories impacting Taiwan Semiconductor Manufacturing this week: TSM stock opened at $396.37 on Friday. The company has a debt-to-equity ratio of 0.17, a current ratio of 2.51 and a quick ratio of 2.32. Taiwan Semiconductor Manufacturing Company Ltd. has a 1-year low of $170.59 and a 1-year high of $414.50. The firm has a fifty day moving average price of $359.03 and a two-hundred day moving average price of $327.65. The firm has a market cap of $2.05 trillion, a price-to-earnings ratio of 32.98, a PEG ratio of 1.15 and a beta of 1.35. Taiwan Semiconductor Manufacturing (NYSE:TSM - Get Free Report) last posted its quarterly earnings results on Tuesday, February 10th. The semiconductor company reported $3.11 earnings per share (EPS) for the quarter. Taiwan Semiconductor Manufacturing had a net margin of 46.97% and a return on equity of 38.17%. The company had revenue of $30.65 billion for the quarter.  Research analysts predict that  Taiwan Semiconductor Manufacturing Company Ltd. will post 15.24 EPS for the current year. The firm also recently announced a quarterly dividend, which will be paid on Thursday, July 9th. Shareholders of record on Thursday, June 11th will be issued a $0.9503 dividend. The ex-dividend date of this dividend is Thursday, June 11th. This represents a $3.80 dividend on an annualized basis and a yield of 1.0%. Taiwan Semiconductor Manufacturing's dividend payout ratio (DPR) is currently 24.71%. In related news, VP Bor-Zen Tien bought 1,000 shares of the firm's stock in a transaction on Sunday, March 22nd. The stock was bought at an average cost of $55.93 per share, for a total transaction of $55,930.00. Following the completion of the purchase, the vice president directly owned 9,051 shares in the company, valued at approximately $506,222.43. The trade was a 12.42% increase in their position. The purchase was disclosed in a legal filing with the Securities & Exchange Commission, which is accessible through the SEC website. 1.11% of the stock is owned by corporate insiders. Taiwan Semiconductor Manufacturing Company (TSMC) is a leading pure-play semiconductor foundry that provides wafer fabrication and related services to the global semiconductor industry. Founded in 1987 by Morris Chang and headquartered in Hsinchu, Taiwan, TSMC manufactures integrated circuits on behalf of fabless and integrated device manufacturers, offering contract chip production across a broad set of technologies and products. TSMC's service offering covers logic and mixed-signal process technologies, specialty processes for radio-frequency, power management and embedded memory, and advanced nodes used in mobile, high-performance computing and AI applications. This instant news alert was generated by narrative science technology and financial data from MarketBeat in order to provide readers with the fastest reporting and unbiased coverage. Please send any questions or comments about this story to contact@marketbeat.com. Before you consider Taiwan Semiconductor Manufacturing, you'll want to hear this. MarketBeat keeps track of Wall Street's top-rated and best performing research analysts and the stocks they recommend to their clients on a daily basis. MarketBeat has identified the five stocks that top analysts are quietly whispering to their clients to buy now before the broader market catches on... and Taiwan Semiconductor Manufacturing wasn't on the list. While Taiwan Semiconductor Manufacturing currently has a Buy rating among analysts, top-rated analysts believe these five stocks are better buys. Looking to profit from the electric vehicle mega-trend? Click the link to see our list of which EV stocks show the most long-term potential. Sign up for MarketBeat All Access to gain access to MarketBeat's full suite of research tools. 345 N Reid Place, Suite 620, Sioux Falls, SD 57103
                                        
                                        contact@marketbeat.com
                                        
                                        (844) 978-6257 © MarketBeat Media, LLC 2010-2026. All rights reserved. © 2026   Fair market value prices are updated every minute and are provided by Massive. Other market data provided is at least 10-minutes delayed and hosted by Barchart Solutions.  Information is provided 'as-is' and solely for informational purposes, not for trading purposes or advice, and is delayed. To see all exchange delays and terms of use please see Barchart's disclaimer. We and our partners share information on your use of this website to help improve your experience. For more information, or to opt out click the Do Not Sell My Information button below.",https://www.marketbeat.com/instant-alerts/filing-verity-asset-management-inc-trims-stock-holdings-in-taiwan-semiconductor-manufacturing-company-ltd-tsm-2026-05-01/
TSM,Taiwan Semiconductor Manufacturing Company Ltd. (TSM) is Attracting Investor Attention: Here is What You Should Know - Yahoo Finance,2026-05-01 13:00:07,"Tip: Try a valid symbol or a specific company name for relevant results The above button links to Coinbase. Yahoo Finance is not a broker-dealer or investment adviser and does not offer securities or cryptocurrencies for sale or facilitate trading. Coinbase pays us for certain activity generated through this link. Prices displayed are informational. TSMC (TSM) has been one of the most searched-for stocks on Zacks.com lately. So, you might want to look at some of the facts that could shape the stock's performance in the near term. Over the past month, shares of this chip company have returned +16.8%, compared to the Zacks S&P 500 composite's +12.2% change. During this period, the Zacks Semiconductor - Circuit Foundry industry, which TSMC falls in, has gained 17.2%. The key question now is: What could be the stock's future direction? Although media reports or rumors about a significant change in a company's business prospects usually cause its stock to trend and lead to an immediate price change, there are always certain fundamental factors that ultimately drive the buy-and-hold decision. Rather than focusing on anything else, we at Zacks prioritize evaluating the change in a company's earnings projection. This is because we believe the fair value for its stock is determined by the present value of its future stream of earnings. Our analysis is essentially based on how sell-side analysts covering the stock are revising their earnings estimates to take the latest business trends into account. When earnings estimates for a company go up, the fair value for its stock goes up as well. And when a stock's fair value is higher than its current market price, investors tend to buy the stock, resulting in its price moving upward. Because of this, empirical studies indicate a strong correlation between trends in earnings estimate revisions and short-term stock price movements. TSMC is expected to post earnings of $3.66 per share for the current quarter, representing a year-over-year change of +48.2%. Over the last 30 days, the Zacks Consensus Estimate has changed +4%. For the current fiscal year, the consensus earnings estimate of $15.24 points to a change of +43.1% from the prior year. Over the last 30 days, this estimate has changed +6.1%. For the next fiscal year, the consensus earnings estimate of $18.97 indicates a change of +24.5% from what TSMC is expected to report a year ago. Over the past month, the estimate has changed +7.4%. With an impressive externally audited track record, our proprietary stock rating tool -- the Zacks Rank -- is a more conclusive indicator of a stock's near-term price performance, as it effectively harnesses the power of earnings estimate revisions. The size of the recent change in the consensus estimate, along with three other factors related to earnings estimates, has resulted in a Zacks Rank #3 (Hold) for TSMC. The chart below shows the evolution of the company's forward 12-month consensus EPS estimate: Even though a company's earnings growth is arguably the best indicator of its financial health, nothing much happens if it cannot raise its revenues. It's almost impossible for a company to grow its earnings without growing its revenue for long periods. Therefore, knowing a company's potential revenue growth is crucial. For TSMC, the consensus sales estimate for the current quarter of $39.76 billion indicates a year-over-year change of +32.2%. For the current and next fiscal years, $161.65 billion and $204.14 billion estimates indicate +32% and +26.3% changes, respectively. TSMC reported revenues of $35.9 billion in the last reported quarter, representing a year-over-year change of +40.6%. EPS of $3.49 for the same period compares with $2.12 a year ago. Compared to the Zacks Consensus Estimate of $35.5 billion, the reported revenues represent a surprise of +1.13%. The EPS surprise was +5.44%. The company beat consensus EPS estimates in each of the trailing four quarters. The company topped consensus revenue estimates each time over this period. Without considering a stock's valuation, no investment decision can be efficient. In predicting a stock's future price performance, it's crucial to determine whether its current price correctly reflects the intrinsic value of the underlying business and the company's growth prospects. While comparing the current values of a company's valuation multiples, such as price-to-earnings (P/E), price-to-sales (P/S), and price-to-cash flow (P/CF), with its own historical values helps determine whether its stock is fairly valued, overvalued, or undervalued, comparing the company relative to its peers on these parameters gives a good sense of the reasonability of the stock's price. As part of the Zacks Style Scores system, the Zacks Value Style Score (which evaluates both traditional and unconventional valuation metrics) organizes stocks into five groups ranging from A to F (A is better than B; B is better than C; and so on), making it helpful in identifying whether a stock is overvalued, rightly valued, or temporarily undervalued. TSMC is graded D on this front, indicating that it is trading at a premium to its peers. Click here to see the values of some of the valuation metrics that have driven this grade. The facts discussed here and much other information on Zacks.com might help determine whether or not it's worthwhile paying attention to the market buzz about TSMC. However, its Zacks Rank #3 does suggest that it may perform in line with the broader market in the near term. Want the latest recommendations from Zacks Investment Research? Today, you can download 7 Best Stocks for the Next 30 Days. Click to get this free report Taiwan Semiconductor Manufacturing Company Ltd. (TSM) : Free Stock Analysis Report This article originally published on Zacks Investment Research (zacks.com). Tip: Try a valid symbol or a specific company name for relevant results",https://finance.yahoo.com/markets/stocks/articles/taiwan-semiconductor-manufacturing-company-ltd-130007228.html
TSM,TSM Stock Bolts Into A Buy Zone With AI Trade Back In Focus - Investor's Business Daily,2026-05-01 12:00:00,"Access to this page has been denied because we believe you are using automation tools to browse the
                website. This may happen as a result of the following: Please make sure that Javascript and cookies are enabled on your browser and that you are not blocking
                them from loading. Reference ID: #f2f605ae-4690-11f1-9c72-90a686a62be2 Powered by
                PerimeterX
                , Inc.",https://www.investors.com/stock-lists/sector-leaders/tsm-stock-tsmc-taiwan-semiconductor-chip-ai-trade-tech-markets/
