ticker,title,date,content,url
TSM,Taiwan Semiconductor (TSM) Secures Three-Decade Renewable Energy Agreement Amid Stock Decline - parameter.io,2026-04-30 15:34:53,"Taiwan Semiconductor Manufacturing (TSM) has finalized an extensive three-decade electricity procurement agreement with Northland Power, securing the complete energy output from Taiwan’s Hai Long 2A offshore wind installation. This latest contract builds upon a renewable energy partnership established between the companies in 2022. Taiwan Semiconductor Manufacturing Company Limited, TSM The Hai Long 2A facility represents a 294-megawatt offshore wind installation positioned between 45 and 70 kilometers from Changhua’s coastline in the Taiwan Strait. This marks TSMC’s third procurement agreement within the Hai Long development, following existing contracts for power from the 2B and 3 installations. The comprehensive Hai Long wind development encompasses three separate sites with a collective gross generation capacity reaching 1,022 megawatts. Development responsibilities are shared among Northland Power (30.6% stake), Mitsui & Co. (40% ownership), and Gentari International Renewables (29.4% interest). Implementation of the electricity supply arrangement will commence upon finalization of regulatory approvals, anticipated to occur in late 2026. Northland Power’s CEO Christine Healy emphasized that this contract “strengthens the project’s enduring financial viability” while delivering meaningful value for the company’s stakeholders. For TSMC, this procurement strategy aligns with its sustained effort to obtain renewable electricity sources as energy requirements for AI-focused semiconductor manufacturing continue their upward trajectory. The foundry controls approximately 70% of the worldwide advanced chip manufacturing market as of 2025. A TrendForce analysis released on April 30 highlighted ongoing constraints in semiconductor production infrastructure. The primary challenge stems from limited availability of CoWoS packaging capabilities, a critical technology for manufacturing the sophisticated processors required for AI systems. TSMC maintains exclusive production capabilities for 3-nanometer process technology and plays a pivotal role in developing 2-nanometer manufacturing. Industry analysts don’t anticipate relief from CoWoS capacity limitations until 2027 at the earliest, despite ongoing expansion initiatives. Major technology companies such as Apple, NVIDIA, and AMD are all vying for constrained production capacity. With artificial intelligence computing requirements continuing to surge, questions persist regarding TSMC’s capacity expansion timeline. TSM shares currently change hands at $393.83. According to GuruFocus’s proprietary GF Value metric — designed to estimate fundamental worth — the stock’s fair value sits at $273.09, suggesting shares trade at a 44.2% premium relative to this analytical framework. The company’s trailing twelve-month price-to-earnings multiple registers at 32.72x, significantly elevated compared to its five-year median of 22.78x. GuruFocus assigns TSM a modest Valuation ranking of 5 on a 10-point scale. However, the semiconductor manufacturer demonstrates exceptional performance in other analytical dimensions. It achieves perfect 10/10 scores in both Profitability and Growth categories, alongside a 9/10 rating for Financial Strength. The comprehensive GF Score totals 97 out of 100. Corporate insider transactions during the most recent three-month period reflect $827,355 in stock acquisitions with zero documented sales. TSM equity has declined 54% across the preceding six-month period and currently hovers near its 52-week price minimum. InvestingPro’s analysis suggests the stock may be undervalued at present levels — a perspective that directly contradicts the GuruFocus valuation framework. Discover top-performing stocks in AI, Crypto, and Technology with expert analysis. Futures & Crypto Trader  Sharing charts, strategies, & mindset tips to help you level up  Not Financial Advice Follow on X @Pro_Trader_Edge DraftKings and Bet365 dominate online gambling, but ZunaBet launched in 2026 with crypto payments, 11,000+ games, and transparent rewards. Full comparison. Parameter is a publication which covers AI, Tech, Finance, Crypto and more. Type above and press Enter to search. Press Esc to cancel. Free AI Stock Analysis & Portfolio Monitoring, FREE!",https://parameter.io/taiwan-semiconductor-tsm-secures-three-decade-renewable-energy-agreement-amid-stock-decline/
TSM,Taiwan Semiconductor (TSM) Secures Three-Decade Renewable Energy Agreement Amid Market Turbulence - Blockonomi,2026-04-30 15:30:42,"Taiwan Semiconductor Manufacturing (TSM) has finalized a comprehensive 30-year energy procurement contract with Northland Power, securing the complete electricity generation from the Hai Long 2A offshore wind facility situated off Taiwan’s coast. This arrangement marks a significant expansion of the partnership between these entities, which was originally established in 2022. Taiwan Semiconductor Manufacturing Company Limited, TSM The Hai Long 2A installation represents a 294-megawatt offshore wind generation facility positioned approximately 45 to 70 kilometers from Changhua’s coastline within the Taiwan Strait. This newest agreement complements TSMC’s existing power procurement arrangements with the Hai Long 2B and 3 installations, marking the third component of the semiconductor giant’s renewable energy strategy with this development. The comprehensive Hai Long initiative boasts a total gross generation capacity reaching 1,022 megawatts. Development responsibilities are shared among Northland Power (controlling 30.6%), Mitsui & Co. (holding 40%), and Gentari International Renewables (with 29.4%). The contract becomes operational once administrative formalities conclude, anticipated to occur in late 2026. Northland’s CEO Christine Healy noted the agreement “strengthens the project’s long-term financial viability” while advancing value generation for the company’s stakeholder base. For TSMC, this contract underscores its sustained commitment to obtaining renewable energy sources as electricity requirements from AI-focused semiconductor manufacturing continue their upward trajectory. The corporation commands approximately 70% of the worldwide advanced foundry sector as of 2025. A market analysis from TrendForce released on April 30 highlighted ongoing constraints within semiconductor production infrastructure. The primary challenge centers on limited availability of CoWoS packaging capabilities, which remain indispensable for manufacturing sophisticated chips deployed in AI systems. TSMC maintains exclusive control over 3nm fabrication processes and serves as a pivotal participant in developing 2nm technology. Industry analysts don’t anticipate relief from the CoWoS capacity shortage until 2027 at the earliest, despite the company’s ongoing expansion initiatives. Key customers such as Apple, NVIDIA, and AMD continue vying for constrained manufacturing capacity. Given the persistent acceleration in AI computing requirements, questions persist regarding TSMC’s capability to scale production sufficiently. TSM shares currently trade at $393.83. The GuruFocus platform calculates its GF Value — representing estimated intrinsic value — at $273.09, indicating shares command a 44.2% premium relative to this analytical framework’s fair value determination. The company’s trailing twelve-month price-to-earnings multiple registers at 32.72x, significantly exceeding its five-year median of 22.78x. GuruFocus assigns TSM a modest Valuation ranking of 5 out of 10. However, the semiconductor manufacturer demonstrates exceptional performance across alternative metrics. It achieves perfect 10/10 scores in both Profitability and Growth categories, alongside a 9/10 Financial Strength rating. The composite GF Score reaches 97 out of 100. Corporate insider transactions during the preceding three-month period reveal $827,355 in share acquisitions with zero reported dispositions. TSM equity has declined 54% throughout the past half-year and currently trades in proximity to its 52-week minimum. InvestingPro’s analysis suggests the stock may be undervalued at present levels — a perspective that sharply contradicts the GuruFocus valuation framework. Discover top-performing stocks in AI, Crypto, and Technology with expert analysis. Futures & Crypto Trader  Sharing charts, strategies, & mindset tips to help you level up  Not Financial Advice Follow on X @Pro_Trader_Edge Type above and press Enter to search. Press Esc to cancel. ZunaBet New Crypto Casino: 250% Bonus & 75 Free Casino Spins, Claim!",https://blockonomi.com/taiwan-semiconductor-tsm-secures-three-decade-renewable-energy-agreement-amid-market-turbulence/
TSM,Taiwan Semiconductor (TSM) Stock Signs 30-Year Wind Power Deal With Northland Power - CoinCentral,2026-04-30 15:18:48,"Taiwan Semiconductor Manufacturing (TSM) has signed a new 30-year power deal with Northland Power, locking in 100% of the output from the Hai Long 2A offshore wind site in Taiwan. The agreement expands an existing relationship between the two companies that dates back to 2022. Taiwan Semiconductor Manufacturing Company Limited, TSM Hai Long 2A is a 294-megawatt offshore wind site located roughly 45 to 70 kilometers off the Changhua coast in the Taiwan Strait. TSMC already buys power from the Hai Long 2B and 3 sites, making this the third leg of its renewable energy commitment with the project. The full Hai Long project carries a combined gross capacity of 1,022 megawatts. It is being developed by Northland Power (30.6%), Mitsui & Co. (40%), and Gentari International Renewables (29.4%). The deal takes effect following the completion of administrative procedures expected later in 2026. Northland CEO Christine Healy said the agreement “enhances the project’s long-term economic fundamentals” and contributes to value creation for Northland’s investors. For TSMC, the deal reflects its ongoing push to secure renewable energy as power demand from AI-driven chip production continues to climb. The company holds roughly 70% of the global advanced foundry market as of 2025. A TrendForce report published April 30 flagged persistent bottlenecks in semiconductor manufacturing. The core issue is a shortage in CoWoS packaging technology, which is essential for producing the kind of advanced chips used in AI systems. TSMC is the sole supplier of 3nm processes and a critical player in the 2nm pipeline. The CoWoS shortage is not expected to ease until at least 2027, even as the company works to expand capacity. Major clients including Apple, NVIDIA, and AMD all compete for limited production slots. With AI compute demand still accelerating, TSMC’s ability to scale fast enough remains a live question. TSM is currently trading at $393.83. GuruFocus puts its GF Value — an estimate of intrinsic worth — at $273.09, which means the stock is trading at a 44.2% premium to that model’s fair value. The trailing twelve-month P/E ratio stands at 32.72x, well above the five-year median of 22.78x. GuruFocus gives TSM a Valuation rank of just 5 out of 10. That said, the company scores near the top in other areas. It holds a 10/10 in both Profitability and Growth, and a 9/10 in Financial Strength. The GF Score overall is 97 out of 100. Insider activity over the past three months shows $827,355 in purchases with no reported sales. TSM stock is down 54% over the past six months and sitting near its 52-week low. InvestingPro has flagged the stock as potentially undervalued at current levels — a view that sits in direct contrast to the GuruFocus model. A new month means new opportunities. Our analysts have just released their top stock picks for April, highlighting companies with strong momentum that rank highly on our KO Score algorithm. We’re also now sharing trade ideas for both long-term and short-term investors, giving you more ways to spot potential opportunities in the market. Sign up to Knockout Stocks today and get 50% off to unlock the full list and see which stocks made the cut. Use coupon code Special50 for your exclusive discount! Discover top-performing stocks in AI, Crypto, and Technology with expert analysis. Futures & Crypto Trader 
 Sharing charts, strategies, & mindset tips to help you level up
 Not Financial Advice
Follow on X @Pro_Trader_Edge Two platforms have defined online gambling in their respective markets more than any others. DraftKings… Never Miss Another Opportunity. Get hand selected news & info from our Crypto Experts so you can make educated, informed decisions that directly affect your crypto profits! Type above and press Enter to search. Press Esc to cancel. ZunaBet New Crypto Casino: 250% Bonus & 75 Free Casino Spins, Claim!",https://coincentral.com/taiwan-semiconductor-tsm-stock-signs-30-year-wind-power-deal-with-northland-power/
TSM,Taiwan Semiconductor Manufacturing Company Ltd. $TSM Shares Sold by Delta Investment Management LLC - MarketBeat,2026-04-30 14:16:17,"Delta Investment Management LLC cut its position in shares of  Taiwan Semiconductor Manufacturing Company Ltd. (NYSE:TSM - Free Report) by 12.2% during the fourth quarter, according to its most recent Form 13F filing with the Securities and Exchange Commission (SEC). The firm owned 19,041 shares of the semiconductor company's stock after selling 2,651 shares during the period. Taiwan Semiconductor Manufacturing makes up   1.0% of Delta Investment Management LLC's holdings, making the stock its 27th biggest holding. Delta Investment Management LLC's holdings in Taiwan Semiconductor Manufacturing were worth $5,786,000 at the end of the most recent quarter. Other hedge funds and other institutional investors have also made changes to their positions in the company. Brighton Jones LLC raised its position in  Taiwan Semiconductor Manufacturing by 20.9% in the fourth quarter. Brighton Jones LLC now owns 10,930 shares of the semiconductor company's stock valued at $2,159,000 after purchasing an additional 1,892 shares during the period.  Gamco Investors INC. ET AL acquired a new position in  Taiwan Semiconductor Manufacturing in the second quarter valued at about $701,000.  Bank of Nova Scotia boosted its stake in  Taiwan Semiconductor Manufacturing by 12.8% during the second quarter. Bank of Nova Scotia now owns 15,697 shares of the semiconductor company's stock worth $3,556,000 after buying an additional 1,784 shares during the period.  FWL Investment Management LLC increased its position in shares of  Taiwan Semiconductor Manufacturing by 26.5% during the second quarter. FWL Investment Management LLC now owns 253 shares of the semiconductor company's stock valued at $57,000 after acquiring an additional 53 shares during the last quarter.  Finally, Main Street Financial Solutions LLC purchased a new stake in shares of  Taiwan Semiconductor Manufacturing in the 2nd quarter valued at approximately $270,000. Institutional investors and hedge funds own  16.51% of the company's stock. In other Taiwan Semiconductor Manufacturing news, VP Bor-Zen Tien bought 1,000 shares of Taiwan Semiconductor Manufacturing stock in a transaction dated Sunday, March 22nd. The stock was acquired at an average cost of $55.93 per share, with a total value of $55,930.00. Following the completion of the acquisition, the vice president owned 9,051 shares of the company's stock, valued at approximately $506,222.43. This represents a 12.42% increase in their ownership of the stock. The purchase was disclosed in a filing with the Securities & Exchange Commission, which is accessible through this hyperlink. Corporate insiders own  1.11% of the company's stock. TSM stock traded down $3.99 during midday trading on Thursday, reaching $389.85. 1,739,080 shares of the company were exchanged, compared to its average volume of 13,884,817. Taiwan Semiconductor Manufacturing Company Ltd. has a 1-year low of $170.59 and a 1-year high of $414.50. The company has a debt-to-equity ratio of 0.17, a quick ratio of 2.32 and a current ratio of 2.51. The company has a market cap of $2.02 trillion, a price-to-earnings ratio of 32.58, a price-to-earnings-growth ratio of 1.20 and a beta of 1.35. The stock's 50-day simple moving average is $358.31 and its 200 day simple moving average is $327.17. Taiwan Semiconductor Manufacturing (NYSE:TSM - Get Free Report) last released its quarterly earnings results on Tuesday, February 10th. The semiconductor company reported $3.11 earnings per share (EPS) for the quarter. Taiwan Semiconductor Manufacturing had a return on equity of 38.17% and a net margin of 46.97%.The firm had revenue of $30.65 billion for the quarter.  On average, equities analysts forecast that  Taiwan Semiconductor Manufacturing Company Ltd. will post 15.1 earnings per share for the current year. The firm also recently disclosed a quarterly dividend, which will be paid on Thursday, July 9th. Shareholders of record on Thursday, June 11th will be given a dividend of $0.9503 per share. This represents a $3.80 annualized dividend and a yield of 1.0%. The ex-dividend date of this dividend is Thursday, June 11th. Taiwan Semiconductor Manufacturing's dividend payout ratio (DPR) is presently 24.96%. Here are the key news stories impacting Taiwan Semiconductor Manufacturing this week: Several analysts recently weighed in on the stock. Dbs Bank upgraded shares of Taiwan Semiconductor Manufacturing to a ""moderate buy"" rating in a report on Friday, January 23rd. TD Cowen boosted their price objective on Taiwan Semiconductor Manufacturing from $325.00 to $370.00 and gave the company a ""hold"" rating in a report on Friday, January 16th. Weiss Ratings raised Taiwan Semiconductor Manufacturing from a ""hold (c+)"" rating to a ""buy (b-)"" rating in a research report on Friday, March 20th. Wedbush  reissued an ""outperform"" rating on shares of Taiwan Semiconductor Manufacturing in a research note on Wednesday, February 11th. Finally, Barclays upped their target price on shares of Taiwan Semiconductor Manufacturing from $450.00 to $470.00 and gave the stock an ""overweight"" rating in a research note on Wednesday, April 22nd. Two analysts have rated the stock with a Strong Buy rating, eleven have assigned  a Buy rating and two have issued  a Hold rating to the company. According to data from MarketBeat, Taiwan Semiconductor Manufacturing  has an average rating of ""Buy"" and an average price target of $404.29. Read Our Latest Research Report on Taiwan Semiconductor Manufacturing Taiwan Semiconductor Manufacturing Company (TSMC) is a leading pure-play semiconductor foundry that provides wafer fabrication and related services to the global semiconductor industry. Founded in 1987 by Morris Chang and headquartered in Hsinchu, Taiwan, TSMC manufactures integrated circuits on behalf of fabless and integrated device manufacturers, offering contract chip production across a broad set of technologies and products. TSMC's service offering covers logic and mixed-signal process technologies, specialty processes for radio-frequency, power management and embedded memory, and advanced nodes used in mobile, high-performance computing and AI applications. This instant news alert was generated by narrative science technology and financial data from MarketBeat in order to provide readers with the fastest reporting and unbiased coverage. Please send any questions or comments about this story to contact@marketbeat.com. Before you consider Taiwan Semiconductor Manufacturing, you'll want to hear this. MarketBeat keeps track of Wall Street's top-rated and best performing research analysts and the stocks they recommend to their clients on a daily basis. MarketBeat has identified the five stocks that top analysts are quietly whispering to their clients to buy now before the broader market catches on... and Taiwan Semiconductor Manufacturing wasn't on the list. While Taiwan Semiconductor Manufacturing currently has a Buy rating among analysts, top-rated analysts believe these five stocks are better buys. With the proliferation of data centers and electric vehicles, the electric grid will only get more strained. Download this report to learn how energy stocks can play a role in your portfolio as the global demand for energy continues to grow. Sign up for MarketBeat All Access to gain access to MarketBeat's full suite of research tools. 345 N Reid Place, Suite 620, Sioux Falls, SD 57103
                                        
                                        contact@marketbeat.com
                                        
                                        (844) 978-6257 © MarketBeat Media, LLC 2010-2026. All rights reserved. © 2026   Fair market value prices are updated every minute and are provided by Massive. Other market data provided is at least 10-minutes delayed and hosted by Barchart Solutions.  Information is provided 'as-is' and solely for informational purposes, not for trading purposes or advice, and is delayed. To see all exchange delays and terms of use please see Barchart's disclaimer. We and our partners share information on your use of this website to help improve your experience. For more information, or to opt out click the Do Not Sell My Information button below.",https://www.marketbeat.com/instant-alerts/filing-taiwan-semiconductor-manufacturing-company-ltd-tsm-shares-sold-by-delta-investment-management-llc-2026-04-30/
