ticker,title,date,content,url
TSM,"If the Market Crashes, I'm Buying These 3 Stocks Before the Dust Settles - The Globe and Mail",2026-05-02 16:35:00,"Despite the chip industry’s best efforts, TSMC still handles about two-thirds of global silicon production. Streaming outfit Roku continues to quietly march forward, further cementing its place in people’s living rooms. Chip designer Arm Holdings has a bunch of revenue lined up that isn’t quite yet reportable. April's market rally may have fully unwound February's and March's sell-offs. However, between steep valuations and a mixed start to the first-quarter earnings season, at least some investors are rethinking things again. Another correction may well be the market's next order of business. Don't sweat a steep sell-off too much. In fact, if a pullback is in the cards, it'll be a long-term buying opportunity. Will AI create the world's first trillionaire? Our team just released a report on the one little-known company, called an ""Indispensable Monopoly"" providing the critical technology Nvidia and Intel both need. Continue » Here's a closer look at three names to consider buying if any sweeping bearishness reels in the recent rallies that have made them overpriced for newcomers. You're certainly familiar with chipmakers like Qualcomm and Nvidia. But did you know that semiconductor companies make little to none of their own silicon? It's true! Most of them outsource this equipment- and labor-intensive work to third-party contract manufacturers like Taiwan Semiconductor Manufacturing(NYSE: TSM). Indeed, despite the chip industry's efforts to wean itself from dependence on the company, Counterpoint Research says that TSMC alone still accounts for more than two-thirds of the global foundry business. As long as demand for artificial intelligence processing chips remains insatiable, TSMC will thrive. That's why this ticker has made surprisingly consistent bullish progress since late 2022, when the launch of OpenAI's ChatGPT started an AI hardware race. There's nothing wrong with paying a premium for a quality stock. If you can hold out for the pullback that history says is coming sooner or later, though, this ticker's been a reliably good one to buy on a dip. Streaming technology outfit Roku(NASDAQ: ROKU) might be one of the market's best-kept secrets, as well as one of its most misunderstood names. Yes, its fate and fortune are tethered to the streaming business's; the company also operates its own streaming channel. By and large, its role means it wins regardless of which streaming services are falling in and out of favor. You only need to look at last quarter's results to see it. Roku's Q1 revenue was up 22% year over year, driving a 27% improvement in gross profit. People are now engaged with their streaming tech almost like they are with their mobile phones, which is a rather resilient relationship. Finally, add Arm Holdings(NASDAQ: ARM) to your list of stocks to buy if a marketwide sell-off dials back some of its recent 70% run-up from its mid-March low. It's already peeled back some from its April 24 peak, but it's still priced at more than 100 times this year's projected profit of around $1.80 per share. You may know it as just another chipmaker. However, it's distinctly different from Intel or Nvidia, in that -- until very recently -- it only designed chip architecture, and then licensed its power-efficient intellectual property out to chip designers like Apple, Nvidia, and Qualcomm. Arm has recently made a number of major agreements, including deals with Meta Platforms and OpenAI, that aren't showing up on the top line yet. This is in addition to existing, ongoing agreements with Amazon, Alphabet's Google, and others. Its reportable business boom is brewing. However, patient investors might want to hold out for a better price. Before you buy stock in Taiwan Semiconductor Manufacturing, consider this: The Motley Fool Stock Advisor analyst team just identified what they believe are the 10 best stocks for investors to buy now… and Taiwan Semiconductor Manufacturing wasn’t one of them. The 10 stocks that made the cut could produce monster returns in the coming years. Consider when Netflix made this list on December 17, 2004... if you invested $1,000 at the time of our recommendation, you’d have $496,473!* Or when Nvidia made this list on April 15, 2005... if you invested $1,000 at the time of our recommendation, you’d have $1,216,605!* Now, it’s worth noting Stock Advisor’s total average return is 968% — a market-crushing outperformance compared to 202% for the S&P 500. Don't miss the latest top 10 list, available with Stock Advisor, and join an investing community built by individual investors for individual investors. James Brumley has positions in Alphabet. The Motley Fool has positions in and recommends Alphabet, Amazon, Apple, Intel, Meta Platforms, Nvidia, Qualcomm, Roku, and Taiwan Semiconductor Manufacturing. The Motley Fool has a disclosure policy. All market data (will open in new tab) is provided by Barchart Solutions. Copyright © 2026. Information is provided 'as is' and solely for informational purposes, not for trading purposes or advice. For exchange delays and terms of use, please read disclaimer (will open in new tab).",https://www.theglobeandmail.com/investing/markets/stocks/TSM/pressreleases/1666958/if-the-market-crashes-im-buying-these-3-stocks-before-the-dust-settles/
TSM,Taiwan Semiconductor (TSM): Top 10 Stock that Billionaire Druckenmiller and Jim Cramer Like - Insider Monkey,2026-05-02 14:43:16,"Taiwan Semiconductor Manufacturing Company Limited (NYSE:TSM) is one of the Stocks that Billionaire Druckenmiller and Jim Cramer like. On April, 22,2026, Cadence (CDNS) deepened its partnership with Taiwan Semiconductor Manufacturing Company Limited (NYSE:TSM) to expedite AI semiconductor development. Under the partnership agreement, Cadence provides comprehensive design infrastructure and certified flows for Taiwan Semiconductor Manufacturing Company Limited (NYSE:TSM)’s N3, N2, A16, and A14 nodes. These advancements streamline processes for high-performance computing in addition to reducing design cycles for complex chiplet and 3D-IC architectures. In another development that day, Taiwan Semiconductor Manufacturing Company Limited (NYSE:TSM) presented its new A13 process at the 2026 North America Technology Symposium. Scheduled for production in 2029, the company says that the new process is a direct shrink of the A14 node. Taiwan Semiconductor Manufacturing Company Limited (NYSE:TSM) claims that the technology offers 6% area savings and enhanced power efficiency for AI and mobile applications. The A13 is fully backward compatible with A14 design rules and enables rapid migration to advanced nanosheet transistors. Taiwan Semiconductor Manufacturing Company Limited (NYSE:TSM) forms a significant 3.91% of Druckenmiller’s portfolio. In response to a caller inquiring about the stock’s growth, Cramer made the following statement in April 2026. I like TSM very, very much. I think it’s terrific. I remember when it reported last week, the stock went down on a perfectly good quarter. I came in here, I said, listen, I like that quarter. I looked real bad for about 48 minutes, and that’s about it. Taiwan Semi is a very good situation. Founded in 1987, Taiwan Semiconductor Manufacturing Company Limited (NYSE:TSM) is the world’s leading dedicated semiconductor foundry. Based in Taiwan, the company carries on the business of manufacturing and selling integrated circuits and wafer semiconductor devices. While we acknowledge the risk and potential of TSM as an investment, our conviction lies in the belief that some AI stocks hold greater promise for delivering higher returns and doing so within a shorter time frame. If you are looking for an AI stock that is more promising than TSM and that has 10,000% upside potential, check out our report about this cheapest AI stock. READ NEXT: 10 New Contenders for S&P 500 Index and Harvard University Stock Portfolio: Top 10 Stock Picks. Disclosure: None.  Follow Insider Monkey on Google News. When Jeff Bezos said that one breakthrough technology would shape Amazon’s destiny, even Wall Street’s biggest analysts were caught off guard. Fast forward a year and Amazon’s new CEO Andy Jassy described generative AI as a “once-in-a-lifetime” technology that is already being used across Amazon to reinvent customer experiences. At the 8th Future Investment Initiative conference, Elon Musk predicted that by 2040 there would be at least 10 billion humanoid robots, with each priced between $20,000 and $25,000. Do the math. According to Musk, this technology could be worth $250 trillion by 2040. And here’s the wild part — this $250 trillion wave isn’t tied to one company, but to an entire ecosystem of AI innovators set to reshape the global economy. It’s a leap so massive, it could reshape how businesses, governments, and consumers operate worldwide. Even if that $250 trillion figure sounds ambitious, major firms like PwC and McKinsey still see AI unlocking multi-trillion-dollar potential. The answer lies in a breakthrough so powerful it’s redefining how humanity works, learns, and creates. And this breakthrough has already set off a frenzy among hedge funds and Wall Street’s top investors. What most investors don’t realize is that one under-owned company holds the key to this $250 trillion revolution. In fact, Verge argues this company’s supercheap AI technology should concern rivals. Before I reveal the details, let’s talk about how some of the richest people on the planet are positioning themselves. When billionaires from Silicon Valley to Wall Street line up behind the same idea — you know it’s worth paying attention to. Even as we admire what Tesla, Nvidia, Alphabet, and Microsoft have built, we believe an even greater opportunity lies elsewhere… But the real story isn’t Nvidia — it’s a much smaller company quietly improving the critical technology that makes this entire revolution possible. And judging by what I’m hearing from both Silicon Valley insiders and Wall Street veterans… A few years from now, you’ll wish you’d owned this stock. The best part? You can discover everything about this company and its groundbreaking technology right now. I’ve compiled everything you need to know about this groundbreaking company in a detailed, members-only report. Trust me — you’ll want to read this report before putting another dollar into any tech stock. For a ridiculously low price of just $9.99 a month, you can unlock a year’s worth of in-depth investment research and exclusive insights – that’s less than a single fast food meal! Here’s why this is a deal you can’t afford to pass up: • Access to our Detailed Report on this Game-Changing AI Stock: Our in-depth report dives deep into our #1 AI stock’s groundbreaking technology and massive growth potential. • 11 New Issues of Our Premium Readership Newsletter: You will also receive 11 new issues and at least one new stock pick per month from our monthly newsletter’s portfolio over the next 12 months. These stocks are handpicked by our research director, Dr. Inan Dogan. • One free upcoming issue of our 70+ page Quarterly Newsletter: A value of $149 • Bonus Reports: Premium access to members-only fund manager video interviews • Ad-Free Browsing: Enjoy a year of investment research free from distracting banner and pop-up ads, allowing you to focus on uncovering the next big opportunity. • 30-Day Money-Back Guarantee:  If you’re not absolutely satisfied with our service, we’ll provide a full refund within 30 days, no questions asked. If you’re thinking about getting in, don’t wait – because once Wall Street catches wind of this story, the easy money will be gone. Space is Limited! Only 1000 spots are available for this exclusive offer. Don’t let this chance slip away – subscribe to our Premium Readership Newsletter today and unlock the potential for a life-changing investment. 1. Head over to our website and subscribe to our Premium Readership Newsletter for just $9.99 a month. 2. Enjoy a year of ad-free browsing, exclusive access to our in-depth report on the revolutionary AI company, and the upcoming issues of our Premium Readership Newsletter over the next 12 months. 3. Sit back, relax, and know that you’re backed by our ironclad 30-day money-back guarantee. Don’t miss out on this incredible opportunity! Subscribe now and take control of your AI investment future! No worries about auto-renewals! Our 30-Day Money-Back Guarantee applies whether you’re joining us for the first time or renewing your subscription a month later! Returns since its inception in May 2014 (through February 18th, 2026)",https://www.insidermonkey.com/blog/taiwan-semiconductor-tsm-top-10-stock-that-billionaire-druckenmiller-and-jim-cramer-like-1752656/?amp=1
TSM,Taiwan Semiconductor (TSM): Top 10 Stock that Billionaire Druckenmiller and Jim Cramer Like - Yahoo Finance,2026-05-02 14:35:34,"Tip: Try a valid symbol or a specific company name for relevant results The above button links to Coinbase. Yahoo Finance is not a broker-dealer or investment adviser and does not offer securities or cryptocurrencies for sale or facilitate trading. Coinbase pays us for certain activity generated through this link. Prices displayed are informational. Taiwan Semiconductor Manufacturing Company Limited (NYSE:TSM) is one of the Stocks that Billionaire Druckenmiller and Jim Cramer like. On April, 22,2026, Cadence (CDNS) deepened its partnership with Taiwan Semiconductor Manufacturing Company Limited (NYSE:TSM) to expedite AI semiconductor development. Under the partnership agreement, Cadence provides comprehensive design infrastructure and certified flows for Taiwan Semiconductor Manufacturing Company Limited (NYSE:TSM)’s N3, N2, A16, and A14 nodes. These advancements streamline processes for high-performance computing in addition to reducing design cycles for complex chiplet and 3D-IC architectures. In another development that day, Taiwan Semiconductor Manufacturing Company Limited (NYSE:TSM) presented its new A13 process at the 2026 North America Technology Symposium. Scheduled for production in 2029, the company says that the new process is a direct shrink of the A14 node. Taiwan Semiconductor Manufacturing Company Limited (NYSE:TSM) claims that the technology offers 6% area savings and enhanced power efficiency for AI and mobile applications. The A13 is fully backward compatible with A14 design rules and enables rapid migration to advanced nanosheet transistors. Taiwan Semiconductor Manufacturing Company Limited (NYSE:TSM) forms a significant 3.91% of Druckenmiller’s portfolio. In response to a caller inquiring about the stock’s growth, Cramer made the following statement in April 2026. I like TSM very, very much. I think it’s terrific. I remember when it reported last week, the stock went down on a perfectly good quarter. I came in here, I said, listen, I like that quarter. I looked real bad for about 48 minutes, and that’s about it. Taiwan Semi is a very good situation. Founded in 1987, Taiwan Semiconductor Manufacturing Company Limited (NYSE:TSM) is the world’s leading dedicated semiconductor foundry. Based in Taiwan, the company carries on the business of manufacturing and selling integrated circuits and wafer semiconductor devices. While we acknowledge the potential of TSM as an investment, we believe certain AI stocks offer greater upside potential and carry less downside risk. If you're looking for an extremely undervalued AI stock that also stands to benefit significantly from Trump-era tariffs and the onshoring trend, see our free report on the best short-term AI stock. READ NEXT: 10 New Contenders for S&P 500 Index and Harvard University Stock Portfolio: Top 10 Stock Picks. Disclosure: None. Follow Insider Monkey on Google News. Tip: Try a valid symbol or a specific company name for relevant results",https://finance.yahoo.com/markets/stocks/articles/taiwan-semiconductor-tsm-top-10-143534244.html
TSM,TSMC Stock (TSM) Opinions on Arizona Plant and Earnings Beat - Quiver Quantitative,2026-05-02 14:11:00,"Enter your email to receive free breaking news alerts and insights related to TSM. Backtested trading strategies built on Quiver's datasets Be the first to see our newest insights and key updates across all datasets Track the top-performing stock portfolios held by U.S. politicians in Congress Find stocks with ease across diverse datasets and filters Build and test your own strategies, using Quiver's Congressional trading datasets Build and test your own strategies, using Quiver's Institutional holdings datasets Our video reports and analysis, with early access to exclusive, subscriber-only videos By: Quiver DiscussionTracker Arizona plant plans unveiled: Social media lit up following TSMC's announcement of a new chip packaging facility in Arizona, slated for 2029. Investors viewed the expansion as a key diversification move amid rising U.S. manufacturing demands. The development reinforced perceptions of the company's strategic resilience in the semiconductor supply chain. Q1 earnings surpass expectations: Discussions surged after first-quarter results revealed revenue of $35.9 billion and EPS of $3.49, both exceeding forecasts. Advanced nodes accounted for 74% of wafer revenue, highlighting AI chip momentum. Upward guidance for the next quarter further bolstered confidence in sustained growth. Advanced node roadmap excites: Chatter focused on TSMC's ambitious sub-2nm plans, including A13 and A12 nodes tailored for AI applications by 2029. Enthusiasts contrasted it favorably against competitors' paces. Year-to-date gains over 30% and congressional purchases amplified the optimistic outlook. Note: This discussion summary was generated from an AI condensation of post data. TSMC insiders have traded $TSM stock on the open market 37 times in the past 6 months. Of those trades, 37 have been purchases and 0 have been sales. Here’s a breakdown of recent trading of $TSM stock by insiders over the last 6 months: To track insider transactions, check out Quiver Quantitative's insider trading dashboard. You can access data on insider stock transactions through the Quiver Quantitative API. Members of Congress have traded $TSM stock 9 times in the past 6 months. Of those trades, 8 have been purchases and 1 have been sales. Here’s a breakdown of recent trading of $TSM stock by members of Congress over the last 6 months: To track congressional stock trading, check out Quiver Quantitative's congressional trading dashboard. You can access data on congressional stock trades through the Quiver Quantitative API. We have seen 1,526 institutional investors add shares of TSMC stock to their portfolio, and 1,276 decrease their positions in their most recent quarter. To track hedge funds' stock portfolios, check out Quiver Quantitative's institutional holdings dashboard. You can access data on hedge funds moves and 13F filings through the Quiver Quantitative API. Wall Street analysts have issued reports on $TSM in the last several months. We have seen 1 firms issue buy ratings on the stock, and 0 firms issue sell ratings. To track analyst ratings and price targets for TSMC, check out Quiver Quantitative's $TSM forecast page. Multiple analysts have issued price targets for $TSM recently. We have seen 5 analysts offer price targets for $TSM in the last 6 months, with a median target of $450.0. This article is not financial advice. See Quiver Quantitative's disclaimers for more information. Note that there may be inaccuracies due to mistakes in ticker-mapping, and other anomalies. Add Quiver Quantitative to your preferred sources on Google",https://www.quiverquant.com/news/TSMC+Stock+%28TSM%29+Opinions+on+Arizona+Plant+and+Earnings+Beat
