ticker,title,date,content,url
TSM,Taiwan Semiconductor Manufacturing (TSM): Billionaire Steve Cohen Likes This Chip Stock - Yahoo Finance,2026-04-03 21:44:56,"Tip: Try a valid symbol or a specific company name for relevant results Taiwan Semiconductor Manufacturing Company Limited (NYSE:TSM) is one of the 10 Best Stocks to Invest In According to Billionaire Steve Cohen. Even though Taiwan Semiconductor Manufacturing Company Limited (NYSE:TSM) first appeared in the 13F portfolio of Point72 Asset Management back in 2015, it has not been a consistent feature in the historical portfolio of the fund. 2021 onwards, however, the chip stock has appeared in the holdings constantly. Latest filings, submitted at the end of the fourth quarter of 2025, show that the fund owned 4.6 million shares in the company, up 157% compared to filings for the third quarter of 2025. Previously, the largest stake in the firm by the fund consisted of almost 2.5 million shares, disclosed in the fourth quarter of 2024. READ ALSO: 10 Best Stocks to Buy According to Billionaire Paul Tudor Jones. Hedge funds love Taiwan Semiconductor Manufacturing Company Limited (NYSE:TSM) stock for a variety of reasons. The single most significant catalyst for institutional buying in early 2026 was the official launch of mass production for 2-nanometer chips in January. TSMC is the first in the world to achieve high-volume manufacturing with Gate-All-Around (GAA) transistors at the 2nm node. Hedge funds are focused on the fact that over 50% of 2nm capacity through 2027 has already been pre-ordered by Apple, NVIDIA, and AMD. Wafers for the 2nm node are reportedly priced at $30,000, a 20% premium over the 3nm generation, ensuring massive margin expansion for the company. While we acknowledge the potential of TSM as an investment, we believe certain AI stocks offer greater upside potential and carry less downside risk. If you're looking for an extremely undervalued AI stock that also stands to benefit significantly from Trump-era tariffs and the onshoring trend, see our free report on the best short-term AI stock. READ NEXT: 12 Best Stocks to Buy According to Billionaire David Abrams and 15 Best Stocks to Buy According to Billionaire Seth Klarman. Disclosure: None. Follow Insider Monkey on Google News. Tip: Try a valid symbol or a specific company name for relevant results",https://finance.yahoo.com/markets/stocks/articles/taiwan-semiconductor-manufacturing-tsm-billionaire-214456500.html
TSM,TSMC (TSM) to Launch 3nm Wafer Production at Second Japan Factory in 2028 - Yahoo Finance,2026-04-03 18:01:21,"Tip: Try a valid symbol or a specific company name for relevant results Taiwan Semiconductor Manufacturing Co. Ltd. (NYSE:TSM) is one of the best future stocks to buy for the next 5 years. On April 1, Reuters reported that Taiwan Semiconductor Manufacturing Co. Ltd., or simply TSMC, is set to launch 3-nanometre wafer production at its second factory in Japan in 2028. According to a Taiwanese government filing, the facility will have a monthly capacity of 15,000 12-inch wafers using this advanced process technology. This follows a February meeting between TSMC CEO CC Wei and Japan’s Prime Minister Sanae Takaichi, where the shift toward more sophisticated semiconductor manufacturing was first indicated. This strategy marks an advancement from TSMC’s earlier plans for its Japanese operations, which initially focused on less-advanced nodes. While the first fabrication plant began volume production in late 2024, the total investment for the first two facilities is expected to exceed $20 billion. Reports suggest the second factory alone could require ~$17 billion in investment, though Taiwan Semiconductor Manufacturing Co. Ltd. (NYSE:TSM) has not officially confirmed that specific figure. The venture is managed through Japan Advanced Semiconductor Manufacturing/JASM, a unit established in 2021 with support from Sony Semiconductor Solutions Corporation. Together, these facilities are projected to reach a combined monthly capacity of 100,000 12-inch wafers, spanning a range of technologies from 40-nanometre down to the new 3-nanometre standard. Taiwan Semiconductor Manufacturing Co. Ltd. (NYSE:TSM) is a technology company that develops ICs and other semiconductor devices. Its products are used in HPC, smartphones, IoT, automotive, and consumer electronics. While we acknowledge the potential of TSM as an investment, we believe certain AI stocks offer greater upside potential and carry less downside risk. If you're looking for an extremely undervalued AI stock that also stands to benefit significantly from Trump-era tariffs and the onshoring trend, see our free report on the best short-term AI stock. READ NEXT: 33 Stocks That Should Double in 3 Years and 15 Stocks That Will Make You Rich in 10 Years. Disclosure: None. Follow Insider Monkey on Google News. Tip: Try a valid symbol or a specific company name for relevant results",https://finance.yahoo.com/markets/stocks/articles/tsmc-tsm-launch-3nm-wafer-180121959.html
TSM,History Says Buying Growth Stocks During a Rotation Beats the Market. Here Are 2 to Buy Right Now. - The Globe and Mail,2026-04-03 17:59:52,"The trends in artificial intelligence (AI) infrastructure are working in Broadcom's favor. Taiwan Semiconductor is set to benefit from multiple tech trends in the coming years. The newest Wall Street buzzword is the ""Great Rotation,"" as the market has seen money move out of large-cap artificial intelligence (AI) stocks into value-oriented names and small caps. While it can be tempting to follow Wall Street's lead, investors are typically best served sticking with elite growth stocks during these rotations, not abandoning them. That's especially true when the underlying trends haven't changed. AI infrastructure demand is still growing rapidly, and semiconductors remain the foundation of the data center buildout. Even great stocks can get pulled down when investors reshuffle their portfolios, but that creates opportunity. Will AI create the world's first trillionaire? Our team just released a report on the one little-known company, called an ""Indispensable Monopoly"" providing the critical technology Nvidia and Intel both need. Continue » Two stocks worth pouncing on during this rotation are Broadcom(NASDAQ: AVGO) and Taiwan Semiconductor Manufacturing (NYSE: TSM). Both sit at the heart of the AI buildout, and long-term trends are working in their favor. Meanwhile, the pressure in their stocks has created a great buying opportunity. With the AI infrastructure buildout trending in Broadcom's direction, now is the time to lean into the stock, not rotate out of it. The company is just at the beginning of two powerful trends that are set to power its growth for years to come. The first trend is the growing size of AI chip clusters. Cluster sizes are set to grow to over 1 million chips, which vastly increases the importance of data center networking. The reason for this is simple: If a company is spending tens of billions of dollars on chips, they need those chips to be constantly working together as a unit. If this isn't happening, then their investment is being underutilized. That's why managing this data workflow through networking components, like Ethernet switches, is so important, so chips don't sit idly by. Broadcom is the market leader in data center networking and is thus riding this trend. At the same time, Broadcom is also benefiting from the shift toward custom chips to help power AI workloads. The company is a leader in ASIC (application-specific integrated circuit) technology, helping its customers turn their chip designs into reality. It helped Alphabet develop its popular Tensor Processing Units (TPUs), and it forecast that its AI ASIC revenue will skyrocket to over $100 billion next fiscal year (that's 1.5x times its total company revenue from fiscal 2025!). Custom AI chips are a powerful trend that should continue to take market share over time. One of the biggest beneficiaries of current trends in AI and tech in general is Taiwan Semiconductor Manufacturing. The company has a near-monopoly in the manufacturing of advanced chips, so the more of these types of chips being produced, the better for TSMC. Whether AI workloads are being powered by graphics processing units (GPUs) or AI ASICs, TSMC benefits, as it's manufacturing both. The growing need for high-performance central processing units (CPUs) for agentic AI also helps TSMC. The robotaxi revolution and autonomous vehicles are going to need an assortment of advanced chips, manufactured by guess who. This is just a company that is likely to be at the forefront of every major chip trend over the next decade. Market rotations come and go, but durable growth stories persist. You don't want to try to time every market shift; instead, you want to buy high-quality growth stocks when their valuations are being reset. That's what makes names like Broadcom and TSMC stand out right now. Both companies are integral parts of the AI infrastructure story, and the long-term trends are working in their favor. History suggests these are exactly the kinds of stocks worth leaning into during periods like this one. While value and small-cap stocks are finally gaining some traction, revenue and earnings growth are still the two biggest drivers of stocks over the long haul. That's why you want to jump on these names now. The Motley Fool Stock Advisor analyst team just identified what they believe are the 10 best stocks for investors to buy now… and Broadcom wasn’t one of them. The 10 stocks that made the cut could produce monster returns in the coming years. Consider when Netflix made this list on December 17, 2004... if you invested $1,000 at the time of our recommendation, you’d have $532,066!* Or when Nvidia made this list on April 15, 2005... if you invested $1,000 at the time of our recommendation, you’d have $1,087,496!* Now, it’s worth noting Stock Advisor’s total average return is 926% — a market-crushing outperformance compared to 185% for the S&P 500. Don't miss the latest top 10 list, available with Stock Advisor, and join an investing community built by individual investors for individual investors. Geoffrey Seiler has positions in Alphabet and Broadcom. The Motley Fool has positions in and recommends Alphabet and Taiwan Semiconductor Manufacturing. The Motley Fool recommends Broadcom. The Motley Fool has a disclosure policy. All market data (will open in new tab) is provided by Barchart Solutions. Copyright © 2026. Information is provided 'as is' and solely for informational purposes, not for trading purposes or advice. For exchange delays and terms of use, please read disclaimer (will open in new tab).",https://www.theglobeandmail.com/investing/markets/stocks/TSM/pressreleases/1138265/history-says-buying-growth-stocks-during-a-rotation-beats-the-market-here-are-2-to-buy-right-now/
TSM,Taiwan Semiconductor Manufacturing Company Limited (TSM) is a Buy on Strong AI Chip Demand - Yahoo! Finance Canada,2026-04-03 15:45:14,"Tip: Try a valid symbol or a specific company name for relevant results Taiwan Semiconductor Manufacturing Company Limited (NYSE:TSM) is one of the best blue-chip AI stocks to buy now. On March 30, Citigroup reiterated a Buy rating on Taiwan Semiconductor Manufacturing Company Limited (NYSE:TSM) and raised the price target to NT$2,800 from NT$2,600. According to Citigroup, the company is well-positioned to benefit from the accelerating artificial intelligence chip market. Consequently, the firm expects the company’s earnings per share to increase by 18% in 2027 to NT$130.72 and by 28% in 2028 to NT$165.99. Net profit is also projected to increase to NT$2.43 trillion in 2026 from NT$1.72 trillion in 2025. Revenue is projected to increase in 2026 to NT$5.12 trillion. Citigroup also expects Taiwan Semiconductor’s artificial intelligence revenue to grow by over 100% into 2027. The increase would come on CoWoS’ packaging capacity, growing from 1.3 million wafers in 2026 to 2 million in 2027. The robust revenue and earnings increase would come at the back of N3 and N2 capacity growth. The N2 node is projected to account for 29% of total revenue in 2027, up from 15% in 2026. Citigroup expects Nvidia to become the first A16 customer for its Feynman GPU in 2028, with Google and AWS AI chips migrating to N2 late 2027. Taiwan Semiconductor Manufacturing Company Limited (NYSE:TSM) is the world’s largest independent semiconductor foundry, manufacturing advanced microchips for companies such as Apple, Nvidia, and AMD. It specializes in fabricating chips designed by others for use in smartphones, AI data centers, and automobiles, and holds roughly 72% of the global foundry market. While we acknowledge the potential of TSM as an investment, we believe certain AI stocks offer greater upside potential and carry less downside risk. If you're looking for an extremely undervalued AI stock that also stands to benefit significantly from Trump-era tariffs and the onshoring trend, see our free report on the best short-term AI stock. READ NEXT: Motley Fool’s 10 High-Growth Stock Picks and 7 Single-Digit Stocks With Double-Digit Growth Potential. Disclosure: None. Follow Insider Monkey on Google News. Tip: Try a valid symbol or a specific company name for relevant results",https://ca.finance.yahoo.com/news/taiwan-semiconductor-manufacturing-company-limited-154514989.html
TSM,Taiwan Semiconductor (TSM) Stock: March Revenue Report Could Signal AI Chip Supply Crunch - parameter.io,2026-04-03 14:28:47,"Taiwan Semiconductor Manufacturing (TSM) stands at a critical juncture. The chipmaking giant will unveil its March 2026 monthly sales data on April 10—a release that could reshape investor sentiment around AI semiconductor demand. Taiwan Semiconductor Manufacturing Company Limited, TSM This monthly snapshot will offer unprecedented transparency into whether TSMC can actually deliver on the explosive growth in artificial intelligence chip orders. That equation has grown increasingly complex in recent weeks. For the better part of a year, the semiconductor AI thesis remained straightforward: rising demand translated directly into revenue growth. That narrative is evolving. Production bottlenecks and international tensions now weigh as heavily as order books. Commanding approximately 72% of worldwide foundry capacity, TSMC represents the indispensable backbone of AI chip manufacturing. Industry leaders including Nvidia and Apple rely exclusively on the Taiwanese manufacturer for cutting-edge semiconductor production. Recent financial performance has been robust. TSMC posted 37% year-over-year revenue expansion in January 2026. February registered 22% YoY gains, despite a 21% sequential pullback—a predictable seasonal fluctuation rather than evidence of weakening demand. Together, the opening two months of 2026 delivered nearly 30% year-over-year growth. That momentum sets high expectations for the March announcement. Broadcom hasn’t minced words: TSMC’s manufacturing capabilities represent a genuine supply chain chokepoint. As cloud providers and corporations transition from AI pilots to production-scale deployments, order volume is bumping against TSMC’s physical production ceiling. This capacity squeeze now intersects with mounting geopolitical instability. The expanding Iran situation has compromised energy shipments through the Strait of Hormuz—a strategic waterway carrying approximately 20% of worldwide petroleum and liquefied natural gas. Taiwan depends on imports for roughly 95% of its energy requirements, with natural gas accounting for about 48% of electrical generation. Any interruption to fuel availability directly threatens semiconductor manufacturing operations. Compounding these challenges, helium supplies continue tightening. This noble gas plays an irreplaceable role in chip production processes, and growing scarcity creates additional manufacturing headwinds. Meanwhile, TSMC is aggressively scaling its American operations. The manufacturer has expanded its Arizona commitment to $165 billion, outlining development of 12 wafer fabrication and packaging plants. Capital spending for 2026 is forecast between $52 billion and $56 billion, reflecting both advanced N2 technology deployment costs and worldwide facility buildout. Operating U.S. facilities costs two to three times Taiwan-based production. Nevertheless, Taiwanese component suppliers are committing resources—processing work permits, recruiting domestic personnel, and securing extended contracts despite compressed near-term profitability. First-mover suppliers are offering premium compensation packages to secure skilled workers, wagering that future production volumes will validate current investments. The April 10 revenue release will provide the first substantive evidence of whether TSMC’s infrastructure can match demand trajectory—and whether the Arizona expansion is already generating returns. Discover top-performing stocks in AI, Crypto, and Technology with expert analysis. Futures & Crypto Trader  Sharing charts, strategies, & mindset tips to help you level up  Not Financial Advice Follow on X @Pro_Trader_Edge Discover how ZunaBet became the top Stake.com alternative in 2026 with $5,000 bonuses, 11,000+ games, and 20% rakeback. See what drives the shift. Parameter is a publication which covers AI, Tech, Finance, Crypto and more. Type above and press Enter to search. Press Esc to cancel. Free AI Stock Analysis & Portfolio Monitoring, FREE!",https://parameter.io/taiwan-semiconductor-tsm-stock-march-revenue-report-could-signal-ai-chip-supply-crunch/
TSM,Taiwan Semiconductor (TSM) Stock: March Revenue Report Puts AI Supply Chain in Spotlight - MoneyCheck,2026-04-03 14:25:49,"Taiwan Semiconductor Manufacturing (TSM) stands at a critical juncture. The chipmaking giant releases March 2026 monthly sales data on April 10 — a report that carries unusual weight for investors. Taiwan Semiconductor Manufacturing Company Limited, TSM This upcoming disclosure will provide fresh evidence of whether TSMC can actually meet the explosive demand for AI processors. Answering that question has grown increasingly complex. For an extended period, the semiconductor investment thesis centered on AI was straightforward: rising demand translates to growing revenues. That storyline is evolving. Manufacturing limitations and international tensions now carry equal importance to order volume. Commanding approximately 72% of worldwide foundry market share, TSMC serves as the essential production hub for AI chip manufacturing. Nvidia, Apple, and numerous other technology leaders rely on its cutting-edge fabrication capabilities. Recent financial performance has been robust. January 2026 sales climbed 37% compared to the prior year. February registered 22% year-over-year growth, despite sliding 21% sequentially — a decline attributable to normal calendar effects rather than weakening orders. Taken together, the first two months of 2026 delivered approximately 30% year-over-year revenue expansion. That momentum sets high expectations for the March figures. Broadcom has communicated plainly: TSMC’s production capacity represents a significant constraint. As cloud providers and corporations transition from AI pilot projects to production-scale implementations, order volumes are pressing against TSMC’s physical output limits. This capacity squeeze now intersects with heightened international instability. Current Iran-related conflicts have compromised energy transit through the Strait of Hormuz — a vital passage carrying roughly 20% of worldwide petroleum and liquefied natural gas shipments. Taiwan depends on foreign sources for nearly 95% of energy requirements, with natural gas accounting for approximately 48% of electrical generation. Any interruption to fuel imports creates immediate vulnerability for semiconductor manufacturing operations on the island. Compounding these challenges, helium scarcity continues intensifying. Helium plays an indispensable role in chip production processes, and diminishing supplies create added manufacturing constraints. On the strategic investment front, TSMC is executing an aggressive American expansion. The semiconductor manufacturer has expanded its Arizona program to $165 billion, encompassing plans for 12 wafer fabrication and packaging plants. Capital spending for 2026 is forecast between $52 billion and $56 billion, propelled by expensive N2 process technology investments and international facility buildouts. Operating costs at U.S. facilities run two to three times higher than Taiwanese operations. Nevertheless, Taiwanese component suppliers are committing resources — obtaining work authorization, recruiting American employees, and securing extended contracts despite compressed profit margins initially. Suppliers establishing early presence are providing elevated compensation packages to secure skilled workers, wagering that future production volumes will validate the upfront expenditures. The April 10 revenue release will deliver the first substantive indication of whether TSMC’s manufacturing infrastructure can match demand trajectories — and whether the Arizona investment strategy is already generating returns. Discover top-performing stocks in AI, Crypto, and Technology with expert analysis. Futures & Crypto Trader
 Sharing charts, strategies, & mindset tips to help you level up
 Not Financial Advice
Follow on X @Pro_Trader_Edge There is a well-worn digital path forming in the crypto gambling world. A player sits… Type above and press Enter to search. Press Esc to cancel. No KYC. 70% Rakeback & 10% Cashback, Exclusive Thrill Originals!",https://moneycheck.com/taiwan-semiconductor-tsm-stock-march-revenue-report-puts-ai-supply-chain-in-spotlight/
