ticker,title,date,content,url
TSM,Taiwan Semiconductor Manufacturing (NYSE:TSM) Stock Price Up 1.2% - Still a Buy? - MarketBeat,2026-04-01 21:49:51,"Taiwan Semiconductor Manufacturing Company Ltd. (NYSE:TSM - Get Free Report)'s stock price was up 1.2% during mid-day trading on Wednesday . The stock traded as high as $348.68 and last traded at $341.8380. Approximately 14,842,664 shares changed hands during mid-day trading, an increase of 4% from the average daily volume of 14,207,039 shares. The stock had previously closed at $337.95. Here are the key news stories impacting Taiwan Semiconductor Manufacturing this week: Several equities research analysts have commented on the stock. Needham & Company LLC boosted their target price on shares of Taiwan Semiconductor Manufacturing from $360.00 to $410.00 and gave the stock a ""buy"" rating in a research report on Thursday, January 15th. Argus upgraded shares of Taiwan Semiconductor Manufacturing to a ""strong-buy"" rating in a report on Thursday, January 15th. Freedom Capital upgraded shares of Taiwan Semiconductor Manufacturing to a ""strong-buy"" rating in a research note on Thursday, January 15th. Wall Street Zen raised shares of Taiwan Semiconductor Manufacturing from a ""hold"" rating to a ""buy"" rating in a report on Sunday, March 22nd. Finally, Citigroup  restated a ""buy"" rating on shares of Taiwan Semiconductor Manufacturing in a research report on Friday, January 9th. Three investment analysts have rated the stock with a Strong Buy rating, ten have issued  a Buy rating and two have issued  a Hold rating to the company. Based on data from MarketBeat, the company currently has a consensus rating of ""Buy"" and a consensus target price of $391.43. Read Our Latest Stock Report on Taiwan Semiconductor Manufacturing The company has a debt-to-equity ratio of 0.17, a current ratio of 2.62 and a quick ratio of 2.42. The company has a market capitalization of $1.77 trillion, a PE ratio of 32.10, a P/E/G ratio of 0.87 and a beta of 1.29. The stock has a 50-day simple moving average of $348.54 and a 200 day simple moving average of $314.32. Taiwan Semiconductor Manufacturing (NYSE:TSM - Get Free Report) last announced its quarterly earnings results on Thursday, February 26th. The semiconductor company reported $3.11 earnings per share for the quarter. The business had revenue of $30.65 billion during the quarter. Taiwan Semiconductor Manufacturing had a return on equity of 34.89% and a net margin of 45.13%. Equities analysts anticipate that  Taiwan Semiconductor Manufacturing Company Ltd. will post 9.2 EPS for the current fiscal year. The firm also recently announced a quarterly dividend, which will be paid on Thursday, July 9th. Shareholders of record on Thursday, June 11th will be issued a dividend of $0.9503 per share. This represents a $3.80 annualized dividend and a yield of 1.1%. The ex-dividend date is Thursday, June 11th. Taiwan Semiconductor Manufacturing's dividend payout ratio (DPR) is 28.36%. In other Taiwan Semiconductor Manufacturing news, VP Bor-Zen Tien purchased 1,000 shares of Taiwan Semiconductor Manufacturing stock in a transaction on Sunday, March 22nd. The shares were bought at an average price of $55.93 per share, with a total value of $55,930.00. Following the completion of the acquisition, the vice president directly owned 9,051 shares of the company's stock, valued at approximately $506,222.43. This trade represents a 12.42% increase in their ownership of the stock. The transaction was disclosed in a filing with the Securities & Exchange Commission, which is available through this hyperlink. Insiders own  1.11% of the company's stock. Hedge funds have recently modified their holdings of the business. Mitchell Sinkler & Starr PA raised its holdings in shares of  Taiwan Semiconductor Manufacturing by 1.9% in the fourth quarter. Mitchell Sinkler & Starr PA now owns 1,482 shares of the semiconductor company's stock worth $450,000 after acquiring an additional 28 shares during the last quarter.  Wayfinding Financial LLC boosted its stake in shares of  Taiwan Semiconductor Manufacturing by 2.5% during the fourth quarter. Wayfinding Financial LLC now owns 1,152 shares of the semiconductor company's stock valued at $350,000 after acquiring an additional 28 shares during the last quarter.  Thompson Siegel & Walmsley LLC boosted its stake in shares of  Taiwan Semiconductor Manufacturing by 3.6% during the fourth quarter. Thompson Siegel & Walmsley LLC now owns 868 shares of the semiconductor company's stock valued at $264,000 after acquiring an additional 30 shares during the last quarter.  Oak Harvest Investment Services increased its position in  Taiwan Semiconductor Manufacturing by 2.9% during the 4th quarter. Oak Harvest Investment Services now owns 1,106 shares of the semiconductor company's stock worth $336,000 after purchasing an additional 31 shares in the last quarter.  Finally, Solstein Capital LLC increased its position in  Taiwan Semiconductor Manufacturing by 4.8% during the 4th quarter. Solstein Capital LLC now owns 695 shares of the semiconductor company's stock worth $211,000 after purchasing an additional 32 shares in the last quarter. 16.51% of the stock is owned by hedge funds and other institutional investors. Taiwan Semiconductor Manufacturing Company (TSMC) is a leading pure-play semiconductor foundry that provides wafer fabrication and related services to the global semiconductor industry. Founded in 1987 by Morris Chang and headquartered in Hsinchu, Taiwan, TSMC manufactures integrated circuits on behalf of fabless and integrated device manufacturers, offering contract chip production across a broad set of technologies and products. TSMC's service offering covers logic and mixed-signal process technologies, specialty processes for radio-frequency, power management and embedded memory, and advanced nodes used in mobile, high-performance computing and AI applications. This instant news alert was generated by narrative science technology and financial data from MarketBeat in order to provide readers with the fastest reporting and unbiased coverage. Please send any questions or comments about this story to contact@marketbeat.com. Before you consider Taiwan Semiconductor Manufacturing, you'll want to hear this. MarketBeat keeps track of Wall Street's top-rated and best performing research analysts and the stocks they recommend to their clients on a daily basis. MarketBeat has identified the five stocks that top analysts are quietly whispering to their clients to buy now before the broader market catches on... and Taiwan Semiconductor Manufacturing wasn't on the list. While Taiwan Semiconductor Manufacturing currently has a Buy rating among analysts, top-rated analysts believe these five stocks are better buys. Wondering what the next stocks will be that hit it big, with solid fundamentals? Click the link to see which stocks MarketBeat analysts could become the next blockbuster growth stocks. Sign up for MarketBeat All Access to gain access to MarketBeat's full suite of research tools. 345 N Reid Place, Suite 620, Sioux Falls, SD 57103
                                        
                                        contact@marketbeat.com
                                        
                                        (844) 978-6257 © MarketBeat Media, LLC 2010-2026. All rights reserved. © 2026   Fair market value prices are updated every minute and are provided by Massive. Other market data provided is at least 10-minutes delayed and hosted by Barchart Solutions.  Information is provided 'as-is' and solely for informational purposes, not for trading purposes or advice, and is delayed. To see all exchange delays and terms of use please see Barchart's disclaimer. We and our partners share information on your use of this website to help improve your experience. For more information, or to opt out click the Do Not Sell My Information button below.",https://www.marketbeat.com/instant-alerts/taiwan-semiconductor-manufacturing-nysetsm-stock-price-up-12-still-a-buy-2026-04-01/
TSM,"Taiwan Semiconductor Options Spot-On: On April 1st, 137.46K Contracts Were Traded, With 1.63 Million Open Interest - 富途牛牛",2026-04-01 20:54:30,"On April 1st ET, $Taiwan Semiconductor (TSM.US)$ had active options trading, with a total trading volume of 137.46K options for the day, of which put options accounted for 38.14% of the total transactions, and call options accounted for 61.86%. It shows that as of the close of the day, the open interest of $Taiwan Semiconductor (TSM.US)$, indicating options positions have not been closed, totaled about 1.63 million contracts, which was 102.24% of the average of the past 30 trading days. When $Taiwan Semiconductor (TSM.US)$ was trading at $348.20, the call option with $395.00 of strike price expiring on April 24th,2026 transacted 3,564 contracts. It ranked first among $Taiwan Semiconductor (TSM.US)$ unusual option trades of the day and reflected $944.46K turnover. Additionally, in terms of the total trading volume for the day, the most active option contract of $Taiwan Semiconductor (TSM.US)$ achieved 10,721 volume and closed at $15.13. Select the top 50 stocks and 20 ETFs based on options volume on trading day. The article will be published after the options trading hours. The ratio of current and 30-day average (OR DoD ratio) Volume/30-Day Average Volume (OR Total Volume DoD) and OI/30-Day Average OI (OR OI DoD) reflect the changes in overall options activities compared to the past. The chart shows the cumulative distribution of open interest of all expiration dates per different strike prices. 10 strike prices that are closest to the current underlying price are presented. The chart conveys the market views of the future underlying price. Options trades with a size of more than 1,000 contracts will be marked as unusual trades. Unusual Options Trades and Active Options Contracts are presented in descending order in terms of trading volume. Options trading entails significant risk and is not appropriate for all customers. It is important that investors read Characteristics and Risks of Standardized Options before engaging in any options trading strategies. Options transactions are often complex and may involve the potential of losing the entire investment in a relatively short period of time. Certain complex options strategies carry additional risk, including the potential for losses that may exceed the original investment amount. Supporting documentation for any claims, if applicable, will be furnished upon request. The past performance of a security or financial product does not guarantee future results or returns. Customers should consider their investment objectives and risks carefully before investing in options. Because of the importance of tax considerations to all options transactions, the customer considering options should consult their tax advisor as to how taxes affect the outcome of each options strategy. The translation is provided by third-party software. Use the share button in your browser  to share the page with your friends",https://news.futunn.com/en/post/70995833/taiwan-semiconductor-options-spot-on-on-april-1st-137-46k?level=1&data_ticket=1775265325866015
TSM,This New Spinoff Is a Nuclear and AI Chip Beneficiary Worth Watching - The Globe and Mail,2026-04-01 19:34:00,"Solstice Advanced Materials (NASDAQ: SOLS) is a relatively new stock to the market, but one that has gotten off to a blistering start. At the end of October 2025, the over $100 billion industrial conglomerate Honeywell International (NASDAQ: HON) spun out the company. Since that time, Solstice shares have gone on an impressive run, up more than 50%. This comes as the firm is benefiting from key tailwinds across both the nuclear energy and semiconductor industries. Investors should likely temper their excitement given Solstice's current share price, which bakes in years of extensive growth. However, with the firm at the intersection of two top investment trends, Solstice is a name to watch should its valuation retreat significantly. Largely due to the rapid deployment of artificial intelligence (AI) data centers, nuclear energy and advanced semiconductor demand are on a big upswing. Many hyperscalers want to accelerate nuclear adoption due to rising electricity demand. This can help fulfill two key goals. First off, nuclear energy is low-carbon, allowing these firms to make good on their clean energy commitments. Additionally, unlike other renewable sources like wind and solar, nuclear sites can run constantly, supporting demanding and continuous AI workloads. Notably, Solstice owns the Metropolis Works uranium hexafluoride (UF6) conversion facility. This makes the firm the only domestic provider of UF6 conversion services. Solstice converts raw uranium into UF6 before it moves on to other producers in the fuel fabrication cycle. Clearly, this gives Solstice a level of importance in national energy security. This is particularly true as the company notes that there are only four other UF6 conversion sites in the world. According to 2022 data, one of these is in Russia and another is in China, both countries that have adversarial relations with the United States. Due to the rise in nuclear demand, capacity at the Metropolis facility is nearly sold out through 2030 and holds an over $2 billion backlog. Bank of America estimates that global nuclear energy capacity could triple by 2050, creating a significant opportunity for Solstice in a fragmented market. A key threat is the entrance of new competitors. However, Solstice notes that getting new facilities production-ready takes four to five years. Meanwhile, advanced semiconductors are fundamental to the proliferation of AI. Solstice holds a similarly strong position as an advanced chip material supplier. This comes as the firm makes copper manganese sputtering targets: essential for building semiconductors at process nodes below seven nanometers (nm). The company says it is “really the only producer that has copper manganese at scale."" It also notes that it is one of only two or three suppliers in the world. Solstice sees the demand for copper manganese continuing to increase as AI progresses. Moving to smaller and smaller process nodes is among the most important vectors for increasing semiconductor performance. As process nodes fall, they require more copper manganese. The increased commitment to U.S.-based advanced semiconductor manufacturing also benefits Solstice, making these customers more likely to buy from it due to proximity. Top players in the semiconductor industry are investing heavily: To support rising demand, Solstice is investing $200 million to double its sputtering target manufacturing capacity at its facility in Washington State. Overall, copper manganese demand is another significant opportunity that the firm is taking advantage of, and SOLS sees substantial runway for future growth in this space. In its latest quarter, Solstice’s nuclear business grew by an impressive clip of 39% year over year (YOY). Meanwhile, its Electronic Materials division, which houses sputtering targets revenue, grew by a solid 19% YOY. Despite this, it is important to note that Solstice is a highly diversified business, not a pure play on nuclear and semiconductor trends. In 2024, nuclear and semiconductors combined for just  22% of total revenue. Thus, total sales grew by just 3% YOY in 2025 and 8% YOY in Q4 2025. In 2026, the company’s revenue growth projection sits near 4%. This doesn’t line up favorably compared to Solstice’s valuation, making the stock's outlook questionable at current levels. Overall, Solstice is clearly an interesting company, acting as a key supplier within the nuclear and semiconductor investment cycles. This makes the stock one to watch going forward, should its aggregate fundamentals or valuation shift meaningfully. Before you make your next trade, you'll want to hear this. MarketBeat keeps track of Wall Street's top-rated and best performing research analysts and the stocks they recommend to their clients on a daily basis. Our team has identified the five stocks that top analysts are quietly whispering to their clients to buy now before the broader market catches on... and none of the big name stocks were on the list. They believe these five stocks are the five best companies for investors to buy now... The article ""This New Spinoff Is a Nuclear and AI Chip Beneficiary Worth Watching"" first appeared on MarketBeat. All market data (will open in new tab) is provided by Barchart Solutions. Copyright © 2026. Information is provided 'as is' and solely for informational purposes, not for trading purposes or advice. For exchange delays and terms of use, please read disclaimer (will open in new tab).",https://www.theglobeandmail.com/investing/markets/stocks/TSM/pressreleases/1122841/this-new-spinoff-is-a-nuclear-and-ai-chip-beneficiary-worth-watching/
TSM,Promising Manufacturing Stocks To Research - April 1st - MarketBeat,2026-04-01 17:31:58,"Taiwan Semiconductor Manufacturing, Applied Materials,  and Phillips 66 are the three Manufacturing stocks to watch today, according to MarketBeat's stock screener tool. Manufacturing stocks are shares of companies whose primary business is producing physical goods—such as automakers, machinery makers, electronics manufacturers, chemical producers, and other industrial firms. Investors treat them as cyclical, capital‑intensive holdings that are sensitive to economic growth, commodity prices, trade policy, and supply‑chain factors, and they often use them to gain exposure to industrial activity or hedge against inflation. These companies had the highest dollar trading volume of any Manufacturing stocks within the last several days. Taiwan Semiconductor Manufacturing Company Limited, together with its subsidiaries, manufactures, packages, tests, and sells integrated circuits and other semiconductor devices in Taiwan, China, Europe, the Middle East, Africa, Japan, the United States, and internationally. It provides a range of wafer fabrication processes, including processes to manufacture complementary metal- oxide-semiconductor (CMOS) logic, mixed-signal, radio frequency, embedded memory, bipolar CMOS mixed-signal, and others. Applied Materials, Inc. engages in the provision of manufacturing equipment, services, and software to the semiconductor, display, and related industries. The company operates through three segments: Semiconductor Systems, Applied Global Services, and Display and Adjacent Markets. The Semiconductor Systems segment develops, manufactures, and sells various manufacturing equipment that is used to fabricate semiconductor chips or integrated circuits. Phillips 66 operates as an energy manufacturing and logistics company in the United States, the United Kingdom, Germany, and internationally. It operates through four segments: Midstream, Chemicals, Refining, and Marketing and Specialties (M&S). The Midstream segment transports crude oil and other feedstocks; delivers refined petroleum products to market; provides terminaling and storage services for crude oil and refined petroleum products; transports, stores, fractionates, exports, and markets natural gas liquids; provides other fee-based processing services; and gathers, processes, transports, and markets natural gas. This instant news alert was generated by narrative science technology and financial data from MarketBeat in order to provide readers with the fastest reporting and unbiased coverage. Please send any questions or comments about this story to contact@marketbeat.com. Before you consider Taiwan Semiconductor Manufacturing, you'll want to hear this. MarketBeat keeps track of Wall Street's top-rated and best performing research analysts and the stocks they recommend to their clients on a daily basis. MarketBeat has identified the five stocks that top analysts are quietly whispering to their clients to buy now before the broader market catches on... and Taiwan Semiconductor Manufacturing wasn't on the list. While Taiwan Semiconductor Manufacturing currently has a Buy rating among analysts, top-rated analysts believe these five stocks are better buys. Market downturns give many investors pause, and for good reason. Wondering how to offset this risk? Click the link to learn more about using beta to protect your portfolio. Sign up for MarketBeat All Access to gain access to MarketBeat's full suite of research tools. 345 N Reid Place, Suite 620, Sioux Falls, SD 57103
                                        
                                        contact@marketbeat.com
                                        
                                        (844) 978-6257 © MarketBeat Media, LLC 2010-2026. All rights reserved. © 2026   Fair market value prices are updated every minute and are provided by Massive. Other market data provided is at least 10-minutes delayed and hosted by Barchart Solutions.  Information is provided 'as-is' and solely for informational purposes, not for trading purposes or advice, and is delayed. To see all exchange delays and terms of use please see Barchart's disclaimer. We and our partners share information on your use of this website to help improve your experience. For more information, or to opt out click the Do Not Sell My Information button below.",https://www.marketbeat.com/instant-alerts/promising-manufacturing-stocks-to-research-april-1st-2026-04-01/
TSM,TSM Options Trade Yields Significant Gains - GuruFocus,2026-04-01 16:41:15,"This website is using a security service to protect itself from online attacks. The action you just performed triggered the security solution. There are several actions that could trigger this block including submitting a certain word or phrase, a SQL command or malformed data. You can email the site owner to let them know you were blocked. Please include what you were doing when this page came up and the Cloudflare Ray ID found at the bottom of this page. Cloudflare Ray ID: 9e6c78e20bb8056e
•

        Your IP:
        Click to reveal
4.246.135.65
•

Performance & security by Cloudflare",https://www.gurufocus.com/news/8764889/tsm-options-trade-yields-significant-gains?mobile=true
TSM,"Positive Signal: URSULA BURNS Shows Faith, Buying $322K In Taiwan Semiconductor Stock - Benzinga",2026-04-01 15:01:11,"The owner of this website (www.benzinga.com) has banned you temporarily from accessing this website. Please see
                            https://developers.cloudflare.com/support/troubleshooting/http-status-codes/cloudflare-1xxx-errors/error-1015/
                            for more details. Cloudflare Ray ID: 9e6c7c10afc915cd
•

        Your IP:
        Click to reveal
4.246.135.65
•

Performance & security by Cloudflare",https://www.benzinga.com/insights/news/26/04/51602238/positive-signal-ursula-burns-shows-faith-buying-322k-in-taiwan-semiconductor-stock
TSM,KEYWISE CAPITAL MANAGEMENT Ltd's Taiwan Semiconductor Manufacturing Co Ltd(TSM) Holding History - GuruFocus,2026-04-01 14:41:24,"This website is using a security service to protect itself from online attacks. The action you just performed triggered the security solution. There are several actions that could trigger this block including submitting a certain word or phrase, a SQL command or malformed data. You can email the site owner to let them know you were blocked. Please include what you were doing when this page came up and the Cloudflare Ray ID found at the bottom of this page. Cloudflare Ray ID: 9e6c790aec57056e
•

        Your IP:
        Click to reveal
4.246.135.65
•

Performance & security by Cloudflare",https://www.gurufocus.com/guru-portfolio/KEYWISE%20CAPITAL%20MANAGEMENT%20Ltd/TSM
