ticker,title,date,content,url
UNH,UnitedHealth Group Inc UNH Stock Upcoming Earnings To Watch France Football (atULXfMFH9) - Mshale,2026-04-09 23:12:57,"UnitedHealth Group Inc UNH Stock Upcoming Earnings To WatchFULL EPISODE NOW LIVE ON SPOTIFY  Click to listen to the complete analysis: Welcome to the Investing Talk Podcast, your go-to source for daily market analysis and investment insights. We're on a mission to empower you with the financial literacy needed to navigate the stock market, understand complex earnings reports, and build a stronger portfolio.
Every day, we provide a deep dive into trending US stocks, upcoming earnings calls, and the latest ETF trends. Whether you're a new investor looking for a starting guide or a india vix today seasoned trader seeking an edge, our content is designed to help you make smarter financial decisions.
What you will find on our channel:
- Daily Stock Analysis: Discover our top stock picks, growth stocks, and value investing opportunities.
- Earnings Report Breakdown: Get a no-nonsense analysis of what corporate earnings truly mean for your investments.
- ETF and Sector Analysis: Learn about the industries poised for growth and how to diversify your portfolio with exchange-traded funds.
- Market News & Economic Trends: Stay ahead of the curve with our expert commentary on the latest market movements and economic updates.
- aditya birla Wealth Building Strategies: Actionable tips on building passive income, financial freedom, and recession-proofing your investments.
New episodes daily!
Subscribe now for your daily dose of financial wisdom and expert market insights.
Disclaimer: We are not financial advisors. The content on this channel is for educational and informational purposes only. Always conduct your own due diligence before making any investment decisions.
 Support our work:
 
Investing, stock market, stocks, personal finance, financial freedom, passive income, day trading, dividend investing, value investing, growth stocks, stock analysis, earnings report, market news, ETF, crypto, cryptocurrency, Bitcoin, wealth building, recession, S&P 500, Nasdaq, Dow Jones, financial literacy, how to invest, investing for beginners, AI stocks, artificial intelligence, clean energy, renewable energy, energy stocks, solar gia new boyfriend stocks, hydrogen stocks, green energy, oil and gas stocks, EV stocks.
#InvestingTalkPodcast #StockMarket #PersonalFinance #InvestingTips #WealthBuilding #Investing #Investment #Stocks #FinancialFreedom #DayTrading #PassiveIncome #FinancialLiteracy #StockAnalysis #ValueInvesting #EarningsReport #ETFs #RecessionProofing #MoneyTalks #Trading #Investor #BeginnerInvesting stock market today, pre-market, after-hours, earnings recap, price target, guidance, AI stocks, semiconductor stocks, dividend stocks, covered call ETF, S&P 500, Nasdaq, Dow, Federal Reserve, rate cuts, CPI, PCE, GDP, recession watch, options trading, options flow, breakout, support & resistance, RSI, short squeeze, valuation, free cash flow, buy hold sell, momentum, risk management, long-term investing, passive income, DRIP, ETF investing, market news
#StockMarketToday #Investing #Shorts #OneMinuteStock #Earnings #PreMarket #AfterHours #PriceTarget #AIStocks #DividendStocks #ETFs #SP500 #NASDAQ #Fed #RateCuts #CPI #OptionsTrading #TechnicalAnalysis #Breakout #MarketNews #StockMarket #Investing #Stocks #Trading #Finance #PennyStocks #ETF #BestStocksToBuyNow #AIInvesting #ESG For Country: United States. City: Chicago, Columbia, Milwaukee, Tulsa, Winston-Salem Tag: #Heartbreak High, #wheel, #mike lynch estate, #man utd vs man city Born and raised in Kenya’s coastal city of Mombasa, Tom is the Founder, Editor-in-Chief and Publisher of Mshale which has been reporting on the news and culture of African immigrants in the United States since 1995. He has a BA in Business from Metro State University and a Public Leadership Credential from Harvard’s Kennedy School of Government. He was the original host of Talking Drum, the signature current affairs show on the African Broadcasting Network (ABN-America), which was available nationwide in the United States via the Dish Network satellite service. On the show, he interviewed Nobel laureates such as 2004 Nobel Peace prize winner, Professor Wangari Maathai, the first woman from Africa to win the peace prize and heads of states. Tom has served and chaired various boards including Global Minnesota (formerly Minnesota International Center), the sixth largest World Affairs Council in the United States. He has previously served as the first Black President of the Board of Directors at Books for Africa. He also serves on the boards of New Vision Foundation and the Minnesota Multicultural Media Consortium. He has previously served two terms on the board of the United Nations Association. An avid runner, he retired from running full marathons after turning 50 and now only focuses on training for half marathons. Born and raised in Kenya’s coastal city of Mombasa, Tom is the Founder, Editor-in-Chief and Publisher of Mshale which has been reporting on the news and culture of African immigrants in the United States since 1995. He has a BA in Business from Metro State University and a Public Leadership Credential from Harvard’s Kennedy School of Government.
He was the original host of Talking Drum, the signature current affairs show on the African Broadcasting Network (ABN-America), which was available nationwide in the United States via the Dish Network satellite service. On the show, he interviewed Nobel laureates such as 2004 Nobel Peace prize winner, Professor Wangari Maathai, the first woman from Africa to win the peace prize and heads of states. Tom has served and chaired various boards including Global Minnesota (formerly Minnesota International Center), the sixth largest World Affairs Council in the United States. He has previously served as the first Black President of the Board of Directors at Books for Africa. He also serves on the boards of New Vision Foundation and the Minnesota Multicultural Media Consortium. He has previously served two terms on the board of the United Nations Association.
An avid runner, he retired from running full marathons after turning 50 and now only focuses on training for half marathons.",https://mshale.com/c02cbc6b-News/b3798a3c-f4YUncr1BIk
UNH,A Look At UnitedHealth Group (UNH) Valuation After The Medicare Advantage Payment Increase - Yahoo Finance,2026-04-09 22:14:54,"Tip: Try a valid symbol or a specific company name for relevant results Americans close to retirement are saving for later, but they're worried about getting by right now Government data out Friday will show how much consumer prices rose in March — and forecasts point to soaring inflation. Palantir plunges after 'Big Short' investor Michael Burry says Anthropic is eating its lunch Stocks rebounded to extend their winning streak, while oil rose ahead of US-Iran talks Stocks turned positive after Israel agreed to talks with Lebanon, reviving optimism for the US-Iran ceasefire US stocks pull back, oil surges as US-Iran ceasefire looks increasingly shaky Sticky reading on inflation pre-war will keep Fed on hold The New York Times may have found bitcoin founder Satoshi Nakamoto. Here's what you need to know. Fed officials saw risks of the Iran war increasing inflation and delaying rate cuts in a March meeting The Strait of Hormuz has immediately become the first major flash point of Trump's 'fragile' ceasefire US stocks surged while oil prices plunged as relief from a fragile US-Iran ceasefire rippled through markets US stocks soar, with Dow surging nearly 1,400 points as Iran truce restarts Hormuz traffic Delta beats on Q1 earnings, maintains guidance despite fuel spike, TSA headwinds Investors are turning to social media and following 'finfluencers' to inform their investment decisions High new car prices, rising gas costs, and rising interest rates brought buyers to used car lots Dow, S&P 500, Nasdaq futures soar after Trump calls for two-week ceasefire Markets weigh the chances of economic fallout from an attack on Iran against previous threats from Trump The S&P 500 and Nasdaq ended the day slightly higher on hopes of an Iran deadline extension Anthropic launches cybersecurity partnership with Amazon, Apple, Google, Microsoft, Nvidia, and others Tech is doing everything right and getting left behind. Here's what could turn that around. US stocks drift lower as Trump's deadline for Iran ultimatum looms US gas prices risk topping $5 per gallon if the Strait of Hormuz stays closed, JPMorgan says Netflix stands to get richer after losing Warner Bros. bidding war. Here's why. Goldman Sachs delivered a warning to laid-off tech workers that it will take more time to find a new job than expected The Dow, S&P 500, and Nasdaq gained ahead of Trump's deadline for an Iran deal US stocks open muted, oil dips as Wall Street eyes push for Iran truce talks JPMorgan CEO flags Iran war-fueled inflation, private credit, and AI-linked job losses as risks to the economy 'Wouldn't be shocked' if bull market continues: Wall Street aims to look past Iran conflict What if I can’t pay my taxes? 5 ways to tackle your bill. The US labor market right now can be defined by one word: Whiplash The Trump administration has signaled it will offer broad tariff refunds. That could mean millions for companies. Inflation readings, oil volatility, and airline earnings: What to watch this week Britain's billion-dollar bet on a hypercar is ""a genuinely incredible machine to drive,"" writes senior reporter Pras Subramanian. Cocoa prices are falling — but not in time for Easter (CNN Business) 7 things to know about Schwab's new brokerage account for teenagers The war in Iran shows no signs of slowing down, and its damage may be felt for years to come The best markets for first-time homebuyers are increasingly in these two regions of the US The company's gravitational pull has the potential to elevate Elon Musk as a government partner, Wall Street fixture, and tech entrepreneur. US judge upholds block of subpoenas in criminal investigation of Jay Powell (Financial Times) Hyundai's Boulder concept previews the automaker's truck future, built in America What we've learned in a year since 'Liberation Day' Americans nearing retirement plan to take Social Security 'as soon as eligible' March jobs report: US economy adds 178,000 jobs, unemployment rate falls to 4.3% in surprise turnaround The March jobs report will show a fuller picture of the state of the job market, just as the Iran war began to weigh on the global economy. Jet fuel prices are up 100%, oil prices keep surging, and airlines are paying the price Microsoft is building its own high-powered AI models, a sign that it is looking to wean itself from OpenAI Stocks shook off early losses, oil held on to gains as markets assessed a potential easing in the Strait of Hormuz Mortgage rates rose above 6% for the 5th straight week Stocks spiked after Iran announced it's working with Oman on a Strait of Hormuz traffic protocol US stocks fall at the open while oil surges after Trump says the war in Iran is not yet over The above button links to Coinbase. Yahoo Finance is not a broker-dealer or investment adviser and does not offer securities or cryptocurrencies for sale or facilitate trading. Coinbase pays us for certain activity generated through this link. Prices displayed are informational. Get insights on thousands of stocks from the global community of over 7 million individual investors at Simply Wall St. The Centers for Medicare & Medicaid Services has finalized a 2.48% average increase in 2027 Medicare Advantage payments, adding over US$13b in funding and sparking a sharp relief rally in UnitedHealth Group (UNH) shares. The relief rally has come after a difficult stretch, with UnitedHealth Group’s share price posting a 10.69% 7 day gain and 8.70% 1 month gain, but a 10.78% 3 month decline and 8.77% year to date share price decline. At the same time, the 1 year total shareholder return of 46.91% and 5 year total shareholder return of 14.27% remain weak, suggesting sentiment is recovering from a low base as investors reassess risks following the Medicare Advantage decision. If this Medicare news has you rethinking healthcare exposure, it could be worth scanning for other companies applying AI to medical services through our screener of 36 healthcare AI stocks With UNH trading at US$306.91, carrying an intrinsic discount of 62% and sitting about 18% below the average analyst price target, the key question is simple: is this a reset entry point, or has the relief rally already priced in future growth? UnitedHealth Group's fair value in the most followed narrative is set at $486.86. This is well above the last close of $306.91 and frames the recent relief rally as only part of the story according to WallStreetWontons. Expanding Premium Base: UNH’s premium base continues to grow, contributing to its revenue growth. Contract Wins: The company secures contracts and renewals, such as the recent contract win in Michigan to serve Medicaid beneficiaries. Strength in Optum Business: Optum, a subsidiary of UNH, contributes significantly to its overall performance. Solid Financial Position: UNH’s financial stability reinforces investor confidence. Aging Population: The aging U.S. population sustains demand for UNH’s Medicare plans. Impressive Earnings Surprise History: UNH consistently outperforms earnings estimates. Robust Growth Prospects: The consensus estimates for 2024 and 2025 indicate growth in both earnings and revenues. Strong Return on Equity: UNH efficiently utilizes shareholders’ funds with a higher return on equity than the industry average. Want to see what kind of revenue build, margin profile, and future earnings multiple underpin that higher fair value, and how they all tie back to Optum and Medicare premiums? The full narrative lays out the numbers behind that conviction. Have a read of the narrative in full and understand what's behind the forecasts. However, risks around shifting healthcare regulation and tougher competition from other insurers and pharmacy benefit managers could still challenge the optimistic fair value narrative. Find out about the key risks to this UnitedHealth Group narrative. That 37% discount to the $486.86 fair value sits alongside a different message from the current P/E. UNH trades on 23.1x earnings, slightly above the US Healthcare average of 22.5x and peers at 20.3x, yet below a fair ratio of 36.2x. Is the market overpaying for caution or underpaying for long term cash flows? See what the numbers say about this price — find out in our valuation breakdown. With sentiment clearly split between caution and optimism, this is the moment to look through the numbers yourself and decide where you stand. You can begin with the 3 key rewards and 1 important warning sign If you stop at a single stock, you miss the bigger picture. Use the Simply Wall Street Screener to line up your next round of potential opportunities. Target strong income potential by reviewing companies we flag as possible 11 dividend fortresses that may offer higher yields with fundamentals you can inspect in detail. Zero in on value by scanning through 62 high quality undervalued stocks that combine quality metrics with prices that may sit below their estimated worth. Prioritize resilience by filtering for 73 resilient stocks with low risk scores that score well on financial health and risk factors before you commit fresh capital. This article by Simply Wall St is general in nature. We provide commentary based on historical data and analyst forecasts only using an unbiased methodology and our articles are not intended to be financial advice. It does not constitute a recommendation to buy or sell any stock, and does not take account of your objectives, or your financial situation. We aim to bring you long-term focused analysis driven by fundamental data. Note that our analysis may not factor in the latest price-sensitive company announcements or qualitative material. Simply Wall St has no position in any stocks mentioned. Have feedback on this article? Concerned about the content? Get in touch with us directly. Alternatively, email editorial-team@simplywallst.com Tip: Try a valid symbol or a specific company name for relevant results",https://finance.yahoo.com/sectors/healthcare/articles/look-unitedhealth-group-unh-valuation-221454367.html
UNH,Federal Investment Advances University of New Hampshire’s Plant Research Excellence - Perishable News,2026-04-09 21:16:37,"To access your saved articles or create a new account with just your email to start
                            building your personalized reading list—it's quick and easy! A vital UNH agricultural research facility to receive substantial updates, host a new center for excellenceThe University of New Hampshire has secured nearly $2 million in federal funding to renovate and enhance the Macfarlane Research Greenhouses and create a new Center for Excellence in Education and Discovery for Plant Science (CEED Plant Science). The appropriation, spearheaded at the federal level by New Hampshire Senator Jeanne Shaheen, will improve UNH’s work to develop cutting-edge research in plant management and train the next generation of innovators to support the greenhouse industry in the Granite State. Horticultural and ornamental production in New Hampshire greenhouses supports nearly 2,000 jobs and contributes $106.7 million annually to the state’s economy. The new Center for Excellence in Education and Discovery for Plant Science will leverage UNH’s world-class scientific and operational expertise to lead workforce training and develop insights tailored to local grower needs. To learn more, please visit The University of New Hampshire. Receive daily updates on floral industry trends, new products and merchandising tips. PerishableNews.com—​your business news destination for comprehensive, up-to-date news and insights across the perishable food industry. We specialize in delivering daily content spanning key sectors such as Bakery, Dairy, Deli, Floral, Meat & Poultry, Produce, and Seafood. Our coverage extends to pivotal developments in both Retail and Foodservice, ensuring you stay informed about the entire perishable foods landscape. Phoenix Media Network - 551 NW 77th Street, Suite 101, Boca Raton, FL 33487",https://perishablenews.com/floral/federal-investment-advances-university-of-new-hampshires-plant-research-excellence/
UNH,UnitedHealth Group: Don't Drink The CMS Kool-Aid (NYSE:UNH) - Seeking Alpha,2026-04-09 20:05:06,"UnitedHealth Group Incorporated (UNH) is a best-of-breed health insurer and pharmacy benefits manager trading at a discount to historical valuations. However, the insurance segment is under huge pressure from medical cost inflation, which requires them to push Analyst’s Disclosure: I/we have a beneficial long position in the shares of UNH either through stock ownership, options, or other derivatives. I wrote this article myself, and it expresses my own opinions. I am not receiving compensation for it (other than from Seeking Alpha). I have no business relationship with any company whose stock is mentioned in this article. The author is not an investment advisor and offers no advice here. He shares his own analysis solely for the interest of readers. Seeking Alpha's Disclosure: Past performance is no guarantee of future results. No recommendation or advice is being given as to whether any investment is suitable for a particular investor. Any views or opinions expressed above may not reflect those of Seeking Alpha as a whole. Seeking Alpha is not a licensed securities dealer, broker or US investment adviser or investment bank. Our analysts are third party authors that include both professional investors and individual investors who may not be licensed or certified by any institute or regulatory body.",https://seekingalpha.com/article/4889612-unitedhealth-group-dont-drink-the-cms-kool-aid
UNH,"$UnitedHealth (UNH.US)$ walawehhh, keep holdinggg onnnn - Moomoo",2026-04-09 15:37:34,"To create a seamless experience and for website quality and improvement purposes, we use cookie technologies for verification and quality purposes, to personalize the content presented, and to provide advertising that may be of specific interest to you. Learn our Privacy Policy here.",https://www.moomoo.com/community/feed/unitedhealth-unh-us-wow-keep-holding-on-116375490002950?chain_id=Name1K9-3FXPhg.1ktfj80&global_content=%7B%22promote_id%22%3A13764%2C%22sub_promote_id%22%3A57%2C%22f%22%3A%22www.moomoo.com%2Fstock%2FUNH-CA%22%7D
