ticker,title,date,content,url
UNH,Women's Lacrosse Cruises Past UNH Behind Batchelder’s 11-Point Night - gocrimson.com,2026-04-07 22:34:31,"Game Recap: Women's Lacrosse | 4/7/2026 6:26:00 PM DURHAM, N.H. - 13 goals from Callie Batchelder, Charlotte Hodgson, and Grace Mullahy helped lead the Crimson to a 20-6 win over UNH on Tuesday evening in New Hampshire. The usual suspects led the way for the Crimson, as Callie Batchelder recorded 11 points, Charlotte Hodgson picked up another eight, and Grace Mullahy added six. Despite a competitive first quarter, the Crimson held the Wildcats to just one goal in the second, third, and fourth quarters as they picked up their fourth non-conference win of the season. HOW IT HAPPENED
The Crimson netted seven goals in a back-and-forth first quarter. The opening seven minutes of the game saw eight total goals from the Crimson and Wildcats. Harvard opened the scoring after Charlotte Hodgson scored in close to give the Crimson a 1-0 lead. Each time Harvard would score to take the lead, the Wildcats responded with a goal of their own in the early going. Grace Mullahy, Callie Batchelder, and Hodgson scored the first four Crimson goals of the game before Harvard went on a three-goal run to build a late cushion in the first. Charlotte Hodgson completed her first-quarter hat trick to make it 6-4 after two consecutive goals, before another goal from Tori Balser gave Harvard a three-goal lead. The Crimson took a 7-5 lead into the second quarter. Callie Batchelder finished the first quarter with a goal and four assists, while Charlotte Hodgson picked up four points with three goals and an assist. The Crimson opened the second quarter with two quick goals after Charlotte Hodgson was left all alone by the side of the net, before Cecilia Batchelder picked a corner from distance to put Harvard up by four. Hodgson's fifth goal of the game doubled up the Wildcats as Harvard led 10-5 at the half. Kate Gilliam opened the third with her first of the game as the Crimson onslaught continued coming out of the break. Harvard would go on to score seven of the next eight goals of the game. Callie Batchelder, Cecilia Batchelder, Natalie Marvin, and Charlotte Hodgson all found the net in the third quarter and early in the fourth. Hodgson's goal to make it 17-6 was the 100th of her career after a quick stick from the side of the cage for her seventh of the game. Lauren Park and Victoria Ottomanelli scored their first career goals in the fourth quarter as the Crimson capped off the big non-conference win. NEXT UP
Harvard hosts Cornell on Saturday in its final home game of the regular season. The use of software that blocks ads hinders our ability to serve you the content you came here to enjoy. We ask that you consider turning off your ad blocker so we can deliver you the best experience possible while you are here.",https://gocrimson.com/news/2026/4/7/womens-lacrosse-crimson-cruises-past-unh-behind-batchelders-11-point-night.aspx
UNH,"UNH Apr 2026 322.500 put (UNH260410P00322500) stock price, news, quote and history - Yahoo Finance UK",2026-04-07 19:03:53,"Tip: Try a valid symbol or a specific company name for relevant results ⚡️Stocks rally 📈 after US and Iran agree two-week ceasefire ⚡️ ⚡️ Stocks waver as Trump's Iran 🇮🇷 deadline looms ⚡️ Stocks fall 📉 after Trump threatens to hit Iran ‘extremely hard’ 🇮🇷 💷 Pound jumps 📈 on hopes that Middle East war will end soon 📈 Stocks rally after Trump says US could leave Iran in a few weeks 📉 Gold prices 👑 set for worst month since 2008 as Iran war 🇮🇷 continues Oil prices 🛢️ pull lower following reports of Trump 🇺🇸 considering end to Middle East conflict Pound ticks higher as UK GDP growth 🇬🇧 confirmed as nearly stagnant in Q4 📊 Stocks set to rise 📈 as Trump willing to end Iran war 🇮🇷 without Hormuz deal Average UK house price 🏡 rises to £277,186 in March 📈 Mortgage approvals ✔️ jump by most since November, Bank of England 🏦 says Brent crude 🛢️ prices up to $115 a barrel 📈 as traders assess Trump peace deal claims Pound 💷 set for biggest monthly loss against dollar 💲 since October Stocks set to tumble as Middle East conflict intensifies Gold and silver prices rise 📈 with eyes on central banks and Iran war 💷 UK currency dips amid weaker retail sales while Middle East war ramps up inflation fears 💷 Stocks muted as Trump delays strikes on Iran power plants 🌍 Pound 💷 dips against dollar as OECD warns Middle East conflict will drive up UK inflation ⛽🛍️ Oil prices 🛢️ higher as Trump claims Iran doesn't want to admit they spoke 🗣️ Bitcoin price struggles near $70K as peace talk hopes falter Pound 💷 steady as Bank of England 🏦 interest rate rise bets ease Gold 🪙 price jumps ⬆️ 3% as oil slump eases inflation fears amid Trump Iran plan Stocks rise 📈 on reports of Trump offering 15-point ceasefire plan to Iran 🗒️ Oil price ⛽ plunges 📉 as Trump announces plan to end Iran war 💷 Pound dips against dollar 💵 as speculation around UK interest rates grow ⚡️ ASML, Estée Lauder, Bellway, Kingfisher and Fevertree ⚡️ ⚡️ Gold and silver price moves muted amid inflation and interest rate hike risks ⚡️ ⚡️ Stocks lack direction as traders assess Middle East conflict ⚡️ 🛢️Tehran's denial of negotiations clouds prospect of reopening Strait of Hormuz and ending conflict 🛢️ Pound 💷 dips against dollar 💲 amid mounting expectations of Bank of England 🏦 rate increase Gold 🪙 and silver erase 2026 gains as Middle East inflation fears stoke bets on higher rates London plunges into correction territory as Trump gives Iran ultimatum Oil prices ⛽ gain as Trump and Starmer discuss need to reopen Hormuz ⚡️ UK inflation, BYD, Next, Kingfisher and Bellway ⚡️ Gold 👑 set for third weekly fall 📉 as strong dollar and Fed stance weigh Pound steady 🇬🇧 as investors digest UK borrowing data 📊 and interest rate decisions Stocks higher 📈 as Netanyahu 🇮🇱 says he will 'hold off' on gas field attacks Oil prices 🛢️ fall as Netanyahu signals pause in Iran strikes 🇮🇷 Government borrowing rose 📈 by more than expected to £14.3bn in February Tip: Try a valid symbol or a specific company name for relevant results",https://uk.finance.yahoo.com/quote/UNH260410P00322500/
UNH,"UNH Apr 2026 217.500 put (UNH260410P00217500) stock price, news, quote and history - Yahoo Finance UK",2026-04-07 18:47:35,"Tip: Try a valid symbol or a specific company name for relevant results ⚡️Stocks rally 📈 after US and Iran agree two-week ceasefire ⚡️ ⚡️ Stocks waver as Trump's Iran 🇮🇷 deadline looms ⚡️ Stocks fall 📉 after Trump threatens to hit Iran ‘extremely hard’ 🇮🇷 💷 Pound jumps 📈 on hopes that Middle East war will end soon 📈 Stocks rally after Trump says US could leave Iran in a few weeks 📉 Gold prices 👑 set for worst month since 2008 as Iran war 🇮🇷 continues Oil prices 🛢️ pull lower following reports of Trump 🇺🇸 considering end to Middle East conflict Pound ticks higher as UK GDP growth 🇬🇧 confirmed as nearly stagnant in Q4 📊 Stocks set to rise 📈 as Trump willing to end Iran war 🇮🇷 without Hormuz deal Average UK house price 🏡 rises to £277,186 in March 📈 Mortgage approvals ✔️ jump by most since November, Bank of England 🏦 says Brent crude 🛢️ prices up to $115 a barrel 📈 as traders assess Trump peace deal claims Pound 💷 set for biggest monthly loss against dollar 💲 since October Stocks set to tumble as Middle East conflict intensifies Gold and silver prices rise 📈 with eyes on central banks and Iran war 💷 UK currency dips amid weaker retail sales while Middle East war ramps up inflation fears 💷 Stocks muted as Trump delays strikes on Iran power plants 🌍 Pound 💷 dips against dollar as OECD warns Middle East conflict will drive up UK inflation ⛽🛍️ Oil prices 🛢️ higher as Trump claims Iran doesn't want to admit they spoke 🗣️ Bitcoin price struggles near $70K as peace talk hopes falter Pound 💷 steady as Bank of England 🏦 interest rate rise bets ease Gold 🪙 price jumps ⬆️ 3% as oil slump eases inflation fears amid Trump Iran plan Stocks rise 📈 on reports of Trump offering 15-point ceasefire plan to Iran 🗒️ Oil price ⛽ plunges 📉 as Trump announces plan to end Iran war 💷 Pound dips against dollar 💵 as speculation around UK interest rates grow ⚡️ ASML, Estée Lauder, Bellway, Kingfisher and Fevertree ⚡️ ⚡️ Gold and silver price moves muted amid inflation and interest rate hike risks ⚡️ ⚡️ Stocks lack direction as traders assess Middle East conflict ⚡️ 🛢️Tehran's denial of negotiations clouds prospect of reopening Strait of Hormuz and ending conflict 🛢️ Pound 💷 dips against dollar 💲 amid mounting expectations of Bank of England 🏦 rate increase Gold 🪙 and silver erase 2026 gains as Middle East inflation fears stoke bets on higher rates London plunges into correction territory as Trump gives Iran ultimatum Oil prices ⛽ gain as Trump and Starmer discuss need to reopen Hormuz ⚡️ UK inflation, BYD, Next, Kingfisher and Bellway ⚡️ Gold 👑 set for third weekly fall 📉 as strong dollar and Fed stance weigh Pound steady 🇬🇧 as investors digest UK borrowing data 📊 and interest rate decisions Stocks higher 📈 as Netanyahu 🇮🇱 says he will 'hold off' on gas field attacks Oil prices 🛢️ fall as Netanyahu signals pause in Iran strikes 🇮🇷 Government borrowing rose 📈 by more than expected to £14.3bn in February Tip: Try a valid symbol or a specific company name for relevant results",https://uk.finance.yahoo.com/quote/UNH260410P00217500/
UNH,UNH Stock Forecast: Jumps 8% on Medicare Payment Boost - CryptoRank,2026-04-07 18:36:16,"- CMS raised Medicare Advantage rates 2.48% for 2027 and added ~2.5% from risk-adjustment changes, putting the effective increase near 5% and injecting >$13B into plans; UnitedHealth closed $281.36 (+1.48%) and jumped to ~$304 premarket (+8.16%), with peers up 8–14%.
- Policy clarity boosts earnings visibility ahead of UnitedHealth results on April 21, 2026 (consensus adj. EPS $6.62, revenue $110.68B); analysts lifted targets but rising medical costs remain a risk. Limited direct crypto/DeFi impact, though broader market fundraising/adoption and risk appetite could be indirectly affected. SEO keywords: crypto, DeFi, DEX, CEX, fundraising, token launch, security, adoption. UnitedHealth Group stock trades at $281.36 at the latest close, gaining 1.48%, while premarket activity shows a sharp surge over $304, up 8.16%as of writing. The move follows a major policy update that lifted sentiment across the health insurance sector. Shares of peers Humana and CVS also climbed strongly. What triggered this sudden rally, and can it hold? The U.S. government confirmed a 2.48% increase in Medicare Advantage payment rates for 2027. This figure came in well above the near-flat 0.09% proposal released in January. The revision immediately shifted market expectations and restored confidence among investors. The Centers for Medicare &amp; Medicaid Services projects that the new rates will inject more than $13 billion into Medicare Advantage plans next year. That figure signals a meaningful revenue tailwind for insurers. Investors reacted quickly, sending shares of major players up between 8% and 14% in extended trading. The relief stands out, especially after months of pressure. Earlier proposals had erased billions in market value as insurers struggled with rising medical costs. Now, with a clearer path forward, the sector appears to regain its footing. But does this signal a full recovery or just a short-term bounce? The headline rate increase tells only part of the story. Officials also introduced changes to risk assessment payments tied to patient health status. These adjustments add roughly another 2.5% benefit, bringing the total effective increase closer to 5%. Industry analysts highlight this combined impact as a key driver behind the rally. Some estimates place the real benefit between 3.5% and 4% after accounting for policy shifts. That range offers insurers a more stable framework to predict costs and margins. The government also paused planned changes to risk modeling methods. This decision gives insurers and healthcare providers more time to adapt to broader structural reforms. At the same time, officials noted shifts within the system. Some insurers have dropped cost-controlled plans, while certain providers have exited Medicare Advantage networks. With policy uncertainty easing, attention now turns to earnings on April 21, 2026. UnitedHealth is expected to report adjusted earnings per share of $6.62 alongside revenue of $110.68 billion. These figures will play a key role in confirming whether the company can translate policy gains into financial performance. Analysts have already started adjusting their outlooks. Some now assign higher price targets, citing improved earnings visibility and operational momentum. The revised Medicare rates provide a stronger base for planning, especially as medical costs continue to rise. At the same time, insurers still face ongoing challenges. Rising healthcare utilization and cost pressures remain key concerns. Industry groups stress the need to balance affordability with sustainable coverage. Investors who exited earlier may now reconsider their positions. For now, hgher Medicare Advantage payments have reignited confidence in health insurers, with UnitedHealth leading the charge. - CMS raised Medicare Advantage rates 2.48% for 2027 and added ~2.5% from risk-adjustment changes, putting the effective increase near 5% and injecting >$13B into plans; UnitedHealth closed $281.36 (+1.48%) and jumped to ~$304 premarket (+8.16%), with peers up 8–14%.
- Policy clarity boosts earnings visibility ahead of UnitedHealth results on April 21, 2026 (consensus adj. EPS $6.62, revenue $110.68B); analysts lifted targets but rising medical costs remain a risk. Limited direct crypto/DeFi impact, though broader market fundraising/adoption and risk appetite could be indirectly affected. SEO keywords: crypto, DeFi, DEX, CEX, fundraising, token launch, security, adoption. UnitedHealth Group stock trades at $281.36 at the latest close, gaining 1.48%, while premarket activity shows a sharp surge over $304, up 8.16%as of writing. The move follows a major policy update that lifted sentiment across the health insurance sector. Shares of peers Humana and CVS also climbed strongly. What triggered this sudden rally, and can it hold? The U.S. government confirmed a 2.48% increase in Medicare Advantage payment rates for 2027. This figure came in well above the near-flat 0.09% proposal released in January. The revision immediately shifted market expectations and restored confidence among investors. The Centers for Medicare &amp; Medicaid Services projects that the new rates will inject more than $13 billion into Medicare Advantage plans next year. That figure signals a meaningful revenue tailwind for insurers. Investors reacted quickly, sending shares of major players up between 8% and 14% in extended trading. The relief stands out, especially after months of pressure. Earlier proposals had erased billions in market value as insurers struggled with rising medical costs. Now, with a clearer path forward, the sector appears to regain its footing. But does this signal a full recovery or just a short-term bounce? The headline rate increase tells only part of the story. Officials also introduced changes to risk assessment payments tied to patient health status. These adjustments add roughly another 2.5% benefit, bringing the total effective increase closer to 5%. Industry analysts highlight this combined impact as a key driver behind the rally. Some estimates place the real benefit between 3.5% and 4% after accounting for policy shifts. That range offers insurers a more stable framework to predict costs and margins. The government also paused planned changes to risk modeling methods. This decision gives insurers and healthcare providers more time to adapt to broader structural reforms. At the same time, officials noted shifts within the system. Some insurers have dropped cost-controlled plans, while certain providers have exited Medicare Advantage networks. With policy uncertainty easing, attention now turns to earnings on April 21, 2026. UnitedHealth is expected to report adjusted earnings per share of $6.62 alongside revenue of $110.68 billion. These figures will play a key role in confirming whether the company can translate policy gains into financial performance. Analysts have already started adjusting their outlooks. Some now assign higher price targets, citing improved earnings visibility and operational momentum. The revised Medicare rates provide a stronger base for planning, especially as medical costs continue to rise. At the same time, insurers still face ongoing challenges. Rising healthcare utilization and cost pressures remain key concerns. Industry groups stress the need to balance affordability with sustainable coverage. Investors who exited earlier may now reconsider their positions. For now, hgher Medicare Advantage payments have reignited confidence in health insurers, with UnitedHealth leading the charge. Please read and accept our Terms and Conditions and Privacy Policy & Cookies Statement to continue using our Site. These documents govern your use of our platform and the provision of personal data necessary to access our services. I have read, understood, and hereby accept the Terms and Conditions and the Privacy Policy & Cookies Statement, and accept essential cookies only.",https://cryptorank.io/news/feed/dca6e-unh-stock-forecast-jumps-8-on-medicare-payment-boost
UNH,Carrying Dr. Henry C. Lee’s legacy forward at UNH - The Charger Bulletin,2026-04-07 16:06:33,"Dr. Henry C. Lee’s legacy is connected to students who study forensic science at the University of New Haven (UNH). Through his assisting in more than 7,000 major cases, working in every state, 30 countries and as a consultant for 600 law enforcement agencies, he left behind an unmatched legacy following his recent death. Lee was born on Nov. 22, 1938, in Rugao, China. Lee’s parents were wealthy business owners. “My father used to be so rich, owns half of the town,” Lee said in a 2014 lecture at the John Jay College of Criminal Justice. This changed in the 1940s when the family fled to Taiwan after the Chinese Civil War. While traveling to Taiwan separate from his family, Lee’s father died after the S.S. Taiping collided with a cargo ship and sank. “However, during the revolution we have to run-for-your-life kind of thing,” said Lee. “We went to Taiwan. My father died when I was 5, 6 years old.” The tragedy left Lee’s family in financial ruin while his mother was left raising him and his 12 siblings alone. Following his secondary education, Lee enrolled at Central Police College (now Central Police University), where he graduated with a B.A. in police administration. This, he said later, was the only path he could afford. “We can’t afford tuition,” said Lee in a lecture at Western University in 2016. “In Taiwan that time only two university, one is military academy the other is police college, it’s tuition free.” He then became a police officer in the Taipei police department, and eventually became Taiwan’s youngest ever police captain at the age of 22. Lee left this position and relocated to the U.S. in 1965 to do professional policing and forensic work. Lee’s move to the U.S. wasn’t out of an abundance of money, he didn’t have much on hand to start with. “When I first come to this country I don’t even speak English,” he said. “Me and my wife together we have $50.” He worked multiple jobs after enrolling in  John Jay College to support his family and pay his tuition. “I worked at the NYU medical center as a technician, I wait on tables, also teach karate and kung fu during weekends to make enough money to support the family also to pay the tuition,” Lee said. Lee graduated from John Jay College in 1972 with a B.S. in forensic science. In 1974, he earned a Master of Science and his doctorate in 1975, both in biochemistry, from New York University.
This was also the year Lee joined University of New Haven (UNH) and founded its forensic science program. From 1978 to 2000, Lee worked at UNH, served as chief criminalist for the state of Connecticut and was the director of the Connecticut State Police Forensic Science Laboratory. He was also the commissioner of the state’s Department of Public Safety and Connecticut State Police from 1998 to 2000. After retiring from state service in 2000, he became chief emeritus of the state of Connecticut’s Division of Scientific Services from 2000-2010. Lee worked on a number of high-profile cases throughout his career. His most notable was his involvement in the O.J. Simpson murder trial in 1995. Other high profile cases Lee worked on include the 9/11 forensics investigation, the Laci Peterson case, the murder of JonBenét Ramsey and the murder of Helle Crafts, which led to Connecticut’s first murder conviction without the victim’s body. His career, while highly respected, was not without controversy. Lee faced criticism for his handling of evidence in the 2007 Phil Spector murder case, with Judge Larry Paul Fiddler concluding that Lee hid or destroyed evidence from the scene of Lana Clarkson’s shooting. In July 2023, a federal court found that Lee fabricated evidence in the Henning-Birch trial in 1985 that saw two young men convicted for the murder of 65-year-old Everett Carr. The two men were released in 2019 when their chargers were overturned, having already spent 30 years incarcerated. In September 2023, the two men were awarded $25.2 million as part of a settlement out of court. Lee’s recent death shook the university community, including alumni. “I felt in shock cause I had not too long ago went to one of his symposiums and he seemed in high spirits and good health,” said Siera Sparks, a 2025 graduate with a B.S. in forensic science. “But I know he’s left a legacy and those who take forensic science will remember him forever.” Lee was well respected by fellow faculty, too. Acting associate dean for the Henry C. Lee College of Criminal Justice and Forensic Science Michael Lawlor said he believed Lee had a way of connecting with those he was teaching. “Dr. Lee had a unique ability to explain complex scientific concepts to students, jurors, law enforcement officers, and politicians,” Lawlor said. “When he was done testifying or teaching, members of his audiences felt like they understood and trusted him. He used humor to offset frequently horrifying crime scene evidence and, in so doing, allowed laypersons to focus on the important details. 50 years ago, our university provided Dr. Lee with an opportunity to break into a profession that was little understood and appreciated at the time.” Lawlor said Lee set an example that should be followed by students. “Today, forensic science and crime scene investigation is a career of choice for an ever-increasing number of talented students,” he said. “Throughout his career he made it a point to repay the University of New Haven community multiple times over. Each of us has an obligation to follow his lead.” The Student News Source of the University of New Haven Your email address will not be published. Required fields are marked * Email * Email address verification requiredWe will send you an email with a verification link after you submit your comment. You must click that link or your comment will be discarded. Your email address will not be publicly displayed.",https://chargerbulletin.com/carrying-dr-henry-c-lees-legacy-forward-at-unh/
UNH,"UNH: Bernstein Raises Price Target, Maintains Outperform Rating - GuruFocus",2026-04-07 15:53:39,"This website is using a security service to protect itself from online attacks. The action you just performed triggered the security solution. There are several actions that could trigger this block including submitting a certain word or phrase, a SQL command or malformed data. You can email the site owner to let them know you were blocked. Please include what you were doing when this page came up and the Cloudflare Ray ID found at the bottom of this page. Cloudflare Ray ID: 9e9e4887bda1b16e
•

        Your IP:
        Click to reveal
64.236.140.211
•

Performance & security by Cloudflare",https://www.gurufocus.com/news/8779055/unh-bernstein-raises-price-target-maintains-outperform-rating-unh-stock-news?mobile=true
