ticker,title,date,content,url
UNH,$UnitedHealth (UNH.US)$ - Moomoo,2026-04-08 11:31:44,"To create a seamless experience and for website quality and improvement purposes, we use cookie technologies for verification and quality purposes, to personalize the content presented, and to provide advertising that may be of specific interest to you. Learn our Privacy Policy here.",https://www.moomoo.com/community/feed/unitedhealth-unh-us-116368861036550
UNH,US Stock Market Today S&P 500 Futures Rally On Ceasefire Hopes And CPI Watch - simplywall.st,2026-04-08 10:32:51,"US stock futures are pointing higher this morning, with E-mini S&P 500 contracts up about 2.6% and Nasdaq-100 futures roughly 3.4% firmer, as a ceasefire push in the Middle East pulls the VIX volatility gauge down around 12%. Government bond yields are reacting too, with the US 10 year near 4.25% while markets wait for Friday’s CPI, a key scorecard for the pace of price increases. Lower volatility and easier bond markets tend to support rate sensitive areas like technology, small caps and real estate. The question for investors is whether this calmer backdrop can last once the next inflation reading lands. With volatility easing but inflation still looming, use the 70 resilient stocks with low risk scores to focus on steadier names. Is Humana still a smart investment or just hype? Read our most popular narrative and get all the answers you need. Look past the noise - uncover the top narrative that explains what truly matters for Kimberly-Clark's long-term success. Attention is on a key consumer earnings update alongside upcoming shareholder votes on executive pay and stock incentive plans. Use our Portfolio or Watchlist features to track market-moving events like these and get alerts for the companies you own, free! When big headlines whip markets around, the real edge often sits in quiet quality, and that list can shrink fast as prices move. Check out the solid balance sheet and fundamentals stocks screener (40 results), where financially resilient names with robust fundamentals are already lined up for you. Ready to take control of your next move? Our stock screener lets you run custom searches that fit your style and set timely alerts so you never miss fresh opportunities. This article by Simply Wall St is general in nature. We provide commentary based on historical data
    and analyst forecasts only using an unbiased methodology and our articles are not intended to be financial advice. It does not constitute a recommendation to buy or sell any stock, and does not take account of your objectives, or your
    financial situation. We aim to bring you long-term focused analysis driven by fundamental data.
    Note that our analysis may not factor in the latest price-sensitive company announcements or qualitative material.
    Simply Wall St has no position in any stocks mentioned. Our new AI Stock Screener scans the market every day to uncover opportunities. • Dividend Powerhouses (3%+ Yield)• Undervalued Small Caps with Insider Buying• High growth Tech and AI CompaniesOr build your own from over 50 metrics. Have feedback on this article? Concerned about the content? Get in touch with us directly. Alternatively, email editorial-team@simplywallst.com Operates as a health care company in the United States and internationally. Financial Data provided by S&P Global Market Intelligence LLC, analysis provided by Simply Wall Street Pty Ltd. Copyright © 2026, S&P Global Market Intelligence LLC. All rights reserved. Simply Wall Street Pty Ltd (ACN 600 056 611), is a Corporate Authorised Representative (Authorised Representative Number: 467183) of Sanlam Private Wealth Pty Ltd (AFSL No. 337927). Any advice contained in this website is general advice only and has been prepared without considering your objectives, financial situation or needs. You should not rely on any advice and/or information contained in this website and before making any investment decision we recommend that you consider whether it is appropriate for your situation and seek appropriate financial, taxation and legal advice. Please read our Financial Services Guide before deciding whether to obtain financial services from us. © 2026 Simply Wall Street Pty Ltd, US Design Patent #29/544/281, Community and European Design Registration #2845206",https://simplywall.st/stocks/us/capital-goods/nasdaq-axon/axon-enterprise/news/us-stock-market-today-sp-500-futures-rally-on-ceasefire-hope
UNH,UnitedHealth (UNH) Soars 9.4%: Is Further Upside Left in the Stock? - Yahoo Finance UK,2026-04-08 08:59:00,"Tip: Try a valid symbol or a specific company name for relevant results ⚡️Stocks rally 📈 after US and Iran agree two-week ceasefire ⚡️ ⚡️ Stocks waver as Trump's Iran 🇮🇷 deadline looms ⚡️ Stocks fall 📉 after Trump threatens to hit Iran ‘extremely hard’ 🇮🇷 💷 Pound jumps 📈 on hopes that Middle East war will end soon 📈 Stocks rally after Trump says US could leave Iran in a few weeks 📉 Gold prices 👑 set for worst month since 2008 as Iran war 🇮🇷 continues Oil prices 🛢️ pull lower following reports of Trump 🇺🇸 considering end to Middle East conflict Pound ticks higher as UK GDP growth 🇬🇧 confirmed as nearly stagnant in Q4 📊 Stocks set to rise 📈 as Trump willing to end Iran war 🇮🇷 without Hormuz deal Average UK house price 🏡 rises to £277,186 in March 📈 Mortgage approvals ✔️ jump by most since November, Bank of England 🏦 says Brent crude 🛢️ prices up to $115 a barrel 📈 as traders assess Trump peace deal claims Pound 💷 set for biggest monthly loss against dollar 💲 since October Stocks set to tumble as Middle East conflict intensifies Gold and silver prices rise 📈 with eyes on central banks and Iran war 💷 UK currency dips amid weaker retail sales while Middle East war ramps up inflation fears 💷 Stocks muted as Trump delays strikes on Iran power plants 🌍 Pound 💷 dips against dollar as OECD warns Middle East conflict will drive up UK inflation ⛽🛍️ Oil prices 🛢️ higher as Trump claims Iran doesn't want to admit they spoke 🗣️ Bitcoin price struggles near $70K as peace talk hopes falter Pound 💷 steady as Bank of England 🏦 interest rate rise bets ease Gold 🪙 price jumps ⬆️ 3% as oil slump eases inflation fears amid Trump Iran plan Stocks rise 📈 on reports of Trump offering 15-point ceasefire plan to Iran 🗒️ Oil price ⛽ plunges 📉 as Trump announces plan to end Iran war 💷 Pound dips against dollar 💵 as speculation around UK interest rates grow ⚡️ ASML, Estée Lauder, Bellway, Kingfisher and Fevertree ⚡️ ⚡️ Gold and silver price moves muted amid inflation and interest rate hike risks ⚡️ ⚡️ Stocks lack direction as traders assess Middle East conflict ⚡️ 🛢️Tehran's denial of negotiations clouds prospect of reopening Strait of Hormuz and ending conflict 🛢️ Pound 💷 dips against dollar 💲 amid mounting expectations of Bank of England 🏦 rate increase Gold 🪙 and silver erase 2026 gains as Middle East inflation fears stoke bets on higher rates London plunges into correction territory as Trump gives Iran ultimatum Oil prices ⛽ gain as Trump and Starmer discuss need to reopen Hormuz ⚡️ UK inflation, BYD, Next, Kingfisher and Bellway ⚡️ Gold 👑 set for third weekly fall 📉 as strong dollar and Fed stance weigh Pound steady 🇬🇧 as investors digest UK borrowing data 📊 and interest rate decisions Stocks higher 📈 as Netanyahu 🇮🇱 says he will 'hold off' on gas field attacks Oil prices 🛢️ fall as Netanyahu signals pause in Iran strikes 🇮🇷 Government borrowing rose 📈 by more than expected to £14.3bn in February UnitedHealth Group (UNH) shares ended the last trading session 9.4% higher at $307.73. The jump came on an impressive volume with a higher-than-average number of shares changing hands in the session. This compares to the stock's 1.3% loss over the past four weeks. CMS finalized Medicare Advantage payment rates for 2027 with an average increase of 2.48%. That’s a big improvement from the 0.09% increase proposed in January, lifting sentiment across the sector. UnitedHealth is one of the largest Medicare Advantage providers in the U.S., so CMS reimbursement changes matter. Even small rate shifts can have a meaningful impact on UNH due to its scale. In 2025, its Medicare Advantage membership stood at 8.445 million. The 2027 rate increase will improve earnings visibility going forward. This largest U.S. health insurer is expected to post quarterly earnings of $6.46 per share in its upcoming report, which represents a year-over-year change of -10.3%. Revenues are expected to be $109.95 billion, up 0.3% from the year-ago quarter. Earnings and revenue growth expectations certainly give a good sense of the potential strength in a stock, but empirical research shows that trends in earnings estimate revisions are strongly correlated with near-term stock price movements. For UnitedHealth, the consensus EPS estimate for the quarter has been revised 4.1% higher over the last 30 days to the current level. And a positive trend in earnings estimate revision usually translates into price appreciation. So, make sure to keep an eye on UNH going forward to see if this recent jump can turn into more strength down the road. The stock currently carries a Zacks Rank #3 (Hold). You can see the complete list of today's Zacks Rank #1 (Strong Buy) stocks here >>>> UnitedHealth is part of the Zacks Medical - HMOs industry. Cigna (CI), another stock in the same industry, closed the last trading session 0.5% lower at $274.25. CI has returned 2.2% in the past month. For Cigna, the consensus EPS estimate for the upcoming report has remained unchanged over the past month at $7.57. This represents a change of +12.3% from what the company reported a year ago. Cigna currently has a Zacks Rank of #3 (Hold). Want the latest recommendations from Zacks Investment Research? Today, you can download 7 Best Stocks for the Next 30 Days. Click to get this free report UnitedHealth Group Incorporated (UNH) : Free Stock Analysis Report This article originally published on Zacks Investment Research (zacks.com). Tip: Try a valid symbol or a specific company name for relevant results",https://uk.finance.yahoo.com/news/unitedhealth-unh-soars-9-4-085900764.html
UNH,UnitedHealth Stock Pulls Back to Support – Smart Entry? - Trefis,2026-04-08 07:19:14,"UnitedHealth (UNH) stock should be on your watchlist. Here is why – it is currently trading in the support zone ($292.34 – $323.12), levels from which it has bounced meaningfully before. Since 2020, UnitedHealth stock has received buying interest at this level 4 times and subsequently went on to generate 39.5% in average peak returns. Yet, a support zone alone isn’t enough; rebounds are more likely when fundamentals, sentiment, and market conditions line up. How does that look for UNH? UnitedHealth’s rebound potential is bolstered by the 2027 Medicare Advantage rate update, de-risking a major segment and driving recent analyst upgrades. While Q1 earnings may reflect ongoing medical cost pressure, management’s focus on exiting unprofitable contracts and significant AI-driven cost reductions support 2026 EPS growth. This operational resilience, combined with a depressed valuation, positions UNH for recovery despite persistent regulatory scrutiny. *LTM: Last Twelve Months | For more details on UNH fundamentals, read Buy or Sell UNH Stock. UNH isn’t immune to big drops. During the Global Financial Crisis, it fell over 72%, and in the Dot-Com bust, it dropped about 42%. The Covid selloff cut it by roughly 36%, while the 2018 correction and recent inflation shock nudged it down 24% and 18%, respectively. Even a strong business can suffer major dips when markets turn sour. It’s a reminder that no stock is completely crash-proof. But the risk is not limited to major market crashes. Stocks fall even when markets are in good shape – think events like earnings, business updates, outlook changes. Read UNH Dip Buyer Analyses to see how the stock has recovered from sharp dips in the past. Still not sure about UNH stock? Consider the portfolio approach. Individual stocks can soar or tank, but one thing matters: staying invested. The right portfolio can help you stay invested, capture upside, and mitigate the downside associated with any individual stock. Beating the market consistently is hard, but the Trefis High Quality (HQ) Portfolio makes it look achievable. By selecting 30 high-conviction stocks, the HQ strategy has historically outpaced the S&P 500, S&P Mid-cap, and Russell 2000. See how this curated selection delivers superior risk-adjusted returns in our detailed performance factsheet. OR Royalties Stock 5-Day Winning Spree: Stock Climbs 18% Tandem Diabetes Care Stock Slides -26% With A 8-Day Losing Spree Newmont Stock On Fire: Up 15% With 5-Day Winning Streak FactSet Research Systems Stock Rockets 17% With 6-Day Winning Streak UnitedHealth Stock Shares $77 Bil Success With Investors UnitedHealth Stock Has Fallen 23%, Time to Enter? Is UnitedHealth Stock Built to Withstand More Downside? Catalysts That Could Propel UnitedHealth Stock to the Moon Is UnitedHealth Stock Heading for a Fall? What Just Happened With UnitedHealth Stock? UnitedHealth Stock Has Fallen 21%, Time to Enter? UnitedHealth Stock Drop Looks Sharp, But How Deep Can It Go? UnitedHealth Stock Pays Out $78 Bil – Investors Take Note Is UnitedHealth Stock Heading for a Fall? The Next Big Rally in UnitedHealth Stock Could Start Like This ©Copyright 2026 Insight Guru Inc. All Rights Reserved. By using the Site, you agree to be bound by our Terms of
		Use.  Financial market data powered by Quotemedia.com.
		Consensus EPS estimates are from QuoteMedia and are updated every weekday.
		All rights reserved. NYSE/AMEX data delayed 20 minutes.  NASDAQ and other
		data delayed 15 minutes unless indicated.",https://www.trefis.com/stock/unh/articles2/596049/unitedhealth-stock-pulls-back-to-support-smart-entry/2026-04-08
UNH,UnitedHealth Group (UNH) Upgraded Over Potential Upside to Earnings Estimates - Yahoo Finance,2026-04-08 06:21:00,"Tip: Try a valid symbol or a specific company name for relevant results The above button links to Coinbase. Yahoo Finance is not a broker-dealer or investment adviser and does not offer securities or cryptocurrencies for sale or facilitate trading. Coinbase pays us for certain activity generated through this link. Prices displayed are informational. UnitedHealth Group Incorporated (NYSE:UNH) is included among the 15 Best S&P 500 Stocks to Buy Right Now. UnitedHealth Group Incorporated (NYSE:UNH) is a health care and well-being company with team members in two distinct and complementary businesses – its insurance wing, UnitedHealthcare, and its health services segment, Optum. UnitedHealth Group Incorporated (NYSE:UNH) received a boost on April 1 when Raymond James analyst John Ransom upgraded the stock from ‘Market Perform’ to ‘Outperform’. The analyst assigned UNH a price target of $330, indicating an upside of 19% from the current levels. Mr. Ransom cited a potential upside to the company’s earnings estimates over the coming years for the upgrade. The analyst expects a ‘modest’ 20 basis point upside to UnitedHealth Group Incorporated (NYSE:UNH)’s general and administrative expenses for 2027 and 2028, driven by potential AI initiatives and margin improvement at the company’s health services arm, Optum Health. UnitedHealth Group Incorporated (NYSE:UNH) is projecting cost reductions of nearly $1 billion for FY 2026, largely attributed to AI and automation. The company expects an adjusted EPS of greater than $17.75 for the year, with measured growth across all reporting segments, and UnitedHealthcare is projected to deliver double-digit improvements. The Minnesota-based firm has a revenue guidance of nearly $440 billion for 2026. Mairs & Power, an investment advisor, recently stated the following regarding UnitedHealth Group Incorporated (NYSE:UNH) in its Q4 2025 investor letter: “While stock selection has historically delivered positive long-term results for our shareholders, it was a notable headwind in 2025, with Fiserv (FI) and UnitedHealth Group Incorporated (NYSE:UNH) standing out as prominent detractors from relative performance. Despite their recent pullbacks, both positions remain substantial long-term winners, appreciating more than 300% and 100%, respectively, since our initial investments. Both companies experienced significant execution missteps that ultimately resulted in weaker-than-expected reported fundamentals. Although we had been trimming these positions due to stretched valuations and growing concerns around leadership uncertainty, in hindsight we should have acted more decisively in reducing our exposure to these names. That said, we believe the challenges at both companies are largely self-inflicted operational issues rather than structural impairments to their franchises. In short, the problems appear fixable but will take time to resolve. We are therefore comfortable maintaining our current positions and believe patient capital will ultimately be rewarded as execution improves…” (Click here to read the full text) While we acknowledge the potential of UNH as an investment, we believe certain AI stocks offer greater upside potential and carry less downside risk. If you're looking for an extremely undervalued AI stock that also stands to benefit significantly from Trump-era tariffs and the onshoring trend, see our free report on the best short-term AI stock. READ NEXT: 15 Best High Yield Energy Stocks to Buy Now and 14 Best Energy Stocks to Buy According to Wall Street Analysts Disclosure: None. Follow Insider Monkey on Google News. Tip: Try a valid symbol or a specific company name for relevant results",https://finance.yahoo.com/sectors/healthcare/articles/unitedhealth-group-unh-upgraded-over-070224075.html
UNH,UnitedHealth Stock Rockets 19% With 6-Day Winning Streak - Trefis,2026-04-08 04:49:39,"©Copyright 2026 Insight Guru Inc. All Rights Reserved. By using the Site, you agree to be bound by our Terms of
		Use.  Financial market data powered by Quotemedia.com.
		Consensus EPS estimates are from QuoteMedia and are updated every weekday.
		All rights reserved. NYSE/AMEX data delayed 20 minutes.  NASDAQ and other
		data delayed 15 minutes unless indicated. This interactive model has a limit on the number of drivers that can be modified in a single scenario.  When the limit is reached those drivers not yet modified become disabled for modification.
	
Your options are: This interactive model has a minimum and/or maximum limit on the value for the current driver you are viewing. This driver cannot be modified within this scenario. This scenario is linked to a parent scenario that has already modified this driver.",https://www.trefis.com/data/companies/UNH/no-login-required/I8ouwqyf/UnitedHealth-Stock-Rockets-19-With-6-Day-Winning-Streak
UNH,6-Day Rally Sends UnitedHealth Stock Up 19% - Trefis,2026-04-08 04:30:40,"UnitedHealth (UNH) – a provider of health plans and pharmacy care services – hit a 6-day winning streak, with cumulative gains over this period amounting to 19%. The company’s market cap has surged by about $44 Bil over the last 6 days and currently stands at $279 Bil. Is this an opportunity or a trap? There is a near-equal mix of good and bad in UNH stock given its overall Moderate operating performance and financial condition. This is aligned with the stock’s Moderate valuation because of which we think it is Fairly Priced (For details, see Buy or Sell UNH). But here is the interesting part. You are reading about this 19% move after it happened. The market has already priced in the news. To catch the next winner before the headlines, you need predictive signals, not notifications. High Quality Portfolio is based on an architecture that includes such signals. The following table summarizes the return for UNH stock vs. the S&P 500 index over different periods, including the current streak: However, big gains can follow sharp reversals – but how has UNH behaved after prior drops? See UNH Dip Buyer Analysis to learn more. There are currently 69 S&P constituents with 3 days or more of consecutive gains and 33 constituents with 3 days or more of consecutive losses. While UNH stock looks attractive given its winning streak, investing in a single stock without detailed, thorough analysis can be risky. The Trefis High Quality (HQ) Portfolio, with a collection of 30 stocks, has a track record of comfortably outperforming its benchmark that includes all 3 — the S&P 500, S&P mid-cap, and Russell 2000 indices. Why is that? As a group, HQ Portfolio stocks provided better returns with less risk versus the benchmark index; less of a roller-coaster ride, as evident in HQ Portfolio performance metrics. OR Royalties Stock 5-Day Winning Spree: Stock Climbs 18% Tandem Diabetes Care Stock Slides -26% With A 8-Day Losing Spree Newmont Stock On Fire: Up 15% With 5-Day Winning Streak FactSet Research Systems Stock Rockets 17% With 6-Day Winning Streak UnitedHealth Stock Pulls Back to Support – Smart Entry? UnitedHealth Stock Shares $77 Bil Success With Investors UnitedHealth Stock Has Fallen 23%, Time to Enter? Is UnitedHealth Stock Built to Withstand More Downside? Catalysts That Could Propel UnitedHealth Stock to the Moon Is UnitedHealth Stock Heading for a Fall? What Just Happened With UnitedHealth Stock? UnitedHealth Stock Has Fallen 21%, Time to Enter? UnitedHealth Stock Drop Looks Sharp, But How Deep Can It Go? UnitedHealth Stock Pays Out $78 Bil – Investors Take Note Is UnitedHealth Stock Heading for a Fall? ©Copyright 2026 Insight Guru Inc. All Rights Reserved. By using the Site, you agree to be bound by our Terms of
		Use.  Financial market data powered by Quotemedia.com.
		Consensus EPS estimates are from QuoteMedia and are updated every weekday.
		All rights reserved. NYSE/AMEX data delayed 20 minutes.  NASDAQ and other
		data delayed 15 minutes unless indicated.",https://www.trefis.com/stock/unh/articles/596020/6-day-rally-sends-unitedhealth-stock-up-19/2026-04-08
