ticker,title,date,content,url
V,Cremonese - Bologna - Flashscore.com,2026-04-04 19:53:05,"Retrouvez nos conseils sur www.joueurs-info-service.fr (09-74-75-13-13, appel non surtaxé) 18+ | Erlaubtes Glücksspiel gemäß der Whitelist | Suchtrisiken | Hilfe unter buwei.de 21+ Участь в азартних іграх може викликати ігрову залежність. Дотримуйтеся правил (принципів) відповідальної гри After ending a long winless run before the international break, Cremonese will hope to pick up where they left off in the battle against the drop in Serie A when they host European-chasing Bologna. It was a dream start for new Cremonese boss Marco Giampaolo, as he ended their 15-game winless streak (D4, L11) with a 2-0 victory over Parma in his first game in charge to move them out of the relegation zone. With only goal difference keeping them outside the drop zone, there is still plenty of work to do, and pulling further clear of the bottom three is far from guaranteed at home, where Cremonese have won just twice this Serie A season (W2, D6, L6). After losing the last two league games they hosted, La Cremo are now at risk of losing three consecutive Serie A home matches for the first time since February 2023. After losing 2-0 to Lazio in their last Serie A match, Bologna’s European hopes are hanging by a thread. With a two-legged UEFA Europa League quarter-final to come after this game, Bologna could be forgiven for prioritising that competition given that it could be deemed their best route back into Europe for next season as they currently trail the top six in Serie A by 12 points. With just eight games remaining, closing that gap seems a tall order, but they could well make inroads this weekend having won their last six away matches in all competitions which served as a club record! Seven of the last ten H2Hs in Serie A or Serie B ended level, but it was Cremonese who won the reverse fixture 3-1, affording them the chance to complete a first-ever top-flight double over Bologna. Cremonese have failed to score in 14 of their 30 Serie A matches this term. Only Parma (eight) have scored fewer than Cremonese’s nine first-half league goals pre-round. Bologna have scored just one Serie A goal in the opening 15 minutes this season. Bologna have seen a pre-round joint-league high 19 of their matches stand level at half-time. Youssef Maleh’s winner against Parma means each of his last six goalscoring appearances ended in victory, opening the scoring in each of the last two. Bologna’s Thijs Dallinga has delivered in key moments, with four of his five goals this season serving as the match winner. Cremonese will evaluate Federico Baschirotto before this match, while Bologna will hope to see Tommaso Pobega and Jens Odgaard return after missing their last match. For all the latest team news, please check the Flashscore match centre. Given Bologna’s penchant for playing out first-half draws and Cremonese’s difficulties in front of goal, backing the half-time result to be a draw could be a smart play. Retrouvez nos conseils sur www.joueurs-info-service.fr (09-74-75-13-13, appel non surtaxé) 18+ | Erlaubtes Glücksspiel gemäß der Whitelist | Suchtrisiken | Hilfe unter buwei.de 21+ Участь в азартних іграх може викликати ігрову залежність. Дотримуйтеся правил (принципів) відповідальної гри Use precise geolocation data. Actively scan device characteristics for identification. Store and/or access information on a device. Personalised advertising and content, advertising and content measurement, audience research and services development. 
        List of Partners (vendors) We process your data to deliver content or advertisements and measure the delivery of such content or advertisements to extract insights about our website. We share this information with our partners on the basis of consent and legitimate interest. You may exercise your right to consent or object to a legitimate interest, based on a specific purpose below or at a partner level in the link under each purpose. These choices will be signaled to our vendors participating in the Transparency and Consent Framework. The choices you make regarding the purposes and vendors listed in this notice are saved and stored locally on your device for a maximum duration of 1 year.
            More informationThird partiesUser ID:  45f28283-ba78-41cc-90da-77009022f541This User ID will be used as a unique identifier while storing and accessing your preferences for future.Timestamp:  -- These cookies are necessary for the website to function and cannot be switched off in our systems. They are usually only set in response to actions made by you which amount to a request for services, such as setting your privacy preferences, logging in or filling in forms.  You can set your browser to block or alert you about these cookies, but some parts of the site will not then work. These cookies do not store any personally identifiable information. These cookies allow us to count visits and traffic sources so we can measure and improve the performance of our site. They help us to know which pages are the most and least popular and see how visitors move around the site.  If you do not allow these cookies we will not know when you have visited our site, and will not be able to monitor and improve its performance. These cookies may be set through our site by our advertising partners. They may be used by those companies to build a profile of your interests and show you relevant adverts on other sites. They do not store directly personal information, but are based on uniquely identifying your browser and internet device. If you do not allow these cookies, you will experience less targeted advertising. These cookies enable the website to provide enhanced functionality and personalisation. They may be set by us or by third party providers whose services we have added to our pages.  If you do not allow these cookies then some or all of these services may not function properly. Cookies, device or similar online identifiers (e.g. login-based identifiers, randomly assigned identifiers, network based identifiers) together with other information (e.g. browser type and information, language, screen size, supported technologies etc.) can be stored or read on your device to recognise it each time it connects to an app or to a website, for one or several of the purposes presented here. Advertising presented to you on this service can be based on limited data, such as the website or app you are using, your non-precise location, your device type or which content you are (or have been) interacting with (for example, to limit the number of times an ad is presented to you). Information about your activity on this service (such as forms you submit, content you look at) can be stored and combined with other information about you (for example, information from your previous activity on this service and other websites or apps) or similar users. This is then used to build or improve a profile about you (that might include possible interests and personal aspects). Your profile can be used (also later) to present advertising that appears more relevant based on your possible interests by this and other entities. Advertising presented to you on this service can be based on your advertising profiles, which can reflect your activity on this service or other websites or apps (like the forms you submit, content you look at), possible interests and personal aspects. Information about your activity on this service (for instance, forms you submit, non-advertising content you look at) can be stored and combined with other information about you (such as your previous activity on this service or other websites or apps) or similar users. This is then used to build or improve a profile about you (which might for example include possible interests and personal aspects). Your profile can be used (also later) to present content that appears more relevant based on your possible interests, such as by adapting the order in which content is shown to you, so that it is even easier for you to find content that matches your interests. Content presented to you on this service can be based on your content personalisation profiles, which can reflect your activity on this or other services (for instance, the forms you submit, content you look at), possible interests and personal aspects. This can for example be used to adapt the order in which content is shown to you, so that it is even easier for you to find (non-advertising) content that matches your interests. Information regarding which advertising is presented to you and how you interact with it can be used to determine how well an advert has worked for you or other users and whether the goals of the advertising were reached. For instance, whether you saw an ad, whether you clicked on it, whether it led you to buy a product or visit a website, etc. This is very helpful to understand the relevance of advertising campaigns. Information regarding which content is presented to you and how you interact with it can be used to determine whether the (non-advertising) content e.g. reached its intended audience and matched your interests. For instance, whether you read an article, watch a video, listen to a podcast or look at a product description, how long you spent on this service and the web pages you visit etc. This is very helpful to understand the relevance of (non-advertising) content that is shown to you. Reports can be generated based on the combination of data sets (like user profiles, statistics, market research, analytics data) regarding your interactions and those of other users with advertising or (non-advertising) content to identify common characteristics (for instance, to determine which target audiences are more receptive to an ad campaign or to certain contents). Information about your activity on this service, such as your interaction with ads or content, can be very helpful to improve products and services and to build new products and services based on user interactions, the type of audience, etc. This specific purpose does not include the development or improvement of user profiles and identifiers. Content presented to you on this service can be based on limited data, such as the website or app you are using, your non-precise location, your device type, or which content you are (or have been) interacting with (for example, to limit the number of times a video or an article is presented to you). With your acceptance, your precise location (within a radius of less than 500 metres) may be used in support of the purposes explained in this notice. With your acceptance, certain characteristics specific to your device might be requested and used to distinguish it from other devices (such as the installed fonts or plugins, the resolution of your screen) in support of the purposes explained in this notice. Your data can be used to monitor for and prevent unusual and possibly fraudulent activity (for example, regarding advertising, ad clicks by bots), and ensure systems and processes work properly and securely. It can also be used to correct any problems you, the publisher or the advertiser may encounter in the delivery of content and ads and in your interaction with them. Certain information (like an IP address or device capabilities) is used to ensure the technical compatibility of the content or advertising, and to facilitate the transmission of the content or ad to your device. Information about your activity on this service may be matched and combined with other information relating to you and originating from various sources (for instance your activity on a separate online service, your use of a loyalty card in-store, or your answers to a survey), in support of the purposes explained in this notice. In support of the purposes explained in this notice, your device might be considered as likely linked to other devices that belong to you or your household (for instance because you are logged in to the same service on both your phone and your computer, or because you may use the same Internet connection on both devices). Your device might be distinguished from other devices based on information it automatically sends when accessing the Internet (for instance, the IP address of your Internet connection or the type of browser you are using) in support of the purposes exposed in this notice. The choices you make regarding the purposes and entities listed in this notice are saved and made available to those entities in the form of digital signals (such as a string of characters). This is necessary in order to enable both this service and those entities to respect such choices.",https://www.flashscore.com/match/football/bologna-0M9xNN8N/cremonese-KUzfp5N3/
V,"Verona v Fiorentina, De Gea: ""Every save is dedicated to my father, who is in hospital"" - Goal.com",2026-04-04 19:42:15,"The Fiorentina goalkeeper was man of the match in this crucial victory for their survival: a 10 for the Viola, with Fagioli’s goal proving decisive Fiorentina’s survival also hinges on David De Gea, the Spanish goalkeeper formerly of Manchester United, who – in what has been an extremely difficult season for the Viola – has been keeping Vanoli’s side afloat in these final months of the league campaign. Even in the away match at Verona, a crucial head-to-head clash in the battle to avoid relegation, the 35-year-old made decisive saves that shaped the final result: Fiorentina won 1-0, with Nicolò Fagioli’s goal proving decisive just over ten minutes from the end of the match. The match ended ten against ten with a sending-off for each side, Suslov for the Gialloblù and Gudmundsson for the visitors. Named man of the match, De Gea had a special message to share in the post-match interview: ""All my saves are dedicated to my father, who is in hospital,"" he told DAZN. ""We didn’t play our best game of the season, but sometimes we’ve come away with less than we deserved, and today the opposite happened; that’s football. Today we were focused on this match because we haven’t done anything yet in the battle to avoid relegation; then there’s Europe, which gives us new motivation: Crystal Palace are a team that, like all Premier League sides, attack a lot and play on a small pitch; they’re strong, but we’ll try to do our best.” With their victory over Verona, Fiorentina have now gone four consecutive league matches without defeat; this figure rises to six if we include the home and away legs of the Conference League round of 16 against Rakow. In Serie A, the Viola are now five points clear of the relegation zone, third-bottom place is occupied by Lecce on 27 points, though they have a game in hand (they play Atalanta tomorrow), and Vanoli’s side are on 32 points after overtaking Cagliari thanks to the three points earned against the Gialloblù and capitalising on Pisacane’s side’s defeat in Reggio Emilia against Sassuolo. Add GOAL.com as a preferred source on Google to see more of our reporting",https://www.goal.com/en/lists/verona-v-fiorentina-de-gea-every-save-is-dedicated-to-my-father-who-is-in-hospital/bltc5ba393745d53da8
V,Glasgow v Bulls: Five takeaways as Warriors clinch historic first while South Africa’s European journey grinds to a halt - Planet Rugby,2026-04-04 19:29:22,"Cameron Hanekom is tackled by Alex Samuel and an inset of Sione Tuipulotu and Stafford McDowall (INPHO/Bryan Keane/EPCR Rugby). Following Glasgow Warriors’ 25-21 victory over the Bulls, here are our five takeaways from the Investec Champions Cup round of 16 clash at Scotstoun Stadium. Franco Smith’s Glasgow Warriors march on to the quarter-finals of the 2025/26 Champions Cup after muscling past the Bulls in a closely fought, niggly knockout match that Storm Dave threatened to spoil, but the 2024 URC finalists did not allow that to be the case as they produced a thrilling encounter, rewarding those who braved the conditions. It took some time for the teams to adjust to the torrential rain, with Handre Pollard opening the visitors’ account in the 12th minute with a penalty. Glasgow’s counter punch came five minutes later as Stafford McDowall made a cracking break. Matt Fagerson was pulled down just short before Max Williamson powered over. The Warriors were far more fancied heading into the clash but the Bulls certainly weren’t going to make it easy for them with David Kriel producing a delicious offload to send Johan Grobbelaar over in the corner. The lead continued to change hands as Jack Dempsey powered over from close range after Glasgow’s rolling maul was brought down in the 33rd minute but Pollard had the final say of the half with a penalty as the Bulls led 12-14 at half-time. Tries for Patrick Schickerling and McDowall gave Glasgow an eight-point buffer in the final ten minutes before Marco van Staden made it a one-point lead with four minutes left to play but the Warriors held out for the win as Adam Hastings dissected the posts with the final kick of the match. While Smith will be pleased with the final result, he will be demanding improvements when Glasgow host a Champions Cup quarter-final for the first time next weekend when they face RC Toulon. The conditions made it nigh on impossible for lengthy attacking passages of play, and that is evident with the number of turnovers the Warriors conceded. On 17 occasions, they coughed up possession, more than double the Bulls’ eight. The Warriors train in testing conditions, and perhaps they felt they should stick to their guns and expansive attacking game. The Bulls weren’t able to capitalise on the opportunities that Glasgow presented to them, but RC Toulon might. Since Johan Ackermann took over from Jake White as head coach, he has instilled a more attacking brand of rugby but that was shelved today due to the conditions and the Bulls leaned on their traditional strengths. Pollard kicked the leather off the ball, Kurt-Lee Arendse, Canan Moodie and Cheswill Jooste contested brilliantly in the air to force errors while Embrose Papier made good use of the big-bodied forwards coming around the corner. Storm Dave ensured that this was never going to be a free-flowing attacking game, and with the odds stacked against them tackling a powerhouse Glasgow team in Scotstoun, the men from Pretoria rose to the challenge. Historically, the Bulls are renowned for their forward and kick-heavy style of play, and as much as Ackermann wants that to change, he will be pleased that his charges adapted to what was in front of them and stuck in the fight against one of the best teams in Europe and at one of the most difficult venues in club rugby. Pollard was a crucial cog in the Bulls performance, with the double World Cup winner well-versed and suited for such conditions. The 32-year-old is not an expansive, attacking number ten, but he is a masterful tactician and game manager, which was pivotal. The set-pieces is another area of the game where the Bulls stepped up to the mark. The scrum was hit-and-miss with the officials but they were driving the Warriors’ pack backwards more often than not. More crucially, Ruan Nortje put in a performance reminiscent of Victor Matfield at lineout time with both teams fiercely competing on the throws. When he wasn’t nicking one of Gregor Hiddleston’s darts, he was spoiling Glasgow’s possession, making it even more difficult for the Warriors to attack from. Stormers player ratings: Sacha Feinberg-Mngomezulu’s sensational cameo falls just short of epic victory And then there were none. The Sharks, Stormers and now Bulls all saw their EPCR journeys this season come to a close this weekend as the South African teams continue to struggle in the Champions Cup. The Sharks weren’t able to replicate their 2024 success in the Challenge Cup while the Stormers and Bulls were incredibly competitive in their knockout matches but failed to grind out the victory. A South African team is still yet to progress past the quarter-finals of the Champions Cup and this year, the round of 16 was the hurdle they couldn’t overcome. But it’s plainly obvious that if they are to go further into the tournament next season, they will need to take the pool stage matches more seriously, as winning on the road in the knockouts is no easy feat. Toulouse were beaten in their last visit to Scotsoun, and the French giants have far more financial pull and player depth than the Bulls, but Ackermann’s men would have stood a much better chance of beating the Warriors had the game taken place in Pretoria. Ex-Springboks coach fumes over ‘dreadful’ referee decisions in Stormers’ Champions Cup defeat There were top-quality performances littered throughout the respective matchday 23 but McDowall was quite rightly picked as the Player of the Match, vindicating Smith’s decision to select him over British and Irish Lion Huw Jones. The 28-year-old sparked the attack that led to the opening try, grabbed one of his own later in the match and put his booming boot to good use to pin the Bulls back in their own half. Defensively, he was a sound and hardly put a foot wrong with ball in hand. Rory Darge and Fagerson were standouts in the Glasgow pack while it was a memorable performance for Shickerling too. Want more from Planet Rugby? Add us as a preferred source on Google to your favourites list for world-class coverage you can trust. Had the Bulls managed to clinch the result, Grobbelaar could well have picked up McDowall’s award as the Springboks hooker racked up a mammoth 29 tackles – seven more than the next best tally posted by Darge. He also pitched in with a try, 10 carries and a 90% lineout success rate. Malcolm Marx is very clearly the first-choice hooker for the Springboks but Grobbelaar is continuing to strengthen his claim for more minutes in the Green and Gold jersey. Meanwhile, it was an eventful cameo off the bench from Van Staden who was listed as Grobbelaar’s back-up at hooker but featured in the back-row instead. The World Cup winner brought his usual energy and aggression but was guilty of gifting Glasgow the opportunity to clinch the result and one they did not pass up on. He conceded the penalty for dragging Josh McKay into touch, after the tackle had already been completed and compounded the error with the afters that marched Glasgow 10 metres further up the pitch. The Warriors capitalised with McDowall going over in the corner. Van Staden looked to have rectified his mistake by scoring a try soon after but the damage had been done and it left the Bulls too big of a mountain to climb. While the Bulls rose to the challenge in many respects, the difference between winning and losing today lay with their discipline as they conceded 14 penalties to the Warriors’ eight. READ MORE: Bath v Saracens: Five takeaways as ‘Thomas the Tank’ sparks recovery while Itoje’s men restore ‘self-respect’ © Planet Sport Limited 2026 • All Rights Reserved",https://www.planetrugby.com/news/glasgow-v-bulls-five-takeaways-as-warriors-clinch-historic-first-while-south-africas-european-journey-grinds-to-a-halt
V,"Softball v Maryland, Allison Oneacre prepping at the base - The Daily Collegian",2026-04-04 19:03:00,"Infielder Allison Oneacre (26) prepares to bat during the Softball doubleheader against Maryland in the Nittany Lion Softball Park and Beard Field on Saturday, April 4, 2026 in University Park, Pa. The Nittany Lions beat the Terrapins 16-4 during the first game and 2-0 during the second game. Your browser is out of date and potentially vulnerable to security risks.We recommend switching to one of the following browsers: We won't sell your personal information to inform the ads you see. You may still see interest-based ads if your information is sold by other companies or was sold previously.",https://www.psucollegian.com/softball-v-maryland-allison-oneacre-prepping-at-the-base/image_b76a890a-bf8a-4cdc-83b4-0368dd5686e7.html
V,Sutton's predictions: West Ham v Leeds - Yahoo Sports,2026-04-04 18:26:58,"The most intriguing thing about this tie is how both teams are going to approach it. They are both in the thick of the relegation battle at the bottom of the table and will surely have at least one eye on that, rather than being fully focused on the FA Cup. Leeds don't play in the league until the following Monday, when they go to Old Trafford, but West Ham are back in action on Friday, at home to bottom side Wolves. Out of the two games, Wolves is surely the one that Hammers boss Nuno Espirito Santo will prioritise, because it has to be seen as 'must win' for them - but you could argue Leeds manager Daniel Farke will do the same before his side play Manchester United too. The one thing both teams definitely don't want here is extra time, and what usually happens in that scenario is that the tie goes the distance. So, that's what I am going to say we will see here, too. You won't be able to split the teams over 90 minutes, but then Leeds will be the ones who find a winner.",https://sports.yahoo.com/articles/suttons-predictions-west-ham-v-182658893.html
