ticker,title,date,content,url
V,What oral argument told us in the birthright citizenship case - SCOTUSblog,2026-04-03 16:04:41,"Empirical SCOTUS is a recurring series by Adam Feldman that looks at Supreme Court data, primarily in the form of opinions and oral arguments, to provide insights into the justices’ decision making and what we can expect from the court in the future. As Amy Howe reported for SCOTUSblog on Wednesday, the Supreme Court heard just over two hours of oral argument on April 1 in Trump v. Barbara, the challenge to President Donald Trump’s executive order ending birthright citizenship for children born in the United States to parents who are undocumented or present in the country on temporary visas. Solicitor General D. John Sauer argued for the government. ACLU National Legal Director Cecillia Wang argued for a class of affected children and families. Trump attended the argument – the first sitting president to do so – and departed shortly after Sauer finished his presentation. Every lower court to consider the executive order has blocked it. The question before the justices is whether the order complies with the citizenship clause of the 14th Amendment and 8 U.S.C. § 1401(a), which codifies the citizenship clause. The government’s theory turns on the phrase “subject to the jurisdiction thereof” in the citizenship clause and the statute, which Sauer argued should be read to require the parents’ allegiance and domicile (that is, permanent home in or connection with the United States) – concepts he contended would exclude unauthorized immigrants and temporary visa holders from the clause’s reach. Wang pressed the broader reading: that virtually everyone born on U.S. soil is a citizen, with narrow exceptions for children of foreign diplomats and hostile occupying forces. Now that the dust has (somewhat) settled from oral argument, I closely analyzed the transcript to really understand how the argument unfolded – who drove it, what it centered on, and what it tells us about a possible outcome. First of all, the advocates got a good deal of words in (Sauer especially) but the bench ultimately controlled the argument. The broadest measure of an oral argument is, obviously, who does the talking. In Trump v. Barbara, the bench spoke a combined 9,454 words – more than either advocate. Sauer spoke 7,575 words across 110 exchanges. Wang spoke 4,861 words across 77 exchanges. Among individual justices, Justice Amy Coney Barrett led (just barely) in total words (1,738), followed closely by Justices Ketanji Brown Jackson (1,726) and Samuel Alito (1,417). Justice Neil Gorsuch spoke 1,126 words and Justice Brett Kavanaugh 1,084. At the other end were Chief Justice John Roberts at 357 words and Justice Clarence Thomas with just 242 words. An interesting pattern emerges when we look to what each justice focused on. Oral arguments at the Supreme Court vary widely in this regard. Some are dominated by pragmatic and doctrinal concerns. But this one was dominated by history and originalism. The originalism-intensity measure – a rate of originalist-theme references per 1,000 words spoken – captures the degree to which each participant framed the argument in historical and originalist terms. Arch-originalist Thomas led at 37.2 references per 1,000 words, with Jackson (who is certainly not a self-described originalist) close behind at 34.2. Of note, the justice least focused on originalism was the chief, who focused on history far less than anyone else. As for specific themes and issues, the argument was organized around a relatively small number of doctrinal questions. “Citizenship” was the most frequently referenced theme across all three speaker groups (the bench, Sauer, and Wang). “Domicile” ranked second overall. “Allegiance” came in third, and “history” and “jurisdiction” filled out the remaining space. Among the justices, the graph above reveals their individual priorities. For example, Jackson concentrated on allegiance, domicile, citizenship, and history/originalism. Barrett was more attuned to citizenship, jurisdiction, and history/originalism. Alito was focused most on precedent and domicile – consistent with his questioning of Wang on the 1898 case of Wong Kim Ark, the court’s most important precedent on birthright citizenship. Kavanaugh was more diffuse but spoke most often of precedent and history/originalism. I next studied how much questioning each justice did of each advocate. Gorsuch concentrated heavily on Sauer and much less on Wang. Jackson and Roberts behaved similarly. On the other side, Alito directed most of his questioning to Wang – as did Barrett and Kavanaugh. Justice Sonia Sotomayor and Thomas were more balanced. In terms of substance, Gorsuch and Jackson were perhaps the most hostile to Sauer, pressing him on his argument’s internal coherence. Same with the the chief. Overall, Barrett is the hardest justice to place: her questioning skewed heavily toward Wang, but her questions focused on administrability and the nature of Wong Kim Ark rather than sympathy with the government’s core theory. Kavanaugh focused more on Wang’s argument as well, although his questioning about Congress’ decision to reenact the birthright-citizenship language after Wong Kim Ark cut against the government. Alito’s lopsided focus on Wang and Thomas’ originalist framing both track with likely votes for the government. The pressure data, taken together, are most consistent with a 7-2 or 6-3 outcome favoring the challengers – with Thomas and Alito as the most probable dissents, and Barrett as the swing justice. The transcript data from Trump v. Barbara reveal (unsurprisingly) a highly-engaged bench, focused on the history and precedent underpinning the citizenship clause, and a majority more skeptical of the government than the challengers. Regarding the focus on history, the argument was conducted overwhelmingly in the language of 1868 – when the 14th Amendment was ratified. Every justice who spoke substantively (including the court’s liberal members) engaged with questions of original meaning, historical allegiance, and the scope of the citizenship clause as understood at the time of ratification. Thomas and Jackson – from different interpretive directions – perhaps most anchored the argument in that historical terrain. Sauer built his presentation around it, and Wang engaged it while also centering her argument on precedent such as Wong Kim Ark. The pressure on advocates was asymmetrical. Gorsuch, Jackson, and Roberts concentrated their questioning on Sauer, testing whether his limiting principles on the citizenship clause – domicile, allegiance, lawful subjection – actually survived the originalist inquiry he invoked. Barrett, Alito, and Kavanaugh concentrated more on Wang, asking whether her broad rule could account for the language and logic of Wong Kim Ark – though (with the exception of Alito) were somewhat less hostile to her than those questioning Sauer. Justices Elena Kagan, Sotomayor, and Thomas were more evenly distributed and, in Thomas’ case, sparing but targeted. Overall, the justices tested both arguments – and the data suggest they found both sides’ positions vulnerable at specific points, but a majority appeared skeptical of the government’s theory. We should know for sure by late summer, when a decision is expected. Posted in Empirical SCOTUS, Featured, Recurring Columns April 3, 2026 April 3, 2026 April 3, 2026 April 3, 2026 April 2, 2026 April 2, 2026 April 2, 2026 April 2, 2026 April 1, 2026 April 1, 2026 ©2026 SCOTUSblog",https://www.scotusblog.com/2026/04/what-oral-argument-told-us-in-the-birthright-citizenship-case/
V,Watch Atlas V rocket launch its heaviest-ever payload early on April 4 - Space,2026-04-03 16:00:00,"Liftoff of the LA-05 mission is scheduled for 1:45 a.m. ET on Saturday (April 4). When you purchase through links on our site, we may earn an affiliate commission. Here’s how it works. Breaking space news, the latest updates on rocket launches, skywatching events and more! Breaking space news, the latest updates on rocket launches, skywatching events and more! Sign up to our monthly entertainment newsletter to keep up with all our coverage of the latest sci-fi and space movies, tv shows, games and books. Discover this week's must-see night sky events, moon phases, and stunning astrophotos. Sign up for our skywatching newsletter and explore the universe with us! Space.com's Sci-Fi Reader's Club. Read a sci-fi short story every month and join a virtual community of fellow science fiction fans! A United Launch Alliance (ULA) Atlas V rocket will launch its heaviest-ever payload on Saturday morning (April 4), and you can watch the action live. The Atlas V is scheduled to lift off Saturday at 1:45 a.m. EDT (0545 GMT) from Florida's Cape Canaveral Space Force Station, carrying 29 satellites for the Amazon Leo broadband constellation to orbit. Together, those spacecraft weigh 18 tons, according to ULA. You can watch it live here at Space.com, courtesy of ULA, or directly via the company. Coverage will begin 20 minutes before launch. The Amazon Leo megaconstellation, previously known as Project Kuiper, will eventually consist of about 3,200 satellites in low Earth orbit. It's Amazon's answer to SpaceX's Starlink network, which beams internet service down from more than 10,000 satellites (and counting). Amazon Leo is still in its early stages; just 212 of the spacecraft have reached orbit to date over the course of eight launches (not counting a 2023 liftoff that sent up two prototype satellites). The Atlas V has flown four of those operational missions. Three employed SpaceX's Falcon 9, and the other one used Arianespace's Ariane 6 heavy lifter. Saturday's launch, which Amazon calls LA-05, will be the first Atlas V mission to loft 29 Amazon Leo satellites; the others carried 27 of the spacecraft. Breaking space news, the latest updates on rocket launches, skywatching events and more! ""The increase is a result of detailed engineering work between Amazon Leo and ULA, and is made possible by a new, higher-performing version of the RL10C engine used on the rocket's Centaur upper stage,"" Amazon representatives wrote in a mission description. ""While the engine has flown on previous missions, LA-05 marks the first time the program has completed the extensive engineering and safety analysis required to use it with our larger payload."" And that payload is larger in a significant way, according to the LA-05 mission description: ""With 29 satellites aboard, LA-05 will mark the heaviest payload ever flown on an Atlas V."" Michael Wall is the Spaceflight and Tech Editor for Space.com and joined the team in 2010. He primarily covers human and robotic  spaceflight, military space, and exoplanets, but has been known to dabble in the space art beat. His book about the search for alien life, ""Out There,"" was published on Nov. 13, 2018. Before becoming a science writer, Michael worked as a herpetologist and wildlife biologist. He has a Ph.D. in evolutionary biology from the University of Sydney, Australia, a bachelor's degree from the University of Arizona, and a graduate certificate in science writing from the University of California, Santa Cruz. To find out what his latest project is, you can follow Michael on Twitter. You must confirm your public display name before commenting Please logout and then login again, you will then be prompted to enter your display name. Space is part of Future US Inc, an international media group and leading digital publisher. Visit our corporate site. ©
Future US, Inc. Full 7th Floor, 130 West 42nd Street,
New York,
NY 10036.",https://www.space.com/space-exploration/launches-spacecraft/ula-atlas-v-amazon-leo-5-internet-satellite-launch
V,Photos: Extremely rare silver Ferrari Enzo with V-12 engine and 660 hp up for sale - Interesting Engineering,2026-04-03 15:46:00,"From daily news and career tips to monthly insights on AI, sustainability, Aerospace, and more—pick what matters and get it in your inbox. Access expert insights, exclusive content, and a deeper dive into engineering and innovation. Engineering-inspired textiles, mugs, hats, and thoughtful gifts We connect top engineering talent with the world's most innovative companies. We empower professionals with advanced engineering and tech education to grow careers. We recognize outstanding achievements in engineering, innovation, and technology. Access expert insights, exclusive content, and a deeper dive into engineering and innovation. Engineering-inspired textiles, mugs, hats, and thoughtful gifts We connect top engineering talent with the world's most innovative companies We empower professionals with advanced engineering and tech education to grow careers. We recognize outstanding achievements in engineering, innovation, and technology. Ferrari’s Formula 1 program provided the technology for the Enzo. An exceptionally rare Argento Nürburgring Ferrari Enzo is set to cross the auction block with RM Sotheby’s, marking a significant event for supercar collectors. This specific vehicle is one of only nine examples ever finished in this particular silver hue out of a total production run of 399 units. It originally debuted at the 2002 Paris Motor Show to compete in the prestigious “Holy Trinity” of early 2000s hypercars. “The car is offered for sale with its bespoke Enzo luggage set, Ferrari books and manuals, tool kit, and an impressive history file that acknowledges the care and attention it has been lavished by,” said RM Sotheby’s. An active and versatile journalist and news editor. He has covered regular and breaking news for several leading publications and news media, including The Hindu, Economic Times, Tomorrow Makers, and many more. Aman holds expertise in politics, travel, and tech news, especially in AI, advanced algorithms, and blockchain, with a strong curiosity about all things that fall under science and tech.",https://interestingengineering.com/photo-story/silver-ferrari-enzo-with-v-12-engine
V,City v Liverpool: All set for a third meeting this season - Manchester City FC,2026-04-03 15:00:00,"Beginning of dialog window. Escape will cancel and close the window. This is a modal window. This modal can be closed by pressing the Escape key or activating the close button. Men's Team We welcome Arne Slot’s team to the Etihad Stadium in a 12:45 (UK) kick-off for an FA Cup quarter-final. City had the better of the league encounters this season, winning 3-0 at the Etihad before a dramatic 2-1 comeback at Anfield. Erling Haaland, Nico and Jeremy Doku got the goals in the October clash as we dominated from start to finish. It was a little tougher on the road, with Dominik Szoboszlai’s free-kick putting the hosts ahead before Bernardo Silva and Haaland turned it around late on. And we have a proud FA Cup record, having reached the semi-finals in each of the last seven seasons. So all that means we can be confident, but Pep Guardiola and his players won’t be taking anything for granted. Get in the mood for the fixture by watching the video at the top of the page... Choose your website language, or follow us on social media in your language",https://www.mancity.com/citytv/mens/liverpool-fa-cup-quarter-final-hype-video-63910806
V,"New Nissan Xterra Will Have V-6 and Hybrid Options, No Manual, And Imposing Looks - Road & Track",2026-04-03 14:50:00,"The new Nissan Xterra is well on its way to reaching showrooms, and thanks to new comments from an executive at the carmaker, we now have a pretty good idea of what powertrain options will be under the off-roader’s hood. Our colleagues over at Car and Driver spoke with senior vice president and chief product and planning officer for Nissan Americas Ponz Pandikuthira at the 2026 New York Auto Show to get the download. ""There will be a pure ICE,"" says Pandikuthira. “If we do ICE only, it will be V-6, it won't be a four-cylinder turbo.” If that comment sounds directed toward some of the competition, we wouldn’t doubt that it is. The new Toyota 4Runner and Land Cruiser come with four-cylinder-turbo powertrains. The Ford Bronco comes with a turbo-four as well, though you can of course step up to a boosted V-6. As for what specific engine Nissan will use, it’s likely going to be the 3.8-liter naturally aspirated V-6 found in the Frontier already, paired with an automatic transmission. Pandikuthira squashed any chance of a manual like that found in the 2027 Z Nismo by saying, ""For the big trucks, no.” He cited the loss of center console storage, and said that the fun of a big SUV is derived from the suspension, tires, steering, and powertrain calibration. Where Nissan will mirror Toyota, however, is that a hybrid option will be available. ""We can build a hybrid off that [V-6],"" Pandikuthira told C/D. ""What that hybrid execution looks like, when it debuts, how many months after the ICE version? Still a work in progress at this point."" Nissan doesn’t offer a hybrid powertrain in any of its large vehicles right now, so this one will remain a mystery for the moment. Regardless, a new Xterra with a little more efficiency (alongside more power) sounds like a concept we can get behind. Car and Driver also spoke to Pandikuthira about the Xterra’s design, and it’s shaping up exactly as we’d suspect. ""I was in Japan two weeks ago and I saw the car in the first foam full mock-up, it literally takes your breath away,"" Pandikuthira said. ""Super-imposing, it's got a lot of those very tough, in-your-face design cues."" He also claimed that Nissan found some excellent solutions to get solid fuel economy out of the car without compromising and going with a softer design. Expect to see this revamped Xterra in 2028, as Nissan is still a couple of years out from a reveal. We may earn commission from links on this page, but we only recommend products we back.",https://www.roadandtrack.com/news/a70927879/new-nissan-xterra-v-6-and-hybrid-options-no-manual/
V,Chiles v. Salazar (2026) - Free Speech Center,2026-04-03 14:41:38,"Home » Articles » Case » Content-based laws » Chiles v. Salazar (2026) Kaley Chiles, who has a Colorado counseling license, challenged the state's prohibition on talk therapy to change a minor's perceived gender to that of the person's birth gender. The Supreme Court in March 2026 ruled that such a prohibition constitutes viewpoint discrimination and is an unconstitutional restriction on freedom of speech. (Image courtesy of Alliance Defending Freedom) As debates have intensified over issues involving the rights of LGBTQ+ individuals, some states have adopted laws prohibiting so called conversion therapy (especially for minors), which is aimed at changing an individual’s perceived gender to that of their birth or in combatting same-sex attraction. There is a general consensus that such therapy is generally ineffective. The state of Colorado adopted legislation designed not only to prevent shock therapy and other medical procedures for bringing about such changes for minors but also legislation prohibiting licensed counselors from using talk therapy to change such identity or attraction. It did, however, permit therapists to provide talk therapy to aid those who were seeking gender transition. Kaley Chiles, who has a master’s degree in clinical mental health and a Colorado counseling license and engages in faith-based talk therapy, challenged the Colorado law as a violation of her First Amendment freedom of speech. She was represented by Alliance Defending Freedom. She explained that she used talk therapy to help clients reach their goals, whether they are to align with their cis-gender or sex preferences or to transition to another gender to change their sexual preferences. Although she lost her case at both the district and circuit court level, neither of which applied strict scrutiny, the U.S. Supreme Court agreed with her in an 8-1 decision. It was written by Neil Gorsuch. Justice Elena Kagan authored a concurring opinion joined by Sonia Sotomayor. Justice Ketanji Brown Jackson dissented. Noting that the only kind of treatment that Chiles offered is talk therapy, Gorsuch observed that the Court was wary of content-based restrictions on freedom of speech, and even more wary of so-called viewpoint discrimination, which permitted the expression of views on one side of an issue but not of others. The only exceptions that the court had carved out involved fraud, defamation and so-called fighting words. All other such content discrimination should be subject to strict scrutiny. Moreover, Gorsuch cited Cohen v. California (1971) (involving coarse language on a man’s jacket opposing the draft) and Holder v. Humanitarian Law Project (2010) (banning material support to certain alleged terrorist organizations) to say that content discrimination could not be countenanced simply because it was connected to non-expressive conduct. Whereas Justice Jackson’s dissent would have upheld the law on the basis that it was a regulation of health professionals, Gorsuch argued that restrictions as to what constituted permissible speech crossed this line. In discussing talk therapy, Gorsuch said that “the spoken word is perhaps the quintessential form of protected speech, which does not lose its protection simply because it can be described as therapy.” As he phrased it, “The First Amendment is no word game.” He cited other cases that established that such content regulation required the court’s highest level of scrutiny, known as strict scrutiny. Gorsuch said that there was no evidence that Colorado’s regulations were part of a long historical tradition, or that regulation of speech fell under state licensing requirements. He pointed to the danger of the government deciding what speech was acceptable versus unacceptable.  He noted that there had been a time when psychiatrists thought that homosexuality was an illness, and that sterilization was appropriate for individuals with mental defects, and that “reflexive deference” to such “prevailing professional views may not always end well.” In concluding, he observed that “the First Amendment stands as a shield against any effort to enforce orthodoxy in thought or speech in this country. It reflects instead a judgment that every American possesses an inalienable right to think and speak freely, and a faith in the free marketplace of ideas as the best means for discovering truth.” Jackson dissented, saying states have power to regulate practice of medicine. Kagan’s concurring opinion said that the case would have been closer had Colorado enacted “a content-based but viewpoint-neutral law.” Justice Jackson based her argument on Lambert v. Yelowley (1926), in which the Court had said that “there is no right to practice medicine which is not subordinate to the police power of the States.” The American Psychological Association raised concerns about the ruling and its possible effect limiting the regulation of therapy. And others have wondered how it will affect state laws that prohibit doctors from counseling patients on the option of abortion But at least one organization that has two pending medical free speech lawsuits, the Children's Health Defense, has praised the ruling. The organization is suing state medical boards in California and Washington over policies targeting doctors who promote misinformation about COVID. John R. Vile is a political science professor and dean of the Honors College at Middle Tennessee State University. Nearly 1,700 articles on First Amendments topics, court cases and history The Free Speech Center operates with your generosity! Please donate now! The Free Speech Center is a nonpartisan, nonprofit public policy center dedicated to building understanding of the five freedoms of the First Amendment through education, information and engagement. Subscribe to our newsletter for latest news. Let's stay updated!",https://firstamendment.mtsu.edu/article/chiles-v-salazar-2026/
