ticker,title,date,content,url
V,"São Paulo ratings: Roger's gamble, Ferreirinha shines v Cruzeiro - OneFootball",2026-04-04 23:44:22,"Oops! It looks like we cannot find what you were looking for. Alternatively, you can visit the homepage to view news and highlights OneFootball is proud to partner with Yahoo! Sports to deliver quality football content to fans in USA and Canada.",https://onefootball.com/en/news/sao-paulo-ratings-rogers-gamble-ferreirinha-shines-v-cruzeiro-42662136
V,Nico González sent off in controversial Atlético v Barça clash - OneFootball,2026-04-04 23:33:09,"Oops! It looks like we cannot find what you were looking for. Alternatively, you can visit the homepage to view news and highlights OneFootball is proud to partner with Yahoo! Sports to deliver quality football content to fans in USA and Canada. These cookies are necessary for the website to function and cannot be switched off in our systems. They are usually only set in response to actions made by you which amount to a request for services, such as setting your privacy preferences, logging in or filling in forms. You can set your browser to block or alert you about these cookies, but some parts of the site will not then work. These cookies do not store any personally identifiable information. Third party trackers collect information to use for analytics and to personalize your experience with targeted ads. Under the Colorado CPA, the Virginia CDPA, the Texas DPSA, the Oregon CPA, the Montana CDPA, and the Florida DBR, you have the right to opt-out of the sale of your personal data to third parties, of targeted advertising related processing, and of some types of profiling. You may exercise your rights by using the toggles below. If you opt out, the ads and content that you see may not be as relevant to you. Under the Colorado CPA, you have the right to opt back in to these categories at any time should you initially choose to opt out, and you may do so using the same toggles provided below. For more details on the data we process and how to exercise your rights, and to view information related to required opt-in disclosures, see our Privacy Policy These cookies may be set through our site by our advertising partners. They may be used by those companies to build a profile of your interests and show you relevant adverts on other sites. They do not store directly personal information, but are based on uniquely identifying your browser and internet device. If you do not allow these cookies, you will experience less targeted advertising. These cookies allow us to count visits and traffic sources so we can measure and improve the performance of our site. They help us to know which pages are the most and least popular and see how visitors move around the site. All information these cookies collect is aggregated and therefore anonymous. If you do not allow these cookies we will not know when you have visited our site, and will not be able to monitor its performance.",https://onefootball.com/en/news/nico-gonzalez-sent-off-in-controversial-atletico-v-barca-clash-42661763
V,Jonny Clayton v Marcel Hausotter (05/04/2026) - Flashscore.com,2026-04-04 23:17:28,"Retrouvez nos conseils sur www.joueurs-info-service.fr (09-74-75-13-13, appel non surtaxé) 18+ | Erlaubtes Glücksspiel gemäß der Whitelist | Suchtrisiken | Hilfe unter buwei.de 21+ Участь в азартних іграх може викликати ігрову залежність. Дотримуйтеся правил (принципів) відповідальної гри Retrouvez nos conseils sur www.joueurs-info-service.fr (09-74-75-13-13, appel non surtaxé) 18+ | Erlaubtes Glücksspiel gemäß der Whitelist | Suchtrisiken | Hilfe unter buwei.de 21+ Участь в азартних іграх може викликати ігрову залежність. Дотримуйтеся правил (принципів) відповідальної гри Use precise geolocation data. Actively scan device characteristics for identification. Store and/or access information on a device. Personalised advertising and content, advertising and content measurement, audience research and services development. 
        List of Partners (vendors) We process your data to deliver content or advertisements and measure the delivery of such content or advertisements to extract insights about our website. We share this information with our partners on the basis of consent and legitimate interest. You may exercise your right to consent or object to a legitimate interest, based on a specific purpose below or at a partner level in the link under each purpose. These choices will be signaled to our vendors participating in the Transparency and Consent Framework. The choices you make regarding the purposes and vendors listed in this notice are saved and stored locally on your device for a maximum duration of 1 year.
            More informationThird partiesUser ID:  45f28283-ba78-41cc-90da-77009022f541This User ID will be used as a unique identifier while storing and accessing your preferences for future.Timestamp:  -- These cookies are necessary for the website to function and cannot be switched off in our systems. They are usually only set in response to actions made by you which amount to a request for services, such as setting your privacy preferences, logging in or filling in forms.  You can set your browser to block or alert you about these cookies, but some parts of the site will not then work. These cookies do not store any personally identifiable information. These cookies allow us to count visits and traffic sources so we can measure and improve the performance of our site. They help us to know which pages are the most and least popular and see how visitors move around the site.  If you do not allow these cookies we will not know when you have visited our site, and will not be able to monitor and improve its performance. These cookies may be set through our site by our advertising partners. They may be used by those companies to build a profile of your interests and show you relevant adverts on other sites. They do not store directly personal information, but are based on uniquely identifying your browser and internet device. If you do not allow these cookies, you will experience less targeted advertising. These cookies enable the website to provide enhanced functionality and personalisation. They may be set by us or by third party providers whose services we have added to our pages.  If you do not allow these cookies then some or all of these services may not function properly. Cookies, device or similar online identifiers (e.g. login-based identifiers, randomly assigned identifiers, network based identifiers) together with other information (e.g. browser type and information, language, screen size, supported technologies etc.) can be stored or read on your device to recognise it each time it connects to an app or to a website, for one or several of the purposes presented here. Advertising presented to you on this service can be based on limited data, such as the website or app you are using, your non-precise location, your device type or which content you are (or have been) interacting with (for example, to limit the number of times an ad is presented to you). Information about your activity on this service (such as forms you submit, content you look at) can be stored and combined with other information about you (for example, information from your previous activity on this service and other websites or apps) or similar users. This is then used to build or improve a profile about you (that might include possible interests and personal aspects). Your profile can be used (also later) to present advertising that appears more relevant based on your possible interests by this and other entities. Advertising presented to you on this service can be based on your advertising profiles, which can reflect your activity on this service or other websites or apps (like the forms you submit, content you look at), possible interests and personal aspects. Information about your activity on this service (for instance, forms you submit, non-advertising content you look at) can be stored and combined with other information about you (such as your previous activity on this service or other websites or apps) or similar users. This is then used to build or improve a profile about you (which might for example include possible interests and personal aspects). Your profile can be used (also later) to present content that appears more relevant based on your possible interests, such as by adapting the order in which content is shown to you, so that it is even easier for you to find content that matches your interests. Content presented to you on this service can be based on your content personalisation profiles, which can reflect your activity on this or other services (for instance, the forms you submit, content you look at), possible interests and personal aspects. This can for example be used to adapt the order in which content is shown to you, so that it is even easier for you to find (non-advertising) content that matches your interests. Information regarding which advertising is presented to you and how you interact with it can be used to determine how well an advert has worked for you or other users and whether the goals of the advertising were reached. For instance, whether you saw an ad, whether you clicked on it, whether it led you to buy a product or visit a website, etc. This is very helpful to understand the relevance of advertising campaigns. Information regarding which content is presented to you and how you interact with it can be used to determine whether the (non-advertising) content e.g. reached its intended audience and matched your interests. For instance, whether you read an article, watch a video, listen to a podcast or look at a product description, how long you spent on this service and the web pages you visit etc. This is very helpful to understand the relevance of (non-advertising) content that is shown to you. Reports can be generated based on the combination of data sets (like user profiles, statistics, market research, analytics data) regarding your interactions and those of other users with advertising or (non-advertising) content to identify common characteristics (for instance, to determine which target audiences are more receptive to an ad campaign or to certain contents). Information about your activity on this service, such as your interaction with ads or content, can be very helpful to improve products and services and to build new products and services based on user interactions, the type of audience, etc. This specific purpose does not include the development or improvement of user profiles and identifiers. Content presented to you on this service can be based on limited data, such as the website or app you are using, your non-precise location, your device type, or which content you are (or have been) interacting with (for example, to limit the number of times a video or an article is presented to you). With your acceptance, your precise location (within a radius of less than 500 metres) may be used in support of the purposes explained in this notice. With your acceptance, certain characteristics specific to your device might be requested and used to distinguish it from other devices (such as the installed fonts or plugins, the resolution of your screen) in support of the purposes explained in this notice. Your data can be used to monitor for and prevent unusual and possibly fraudulent activity (for example, regarding advertising, ad clicks by bots), and ensure systems and processes work properly and securely. It can also be used to correct any problems you, the publisher or the advertiser may encounter in the delivery of content and ads and in your interaction with them. Certain information (like an IP address or device capabilities) is used to ensure the technical compatibility of the content or advertising, and to facilitate the transmission of the content or ad to your device. Information about your activity on this service may be matched and combined with other information relating to you and originating from various sources (for instance your activity on a separate online service, your use of a loyalty card in-store, or your answers to a survey), in support of the purposes explained in this notice. In support of the purposes explained in this notice, your device might be considered as likely linked to other devices that belong to you or your household (for instance because you are logged in to the same service on both your phone and your computer, or because you may use the same Internet connection on both devices). Your device might be distinguished from other devices based on information it automatically sends when accessing the Internet (for instance, the IP address of your Internet connection or the type of browser you are using) in support of the purposes exposed in this notice. The choices you make regarding the purposes and entities listed in this notice are saved and made available to those entities in the form of digital signals (such as a string of characters). This is necessary in order to enable both this service and those entities to respect such choices.",https://www.flashscore.com/match/darts/clayton-jonny-tx0y2xRD/hausotter-marcel-bgWr9aXH/
V,Mirassol v RB Bragantino: survival fight meets Sudamericana push - OneFootball,2026-04-04 23:08:17,"Get the full live experience with the OneFootball app. Mirassol host RB Bragantino in the Brasileirão at the Maião on Sunday, 5 April 2026, with the hosts seeking to climb out of the relegation places and the visitors looking to consolidate their Copa Sudamericana ambitions. These sides last met in January, when Mirassol and RB Bragantino drew 0-0 in the Paulista. The stakes are clearer now: Mirassol start in 19th, while the visitors are 11th. Mirassol have taken one point from their past five league games, losing four on the spin, including a 3-2 defeat at Botafogo last time out. Braga snapped a four-match winless run by beating Flamengo 3-0 at home. Mirassol are without suspended forward Negueba. Massa Bruta, meanwhile, have forwards Eduardo Sasha and Fernando among several injuries, with defenders Guzmán Rodríguez and Vanderlan also sidelined. Midfielder Ignacio Sosa is suspended, while goalkeeper Fabrício and midfielder Davi Gomes are also out. Mirassol have scored 10 and conceded 13 in eight league matches, and may look to lean on home form that has yielded five of their six points. Braga have nine scored and 10 conceded from nine, and only two goals away, so margins could be tight. A win would move Mirassol to nine points and could lift them towards safety. Victory would take Massa Bruta to 14 points and could push them into the top half, strengthening their Sudamericana bid. Best bits of RB Bragantino’s Brasileirão win over Flamengo Corinthians v RB Bragantino: where to watch the Women's Brasileirão 📋 Bragantino and Flamengo named for Brasileirão clash Corinthians step up tactical work before Red Bull Bragantino visit in Brasileirão Feminino At home, Corinthians Women thrash RB Bragantino, go top in Brasileirão Southampton 2-1 Arsenal: Shea Charles goal dumps Gunners out of FA Cup as treble dream dashed Gunners lose back-to-back cup games as treble dream is dashedSuper sub Shea Charles fired Southampton to Wembley as Tonda Eckert's Championship side stunned Premier League leaders Arsenal in a famous... Robert Lewandowski sniffs out winner in game of false nines between Barcelona and Atletico Madrid Atletico Madrid 1-2 BarcelonaBarcelona took a major step towards the La Liga title on Saturday night, just about overcoming 10-man Atletico Madrid with a late winner from Robert Lewandowski. A... Barcelona star limps off with injury vs Atlético Madrid La Liga champions Barcelona have on Saturday been dealt a fresh blow on the personnel front.This comes owing to developments in the Blaugrana’s showdown with Diego Simeone’s Atlético Madrid.The headline fixture... OneFootball is proud to partner with Yahoo! Sports to deliver quality football content to fans in USA and Canada. These cookies are necessary for the website to function and cannot be switched off in our systems. They are usually only set in response to actions made by you which amount to a request for services, such as setting your privacy preferences, logging in or filling in forms. You can set your browser to block or alert you about these cookies, but some parts of the site will not then work. These cookies do not store any personally identifiable information. Third party trackers collect information to use for analytics and to personalize your experience with targeted ads. Under the Colorado CPA, the Virginia CDPA, the Texas DPSA, the Oregon CPA, the Montana CDPA, and the Florida DBR, you have the right to opt-out of the sale of your personal data to third parties, of targeted advertising related processing, and of some types of profiling. You may exercise your rights by using the toggles below. If you opt out, the ads and content that you see may not be as relevant to you. Under the Colorado CPA, you have the right to opt back in to these categories at any time should you initially choose to opt out, and you may do so using the same toggles provided below. For more details on the data we process and how to exercise your rights, and to view information related to required opt-in disclosures, see our Privacy Policy These cookies may be set through our site by our advertising partners. They may be used by those companies to build a profile of your interests and show you relevant adverts on other sites. They do not store directly personal information, but are based on uniquely identifying your browser and internet device. If you do not allow these cookies, you will experience less targeted advertising. These cookies allow us to count visits and traffic sources so we can measure and improve the performance of our site. They help us to know which pages are the most and least popular and see how visitors move around the site. All information these cookies collect is aggregated and therefore anonymous. If you do not allow these cookies we will not know when you have visited our site, and will not be able to monitor its performance.",https://onefootball.com/en/news/mirassol-v-rb-bragantino-survival-fight-meets-sudamericana-push-42662056
V,Boxing: Lauren Price v Claressa Shields in the UK? - BBC,2026-04-04 22:58:34,"Claressa Shields challenges Lauren Price to a match after Price retains her unified world champion status, beating Puerto Rican Stephanie Pineiro by a unanimous decision at Cardiff's Utilita Arena. Read more: Price calls for Shields fight after beating Pineiro Price v Shields in the UK? Video, 00:01:07Price v Shields in the UK? Up Next. Phantom v Price - can a Gladiator keep up with a world champion? Video, 00:05:12Phantom v Price - can a Gladiator keep up with a world champion? Price and Pineiro set for world title showdown in Cardiff. Video, 00:01:03Price and Pineiro set for world title showdown in Cardiff Fake tan disasters & living two lives - inside the camp of a world champ. Video, 00:04:10Fake tan disasters & living two lives - inside the camp of a world champ Watch: Michael Conlan retires from boxing. Video, 00:02:45Watch: Michael Conlan retires from boxing Fernandez sanctioned to protect culture - Rosenior. Video, 00:01:32Fernandez sanctioned to protect culture - Rosenior This is our 100th fight, it will be one of the best - Wilder. Video, 00:02:57This is our 100th fight, it will be one of the best - Wilder I can't expect to jump in at top level - Defoe. Video, 00:01:56I can't expect to jump in at top level - Defoe Is Roberto de Zerbi the man to save Spurs? Video, 00:02:20Is Roberto de Zerbi the man to save Spurs? Wiegman on 'speechless' Parkinson's England call-up. Video, 00:01:13Wiegman on 'speechless' Parkinson's England call-up Maybe Verstappen needs a break from F1? - Hill. Video, 00:01:48Maybe Verstappen needs a break from F1? - Hill 'Antonelli had the luck, but sometimes you need it' Video, 00:01:33'Antonelli had the luck, but sometimes you need it' Kerr ready to attempt world mile record this year. Video, 00:02:12Kerr ready to attempt world mile record this year Salah set completely new standards - Klopp. Video, 00:02:08Salah set completely new standards - Klopp Copyright © 2026 BBC. The BBC is not responsible for the content of external sites. Read about our approach to external linking.",https://www.bbc.com/sport/boxing/videos/cql7egx5k40o
V,Vacaville aquatic egg hunt makes a splash - The Vacaville Reporter,2026-04-04 22:27:06,"Subscribers are entitled to 10 gift sharing articles each month. These can be shared with friends and family who are not subscribers. Subscribers are entitled to 10 gift sharing articles each month. These can be shared with friends and family who are not subscribers. Warm temperatures and blue skies made for the perfect backdrop at the Walter V. Graham Aquatic Center on Saturday for the annual Aquatic Easter Egg Hunt. Families streamed in before the event, with excited children who couldn’t wait to get their photo with the Easter Bunny before diving into the day’s activity. Kids of all ages, clad in colorful swimsuits and floatation wear, lined up eagerly at the ... Subscribers are entitled to 10 gift sharing articles each month. These can be shared with friends and family who are not subscribers. Copyright 2026 The Vacaville Reporter. All rights reserved. The use of any content on this website for the purpose of training artificial intelligence systems, algorithms, machine learning models, text and data mining, or similar use is strictly prohibited without explicit written consent.",https://www.thereporter.com/2026/04/04/vacaville-aquatic-egg-hunt-makes-a-splash/
V,"São Paulo v Cruzeiro: XIs in, Ferreirinha starts, Roger drops Danielzinho - OneFootball",2026-04-04 22:15:48,"Oops! It looks like we cannot find what you were looking for. Alternatively, you can visit the homepage to view news and highlights OneFootball is proud to partner with Yahoo! Sports to deliver quality football content to fans in USA and Canada. These cookies are necessary for the website to function and cannot be switched off in our systems. They are usually only set in response to actions made by you which amount to a request for services, such as setting your privacy preferences, logging in or filling in forms. You can set your browser to block or alert you about these cookies, but some parts of the site will not then work. These cookies do not store any personally identifiable information. Third party trackers collect information to use for analytics and to personalize your experience with targeted ads. Under the Colorado CPA, the Virginia CDPA, the Texas DPSA, the Oregon CPA, the Montana CDPA, and the Florida DBR, you have the right to opt-out of the sale of your personal data to third parties, of targeted advertising related processing, and of some types of profiling. You may exercise your rights by using the toggles below. If you opt out, the ads and content that you see may not be as relevant to you. Under the Colorado CPA, you have the right to opt back in to these categories at any time should you initially choose to opt out, and you may do so using the same toggles provided below. For more details on the data we process and how to exercise your rights, and to view information related to required opt-in disclosures, see our Privacy Policy These cookies may be set through our site by our advertising partners. They may be used by those companies to build a profile of your interests and show you relevant adverts on other sites. They do not store directly personal information, but are based on uniquely identifying your browser and internet device. If you do not allow these cookies, you will experience less targeted advertising. These cookies allow us to count visits and traffic sources so we can measure and improve the performance of our site. They help us to know which pages are the most and least popular and see how visitors move around the site. All information these cookies collect is aggregated and therefore anonymous. If you do not allow these cookies we will not know when you have visited our site, and will not be able to monitor its performance.",https://onefootball.com/en/news/sao-paulo-v-cruzeiro-xis-in-ferreirinha-starts-roger-drops-danielzinho-42661571
