id,ticker,date,title,content,url
1,V,2026-03-27 22:48:28,HI v. Gerhardt Konig: 천국의 문제 재판 - Court TV,"호놀룰루(Court TV) — 하와이의 한 하이킹 코스에서 아내를 살해하려 했다는 혐의를 받은 한 마취과 의사가 재판에 서고 있다. Gerhardt Konig가 재판 첫날 개시 진술을 듣고 있다. (Court TV) Gerhardt Konig는 2025년 3월 24일 Pali Lookout에서 아내 Arielle Konig를 상대로 한 것으로 alleged된 폭행 혐의로 2급 살인미수 혐의를 받고 있다. Arielle Konig는 경찰에, 부부가 산책로를 걷고 있던 중 Gerhardt Konig가 가파른 산비탈이 있는 길 가장자리에서 셀카를 찍자고 했다고 진술했다. 자신이 편하지 않다고 말한 뒤 Arielle Konig는 걸어가려 했다. 그러자 Gerhardt Konig는 돌아오라고 소리친 뒤 그녀를 덤불 속으로 밀어 넣었다고 한다. Arielle Konig는 다시 빠져나왔지만, Gerhardt Konig는 돌을 집어 들어 약 10차례 그녀의 머리를 때렸고, “뒤통수의 머리카락을 잡아당기면서 그녀의 얼굴을 땅에 내리찍었다”고 한다. Arielle Konig는 또한 남편이 가방에서 주사기 두 개를 꺼내 자신에게 사용하려 했다고 경찰에 진술했다. 두 여성은 Arielle Konig가 “도와주세요! 도와주세요!”라고 비명을 지르는 소리를 듣고 달려가 공격 장면을 목격했다. 그들은 피해자가 등을 대고 누워 있고 Gerhart Konig가 그 위에 올라타 머리를 때리고 있는 것을 봤다고 경찰에 말했다. alleged된 공격 이후 Arielle Konig는 이혼을 신청했고 피고인에 대한 접근금지명령을 받았다. 이혼 청원서에서 Arielle Konig는 남편이 자신에게 외도를 의심했다고 말했으며, 그가 자신을 성적으로 학대하고 폭행했다고 적었다. 체포 당시 Gerhardt Konig는 Maui Health에서 마취과 의사로 근무하고 있었으며, 수사 시작과 함께 직무 정지됐다. Arielle Konig는 오아후의 절벽 가장자리에서 남편이자 마취과 의사인 Gerhardt Konig에게 당한 alleged된 공격을 상세히 진술했다. 더 보기 Gerhardt Konig는 살인미수 재판 첫날 개시 진술을 들으며 눈물을 훔쳤다. 더 보기 Vinnie Politan은 Gerhardt와 Arielle Konig의 관계와 그가 그녀를 살해하려 했다고 alleged된 사건을 둘러싼 경위를 분석한다. 더 보기 새 영상에는 Bryan Kohberger가 번호판을 바꾸고 Jeffrey Spence와 대화하는 장면이 담겼으며, 그는 딸의 남자친구를 살해한 혐의로 유죄 판결을 받았다 © 2026 Court TV Media LLC, The E.W. Scripps Company의 일부. All Rights Reserved.",https://www.courttv.com/news/hi-v-gerhardt-konig-trouble-in-paradise-trial/
2,V,2026-03-27 22:46:58,"Infiniti의 최신 SUV, 내년에 이미 큰 변화가 예정됐다 - Top Speed","Infiniti가 곧 출시될 QX65의 전체 사양을 공개했다. 이 차는 상징적인 스타일과 삶의 더 좋은 것들을 즐기는 성향을 바탕으로 한 쿠페형 2열 크로스오버다. 도장에 실제 금빛 입자를 섞은 것부터 일본 문화의 요소는 물론 Infiniti의 과거 퍼포먼스 모델을 떠올리게 하는 세부 디자인까지, QX65는 현재 럭셔리 SUV 시장에서 탄탄한 모델로 자리 잡을 조짐을 보이고 있다. 다만, 기모노 뒤편에서는 또 다른 주목할 만한 이야기가 무르익고 있다. QX65는 아직 딜러십에 도착하기도 전인데, 이미 업그레이드 모델이 준비 중이라는 소식이 들리고 있다. Automotive News의 내부 소식통에 따르면 Infiniti는 QX65 라인업에 V-6를 추가할 계획이며, 이 모델은 268마력과 286파운드-피트의 토크를 내는 4기통 VC 터보 엔진과 9단 자동변속기를 조합한 사양으로 데뷔할 예정이다. 소문에 따르면 V-6 사양은 Pathfinder에 탑재된 3.5리터 엔진을 사용할 것이며, 출력은 약 300마력 수준까지 올라갈 것으로 전해진다. Nissan US 세일즈 총괄 Tiago Castro는 “미국 소비자들은 V-6를 선호한다”고 말했으며, 전반적인 다운사이징 시대가 도래한 만큼 성능과 직접적으로 관련되지 않은 대부분의 차종에서 V-8과 함께 V-6도 점점 희귀해지고 있다는 점에서 우리도 그 의견에 동의한다. 하지만 여기서부터 소문은 더 흥미로워진다. Infiniti가 퍼포먼스 중심 트림인 Red Sport 라인을 부활시킬 가능성이 있으며, 이미 QX80 Red Sport에 대한 이야기도 나오고 있다. QX65는 2026년 말 전에 딜러십에 도착할 예정이지만, 소문상 V-6 모델은 2027년까지 더 늦게 등장할 것으로 보인다. Auto News 소식통에 따르면 V-6 모델은 더 높은 출력 버전이 뒤따르는 본격적인 Red Sport 복귀의 길을 열 수 있으며, 그는 “이 세그먼트에서는 여전히 V-6가 출력의 인식 측면에서 왕”이라고 말했다. Infiniti가 QX65를 설계할 때 퍼포먼스 중심 FX 라인에서 스타일링 단서를 가져왔다는 점을 생각하면 이는 잘 맞는 이야기지만, 실제로 그렇게 되기 전까지는 모두 추측일 뿐이다. 2027 Infiniti QX65는 세련된 패스트백 스타일의 크로스오버로, 럭셔리 입문 고객과 대형 3열 SUV에서 다운사이징하려는 빈 둥지 가구를 겨냥한다. QX65는 젊은 고객과 나이 든 고객 모두에게 공감되는 스포티하고 대담한 분위기를 중심으로 진정한 럭셔리 경험을 제공한다. 설령 대히트하지 않더라도, Infiniti는 쿠페형 크로스오버를 원하지 않는 사람들까지 포함해 일본 럭셔리 브랜드의 포트폴리오를 살펴보려는 고객들을 쇼룸으로 끌어들이는 역할을 하길 기대하고 있다. 이는 풍부한 소재와 직관적인 기술을 포함한 QX65의 현대적이고 고급스러운 구성으로 달성하려는 목표다. Autograph 트림에는 21인치 기계 가공 마감 알로이 휠, 새틴 크롬 윈도우 트림, 블랙 도장 루프가 포함된다. 실내에는 킴노의 주름에서 영감을 받은 오픈 포어 우드톤 액센트, 퀼팅 처리된 대시보드, 세미 아닐린 퀼팅 가죽 시트가 적용된다. Sport 트림은 더 공격적인 내외장 포인트를 갖추며, 독특한 프런트 그릴, 글로스 블랙 외장 액센트, 전용 5스포크 20인치 휠이 포함된다. 실내는 그래파이트 헤드라이너와 글로스 블랙 카보나이트 트림 조각으로 꾸며진다. 모든 트림에는 Apple과 Android는 물론 내장 Google Assistant까지 포함된 표준 12.3인치 구성 가능 디스플레이가 적용된다. 물론 향상된 사운드 시스템, 선택 가능한 앰비언트 라이팅, 첨단 안전 패키지, 무선 충전 등 실내를 위한 다른 고급 사양도 다양하게 제공된다. 시작 가격은 기본 Luxe 트림이 53,990달러, Sport 트림이 55,690달러, 최상위 Autograph 트림이 62,590달러다. 여러분의 의견을 듣고 싶습니다! 아래 스레드에 생각을 공유해 주세요. 다만 서로를 존중하는 태도는 잊지 말아 주세요.",https://www.topspeed.com/2027-infiniti-qx65-already-has-big-changes/
3,V,2026-03-27 22:42:20,매치 센터: 잉글랜드 1-1 우루과이 - englandfootball.com,"● 잉글랜드와 우루과이의 맞대결은 2014년 월드컵 이후 처음이다. 당시 Three Lions는 로이 호지슨 감독 체제에서 2-1로 패해 토너먼트에서 탈락했다. 잉글랜드의 우루과이 상대 승률은 27%에 불과하다(P11 W3). 10번 이상 맞붙은 나라들 중에서는 브라질(15%, P27 W4)과 루마니아(25%, P12 W3) 상대보다도 낮다. ● 웸블리에서 열린 잉글랜드와 우루과이의 이전 4경기 중 2경기는 0-0 무승부로 끝났으며, 이 무득점 경기는 1966년 월드컵과 1995년 친선경기에서 나왔다. 이들은 웸블리에서 0-0 무승부를 두 번 이상 기록한 세 나라 중 하나이며, 나머지는 웨일스(3)와 스웨덴(2)이다. ● 잉글랜드는 최근 남미 국가들과의 11경기에서 2승만 거뒀다(D5 L4). 2013년 2월 브라질을, 2014년 5월 페루를 이겼다. 페루전 승리 이후로는 5경기 무승(D3 L2)이다. ● 잉글랜드는 최근 12경기 중 11경기에서 무실점을 기록했으며, 2025년 6월 세네갈에 3-1로 패한 이후 최근 6연속 무실점 중이다. 이번 경기에서도 무실점을 기록하면 2021년 6~7월에 세웠던 연속 무실점 최다 기록인 7경기에 어깨를 나란히 하게 된다. 우루과이는 직전 경기에서 미국에 1-5로 패했다. 오스카르 타바레스 감독 체제에서 마지막 4경기를 포함해 2021년 10~11월 4연패를 당한 이후 연패를 한 적이 없다. ● 잉글랜드는 연중 첫 경기에서 최근 13년 중 11번 승리했다(L2). 다만 이 13년 연속 기록 중 패배 하나는 웸블리에서 남미 팀을 상대로 당한 것으로, 2024년 브라질에 0-1로 졌다. ● 우루과이의 마르셀로 비엘사는 잉글랜드를 상대로 세 번째 경기를 지휘한다. 그는 2000년 2월 웸블리에서 0-0 무승부를 기록했고, 2002년 월드컵에서는 아르헨티나 감독으로 0-1 패배를 당했다. 이번 경기는 그가 웸블리에서 치른 마지막 경기로부터 26년 32일 만의 경기로, 잉글랜드전 감독 맞대결 기준 최장 기록이다. 현재 기록은 Bernd Stange가 보유하고 있다(1984년 9월 동독 감독 시절부터 2009년 10월 벨라루스 감독 시절까지 25년 32일). ● Harry Kane은 최근 잉글랜드 대표팀 10경기에서 10골을 넣었으며, Thomas Tuchel 체제의 첫 9경기에서는 9골을 기록했다. Kane은 또한 Marcelo Bielsa가 리즈 감독이던 시절 잉글랜드 땅에서 치른 마지막 경기, 즉 2022년 2월 토트넘이 Elland Road에서 4-0으로 이긴 경기에서 득점과 도움을 모두 기록했다. Three Lions 선수들이 2014년 우루과이전이 열리기 전 준비하고 있다 Three Lions는 지금까지 우루과이와 총 11차례 맞붙었고, 그중 3경기에서 승리했으며, 가장 최근 맞대결은 2014년이었다. Luis Suarez는 부상에서 복귀해 2014년 월드컵에서 잉글랜드를 상대로 2골을 넣으며 악몽을 안겼고, Wayne Rooney는 브라질에서 열린 대회에서 자신의 첫 골을 넣었다. 독일 월드컵을 3개월 앞둔 시점에는 Anfield에서 Three Lions가 먼저 실점한 뒤 역전승을 거뒀고, Peter Crouch와 Joe Cole이 모두 득점했다. 잉글랜드 0-0 우루과이, 국제경기, 1995년 3월 29일 옛 웸블리에서 열린 경기에서 Terry Venables 감독의 잉글랜드는 Teddy Sheringham, John Barnes, Tony Adams 등이 선발로 나선 가운데 우루과이와 득점 없이 비겼다. James Trafford와 James Garner는 Thomas Tuchel이 웸블리 스타디움에서 우루과이를 상대할 선발 11명을 발표하면서 성인 대표팀 데뷔전을 치른다. Three Lions의 감독은 이번 Send-Off Series의 오늘 밤 경기에서 새 얼굴, 복귀한 얼굴, 익숙한 얼굴이 섞인 라인업을 택했다. 잉글랜드: 22 James Trafford, 2 Tino Livramento, 6 Harry Maguire, 7 Phil Foden, 8 Jordan Henderson (C), 9 Dominic Solanke, 11 Marcus Rashford, 14 Fikayo Tomori, 16 Djed Spence, 17 Noni Madueke, 21 James Garner 교체명단: 1 Jordan Pickford, 3 Lewis Hall, 4 Adam Wharton, 5 John Stones, 10 Cole Palmer, 12 Ben White, 13 Aaron Ramsdale, 15 Kobbie Mainoo, 18 Dominic Calvert-Lewin, 19 Harvey Barnes, 20 Jarrod Bowen, 23 Jason Steele 이 쿠키는 웹사이트가 작동하는 데 필요하며, 시스템에서 끌 수 없습니다. 이는 일반적으로 사용자가 개인정보 설정을 지정하거나, 로그인하거나, 양식을 작성하는 등 서비스 요청에 해당하는 행동을 할 때만 설정됩니다. 브라우저를 통해 이 쿠키를 차단하거나 알림을 받도록 설정할 수 있지만, 그렇게 하면 사이트의 일부 기능이 작동하지 않을 수 있습니다. 이 쿠키는 어떤 개인 식별 정보도 저장하지 않습니다. 이 쿠키는 방문자 수와 유입 경로를 집계하여 사이트 성능을 측정하고 개선할 수 있게 해 줍니다. 이를 통해 어떤 페이지가 가장 인기 있고 가장 덜 인기 있는지, 방문자들이 사이트를 어떻게 이동하는지 알 수 있습니다. 이 쿠키가 수집하는 모든 정보는 집계되며 익명으로 처리됩니다. 이 쿠키를 허용하지 않으면 언제 사이트를 방문했는지 알 수 없으며, 사이트 성능을 모니터링할 수도 없습니다. 이 쿠키는 웹사이트가 향상된 기능과 개인화를 제공할 수 있게 해 줍니다. 당사 또는 페이지에 서비스를 추가한 제3자 제공업체가 설정할 수 있습니다. 이 쿠키를 허용하지 않으면 일부 또는 모든 서비스가 제대로 작동하지 않을 수 있습니다. 이 쿠키는 사이트에 추가한 다양한 소셜 미디어 서비스에 의해 설정되어, 친구 및 네트워크와 콘텐츠를 공유할 수 있게 해 줍니다. 이들은 브라우저를 다른 사이트 전반에서 추적하고 사용자의 관심사 프로필을 구축할 수 있습니다. 이는 방문하는 다른 웹사이트에서 보게 되는 콘텐츠와 메시지에 영향을 미칠 수 있습니다. 이 쿠키를 허용하지 않으면 이러한 공유 도구를 사용하거나 볼 수 없을 수도 있습니다.",https://www.englandfootball.com/england/mens-senior-team/fixtures-results/2025-26/internationals/england-v-uruguay-international-match-friday-27-march-2026-match-centre
4,V,2026-03-27 22:36:43,NCAA 토너먼트의 세 번의 미디어 타임아웃은 추가 휴식을 허용한다. UND는 그것이 필요하지 않았다 - Grand Forks Herald,"사우스다코타주 수폴스 — UND는 목요일 Merrimack과의 경기에서 평소보다 조금 더 많은 경기 중 휴식을 가졌다. NCAA 토너먼트는 기간마다 90초짜리 미디어 타임아웃이 3번 있으며, 이는 15분, 10분, 5분 시점 이후 첫 번째 중단 때 시작된다. NCHC 정규시즌에는 기간마다 90초짜리 미디어 타임아웃이 2번 있다. 그 추가 휴식이 Fighting Hawks의 라인 운용 방식을 바꾸지는 않았다. Dane Jackson 수석 코치는 “우리 네 개의 라인이 모두 잘 뛰고 있어서, 라인을 계속 돌렸다”고 말했다. “각 기간마다 저 세 번의 타임아웃이 서로 다른 시점에 꽤 좋은 휴식을 주죠. 그래서 톱 라인을 조금 더 자주 먼저 내보내도 괜찮을 겁니다. 그래서 그런 가능성도 살펴볼 겁니다. 하지만 어젯밤에는 모든 라인이 잘 뛰고 있어서 그렇게 많이 하지는 않았다고 느꼈습니다.” 무엇: Sioux Falls Regional 챔피언십 상대: UND 대 Quinnipiac 시각: 토요일 오후 6시 장소: Denny Sanford Premier Center 중계: ESPN2 2학년 포워드 Cody Croal은 1피리어드 파워플레이에서 득점했고, 종료 19초를 남기고 빈 골대 골도 추가했다. 1라인은 3피리어드에 4학년 포워드 Dylan James의 도움으로 득점했다. 대부분이 골리의 활약에 의해 좌우된 저득점 경기에서, 강한 라인 플레이의 상당 부분은 수비 지역에서 드러났다. 특히 UND의 3, 4라인이 그랬다. Jackson은 “그 선수들은 지금쯤 수비 책임에 좀 더 자부심을 갖고 있다”고 말했다. “물론 여전히 득점도 할 수 있지만, 정말로 상대를 끝까지 붙고, 좋은 수비 위치를 유지하고, 퍽을 잘 관리하는 데 집중하고 있고, 그것이 그들을 가치 있게 만든다. 우리는 이 시기에는 신뢰성에 대해 이야기했다. 정말 중요한 요소다. 그리고 코치가 믿고 맡길 수 있는 선수들이 얼음판에 나가게 된다.” 하위 6명은 토너먼트 개막전에 앞서 일부 재배치가 있었다. 1학년 포워드 Ollie Josephson은 3라인 중앙을 맡고 있었지만, 하체 부상으로 결장했다. 그 자리는 1학년 포워드 Jack Kernan이 메웠다. 자연스러운 센터인 Kernan은 이번 시즌 윙이나 중앙에서 모두 뛰었다. Kernan은 시니어 Tyler Young과 Croal과 함께 윙으로 들어가 Josephson을 대신하는 데 무난한 모습을 보였다. Kernan은 “그냥 돌아가며 맡는 자리일 뿐”이라고 말했다. “모두가 서로와 함께 뛰고, 모두가 자신의 역할을 최선을 다해 수행하려는 같은 생각을 갖고 있다. 그래서 새 선수가 들어와 그 역할을 맡으면, 그 자리를 메우고 라인 동료들과 잘 맞춰 가는 게 쉽다.” Kernan만 그런 것이 아니다. 하위 6명 상당수가 올해 역할을 바꿔 가며, 부상이나 경기 중 상황, 상대에 따라 필요할 때 투입되고 뛰고 있다. 1학년 Josh Zakreski는 “우리 모두 이 팀을 돕고 싶다”고 말했다. “뛸 기회가 오면 우리는 나가서 최선을 다해 뛸 것이다. 라인업에 들어가면 해야 할 일이 있다는 걸 알고 있고, 자신의 역할을 해내면서 이 팀이 경기에서 이길 수 있도록 돕고자 한다.” Zakreski는 비교적 최근에 하위 6명에 합류했다. 6피트, 197파운드의 이 포워드는 10월 말 부상으로 이탈했다가 2월 20일에야 복귀했다. Zakreski는 “부상 기간 동안 스스로에 대해 많은 것을 배웠다”고 말했다. “이런 식으로 다친 적이 없어서 몇 달을 결장한 적도 없었다. 그래서 정신적인 면에 대해 정말 많이 배웠고, 그런 일을 견뎌내는 법도 배웠다.” Zakreski는 Warriors전에서 4라인의 오른쪽 윙으로 2학년 Cade Littler, 1학년 David Klee와 함께 뛰었다. Jackson은 “(Zakreski)는 정말 뛰어났다”고 말했다. “사람들은 선수들을 포인트로 많이 평가하지만, 그는 득점을 못 했을 때조차 우리에게 믿을 수 있는 선수였다. 그는 체크를 끝까지 하고 수비적으로 넓은 얼음을 커버하는 선수라서, 우리는 그의 경기를 정말 좋아했다.” UND 하키 연습 리포트: Fighting Hawks, 가벼운 훈련 소화 UND의 지역 결승 상대 Quinnipiac에 대해 알아야 할 점 Merrimack 코치 Scott Borek는 악수 줄에서 Dane Jackson에게 뭐라고 말했나? UND 체육부, 지역 결승전 학생 티켓 비용 부담",https://www.grandforksherald.com/sports/und-hockey/the-ncaa-tournaments-three-media-timeouts-allow-for-extra-rest-und-hasnt-needed-it
5,V,2026-03-27 22:30:19,Cisco Systems v. Doe - Constitutional Accountability Center,"Cisco Systems v. Doe 사건에서 대법원은, 그 밖의 쟁점들과 함께, 고문 피해자 보호법(Torture Victim Protection Act)이 고문을 방조하고 교사한 자들에게 책임을 부과하는지 여부를 심리하고 있다. 이 사건은 중국 공산당에 의해 중국에서 고문을 당한 파룬궁 수련자들이 제기한 청구에서 비롯되었다. 고문 피해자들은 미국 기술 기업 Cisco Systems의 임원들이 파룬궁 신도를 감시, 체포, 고문하는 데 도움을 주기 위해 중국 공산당에 맞춤형 소프트웨어 시스템을 설계, 구축, 판매했다고 주장했다. 파룬궁 수련자들로 구성된 잠정적 집단소송 원고들이 캘리포니아 북부 연방지방법원에 Cisco Systems와 그 임원들을 상대로 소송을 제기했다. 여기서 관련된 쟁점으로, 한 원고는 고문 피해자 보호법(TVPA)에 따라 회사 임원들을 상대로 청구를 제기했다. 이 법은 어떤 사람을 “고문에 처하게 하는” 사람에게 책임을 부과한다. 임원들은 TVPA가 단지 다른 사람의 고문 행위를 방조하고 교사한 자까지는 포섭하지 않으며, 오직 직접 고문을 저지른 자 또는 자신의 하급자들의 고문 행위에 책임이 있는 자로만 한정된다고 주장하며 기각을 신청했다. 지방법원은 TVPA 청구를 기각했지만, 제9연방항소법원은 만장일치로 이를 뒤집고 TVPA가 고문을 방조하고 교사한 자에게 책임을 부과한다고 판시했다. 이후 피고들은 대법원에 상고를 신청했고, 대법원은 사건 심리를 수락했다. 2026년 3월 Constitutional Accountability Center는 원고를 지지하는 amicus brief를 제출했다. 우리의 서면의 핵심은 두 가지다. 첫째, TVPA의 문언적 의미는 고문을 방조하고 교사한 자를 포섭한다. 우리의 서면에서 설명하듯, 동사 “subjects”의 사전적 정의와 일상적 용례는 “subjects”가 어떤 사람을 무언가를 “겪게 하거나(exposed)” “당하게(cause ... to undergo)” 하는 것을 의미함을 보여준다. 실제로 대법원과 의회 모두 이 동사를, 어떤 사람이 직접 그 근본 행위를 가하지 않았거나 그에 책임이 없더라도 다른 사람을 어떤 것에 “subject”할 수 있음을 분명히 하는 맥락에서 사용해 왔다. 이러한 이해는 TVPA 제정 당시의 언론 보도에서 “subjects”가 사용된 사례들에 의해서도 확인된다. 고문을 방조하고 교사한 자는 피해자가 고문을 겪도록 “cause”했으므로, TVPA의 의미상 피해자를 고문에 “subject”한 것이다. 둘째, 우리의 서면은 대법원이 민사법률이 방조 및 교사 책임을 부과하기 전에 의회가 반드시 “aid”와 “abet”이라는 용어를 사용해야 한다는 식의 유동적인 “마법의 단어” 규칙을 채택한 적이 없다고 설명한다. 피고들은 Central Bank of Denver라는 사건을 근거로 그 주장을 펼치지만, 우리의 서면은 그 주장이 왜 잘못되었는지를 설명한다. 또한 그러한 마법의 단어 규칙은 개별 법률의 통상적 의미를 왜곡하고 판사가 만든 기술적 해석을 법률 문언의 평이한 의미보다 우위에 두게 하므로, 권력분립에 중대한 우려를 낳는다고 설명한다. 이는 입법을 할 의회 권한을 침해하고, 판사들이 의회가 제정한 법률의 문언을 사실상 다시 쓰도록 만든다. 대법원은 고문을 방조하고 교사한 자들도 TVPA에 따라 책임을 질 수 있다는 제9연방항소법원의 판결을 확인해야 한다.",https://www.theusconstitution.org/litigation/cisco-systems-v-doe/
