ticker,title,date,content,url
V,PSG v Toulouse to trial referee microphones for VAR explanations in Ligue one - OneFootball,2026-04-03 23:50:03,"Get the full live experience with the OneFootball app. Referee Éric Wattellier will wear a live microphone during PSG v Toulouse on Friday at 20:45, explaining VAR-related decisions to supporters in the stadium and viewers at home. The trial is being run by the LFP and could be repeated before the end of the season. The Parc des Princes will host the trial as it opens matchday 28 of Ligue one. According to L'Équipe, Wattellier’s mic will be activated remotely by VAR official Mathieu Vernice from the supervision centre, and certain explanations will be broadcast live to the crowd and the television audience, including the pre-match coin toss. Toulouse midfielder Aron Dönnum voiced doubts, suggesting explanations will not necessarily improve acceptance among players or fans. Even so, the initiative aims to aid public understanding. The system is already commonplace in the Bundesliga and the Premier League this season. The refereeing department has long backed the idea, though costs and, to a lesser extent, uneven stadium technology had delayed it. After IFAB’s approval in early 2024, director of refereeing Antony Gautier said officials were trained specifically for this exercise and are ready to operate. Gautier welcomed the launch in Ligue one and said he would like to see it extended to every matchday across all stadiums next season, if the trial proves conclusive, arguing that any step which improves understanding of decisions should be encouraged. PSG head coach Luis Enrique took a positive view, saying he is open to anything that can improve football and that clearer explanations for supporters, players and coaches would be beneficial. Referee to be miked for PSG v Toulouse in Ligue 1 first, more trials could follow PSG v Toulouse referee to be mic'd up for VAR, Ligue 1 first PLAYER RATINGS | PSG 3-1 Toulouse: League leaders go four points clear Ousmane Dembélé tops Ligue 1 pay list as PSG dominate Pep Guardiola thinks Rodri will stay at Man City but accepts lure of Real Madrid Pep Guardiola believes Rodri will sign a new contract at Manchester City but will not stand in his way if Real Madrid come calling.City midfielder Rodri, whose contract expires at... Chelsea decide if Enzo Fernandez will remain as vice-captain after two-game sanction Argentine has been stood down for two huge cup clashesEnzo Fernandez will remain Chelsea’s vice-captain despite being punished by the club over comments regarding his future, Liam Rosenior has confirmed.The... Club football makes its return after the international break with some thrilling ties on the weekend schedule. Our five best games of the weekend feature massive games in Greece, Italy,... OneFootball is proud to partner with Yahoo! Sports to deliver quality football content to fans in USA and Canada. These cookies are necessary for the website to function and cannot be switched off in our systems. They are usually only set in response to actions made by you which amount to a request for services, such as setting your privacy preferences, logging in or filling in forms. You can set your browser to block or alert you about these cookies, but some parts of the site will not then work. These cookies do not store any personally identifiable information. Third party trackers collect information to use for analytics and to personalize your experience with targeted ads. Under the Colorado CPA, the Virginia CDPA, the Texas DPSA, the Oregon CPA, the Montana CDPA, and the Florida DBR, you have the right to opt-out of the sale of your personal data to third parties, of targeted advertising related processing, and of some types of profiling. You may exercise your rights by using the toggles below. If you opt out, the ads and content that you see may not be as relevant to you. Under the Colorado CPA, you have the right to opt back in to these categories at any time should you initially choose to opt out, and you may do so using the same toggles provided below. For more details on the data we process and how to exercise your rights, and to view information related to required opt-in disclosures, see our Privacy Policy These cookies may be set through our site by our advertising partners. They may be used by those companies to build a profile of your interests and show you relevant adverts on other sites. They do not store directly personal information, but are based on uniquely identifying your browser and internet device. If you do not allow these cookies, you will experience less targeted advertising. These cookies allow us to count visits and traffic sources so we can measure and improve the performance of our site. They help us to know which pages are the most and least popular and see how visitors move around the site. All information these cookies collect is aggregated and therefore anonymous. If you do not allow these cookies we will not know when you have visited our site, and will not be able to monitor its performance.",https://onefootball.com/en/news/psg-v-toulouse-to-trial-referee-microphones-for-var-explanations-in-ligue-one-42657283
V,Coritiba v Flu: top-four push meets Sudamericana chase - OneFootball,2026-04-03 23:38:06,"Get the full live experience with the OneFootball app. Coritiba host Fluminense in the Brasileirão on Saturday, 4 April 2026, at Estádio Major Antônio Couto Pereira, with the visitors second on 19 points and the hosts seventh on 14 in a live scrap for continental places. Coritiba and Fluminense traded home wins last season. The sides now meet with contrasting targets shaped by the table: the visitors chasing the top four, the hosts guarding a Sudamericana berth. Form points to momentum for both. Coxa have three wins in their past five league games and drew with Vasco da Gama last time out. Flu have won four of their past five, including a 3-1 victory over Corinthians in midweek. Availability could shape selection. Coxa are without Keno, Rodrigues and goalkeeper Pedro Morisco through injury, and Joaquín Lavega is suspended. Tricolor Carioca are missing Luciano Acosta (suspended) plus Nonato, Facundo Bernal and Matheus Reis through injury. The match-up angles are clear. Coxa have scored only two league goals at home, so set pieces and transitions could be vital, while their defence has conceded nine in nine. Flu have been far stronger at home than away, with just one away win and four away points, yet they have 16 goals overall and may still test the hosts' back line. A win would move Coxa-Branca to 17 points and further cement their Sudamericana push. Three points for Flu would take them to 22 and strengthen their hold on the top four, keeping them firmly in the title chase. Where to watch Coritiba v Fluminense in the Brasileirão Corinthians’ unbeaten away run in Brasileirão ends with defeat by Fluminense Santos have eight players at risk of suspension for Remo clash Santos breathe easier! See the Brasileirão table after round 9 Neymar decisive as Santos beat Remo and leave Brasileirão bottom four Pep Guardiola thinks Rodri will stay at Man City but accepts lure of Real Madrid Pep Guardiola believes Rodri will sign a new contract at Manchester City but will not stand in his way if Real Madrid come calling.City midfielder Rodri, whose contract expires at... Chelsea decide if Enzo Fernandez will remain as vice-captain after two-game sanction Argentine has been stood down for two huge cup clashesEnzo Fernandez will remain Chelsea’s vice-captain despite being punished by the club over comments regarding his future, Liam Rosenior has confirmed.The... Club football makes its return after the international break with some thrilling ties on the weekend schedule. Our five best games of the weekend feature massive games in Greece, Italy,... OneFootball is proud to partner with Yahoo! Sports to deliver quality football content to fans in USA and Canada. These cookies are necessary for the website to function and cannot be switched off in our systems. They are usually only set in response to actions made by you which amount to a request for services, such as setting your privacy preferences, logging in or filling in forms. You can set your browser to block or alert you about these cookies, but some parts of the site will not then work. These cookies do not store any personally identifiable information. Third party trackers collect information to use for analytics and to personalize your experience with targeted ads. Under the Colorado CPA, the Virginia CDPA, the Texas DPSA, the Oregon CPA, the Montana CDPA, and the Florida DBR, you have the right to opt-out of the sale of your personal data to third parties, of targeted advertising related processing, and of some types of profiling. You may exercise your rights by using the toggles below. If you opt out, the ads and content that you see may not be as relevant to you. Under the Colorado CPA, you have the right to opt back in to these categories at any time should you initially choose to opt out, and you may do so using the same toggles provided below. For more details on the data we process and how to exercise your rights, and to view information related to required opt-in disclosures, see our Privacy Policy These cookies may be set through our site by our advertising partners. They may be used by those companies to build a profile of your interests and show you relevant adverts on other sites. They do not store directly personal information, but are based on uniquely identifying your browser and internet device. If you do not allow these cookies, you will experience less targeted advertising. These cookies allow us to count visits and traffic sources so we can measure and improve the performance of our site. They help us to know which pages are the most and least popular and see how visitors move around the site. All information these cookies collect is aggregated and therefore anonymous. If you do not allow these cookies we will not know when you have visited our site, and will not be able to monitor its performance.",https://onefootball.com/en/news/coritiba-v-flu-top-four-push-meets-sudamericana-chase-42657263
V,Sporting CP - Santa Clara 4:2 - Flashscore.com,2026-04-03 23:09:39,"Retrouvez nos conseils sur www.joueurs-info-service.fr (09-74-75-13-13, appel non surtaxé) 18+ | Erlaubtes Glücksspiel gemäß der Whitelist | Suchtrisiken | Hilfe unter buwei.de 21+ Участь в азартних іграх може викликати ігрову залежність. Дотримуйтеся правил (принципів) відповідальної гри Retrouvez nos conseils sur www.joueurs-info-service.fr (09-74-75-13-13, appel non surtaxé) 18+ | Erlaubtes Glücksspiel gemäß der Whitelist | Suchtrisiken | Hilfe unter buwei.de 21+ Участь в азартних іграх може викликати ігрову залежність. Дотримуйтеся правил (принципів) відповідальної гри Use precise geolocation data. Actively scan device characteristics for identification. Store and/or access information on a device. Personalised advertising and content, advertising and content measurement, audience research and services development. 
        List of Partners (vendors) We process your data to deliver content or advertisements and measure the delivery of such content or advertisements to extract insights about our website. We share this information with our partners on the basis of consent and legitimate interest. You may exercise your right to consent or object to a legitimate interest, based on a specific purpose below or at a partner level in the link under each purpose. These choices will be signaled to our vendors participating in the Transparency and Consent Framework. The choices you make regarding the purposes and vendors listed in this notice are saved and stored locally on your device for a maximum duration of 1 year.
            More informationThird partiesUser ID:  bd7dbbd6-7963-4962-bd23-1510b9d954bbThis User ID will be used as a unique identifier while storing and accessing your preferences for future.Timestamp:  -- These cookies are necessary for the website to function and cannot be switched off in our systems. They are usually only set in response to actions made by you which amount to a request for services, such as setting your privacy preferences, logging in or filling in forms.  You can set your browser to block or alert you about these cookies, but some parts of the site will not then work. These cookies do not store any personally identifiable information. These cookies allow us to count visits and traffic sources so we can measure and improve the performance of our site. They help us to know which pages are the most and least popular and see how visitors move around the site.  If you do not allow these cookies we will not know when you have visited our site, and will not be able to monitor and improve its performance. These cookies may be set through our site by our advertising partners. They may be used by those companies to build a profile of your interests and show you relevant adverts on other sites. They do not store directly personal information, but are based on uniquely identifying your browser and internet device. If you do not allow these cookies, you will experience less targeted advertising. These cookies enable the website to provide enhanced functionality and personalisation. They may be set by us or by third party providers whose services we have added to our pages.  If you do not allow these cookies then some or all of these services may not function properly. Cookies, device or similar online identifiers (e.g. login-based identifiers, randomly assigned identifiers, network based identifiers) together with other information (e.g. browser type and information, language, screen size, supported technologies etc.) can be stored or read on your device to recognise it each time it connects to an app or to a website, for one or several of the purposes presented here. Advertising presented to you on this service can be based on limited data, such as the website or app you are using, your non-precise location, your device type or which content you are (or have been) interacting with (for example, to limit the number of times an ad is presented to you). Information about your activity on this service (such as forms you submit, content you look at) can be stored and combined with other information about you (for example, information from your previous activity on this service and other websites or apps) or similar users. This is then used to build or improve a profile about you (that might include possible interests and personal aspects). Your profile can be used (also later) to present advertising that appears more relevant based on your possible interests by this and other entities. Advertising presented to you on this service can be based on your advertising profiles, which can reflect your activity on this service or other websites or apps (like the forms you submit, content you look at), possible interests and personal aspects. Information about your activity on this service (for instance, forms you submit, non-advertising content you look at) can be stored and combined with other information about you (such as your previous activity on this service or other websites or apps) or similar users. This is then used to build or improve a profile about you (which might for example include possible interests and personal aspects). Your profile can be used (also later) to present content that appears more relevant based on your possible interests, such as by adapting the order in which content is shown to you, so that it is even easier for you to find content that matches your interests. Content presented to you on this service can be based on your content personalisation profiles, which can reflect your activity on this or other services (for instance, the forms you submit, content you look at), possible interests and personal aspects. This can for example be used to adapt the order in which content is shown to you, so that it is even easier for you to find (non-advertising) content that matches your interests. Information regarding which advertising is presented to you and how you interact with it can be used to determine how well an advert has worked for you or other users and whether the goals of the advertising were reached. For instance, whether you saw an ad, whether you clicked on it, whether it led you to buy a product or visit a website, etc. This is very helpful to understand the relevance of advertising campaigns. Information regarding which content is presented to you and how you interact with it can be used to determine whether the (non-advertising) content e.g. reached its intended audience and matched your interests. For instance, whether you read an article, watch a video, listen to a podcast or look at a product description, how long you spent on this service and the web pages you visit etc. This is very helpful to understand the relevance of (non-advertising) content that is shown to you. Reports can be generated based on the combination of data sets (like user profiles, statistics, market research, analytics data) regarding your interactions and those of other users with advertising or (non-advertising) content to identify common characteristics (for instance, to determine which target audiences are more receptive to an ad campaign or to certain contents). Information about your activity on this service, such as your interaction with ads or content, can be very helpful to improve products and services and to build new products and services based on user interactions, the type of audience, etc. This specific purpose does not include the development or improvement of user profiles and identifiers. Content presented to you on this service can be based on limited data, such as the website or app you are using, your non-precise location, your device type, or which content you are (or have been) interacting with (for example, to limit the number of times a video or an article is presented to you). With your acceptance, your precise location (within a radius of less than 500 metres) may be used in support of the purposes explained in this notice. With your acceptance, certain characteristics specific to your device might be requested and used to distinguish it from other devices (such as the installed fonts or plugins, the resolution of your screen) in support of the purposes explained in this notice. Your data can be used to monitor for and prevent unusual and possibly fraudulent activity (for example, regarding advertising, ad clicks by bots), and ensure systems and processes work properly and securely. It can also be used to correct any problems you, the publisher or the advertiser may encounter in the delivery of content and ads and in your interaction with them. Certain information (like an IP address or device capabilities) is used to ensure the technical compatibility of the content or advertising, and to facilitate the transmission of the content or ad to your device. Information about your activity on this service may be matched and combined with other information relating to you and originating from various sources (for instance your activity on a separate online service, your use of a loyalty card in-store, or your answers to a survey), in support of the purposes explained in this notice. In support of the purposes explained in this notice, your device might be considered as likely linked to other devices that belong to you or your household (for instance because you are logged in to the same service on both your phone and your computer, or because you may use the same Internet connection on both devices). Your device might be distinguished from other devices based on information it automatically sends when accessing the Internet (for instance, the IP address of your Internet connection or the type of browser you are using) in support of the purposes exposed in this notice. The choices you make regarding the purposes and entities listed in this notice are saved and made available to those entities in the form of digital signals (such as a string of characters). This is necessary in order to enable both this service and those entities to respect such choices.",https://www.flashscore.com/match/football/santa-clara-YmQyLBJf/sporting-cp-tljXuHBC/summary/player-stats/?mid=MJSPKuT9
V,"FA Cup quarter-final LIVE: Chelsea vs Port Vale - score, TV coverage, radio commentary, text updates & match stats - BBC",2026-04-03 22:58:44,"Chelsea and Port Vale last met in any competition in April 1929 in a league encounter, won 1-0 by the Valiants. All 14 meetings between the teams were in the second tier between 1905-06 and 1928-29 (7 Chelsea wins, 4 draws, 3 Port Vale wins). Port Vale have never won an away game against Chelsea in seven attempts (D1 L6), with only four teams playing more times there without a win: Hull City (23 games), Bristol City (13), Reading (10), and Swindon Town (8). Chelsea have progressed from 64 of their last 66 FA Cup ties against sides from outside the Premier League, failing in this run only against Barnsley in 2007-08 and Bradford City in 2014-15. In domestic cup competitions since 2015-16, the Blues have had 37 ties against lower league teams and progressed from all 37. Port Vale are in just their second ever FA Cup quarter-final, previously reaching this stage in the 1953-54 campaign when they knocked out Leyton Orient. In the time between the Valiants last appearing at this stage, Chelsea have played 30 quarter-final ties. Should Chelsea win this tie, they will have reached the FA Cup semi-final without facing a top-flight opponent for the fourth time under the competition’s current format (from 1925-26) – which would be the joint-most of any side, equalling Tottenham Hotspur. Indeed, the last side to do so were the Blues themselves in 2021-22 (Arsenal could also do this in 2025-26). After beating Sunderland in the fifth round, Port Vale are looking to become the first side from the third tier or lower to eliminate two Premier League clubs in a single FA Cup campaign since Wigan Athletic in 2017-18 (3 – Bournemouth, West Ham, Man City). The Valiants themselves last achieved this feat in 1953-54 (the season of their only previous quarter-final), knocking out Cardiff City and Blackpool. Chelsea’s João Pedro has scored seven goals in his last seven FA Cup appearances. Six of these have come since the start of 2023-24, with no player netting more times in the competition in this period. Ben Waine has scored three FA Cup goals this season, including Port Vale’s winner in both the fourth and fifth rounds against Bristol City and Sunderland. The last player to score four in a single campaign in the competition for the club was Tom Pope in 2019-20. Copyright © 2026 BBC. The BBC is not responsible for the content of external sites. Read about our approach to external linking.",https://www.bbc.com/sport/football/live/clyew9r7jdet
