id,ticker,date,title,content,url
18,V,2026-03-27 20:36:35,MA 대 Judy Church: 부동액 살인 재판 - Court TV,"매사추세츠주 세일럼(Court TV) — 한 매사추세츠 여성이 동거하던 남자친구를 부동액으로 중독시켜 살해한 혐의로 재판을 받고 있다. Judy Church가 살인 재판 중 법정에 앉아 있다. (Court TV) 67세의 Judy Church는 2022년 11월 13일 사망한 Leroy Fowler(55)를 살해한 혐의로 기소됐으며, 무죄를 주장했다. 2022년 11월 11일, Church는 911에 전화를 걸어 Fowler가 “무언가를 섭취한 것 같아야” 하고 코피를 흘리며 침실을 헤집고 있다고 신고했다. 구급대원이 도착했을 때 피해자는 의식 상태가 변해 있었고 의료적 위급 상태에 있었다. 그는 병원으로 이송됐으며, 며칠 뒤 생명 유지 장치에서 제거된 후 사망했다. 의사들이 Fowler의 가족에게 그의 신장 손상이 부동액 중독의 결과라고 믿는다고 말하자, 가족은 즉시 경찰에 연락했다. 경찰이 Church를 그녀의 집에서 인터뷰했을 때, 그녀는 형사들이 안으로 들어오는 것을 거부하고 밖에서만 이야기하겠다고 했다. 그녀는 Fowler가 사건 전 아무것도 먹거나 마신 적이 없다고 부인했다. Church의 성인 아들 Douglas Church는 Fowler가 일산화탄소 중독을 겪었을 가능성을 제기했다. 형사들은 Fowler의 가족과도 접촉했는데, 가족은 피해자가 Church와 수년간 관계를 유지해 왔지만 다른 여자친구도 있었다고 말했다. Fowler의 의붓아들은 경찰에 Fowler가 이전에 자신에게 Church가 자신을 중독시키고 있다고 생각한다고 말한 적이 있다고 진술했다. 이유는 “Judy의 집을 떠날 때마다 몸이 더 좋아지기 때문”이라는 것이었다. 의붓아들은 또한 Church가 Fowler의 두 번째 여자친구 집에서 그를 납치해 “묶어서 그녀에게 다시 데려오라”며 자신에게 1만 달러를 제안했다고도 경찰에 말했다. Fowler의 가족은 조사관들에게 Church가 피해자의 사망 약 1년 전에 생명보험에 가입시켰다고 전했다. Andrew Camelio가 연방(공소측) 측 최후변론을 진행하며, “이 살인은 극도의 만행과 잔혹성을 동반해 저질러졌다”고 재차 강조한다. 더 보기 Judy Church의 변호인단이 최후변론을 진행하며 “Judy가 Powerade에 부동액을 넣었다면, 왜 그것을 집 안에 두었겠는가?”라고 묻는다. 더 보기 부검을 수행한 Dr. Richard Atkinson이 Leroy Fowler의 신장에서 수산칼슘 결정이 발견된 점을 설명한다. 더 보기 새 영상은 Bryan Kohberger가 번호판을 바꾸고 Jeffrey Spence가 딸의 남자친구를 살해한 혐의로 유죄 판결을 받은 사실을 보여준다. © 2026 Court TV Media LLC, The E.W. Scripps Company의 일부. All Rights Reserved.",https://www.courttv.com/news/ma-v-judy-church-death-by-antifreeze-trial/
19,V,2026-03-27 20:35:35,스코틀랜드 챔피언십: Partick Thistle 대 Ross County & Raith Rovers 대 Ayr United - Yahoo Sports,"Partick Thistle 3-1 Ross County - Lindsay의 선제골 이후 Samuel, Crawford, McPherson이 Thistle을 앞서게 했다. Raith Rovers 1-0 Ayr United - Innes Cameron이 균형을 깼다. 스코틀랜드 챔피언십: Partick Thistle 대 Ross County & Raith Rovers 대 Ayr United",https://sports.yahoo.com/articles/scottish-championship-partick-thistle-v-193438705.html?guccounter=1&guce_referrer=aHR0cHM6Ly9uZXdzLmdvb2dsZS5jb20v&guce_referrer_sig=AQAAAFX5XlYHhxDc7AfWbUyaM1vhBP1Hrrle6OVpixLnVkBC3fXhAIqo_vzhPEhuXbMzD2v8A4OYvP7L2fcurAYCcDokwESKcQyyX84r7i5JnQWsEGmjPz55NnC1YxCIG5aaZvNXJ1Bt2zaB1ZM8H8B2DHojl-IuB2Wm7DKVlLK7UwpQ
20,V,2026-03-27 20:12:23,Sharks 대 Cardiff: Springboks의 호화 전력이 JP Pietersen의 팀이 '무기력한' 경기력을 극복하는 데 도움이 된 5가지 포인트 - Planet Rugby,"Sharks 포워드 Ox Nche와 Emile van Heerden. 더반에서 열린 Sharks의 Cardiff전 21-15 승리 이후, United Rugby Championship 맞대결에서 얻은 다섯 가지 시사점을 정리했다. 경기는 아름답지 않았다. 치열했고, 실수가 많았다. 그러나 Sharks에는 꼭 필요한 승리였고 Cardiff에는 또 한 번의 원정 패배였다. 더반 팀에게는 상위 8위 진입을 향한 뜻밖의 도전을 이어가는 데 결정적인 승리였으며, 트라이 수에서 Cardiff를 3-2로 앞섰다. Phepsi Buthelezi가 강력한 몰의 후방에서 두 번의 트라이를 기록했고, Yaw Penxe가 전반 종료 휘슬 전에 세 번째 트라이를 꽂아 넣었다. Mason Grady는 Cardiff의 두 트라이를 모두 기록했고, 홈팀은 Ioan Lloyd의 72분 페널티킥으로 21-12로 앞선 채 전반을 마쳤다. 이후 남은 40분 동안 양 팀이 스코어보드에 올린 유일한 득점이었다. 전형적인 더반의 조건, 즉 덥고 습하며 약간 비가 내리는 상황에서 JP Pietersen의 팀은 어리석은 실수, 나쁜 판단, 핵심 기술의 무기력한 실행을 단순히 Cardiff 포워드를 두들겨 패는 방식으로 극복했다. 두 차례의 월드컵 우승 경력이 있는 세계적 수준의 프롭 Ox Nche와 Vincent Koch를 벤치에 두었다가 전반 종료 10분을 남기고 투입할 수 있다는 호사도 큰 도움이 됐다. 이 프론트로우 선수들의 영향은 스크럼보다는 몰에서 나타났으며, Koch는 심판 Gianluca Gnecchi가 몰 세팅 과정에서 Cardiff의 불법 행위를 포착하도록 만들어 Sharks를 상대 진영 22m 안쪽으로 더 깊이 밀어 넣었다. 그 결과 이 듀오는 Buthelezi의 두 번째 트라이에 기여했다. Pietersen과 코칭스태프는 공격상의 문제와 수비에서의 간헐적 허점을 꼼꼼히 따지겠지만, 라인아웃은 승리의 핵심 동력이었다. 특히 뛰어나면서도 과소평가되기 쉬운 Emile van Heerden이 그 중심에 있었다. 25세의 그는 최근 몇 주 동안 출장 정지 중인 Eben Etzebeth와 함께 훈련해 왔는데, 관련된 모든 이들이 충분히 칭찬받을 만하다. Sharks는 세트피스에서 반복적으로 공을 확보하고 Cardiff의 볼을 방해하는 데 성공했다. Sharks의 라인아웃과 몰 전술이 얼마나 잘 맞물려 돌아가는지는 Buthelezi의 두 번째 트라이에서 잘 드러났다. Cardiff가 드라이브를 어느 정도 분해했지만 Jason Jenkins가 전진했고 Buthelezi가 바로 뒤를 따랐다. Jenkins는 자신이 방해물을 만들 수 있음을 깨닫고 멈춰 섰고, 그의 백로우가 빠져나가 돌파했다. 미묘하고, 놓치기 쉽지만, 중요한 장면이었다. Sharks의 라인아웃은 세 트라이 중 두 개를 만들어냈고, 특히 핵심 지역에서 Cardiff의 소유권을 계속 빼앗았다. 홈팀은 자팀 볼 확보 성공률 94%로 경기를 마친 반면 Cardiff는 70%에 그쳤다. 웨일스 팀이 일시적인 록진(locks) 위기를 겪고 있다는 점은 고려할 필요가 있지만, 그럼에도 Sharks는 헤드-온 라인아웃에서 7번이나 공을 따냈다. Van der Heerden과 Vincent Tshituka가 훌륭한 호흡으로 큰 혼란을 일으켰다. 스크럼에서는 Cardiff가 상황을 개선하지 못했고, Sharks는 계속해서 페널티를 따냈지만 원정팀도 Gnecchi로부터 몇 차례 유리한 판정을 받았다. 그러나 전반적으로 더반 팀의 세트피스에서의 우수함은 특히 이런 날씨 조건에서는 넘어서기 너무 큰 장애물이었다. 그리고 균형을 맞추는 데 성공했을 때에도 Andre Esterhuizen은 Callum Sheedy의 채널을 거칠게 파고들며 플라이인 플라이하프를 만들어냈고, 웨일스 선수를 밀쳐낸 뒤 여러 수비수들이 그를 땅에 눕혀야 했는데, 그때쯤 Cardiff는 다시 수세에 몰려 있었다. Sharks 선수 평점: Springboks 제외와 Andre Esterhuizen의 '선봉 역할', Cardiff와의 치열한 승리에서 돋보이다. Cardiff는 세트피스에서 완전히 밀렸음에도 Corniel van Zyl이 가져갈 긍정적인 요소가 있었다. 그것은 단순한 투지 이상의 것이었다. 웨일스 팀에는 그 투지는 기본이기 때문이다. 대신 두 트라이를 만들어낸 것은 창의성과 문제 해결 능력이었다. 첫 번째 트라이는 Sharks 라인 근처에서 완벽하게 실행된 탭 플레이에서 나왔고, 이는 바깥 공간을 열어 Grady가 손쉽게 5점을 올릴 수 있게 했다. 두 번째는 Sharks가 14명으로 줄어든 직후 빠르게 나왔는데, Jordan Hendrikse가 의도적인 노크온으로 유죄 판정을 받았고 이는 돌파로 이어졌을 상황이었다. Sharks가 특히 자국 22m 안에서는 수비를 좁게 펼칠 것임을 알고 Ben Thomas는 훌륭하게 필드를 가로질러 자기 윙어에게 킥을 보냈고, 그 기회는 놓칠 수 없는 것이었다. Cardiff는 최근 원정에서 확실히 고전해 왔지만, 오늘은 난투를 받아들였고 세트피스 문제에도 불구하고 최종 휘슬까지 싸움을 이어갔다. 결국 경기를 결정한 것은 Penxe가 느슨한 공에서 만들어낸 한 순간의 빛나는 플레이였다. 지난주 프리토리아에서는 벤치에서 잠깐 모습을 드러내는 데 그쳤던 James Botham은 선발로 복귀해 Six Nations에서 웨일스를 위해 보여줬던 흐름을 이어가며 결국 주연급 활약을 펼쳤다. 그는 수비와 브레이크다운에서 잔혹할 정도로 효과적이었고, 홈팀의 실수를 유발하며 Pietersen의 팀에 전방위적인 골칫거리가 됐다. 28세인 그는 올해 정말로 자기 모습을 찾아가는 듯하며, 이는 구단과 국가대표팀 모두에 좋은 일이다. Botham이 Championship 출전 명단에 이름을 올린 반면 Sheedy는 그렇지 못했지만, Steve Tandy에게 플라이하프 선택지가 부족한 것은 아니다. 그럼에도 Cardiff의 이 선수는 더 많은 고려를 받을 자격이 분명하다. 더반에서의 경기는 결코 흥행작은 아니었지만, 그는 특히 킥 싸움에서 많은 부분을 잘 해냈고 원정팀은 실제 성과를 거뒀다. Grady의 두 트라이는 그의 기량을 가진 선수에게는 쉬운 득점이었지만, 그래도 넣어야 하는 것이었고 그는 해냈다. 그러나 Cardiff가 잘했던 많은 부분은 이 인상적인 백의 노력에서 비롯됐다. 그는 하이볼 상황에서 Makazole Mapimpi를 몇 차례 곤란하게 했고, 멋진 돌파를 만들었으나 Esterhuizen의 뛰어난 커버 태클에 막히기도 했으며, 백라인에서는 전진이 어려웠던 경기에서 꾸준히 야드를 쌓았다. Rassie Erasmus는 스크럼하프 선택지에서 풍부한 여유를 누리고 있으며, Bradley Davids는 그의 레이더에 거의 잡히지 않고 있다는 사실이 이를 분명히 보여준다. Sharks의 신예를 두둔하자면, 부상 때문에 이번이 시즌 두 번째 출전일 뿐이지만 그는 빠르게 리듬을 찾아가고 있는 듯하다. 물론 완벽과는 거리가 있었고, 자기 진영에서 매우 어리석은 빠른 탭 페널티는 아마 Jordan Hendrikse가 콜한 것으로 보이며 Esterhuizen의 반응으로 미루어 짐작할 수 있다. 또한 Cardiff 진영에서 시도한 칩 킥도 전혀 적절하지 않았다. 그러나 전반적인 킥과 분배는 무난했고, 그의 팀은 꼭 필요한 승리를 힘겹게 따냈다. Esterhuizen은 다시 한 번 자신이 작년 Springboks에서 왜 핵심 축이었는지, 그리고 Pietersen 체제에서 왜 Sharks 주장으로 승격됐는지를 보여줬다. 그가 마지막으로 부진한 경기를 했던 때를 떠올리기 어려울 정도이며, 그는 주변 동료들에게 매우 높은 기준을 요구한다. 오늘도 마찬가지였고, 그는 기준을 세우며 또 하나의 강하고 안정적인 활약을 펼쳤다. Erasmus는 올해 지금까지 70명 안팎의 선수들을 정렬 캠프에 초대했지만, 세 명의 Sharks 선수는 외면받았고, 이는 Buthelezi, Jenkins, Van Heerden에게 그의 관심을 끌 가능성이 있다. Bok 감독은 록 포지션의 얕은 뎁스를 언급한 바 있으며, 후자의 두 선수는 충분히 경쟁권에 들어올 수 있다. 오늘 그들은 자신들이 한 거의 모든 일에서 강하고 정확했으며, 그 수준 높은 스쿼드에 들어가기는 어렵지만 좋은 인상을 남기고 있다. 한편 Buthelezi는 볼 캐리에서 끈질겼고, 경기 최우수선수상을 가져갔다. Siya Kolisi가 빠진 상황에서 정말 성실하게 뛰었고, 두 트라이가 모두 몰의 우세에서 나왔지만 돌파 타이밍은 완벽했다. 마지막으로 Tshituka는 지난해 자신이 획득한 단 1개의 테스트 캡 이상을 더할 가능성을 높였다. Planet Rugby의 더 많은 소식을 원한다면, 신뢰할 수 있는 세계적 수준의 보도를 위해 Google에서 선호 소스로 추가해 즐겨찾기 목록에 넣어두자. Cardiff는 경기 중 5위와 3위 사이를 오갔지만 최종 휘슬에서는 전자의 위치로 마쳤고, 이번 주말 다른 경기 결과에 따라 순위가 더 내려갈 수도 있다. EPCR 휴식기 이후 Scarlets와 Ospreys를 상대로 한 더비가 예정되어 있어, Van Zyl의 팀에게는 매우 중요한 시기다. 정규시즌 마지막 두 경기는 Glasgow(원정)와 Stormers(홈)와의 경기다. Oval Insights는 더반에서 첫 휘슬이 울리기 전 Sharks의 상위 8위 진입 확률을 31%, Cardiff의 확률을 67%로 평가했다. 그 수치는 지금쯤 분명 바뀌었겠지만, 두 팀 모두 단 1점에 대해 곱씹게 될 것이다. Sharks에게는 보너스 포인트 트라이를 따내지 못한 1점이었고, 공격이 특히 전환공 상황에서 너무 자주 기대에 못 미쳤다. 반면 몹시 실망한 Cardiff는 적어도 패배 보너스 포인트라도 챙겼다는 점에서 조금은 위안을 얻었을 것이다. 그래도 남아공 원정 2경기에서 1점만 가져온 것은 플레이오프 진출을 노리는 팀에게는 충격적인 결과다. 

더 보기: Siya Kolisi의 결장 이유가 설명되고, JP Pietersen이 Springboks 스피드스터의 제외를 설명한다 © Planet Sport Limited 2026 • All Rights Reserved",https://www.planetrugby.com/news/sharks-v-cardiff-five-takeaways-as-springboks-luxury-helps-jp-pietersens-men-overcome-lacklustre-performance
21,V,2026-03-27 19:50:49,두 구단의 역사에 모두 남은 콜론 대 파트로나토 경기 - OneFootball,"앗! 찾으시는 내용을 찾을 수 없는 것 같습니다. 대신 홈페이지를 방문해 뉴스와 하이라이트를 확인하실 수 있습니다. OneFootball은 미국과 캐나다의 팬들에게 양질의 축구 콘텐츠를 제공하기 위해 Yahoo! Sports와 협력하게 된 것을 자랑스럽게 생각합니다. 이러한 쿠키는 웹사이트가 작동하는 데 필요하며, 당사 시스템에서 끌 수 없습니다. 일반적으로 이는 개인정보 설정, 로그인 또는 양식 작성 등 사용자가 서비스 요청에 해당하는 행동을 했을 때만 설정됩니다. 브라우저에서 이러한 쿠키를 차단하거나 알림을 받도록 설정할 수 있지만, 그러면 사이트의 일부가 작동하지 않을 수 있습니다. 이러한 쿠키는 개인 식별 정보를 저장하지 않습니다. 제3자 추적 도구는 분석 및 맞춤형 광고를 통한 경험 개인화를 위해 정보를 수집합니다. 콜로라도 CPA, 버지니아 CDPA, 텍사스 DPSA, 오리건 CPA, 몬태나 CDPA, 플로리다 DBR에 따라 귀하는 제3자에 대한 개인정보 판매, 타깃 광고 관련 처리, 일부 유형의 프로파일링을 거부할 권리가 있습니다. 아래 토글을 사용해 해당 권리를 행사할 수 있습니다. 거부할 경우, 표시되는 광고와 콘텐츠의 관련성이 낮아질 수 있습니다. 콜로라도 CPA에 따라 처음에 거부를 선택한 경우 언제든지 다시 동의할 권리가 있으며, 아래에 제공된 동일한 토글을 사용해 그렇게 할 수 있습니다. 당사가 처리하는 데이터와 귀하의 권리 행사 방법에 대한 자세한 내용, 그리고 필요한 동의 고지 관련 정보는 개인정보 처리방침을 참조하십시오. 이러한 쿠키는 당사의 광고 파트너를 통해 사이트에 설정될 수 있습니다. 이들은 해당 회사가 귀하의 관심사 프로필을 구축하고 다른 사이트에서 관련 광고를 보여주는 데 사용될 수 있습니다. 이 쿠키는 직접적인 개인정보를 저장하지 않지만, 귀하의 브라우저와 인터넷 장치를 고유하게 식별하는 정보를 기반으로 합니다. 이러한 쿠키를 허용하지 않으면 보다 덜 맞춤화된 광고를 보게 됩니다. 이러한 쿠키는 방문 수와 트래픽 출처를 집계해 사이트의 성과를 측정하고 개선할 수 있게 해줍니다. 또한 어떤 페이지가 가장 인기 있고 가장 덜 인기 있는지, 방문자들이 사이트를 어떻게 이동하는지 파악하는 데 도움이 됩니다. 이러한 쿠키가 수집하는 모든 정보는 집계되며 따라서 익명입니다. 이러한 쿠키를 허용하지 않으면 귀하가 언제 당사 사이트를 방문했는지 알 수 없으며, 사이트 성능을 모니터링할 수 없습니다.",https://onefootball.com/en/news/the-colon-v-patronato-match-that-went-down-in-both-clubs-history-42625218
22,V,2026-03-27 19:35:16,다윗 대 골리앗 | DEVILS DOWNLOAD - NHL.com,"대화창 시작. Escape 키를 누르면 창이 취소되고 닫힙니다. 이 창은 모달 창입니다. 이 모달은 Escape 키를 누르거나 닫기 버튼을 활성화해 닫을 수 있습니다. 데블스는 토요일 캐롤라이나 원정에서 5경기 원정 일정을 마무리합니다. 데블스는 캐인스와의 최근 9경기에서 단 1승에 그친 상황에서, 그 용을 쓰러뜨리려 합니다. 데블스는 캐인스와의 최근 9경기에서 단 1승에 그친 상황에서, 그 용을 쓰러뜨리려 합니다. 도슨 머서가 금요일 라일리에서 열린 데블스 훈련 후 발언합니다. 브렌든 딜런이 금요일 라일리에서 열린 데블스 훈련 후 발언합니다. 뉴저지 데블스와 내슈빌 프레데터스의 맞대결에서 경기 흐름을 바꾼 하이라이트 데블스의 셸던 키프 감독이 프레데터스를 4-2로 꺾은 뒤 선수단에 말을 건넵니다. 데블스의 셸던 키프 감독이 프레데터스를 4-2로 꺾은 뒤 언론에 말합니다. 예스퍼 브랫이 목요일 프레데터스를 4-2로 꺾은 뒤 언론에 말합니다. 니코 히셔가 내슈빌 프레데터스를 4-2로 꺾은 뒤 말합니다. NJD@NSH: 히셔가 저스투스 아눈넨 상대로 파워플레이 골을 넣습니다. NJD@NSH: 마크스트룀이 에릭 하울라의 슛을 멋지게 세이브합니다. NJD@NSH: 히셔가 저스투스 아눈넨을 상대로 골을 넣습니다. 아르세니 그리추크가 부상으로 출전할 수 없어, 예브게니 다도노프가 내슈빌전 명단에 포함됩니다. 키프 감독이 그리추크의 부상 상황과 오늘 밤 내슈빌전 등을 앞두고 업데이트를 전합니다. 뉴저지 데블스와 댈러스 스타스의 맞대결에서 경기 흐름을 바꾼 하이라이트 데블스의 셸던 키프 감독이 댈러스에서 큰 6-4 승리를 거둔 뒤 선수단에 말합니다. 티모 마이어가 댈러스 스타스를 6-4로 꺾은 뒤 언론에 말합니다. 데블스의 셸던 키프 감독이 댈러스 스타스를 6-4로 꺾은 뒤 언론에 말합니다. 예스퍼 브랫이 댈러스 스타스를 6-4로 꺾은 뒤 언론에 말합니다. 귀하가 당사 웹사이트를 방문하면, 당사와 서비스 제공업체 및 파트너는 쿠키와 픽셀(웹 비콘이라고도 함)(총칭하여 “쿠키”)을 사용해 웹사이트 경험 제공, 방문자가 사이트와 상호작용하는 방식 이해, 광고 개인화를 위해 정보를 수집하고 사용할 수 있습니다. 이 정보는 귀하, 귀하의 선호도 또는 귀하의 기기에 관한 것일 수 있습니다. 관련 사이트의 경우, 당사와 일부 제3자(분석, 기능, 광고 서비스를 제공하는 업체)가 설정하는 쿠키와 관련하여 귀하는 선택권을 가질 수 있습니다. 예를 들어, 아래 토글을 사용하면 관련 쿠키를 통한 개인정보 수집을 비활성화하거나 제한할 수 있습니다. 쿠키 설정을 변경하면 경험과 관련 사이트에서 제공받는 서비스에 영향을 줄 수 있지만, 각 범주 제목을 클릭하면 더 자세한 내용을 확인하고 기본 설정을 변경할 수 있습니다. 이러한 쿠키 선택은 NHL 및 NHL.com 도메인을 사용하는 회원 구단 사이트에만 적용됩니다. Fanatics가 운영하는 NHL Shop 등 다른 NHL, 회원 구단 및 제3자 사이트의 경우, 해당 사이트에서 제공되는 관련 쿠키 설정을 확인하시기 바랍니다. 또한 이러한 선택은 사용 중인 기기와 브라우저에만 적용됩니다. 당사의 개인정보 보호 관행과 추가 선택 사항에 대한 정보는 쿠키 정책을 검토해 주십시오. 이러한 쿠키는 웹사이트가 작동하는 데 필요하거나 필수적인 쿠키로, 당사 시스템에서 끌 수 없습니다. 일반적으로 이는 개인정보 설정, 로그인 또는 양식 작성 등 사용자가 서비스 요청에 해당하는 행동을 했을 때만 설정됩니다. 브라우저에서 이러한 쿠키를 차단하거나 알림을 받도록 설정할 수 있지만, 그러면 사이트의 일부가 작동하지 않을 수 있습니다. 이러한 쿠키는 웹사이트가 향상된 기능과 맞춤형 콘텐츠를 제공할 수 있게 합니다. 이러한 쿠키는 방문 수와 트래픽 출처 같은 지표를 측정해 사이트 성과를 개선하는 데 도움을 줍니다. 예를 들어, 어떤 페이지가 가장 인기 있고 가장 덜 인기 있는지, 방문자들이 사이트를 어떻게 이동하는지 파악하는 데 도움이 됩니다. 이러한 쿠키는 소셜 미디어 서비스 등을 포함한 제3자 사이트에서 귀하의 관심사 프로필을 구축하고 관련 광고를 보여주기 위해 귀하의 온라인 상호작용에 대한 정보를 수집합니다. 이러한 쿠키를 거부하거나 옵트아웃하면 광고는 계속 표시되지만 개인화 정도가 낮아질 수 있습니다.",https://www.nhl.com/devils/video/david-v-goliath-devils-download-6391872758112
