id,ticker,date,title,content,url
22,XOM,2026-03-26 08:15:04,"Exxon Mobil 뉴질랜드 철수, 더 큰 핵심 프로젝트로의 전환 부각 - simplywall.st","주당 163.26달러의 주가로 Exxon Mobil을 지켜보고 있는 투자자들에게, 잠재적인 뉴질랜드 철수는 강한 장기 주가 성과와 맞물려 있습니다. 회사 주가는 연초 대비 33.1%, 지난 1년 동안 42.8% 상승했습니다. 3년과 5년 수익률은 각각 65.9%와 254.2%로, NYSE:XOM이 대규모 석유·가스 프로젝트에 집중해 인내심 있는 보유자들에게 보상해왔음을 보여줍니다. 뉴질랜드 사업의 잠재적 매각은 이러한 포트폴리오 집중 전략과 일치하며, 페르미안 분지, 가이아나, LNG 프로젝트 등으로 자본과 경영진의 관심을 집중시키는 방향입니다. 독자 입장에서는 매각 금액의 평가, 매각 대금의 사용처, 그리고 더 축소된 지리적 사업 범위가 장기적으로 Exxon의 위험 프로필에 어떤 영향을 미칠지에 질문의 초점이 맞춰질 것입니다. Exxon Mobil의 가장 중요한 뉴스들을 놓치지 않으려면 관심종목이나 포트폴리오에 추가하세요. 또는 커뮤니티를 탐색해 Exxon Mobil에 대한 새로운 관점을 확인해 보세요. 📰 헤드라인 너머: 모든 투자자가 알아야 할 Exxon Mobil의 1가지 위험과 3가지 긍정적 요인.
Exxon Mobil이 뉴질랜드에서 철수하려는 것으로 보이는 계획은 페르미안 분지와 가이아나 같은 지역의 더 크고 수익률이 높은 프로젝트에 집중하는 전략과 부합합니다. 소문으로 거론되는 5억~10억 달러 규모의 잠재 매각대금은 Exxon 같은 규모의 사업과 비교하면 크지 않지만, 이 움직임은 경영진의 시간과 자본이 어디에 쓰이는지를 더 날카롭게 정리하는 데 더 큰 의미가 있습니다. 터미널과 150개 이상의 주유소를 포함한 자산을 매각하면 더 분산되고 규모가 작은 다운스트림 시장에 대한 노출이 줄어들고, Exxon이 장기적으로 더 나은 경제성을 기대하는 프로젝트에 투입할 수 있는 자원이 확보됩니다. 투자자에게는 뉴질랜드 철수가 포트폴리오를 약간 단순화해, 핵심 지역과 부문이 시간이 지나며 어떻게 성과를 내는지 판단하기가 더 쉬워질 수 있습니다.
기업의 가치를 안다는 것은 그 기업의 이야기를 이해하는 것에서 시작됩니다. Exxon Mobil에 대한 Simply Wall St Community의 최고 내러티브 중 하나를 확인해, 이 기업의 가치를 어떻게 볼지 결정하는 데 도움을 받아보세요.
앞으로는 Exxon이 공식적인 매각 절차를 확인하는지, 뉴질랜드 자산에 대한 평가 범위를 공개하는지, 그리고 인프라 펀드나 지역 연료 소매업체 같은 관심 있는 입찰자가 누구인지 지켜보세요. 경영진이 매각 대금의 사용처를 어떻게 설명하는지, 즉 부채 상환, 핵심 프로젝트의 설비투자(capex), 자본 환원 중 무엇에 쓸지에 따라 이번 철수가 더 넓은 포트폴리오 재편과 어떻게 맞물리는지 판단하는 데 도움이 될 것입니다. 또한 Exxon이 다른 소규모 시장에서도 얼마나 자주 자산을 축소하는지 살펴보세요. 철수의 패턴이 지속되면 하류 사업 믹스와 글로벌 동종업체 대비 경쟁 구도가 점진적으로 바뀔 수 있습니다.
최신 뉴스가 Exxon Mobil의 투자 내러티브에 어떤 영향을 미치는지 항상 확인하려면 Exxon Mobil 커뮤니티 페이지로 이동해 상위 커뮤니티 내러티브의 업데이트를 놓치지 마세요.
이 Simply Wall St 기사는 일반적인 성격의 기사입니다. 우리는 역사적 데이터와 애널리스트 전망에만 근거해 편향 없는 방법론으로 논평을 제공하며, 당사의 기사는 금융 조언을 목적으로 하지 않습니다. 이는 어떤 주식의 매수 또는 매도 추천도 아니며, 귀하의 목표나 재무 상황을 고려하지 않습니다. 우리는 기초적 데이터에 기반한 장기 중심 분석을 제공하는 것을 목표로 합니다. 또한 당사의 분석은 최신 주가 민감성 기업 공시나 정성적 자료를 반영하지 못할 수 있습니다. Simply Wall St는 언급된 어떤 주식에도 포지션을 보유하고 있지 않습니다.
공정가치 추정치, 잠재적 위험, 배당, 내부자 거래 및 재무 상태를 포함한 상세 분석을 통해 Exxon Mobil이 저평가 또는 고평가되어 있는지 알아보세요.
이 기사에 대한 의견이 있으신가요? 내용에 우려가 있으신가요? 직접 문의해 주세요. 또는 editorial-team@simplywallst.com 으로 이메일을 보내주세요.
미국, 캐나다 및 국제적으로 원유 및 천연가스의 탐사와 생산에 종사합니다. 우수한 재무상태표, 확고한 배당 지급 기업.
재무 데이터는 S&P Global Market Intelligence LLC가 제공하며, 분석은 Simply Wall Street Pty Ltd가 제공합니다. Copyright © 2026, S&P Global Market Intelligence LLC. All rights reserved. Simply Wall Street Pty Ltd(ACN 600 056 611)는 Sanlam Private Wealth Pty Ltd(AFSL No. 337927)의 법인 공인 대리인(Authorized Representative Number: 467183)입니다. 본 웹사이트에 포함된 모든 조언은 일반적인 조언일 뿐이며, 귀하의 목표, 재무 상황 또는 필요를 고려하지 않고 작성되었습니다. 본 웹사이트에 포함된 어떠한 조언 및/또는 정보도 의존해서는 안 되며, 투자 결정을 내리기 전에 귀하의 상황에 적절한지 검토하고 적절한 금융·세무·법률 자문을 구할 것을 권고합니다. 금융서비스를 이용하기 전에 당사의 Financial Services Guide를 읽어주시기 바랍니다. © 2026 Simply Wall Street Pty Ltd, US Design Patent #29/544/281, Community and European Design Registration #2845206",https://simplywall.st/stocks/us/energy/nyse-xom/exxon-mobil/news/exxon-mobil-new-zealand-exit-highlights-shift-to-larger-core
23,XOM,2026-03-26 07:56:53,"Clear Trail Advisors LLC, Exxon Mobil Corporation $XOM에 신규 투자 - MarketBeat","Clear Trail Advisors LLC는 최근 제출한 13F 보고서에 따르면 4분기 동안 Exxon Mobil Corporation(NYSE:XOM - Free Report)에 신규 지분을 취득했습니다. 이 기관투자가는 석유·가스 회사 주식 238,726주를 약 28,728,000달러어치 매입했습니다. Exxon Mobil은 Clear Trail Advisors LLC 보유 자산의 약 6.7%를 차지하며, 전체 보유 종목 중 두 번째로 큰 비중입니다.
최근 다른 여러 헤지펀드도 XOM 보유 지분을 조정했습니다. Westfuller Advisors LLC는 3분기에 Exxon Mobil의 신규 포지션을 30,000달러어치 매입했습니다. Clayton Financial Group LLC는 3분기에 Exxon Mobil 주식의 신규 포지션을 약 40,000달러어치 매입했습니다. TruNorth Capital Management LLC는 3분기에 Exxon Mobil 주식 지분을 1,595.2% 늘렸습니다. TruNorth Capital Management LLC는 지난 분기 추가로 335주를 매입한 뒤 현재 석유·가스 회사 주식 356주를 보유하고 있으며, 가치는 40,000달러입니다. Bare Financial Services Inc는 2분기에 Exxon Mobil 보유 지분을 121.8% 확대했습니다. Bare Financial Services Inc는 해당 기간 동안 추가로 201주를 매입한 뒤 현재 석유·가스 회사 주식 366주를 보유하고 있으며, 가치는 39,000달러입니다. 마지막으로 Halbert Hargrove Global Advisors LLC는 3분기에 Exxon Mobil 보유 지분을 95.8% 늘렸습니다. Halbert Hargrove Global Advisors LLC는 지난 분기 추가로 181주를 매입한 뒤 현재 석유·가스 회사 주식 370주를 보유하고 있으며, 가치는 42,000달러입니다. 주식의 61.80%는 기관투자가와 헤지펀드가 보유하고 있습니다.
여러 리서치 애널리스트들도 이 종목에 대해 의견을 내놓았습니다. Bank of America는 3월 2일 월요일 보고서에서 Exxon Mobil 주식의 목표주가를 135.00달러에서 151.00달러로 상향하고, 회사에 대해 '중립' 등급을 부여했습니다. BMO Capital Markets는 2월 4일 수요일 보고서에서 '시장수익률' 등급을 재확인하고 Exxon Mobil 주식에 155.00달러의 목표주가를 제시했습니다. Wells Fargo & Company는 2월 2일 월요일 리서치 보고서에서 Exxon Mobil 목표주가를 158.00달러에서 156.00달러로 낮추고, 종목에 '비중확대' 등급을 부여했습니다. BNP Paribas Exane은 2월 3일 화요일 리서치 노트에서 Exxon Mobil을 '중립' 등급에서 '시장수익률 하회' 등급으로 하향하고 목표주가를 125.00달러로 제시했습니다. 마지막으로 UBS Group은 2월 2일 월요일 보고서에서 '매수' 등급을 재제시하고 Exxon Mobil 주식의 목표주가를 171.00달러로 설정했습니다. 애널리스트 9명은 매수(Buy) 의견을, 9명은 보유(Hold) 의견을, 1명은 매도(Sell) 의견을 제시했습니다. MarketBeat.com 데이터에 따르면 Exxon Mobil의 종합 평가는 '보유(Hold)'이며 평균 목표주가는 148.89달러입니다.
다른 Exxon Mobil 소식으로, 부사장 Darrin L. Talley는 3월 16일 월요일 거래에서 회사 주식 1,080주를 매도했습니다. 주당 평균 매도가는 155.50달러였으며 총 거래 금액은 167,940.00달러였습니다. 거래 이후 부사장은 회사 주식 17,124주를 보유했으며, 가치는 2,662,782달러였습니다. 이번 거래는 지분이 5.93% 감소했음을 의미합니다. 해당 거래는 SEC 웹사이트에서 확인할 수 있는 SEC 제출 서류에 공시되었습니다. 지난 90일 동안 내부자들은 회사 주식 11,460주를 총 1,687,854달러어치 매도했습니다. 회사 내부자는 현재 회사 주식의 0.03%를 보유하고 있습니다.
Exxon Mobil 주식은 목요일 163.10달러에 개장했습니다. 회사의 당좌비율은 0.79, 유동비율은 1.15, 부채비율은 0.13입니다. 시가총액은 6,795억9,000만달러, 주가수익비율(P/E)은 24.38, 주가수익성장비율(PEG)은 1.29, 베타는 0.35입니다. Exxon Mobil Corporation의 12개월 최저가는 97.80달러, 12개월 최고가는 167.48달러입니다. 회사의 50일 단순이동평균은 147.75달러, 200일 단순이동평균은 127.32달러입니다.
Exxon Mobil(NYSE:XOM - Free Report)은 최근 1월 30일 금요일에 실적을 발표했습니다. 석유·가스 회사는 해당 분기 주당순이익(EPS) 1.71달러를 보고해 애널리스트 컨센서스 추정치 1.63달러를 0.08달러 상회했습니다. Exxon Mobil의 순이익률은 8.68%, 자기자본이익률(ROE)은 11.21%였습니다. 해당 분기 매출은 800억4,000만달러로, 애널리스트 예상치 779억8,000만달러를 상회했습니다. 전년 같은 분기에는 회사가 EPS 1.67달러를 기록했습니다. 회사의 분기 매출은 전년 동기 대비 1.3% 감소했습니다. 애널리스트들은 Exxon Mobil Corporation이 올해 주당순이익 7.43달러를 기록할 것으로 전망하고 있습니다. 회사는 최근 분기배당도 공시했으며, 배당은 3월 10일 화요일에 지급됐습니다. 2월 12일 목요일 기준 주주에게는 주당 1.03달러의 배당이 지급됐습니다. 이는 연환산 기준 배당금 4.12달러, 배당수익률 2.5%에 해당합니다. 배당성향(DPR)은 현재 61.58%입니다.
이번 주 Exxon Mobil에 영향을 미치는 주요 뉴스는 다음과 같습니다: Exxon Mobil Corporation NYSE: XOM은 원유 및 천연가스의 탐사, 생산, 정제, 유통 및 마케팅과 석유화학 제품의 제조 및 판매에 종사하는 통합형 석유·가스 회사입니다. 회사의 사업은 원유 및 천연가스의 상류 탐사·개발, 중류 운송·저장, 하류 정제·제품 유통·소매 등 전체 에너지 가치사슬에 걸쳐 있습니다. 또한 산업 및 소비자용 광범위한 화학 제품도 생산합니다. ExxonMobil은 Exxon, Mobil, Esso와 같은 유명 브랜드로 연료와 윤활유를 판매하며, Mobil 1 모터오일은 대표적인 소비자 제품입니다.
이 즉시 뉴스 알림은 독자에게 가장 빠른 보도와 편향 없는 커버리지를 제공하기 위해 narrative science 기술과 MarketBeat의 금융 데이터를 바탕으로 생성되었습니다. 이 기사에 대한 질문이나 의견은 contact@marketbeat.com 으로 보내주시기 바랍니다. Exxon Mobil을 고려하기 전에, 이 내용을 꼭 들어보시기 바랍니다. MarketBeat는 월가의 최고 평가 및 최고 성과 리서치 애널리스트와 그들이 고객에게 추천하는 종목을 매일 추적합니다. MarketBeat는 상위 애널리스트들이 지금 조용히 고객에게 매수를 권하는 다섯 종목을 식별했습니다. 더 넓은 시장이 알아차리기 전에 말입니다... 그리고 Exxon Mobil은 그 목록에 없었습니다. 현재 애널리스트들 사이에서 Exxon Mobil은 보유(Hold) 등급을 받고 있지만, 최고 평가 애널리스트들은 이 다섯 종목이 더 나은 매수처라고 믿습니다. Meta, Roblox 또는 Unity에 투자할 생각이 있으신가요? 투자하기 전에 거리의 투자자들이 메타버스와 공개시장에 대해 알아야 할 사항을 확인하려면 링크를 클릭하세요. MarketBeat All Access에 가입하면 MarketBeat의 전체 리서치 도구 모음에 접근할 수 있습니다. 345 N Reid Place, Suite 620, Sioux Falls, SD 57103 contact@marketbeat.com (844) 978-6257 © MarketBeat Media, LLC 2010-2026. All rights reserved. © 2026 공정가치 가격은 매분 업데이트되며 Massive가 제공합니다. 기타 시장 데이터는 최소 10분 지연되며 Barchart Solutions에서 호스팅합니다. 정보는 '있는 그대로' 제공되며 거래 목적이나 조언이 아닌 정보 제공 목적으로만 사용되고 지연이 있을 수 있습니다. 모든 거래소 지연 및 이용약관은 Barchart의 면책조항을 참조하시기 바랍니다. 당사 및 파트너는 귀하의 사용 정보를 공유하여 경험을 개선합니다. 자세한 내용이나 거부를 원하시면 아래의 'Do Not Sell My Information' 버튼을 클릭하십시오.",https://www.marketbeat.com/instant-alerts/filing-clear-trail-advisors-llc-makes-new-investment-in-exxon-mobil-corporation-xom-2026-03-26/
24,XOM,2026-03-25 22:24:34,Exxon Mobil(NYSE:XOM) 주가 1.4% 하락 - 다음은? - MarketBeat,"Exxon Mobil Corporation(NYSE:XOM - Get Free Report) 주가는 수요일 장중 거래에서 1.4% 하락했습니다. 회사 주가는 장중 한때 162.93달러까지 떨어졌고, 최근에는 163.0990달러에 거래됐습니다. 장중 거래량은 약 17,109,156주로, 평균 일일 거래량 22,135,891주보다 23% 감소했습니다. 주가는 이전에 165.38달러로 마감했습니다.
이번 주 Exxon Mobil에 영향을 미치는 주요 뉴스는 다음과 같습니다:
여러 주식 애널리스트들이 최근 XOM 주식에 대해 의견을 제시했습니다. Weiss Ratings는 12월 29일 월요일 리서치 보고서에서 Exxon Mobil 주식에 대해 '보유(c)' 등급을 재확인했습니다. BMO Capital Markets는 2월 4일 수요일 보고서에서 '시장수익률' 등급을 재확인하고 Exxon Mobil 주식에 155.00달러의 목표주가를 제시했습니다. Bank of America는 3월 2일 월요일 리서치 노트에서 Exxon Mobil 목표주가를 135.00달러에서 151.00달러로 상향하고 종목에 '중립' 등급을 부여했습니다. Piper Sandler는 3월 12일 목요일 리서치 보고서에서 Exxon Mobil 목표주가를 145.00달러에서 186.00달러로 상향하고 회사에 '비중확대' 등급을 부여했습니다. 마지막으로 Mizuho는 3월 17일 화요일 보고서에서 Exxon Mobil의 목표주가를 140.00달러에서 162.00달러로 올리고 회사에 '중립' 등급을 부여했습니다. 애널리스트 9명은 매수(Buy) 등급을, 9명은 보유(Hold) 등급을, 1명은 매도(Sell) 등급을 제시했습니다. MarketBeat.com 데이터에 따르면 이 종목의 현재 종합 평가는 '보유(Hold)'이며, 종합 목표주가는 148.89달러입니다.
이 회사의 시가총액은 6,795억9,000만달러, 주가수익비율(P/E)은 24.38, PEG 비율은 1.26, 베타는 0.35입니다. 부채비율은 0.13, 유동비율은 1.15, 당좌비율은 0.79입니다. 50일 이동평균은 147.09달러, 200일 이동평균은 127.07달러입니다.
Exxon Mobil(NYSE:XOM - Get Free Report)은 최근 1월 30일 금요일 실적을 발표했습니다. 석유·가스 회사는 해당 분기 주당순이익(EPS) 1.71달러를 기록해 시장 예상치 1.63달러를 0.08달러 상회했습니다. Exxon Mobil의 자기자본이익률(ROE)은 11.21%, 순이익률은 8.68%였습니다. 해당 분기 매출은 800억4,000만달러로, 애널리스트 예상치 779억8,000만달러를 웃돌았습니다. 전년 동기 같은 분기에는 EPS 1.67달러를 기록했습니다. 회사의 분기 매출은 전년 동기 대비 1.3% 감소했습니다. 애널리스트들은 Exxon Mobil Corporation이 올해 주당순이익 7.43달러를 기록할 것으로 전망합니다. 회사는 최근 분기배당을 공시했으며, 배당은 3월 10일 화요일에 지급됐습니다. 2월 12일 목요일 기준 투자자에게는 주당 1.03달러의 배당이 지급됐습니다. 이는 연환산 기준 4.12달러의 배당과 2.5%의 배당수익률에 해당합니다. 해당 배당의 배당락일은 2월 12일 목요일이었습니다. Exxon Mobil의 배당성향(DPR)은 현재 61.58%입니다.
다른 Exxon Mobil 뉴스로, 부사장 Darrin L. Talley는 3월 16일 월요일 거래에서 회사 주식 1,080주를 매도했습니다. 주당 평균 매도가는 155.50달러였으며, 총 거래 가치는 167,940.00달러였습니다. 거래 후 부사장은 회사 주식 17,124주를 보유했으며, 가치는 2,662,782달러였습니다. 이는 지분이 5.93% 감소한 것을 의미합니다. 해당 거래는 SEC에 제출된 신고서에 공시되었으며, SEC 웹사이트에서 확인할 수 있습니다. 최근 90일 동안 내부자들은 회사 주식 11,460주를 총 1,687,854달러어치 매도했습니다. 현재 주식의 0.03%는 내부자가 보유하고 있습니다.
기관투자가들은 최근 이 종목의 보유 지분을 변경했습니다. Norges Bank는 4분기에 Exxon Mobil의 신규 지분을 약 7,625,063,000달러어치 매입했습니다. First Trust Advisors LP는 2분기에 Exxon Mobil 주식 지분을 150.2% 확대했습니다. First Trust Advisors LP는 지난 분기 추가로 4,563,707주를 매입한 뒤 현재 석유·가스 회사 주식 7,602,601주를 보유하고 있으며 가치는 819,560,000달러입니다. Cerity Partners LLC는 2분기에 Exxon Mobil 주식 지분을 200.7% 확대했습니다. Cerity Partners LLC는 지난 분기 추가로 4,015,099주를 매입한 뒤 현재 석유·가스 회사 주식 2,014,446주를 보유하고 있으며 가치는 217,162,000달러입니다. Laurel Wealth Advisors LLC는 2분기에 Exxon Mobil 주식 보유를 10,809.8% 늘렸습니다. Laurel Wealth Advisors LLC는 해당 기간 동안 추가로 3,066,736주를 매입한 뒤 현재 석유·가스 회사 주식 3,095,106주를 보유하고 있으며 가치는 333,652,000달러입니다. 마지막으로 Franklin Resources Inc.는 3분기에 Exxon Mobil 주식 보유를 7.4% 늘렸습니다. Franklin Resources Inc.는 해당 기간 동안 추가로 2,660,910주를 매입한 뒤 현재 석유·가스 회사 주식 38,728,643주를 보유하고 있으며 가치는 4,366,655,000달러입니다. 현재 주식의 61.80%는 기관투자가와 헤지펀드가 보유하고 있습니다.
Exxon Mobil Corporation NYSE: XOM은 원유 및 천연가스의 탐사, 생산, 정제, 유통 및 마케팅과 석유화학 제품의 제조·판매에 종사하는 통합형 석유·가스 기업입니다. 회사의 사업은 원유 및 천연가스의 상류 탐사·개발, 중류 운송·저장, 하류 정제·제품 유통·소매 등 전체 에너지 가치사슬에 걸쳐 있습니다. 또한 산업 및 소비자용 광범위한 화학 제품도 생산합니다. ExxonMobil은 Exxon, Mobil, Esso와 같은 유명 브랜드로 연료와 윤활유를 판매하며, Mobil 1 모터오일은 대표적인 소비자 제품입니다.
이 즉시 뉴스 알림은 독자에게 가장 빠른 보도와 편향 없는 커버리지를 제공하기 위해 narrative science 기술과 MarketBeat의 금융 데이터를 바탕으로 생성되었습니다. 이 기사에 대한 질문이나 의견은 contact@marketbeat.com 으로 보내주시기 바랍니다. Exxon Mobil을 고려하기 전에, 이 내용을 꼭 들어보시기 바랍니다. MarketBeat는 월가의 최고 평가 및 최고 성과 리서치 애널리스트와 그들이 고객에게 추천하는 종목을 매일 추적합니다. MarketBeat는 상위 애널리스트들이 지금 조용히 고객에게 매수를 권하는 다섯 종목을 식별했습니다. 더 넓은 시장이 알아차리기 전에 말입니다... 그리고 Exxon Mobil은 그 목록에 없었습니다. 현재 Exxon Mobil은 애널리스트들 사이에서 보유(Hold) 등급을 받고 있지만, 최고 평가 애널리스트들은 이 다섯 종목이 더 나은 매수처라고 믿습니다. Elon Musk의 가장 대담한 도전들—AI와 자율주행부터 우주 식민지화까지—을 살펴보고, 투자자들이 다음 혁신의 물결을 어떻게 탈 수 있는지 알아보세요. MarketBeat All Access에 가입하면 MarketBeat의 전체 리서치 도구 모음에 접근할 수 있습니다. 345 N Reid Place, Suite 620, Sioux Falls, SD 57103 contact@marketbeat.com (844) 978-6257 © MarketBeat Media, LLC 2010-2026. All rights reserved. © 2026 공정가치 가격은 매분 업데이트되며 Massive가 제공합니다. 기타 시장 데이터는 최소 10분 지연되며 Barchart Solutions에서 호스팅합니다. 정보는 '있는 그대로' 제공되며 거래 목적이나 조언이 아닌 정보 제공 목적으로만 사용되고 지연이 있을 수 있습니다. 모든 거래소 지연 및 이용약관은 Barchart의 면책조항을 참조하시기 바랍니다. 당사 및 파트너는 귀하의 사용 정보를 공유하여 경험을 개선합니다. 자세한 내용이나 거부를 원하시면 아래의 'Do Not Sell My Information' 버튼을 클릭하십시오.",https://www.marketbeat.com/instant-alerts/exxon-mobil-nysexom-shares-down-14-whats-next-2026-03-25/
25,XOM,2026-03-25 20:05:26,핵심 사실: Exxon 베네수엘라; Md. 소송 기각; 가이아나 프리미엄 거래 - TradingView,"선별된 시장 데이터는 ICE Data Services가 제공합니다. 선별된 참고 데이터는 FactSet이 제공합니다. Copyright © 2026 FactSet Research Systems Inc. Copyright © 2026, American Bankers Association. CUSIP Database는 FactSet Research Systems Inc.가 제공합니다. 모든 권리 보유. SEC 제출 서류 및 기타 문서는 Quartr가 제공합니다. © 2026 TradingView, Inc.",https://www.tradingview.com/news/tradingview:ca4464247692f:0-key-facts-exxon-venezuela-md-suits-dismissed-guyana-premium-deal/
