id,ticker,date,title,content,url
1,XOM,2026-03-27 21:17:42,"Exxon Mobil(NYSE:XOM), 애널리스트 상향 조정에 따라 3.5% 상승 - MarketBeat","엑슨 모빌 코퍼레이션(NYSE:XOM - 무료 보고서 받기)은 모건스탠리가 해당 종목의 목표주가를 134.00달러에서 172.00달러로 상향 조정한 뒤 금요일 장중 거래에서 3.5% 급등했다. 모건스탠리는 현재 이 종목에 대해 비중확대(overweight) 의견을 제시하고 있다. 엑슨 모빌은 장중 한때 171.23달러까지 올랐고, 마지막 거래가는 171.1690달러였다. 장중 거래량은 30,243,442주로, 평균 세션 거래량 22,217,891주보다 36% 증가했다. 직전 종가는 165.43달러였다. 다른 애널리스트들도 최근 이 종목에 대한 리서치 보고서를 발표했다. 와이스 레이팅스는 12월 29일 월요일 보고서에서 엑슨 모빌 주식에 대해 '보유(hold) (c)' 등급을 재확인했다. UBS 그룹은 2월 2일 월요일 리서치 नोट에서 '매수(buy)' 의견을 재확인하고 목표주가 171.00달러를 제시했다. 씨티그룹은 3월 2일 월요일 리서치 보고서에서 엑슨 모빌의 목표주가를 118.00달러에서 150.00달러로 상향하고 회사에 대해 '중립(neutral)' 등급을 부여했다. HSBC는 3월 20일 금요일 보고서에서 엑슨 모빌의 목표주가를 135.00달러에서 158.00달러로 올리고 주식에 대해 '보유(hold)' 등급을 제시했다. 마지막으로 TD 코웬은 2월 3일 화요일 리서치 नोट에서 엑슨 모빌의 목표주가를 135.00달러에서 145.00달러로 상향하고 회사에 대해 '매수(buy)' 의견을 제시했다. 애널리스트 9명은 이 종목에 매수 등급을, 9명은 보유 등급을, 1명은 매도 등급을 부여했다. MarketBeat에 따르면 현재 엑슨 모빌의 컨센서스 등급은 '보유(hold)'이며, 컨센서스 목표주가는 151.00달러다. 관련 소식으로는, 다린 L. 탈리 부사장이 3월 16일 월요일에 이뤄진 거래에서 회사 주식 1,080주를 매도했다. 주당 평균 155.50달러에 매도됐으며 총 거래금액은 167,940.00달러였다. 매도 이후 부사장은 회사 주식 17,124주를 직접 보유하고 있었고, 이는 약 2,662,782달러 상당이었다. 이는 보유 지분이 5.93% 감소한 것이다. 해당 매도는 SEC 제출 문서에 공시됐으며, 이 하이퍼링크를 통해 확인할 수 있다. 내부자들은 최근 90일 동안 총 11,460주, 총액 1,687,854달러 상당의 회사 주식을 매도했다. 내부자들의 지분 보유 비율은 회사 주식의 0.03%다. 이번 주 엑슨 모빌에 영향을 미친 주요 뉴스는 다음과 같다. 최근 여러 기관투자가가 이 종목의 보유 비중을 조정했다. 버비스 캐피털 매니지먼트 LLC는 4분기에 엑슨 모빌의 신규 포지션을 약 26,000달러어치 매수했다. 미드웨스트 캐피털 어드바이저스 LLC는 4분기에 엑슨 모빌 주식의 신규 포지션을 약 27,000달러어치 매수했다. E 펀드 매니지먼트 홍콩 주식회사는 4분기 동안 엑슨 모빌 지분을 456.1% 늘렸다. E 펀드 매니지먼트 홍콩 주식회사는 지난 분기 추가로 187주를 취득한 뒤 현재 이 석유·가스 회사 주식 228주를 보유하고 있으며, 가치는 27,000달러다. 키 캐피털 매니지먼트 INC는 4분기에 엑슨 모빌의 신규 포지션을 약 28,000달러어치 매수했다. 마지막으로 Nvest 웰스 스트래티지스 Inc.는 4분기 동안 엑슨 모빌의 신규 지분을 약 32,000달러어치 매수했다. 헤지펀드와 기타 기관투자가들은 회사 주식의 61.80%를 보유하고 있다. 회사의 부채비율은 0.13, 당좌비율은 0.79, 유동비율은 1.15다. 시가총액은 7,132억 2,000만 달러이며, PER은 25.59, PEG 비율은 1.28, 베타는 0.35다. 회사의 50일 단순이동평균은 148.48달러, 200일 단순이동평균은 127.58달러다. 엑슨 모빌(NYSE:XOM - 무료 보고서 받기)은 마지막으로 1월 30일 금요일 분기 실적을 발표했다. 이 석유·가스 회사는 해당 분기 주당순이익(EPS) 1.71달러를 기록해 애널리스트 컨센서스 추정치 1.63달러를 0.08달러 상회했다. 회사의 해당 분기 매출은 800억 4,000만 달러로, 애널리스트 추정치 779억 8,000만 달러를 웃돌았다. 엑슨 모빌의 순이익률은 8.68%, 자기자본이익률(ROE)은 11.21%였다. 해당 분기 매출은 전년 동기 대비 1.3% 감소했다. 전년 동기 같은 기간에는 EPS 1.67달러를 기록했다. 애널리스트들은 평균적으로 엑슨 모빌 코퍼레이션이 현재 회계연도에 EPS 7.43달러를 기록할 것으로 전망하고 있다. 회사는 최근 분기 배당금도 공시했으며, 3월 10일 화요일에 지급됐다. 2월 12일 목요일 기준 주주들에게 주당 1.03달러의 배당금이 지급됐다. 이 배당금의 배당락일은 2월 12일 목요일이었다. 이는 연환산 배당금 4.12달러, 배당수익률 2.4%에 해당한다. 현재 엑슨 모빌의 배당성향은 61.58%다. 엑슨 모빌 코퍼레이션(NYSE: XOM)은 원유 및 천연가스의 탐사, 생산, 정제, 유통 및 마케팅과 석유화학 제품의 제조·판매를 수행하는 종합 석유·가스 기업이다. 회사의 사업은 원유 및 천연가스의 상류(upstream) 탐사 및 개발, 중류(middlestream) 운송 및 저장, 하류(downstream) 정제, 제품 유통 및 소매를 포함한 에너지 가치사슬 전반에 걸쳐 있다. 또한 산업 및 소비자용 광범위한 화학 제품도 생산한다. 엑슨모빌은 엑슨, 모빌, 에쏘(Esso) 등 잘 알려진 브랜드로 연료와 윤활유를 판매하며, Mobil 1 모터 오일은 대표적인 소비재다. 이 속보 알림은 독자들에게 가장 빠른 보도와 편향 없는 커버리지를 제공하기 위해 내러티브 사이언스 기술과 MarketBeat의 금융 데이터를 바탕으로 생성됐다. 이 기사에 관한 질문이나 의견은 contact@marketbeat.com으로 보내주시기 바란다. 엑슨 모빌을 고려하기 전에, 이 내용을 들어보시기 바란다. MarketBeat는 월가 최고 평가 및 최고 성과를 내는 리서치 애널리스트와 그들이 고객에게 추천하는 종목을 매일 추적한다. MarketBeat는 더 넓은 시장이 알아차리기 전에 지금 조용히 고객에게 매수하라고 속삭이고 있는, 최고 애널리스트들이 선정한 5개 종목을 찾아냈으며... 엑슨 모빌은 그 명단에 없었다. 현재 애널리스트들 사이에서 엑슨 모빌은 '보유' 등급이지만, 최고 평가 애널리스트들은 이 5개 종목이 더 나은 매수 대상이라고 본다. MarketBeat는 방금 2026년 월가에 상장될 것으로 예상되는 가장 뜨거운 IPO 7개의 목록을 발표했다. 어떤 기업들이 상장을 준비하고 있는지, 그리고 투자자들이 왜 주목하고 있는지 확인해 보라. MarketBeat의 전체 리서치 도구 모음에 접근하려면 MarketBeat All Access에 가입하라. 345 N Reid Place, Suite 620, Sioux Falls, SD 57103 contact@marketbeat.com (844) 978-6257 © MarketBeat Media, LLC 2010-2026. 모든 권리 보유. © 2026 공정가치 가격은 매분 업데이트되며 Massive가 제공합니다. 기타 시장 데이터는 최소 10분 지연되며 Barchart Solutions에서 호스팅합니다. 정보는 '있는 그대로(as-is)' 제공되며, 거래 목적이나 조언이 아닌 정보 제공 목적으로만 사용되며 지연될 수 있습니다. 모든 거래소 지연 및 이용 약관은 Barchart의 면책 조항을 참조하십시오. 당사와 파트너는 귀하의 웹사이트 사용 정보를 공유하여 경험 개선에 도움을 줍니다. 자세한 정보 또는 거부를 원하면 아래의 '내 정보를 판매하지 않기(Do Not Sell My Information)' 버튼을 클릭하십시오.",https://www.marketbeat.com/instant-alerts/exxon-mobil-nysexom-trading-up-35-following-analyst-upgrade-2026-03-27/
2,XOM,2026-03-27 18:16:09,왜 엑슨모빌(XOM) 주가는 오늘 상승 중인가 - The Globe and Mail,"통합 에너지 기업 엑슨모빌(NYSE:XOM) 주가는 중동의 지정학적 긴장이 고조되면서 더 큰 분쟁과 잠재적 공급 차질에 대한 우려가 커진 가운데 에너지 섹터가 랠리를 펼치자 오후 장에서 3% 상승했다. 트럼프 대통령이 세계 원유 거래의 핵심 병목지점인 호르무즈 해협을 이란이 재개방하도록 하라는 시한을 10일 연장했음에도 유가 상승세는 계속됐다. 대통령은 이 중요한 해상 운송로가 계속 봉쇄될 경우 군사 행동을 위협한 바 있다. 트럼프는 협상이 진전되고 있다고 시사했지만, 보도에 따르면 이란 당국은 협상 중이 아니라고 주장하고 있다. 지속되는 불확실성과 세계 원유 공급에 대한 위험이 원유 가격을 끌어올렸고, 이 소식으로 전체 주식시장이 하락한 가운데서도 석유·가스 생산업체들의 전망은 개선됐다. 초반 급등 이후 주가는 170.45달러로 둔화됐으며, 전일 종가 대비 3% 상승했다. 지금이 엑슨모빌을 매수할 때일까? 여기에서 전체 분석 보고서를 무료로 확인하라. 엑슨모빌 주가는 변동성이 크지 않으며, 지난 1년 동안 5% 이상 움직인 경우는 3번에 불과했다. 이런 맥락에서 오늘의 움직임은 시장이 이 뉴스를 의미 있는 것으로 보고 있음을 시사하지만, 기업에 대한 인식을 근본적으로 바꿀 정도는 아닐 수 있다. 엑슨모빌은 연초 대비 39% 상승했으며, 주당 170.45달러로 52주 신고가를 새로 썼다. 5년 전 엑슨모빌 주식에 1,000달러를 투자했다면 현재는 2,970달러 가치의 투자로 불어났을 것이다. 추가로 알아둘 점: 월가가 잊고 있던 21달러 AI 애플리케이션 주식. 월가가 누가 AI를 구축하고 있는지에 집착하는 동안, 한 기업은 이미 AI를 활용해 돈을 찍어내고 있다. 그런데 아무도 주목하지 않고 있다. AI 칩 주식들은 터무니없는 밸류에이션에 거래된다. 이 회사는 AI를 사용해 매달 1조 개의 소비자 신호를 처리하면서도 가격은 그 3분의 1 수준에 거래된다. 이 격차는 오래가지 않을 것이다. 기관투자가들이 곧 알아차릴 것이다. 먼저 확인해야 한다. 눈치채기 전에 무료 보고서를 읽어라. 모든 시장 데이터(새 탭에서 열림)는 Barchart Solutions에서 제공합니다. © 2026. 정보는 있는 그대로 제공되며, 거래 목적이나 조언이 아닌 정보 제공 목적으로만 사용됩니다. 거래소 지연 및 이용 약관은 면책 조항(새 탭에서 열림)을 읽어보십시오.",https://www.theglobeandmail.com/investing/markets/stocks/XOM/pressreleases/1011624/why-exxonmobil-xom-stock-is-trading-up-today/
3,XOM,2026-03-27 18:12:00,월가 라운드업: 시장은 방어주로 이동 - Seeking Alpha,"아래에서 듣거나 Apple Podcasts와 Spotify를 통해 이동 중에도 들을 수 있습니다

이번 주 시장은 거시경제 이슈 중심이었다 (0:20)
방어적 전환; AI 주식은 큰 타격 (0:55)
Circle 하락 (3:30)
고용지표가 주요 촉매가 될 것 (4:55)
연준과 금리 (7:20)

레나 셔빌: 브라이언 스튜어트, 월가 라운드업의 또 다른 시간에 다시 오신 것을 환영합니다. 한 주 쉬고 돌아오셨는데요. 요즘 무엇을 생각하고 계신가요?
브라이언 스튜어트: 지난 한 주는 정말 시장에 거시경제의 주간이었습니다. 개별 기업 관련 데이터가 많이 나오지 않고 있고, 실적 시즌도 끝났습니다. 뉴스 흐름도 많이 들어오지 않고 있죠. 그래서 시장은 큰 이슈들에 움직이고 있는데, 당연히 이번 주 가장 큰 이슈는 이란 분쟁이었습니다. 초반에는 트럼프 행정부가 협상이 진행 중이며 거의 종결 단계에 가깝다고 밝혔고, 그 뒤 이란이 이를 반박하는 등 신호가 엇갈렸습니다. 한 주 내내 서로 다른 주장이 오가는 양상이었습니다. 시장은 이런 방어적 전환의 한가운데 있습니다. 그래서 놀랍지 않게도 이번 주에는 대형 정유주가 매우 강했습니다. 엑슨 모빌(XOM)은 9% 상승했습니다. 셰브론(CVX)은 7% 올랐습니다. 둘 다 연초 대비 약 40% 상승하며 고점을 확대하고 있습니다. 사실 이번 주 뉴스의 중심에 엑슨모빌이 서 있거나 많은 사람들의 관심을 끌면서, 저는 약간 향수를 느꼈습니다. 제가 어렸을 때는 엑슨모빌이 시가총액 기준 세계 최대 기업이었거든요. 그러면서 지난 40년 정도 동안 경제가 얼마나 많이 변했는지 생각하게 됐습니다. 지금은 세계 최대 기업 목록에서 일종의 조연 같은 존재가 되었으니까요. 이런 주식들이 뉴스에 오르는 것은 흥미로운 일입니다. 또 다른 예로 이번 주에는 통신주도 매우 좋았습니다. 하락장인데도 AT&T(T)는 3% 올랐고, T모바일(TMUS)은 약 3%, 버라이즌(VZ)은 약 2% 상승했습니다. 이런 기업들은 방어주로 여겨집니다. 현금흐름 주식이고 배당주이며, 이들 기업의 배당수익률은 2~6%입니다. 반면 다른 쪽에서는 지난 몇 주 동안 AI 주식이 큰 타격을 받고 있습니다. 마이크론(MU)은 15% 하락했고, 메타(META)는 12%, 오라클(ORCL)은 8%, 구글(GOOG)(GOOGL)은 7% 내렸습니다. 즉, 지난 몇 년간 시장을 이끌어 온 AI 주식에서 자금이 빠져나와, 이 자금이 구경제(old economy) 성격의 옵션으로 재투자되는 흐름을 볼 수 있습니다.
레나 셔빌: 저희가 Investing Experts에 빅터 듀르구노프를 모셨습니다. 그 에피소드는 어제 공개됐고, 우리는 수요일에 이야기를 나눴습니다. 그는 슬럼버거(SLB)에 대해 이야기했는데, 이는 두 회차 연속으로 누군가가 매우 강하게 추천한 사례였습니다. 첫 번째는 조지 노블이었습니다. 그리고 방금 말씀하신 대로, 그의 이유 중 하나는 AI와 미래에 대한 집중이었습니다. 과거에는 무명에 가까웠던 이 회사가 이제 미래를 구축하면서 이로부터 혜택도 보고 있습니다. 지금 중동 지정학과 분쟁, 그리고 시장과 에너지, 대형 정유주 전반에서 벌어지고 있는 상황은 '많은 것이 변해도 많은 것은 그대로다'라는 식의 추세를 보여주는 것 같습니다. 흥미롭네요. 이번 주 또 무엇을 생각하고 계신가요? 무엇에 집중하고 있나요?
브라이언 스튜어트: 또 다른 뉴스성이 강했던 섹터는 Circle(CRCL)이었습니다. 20% 하락했습니다. 이는 의회를 통과 중인 법안인 클라리티 법(Clarity Act) 관련 보도 때문이었는데, 이 법안은 암호화폐에 대해 조금 더 규제 구조를 제공하는 내용입니다. 여기에는 스테이블코인이 가질 수 있는 수익률의 규모에 대한 강한 제한이 포함돼 있었습니다. 이 보도 이후 Circle은 급락했습니다. 이는 Coinbase(COIN)도 끌어내렸는데, 지난 5일간 19% 하락했습니다. 단일 거래일 기준으로는 그렇게 극적으로 떨어지지는 않았지만, 한 주 동안 상당히 큰 폭으로 내려갔습니다. 그래서 이는 잠시 뒤로 밀려난 이슈처럼 보입니다. 제 생각에는 이 헤드라인들이 이란에 대한 우려에 가려지고 있기 때문입니다. 사람들은 DHS와 TSA가 항공 여행에 미치는 영향도 걱정하고 있고, 그런 여러 이슈들이 있습니다. 그래서 다른 섹터 관련 뉴스들도 부상하고 있습니다.
레나 셔빌: 실적 면에서는 앞으로 볼 만한 것이 있나요?
브라이언 스튜어트: 다음 주도 다시 실적이 거의 없습니다. 나이키(NKE)가 가장 큰 하이라이트가 될 것 같습니다. 소비자 상황에 대한 정보를 조금 얻을 수 있을 텐데요. 나이키 투자자가 아니더라도 그 주변 코멘트를 살펴볼 가치는 있다고 생각합니다. 한편 경제 뉴스 측면에서는, 당연히 이란 관련 헤드라인이 다음 주에도 지배적인 요인이 될 것 같습니다. 하지만 앞으로 나올 데이터 측면에서 보면, 금요일 고용지표가 주요 촉매가 될 것이라고 봅니다. 지난 고용보고서는 매우 우려스러웠습니다. 비농업 고용은 9만2,000명 감소했고 실업률은 4.4%로 올라갔습니다. 이는 '채용도 적고 해고도 적은' 환경으로 묘사되고 있습니다. 최근 나온 고용 데이터에는 여러 가지 상반된 신호가 있습니다. 예를 들어, 비농업 고용이 9만2,000명 감소했다는 것은 경기침체적 영역에 가깝습니다. 그러나 실업률 4.4%는 특별히 우려스러운 수준은 아닙니다. 다만, 노동참여율이 하락 추세에 있고 약 62% 수준입니다. 이는 전체 경제에서 일자리를 찾고 있거나 일자리 보유를 걱정하는 사람들의 비율입니다. 우리는 대침체와 금융위기 때 이런 모습을 봤습니다. 회복이 시작된 이후에도 많은 사람들이 다시 일터로 돌아오지 않았습니다. 따라서 특정한 구조적 고용 상황은 어떤 사람들을 조기 은퇴로 몰아가거나, 학교로 다시 돌아가게 하거나, 한 가구 한 소득 구조를 선택하게 만드는 식으로 작용할 수 있습니다. 그리고 지금 그런 징후들이 보이고 있습니다. 저는 이것이 우리가 조금 이야기해 온 AI 구조 혁명의 초기 신호일 수도 있다고 생각합니다. 기업이 업무를 수행하는 데 더 적은 인력이 필요해진다면, 일부 사람들은 더 이른 은퇴를 맞을 수 있습니다. 특히 나이 많은 근로자는 AI를 운용하는 데 필요한 혁신적 역량이 젊은 층만큼 같지 않을 수 있습니다. 그들이 쌓아온 경험은 이제 막 학교를 졸업한 사람의 경험보다 더 낡아 보일 수 있겠죠. 그런 일들이 나타날 수 있습니다. 그래서 새 고용보고서가 무엇을 말할지 매우 흥미로울 것입니다. 수정치도 주목해야 합니다. 최근에는 하향 수정되는 패턴이 있었습니다. 이전 보고서에서 9만2,000개의 일자리를 잃은 것으로 나온 것과 관련해, 실제로 그때 보고된 것보다 더 나빴는지, 아니면 반등할지, 더 많은 고용 증가가 나올지, 아니면 추가 악화가 있을지 지켜봐야 합니다. 그것도 흥미로울 것입니다. 그리고 연준 기대치에 미치는 영향도 제가 표시해 둔 또 다른 요소입니다. 뜨거운 인플레이션 데이터가 나오는 가운데 연료 가격 상승이 인플레이션을 더 자극할 것이라는 예상까지 겹치면서, 시장의 기대는 크게 바뀌었습니다. 이제 시장은 더 높은 금리 가능성을 가격에 반영하고 있습니다. 이전에는 낮은 금리가 일종의 표준이었습니다. 다음 회의, 즉 4월에 열릴 회의에서는 금리가 변하지 않을 확률이 96%로, 지난 연준 회의 결과와 거의 일치합니다. 하지만 이제 금리 인상 확률이 4%인데, 이전에는 소폭의 금리 인하 가능성이 반영돼 있었습니다. 우리가 올해 초에 기대했던 것은 연준이 시간이 지남에 따라 금리를 낮출 수 있다는 것이었습니다. 그런데 최근에는 실제로 큰 변화가 있었습니다. 3월 초만 해도 연말 시점에 금리가 지금과 같을 확률이 8%, 금리가 더 높을 확률은 0%, 그리고 금리가 최소 1%포인트 낮아질 확률은 10%였습니다. 즉, 지금부터 연말까지 최소 네 번 이상의 0.25%포인트 인하가 있을 것이라는 뜻이었죠. 그런데 그것이 완전히 뒤집혔습니다. 이제는 연말까지 금리 변동이 없을 확률이 61%, 더 높아질 확률이 39%로 보고 있습니다. 지난 3주 정도 동안 금리 전망이 완전히 반전된 것입니다.
레나 셔빌: 저도 빅터와의 대화를 언급하고 싶습니다. 그는 연준에 대해 몇 분간 이야기했는데 매우 흥미롭다고 생각합니다. 혹시 공감하지 않더라도, 분명 흥미로운 주제입니다. 저도 흥미롭다고 생각하는데, 뭐, 그런 점이 경마를 재미있게 만드는 것이죠. 대화를 마무리하면서, 3월도 마무리되고 있는데 주말로 들어가며 시장에 대한 마지막 메모가 있을까요? 지금 저희가 이야기하는 시점에서는 시장이 하락하고 있고, 국채 수익률은 올라 멀티먼스 고점에 도달하고 있습니다. 이에 대해 언급할 것이 있나요?
브라이언 스튜어트: 연준이 흥미롭고, 재미있지만 매력적이라고까지는 못하겠다고 할 때 제가 하나 덧붙이고 싶은 점은, 파월과 트럼프, 그리고 아직 상원 인준을 받아야 하는 차기 연준 의장까지 이어지는 인물 구도도 있다는 겁니다. 파월은 해임되더라도 연준 이사로 남을 것이며, 이 조사들이 결론에 도달할 때까지 연준에 남겠다고 말했습니다. 또 정책상 차기 연준 의장을 기다리고 있는 동안 임시 의장직도 계속 맡을 의향이 있다고 밝혔습니다. 그래서 이 사안에는 인물 구도가 함께 얽혀 있어 매우 흥미롭습니다. 트럼프는 물론 더 낮은 금리를 강하게 밀어붙여 왔습니다. 따라서 이제 시장은 더 높은 금리를 예상하고 있습니다. 트럼프가 직접 지명한, 혹은 그가 직접 선택한 연준 의장이 들어가면 무엇을 할지 흥미롭습니다. 전체 시장과 앞으로의 전망을 보면, 저는 정말로 헤드라인 주도의 장세가 될 것이라고 생각합니다. 최근의 하락으로 S&P 500(SP500)은 지난 9월 이후 보지 못한 수준까지 내려갔고, 나스닥(QQQ)은 고점 대비 10% 이상 하락하며 공식적으로 조정 국면에 들어갔습니다. 이 오버행은 이란 분쟁이 시장이 긍정적으로 받아들일 수 있는 결론, 특히 유가가 상당히 급락할 수 있는 빠른 결론으로 이어진다면 꽤 빨리 사라질 수 있습니다. 하지만 그것이 장기전이 될 것이라는 점이 분명해지고, 여러 인플레이션 압력과 맞물려 유가가 가까운 미래에 더 높은 수준을 유지할 것으로 보이며, 그런 인플레이션 압력에 맞서 연준이 금리를 인상해야 하는 필요성이 커진다면, 설령 노동시장이 약화되거나 최소한 우려스러운 상황이라 해도, 역풍이 상당히 많아집니다. 그래서 시장은 미래를 보려 최선을 다하겠지만, 미래를 보기 매우 어려운 환경이라고 생각합니다.
레나 셔빌: 감사합니다. 그리고 흥미롭다는 말씀, 아주 정확합니다. 연준에 대한 이야기를 성격 중심적이라고 부른 것도 흥미롭네요. 물론 정확하기도 하고요. 다만 이번 대화는 대부분 제가 빅터에게 워시 대신 자신이 지명된다면 무엇을 할 것인지 물어보면서 시작됐습니다. 요즘은 꽤 주관적인 문제라는 점에서 당신 말씀이 맞다고 생각합니다.
브라이언 스튜어트: 그는 뭐라고 했나요? 인터뷰를 듣지 못했습니다.
레나 셔빌: 그가 먼저 한 핵심 포인트는 금리와 금 가격의 연관성이었고, 금리에 대한 논의가 이렇게 바뀌면서 금과 금광주에 대한 장기 투자 논리가 더 설득력을 갖게 됐다는 점이었습니다.
브라이언 스튜어트: 최근 금 거래는 흥미롭다고 생각합니다. 지정학적 상황에 대한 우려가 급증하는 상황에서는 보통 금이 선호되기 마련인데, 시장 반응이 꼭 그렇지는 않았거든요. 보통은 금을 쌓아두는 이벤트인데, 이번에는 시장에서 그런 반응이 완전히 나타나지 않았습니다. 그래서 그 설명은 정말 흥미롭게 들립니다.",https://seekingalpha.com/article/4886685-wall-street-roundup-market-shifts-to-defense
4,XOM,2026-03-27 18:01:41,유가 급등 속 엑슨모빌의 앞날은? - Zacks Investment Research,"브라우저와 관련된 어떤 사항을 보던 중, 저희는 귀하가 봇일 수 있다고 판단했습니다. 이런 일이 발생하는 데에는 몇 가지 이유가 있습니다: 다시 접근하려면 새로고침하기 전에 쿠키와 JavaScript가 활성화되어 있는지 확인해 주십시오. 모든 준비를 진행 중입니다. 페이지를 불러오는 중이며, 잠시 후 이용하실 수 있습니다.",https://www.zacks.com/stock/news/2891159/what-lies-ahead-for-exxonmobil-amid-surging-crude-prices
